Index,Message,Description,Message Abstract,Description Abstract
209,Create Mysql8 Databases if Mysql8 feature enabled (#1544),Generating databases on up/provision when using mysql 8 is broken. This fixes that :),Create Mysql8 Databases if Mysql8 feature enabled (#1544),Generating databases on up/provision when using mysql 8 is broken. This fixes that :)
210,Update golang version to 1.15.5 (#1543),Signed-off-by: Ricardo Seriani ricardo.seriani@gmail.com,Update golang version to 1.15.5 (#1543),Signed-off-by: Ricardo Seriani ricardo.seriani@gmail.com
211,Only create databases for features enabled. Update DB backup path,Backup path is now set to .backup/ instead of the root directory.,Only create databases for features enabled. Update DB backup path,Backup path is now set to .backup/ instead of the root directory.
212,Update golang version to 1.15.4 (#1542),Signed-off-by: Ricardo Seriani ricardo.seriani@gmail.com,Update golang version to 1.15.4 (#1542),Signed-off-by: Ricardo Seriani ricardo.seriani@gmail.com
213,Tagging 10.15.2,,Tagging 10.15.2,
214,"Handle MariaDB as well as MySQL DBs, resolves #1532",,"Handle MariaDB as well as MySQL DBs, resolves #1532",
215,Tagging 10.15.1,,Tagging 10.15.1,
216,Add MySQL as a default feature (#1527),,Add MySQL as a default feature (#1527),
217,Tagging v10.15.0,,Tagging v10.15.0,
218,Use primary TimescaleDB package,,Use primary TimescaleDB package,
219,Only create databases when enabled,,Only create databases when enabled,
220,"Fix Magento site type ""upstream sent too big header while reading response header from upstream"" error (#1520)",Raise fastcgi_buffer_size as official Magento Nginx sample recent change (https://github.com/magento/magento2/blame/2.4-develop/nginx.conf.sample#L185) to allow PHP process larger request.,"Fix Magento site type ""upstream sent too big header while reading response header from upstream"" error (#1520)",Raise fastcgi_buffer_size as official Magento Nginx sample recent change (link) to allow PHP process larger request.
221,Update golang version to 1.15.3 (#1518),Signed-off-by: Ricardo Seriani ricardo.seriani@gmail.com,Update golang version to 1.15.3 (#1518),Signed-off-by: Ricardo Seriani ricardo.seriani@gmail.com
222,Tag v10.14.0,,Tag v10.14.0,
223,Fix Issue where wildcard SSL certificates were not being named correctly,"Fix Issue where wildcard SSL certificates were not being named correctly. Homestead.yaml: sites:     - map: foo.test       to: /home/vagrant/foo/public_html       wildcard: ""yes"" oot@homestead:/etc/nginx/ssl# openssl x509 -subject -noout -in '*.foo.test.crt' subject=O = Vagrant, C = UN, CN = *.foo.test root@homestead:/etc/nginx/ssl# openssl x509 -subject -noout -in foo.test.crt subject=O = Vagrant, C = UN, CN = foo.test root@homestead:/etc/nginx/ssl#",Fix Issue where wildcard SSL certificates were not being named correctly,"Fix Issue where wildcard SSL certificates were not being named correctly. Homestead.yaml: sites:     - map: foo.test       to: /home/vagrant/foo/public_html       wildcard: ""yes"" oot@homestead:/etc/nginx/ssl# openssl x509 -subject -noout -in '.foo.test.crt' subject=O = Vagrant, C = UN, CN = .foo.test root@homestead:/etc/nginx/ssl# openssl x509 -subject -noout -in foo.test.crt subject=O = Vagrant, C = UN, CN = foo.test root@homestead:/etc/nginx/ssl#"
224,"Fix base box version, tag new release",,"Fix base box version, tag new release",
225,Tagging v10.13.2,,Tagging v10.13.2,
226,Support PHP 8.0 on 18.04,,Support PHP 8.0 on 18.04,
227,[11.x] Update the badges to use shields.io (#1509),,[11.x] Update the badges to use shields.io (#1509),
228,Limit to ~9.0 base box version. Tag new release,,Limit to ~9.0 base box version. Tag new release,
229,Tagging v10.13.0,,Tagging v10.13.0,
230,RVM Feature support (#1490),,RVM Feature support (#1490),
231,change dusk alias (#1492),,change dusk alias (#1492),
232,Update golang version to 1.15.2 (#1487),Signed-off-by: Ricardo Seriani ricardo.seriani@gmail.com,Update golang version to 1.15.2 (#1487),Signed-off-by: Ricardo Seriani ricardo.seriani@gmail.com
233,Update golang version to 1.15.1 (#1480),Signed-off-by: Ricardo Seriani ricardo.seriani@gmail.com,Update golang version to 1.15.1 (#1480),Signed-off-by: Ricardo Seriani ricardo.seriani@gmail.com
234,Update golang version to 1.15 (#1474),Signed-off-by: Ricardo Seriani ricardo.seriani@gmail.com,Update golang version to 1.15 (#1474),Signed-off-by: Ricardo Seriani ricardo.seriani@gmail.com
235,Feature: Add EventStore script (#1472), Feature: Add EventStore script  This script will install and configure EventStore using official documentation https://eventstore.com/docs/getting-started/index.html There is some options you can add on the Homestead.yaml file ```yaml ... features:     - mariadb: false     - ohmyzsh: false     - webdriver: false     - eventstore:         version: 5.0.8-1         run_projections: All         external_ip: 192.168.10.10         external_tcp_port: 1113         external_http_port: 2113         admin_on_ext: true ports: # Needed if you want to expose the service on the external IP      - send: 1113        to: 1113      - send: 2113        to: 2113 ... ``` Then you can access it from http://{VM IP or FQDN}:2113 with the default username and password (admin / changeit)  Removes sudo  We can remove sudo since features are executed as root,Feature: Add EventStore script (#1472),Feature: Add EventStore script This script will install and configure EventStore using official documentation link There is some options you can add on the Homestead.yaml file module Then you can access it from link IP or FQDN}:2113 with the default username and password (admin / changeit) Removes sudo We can remove sudo since features are executed as root
236,Update golang version to 1.14.7 (#1473),Signed-off-by: Ricardo Seriani ricardo.seriani@gmail.com,Update golang version to 1.14.7 (#1473),Signed-off-by: Ricardo Seriani ricardo.seriani@gmail.com
237,Update MongoDB PHP driver to v1.8.0 (#1470), mongodb.sh: bump PHP driver version to 1.8.0,Update MongoDB PHP driver to v1.8.0 (#1470),mongodb.sh: bump PHP driver version to 1.8.0
238,Merge branch 'develop' into master,,Merge branch 'develop' into master,
239,mongodb.sh: bump PHP driver version to 1.8.0,,mongodb.sh: bump PHP driver version to 1.8.0,
240,Merge remote-tracking branch 'upstream/master' into master,,Merge remote-tracking branch 'upstream/master' into master,
241,Fix table in readme,,Fix table in readme,
242,Tagging v10.12.0,,Tagging v10.12.0,
243,Refactor wildcard usage resolves #1458 & add services feature,,Refactor wildcard usage resolves #1458 & add services feature,
244,Update readme,,Update readme,
245,Tag new version,,Tag new version,
246,Update golang version to 1.14.6 (#1454),Signed-off-by: Ricardo Seriani ricardo.seriani@gmail.com,Update golang version to 1.14.6 (#1454),Signed-off-by: Ricardo Seriani ricardo.seriani@gmail.com
247,"remove backticks, on provisioning the bash interprete the line (#1449)",remove upstream to allow multiple pimcore sites Co-authored-by: Richard Hülsberg richard.huelsberg@ort-online.net,"remove backticks, on provisioning the bash interprete the line (#1449)",remove upstream to allow multiple pimcore sites Co-authored-by: Richard Hülsberg richard.huelsberg@ort-online.net
248,Update golang version to 1.14.5 (#1452),Signed-off-by: Ricardo Seriani ricardo.seriani@gmail.com,Update golang version to 1.14.5 (#1452),Signed-off-by: Ricardo Seriani ricardo.seriani@gmail.com
249,Add support for Hyper-V specific configuration,Usage Notes https://www.vagrantup.com/docs/providers/hyperv/configuration hyperv_mac mac (string) - MAC address for the guest network interface hyperv_maxmemory maxmemory (integer) - Maximum number of megabytes allowed to be allocated for the VM. When set Dynamic Memory Allocation will be enabled. hyperv_enable_virtualization_extensions enable_virtualization_extensions (boolean) - Enable virtualization extensions for the virtual CPUs. Default: false,Add support for Hyper-V specific configuration,Usage Notes link hyperv_mac mac (string) - MAC address for the guest network interface hyperv_maxmemory maxmemory (integer) - Maximum number of megabytes allowed to be allocated for the VM. When set Dynamic Memory Allocation will be enabled. hyperv_enable_virtualization_extensions enable_virtualization_extensions (boolean) - Enable virtualization extensions for the virtual CPUs. Default: false
250,"Fix minio script, tag release",,"Fix minio script, tag release",
251,Change version constraint to not show beta builds.,,Change version constraint to not show beta builds.,
252,Fixed localized paths for serve commands (#1440),,Fixed localized paths for serve commands (#1440),
253,Update symfony2.sh (#1441),Permits to upload up to 20M to the server,Update symfony2.sh (#1441),Permits to upload up to 20M to the server
254,"Removed extra ""echo"" that was making it into the config (#1443)",Co-authored-by: Joe Ferguson joe@joeferguson.me,"Removed extra ""echo"" that was making it into the config (#1443)",Co-authored-by: Joe Ferguson joe@joeferguson.me
255,Fix remote MariaDB access,,Fix remote MariaDB access,
256,"Fix bad paste, bump patch version",,"Fix bad paste, bump patch version",
257,Update webdriver w/ chrome stable,,Update webdriver w/ chrome stable,
258,Tagging v10.9.0,,Tagging v10.9.0,
259,Cleanup MariaDB install,,Cleanup MariaDB install,
260,Add docker-compose support. (#1436),Add docker-compose support to docker feature.,Add docker-compose support. (#1436),Add docker-compose support to docker feature.
261,Update golang version to 1.14.4 (#1432),Signed-off-by: Ricardo Seriani ricardo.seriani@gmail.com,Update golang version to 1.14.4 (#1432),Signed-off-by: Ricardo Seriani ricardo.seriani@gmail.com
262,Tagging v10.8.1,,Tagging v10.8.1,
263,mongodb.sh: fix dpkg error (#1427),Co-authored-by: Dusan Maric maricd@firstbeatmedia.com,mongodb.sh: fix dpkg error (#1427),Co-authored-by: Dusan Maric maricd@firstbeatmedia.com
264,mongodb.sh: fix dpkg error,,mongodb.sh: fix dpkg error,
265,Features: mongodb.sh: fix dpkg error,,Features: mongodb.sh: fix dpkg error,
266,Update golang version to 1.14.3 (#1418),Signed-off-by: Ricardo Seriani ricardo.seriani@gmail.com,Update golang version to 1.14.3 (#1418),Signed-off-by: Ricardo Seriani ricardo.seriani@gmail.com
267,Tagging v10.8.0,,Tagging v10.8.0,
268,Requires base box v9.5.0 (Due to PostgreSQL changes),,Requires base box v9.5.0 (Due to PostgreSQL changes),
269,Add timestampDB to each Postgresql Version,,Add timestampDB to each Postgresql Version,
270,Remove Feature PostGIS as it's included in Laravel Settler,,Remove Feature PostGIS as it's included in Laravel Settler,
271,Add wildcard & use_wildcard SSL Site options (#1410)," Add wildcard & use_wildcard SSL Site options  Usage: Create an use wildcard for a site: - map: foo.domain.test       to: /home/vagrant/domain       wildcard: ""yes""       use_wildcard: ""yes"" Create but do not use wildcard for a site: - map: foo.domain.test       to: /home/vagrant/domain       wildcard: ""yes""       use_wildcard: ""no""  Support for Apache + SSL wildcard And Disable nginx when Apache installed",Add wildcard & use_wildcard SSL Site options (#1410),"Add wildcard & use_wildcard SSL Site options Usage: Create an use wildcard for a site: - map: foo.domain.test       to: /home/vagrant/domain       wildcard: ""yes""       use_wildcard: ""yes"" Create but do not use wildcard for a site: - map: foo.domain.test       to: /home/vagrant/domain       wildcard: ""yes""       use_wildcard: ""no"" Support for Apache + SSL wildcard And Disable nginx when Apache installed"
272,Allow multiple pimcore sites (#1398),Allows using of multiple pimcore-type sites in the same homestead box,Allow multiple pimcore sites (#1398),Allows using of multiple pimcore-type sites in the same homestead box
273,Update golang version to 1.14.2 (#1397),Signed-off-by: Ricardo Seriani ricardo.seriani@gmail.com,Update golang version to 1.14.2 (#1397),Signed-off-by: Ricardo Seriani ricardo.seriani@gmail.com
274,Add timestamp directory to mysql backups. (#1393),,Add timestamp directory to mysql backups. (#1393),
275,Tag v10.7.0,,Tag v10.7.0,
276,mongodb.sh: update PHP driver to v1.7.4 (#1391),Co-authored-by: Dusan Maric maricd@firstbeatmedia.com,mongodb.sh: update PHP driver to v1.7.4 (#1391),Co-authored-by: Dusan Maric maricd@firstbeatmedia.com
277,mongodb.sh: update PHP driver to v1.7.4,,mongodb.sh: update PHP driver to v1.7.4,
278,"Tweak MongoDB install, Tag 10.6.1",,"Tweak MongoDB install, Tag 10.6.1",
279,tag v10.6.0,,tag v10.6.0,
280,Update golang version to 1.14.1 (#1385),Signed-off-by: Ricardo Seriani ricardo.seriani@gmail.com,Update golang version to 1.14.1 (#1385),Signed-off-by: Ricardo Seriani ricardo.seriani@gmail.com
281,"Tag 10.5.1, Fix MySQL 8 apparmor issues",,"Tag 10.5.1, Fix MySQL 8 apparmor issues",
282,Empty the mysql directory on 8 install,,Empty the mysql directory on 8 install,
283,Tag v10.5.0,,Tag v10.5.0,
284,Don't remove mysql lib folder #1383 #1188,,Don't remove mysql lib folder #1383 #1188,
285,[yii] Allow use index-test.php (#1379),  Open index-test.php for yii   Set fastcgi_index ,[yii] Allow use index-test.php (#1379),Open index-test.php for yii Set fastcgi_index
286,Tagging v10.4.0,,Tagging v10.4.0,
287,Merge branch 'master' of github.com:laravel/homestead,,Merge branch 'master' of github.com:laravel/homestead,
288,Update clear variables to be consistent. h/t ProjectCleverWeb,,Update clear variables to be consistent. h/t ProjectCleverWeb,
289,fix xhgui for Symfony4 (#1375),,fix xhgui for Symfony4 (#1375),
290,Update golang version to 1.14 (#1374),Signed-off-by: Ricardo Seriani ricardo.seriani@gmail.com,Update golang version to 1.14 (#1374),Signed-off-by: Ricardo Seriani ricardo.seriani@gmail.com
291,Remove cruft from MySQL 8 install,,Remove cruft from MySQL 8 install,
292,added-masonite-python (#7) (#1367),added masonite python (Laravel inspired web framework for Python 3.5+),added-masonite-python (#7) (#1367),added masonite python (Laravel inspired web framework for Python 3.5+)
293,Merge branch 'master' of github.com:laravel/homestead,,Merge branch 'master' of github.com:laravel/homestead,
294,Tagging 10.3.1,,Tagging 10.3.1,
295,Update golang version to 1.13.8 (#1366),Signed-off-by: Ricardo Seriani ricardo.seriani@gmail.com,Update golang version to 1.13.8 (#1366),Signed-off-by: Ricardo Seriani ricardo.seriani@gmail.com
296,Tagging v10.3.0,,Tagging v10.3.0,
297,Fix broken Elasticsearch feature script (#1365),,Fix broken Elasticsearch feature script (#1365),
298,Update golang version to 1.13.7 (#1359),Signed-off-by: Ricardo Seriani ricardo.seriani@gmail.com,Update golang version to 1.13.7 (#1359),Signed-off-by: Ricardo Seriani ricardo.seriani@gmail.com
299,Tagging v10.2.0,,Tagging v10.2.0,
300,update mongodb to v4.2 (#1354),  update mongodb to v4.2   Update mongodb.sh   add changes per Joe's comment,update mongodb to v4.2 (#1354),update mongodb to v4.2 Update mongodb.sh add changes per Joe's comment
301,Update mongodb.sh (#1356),,Update mongodb.sh (#1356),
302,Update golang version to 1.13.6 (#1350),Signed-off-by: Ricardo Seriani ricardo.seriani@gmail.com,Update golang version to 1.13.6 (#1350),Signed-off-by: Ricardo Seriani ricardo.seriani@gmail.com
303,update MySQL 8 deb (#1351),https://dev.mysql.com/downloads/repo/apt/,update MySQL 8 deb (#1351),link/
304,wording (#1349),"minor fix to some capitalization. also the ""Try again!"" seems unnecessary.",wording (#1349),"minor fix to some capitalization. also the ""Try again!"" seems unnecessary."
305,Tagging v10.1.0,,Tagging v10.1.0,
306,Add mac option (#1346),"Allows setting the MAC Address of an interface (e.g. bridge). This enables setting a fixed MAC. which in turn can be used by a DHCP (in the LAN) to provide an ip. For example: networks:     - type: ""public_network""       bridge: ""Intel(R) Ethernet Connection (2) I218-V""       mac: ""080027905b10""",Add mac option (#1346),"Allows setting the MAC Address of an interface (e.g. bridge). This enables setting a fixed MAC. which in turn can be used by a DHCP (in the LAN) to provide an ip. For example: networks:     - type: ""public_network""       bridge: ""Intel(R) Ethernet Connection (2) I218-V""       mac: ""080027905b10"""
307,Add generated ca to local cert storage (#1345),Homestead should trust the generated ca by default,Add generated ca to local cert storage (#1345),Homestead should trust the generated ca by default
308,Crystal installation process updated (#1343),Updated the shell commands as per Crystal documentation https://crystal-lang.org/install/on_ubuntu/,Crystal installation process updated (#1343),Updated the shell commands as per Crystal documentation link/
309,Git repo url updated (#1342),Github URL has been changed for oh-my-zsh.,Git repo url updated (#1342),Github URL has been changed for oh-my-zsh.
310,use --filter when calling Dusk (#1340),  Update aliases   Update aliases ,use --filter when calling Dusk (#1340),Update aliases Update aliases
311,Tag v10.0.2,,Tag v10.0.2,
312,Update golang version to 1.13.5 (#1335),Signed-off-by: Ricardo Seriani ricardo.seriani@gmail.com,Update golang version to 1.13.5 (#1335),Signed-off-by: Ricardo Seriani ricardo.seriani@gmail.com
313,"Fix PostGIS packages, bump version",,"Fix PostGIS packages, bump version",
314,update Taylor's email (#1326),,update Taylor's email (#1326),
315,Homestead v10 (#1321),"  Initial v10 work, default to PHP 7.4   Version bump ",Homestead v10 (#1321),"Initial v10 work, default to PHP 7.4 Version bump"
316,add postgis feature (#1322),,add postgis feature (#1322),
317,"Revert #1316, Tag v9.4.1",,"Revert #1316, Tag v9.4.1",
318,Tagging v9.4.0,,Tagging v9.4.0,
319,force all non file matches through the Front Controller (#1316),,force all non file matches through the Front Controller (#1316),
320,Add support for Symfony 5 (#1317),,Add support for Symfony 5 (#1317),
321,Don't remove hosts on halt for vagrant-hostsupdater (#1313),,Don't remove hosts on halt for vagrant-hostsupdater (#1313),
322,Bump version number for release,,Bump version number for release,
323,Add more permissive fastcgi_x_timeout options for Symfony 2 DEV (#1311),"Add more permissive fastcgi_x_timeout options for DEV environment  ""time to establish connection to upstream"", ""time after FPM replies accepted until the whole response is transmitted""",Add more permissive fastcgi_x_timeout options for Symfony 2 DEV (#1311),"Add more permissive fastcgi_x_timeout options for DEV environment  ""time to establish connection to upstream"", ""time after FPM replies accepted until the whole response is transmitted"""
324,Apply fixes from StyleCI (#1309),,Apply fixes from StyleCI (#1309),
325,Update golang version to 1.13.4 (#1308),Signed-off-by: Ricardo Seriani ricardo.seriani@gmail.com,Update golang version to 1.13.4 (#1308),Signed-off-by: Ricardo Seriani ricardo.seriani@gmail.com
326,Create phalcon.sh (#1307),add new site-type for Phalcon framework,Create phalcon.sh (#1307),add new site-type for Phalcon framework
327,Remove site-specific client_max_body_size (#1299),"Homestead would provide greater flexibility if this value were simply removed. Currently, there is no straightforward means by which to override this hard-coded, site-specific value, which causes large file uploads to fail with HTTP status code 413 in NGINX. If this directive is simply removed, the end-user is able to add a preferred value to e.g. /home/vagrant/.config/nginx/nginx.conf, drop an override file in /etc/nginx/conf.d, etc. There seems to be no obvious downside to removing this value.",Remove site-specific client_max_body_size (#1299),"Homestead would provide greater flexibility if this value were simply removed. Currently, there is no straightforward means by which to override this hard-coded, site-specific value, which causes large file uploads to fail with HTTP status code 413 in NGINX. If this directive is simply removed, the end-user is able to add a preferred value to e.g. /home/vagrant/.config/nginx/nginx.conf, drop an override file in /etc/nginx/conf.d, etc. There seems to be no obvious downside to removing this value."
328,Update golang version to 1.13.3 (#1303),Signed-off-by: Ricardo Seriani ricardo.seriani@gmail.com,Update golang version to 1.13.3 (#1303),Signed-off-by: Ricardo Seriani ricardo.seriani@gmail.com
329,Update golang version to 1.13.2 (#1301),Signed-off-by: Ricardo Seriani ricardo.seriani@gmail.com,Update golang version to 1.13.2 (#1301),Signed-off-by: Ricardo Seriani ricardo.seriani@gmail.com
330,Document how to develop homestead itself (#1295),,Document how to develop homestead itself (#1295),
331,Version bump,,Version bump,
332,Added new site type: UMI CMS (#1291),  Added new site type: UMI CMS   Removed duplicated deny location ,Added new site type: UMI CMS (#1291),Added new site type: UMI CMS Removed duplicated deny location
333,"Revert ""Remove old issue template""",This reverts commit 9fc4a5c6248c9b8dfe12dc7440246b24e8035d54.,"Revert ""Remove old issue template""",This reverts commit 9fc4a5c6248c9b8dfe12dc7440246b24e8035d54.
334,Remove old issue template,,Remove old issue template,
335,Version bump,,Version bump,
336,fix timescaledb version mismatch (#1289),,fix timescaledb version mismatch (#1289),
337,"Version bump v9.2.0, require box v8.2.0 (PHP 7.4)",,"Version bump v9.2.0, require box v8.2.0 (PHP 7.4)",
338,Add support for PHP 7.4,,Add support for PHP 7.4,
339,Update golang version to 1.13.1 (#1282),Signed-off-by: Ricardo Seriani ricardo.seriani@gmail.com,Update golang version to 1.13.1 (#1282),Signed-off-by: Ricardo Seriani ricardo.seriani@gmail.com
340,Update golang version to 1.13 (#1268),Signed-off-by: Ricardo Seriani ricardo.seriani@gmail.com,Update golang version to 1.13 (#1268),Signed-off-by: Ricardo Seriani ricardo.seriani@gmail.com
341,Tagging v9.1.0 & Require base box >= 8.1.0,,Tagging v9.1.0 & Require base box >= 8.1.0,
342,Minio conditional statement and bucket location change (#1262),Signed-off-by: Ray Blair rblair@codeplayground.io,Minio conditional statement and bucket location change (#1262),Signed-off-by: Ray Blair rblair@codeplayground.io
343,Fix for setting Minio Bucket Policy (#1261),,Fix for setting Minio Bucket Policy (#1261),
344,Update golang version to 1.12.9 (#1258),Signed-off-by: Ricardo Seriani ricardo.seriani@gmail.com,Update golang version to 1.12.9 (#1258),Signed-off-by: Ricardo Seriani ricardo.seriani@gmail.com
345,Update golang version to 1.12.8 (#1257),Signed-off-by: Ricardo Seriani ricardo.seriani@gmail.com,Update golang version to 1.12.8 (#1257),Signed-off-by: Ricardo Seriani ricardo.seriani@gmail.com
346,Remove branch alias for dev-master (#1254),,Remove branch alias for dev-master (#1254),
347,White space (#1255),,White space (#1255),
348,Merge remote-tracking branch 'origin/master',,Merge remote-tracking branch 'origin/master',
349,What's Hodor Durin?,,What's Hodor Durin?,
350,Updated serve-script paths (#1252),,Updated serve-script paths (#1252),
351,Disable Avahi service configuration,"We're seeing users with a long list of domains will get errors from the avahi-daemon service. Will continue debugging to get this feature reenabled, but currently disabling so not to break users' configurations. Tagging new version",Disable Avahi service configuration,"We're seeing users with a long list of domains will get errors from the avahi-daemon service. Will continue debugging to get this feature reenabled, but currently disabling so not to break users' configurations. Tagging new version"
352,Tag v9.0.6,,Tag v9.0.6,
353,Refactor Avahi configuration to script,This keeps the primary ruby script a bit cleaner and gives us better control down the line if we want to do more Avahi configuration.,Refactor Avahi configuration to script,This keeps the primary ruby script a bit cleaner and gives us better control down the line if we want to do more Avahi configuration.
354,Use mDNS to resolve all host names (#1245),  Use mDNS to resolve more host names   Use better variable name ,Use mDNS to resolve all host names (#1245),Use mDNS to resolve more host names Use better variable name
355,Tag v9.0.4 & CS tweak,Code Style tweak to make it easier to human lint what we're sending to site scripts,Tag v9.0.4 & CS tweak,Code Style tweak to make it easier to human lint what we're sending to site scripts
356,Correct variable index in response to zray removal (#1247),  Shift array values in reaction to new xhgui option being added   shift variable index in response to zray removal ,Correct variable index in response to zray removal (#1247),Shift array values in reaction to new xhgui option being added shift variable index in response to zray removal
357,Tagging v9.0.4,,Tagging v9.0.4,
358,Update JSON configuration example for features,,Update JSON configuration example for features,
359,Run apt-get update before installing python feature,,Run apt-get update before installing python feature,
360,Fix features declaration in Homestead.json stub (#1244),,Fix features declaration in Homestead.json stub (#1244),
361,Add support for TimescaleDB (#1241),,Add support for TimescaleDB (#1241),
362,MySQL Password as ENV to not throw CLI warnings (#1236),  If installed MySQL does not need something to do   Does not need sudo because script run with privileged permission when provisioning   Change configuration method for bind-address and default_authentication_plugin   Move password parameter to environment variable   Unset environment variables   Add some style corrections to the comments ,MySQL Password as ENV to not throw CLI warnings (#1236),If installed MySQL does not need something to do Does not need sudo because script run with privileged permission when provisioning Change configuration method for bind-address and default_authentication_plugin Move password parameter to environment variable Unset environment variables Add some style corrections to the comments
363,Tag v9.0.3,,Tag v9.0.3,
