Index,Message,Description,Message Abstract,Description Abstract
1,Tagging 14.4.1,,Tagging 14.4.1,
2,Restart services,,Restart services,
3,tagging v14.4.0,,tagging v14.4.0,
4,Add check to enable PHP service when needed,Resolves https://github.com/laravel/homestead/issues/1868,Add check to enable PHP service when needed,Resolves link
5,Remove extra features file touch,,Remove extra features file touch,
6,feat: add logstash feature (#1877),,feat: add logstash feature (#1877),
7,Install rabbitmqadmin CLI tool when enabling rabbitmq feature (#1876),  feat: install rabbitmqadmin cli tool   fix: provide homestead with all topic permissions as well   fix: use quiet output ,Install rabbitmqadmin CLI tool when enabling rabbitmq feature (#1876),feat: install rabbitmqadmin cli tool fix: provide homestead with all topic permissions as well fix: use quiet output
8,fix: use correct environment variables (#1875),fix: use correct command for setting anonymous policy fix: don't attempt to recreate bucket if it exists already,fix: use correct environment variables (#1875),fix: use correct command for setting anonymous policy fix: don't attempt to recreate bucket if it exists already
9,update golang to 1.20.4 (#1872),,update golang to 1.20.4 (#1872),
10,Update readme.md (#1867),From this illuminating answer: https://github.com/laravel/homestead/issues/1394#issuecomment-609072140,Update readme.md (#1867),From this illuminating answer: link
11,Tagging v14.3.1,,Tagging v14.3.1,
12,Faster first startup of feature mariadb and fixing upgrading packages (#1866),,Faster first startup of feature mariadb and fixing upgrading packages (#1866),
13,Add feature for installing Mailpit and disabling Mailhog (#1864), feat: finish mailpit feature,Add feature for installing Mailpit and disabling Mailhog (#1864),feat: finish mailpit feature
14,Tagging v14.3.0,,Tagging v14.3.0,
15,Provide full credentials for mariadb install,,Provide full credentials for mariadb install,
16,Force mysql purge to use new configurations,,Force mysql purge to use new configurations,
17,feat: always enable symlink creation on windows (#1856),"adds in the ""VBoxInternal2/SharedFoldersEnableSymlinksCreate/v-root"" value when running vagrant on windows to ensure symlinks will always work.",feat: always enable symlink creation on windows (#1856),"adds in the ""VBoxInternal2/SharedFoldersEnableSymlinksCreate/v-root"" value when running vagrant on windows to ensure symlinks will always work."
18,"Use virtiofs for default when, no folders are defined. (#1859)",Allow changing the type of user mounts.,"Use virtiofs for default when, no folders are defined. (#1859)",Allow changing the type of user mounts.
19,Libvirt: fix vm naming (#1851),,Libvirt: fix vm naming (#1851),
20,Update golang version to 1.20 (#1853),Signed-off-by: Ricardo Seriani ricardo.seriani@gmail.com,Update golang version to 1.20 (#1853),Signed-off-by: Ricardo Seriani ricardo.seriani@gmail.com
21,Bump version,,Bump version,
22,Updates to bring WSL to Settler v13 (#1850),  Updates to bring WSL to Settler v13   Fix comment   Don't try to configure postfix ,Updates to bring WSL to Settler v13 (#1850),Updates to bring WSL to Settler v13 Fix comment Don't try to configure postfix
23,tagging 14.2.0,,tagging 14.2.0,
24,Readd libvirt provider (#1845),,Readd libvirt provider (#1845),
25,update for Ngrok v3 (#1846), adjust call to start ngrok update path to Ngrok config,update for Ngrok v3 (#1846),adjust call to start ngrok update path to Ngrok config
26,ensure single empty newline at EOF (#1848),,ensure single empty newline at EOF (#1848),
27,drop Yarn (#1847),,drop Yarn (#1847),
28,Bump MongoDB PHP driver to v1.15.0 / Install PHP8.2 MongoDB extension (#1844),  mongodb.sh: bump PHP driver to 1.14.1 version   Bump MongoDB PHP driver to v1.15.0   Install PHP8.2 MongoDB extension   mongodb.sh: fix copy'n'paste issue   Co-authored-by: Dusan Maric maricd@firstbeatmedia.com,Bump MongoDB PHP driver to v1.15.0 / Install PHP8.2 MongoDB extension (#1844),mongodb.sh: bump PHP driver to 1.14.1 version Bump MongoDB PHP driver to v1.15.0 Install PHP8.2 MongoDB extension mongodb.sh: fix copy'n'paste issue Co-authored-by: Dusan Maric maricd@firstbeatmedia.com
29,sync up the example file (#1843),,sync up the example file (#1843),
30,Tagging v14.1.1,,Tagging v14.1.1,
31,Remove libvirt provider configuration to fix error on other provider,,Remove libvirt provider configuration to fix error on other provider,
32,Update example to match expected services enabled,,Update example to match expected services enabled,
33,Tagging v14.1.0,,Tagging v14.1.0,
34,Clear PHP 8.1 and PHP 8.2 variables (#1837),,Clear PHP 8.1 and PHP 8.2 variables (#1837),
35,Add basic libvirt support (#1831),,Add basic libvirt support (#1831),
36,Update golang version to 1.19.5 (#1836),Signed-off-by: Ricardo Seriani ricardo.seriani@gmail.com Signed-off-by: Ricardo Seriani ricardo.seriani@gmail.com,Update golang version to 1.19.5 (#1836),Signed-off-by: Ricardo Seriani ricardo.seriani@gmail.com Signed-off-by: Ricardo Seriani ricardo.seriani@gmail.com
37,Revert host only test changes,,Revert host only test changes,
38,Update meilisearch for aarch64 support (#1834)," Update meilisearch for aarch64 support  This updates meilisearch to work with aarch64, related to this thread: https://github.com/meilisearch/meilisearch/discussions/2048, the if statement may not be needed as the sh command would do the check and install, however I left it in as I can only test it using the arm aarch64 variation.  Update meilisearch.sh  removed if statement.",Update meilisearch for aarch64 support (#1834),"Update meilisearch for aarch64 support This updates meilisearch to work with aarch64, related to this thread: link, the if statement may not be needed as the sh command would do the check and install, however I left it in as I can only test it using the arm aarch64 variation. Update meilisearch.sh removed if statement."
39,Updating versions in readme,,Updating versions in readme,
40,tagging 14.0.0,,tagging 14.0.0,
41,14.0.0 (#1828)," Require box 13, but not 14 Default to PHP 8.2",14.0.0 (#1828),"Require box 13, but not 14 Default to PHP 8.2"
42,Update Trader installation script (#1825),  include php8.1 for the extension installation   Update trader extension path and include 8.1 ,Update Trader installation script (#1825),include php8.1 for the extension installation Update trader extension path and include 8.1
43,Update golang version to 1.19.4 (#1822),Signed-off-by: Ricardo Seriani ricardo.seriani@gmail.com Signed-off-by: Ricardo Seriani ricardo.seriani@gmail.com,Update golang version to 1.19.4 (#1822),Signed-off-by: Ricardo Seriani ricardo.seriani@gmail.com Signed-off-by: Ricardo Seriani ricardo.seriani@gmail.com
44,Fix MariaDB set-up script - issue #1816 - vagrant up crashes on create database (#1817),Co-authored-by: Miroslav Koula miroslav.koula@seyvillas.com,Fix MariaDB set-up script - issue #1816 - vagrant up crashes on create database (#1817),Co-authored-by: Miroslav Koula miroslav.koula@seyvillas.com
45,Upgraded MongoDB version from v4.4 to v6.X and NodeJS version from 14.x to 18.x (#1818),,Upgraded MongoDB version from v4.4 to v6.X and NodeJS version from 14.x to 18.x (#1818),
46,Updating HostOnly adapter for VirtualBox 7,Thanks to https://github.com/hashicorp/vagrant/issues/12959#issuecomment-1307010617,Updating HostOnly adapter for VirtualBox 7,Thanks to link
47,fix mysql create script (#1813),  fix mysql create script   Tag v13.3.2 ,fix mysql create script (#1813),fix mysql create script Tag v13.3.2
48,Update golang version to 1.19.3 (#1811),Signed-off-by: Ricardo Seriani ricardo.seriani@gmail.com Signed-off-by: Ricardo Seriani ricardo.seriani@gmail.com,Update golang version to 1.19.3 (#1811),Signed-off-by: Ricardo Seriani ricardo.seriani@gmail.com Signed-off-by: Ricardo Seriani ricardo.seriani@gmail.com
49,Tagging v13.3.1,,Tagging v13.3.1,
50,Add aliases for 8.2,,Add aliases for 8.2,
51,Dockstead (#1809), Split mysql57 into its own script,Dockstead (#1809),Split mysql57 into its own script
52,add Laravel Pint alias (#1808),Pint now comes pre-installed with every new Laravel installation. Adding an alias so we can reference it more easily.,add Laravel Pint alias (#1808),Pint now comes pre-installed with every new Laravel installation. Adding an alias so we can reference it more easily.
53,Adding 8.2 to CICD (#1806),  Adding 8.2 to CICD   Composer update ,Adding 8.2 to CICD (#1806),Adding 8.2 to CICD Composer update
54,Update golang version to 1.19.2 (#1805),Signed-off-by: Ricardo Seriani ricardo.seriani@gmail.com Signed-off-by: Ricardo Seriani ricardo.seriani@gmail.com,Update golang version to 1.19.2 (#1805),Signed-off-by: Ricardo Seriani ricardo.seriani@gmail.com Signed-off-by: Ricardo Seriani ricardo.seriani@gmail.com
55,Feature oh my zsh : set theme and plugins from config (#1798),"With this we can set (and keep after a vagrant destroy command) at least the theme and plugins for our oh my zsh config. If any of theme or plugins is not set, we keep the default config.",Feature oh my zsh : set theme and plugins from config (#1798),"With this we can set (and keep after a vagrant destroy command) at least the theme and plugins for our oh my zsh config. If any of theme or plugins is not set, we keep the default config."
56,mongodb.sh: bump PHP driver to 1.14.1 version (#1800),Co-authored-by: Dusan Maric maricd@firstbeatmedia.com,mongodb.sh: bump PHP driver to 1.14.1 version (#1800),Co-authored-by: Dusan Maric maricd@firstbeatmedia.com
57,Update golang version to 1.19.1 (#1796),Signed-off-by: Ricardo Seriani ricardo.seriani@gmail.com Signed-off-by: Ricardo Seriani ricardo.seriani@gmail.com,Update golang version to 1.19.1 (#1796),Signed-off-by: Ricardo Seriani ricardo.seriani@gmail.com Signed-off-by: Ricardo Seriani ricardo.seriani@gmail.com
58,Update tests.yml (#1795),Signed-off-by: sashashura 93376818+sashashura@users.noreply.github.com Signed-off-by: sashashura 93376818+sashashura@users.noreply.github.com,Update tests.yml (#1795),Signed-off-by: sashashura 93376818+sashashura@users.noreply.github.com Signed-off-by: sashashura 93376818+sashashura@users.noreply.github.com
59,Update golang version to 1.19 (#1791),Signed-off-by: Ricardo Seriani ricardo.seriani@gmail.com,Update golang version to 1.19 (#1791),Signed-off-by: Ricardo Seriani ricardo.seriani@gmail.com
60,Update golang version to 1.18.5 (#1790),Signed-off-by: Ricardo Seriani ricardo.seriani@gmail.com,Update golang version to 1.18.5 (#1790),Signed-off-by: Ricardo Seriani ricardo.seriani@gmail.com
61,Update golang version to 1.18.4 (#1787),Signed-off-by: Ricardo Seriani ricardo.seriani@gmail.com,Update golang version to 1.18.4 (#1787),Signed-off-by: Ricardo Seriani ricardo.seriani@gmail.com
62,Update golang version to 1.18.3 (#1785),Signed-off-by: Ricardo Seriani ricardo.seriani@gmail.com,Update golang version to 1.18.3 (#1785),Signed-off-by: Ricardo Seriani ricardo.seriani@gmail.com
63,Update golang version to 1.18.2 (#1783),,Update golang version to 1.18.2 (#1783),
64,feat: add new site type for fastadmin framework (#1779),,feat: add new site type for fastadmin framework (#1779),
65,Fix overriding multiple provisioners in loops (#1772),,Fix overriding multiple provisioners in loops (#1772),
66,Update golang version to 1.18 (#1776),Signed-off-by: Ricardo Seriani ricardo.seriani@gmail.com,Update golang version to 1.18 (#1776),Signed-off-by: Ricardo Seriani ricardo.seriani@gmail.com
67,Update golang version to 1.17.8 (#1771),Signed-off-by: Ricardo Seriani ricardo.seriani@gmail.com,Update golang version to 1.17.8 (#1771),Signed-off-by: Ricardo Seriani ricardo.seriani@gmail.com
68,Update golang version to 1.17.7 (#1762),Signed-off-by: Ricardo Seriani ricardo.seriani@gmail.com,Update golang version to 1.17.7 (#1762),Signed-off-by: Ricardo Seriani ricardo.seriani@gmail.com
69,Testing symfony ^5/^6 for Laravel 8,,Testing symfony ^5/^6 for Laravel 8,
70,Testing symfony ^5/^6 for Laravel 8,,Testing symfony ^5/^6 for Laravel 8,
71,"Update requirements to PHP 8.0, 8.1, Symfony ^6 (#1758)","  Update requirements to PHP 8.0, 8.1, Symfony ^6   Test on PHP 8.0, 8.1, dropping 7.4   Tagging v13.2.0 ","Update requirements to PHP 8.0, 8.1, Symfony ^6 (#1758)","Update requirements to PHP 8.0, 8.1, Symfony ^6 Test on PHP 8.0, 8.1, dropping 7.4 Tagging v13.2.0"
72,Tagging v13.1.1,,Tagging v13.1.1,
73,Revert #1754 (#1755),,Revert #1754 (#1755),
74,Tagging 13.1.0,,Tagging 13.1.0,
75,Change minio install to /opt/bin (#1754),,Change minio install to /opt/bin (#1754),
76,Update golang version to 1.17.6 (#1751),Signed-off-by: Ricardo Seriani ricardo.seriani@gmail.com,Update golang version to 1.17.6 (#1751),Signed-off-by: Ricardo Seriani ricardo.seriani@gmail.com
77,Make mongodb install aware of CPU Arch being used (#1749),  Make mongodb install aware of CPU Arch being used   Tagging v13.0.2 ,Make mongodb install aware of CPU Arch being used (#1749),Make mongodb install aware of CPU Arch being used Tagging v13.0.2
78,add mongodb backup (#1746),,add mongodb backup (#1746),
79,Wordpress - Enable debug mode automatically (#1747),"Due to homestead being a development platform, enabling WP_DEBUG automatically makes sense.",Wordpress - Enable debug mode automatically (#1747),"Due to homestead being a development platform, enabling WP_DEBUG automatically makes sense."
80,Tagging 13.0.1,,Tagging 13.0.1,
81,add mongodb.so to php8.1 php.ini (#1745),,add mongodb.so to php8.1 php.ini (#1745),
82,Bump MongoDB PHP driver to v1.12.0 (#1743),  mongodb.sh: bump PHP driver to 1.11.0   mongodb.sh: bump PHP driver to v1.12.0   Co-authored-by: Dusan Maric maricd@firstbeatmedia.com,Bump MongoDB PHP driver to v1.12.0 (#1743),mongodb.sh: bump PHP driver to 1.11.0 mongodb.sh: bump PHP driver to v1.12.0 Co-authored-by: Dusan Maric maricd@firstbeatmedia.com
83,Update golang version to 1.17.5 (#1742),Signed-off-by: Ricardo Seriani ricardo.seriani@gmail.com,Update golang version to 1.17.5 (#1742),Signed-off-by: Ricardo Seriani ricardo.seriani@gmail.com
84,"13.0.0 - PHP 8.1 Default Requires Base Box  >= 12.0.0, < 13.0.0 (#1739)", Default to PHP 8.1 Tagging v13.0.0 and update constraints Update minio feature to be aware of CPU arch (#1734) Update cpu arch conditional check for minio Add test aliases for both Pest and PHPunit dynamically (#1738) Update localized aliases,"13.0.0 - PHP 8.1 Default Requires Base Box  >= 12.0.0, < 13.0.0 (#1739)",Default to PHP 8.1 Tagging v13.0.0 and update constraints Update minio feature to be aware of CPU arch (#1734) Update cpu arch conditional check for minio Add test aliases for both Pest and PHPunit dynamically (#1738) Update localized aliases
85,Add test aliases for both Pest and PHPunit dynamically (#1738),This is from @freekmurze blog https://freek.dev/2142-a-bash-function-to-run-tests-for-both-phpunit-and-pest,Add test aliases for both Pest and PHPunit dynamically (#1738),This is from @freekmurze blog link
86,Update golang version to 1.17.4 (#1736),Signed-off-by: Ricardo Seriani ricardo.seriani@gmail.com,Update golang version to 1.17.4 (#1736),Signed-off-by: Ricardo Seriani ricardo.seriani@gmail.com
87,Tagging v12.8.0,,Tagging v12.8.0,
88,Use 192.168.56.56 as the default IP for Homestead,,Use 192.168.56.56 as the default IP for Homestead,
89,Update golang version to 1.17.3 (#1727),Signed-off-by: Ricardo Seriani ricardo.seriani@gmail.com,Update golang version to 1.17.3 (#1727),Signed-off-by: Ricardo Seriani ricardo.seriani@gmail.com
90,Update MongoDB to v1.11.1,,Update MongoDB to v1.11.1,
91,mongodb.sh: bump PHP driver to 1.11.0 (#1725),Co-authored-by: Dusan Maric maricd@firstbeatmedia.com,mongodb.sh: bump PHP driver to 1.11.0 (#1725),Co-authored-by: Dusan Maric maricd@firstbeatmedia.com
92,Fix cpu detection for golang install,,Fix cpu detection for golang install,
93,Update golang feature to be aware of CPU arch (#1723),Partially resolves https://github.com/laravel/homestead/issues/1722,Update golang feature to be aware of CPU arch (#1723),Partially resolves link
94,"Remove docker feature, since it's already on homestead base image (#1716)",Signed-off-by: Ricardo Seriani ricardo.seriani@gmail.com,"Remove docker feature, since it's already on homestead base image (#1716)",Signed-off-by: Ricardo Seriani ricardo.seriani@gmail.com
95,Tagging v12.7.1,,Tagging v12.7.1,
96,Updating default Homestead.yaml/json,,Updating default Homestead.yaml/json,
97,Deduplicate django installation (#1712),Signed-off-by: Ricardo Seriani ricardo.seriani@gmail.com,Deduplicate django installation (#1712),Signed-off-by: Ricardo Seriani ricardo.seriani@gmail.com
98,Update golang version to 1.17.2 (#1711),Signed-off-by: Ricardo Seriani ricardo.seriani@gmail.com,Update golang version to 1.17.2 (#1711),Signed-off-by: Ricardo Seriani ricardo.seriani@gmail.com
99,Tagging v12.7.0,,Tagging v12.7.0,
100,Add a script we can use to clean up tasks in flight,,Add a script we can use to clean up tasks in flight,
101,Install ca_certificates & Tag bump,,Install ca_certificates & Tag bump,
102,Tagging v12.6.0,,Tagging v12.6.0,
103,Change logo to work on Dark Theme (#1703),,Change logo to work on Dark Theme (#1703),
104,Apply fixes from StyleCI,,Apply fixes from StyleCI,
105,Process headers & rewrites for wsl:create-sites,,Process headers & rewrites for wsl:create-sites,
106,Apply fixes from StyleCI,,Apply fixes from StyleCI,
107,Update golang version to 1.17.1 (#1699),Signed-off-by: Ricardo Seriani ricardo.seriani@gmail.com,Update golang version to 1.17.1 (#1699),Signed-off-by: Ricardo Seriani ricardo.seriani@gmail.com
108,Move services configuration after feature installation #1694,,Move services configuration after feature installation #1694,
109,feat(php) enable php-fpm on box startup (#1691),,feat(php) enable php-fpm on box startup (#1691),
110,Fix shebang for php81.sh script (#1690),,Fix shebang for php81.sh script (#1690),
111,pass all our params to create site,,pass all our params to create site,
112,Site option feature parity for PHP from Ruby,,Site option feature parity for PHP from Ruby,
113,Tagging v12.5.0,,Tagging v12.5.0,
114,Adding support for PHP 8.1,,Adding support for PHP 8.1,
115,Tagging v12.4.2,,Tagging v12.4.2,
116,Fix port sent/to issue where the values had been flipped,,Fix port sent/to issue where the values had been flipped,
117,"Removed older php version in favor of the ""Feature scripts for old PHP versions"" (#1684)",,"Removed older php version in favor of the ""Feature scripts for old PHP versions"" (#1684)",
118,Tagging 12.4.1,,Tagging 12.4.1,
119,Restart php when installing/adding,,Restart php when installing/adding,
120,Tagging v12.4.0,,Tagging v12.4.0,
121,Tagging v12.3.3,,Tagging v12.3.3,
122,Update Go to 1.17,,Update Go to 1.17,
123,Update Installation for TimescaleDB,,Update Installation for TimescaleDB,
124,Update golang version to 1.16.7 (#1678),Signed-off-by: Ricardo Seriani ricardo.seriani@gmail.com,Update golang version to 1.16.7 (#1678),Signed-off-by: Ricardo Seriani ricardo.seriani@gmail.com
125,Ensure we purge the entire contents of lib mysql,Somewhat related to https://github.com/laravel/homestead/issues/1618,Ensure we purge the entire contents of lib mysql,Somewhat related to link
126,Mongo install should check for php version existence before installing,Only configure MongoDB for installed PHP versions.,Mongo install should check for php version existence before installing,Only configure MongoDB for installed PHP versions.
127,Reduce number of default ports Add old defaults to ports example,Reduces networking overhead by sharing fewer ports by default.,Reduce number of default ports Add old defaults to ports example,Reduces networking overhead by sharing fewer ports by default.
128,Merge branch 'php-versions' into main,,Merge branch 'php-versions' into main,
129,Adding/Tweaking PHP version scripts,,Adding/Tweaking PHP version scripts,
130,Bump MongoDB PHP driver to 1.10.0 (#1675),  mongodb.sh: update PHP driver to v1.7.4   Features: mongodb.sh: fix dpkg error   mongodb.sh: fix dpkg error   mongodb.sh: bump PHP driver version to 1.8.0   mongodb: update PHP driver to PHP8 compatible v1.9.0   mongodb.sh: bump PHP driver version to 1.10.0   Co-authored-by: Dusan Maric maricd@firstbeatmedia.com,Bump MongoDB PHP driver to 1.10.0 (#1675),mongodb.sh: update PHP driver to v1.7.4 Features: mongodb.sh: fix dpkg error mongodb.sh: fix dpkg error mongodb.sh: bump PHP driver version to 1.8.0 mongodb: update PHP driver to PHP8 compatible v1.9.0 mongodb.sh: bump PHP driver version to 1.10.0 Co-authored-by: Dusan Maric maricd@firstbeatmedia.com
131,Merge branch 'main' into master,,Merge branch 'main' into master,
132,mongodb.sh: bump PHP driver version to 1.10.0,,mongodb.sh: bump PHP driver version to 1.10.0,
133,Update after.sh (#1672), Update after.sh  Updates Node version  Update after.sh,Update after.sh (#1672),Update after.sh Updates Node version Update after.sh
134,Update golang version to 1.16.6 (#1673),Signed-off-by: Ricardo Seriani ricardo.seriani@gmail.com,Update golang version to 1.16.6 (#1673),Signed-off-by: Ricardo Seriani ricardo.seriani@gmail.com
135,Fix typo in configure syntax breaking php gloabal key,,Fix typo in configure syntax breaking php gloabal key,
136,Tagging v12.3.1,,Tagging v12.3.1,
137,Update Blackfire to v2 (#1671),,Update Blackfire to v2 (#1671),
138,add support for vagrant-goodhosts (#1667),Co-authored-by: David Thomas dt@humaan.com.au,add support for vagrant-goodhosts (#1667),Co-authored-by: David Thomas dt@humaan.com.au
139,Add feature scripts for old PHP versions. Enable easy site to feature,,Add feature scripts for old PHP versions. Enable easy site to feature,
140,"When clearing variables, check if the file exists first.",,"When clearing variables, check if the file exists first.",
141,Adding old PHP versions as feature scripts,,Adding old PHP versions as feature scripts,
142,TimescaleDB Should use PostgreSQL 13,,TimescaleDB Should use PostgreSQL 13,
143,Adding Flyway & Heroku CLI as feature scripts,,Adding Flyway & Heroku CLI as feature scripts,
144,Update Readme to remove reference to 20.04 branch.,20.04 and 18.04 branches should not be used and considered archived.,Update Readme to remove reference to 20.04 branch.,20.04 and 18.04 branches should not be used and considered archived.
145,Merge remote-tracking branch 'origin/main' into main,,Merge remote-tracking branch 'origin/main' into main,
146,Removed PostgreSQL < 13 for WSL & TimescaleDB,,Removed PostgreSQL < 13 for WSL & TimescaleDB,
147,Debugging inline provisioners (#1663),,Debugging inline provisioners (#1663),
148,Update golang version to 1.16.5 (#1660),Signed-off-by: Ricardo Seriani ricardo.seriani@gmail.com,Update golang version to 1.16.5 (#1660),Signed-off-by: Ricardo Seriani ricardo.seriani@gmail.com
149,Add Author (#1659),,Add Author (#1659),
150,Tagging v12.3.0,,Tagging v12.3.0,
151,Update aliases for Xdebug 3,,Update aliases for Xdebug 3,
152,Updates to fix mariadb,,Updates to fix mariadb,
153,Adding feature 'r-base' (#1653),,Adding feature 'r-base' (#1653),
154,Update golang version to 1.16.4 (#1649),Signed-off-by: Ricardo Seriani ricardo.seriani@gmail.com,Update golang version to 1.16.4 (#1649),Signed-off-by: Ricardo Seriani ricardo.seriani@gmail.com
155,Remove usage of bintray for rabbitmq (#1646),,Remove usage of bintray for rabbitmq (#1646),
156,Added swoole for Octane (#1642),,Added swoole for Octane (#1642),
157,Update meilisearch.sh (#1643),Listen to all incoming connections instead of specific ip,Update meilisearch.sh (#1643),Listen to all incoming connections instead of specific ip
158,Tagging v12.2.0,,Tagging v12.2.0,
159,WIP: Support Site types in WSL (#1640), Add support for site types in WSL  Addresses #1638  Apply fixes from StyleCI (#1639),WIP: Support Site types in WSL (#1640),Add support for site types in WSL Addresses #1638 Apply fixes from StyleCI (#1639)
160,Fix Minio Buckets Being Setup Incorrectly (#1633),,Fix Minio Buckets Being Setup Incorrectly (#1633),
161,Add executable path and default homestead IP on ExecStart (#1636),,Add executable path and default homestead IP on ExecStart (#1636),
162,Update golang version to 1.16.3 (#1637),Signed-off-by: Ricardo Seriani ricardo.seriani@gmail.com,Update golang version to 1.16.3 (#1637),Signed-off-by: Ricardo Seriani ricardo.seriani@gmail.com
163,Update timescaledb2 to support postgres 13 (#1635),,Update timescaledb2 to support postgres 13 (#1635),
164,Removed trailing slash from apache config (#1630),Co-authored-by: Firoj Ghimire firoj@socialknowledge.com,Removed trailing slash from apache config (#1630),Co-authored-by: Firoj Ghimire firoj@socialknowledge.com
165,Apache corrupts files on mounted folder (#1631),"https://bugs.debian.org/cgi-bin/bugreport.cgi?bug=900821 I encountered this issue under hyper-v. The proposed fix disables mmap, which seems to be broken on cifs.",Apache corrupts files on mounted folder (#1631),"link I encountered this issue under hyper-v. The proposed fix disables mmap, which seems to be broken on cifs."
166,tagging v12.1.1,,tagging v12.1.1,
167,Default MySQL to be true,Resolves https://github.com/laravel/homestead/issues/1625,Default MySQL to be true,Resolves link
168,Update golang version to 1.16.2 (#1629),Signed-off-by: Ricardo Seriani ricardo.seriani@gmail.com,Update golang version to 1.16.2 (#1629),Signed-off-by: Ricardo Seriani ricardo.seriani@gmail.com
169,Update golang version to 1.16.1 (#1628),Signed-off-by: Ricardo Seriani ricardo.seriani@gmail.com,Update golang version to 1.16.1 (#1628),Signed-off-by: Ricardo Seriani ricardo.seriani@gmail.com
170,Apply fixes from StyleCI (#1626),,Apply fixes from StyleCI (#1626),
171,"When creating WSL Sites, clear any existing nginx sites",,"When creating WSL Sites, clear any existing nginx sites",
172,Tagging v12.1.0,,Tagging v12.1.0,
173,Merge branch 'main' of github.com:laravel/homestead into main,,Merge branch 'main' of github.com:laravel/homestead into main,
174,Updates for WSL2,,Updates for WSL2,
