Index,Commit Message,Score,Correspond Changelog Sentence,Commit Description,Label
671,Update timescaledb2 to support postgres 13 (#1635),0.8997855,Update timescaledb2 to support postgres 13 (#1635) @yazeed,,1
672,Delete .styleci.yml,0.5566323,Remove extra features file touch @svpernova09,,0
673,🚑 Fix broken mongodb install when there are PHP 7.x updated packages (#887),0.9842688,🚑 Fix broken mongodb install when there are PHP 7.x updated packages,Resolves / Fixes #570,1
674,Support for i386 architecture removed from the MariaDB installation (#1084),0.96669984,Support for i386 architecture removed from the MariaDB installation (#1084) @afgloeden,,1
675,Re-implement the nginx sites and shared folders settings (#498),0.92844474,Re-implement the nginx sites and shared folders settings #498 (@dojogeekRA),,1
676,"Tag 10.5.1, Fix MySQL 8 apparmor issues",1.0,"Tag 10.5.1, Fix MySQL 8 apparmor issues",,1
677,✨ Add option to disable CFQ (#898),0.8984035,✨ Add option to disable CFQ (#898) @svpernova09,,1
678,Merge remote-tracking branch 'origin/php-7' into php-7,0.60936964,Default to PHP 7.4,  Adding environment variables per sites for laravel apache and symfony same usage as global variables   testing variables per sites   Adding Apache and symfony testing   Small review regarding variables should be ok this time ,0
679,Allow user to specify their own options for ngrok (#499),0.93310887,Allow user to specify their own options for ngrok #499 (@vblinden),,1
680,Merge pull request #505 from DojoGeekRA/refactor/consistency,0.5942421,refactor make command #492 (@DojoGeekRA),,0
681,Tagging v8.5.0,0.957726,Tagging v8.5.4,,1
682,Update golang version to 1.16.5 (#1660),0.9247543,Update golang version to 1.16.5 (#1660) @ricardoseriani,,1
683,Add rewrite support to nginx config (#1019),0.95766366,Add rewrite support to nginx config (#1019) @martijn94,,1
684,missing vmware_desktop directive in homestead.rb (#1570),0.5806475,Fix error message for missing Homestead settings (#950) @fitzrev,,0
685,"Fix minio script, tag release",0.7003379,Minio install : revert #1754 #1755  @bastien-phi,  Add alias for xdebug cli remote debugging   use bridge gateway address   rename alias ,1
686,White space (#1255),0.9101721,White space (#1255) @piotr-cz,  Add rudimentary db import/export aliases   Add support for using PV to monitor progress   Add import progress to PV by calcuating an estimated file size   Add installation message for PV ,1
687,Consistent whitespace indent (2 spaces) (#1176),0.9399826,Consistent whitespace indent (2 spaces) (#1176) @piotr-cz,Tagged 5.2.0 before the PR updating the version was done. Retagging now.,1
688,Update readme.md,0.8288033,Updating versions in readme,,1
689,Issue template: pls update!!,0.6275821,"✨ Update info requested in issue template, bump Virtualbox version (#749) @svpernova09",This allows us to halt the VM from anywhere on the system.,0
690,Remove site-specific client_max_body_size (#1299),0.94777286,Remove site-specific client_max_body_size (#1299) @cbj4074,,1
691,"⬆️ Drop support for Symfony 2.x, upgrade 3.x to 3.3 (#738)",0.9499726,"⬆️ Drop support for Symfony 2.x, upgrade 3.x to 3.3 (#738) @svpernova09",Before my changes all logs was placed in root folder and all sites was saved to one file for access log and one for error log.,1
692,update readme.,0.8582466,Updating versions in readme,Fix bash typo in create-certificate.sh,1
693,Merge pull request #80 from mikeritter/patch-1,0.56198585,Fix bad merge conflict @svpernova09,"Without this, typical output for each certificate is: ==> homestead: /tmp/vagrant-shell: line 11: -f: command not found and existing certificates are regenerated unnecessarily.",0
694,Merge pull request #302 from Maxwell1987/master,0.50700766,Fix bad merge conflict @svpernova09,✨ 🎀 ❄️ Add alias support to run dusk,0
695,✨ Add Zend Z-Ray support (#775),0.91830647,✨ Add Zend Z-Ray support (#775) @Svpernova09,,1
696,Merge pull request #152 from martinlindhe/master,0.5447749,Fix bad merge conflict @svpernova09,🎀 ❄️ ⬇️ Use stable version of MariaDB when installing,0
697,Fix issue with spaces in folder names.,0.54091007,"Use virtiofs for default when, no folders are defined. (#1859) @csaba215",,0
698,Merge branch 'main' into master,0.48149556,Remove branch alias for dev-master (#1254 @svpernova09,,0
699,Merge pull request #143 from lancedikson/master,0.5192028,Fix bad merge conflict @svpernova09,"This changes a few things regarding SSL certificates and how they’re generated. First, the code to generate a certificate has been removed from each of the serve-[whatever] scripts and into it’s own script. The certificate generation code was duplicated 6 times, and in one instance (Symfony2) the checks to see whether or not a certificate was already created weren’t included, like they were in the others. So this change should help prevent things like that from happening again. DRY. Second big change is to the way the certificates are actually generated with OpenSSL. We’re now using an OpenSSL configuration file for each certificate that’s generated. They’re saved along-side the certificates. We’re doing this because the certificates must be generated using the subjectAltName property to list domains, and that property can only be added via configuration file. The subjectAltName property is the primary property that is used in validating domains. Historically, the CN (commonName) value was used to validate domains (as a fall-back), but apparently this was never to specification and recent browsers are removing that decade long oversight(?) A small change worth mentioning is the removal of the CSR (Certificate Signing Request). Since these are self-signed certificates, we don’t need to send a request to an authority to have the certificates created. We can just skip that step and create the certificate using the key.",0
700,Clean up Readme,0.5698228,Updating versions in readme,  Add tests for the init.sh script   Refactor to improve readabilty   Name properly the slugs trait   Name properly the test directory trait ,0
701,📼 Disable socket wrench since we disabled it in the base box (#1057),0.96181417,📼 Disable socket wrench since we disabled it in the base box (#1057) @svpernova09 ,,1
702,💎 🔖 Tagging version 5.3.0,0.9485231,💎 🔖 Tagging v7.14.0,,1
703,Version 9 (#1207),0.70864534,"            version: ""7.1.1""",,1
704,Remove usage of bintray for rabbitmq (#1646),0.9635539,Remove usage of bintray for rabbitmq (#1646) @@Simoneu01, Move stubs directory to the `/resources This allows to keep only php files in the src/ directory and actually it is more friendly for people looking for the stubs files to find them in the project root.,1
705,Add feature scripts for old PHP versions. Enable easy site to feature,1.0000001,Add feature scripts for old PHP versions. Enable easy site to feature, Preserve site's schedule settings Allow to override only the ip address from example settings Refactor settings classes They now inherit from a settings abstract class Preserve site's type settings,1
706,tagging 14.2.0,0.8554238,Tagging v8.5.4,,1
707,restart nginx.,0.7084497,Add rewrite support to nginx config (#1019) @martijn94,Fix #509,1
708,Make mongodb install aware of CPU Arch being used (#1749),0.93852866,Make MongoDB install aware of CPU Arch being used (#1749) @svpernova09,Refactors for consistency,1
709,sendfile param changed to off (#788),0.9391531,sendfile param changed to off (#788) @TheBnl,This will maintain consistency between the bash script files,1
710,Fix to show PHP errors,0.74209726,Default to PHP 8.0 (#226),This will mantain consistency between the bash script files,1
711,working on yaml file.,0.60921216,Install pecl yaml extension #495 (@sitedyno),only reload apache if it is active,0
712,fix: use correct environment variables (#1875),0.8302252,fix: use correct environment variables (#1875) @Sn0wCrack,"the command service apache2 reload will cause a fatal error if apache is not loaded. this update first checks to see if apache is active, before triggering the reload",1
713,Merge pull request #280 from cptmintalicious/master,0.5240017,Finish implementing addition/removal of site domains to hosts file @cbj4074,"the flip command allows the users to easily switch between the Nginx and Apache web servers on their homestead boxes. it does this by checking if apache is running, and then starting and stopping the services depending on which is currently running.",0
714,Removed the client,0.5342781,Don't remove mysql lib folder #1383 #1188 ,  Remove php-yaml extension installation It is no longer needed given that the yaml file manipulations is being done with Symfony Yaml component.   Disable xdebug during TravisCI execution   This will improve the execution time,0
715,add Symfony4 nginx configuration (#600),0.93777835,add Symfony4 nginx configuration (#600) @michaelesmith, Allow user to specify their own options for ngrok Updated the usage command with extra clarification,1
716,Add support for custom headers in proxy sites (#1158),0.95085704,Add support for custom headers in proxy sites (#1158) @almas1992,,1
717,:sparkles: :bulb: Add issue template,0.56086075,Updating magento template to support params (#1557) @minioak, Refactor to improve readability Re-implement the settings nginx configuration Re-implement the settings shared folder configuration,0
718,Set Homestead Environment Variables to the CLI profile,0.5395771,Change features parser to provide environment variables (#1213) @ricardoseriani,,0
719,Update meilisearch.sh (#1643),0.8561501,Update meilisearch.sh (#1643) @RemCom, Install pecl yaml extension Choose yaml versions based on php version,1
720,tag v10.6.0,0.87455505,Tagging v8.5.4, use Symfony yaml component instead of PHP extension Add missing namespace to settings tests,1
721,Tagging v9.1.0 & Require base box >= 8.1.0,0.9213823,Tagging v9.1.0 & Require base box >= 8.1.0 @svpernova09,,1
722,Create serve-proxy.sh,0.5718757,Proposal: user-specific after.sh files (#932) @stevegrunwell,,0
723,💎 Tagging 5.4.0 (#595),0.9371122,💎 🔖 Tagging v7.14.0, Refactor example settings file creation Refactor after shell script file creation Refactor aliases file creation Refactor Vagrantfile creation Refactor the settings file creation,1
724,drop Yarn (#1847),0.9061553,drop Yarn (#1847) @browner12,,1
725,Update golang version to 1.13.3 (#1303),0.91700935,Update golang version to 1.13.3 (#1303) @ricardoseriani,,1
726,Merge branch 'master' into php-7,0.5694512,Default to PHP 7.4,,0
727,💎 🔖 Tagging v7.10.0,0.9942236,💎 🔖 Tagging v7.14.0,,1
728,Apache HTTP/HTTPS php version fix (#940),0.93815,Apache HTTP/HTTPS php version fix (#940) @fppz, Create Homestead.json stub Add Homestead.json to .gitignore,1
729,💎 🔖 Tagging v7.14.0,0.99999976,💎 🔖 Tagging v7.14.0,,1
730,🚑 Set Mutex value in Apache config to prevent auto reload issues on boot,0.8765435,🚑 Set Mutex value in Apache config to prevent auto reload issues on vagrant reboot @svpernova09,✨ ❄️ Port forward mailhog http interface by default,1
731,Add php version to cron schedule (#1568),0.68522716,Refactor cron schedule script (#692) @DojoGeekRA ,,0
732,Refactor some tests and code (#511),0.83709776,Refactor some tests and code #511 (@pluxain),,1
733,Add serve-hhvm,0.5098355,🔥 Remove HHVM #468 (@svpernova09),,0
734,Update golang version to 1.17.7 (#1762),0.9252295,Update golang version to 1.17.7 (#1762) @ricardoseriani,,1
735,💎 🔖 Tagging v8.0.2,0.9999999,💎 🔖 Tagging v8.0.2,Refactor/bash files,1
736,Update golang version to 1.19.5 (#1836),0.92719007,Update golang version to 1.19.5 (#1836) @ricardoseriani,This is to maintain consistency between all the bash files,1
737,Merge pull request #6 from hakanersu/patch-2,0.56773096,Fix bad merge conflict @svpernova09,This will maintain consistency in all of the shell scripts.,0
738,Tagging v14.3.0,0.921937,Tagging v8.5.4,Unix tools expect the newline character because lines not ending in a newline character aren't considered actual lines Source: http://stackoverflow.com/questions/729692/why-should-text-files-end-with-a-newline,1
739,Update golang version to 1.18.5 (#1790),0.9296713,Update golang version to 1.18.5 (#1790) @ricardoseriani,"✨ ❄️ 💡 ⚡️ Instead of creating ~/.homestead, just use the repo folder instead",1
740,Merge pull request #399 from svpernova09/bug/fix-blank-bash_aliases-file,0.6205515,Fix bad merge conflict @svpernova09,✨ Add missing serve aliases and alphabetize alias functions,0
741,Update readme.md (#1867),0.8930288,Update readme.md (#1867) @stebogit,,1
742,"Fix Magento site type ""upstream sent too big header while reading response header from upstream"" error (#1520)",0.8972915,"Fix Magento site type ""upstream sent too big header while reading res… @jeshtan",,1
743,Refactor cron schedule script (#692),0.9155632,Refactor cron schedule script (#692) @DojoGeekRA , added checking for none existing local dirs changed the error printing like desired by the boss :),1
744,Updated parameters for folder sharing,0.75721836,Add more tests for shared folders configuration,,1
745,Add blackfire configuration to Homestead.yaml file,0.68804055,Blackfire Support has been moved to a feature and must be defined as such within Homestead.yaml,,0
746,Update tests.yml (#1795),0.84253174,Update tests.yml (#1795) @sashashura,Fix StyleCI issues,1
747,fix 413 Request Entity Too Large ,0.59404224,Remove site-specific client_max_body_size (#1299) @cbj4074,,0
748,Adding Run command for running ssh commands,0.5027836,Set scripts to be executeable @svpernova09,,0
749,🚑 ❄️ 🎨 Code style fixes and add site parameter support to missing site scripts (#567),0.9168873,🚑 ❄️ 🎨 Code style fixes and add site parameter support to missing site scripts (#567) @Svpernova09,,1
750,working on readme.,0.52639383,Updating versions in readme,,0
751,fix version,0.69784033,New Default Versions,,0
752,Avoid reappending hostname when Homestead.yaml already exist.,0.68451047,Add Sites from Homestead.yaml to /etc/hosts (#1007) @cbj4074,,0
753,Fix table in readme,0.5557603,Updating versions in readme, Added unit tests Changed phpunit version + added @test annotation,0
754,change dusk alias (#1492),0.85240835,change dusk alias (#1492) @Perafan18,,1
755,feat: add logstash feature (#1877),0.89550245,feat: add logstash feature (#1877) @Sn0wCrack,,1
756,Fix indentation in flip-webserver script,0.85952294,Fix indentation in flip-webserver script #505 (@DojoGeekRA),,1
757,Remove old openresty install script (#1211),0.9324782,Remove old openresty install script (#1211) @ricardoseriani,Update mariadb to 10.2.* to work with laravel 5.4,1
758,Support Symfony 3.x components (#1070),0.952904,Support Symfony 3.x components (#1070) @deviantintegral,,1
759,Unique Hostname CN for Root Certificate (#789),0.94848424,Unique Hostname CN for Root Certificate (#789) @Artisan,,1
760,✨ ❄️ 💎 🔖 Default to PHP 7.2 Tag v7.0.0 (#743),0.9561267,✨ ❄️ 💎 🔖 Default to PHP 7.2 Tag v7.0.0 (#743) @svpernova09,✨ 🎀 🚀 Add statamic serve script,1
761,Ensure we purge the entire contents of lib mysql,0.9999998,Ensure we purge the entire contents of lib mysql,,1
762,Update Readme to remove reference to 20.04 branch.,1.0000001,Update Readme to remove reference to 20.04 branch.,,1
763,Tagging v10.9.0,0.9415112,Tagging v10.17.0 ,,1
764,Add generated ca to local cert storage (#1345),0.9321975,Add generated ca to local cert storage (#1345) @kesselb,,1
765,Fix Graphana install,0.8643711,Fix Graphana install @svpernova09,,1
766,couchdb support (#591),0.71068144,"Fix issues with CouchDB installation, resolves #1168 @svpernova09",,1
767,Add cakephp3 to supported site types (#1154),0.897997,Add cakephp3 to supported site types (#1154) @Fuxy22,,1
768,Add mac option (#1346),0.863505,Add mac option (#1346) @sigmoidal,,1
769,💎 🔖 Tagging v7.7.0,0.9812584,💎 🔖 Tagging v7.9.0,,1
770,Merge pull request #323 from JulienTant/patch-1,0.5396737,Fix bad merge conflict @svpernova09,,0
771,Remove cruft from MySQL 8 install,0.909464,Remove cruft from MySQL 8 install @svpernova09,Resolves #409 by allow user to set option in their Homstead.yaml config.,1
772,Merge pull request #180 from franzliedke/patch-2,0.5629244,Fix bad merge conflict @svpernova09,"Removing the credentials from the mysql command. A copy of the .my.cnf file is created for the vagrant user, to allow easy access to the database. resolves #407",0
773,Fixing #740 (#741),0.8183029,Fixing #740 (#741) @mattclements,"To avoid ""Access denied"" problem specifically for maridb installations, it is required to use the database credentials directly on the command.",1
774,force all non file matches through the Front Controller (#1316),0.9443046,Force all non file matches through the Front Controller (#1316) @browner12, The .my.cnf could be available for vagrant user,1
775,Limit to ~9.0 base box version. Tag new release,0.99999994,Limit to ~9.0 base box version. Tag new release,Show DB name when creating while provision,1
776,Merge pull request #174 from zoontek/master,0.5775212,Fix bad merge conflict @svpernova09,Show which database is being created while the provision.,0
777,🚑 🔖 💎 Tagging 5.0.1,0.923965,💎 🔖 Tagging v7.14.0,,1
778,Swap out oracle Java with openJDK (#1088),0.95038825,Swap out oracle Java with openJDK (#1088) @svpernova09,,1
779,Tagging v12.4.0,0.919556,Tagging v8.5.4,:ambulance: Copy aliases -> /tmp/.bash_aliases before awk'ing it to ~/.bash_aliases,1
780,increment versino,0.49361852,Note on Versioning,More info: https://laracasts.com/discuss/channels/laravel/default-aliases-not-working-in-homestead,0
781,Safety first! (#655),0.4756492,"Add https link to docs The safer, the better (#613) @m1guelpf",:sparkles: Support naming the VM for the Parallels Provider,0
782,remove from stub,0.56841075,Ensure we purge the entire contents of lib mysql,,0
783,Remove fix for old apt-get issue. (#688),0.8952476,Remove fix for old apt-get issue. (#688) @DFurnes,":ambulance: :checkered_flag: Fix line endings on aliases file if needed, fixes #396",1
784,💎 🔖 Tagging v7.19.0,0.97482765,💎 🔖 Tagging v7.9.0,,1
785,Remove code directory (#672),0.64677477,lowercase 'code' directory (#667) @browner12,Updated issue template to emphasize version checking,0
786,add header support (#955),0.83259195,add header support (#955) @jordanramstad,,1
787,Tagging v12.7.1,0.92833126,Tagging v8.5.4,,1
788,✨ Always restart the motd service on provision (#1002),0.93349403,✨ Always restart the motd service on provision (#1002) @svpernova09,,1
789,Merge pull request #209 from briankiewel/master,0.53641856,Fix bad merge conflict @svpernova09,:sparkles: :snowflake: :art: Upgrading PHP to 7.1,0
790,"Version bump v9.2.0, require box v8.2.0 (PHP 7.4)",0.6538986,Fix base box version requirement.,,0
791,Update PHP Mongodb Driver (#876),0.9536954,Update PHP Mongodb Driver (#876) @fppz,:books: Update Issue Template to suggest using latest versions,1
792,Merge branch 'master' of https://github.com/pbsmartteam/homestead into pbsmartteam-master,0.4925518,Merge SMB creds from Homestead.yaml into config (#996) @cbj4074,,0
793,Merge pull request #398 from svpernova09/feature/parallels-vm-name,0.6412372,Fix bad merge conflict @svpernova09,:sparkles: :bulb: Add issue template,0
794,add postgis feature (#1322),0.8836498,add postgis feature (#1322) @motia,,1
795,"If Homestead.yaml, aliases, or after.sh exist, do not overwrite, assume they came with the application.",0.53195983,"To use xhgui you need to add xhgui: ""true"" to the site in Homestead.yaml",,0
796,Update golang version to 1.15.7 (#1594),0.9328045,Update golang version to 1.15 (#1474),Add gui to vmware and virtualbox,1
797,Merge pull request #282 from bbashy/certificate-bit-length,0.5817969,Merge SMB creds from Homestead.yaml into config (#996) @cbj4074,Add gui for virtualbox Better conforming to code style.,0
798,Update golang feature to be aware of CPU arch (#1723),0.95785034,Update golang feature to be aware of CPU arch (#1723) @svpernova09,Run composer self-update from vagrant user,1
799,Merge pull request #144 from haampie/master,0.51169944,Fix bad merge conflict @svpernova09,Before this fix composer self-update was run directly as root and didn't add the missing keys to /home/vagrant/.composer (keys.dev.pub and keys.tags.pub) if you try run composer diagnose before this fix then you will see that it shows error of missing keys,0
800,tweak comment.,0.57912445,Edit some grammar and include some links (#654) @fairbraxton,,0
801,🔖 Tagging v4.0.4 (#442),0.88731414,💎 🔖 Tagging v7.14.0,,1
802,Merge pull request #187 from JamShady/pr/add-ssl-support,0.5643185,Fix bad merge conflict @svpernova09,Vagrantfiles coherence,0
803,working on code formatting.,0.5135905,Instructions,"This update prevents vagrant ""default"" instance naming no matter what name one sets in the configuration file. If no name key is set in the Homestead.yaml/json then ""homestead-7 is used consistent with virtualbox naming in the lines above the edit.",0
804,Tagging v14.1.0,0.91423035,Tagging v8.5.4,"File.exists? is a deprecated method in Ruby, use File.exist? instead. Same as 9c8a099d81d5ec15a2a881c1352b1ca0fb7414f2 but for LocalizedVagrantfile",1
805,"The safer, the better (#613)",0.6293682,"Add https link to docs The safer, the better (#613) @m1guelpf",Same as 29412e4bd4a3e928e46ce90a518bca3d80a43c21 but for LocalizedVagrantfile,0
806,Update MongoDB to v1.11.1,0.9424921,Update MongoDB for 4.4 / Ubuntu 20.04 ,Same as 017232ccb5d3ebb5ec9a19210f93c0189189f70a but for vagrantfile,1
807,Update golang version to 1.13.2 (#1301),0.9205244,Update golang version to 1.13.3 (#1303) @ricardoseriani,same as 430659488844c695b3900013d180d1a1473899d7 but for LocalizedVagrantfile,1
808,Update golang version to 1.17.2 (#1711),0.9154998,Update golang version to 1.17.7 (#1762) @ricardoseriani,Deprecated method.,1
809,Merge pull request #176 from kevinsimard/master,0.5426636,Fix bad merge conflict @svpernova09,"File.exists? is a deprecated method in Ruby, use File.exist? instead.",0
810,Remove extra features file touch,0.8637072,Remove extra features file touch @svpernova09,Added 'nolock' to default nfs mount_options,1
811,Add function to switch to PHP 8.0 (#1553),0.90027666,Add function to switch to PHP 8.0 (#1553) @DieterHolvoet,Fixes ErrorException: file_put_contents(): Exclusive locks are not supported for this stream in /home/vagrant/Code/project/vendor/laravel/framework/src/Illuminate/Filesystem/Filesystem.php:111``` which causesTokenMismatchException` for homestead folders with nfs enabled. System where I've experienced the issue: Host OS: Ubuntu 16.04. One colleague also experienced weird TokenMismatchExceptions on Windows 10 but disabled nfs as a workaround. ( Will try to test this on Windows a.s.a.p. ),1
812,Bump version number for release,0.80254364,Version bump,Enabled http/2 support,1
813,fix timescaledb version mismatch (#1289),0.82946455,fix timescaledb version mismatch (#1289) @motia ,,1
814,resolve conflicts,0.52307785,Resolves #1507 ,add ability to serve apache sites,0
815,💎 🔖 Tagging v7.15.0,0.99489343,💎 🔖 Tagging v7.14.0,,1
816,Add artisan as an alias to allow users to use 'arstian' without having to 'php artisan' at the command line,0.61916363,Use function instead of alias to swith php version (#648) @ricardoseriani,per-project installation - unprivileged afterScript provisioner,0
817,add support for vagrant-goodhosts (#1667),0.88739526,add support for vagrant-goodhosts (#1667) @thedavidthomas,(for per-project installation to be coherent with standard install),1
818,Use getcwd() instead of string replacing it's output,0.40885478,Fix bash typo in create-certificate.sh (#533) @wturrell,Add Vagrant.require_version to Vagrantfile,0
819,Enable Github Actions - Decom Travis-CI (#1573),0.53885347,Git repo url updated (#1342) @shahariaazam,Forces to use Vagrant 1.8.4 and greater,0
820,Add support for Symfony 5 (#1317),0.8433347,Add support for Symfony 5 (#1317) @andrewmy,Use MariaDB Xenial PPA,1
821,first commit.,0.31597024,TL;DR,,0
822,Pass .profile variables to cron (#760),0.91951406,Pass .profile variables to cron (#760) @Artisan,,1
823,Default MySQL to be true,1.0,Default MySQL to be true,,1
824,Add support for Hyper-V specific configuration,0.9999999,Add support for Hyper-V specific configuration,updated comment,1
825,"✨ Update info requested in issue template, bump Virtualbox version (#749)",0.9558247,"✨ Update info requested in issue template, bump Virtualbox version (#749) @svpernova09",,1
826,Support for timeseries database / visualization (#885),0.9072305,Support for timeseries database / visualization (#885) @ khusmann,Allow user to create from Homestead.yaml.example with different IP.,1
827,Merge pull request #262 from skyrpex/patch-1,0.59526014,Fix bad merge conflict @svpernova09,This would allow user to run homestead make --ip=x.x.x.x and able to change the default IP address when starting a project that include Homestead.yaml.example. Signed-off-by: crynobone crynobone@gmail.com,0
828,Prompt user if the files are being overwritten,0.49738267,Update scripts file permissions (#720) @DojoGeekRA,"Extended the previous ""artisan"" alias to take in arguments...",0
829,Use :: operator instead of . in the json parse statement,0.8586376,Use :: operator instead of . in the json parse statement (#699) @DojoGeekRA,"Also made it shorter by adding the ""art"" alias.",1
830,✨ 🐬 Add support for MySQL 8 config option to install newer version (#970),0.8775369,✨ 🐬 Add support for MySQL 8 config option to install newer version @svpernova09,Assist syntax highlighters w/Vagrantfile language,1
831,Add Author (#1659),0.49661854,Update readme.md (#1867) @stebogit,,0
832,clear variables,0.5096135,Update clear variables to be consistent. #1380 h/t @ProjectCleverWeb @svpernova09 ,,0
