Index,Commit Message,Score,Correspond Changelog Sentence,Commit Description,Label
2543,"Update README from ""beta roadmap"" to ""roadmap""",0.64487445,chore(docs): remove roadmap link from README #1067,,0
2544,Update Makefile,0.5539395,chore: Update Digital Team Files #2203,,0
2545,Add examples section to Contribution guide,0.6556351,chore(docs): Adds descriptions example drafts #1073,,0
2546,Update snapshot,0.58891153,chore(deps): add script to update all snapshot tests #1139,,0
2547,refactor(cli): move debug collection into lib,0.77573323,refactor(cli): move cli library into seperate package #2253,Co-authored-by: Laura Pacilio 83350965+laurapacilio@users.noreply.github.com,1
2548,chore: update jsii-rosetta version to latest,0.64820313,chore(deps): Upgrade eslint to v7 #819,,0
2549,fix(provider-generator): Add special case in case resource is named 'object',0.9672542,fix(provider-generator): Add special case in case resource is named 'object' #2138,,1
2550,Use current version of Terraform 0.13 (#301),0.84404016,Terraform version check #378,Co-authored-by: Ansgar Mertens ansgar@hashicorp.com,1
2551,"fix(docs): fix stack escape hatch override example for TS, Python, and Java",0.61406064,Stack escape hatch (#81),Co-authored-by: Ansgar Mertens ansgar@hashicorp.com,0
2552,Drop obsolete comments,0.51891184,Removed functionality,as we deprecate resource parsing we don't necessarily need this anymore,0
2553,note!: cdktf convert does not support Go currently,0.6608212,Fix cdktf init issue (#139),"We always need to fetch all, but we don't want to reprint it",0
2554,test(cli): test variables and flags,0.7911578,test(cli): test generated providers #1235,,1
2555,chore(deps): bump @types/stream-buffers from 3.0.3 to 3.0.4,0.71470475,chore(deps): bump trim-newlines from 3.0.0 to 3.0.1 #863,,1
2556,Merge pull request #2598 from hashicorp/prepare-release-0.15.3,0.5923765,chore: fix finalizing the Sentry release #2379,Closes #1337,0
2557,chore: add SUPPORT.md,0.62184733,chore: Support building with Go 1.19 #2098,,0
2558,chore: update version to 0.9.0,0.7841407,chore(docs): add 0.9 upgrade guide #1512,,1
2559,check not undefined rather than truthy,0.5915271,fix(lib): check for null objects and don't try to reverse undefined or null #1592,,0
2560,Tests for 3a70b69632bd2219ed7febe5d81370877c7cf91a,0.6268549,feat(lib): expose unit testing helpers #942,,0
2561,updated with feedback from @crw,0.53782094,chore: disable cron for project board #2484,,0
2562,Add locals content to new docs and update sidebar for functions,0.62510186,chore(docs): add sidebar link #1674,fix: ignore vercel for PRs as it currently fails on branches of forks,0
2563,1st attempt at correct handling,0.49771112,Basic error handling support (#110),,0
2564,chore: remove dependency,0.6567838,chore: remove long-running hooks #2418,,0
2565,feat(docs): Add iterator docs page,0.951001,feat(docs): Add iterator docs page #1840,This has been buggy for a long time,1
2566,fix(cli): init use the default instead of template name as TFC workspace name,0.6757766,fix(cli): Use 'id' as argument name for all templates #2119,feat(cli): enhance logs with path to construct,0
2567,added outline of sections to add,0.64004046,chore(docs): Adds descriptions example drafts #1073,,0
2568,chore: remove conditional to test,0.60896695,chore(tests): Ignore website changes for test workflows #1109,,0
2569,"add partial docs for terraform-functions.ts,matcher.ts and fs.ts",0.62974256,chore: create TFC/TFE workspace using the Terraform CLI #2424,,0
2570,update go module creation example,0.63864756,fix: update constructs and go runtime versions #2096,chore(docs): Update README and remove old files,0
2571,Fix usage of ExecutionOptions in watch,0.5219257,fix(docs): remove outdated docs from the previous watch implementation #1768,,0
2572,ifeat(docs): add hcl-cdk interoperability documentation,0.8164172,chore(docs): What is CDKTF and Interoperability #1065,Co-authored-by: Laura Pacilio 83350965+laurapacilio@users.noreply.github.com,1
2573,"Revert ""Make build names easier to identify""",0.5202372,fix(cli): Better handle non-registry modules and improved naming #929,,0
2574,Merge pull request #796 from hashicorp/tf-to-cdk,0.56879246,fix(hcl2cdk): handle no providers passed and add cdktf import for remote state data sources #1561,Co-authored-by: Ansgar Mertens ansgar@hashicorp.com,0
2575,Merge pull request #1773 from hashicorp/sync-backported-release,0.6120299,chore: sync version and changelog from the 0.13.3 backported release #2251,,0
2576,Merge pull request #2426 from hashicorp/fix/ci-release-next-errro,0.57138205,fix(lib): Fix release pipeline #1061,Updates /docs README with a link to Learn and removes old getting started files.,0
2577,fix(cli): Use version of cdktf-cli when running init for go with a local override (--dist) for the cdktf package,0.7662356,"We split up our cdktf-cli package into cdktf-cli for the UI parts, utilizing @cdktf/cli-core for the functionality. If you previously relied on the internal cdktf-cli/lib entrypoint you should switch to @cdktf/cli-core. This was never an official API, but we want to mention it here in case it breaks for anyone.",Co-authored-by: Ansgar Mertens ansgar@hashicorp.com,1
2578,Merge pull request #1085 from hashicorp/sm/975-edit,0.5255052,chore(docs): Merge stable-website into main #1515,,0
2579,Merge pull request #1234 from hashicorp/add-reference-docs-to-website,0.6608151,chore(docs): Merge docs content to stable website #1133,,0
2580,Merge pull request #1915 from hashicorp/cli-synth-node-options,0.5845987,feat(cli): support generating provider bindings in parallel #2111,,0
2581,Merge pull request #1984 from hashicorp/automation/yarn-upgrade,0.54425776,chore: truly autoclose older GHA updater PRs #2546,,0
2582,Don't push to proxy,0.4856131,Don't treat warning lines as resources #585,feat(cli): match multiple stacks with patterns,0
2583,fix: ignore files that git knows but have recently deleted,0.6443022,feat: also go through files not yet added to git #2567,Co-authored-by: Ansgar Mertens ansgar@hashicorp.com,0
2584,fix(hcl2cdk): use fqn whenever a var without property access is used,0.5726788,fix(lib): Delay complex object fqn so that override id can still be used #1793,,0
2585,Merge branch 'main' into fix_update_snapshots_from_fork,0.5035065,fix(docs): fix order of changelog steps to make sure version is bumped after running script #1419,,0
2586,chore: remove warning level,0.6258987,chore(deps): ignore tsbuildinfo #894,,0
2587,Update commands help,0.65524983,feat(cli): add provider upgrade command #2202,,0
2588,"Revert ""fix: (temporary) don't synth failing tests yet""",0.686242,fix(tests): Make version more stable #2467,feat(cli): allow multiple stacks in the output command,0
2589,Add docs about provider caching,0.65696156,chore(docs): add google cloud kubernetes example #742,,0
2590,chore: trigger CI by labels only,0.68041587,chore: run CI more selectively #2313,,0
2591,Add support for List of Maps,0.80085063,Add Lists of Maps #229,feat(cli): parallelize cdktf deploy/destroy,1
2592,wip: debug test,0.6642756,chore: fix edge provider tests in pre-release pipeline #1423,,0
2593,fix(tests): Fix Go testing matchers test #2,0.6852026,fix(tests): change Options -> Config as per #2471 #2482,,0
2594,Add test for cdktf init  with colors enabled - Closes #141,0.66784346,Fix cdktf init issue (#139),,0
2595,chore(hcl2cdk): update snapshots,0.844048,chore(hcl2cdk): update readme #1452,,1
2596,add in remote state typing,0.6314565,Migrating from local state to remote state doesn't work #168,,0
2597,docs: document cross-stack references,0.68778384,chore(docs): reference interoperability layer #1160,,0
2598,chore: document subtle changes,0.65633345,chore(docs): Add note and copyediting to providers page #1127,,0
2599,getting closer on writteable string list map case,0.5732782,test(lib): ensure list mapper does not fail when passed IResolvables #1791,,0
2600,run all win int tests that exist,0.60796005,chore(release): run all tests on npm test #962,chore: disable watch test,0
2601,fix(docs): add mandatory cdktf get step,0.9489413,fix(docs): add mandatory cdktf get step #784,"It's currently flaking a lot, so we want to investigate it properly without blocking the current work",1
2602,fix(examples): Fix Go Aspects example JSII error by using pointer to Aspect,0.5744505,fix(cli): Fix indentation of RemoteBackend in CSharp and Java template #1733,fix: fix snapshot tests,0
2603,Actually Resolve Tokens,0.64207196,feat: enable non-escaping mode for tokens #2179,,0
2604,Merge pull request #717 from hashicorp/cloud-output-bug,0.5843479,fix: cross-stack references in terraform cloud remote execution mode #1574,chore: use distinct GitHub token to push changes,0
2605,Merge pull request #1163 from hashicorp/sm/link-fixes,0.57848144,chore(docs): Fixes broken links #1163,chore: npm-check-updates && yarn upgrade,0
2606,fix(docs): fix Go code,0.72400284,"fix(docs): fix code blocks in ""create and deploy"" documentation #1826",,1
2607,small naming change,0.6017321,Rename instance variable to a more specific name to avoid name collisions #640,Ran npm-check-updates and yarn upgrade to keep the yarn.lock file up-to-date.,0
2608,feat(cli): support variables in destroy as well,0.6580578,feat(cli): output command #1495,feat(provider-generator): allow tfResourceType to be narrowly typed,0
2609,Merge pull request #1828 from hashicorp/ignore-usage-errors,0.5625962,Fix: Unable to use resources containing an argument named 'stack' #716,,0
2610,Merge branch 'main' into doc/update-prerequisites,0.6397354,chore(docs): Merge stable-website into main #1515,feat(lib): update attributes['//'] instead of assigning to it,0
2611,output NEXT_PRIVATE_OUTPUT_TRACE_ROOT,0.4513913,feat(cli): output command #1495,,0
2612,python pip template adjustments for windows,0.942924,Python pip template adjustments for windows #535,,1
2613,Update example to align with template,0.5633605,fix(cli): Update require package in template #2118,chore(cli): remove date-fns dependency,0
2614,chore: improve error message,0.6777854,chore(cli): add sentry error reporting #1809,,0
2615,Merge pull request #2677 from hashicorp/labeler-integration-tests,0.64445364,fix(docs): fix example for integration test #1129,feat(cli): Enable to override 'checkCodeMakerOutput',0
2616,fix(tests): ignore version check for provider add tests as they need to run with an older cdktf version with pre-built providers available,0.72810876,fix(tests): Make version more stable #2467,fix(examples): update eks python example,1
2617,fix: use recursion for boolean arrays,0.5407791,Boolean[] attributes have gone from boolean[] to Array<boolean | IResolvable> | IResolvable.,,0
2618,update expected test order,0.59680265,"fix(tests): as predicted, the test needs to be skipped for a bit of time #2004",,0
2619,Merge pull request #1586 from jsteinich/provider_version_updates,0.568956,feat(cli): add provider upgrade command #2202,feat: Model ComplexComputedLists as ComplexLists and ComputedObjects,0
2620,feat(lib): add support for cloud backend,0.9099721,feat(lib): add support for cloud backend #1924,,1
2621,only turn on logging when env is set to true,0.53513443,fix(cli): only log if logs are sent #1365,,0
2622,updates suggestions from pr review,0.59167886,fix(release): only include prs since last version in the changelog #1171,,0
2623,chore: update variable usage based on review feedback,0.6352803,chore: add a refactoring guide #2413,,0
2624,chore(cli): handle dev pypi versions,0.61313015,chore(cli): upgrade React version #1259,,0
2625,Move stack test to cdktf,0.6918625,Handle stale stacks in cdktf #150,,0
2626,refactor(cli): remove getStack duality,0.7023797,refactor(cli): replace links with redirects #1138,,1
2627,feat(cli): discard / cancel terraform cloud runs on discard / stop / ctrl-c cancel,0.63373935,fix(tests): disable terraform cloud test for now #955,,0
2628,chore: add website release automation,0.94844735,chore: add website release automation #1255,,1
2629,Merge pull request #1674 from hashicorp/sm/add-sidebar-link,0.56178725,chore(docs): add sidebar link #1674,,0
2630,Merge branch 'main' into dependabot/npm_and_yarn/axios-0.21.4,0.5373371,chore(docs): Merge stable-website into main #1515,,0
2631,Merge pull request #278 from smalltown/feature/add_python_example,0.49341434,chore(docs): add azure python link #773,As ComplexObjects always are single items.,0
2632,Merge pull request #2294 from hashicorp/trying-to-fix-ci,0.61278886,feat(cli): link to troubleshooting page for error #2192,feat(cli): check whether an existing token is still valid when running login command,0
2633,fix(cli): return non-zero exit code on unknown command,0.7757149,fix(cli): return non-zero exit code in case of error when using cdktf diff #1726,Resolves #370,1
2634,Merge branch 'main' into map_token,0.5238366,"The Terraform merge function can merge both lists and maps, but this can cause issues when using the result in a typed language. Therefore we split it into Fn.mergeLists and Fn.mergeMaps, this means you need to change your cdktf programs code.",feat(cli): handle dismissing a single stack vs stopping all stacks,0
2635,docs: update README for function generation tool,0.6395109,Minor output changes and updated README.md example.,,0
2636,Merge pull request #2010 from hashicorp/fix-docs-links-provider-resources,0.7095442,fix(docs): fix links by removing all links to the providers-and-resources page that does not exist anymore #2010,,1
2637,Merge pull request #698 from hashicorp/feat-648-asset-construct,0.61840606,Add Asset Construct #698,"Using the actions default token does not trigger a CI run, see https://github.community/t/push-from-action-does-not-trigger-subsequent-action/16854 I created a new token with the team-tf-cdk user and used it here.",0
2638,enable python set edge test,0.75754344,chore: disable python edge test #2369,feat(cli): serial multi-stack deploys,1
2639,fix(hcl2cdk): vars need to be accessed through the value property,0.6291643,fix(hcl2cdk): suffix variables and locals #845,,0
2640,Remove broken link on overview page,0.64063483,fix(docs): fix header indentation causing no page contents sidebar for this page #2299,Signed-off-by: github-team-tf-cdk github-team-tf-cdk@hashicorp.com,0
2641,Fix recursive delete call,0.50050217,Removed functionality,,0
2642,feat(hcl2cdk): support dynamics through iterators,0.63705873,feat(cli): implement hcl2cdk #796,,0
2643,chore: rename hcl module options,0.6651103,chore(docs): Update cli configuration doc #1111,,0
2644,Merge pull request #739 from hashicorp/fix-738,0.53787065,Fix: Unable to use resources containing an argument named 'stack' #716,,0
2645,feat(cli): add chokidar for file watching and start working on cdktf watch command,0.8334956,feat(cli): add cdktf watch command #817,,1
2646,Don't use colors for inputs,0.58116007,feat(docs): document FORCE_COLOR env var that allows disabling colored output #1917,,0
2647,Merge pull request #1754 from robin-norwood/rln-fix-convert-docs,0.5713531,chore(docs): Merge docs content to stable website #1133,there is a bit of change in also for creating a new dir per testcase to make them more robust,0
2648,chore(tests): Add pr lint for semantic releases,0.66329634,chore(docs): prepare for code samples in multiple languages #2314,,0
2649,Merge pull request #2595 from hashicorp/source-iterator-snippets-from-examples,0.5076211,feat(cli): support generating provider bindings in parallel #2111,,0
2650,feat(lib): expose unit testing helpers,0.961768,feat(lib): expose unit testing helpers #942,Destroy is not yet supported but can be passed multiple stacks,1
2651,chore: remove tfc file once more as rebasing is not my greatest strength,0.5721509,Fix cdktf destroy - Make sure output parses only relevant parts #761,Signed-off-by: github-team-tf-cdk github-team-tf-cdk@hashicorp.com,0
2652,chore: increase parallel limit (10->30) to speed up integration tests,0.98921263,chore: increase parallel limit (10->30) to speed up integration tests #2487,,1
2653,Add remote backends content to new doc structure,0.6860031,feat(lib): add docstrings to S3 backend resource #1780,,0
2654,Merge pull request #1458 from hashicorp/prepare-release-0.8.5,0.53832316,chore: fix finalizing the Sentry release #2379,fix(cli): parse JSON log lines if possible,0
2655,Take out token page todos,0.5650729,feat: enable non-escaping mode for tokens #2179,,0
2656,fix(cli): errors were not properly forwarded,0.7295773,fix(cli): improve cli error handling #1687,Signed-off-by: github-team-tf-cdk github-team-tf-cdk@hashicorp.com,1
2657,only keep empty object if explicit,0.63463134,fix(lib): Keep specified empty objects #1329,,0
2658,update file location and local tests,0.5786443,fix: Update Remote State Outputs documentation #1436,,0
2659,chore: update LICENSE,0.9366616,chore: update LICENSE #2268,chore: npm-check-updates && yarn upgrade,1
2660,Merge pull request #1159 from hashicorp/adjust-aws-examples,0.5540963,chore(examples): Use AWS provider 3.0 #1155,Ran npm-check-updates and yarn upgrade to keep the yarn.lock file up-to-date.,0
2661,fix: correctly denote all of our redirects as temporary because they might change,0.9625237,fix: correctly denote all of our redirects as temporary because they might change #2218,feat(lib): Support impersonate_service_account and _delegate on gcs backend,1
2662,fix(cli): add sentry DSN in build process,0.9719105,fix(cli): add sentry DSN in build process #2085,,1
2663,Make providers overwriteable in a single file,0.55019665,Fix providers file workflow (#66),Resolves #1613,0
2664,fix(lib): Add new optional AWS route attributes,0.97131324,fix(lib): Add new optional AWS route attributes #1755,chore(docs): add vercel config,1
2665,feat(lib): Support forEach in datasources and modules,0.68958277,feat(lib): Create assets for local modules #1476,,0
2666,feat(cli): add support for var files and auto-loading,0.6201374,feat(cli): plug provider add command in help printed after initializing a new cdktf project #1833,feat(cli): properly shutdown subprocesses on abort,0
2667,add a note about potential breaking change,0.78274107,Breaking Changes,"AbortController shipped in node 14.17, but only with an experimental feature flag. This is hard to set and node 14 is LTS so we don't want to update to node 16, therefore this polyfill will help us in the meantime.",1
2668,chore(docs): update link to AWS Constructs base class,0.9175126,chore(docs): link to AWS Constructs base class #1473,,1
2669,docs(hcl2cdk): convert and import,0.712759,chore(docs): update convert docs #1701,,1
2670,chore(deps): add script to update all snapshot tests,0.9832352,chore(deps): add script to update all snapshot tests #1139,This is needed for node 14 and can be dropped once we upgrade to node 16,1
2671,override maven options env variable,0.45750466,Set NODE_ENV for CLI #129,Closes #771,0
2672,fix(cli): deduplicate logs coming from TFC,0.6774844,fix(cli): only log if logs are sent #1365,,0
2673,fix(hcl2cdk): Handle multi-line strings better,0.691856,fix(hcl2cdk): Support conversion of functions that have variate arguments at the end #2833,"feat: stream terraform output on diff, deploy, and destroy",0
2674,Merge pull request #1254 from spinningarrow/patch-1,0.50297284,IWinrmProvisionerConnection to WinrmProvisionerConnection,,0
2675,fix: detect destroys on windows / TF version,0.97425747,fix: detect destroys on windows / TF version #2486,Co-authored-by: Ansgar Mertens ansgar@hashicorp.com,1
2676,chore: follow precedence in varfile loading,0.48234236,chore(docs): document pinning state to stack #1504,,0
2677,Merge pull request #1489 from hashicorp/automation/yarn-upgrade,0.51825124,chore: create upgrade guide #2494,,0
2678,Update providers-and-resources.html.md,0.6167064,chore(docs): Update remote-backends.mdx #2324,,0
2679,Singleton stack file,0.56927896,chore(docs): document pinning state to stack #1504,,0
2680,Add constructs documentation to website,0.8801945,chore(docs): Add constructs documentation to website #1338,,1
2681,docs(cli): update help output removing import,0.6900239,fix(cli): fix import path for Manifest (was relative) #1037,,0
2682,update tests,0.72662264,chore: ensure we run all tests on dependency updates #2323,,1
2683,fix(hcl2cdk): escape dollars also in the last part of the string,0.54228824,fix(hcl2cdk): suffix variables and locals #845,,0
2684,chore: release 0.9.1,0.7199745,chore(release): Pre-releases should use next version #1257,,1
2685,tests(lib): add unit tests for forEach support for datasources and modules,0.72854316,feat(lib): expose unit testing helpers #942,,1
2686,change how alias is defined in TerraformProvider,0.8483949,Fix TerraformProvider alias definition #332,,1
2687,Merge pull request #1341 from hashicorp/remove-jsii-version-from-snapshots,0.5615908,chore(tests): remove jsii version from snapshot #1341,,0
2688,Add support for terraform escape sequences,0.81659037,feat: Extend support for Terraform expressions #1131,,1
2689,Merge pull request #697 from hashicorp/dependabot/npm_and_yarn/lodash-4.17.21,0.5055584,chore: fix finalizing the Sentry release #2379,,0
2690,Merge pull request #899 from hashicorp/fix-number-synthesis-issue-679,0.6443267,fix(lib): synthesise numbers correctly #899,,0
2691,chore: disable python edge test,0.9609406,chore: disable python edge test #2369,,1
2692,Merge pull request #1757 from hashicorp/add-option-to-disable-version-check,0.5358124,feat(cli): support refresh only option for diff and deploy #1851,,0
2693,chore(docs): add a first set of markers to typescript documentation example and update the docs with them,0.7262882,chore(docs): Add note and copyediting to providers page #1127,,1
2694,feat(cli): implement parallel destroy,0.6309798,feat(cli): support generating provider bindings in parallel #2111,,0
2695,Drop custom symlink for generic plugin cache setting,0.58630216,chore: cache examples and terraform plugins #2213,,0
2696,fix: pass providers so that provider schema can be read,0.6326109,fix(provider-generator): strictly adhere to the provider schema #1792,,0
2697,renamed build workflow job name to include package,0.57020855,"                    .workspaces(new NamedCloudWorkspace(""demo""))",,0
2698,Merge pull request #138 from hashicorp/move-state-out-of-cdktfout,0.52944064,fix(hcl2cdk): handle no providers passed and add cdktf import for remote state data sources #1561,,0
2699,chore: use catch all argument,0.48255885,"fix: Allow ""all"" as ignoreChanges lifecycle value #1848",,0
2700,fix(provider-generator): attributes on resources should not be undefined,0.9642813,fix(provider-generator): attributes on resources should not be undefined #1310,chore: npm-check-updates && yarn upgrade Ran npm-check-updates and yarn upgrade to keep the yarn.lock file up-to-date.,1
2701,output -> cdktf.out can't exist before synthing,0.7349609,Fix output directory argument for cdktf synth (#62),,1
2702,chore: create pull request template,0.59572655,Add support for remote templates #645,Ran npm-check-updates and yarn upgrade to keep the yarn.lock file up-to-date.,0
2703,1st pass using lock provider check,0.61151695,chore: additionally lock providers for linux only #2593,chore(docs): Update page title and description,0
2704,chore: Add constructs-scope example in typescript,0.73723745,Typescript Example,,1
2705,refactor(cli): parse json according to schema,0.9671184,refactor(cli): parse json according to schema #2286,fix(cli): fix go template stack name replacing for Terraform Cloud,1
2706,feat(provider-generator): add help message to map types,0.65868247,Add support for List of Maps in schema generator #229,,0
2707,Improve python/multiple-stacks test run times,0.6456492,chore: increase parallel limit (10->30) to speed up integration tests #2487,fix: Support Auto Updating Snapshots for forks,0
2708,Merge branch 'main' into improve-cli-error-handling,0.62148595,fix(cli): improve cli error handling #1687,,0
2709,Update website/docs/cdktf/community.html.md,0.61534286,chore(docs): Update docs link #1162,,0
2710,chore(hcl2cdk): adjust link in error for new label name,0.8657402,fix(hcl2cdk): adjust link for label renaming #852,chore(docs): Remove broken link on overview page,1
2711,fix(provider-generator): escape hyphens in provider names for Go package identifiers,0.97657293,fix(provider-generator): escape hyphens in provider names for Go package identifiers #1252,,1
2712,ability to fake cdktf.json location for testing,0.6111351,feat(lib): produce stable cdk.tf.json output #1454,,0
2713,update python tests to synth rather than build,0.6849202,Enable synthesis to Python,,0
2714,Page review for providers and outputs,0.64953375,chore(docs): Combine Resources and Providers pages #1092,due to some weak typings we have to use a lot of ! syntax in this file,0
2715,chore: document development workflow changes,0.70742625,chore(docs): Add note and copyediting to providers page #1127,,1
2716,feat(asset): implement archiving,0.61374325,feat(lib): make asset paths change if asset content changes #769,Co-authored-by: Ansgar Mertens ansgar@hashicorp.com,0
2717,Merge pull request #2379 from hashicorp/fix-sentry-finalize-release,0.66141427,chore: fix finalizing the Sentry release #2379,,0
2718,use explicit node call,0.55335164,Set NODE_ENV for CLI #129,,0
2719,add next version,0.6159052,// Version 0.13,,0
2720,fix(docs): apply prettier,0.6502522,fix(docs): adjust setup handling in docs #1048,,0
2721,chore(docs): fix lint,0.792909,chore(docs): fix some docs #2483,,1
2722,chore(docs): document new watch command,0.6971408,chore(docs): update aspect docs #1690,,0
2723,adds package-lock,0.62988615,fix(lib): Lock jsii version #1166,,0
