Commit Message,Score,Correspond Changelog Sentence,Commit Description,Label
"if both text/markdown and text/html are writable, assume it is Markdown source and send only markdown",0.28208932,- ensure JSONText is never base64-encoded (#1081) (@stevengj),,0
Merge pull request #165 from JuliaLang/clear_output,0.59476393,Merged pull requests:,clear_output support (not working yet) for #134,0
clear_output support (fixes #134),0.5457717,- flush stdio before display (#999) (@stevengj),,0
Merge pull request #325 from JuliaLang/ipython_v3,0.5938538,Merged pull requests:,"switch to IPython v3 protocol, require IPython 3.0 or later",0
instructions for checkout out ipython2 branch,0.43248498,"MIME fixes (#771, #773), store prefs in depot path (#760), fix IPython ""magic"" error reporting (#769).",,0
"switch to IPython v3 protocol, require IPython 3.0 or later",0.5553051,"MIME fixes (#771, #773), store prefs in depot path (#760), fix IPython ""magic"" error reporting (#769).",,0
Merge pull request #319 from garrison/juliav03,0.62514746,Merged pull requests:,Updates to reflect julia 0.3 now being required,0
Updates to reflect julia 0.3 now being required,0.6360105,"Drop Julia 0.5 (#642), redirect fixes (#641), JupyterLab fixes, module-evaluation control (#651), compatibility with ZMQ.jl master.",,0
Merge pull request #315 from dhoegh/patch-1,0.7059533,Merged pull requests:,Fix #305,1
Merge pull request #314 from minrk/heartbeat,0.68823004,Merged pull requests:,use QUEUE(ROUTER) for heartbeat,0
Adapt IJulia to use the new keyword argument added in JuliaLang/julia#11112 to fix #305,0.716076,- IJulia is not starting julia 1.9 kernel (#1076),,1
use QUEUE(ROUTER) for heartbeat,0.43696904,- fix heartbeat on 1.6 (#985) (@stevengj),instead of FORWARDER(REP) due to change in zmq_proxy in 4.0.6.,0
Merge pull request #296 from yuyichao/ijulia-system,0.7313221,Merged pull requests:,Better support for system-wise install,1
tenative improved object_info_request handler for #219,0.38989705,- Proposed fix for #986. (#989) (@rgobbel),,0
"documentation for JuliaLang/julia#11064, and also make it possible to override the defaults via LINES and COLUMNS environment variables in the shell where IJulia is launched",0.74251014,"Makes Conda the default during installation (#501), IJulia.history() function analogous to IPython %history (#500), improved Julia 0.6 compatibility.",,1
Merge pull request #306 from malmaud/koala_fix,0.6699375,Merged pull requests:,Fix Codemirror mode for proper emoji tab completion.,0
Fix Codemirror mode for proper emoji tab completion.,0.5120466,- tab completion and unicode not working in Jupyter notebook (#1034),,0
Merge pull request #303 from bnels/fix_history,0.7071895,Merged pull requests:,Update clear_history to use Range instead of Ranges,1
changed Ranges to Range,0.3358226,References to output value of cells kept indefinitely (#851),,0
support system wise install ijulia,0.70233047,- Trouble installing IJulia (#923),,1
Fix hyphen problem for debug build - #298,0.42584378,- won't catch the wrong syntax (#994),,0
Merge pull request #298 from rgbkrk/patch-1,0.63820267,Merged pull requests:,Remove space in kernel spec path,0
Siphon bug with a hyphen,0.38819876,- won't catch the wrong syntax (#994),,0
Remove space in kernel spec path,0.47290748,- Correct kernelspec name (#1004) (@jks-liu),,0
work around JuliaLang/julia#10935 -- make sure IJulia.set_verbose(blah) does not crash IJulia,0.7774528,- IJulia is not starting julia 1.9 kernel (#1076),,1
update for the tupocolypse (JuliaLang/julia#10380); no point in pretending to support Julia 0.2 any more since Compat doesn't support it,0.7437642,"Julia 0.6 fixes, dropping Julia 0.4, switching to MbedTLS instead of Nettle.",,1
make sure Python uses UTF-8 when printing the profile path (fix #292),0.4906041,- Error in utf-8 decoding (#927),,0
0.4 compatibility,0.8499752,0.7 compatibility,,1
Merge pull request #280 from JuliaLang/cjh/multijulia,0.6251178,Merged pull requests:,Allow multiple versions of Julia as IPython kernels,0
Allow multiple versions of Julia as IPython kernels,0.6309197,- Kernel does not start with Julia 1.9 (#1062),"This change allows multiple Julia versions to be registered as IPython/Jupyter 3.0 kernels. You will get entries like Julia 0.3.6 Julia 0.4.0-dev Julia 0.4.0-dev debug depending on which Julia binary is used to build IJulia.jl. To get multiple Julia versions available as IPython kernels, you will need to rebuild IJulia from within each Julia binary. Ref: #224",0
Merge pull request #210 from Carreau/kernelspec,0.6663836,Merged pull requests:,add kernelspec for IPython 3.0,0
install all files on all versions of IPython,0.4932809,"MIME fixes (#771, #773), store prefs in depot path (#760), fix IPython ""magic"" error reporting (#769).",,0
fix ? help in Julia 0.4,0.6341722,"Julia 0.6 fixes, dropping Julia 0.4, switching to MbedTLS instead of Nettle.",,0
Merge pull request #276 from Carreau/fixcustom30,0.6660874,Merged pull requests:,Fix custom.js for 3.0,0
Merge remote-tracking branch 'origin/pr/276' into kernelspec,0.42598614,- Correct kernelspec name (#1004) (@jks-liu),,0
use kwarg,0.317574,- TagBot: use DOCUMENTER_KEY (#944) (@DilumAluthge),,0
polish for IPython 3.0.0-rc,0.4813229,"MIME fixes (#771, #773), store prefs in depot path (#760), fix IPython ""magic"" error reporting (#769).",,0
specify type for kwarg,0.3272115,"Support pkg commands in 0.7 (#715), use soft global scope in 0.7 (#720), unique completions (#712).",,0
fix more kyle comments,0.35142514,Fix #776,,0
"overrite resources, compat and simplify logic",0.2107665,- ZMQ unsatiable constraints (#971),,0
Add kernelspec for IPython 3.0,0.6520356,How to install kernelspec to $CONDA_PREFIX/share/jupyter/kernels/? (#865),There is still the limitation that object inspection will not work with identifiers that have a bang (!) in the name while IJulia does not support the kernelspec v5.,0
add debugging info,0.46425885,"- Add notes on fixing ""Connecting to kernel"" failures. (#1030) (@jd-foster)",,0
indent block,0.552576,- Indentation error (#1070),,0
fix custom.js for 3.0,0.33569205,Fix more 0.7 deprecations.,,0
ditch _* history vars (close #267),0.46005124,"Fix shell mode (#703), Revise (#708), and history (#706).",,0
fix shell commands in Julia 0.4 due to Base.repl_cmd API change,0.6447586,- support repl_ast_transforms in Julia 1.5 (#947) (@stevengj),,0
Merge pull request #261 from darwindarak/dd/no_exit_on_sigint,0.52913976,Merged pull requests:,Prevent SIGINT from killing the kernel,0
Make fix apply to only VERSION >= 0.3,0.55832666,Fix more 0.7 deprecations.,,0
Prevent SIGINT from killing the kernel,0.43225926,- Kernel on Jupyter Notebook constantly dies  (#1022),,0
Merge pull request #259 from afniedermayer/fix-bug-clear_history,0.60740155,Merged pull requests:,fix bug in clear_history,0
fix bug in clear_history,0.44733045,"Fix shell mode (#703), Revise (#708), and history (#706).","The original code gave this error message: delete! has no method matching delete!(::Dict{Integer,UTF8String}, ::Int64, ::Nothing) while loading In[5], in expression starting on line 1 in clear_history at /home/andras/.julia/v0.3/IJulia/src/history.jl:21  in clear_history at /home/andras/.julia/v0.3/IJulia/src/history.jl:31  in clear_history at /home/andras/.julia/v0.3/IJulia/src/history.jl:35",0
silence another Julia 0.4 warning,0.58568555,"Julia 0.6 fixes, dropping Julia 0.4, switching to MbedTLS instead of Nettle.",,0
fix #251,0.7312595,Fix #776,,1
Julia 0.4 compat,0.7122229,"Drop Julia 0.6 support, use the ZMQ 1.0 API (#729).",,1
"Allow comm_open messages to contain some data, set via a kwarg to Comm constructor",0.29760757,- UndefVarError: execute_msg not defined (#1077),,0
Merge pull request #240 from randy3k/stdio,0.69231784,Merged pull requests:,add a little pause after flush_cstdio(),0
another attempt to #238,0.4145609,Fix #776,,0
"bug fixes in @compat; make debugging easier by adding a capture_stderr const flag, make some changes for #238 (not fixed yet)",0.5256669,"- Unlike in REPL, passing (e, catch_backtrace()) to the @error macro displays unreadable raw stacktrace instead of text representation (#1043)",,0
get rid of splitkeep now that we can use @compat,0.3537275,- Update [compat] to allow MbedTLS v1 (#912) (@jaakkor2),,0
update Dict literals via Compat package (closes #235),0.3646816,"MIME fixes (#771, #773), store prefs in depot path (#760), fix IPython ""magic"" error reporting (#769).",,0
Merge pull request #230 from jkroso/fix/isinteractive,0.55446553,Merged pull requests:,set isinteractive via the command line,0
fix option passing,0.32019928,Fix #776,,0
backwards compat,0.36875758,0.7 compatibility,,0
set isinteractive via the command line,0.34445912,Feature Request : Allow IJulia to run on root. (#895),Otherwise it looks like ~/.juliarc.jl will always be loaded too early,0
workaround ipython/ipython#6383,0.5713403,"MIME fixes (#771, #773), store prefs in depot path (#760), fix IPython ""magic"" error reporting (#769).",,0
avoid split deprecation warning in Julia 0.4,0.51892126,- redirect_stdio is broken by Julia 1.7 (#986),,0
"empty the displayqueue after executing posterror hooks, not before",0.30160362,- flush stdio before display (#999) (@stevengj),,0
a more useful return value for undisplay(x) (-> x),0.27705565,- respect should_complete return value from REPLCompletions.completions (#993) (@stevengj),,0
formatting,0.41219106,- Indentation error (#1070),,0
moved the updating section,0.40627733,- Update help link (#1006) (@raphbacher),,0
README updates,0.47608387,Fix more 0.7 deprecations.,,0
"remove python->julia magics etc., which have been moved to JuliaLang/pyjulia (see JuliaLang/pyjulia#1)",0.7292795,"- Add kwarg julia_cmd to installkernel (to support JupyterHub with containers, etc.) (#948) (@oschulz)",,1
Merge pull request #216 from garborg/master,0.72838163,Merged pull requests:,Update README to reflect subsequent Julia releases,1
Update README to reflect subsequent Julia releases,0.60019755,"Drop Julia 0.5 (#642), redirect fixes (#641), JupyterLab fixes, module-evaluation control (#651), compatibility with ZMQ.jl master.",,0
Merge pull request #190 from shashi/comm_rebase,0.70326734,Merged pull requests:,Widget Messaging Protocol (IPEP 21),1
Fix Comm constructor,0.31268367,"- When IJULIA_NODEFAULTKERNEL is defined, exe is not. (#1075)",,0
Send parent message ID in status messages.,0.43937707,- Convert uuid4 to a string before using as msg_id (#972) (@bluesmoon),,0
IPEP 21: Widget Messaging Protocol,0.3923405,make work with ipc transport (#868) (marius311),,0
Merge pull request #208 from stonebig/init_fix,0.5540965,Merged pull requests:,core module is at the same level of directory,0
core module is at the same level of directory,0.314661,Use DEPOT_PATH[1]... to load startup_ijulia.jl (#846) (macd),,0
Merge pull request #207 from stonebig/eval_fix,0.5513054,Merged pull requests:,"switch from ""run"" to ""eval"", as did the pyjulia project",0
minimal 'eval' patch to align to pyjulia change,0.4218826,Slight fix to handling of environment variables for jupyter subcommands (137aed4c98a4be788b6a73df2ef74c2667be5611).,link,0
julia.eval has replaced julia.run,0.631656,- Jupyterlab won't work with Julia 1.5 and Python 3.7.7 (#939),,0
"replace readavailable with eof/nb_available/readbytes, as suggested by @vtjnash in JuliaLang/julia#7478",0.5723715,"Julia 0.6 fixes, dropping Julia 0.4, switching to MbedTLS instead of Nettle.",,0
throw an error if notebook() is run from a running IJulia kernel,0.5202483,"- IJulia in local environment, dead kernel (#1021)",,0
add notebook() function to launch the notebook from the REPL as discussed in #199,0.38326192,use _set_conda_env to launch jupyter (#900) (stevengj),,0
Merge branch 'quinnj-jq/reorg2',0.5847746,Merged pull requests:,,0
Merge branch 'jq/reorg2' of link into quinnj-jq/reorg2,0.51196826,Merged pull requests:,Conflicts:     src/stdio.jl,0
send busy/idle status messages for all message handlers (ipython/ipython#6055),0.34871164,"Fix #855, add required status field for JupyterLab 1.0 (#856) (drewrobson)",,0
Merge pull request #201 from Carreau/fix-193,0.66484624,Merged pull requests:,Shot in the dark for #193,0
Shot in the dark for #193,0.35381764,- Zero before another number breaks ijulia (#907),,0
add parens around global multiple assignment (paranoia about future problems like JuliaLang/julia#7297),0.42931694,- support repl_ast_transforms in Julia 1.5 (#947) (@stevengj),,0
fix #191: only allow one shell command per cell,0.45884678,"Fix shell mode (#703), Revise (#708), and history (#706).",,0
Merge pull request #189 from shashi/metadata-fix,0.64668286,Merged pull requests:,Import metadata in inline.jl,0
Import metadata in inline.jl,0.44191617,- Add documentation with Documenter.jl (#941) (@jlumpe),,0
Take off verbose logging,0.4543853,- Replace SimpleLogger with ConsoleLogger (#1045) (@BoZenKhaa),,0
Move IJulia globals into an init(ARGS) function that can be called from the kernel.jl file. This allows for IJulia precompilation.,0.76874393,- Load InteractiveUtils from the IJulia namespace in src/kernel.jl. (#951) (@fredrikekre),,1
Merge pull request #183 from shashi/metadata,0.7036432,Merged pull requests:,Allow modules to attach metadata in IPython display_data & pyout messages,1
Allow modules to attach metadata in IPython display_data & pyout messages,0.46748453,"MIME fixes (#771, #773), store prefs in depot path (#760), fix IPython ""magic"" error reporting (#769).",,0
"fix Unicode completion bug: IPython completion requests use character index, not byte index",0.65662676,- tab completion and unicode not working in Jupyter notebook (#1034),,0
"use libuv thread functions to ease portability, and hopefully work around #178",0.36500153,Fix more 0.7 deprecations.,,0
fix #173,0.79682404,Fix #794.,,1
support flush on STDOUT/STDERR (fix #172),0.57617956,- flush stdio before display (#999) (@stevengj),,0
use Base.REPLCompletions (Julia 0.3) if available,0.68955266,- support repl_ast_transforms in Julia 1.5 (#947) (@stevengj),,0
silent should not suppress storage of In or incrementing execution counter (fix #171),0.39551798,Interrupt messages on Windows (#804) and warning for incorrect kernel path (#809).,,0
Fix typos in 6ca218ee,0.45231366,Fix #776,,0
"Also try ipython.bat, for IPython 2.0 on Windows",0.47694305,Calls to jupyterlab() always ask to install on Windows (#866),,0
Merge pull request #163 from JuliaLang/malmaud/unicode,0.59120214,Merged pull requests:,Syntax highlighting support added for non-ASCII unicode characters in identifiers,0
Syntax highlighting support added for non-ASCII unicode characters in identifiers,0.6202934,- [feature request] syntax highlight in vscode (#933),,0
Update binary name for julia-basic -> julia rename,0.5722813,- support repl_ast_transforms in Julia 1.5 (#947) (@stevengj),link,0
Merge pull request #162 from slundberg/master,0.71570194,Merged pull requests:,Drop custom tooltip.js to address #157,1
Added support for ipython 1.x,0.58071977,"MIME fixes (#771, #773), store prefs in depot path (#760), fix IPython ""magic"" error reporting (#769).",,0
Drop custom tooltip.js to address #157,0.25699717,- Update help link (#1006) (@raphbacher),,0
Merge pull request #161 from Zulko/patch-1,0.69645333,Merged pull requests:,"Added ""install IJulia --from a Julia console--""",0
"Added ""install IJulia --from a Julia console--""",0.7978565,- IJulia is not starting julia 1.9 kernel (#1076),"Coming from the Python world it took me some time to realize that Pkg.add(""Julia"") was actually not a python command so I added 3 words to help the next pythonista.",1
Merge pull request #154 from cmey/patch-1,0.72500676,Merged pull requests:,Update README.md,1
Merge pull request #150 from cdsousa/favicon,0.6644718,Merged pull requests:,add favicon to Julia IPython profile (partially fixes #70),0
add favicon to Julia IPython profile (partially fixes #70),0.53973126,- Add Julia svg logo (#1053) (@steff456),,0
Merge pull request #147 from christopherdavidwhite/master,0.77474636,Merged pull requests:,Add space to fix incorrect macro call.,1
Add space to fix incorrect macro call.,0.44314983,- Indentation error (#1070),"Previously, Pkg.add(""IJulia"") or julia deps/build.jl failed with an error message, the meat of which was ""wrong number of arguments while loading /home/christopher/.julia/v0.3/IJulia/deps/build.jl, in expression starting on line 79"". This was ultimately caused by the fact that the macro name @windows? was immediately followed by an open parenthesis. The parentheses were intended to mark the first argument of @windows?---this argument itself is a nontrivial expression---but instead, because there was no space, Julia expected all the arguments to be inside the parentheses. Adding a space fixes this problem (see link).",0
use julia-basic.exe on Windows for version >= 0.3- (fix #145),0.71393305,"Julia 0.6 fixes, dropping Julia 0.4, switching to MbedTLS instead of Nettle.",,1
make cfunction const,0.22611044,- Error: syntax: undefined reference in AST (#960),,0
Merge pull request #142 from cdsousa/fixheartbeat,0.6526644,Merged pull requests:,Fix heartbeat pthread_create segmentation fault,0
Fix heartbeat pthread_create segmentation fault,0.52089703,- fix heartbeat on 1.6 (#985) (@stevengj),,0
Merge pull request #140 from JuliaLang/malmaud/qt_syntax,0.5586861,Merged pull requests:,Enable syntax highlighting in the QT Console,0
Merge pull request #141 from JuliaLang/malmaud/n139,0.60702026,Merged pull requests:,Fix #139,0
Fix #139,0.80141765,Fix #794.,,1
Enable syntax highlighting in the QT Console,0.63983285,- [feature request] syntax highlight in vscode (#933),,0
ipython may be called ipython2 (fix #133),0.61194336,"MIME fixes (#771, #773), store prefs in depot path (#760), fix IPython ""magic"" error reporting (#769).",,0
Merge pull request #125 from JuliaLang/malmaud/preexecute,0.5744795,Merged pull requests:,Added pre-execute hooks,0
Added pre-execute hooks,0.43135583,- Add to startup (#922),,0
bugfix to readline(Pipe) for non-stdin,0.37662792,- flush stdio before display (#999) (@stevengj),,0
Merge pull request #114 from glesica/master,0.71009696,Merged pull requests:,Update install instructions with Pkg.update() call.,1
Revise wording to not mention building since problem exists with packages as well.,0.52933,Set version to 1.21.0. (#899) (fredrikekre),,0
Update install instructions with Pkg.update() call.,0.49812338,"Support pkg commands in 0.7 (#715), use soft global scope in 0.7 (#720), unique completions (#712).",,0
"don't close(STDIN), seems to crash Julia (fix #111)",0.6466454,- redirect_stdio is broken by Julia 1.7 (#986),,0
make reads from STDIN fail rather than freeze until we can get a more general solution to #42,0.3222548,- flush stdio before display (#999) (@stevengj),,0
"make readline(STDIN) work, for #42, though no other reads from STDIN work",0.32992497,- flush stdio before display (#999) (@stevengj),,0
do blocks and indent size fixed in julia.js,0.40130773,"Julia 0.6 fixes, dropping Julia 0.4, switching to MbedTLS instead of Nettle.",,0
Added backtick support to julia.js,0.5438007,- support repl_ast_transforms in Julia 1.5 (#947) (@stevengj),,0
Fixed infix .. syntax highlighting in julia.js (fix #104),0.57658565,"Julia 0.6 fixes, dropping Julia 0.4, switching to MbedTLS instead of Nettle.",,0
Merge pull request #103 from Carreau/fix-tooltip,0.5658178,Merged pull requests:,fix tooltip on dev version,0
"run .juliarc.jl file on startup, fixes #64",0.6903549,- IJulia is not starting julia 1.9 kernel (#1076),,0
detect ipython or ipython 3 (fix #102),0.6089392,"MIME fixes (#771, #773), store prefs in depot path (#760), fix IPython ""magic"" error reporting (#769).",,0
bash hack should no longer be needed on OSX,0.38205433,- Can't Use on OSX (#967),,0
Merge pull request #101 from malmaud/n17_v3,0.69576895,Merged pull requests:,Fixed indenting for list comprehensions,0
fix tooltip on dev version,0.3363625,Fix more 0.7 deprecations.,,0
Fixed indenting for list comprehensions,0.34091452,- Indentation error (#1070),,0
send interrupts to request-handler task (fix #98),0.49073464,Interrupt messages on Windows (#804) and warning for incorrect kernel path (#809).,,0
fix mkpath in copy_config (don't add juliaprof to path twice,0.5963373,"- Add kwarg julia_cmd to installkernel (to support JupyterHub with containers, etc.) (#948) (@oschulz)",,0
Merge pull request #97 from malmaud/n17_v2,0.712631,Merged pull requests:,Fixed some parsing errors involving <: and :: in notebook syntax highlig...,1
Fixed bug in range parsing in notebook syntax highlighting,0.5545418,- [feature request] syntax highlight in vscode (#933),,0
Fixed some parsing errors involving <: and :: in notebook syntax highlighting,0.5043964,- [feature request] syntax highlight in vscode (#933),,0
Merge pull request #96 from malmaud/n17,0.7345942,Merged pull requests:,added julia syntax highlighting. Implements #17,1
"logging call removed from custom.js, mkpath factored out in build.jl",0.48387086,- IJulia/kernel.jl should not change the global_logger (#1018),,0
fixed misinterpretation of ' as string delimeter instead of transpose in notebook syntax highlighting,0.52936304,Syntax highlighting issue in JupyterLab 1.0 (#855),,0
added support for symbols to julia notebook syntax highlighting,0.6327889,- [feature request] syntax highlight in vscode (#933),,0
added julia syntax highlighting. Implements #17,0.64587885,- [feature request] syntax highlight in vscode (#933),,0
Merge pull request #95 from Carreau/re-hilight,0.642193,Merged pull requests:,force re-highlighting of codecell after julia-mode loading,0
force re-highlighting of codecell after julia-mode loading,0.4489156,Syntax highlighting issue in JupyterLab 1.0 (#855),,0
tweaks to copy_config in build script,0.30003744,- Don't use --startup-file=yes (it is default anyways). (#963) (@fredrikekre),,0
overwrite config files if they have changed,0.277881,- Compare kernel.jl files rather than filenames (#1025) (@bluesmoon),,0
Merge pull request #89 from Carreau/ijm,0.70705885,Merged pull requests:,layout logics for julia mode,1
layout logics for julia mode,0.44069862,- support repl_ast_transforms in Julia 1.5 (#947) (@stevengj),,0
updated README,0.5313252,- Update help link (#1006) (@raphbacher),,0
backwards compatibility for pending mimewritable API change,0.5365344,Add support for vega-lite 4 MIME type (#890) (davidanthoff),,0
Merge pull request #78 from GlenHertz/patch-1,0.7227961,Merged pull requests:,Fix links to IPython config docs and try to clarify what needs to be don...,1
rm trailing whitespace from match (since on Windows there is a trailing \r),0.24720511,- won't catch the wrong syntax (#994),,0
Pkg2 -> Pkg,0.5255887,"Support pkg commands in 0.7 (#715), use soft global scope in 0.7 (#720), unique completions (#712).",,0
Merge pull request #79 from nfoti/master,0.74857026,Merged pull requests:,libjulia-release -> libjulia,1
libjulia-release -> libjulia.,0.5534836,IJulia v1.23.1,,0
"overwrite KernelManager.kernel_cmd if it has been changed (e.g. if the path to Julia changes), so that users no longer need to delete .ipython/profile_julia to reconfigure",0.56038606,"- Add kwarg julia_cmd to installkernel (to support JupyterHub with containers, etc.) (#948) (@oschulz)",,0
Fixed grammar and link to stable docs (instead of dev),0.4212014,- Documentation? (#936),,0
Fix links to IPython config docs and try to clarify what needs to be done,0.6246142,"MIME fixes (#771, #773), store prefs in depot path (#760), fix IPython ""magic"" error reporting (#769).",I found this section confusing so I tried to improve it.  Not sure if it is correct for Windows though...,0
don't deallocate heartbeat threadid (may help #74),0.61526394,- fix heartbeat on 1.6 (#985) (@stevengj),,0
workaround for JuliaLang/julia#4259,0.69938886,"Drop Julia 0.6 support, use the ZMQ 1.0 API (#729).",,0
Merge pull request #69 from JuliaLang/kf/win,0.65565723,Merged pull requests:,some windows fixes,0
some windows fixes,0.42704388,"Fix shell mode (#703), Revise (#708), and history (#706).",,0
make ipython const,0.46233034,use _set_conda_env to launch jupyter (#900) (stevengj),,0
work around #60,0.30061078,- Update help link (#1006) (@raphbacher),,0
"typo, fix incorrect deletion of hyphen from compound adjective",0.35551476,Fix #776,,0
use .profile in finding ipython on OSX (fix #60),0.5259426,"MIME fixes (#771, #773), store prefs in depot path (#760), fix IPython ""magic"" error reporting (#769).",,0
change contains to in,0.19300771,Fix #776,,0
fix deprecated error_show,0.4942772,"- Unlike in REPL, passing (e, catch_backtrace()) to the @error macro displays unreadable raw stacktrace instead of text representation (#1043)",,0
REQUIRE: replace GnuTLS with Nettle.,0.4424457,"Julia 0.6 fixes, dropping Julia 0.4, switching to MbedTLS instead of Nettle.",,0
Merge pull request #53 from staticfloat/nettle,0.68172234,Merged pull requests:,Switch from GnuTLS -> Nettle,0
"Switch from GnuTLS -> Nettle, allowing for compilerless installation on OSX",0.4067718,"Julia 0.6 fixes, dropping Julia 0.4, switching to MbedTLS instead of Nettle.",,0
eliminate deprecation warnings,0.68462443,Fix more 0.7 deprecations.,,0
initialize execute_msg to a Msg in case there is an error before the first code is executed,0.5005709,- UndefVarError: execute_msg not defined (#1077),,0
"julia binary is now called julia-basic, not julia-release-basic",0.67074573,- Kernel does not start with Julia 1.9 (#1062),,0
rows and cols to display should not depend on terminal where IJulia kernel is started; pick a sensible default (see JuliaLang/julia#4117),0.75414735,- IJulia is not starting julia 1.9 kernel (#1076),,1
README logo: shrink and center,0.43878114,- Use logo in the documentation (#1064) (@hyrodium),,0
"flush pending stdio on error, add posterror_hooks",0.4765336,- flush stdio before display (#999) (@stevengj),,0
