Index,Commit Message Abstract,Score Abstract,Corresponding Changelog Sentence Abstract,Commit Desription Abstract,Label
1,Set version to 1.23.1.,0.66280556,Set version to 1.21.0. (#899) (fredrikekre),update docs/make.jl to copy logo files update path variables update gitignore fix typo,0
2,Enables setting the the header message under which stream messages are sent,0.44299477,Interrupt messages on Windows (#804) and warning for incorrect kernel path (#809).,,0
3,Allows adding metadata to comm_open message (#583),0.48160902,add info on nteract to README.md? (#841),,0
4,Syntax highlighting support added for non-ASCII unicode characters in identifiers,0.5308455,- [feature request] syntax highlight in vscode (#933),,0
5,object_info_request for #4,0.5421021,- Feature: show methods applicable to object  (methodswith) (#1033),,0
6,Add new notebook that shows matplotlib integration.,0.49673298,Add InlineIOContext with Jupyter property. (#876) (travigd),Correct kernelspec name Add test for kernelspec_name,0
7,"added display_text (text/plain) to display machinery, some rearrangements; only display 1 arg at a time (at least for now), as allowing display(x...) led to stack overflow in some cases because Julia gets confused about which routine to call",0.4467371,"vega-lite display (#621, #611), IJulia.qtconsole() (#620), 0.7 fixes, display of arbitrary MIME types is now passed through to notebook.",pkg.julialang.org is now an empty page (url used as a package server),0
8,changed Ranges to Range,0.4384221,Fix more 0.7 deprecations.,Add Julia svg logo Add new svg path to kernelspecs,0
9,help for %file and %paste,0.44731498,- support for pdf plot output (#1035),Co-authored-by: Jan Mrkos mrkosja1@fel.cvut.cz,0
10,Fix #139,0.72406626,Fix #776,,1
11,default to soft global scope (#720),0.62374645,- Handling of local y = (x = i) in soft scope (#938),,0
12,Allow failures for builds on julia nightlies (#622),0.5505413,IJulia v1.23.1,Fix broken link Update docs/src/manual/usage.md Co-authored-by: Fredrik Ekre ekrefredrik@gmail.com,0
13,overwrite config files if they have changed,0.4836008,- Jupyter Kernels Getting Overwritten (#908),"Comparing filenames means we end up warning on directory level symlinks or file level hardlinks. Using stat instead compares the device, inode, and other details about the file itself.",0
14,Add documentation with Documenter.jl (#941),0.9427459,- Add documentation with Documenter.jl (#941) (@jlumpe),"If you add IJulia to a different environment, then Jupyter won't be able to launch the IJulia kernel automatically.  I got bit by this recent.",1
15,added logo and Pkg build file (to install Julia IPython profile; punt on installing IPython itself),0.63587195,"- Pkg.add(""IJulia"") git proxy error without using proxy (#916)",,0
16,Fix #31,0.7509064,Fix #776,,1
17,ditch _* history vars (close #267),0.5052049,IJulia v1.21.4,,0
18,fix backtraces to exclude the IJulia functions,0.55504256,- IJulia doesnt work (#926),,0
19,initialize execute_msg to a Msg in case there is an error before the first code is executed,0.41351175,- Convert uuid4 to a string before using as msg_id (#972) (@bluesmoon),,0
20,cleanup and re-organization,0.3417391,Fix more 0.7 deprecations.,"additionally, the call to repr is no longer required.",0
21,Merge pull request #30 from minrk/handlers,0.6535547,Merged pull requests:,"IJulia.uuid4() is defined as repr(UUIDs.uuid4()), however repr(UUIDs.uuid4()) is rendered as UUID("".......""). The result is that in websocket responses from Jupyter, we see the following: {""msg_id"": ""UUID(\""f160847f-81ef-4c2f-b6b8-68659c81a957\"")"", ""msg_type"": ""status"", ""username"": ""username"", ""date"": ""2021-01-08T20:06:10.647000Z"", ""version"": ""5.3"", ""session"": ""1bbf2086-e46f-4174-bb88-72e75a09479d""}, ""msg_id"": ""UUID(\""f160847f-81ef-4c2f-b6b8-68659c81a957\"")"", ""msg_type"": ""status"", ""parent_header"": {""msg_id"": ""317ec8d3-c7a0-4752-bb0d-137c4149268f"", ""notebook_uuid"": ""07423003-fd24-4681-911a-301054ffbcb7"", ""username"": ""username"", ""msg_type"": ""execute_request"", ""date"": ""2021-01-08T20:06:10.646228Z"", ""version"": ""5.0"", ""session"": ""1bbf2086-e46f-4174-bb88-72e75a09479d""}, ""metadata"": {}, ""content"": {""execution_state"": ""busy""}, ""buffers"": [], ""channel"": ""iopub""}' Wrapping it in a call to string() fixes this issue.",0
22,core module is at the same level of directory,0.37180167,Does IJulia follow Manifest.toml branch dependencies? (#837),,0
23,"Fix typo in display_mimestring, display_mimejson. (#757)",0.5142963,Custom MIME display (#755).,,0
24,Merge pull request #588 from JuliaLang/yyc/0.7,0.7249445,Merged pull requests:,,1
25,"fixed unsafe_string instead of bytestring, fixed ZMQ version (#444)",0.6681143,- ZMQ unsatiable constraints (#971),"Pkg launches subprocesses with the startup file if you explicitly start julia with --startup-file=yes. Since it is default anyway it seems like this can be removed, fixes link.",0
26,Merge pull request #240 from randy3k/stdio,0.6580206,Merged pull requests:,,0
27,Bump version,0.48733753,"Fix compat bounds for auto-merging, bump version to 1.20.1. (#884) (fredrikekre)",Allow users to opt out of the default kernel. document IJULIA_NODEFAULTKERNEL Co-authored-by: Steven G. Johnson stevenj@alum.mit.edu,0
28,Revise wording to not mention building since problem exists with packages as well.,0.42129588,Respect environment variables XDG_DATA_HOME and JUPYTER_DATA_DIR during build (#796).,This reverts commit 4fd955afa15c43af6f137e6d27a112958cc6f0e6.,0
29,added julia syntax highlighting. Implements #17,0.66881007,Syntax highlighting issue in JupyterLab 1.0 (#855),,0
30,REPL based completions (fixes #11),0.76587886,Fix REPL-like ? help.,,1
31,tag 1.21.3,0.65789235,Tag a release (#898),,0
32,bugfix on interrupted watch_stream,0.41916466,"MIME fixes (#771, #773), store prefs in depot path (#760), fix IPython ""magic"" error reporting (#769).",,0
33,workaround ipython/ipython#6383,0.54441845,"MIME fixes (#771, #773), store prefs in depot path (#760), fix IPython ""magic"" error reporting (#769).",Remove duplicate documentation src file Explicitly list API docstrings to include and group under headings Add @docs blocks for important functions/types currently missing docstrings.,0
34,Fix a typo in IJulia.jl (#521),0.72948766,- Error in installing IJulia.jl (#956),,1
35,Merge pull request #25 from Carreau/patch-1,0.6986554,Merged pull requests:,,0
36,"fix #354: don't delete temp directory for Windows (grr), don't double-escape strings",0.4322975,"Fix shell mode (#703), Revise (#708), and history (#706).",,0
37,only recognize magics at start of cell (fixes #888),0.55401325,- Cell content disappears  (#919),,0
38,Move mode and startup global variable into let block (#813),0.4706829,- Add to startup (#922),"Documenter.jl src files with README contents Add public API docs page w/ @autodoc, empty docs page on internals Simplify README Set up documentation deployment Add documentation badges to README Run Pkg.build() in documentation workflow",0
39,comm_info_request,0.42530847,Merged pull requests:,,0
40,Merge pull request #208 from stonebig/init_fix,0.59998304,Merged pull requests:,,0
41,barely functional pure-Julia IPython kernel,0.6865455,- Kernel does not start with Julia 1.9 (#1062),Limit TagBot cronjob to once per day. Set version to 1.21.2.,0
42,Add Julia svg logo (#1053),0.9371648,- Add Julia svg logo (#1053) (@steff456),,1
43,Update README.md,0.6474739,add info on nteract to README.md? (#841),,0
44,fix backtraces for JuliaLang/julia#12250,0.67703974,- support repl_ast_transforms in Julia 1.5 (#947) (@stevengj),,0
45,changed default display to display stack,0.43363047,- Display/println order incorrect (#998),,0
46,add IJulia.addkernel,0.6919863,- Load InteractiveUtils from the IJulia namespace in src/kernel.jl. (#951) (@fredrikekre),,0
47,use eval on hooks to run in the current world (#513),0.45762742,- Update [compat] to allow MbedTLS v1 (#912) (@jaakkor2),,0
48,remove Compat stuff for 0.4 that is no longer needed now that we REQUIRE 0.5 (as of #447),0.5922762,Fix more 0.7 deprecations.,,0
49,skeleton of Julia Pkg,0.47557658,- I bulid Ijulia (#879),,0
50,"use repl_cmd rather than run for ""; ..."" commands, as discussed in #43",0.47418264,Fix REPL-like ? help.,,0
51,Tell the user to install the jupyter-client package on Debian (#754),0.6895776,"PR #791: Jupyter is no longer required for package installation (fixes #692).   Also added jupyterlab() function to launch JupyterLab, and added an env keyword to installkernel to provide control over the kernel environment.",,0
52,don't convert environment vars to uppercase on non-Windows,0.4054227,Slight fix to handling of environment variables for jupyter subcommands (137aed4c98a4be788b6a73df2ef74c2667be5611).,Add InlineIOContext with Jupyter property. Fix test case.,0
53,Capture the parent message locally for idle messages (#618),0.42807868,- Cell content disappears  (#919),,0
54,"more fixes to jupyter/jupyter_core#62 workarounds: Canopy/EPD Python puts quotes around Python path, and jupyter-notebook is a .exe file",0.6823397,"PR #791: Jupyter is no longer required for package installation (fixes #692).   Also added jupyterlab() function to launch JupyterLab, and added an env keyword to installkernel to provide control over the kernel environment.",,0
55,refactoring and cleanup of jlkernel,0.62171847,- Deprecation from PyCall.jl (#905),,0
56,Don't load startup_ijulia.jl with --startup-file=no (#748),0.8198236,Use DEPOT_PATH[1]... to load startup_ijulia.jl (#846) (macd),,1
57,Merge pull request #570 from pabloferz/pz/ci,0.67686814,Merged pull requests:,,0
58,"typo, fix incorrect deletion of hyphen from compound adjective",0.2694571,- Deprecation from PyCall.jl (#905),,0
59,specify type for kwarg,0.37320584,- ZMQ unsatiable constraints (#971),,0
60,Merge branch 'master' of git://github.com/JuliaLang/julia-ipython,0.60169846,- Install TagBot as a GitHub Action (#901) (@JuliaTagBot),,0
61,rename addkernel -> installkernel,0.5474485,"- Add kwarg julia_cmd to installkernel (to support JupyterHub with containers, etc.) (#948) (@oschulz)",Mention In and Out in README and how to empty them Update README.md Update README.md Co-Authored-By: Nathan Daly 44379820+rai-nhdaly@users.noreply.github.com Update README.md Co-Authored-By: Nathan Daly 44379820+rai-nhdaly@users.noreply.github.com Update README.md Co-Authored-By: Nathan Daly 44379820+rai-nhdaly@users.noreply.github.com,0
62,allow jupyter to be specified via the JUPYTER environment variable,0.6283547,Add InlineIOContext with Jupyter property. (#876) (travigd),,0
63,Fix close_comm (#487),0.56000346,Closed issues:,Use DEPOT_PATH[1]... to load startup_ijulia.jl First check that DEPOT_PATH is not empty before loading startup_ijulia.jl,0
64,fix more kyle comments,0.5184031,Fix more 0.7 deprecations.,,0
65,"tooltip on in-place functions, julia lang hint in metadata",0.5473073,- Organize/add docstrings in API docs (#945) (@jlumpe),,0
66,pyin for #4,0.5250032,- Deprecation from PyCall.jl (#905),,0
67,ignore MIME types that throw errors during display (#777),0.6586674,Custom MIME display (#755).,,0
68,Load InteractiveUtils from the IJulia namespace in src/kernel.jl. (#951),0.9579054,- Load InteractiveUtils from the IJulia namespace in src/kernel.jl. (#951) (@fredrikekre),,1
69,Enable Appveyor on 0.5 releases,0.39240268,- Update [compat] to allow MbedTLS v1 (#912) (@jaakkor2),"fix(vega): add v4 mime type The v4 mime type is what is currently supported out of the box by Jupyter, v3 requires an extension to be installed style(vegaMime): use list comprehensions",0
70,Evaluate result in current_module(). Fix #507 (#508),0.5654964,Fix #776,"Fix bug (I think): evaluate each of the user_expressions, rather than returning them untouched Should have evaluated ex, not code. And ignoring SOFTSCOPE setting, as suggested in link Catch and report errors in evaluating user expressions, as suggested in link whoops, didn't mean to use tab characters Update implemantation of user_expressions to match the IPython reference implementation whoops wrong status",0
71,"default to system jupyter (not Conda) on Linux, as discussed in #501 and #506",0.64669645,"PR #791: Jupyter is no longer required for package installation (fixes #692).   Also added jupyterlab() function to launch JupyterLab, and added an env keyword to installkernel to provide control over the kernel environment.",,0
72,"duh, stupid typo, fixes #23",0.5984169,- Proposed fix for #986. (#989) (@rgobbel),Move mode global variable into let block Move startup global variable into let block,0
73,"Switch from GnuTLS -> Nettle, allowing for compilerless installation on OSX",0.4552556,"Julia 0.6 fixes, dropping Julia 0.4, switching to MbedTLS instead of Nettle.",Default to message mode for Windows and keep the previous behaviour for all other platforms.,0
74,make sure UTF8 strings are allowed in display dictionary,0.51315665,- Error in utf-8 decoding (#927),,0
75,"use print_repl, honor silent, and evaluate user vars for #5; status messages for #4; still some weirdness for #10",0.50837946,- flush stdio before display (#999) (@stevengj),,0
76,pipe -> pipeline,0.35405713,make work with ipc transport (#868) (marius311),,0
77,Merge pull request #296 from yuyichao/ijulia-system,0.62778485,Merged pull requests:,"See link and Jupyter source file ""jupyter_core/paths.py"".",0
78,"remove python->julia magics etc., which have been moved to JuliaLang/pyjulia (see JuliaLang/pyjulia#1)",0.6055639,- Jupyterlab won't work with Julia 1.5 and Python 3.7.7 (#939),,0
79,"Fix io redirection for Julia 1.7, fixes #986. (#989)",0.8012608,- redirect_stdio is broken by Julia 1.7 (#986),,1
80,Ensure that only pure python strings (not unicode) are passed to Julia.,0.41587037,- Jupyterlab won't work with Julia 1.5 and Python 3.7.7 (#939),,0
81,"implement Base.redirect_{stdout,stderr,stdin} (#641)",0.5987785,- redirect_stdio is broken by Julia 1.7 (#986),,0
82,better Pylab support (though still need to auto-close figures at end of cell) for #15; updated multimedia.jl to latest proposal,0.5621456,- support for pdf plot output (#1035),"work on jupyter-free installation rebase fix drop compat, save jupyter pref again, add env to installkernel updated notebook command, also jupyterlab command adapted from #783 installkernel test clean up test output whoops rm another compat reference rm more compatibility code updated docs installkernel is exported add .exe suffix on Windows fix path for windows no compat only prompt once for jupyterlab install",0
83,Merge pull request #95 from Carreau/re-hilight,0.68085355,Merged pull requests:,"ignore MIME types that throw errors during display (fixes #776), split display into separate file tweak test fix",0
84,Add support for more scalar types.,0.41957343,- Handling of local y = (x = i) in soft scope (#938),,0
85,Set --project=@. for the default kernel. (#820),0.6060997,- Correct kernelspec name (#1004) (@jks-liu),,0
86,fix #191: only allow one shell command per cell,0.40947437,"- Set version to 1.21.2, limit tagbot to once per day. (#914) (@fredrikekre)",,0
87,Merge pull request #337 from julian-gehring/patch-1,0.70634496,Merged pull requests:,,1
88,Fix Codemirror mode for proper emoji tab completion.,0.56490517,- tab completion and unicode not working in Jupyter notebook (#1034),"store prefs in depot_path/prefs As a stopgap until we get proper package options (JuliaLang/Juleps#38), store JUPYTER preference in depot_path/prefs/IJulia so that it isn't forgotten when IJulia is updated.  See also JuliaPy/PyCall.jl#589 misplaced const",0
89,allow passing the profile JSON file name as ARGS[1],0.41597062,- Convert uuid4 to a string before using as msg_id (#972) (@bluesmoon),,0
90,make Conda the default in Pkg.build (closes #501),0.5838978,use _set_conda_env to launch jupyter (#900) (stevengj),"Add custom MIME types to display_dict. Add tests, fix markdown/latex priority. Improve documentation. Update MIME priority of png/jpeg and html. register_ijulia_mime -> register_mime Vector -> AbstractVector, add test cases for vector-of-MIMEs Fix more types!",0
91,don't use remove_destination keyword in Julia 0.3 (fixes #356),0.6337726,"Julia 0.6 fixes, dropping Julia 0.4, switching to MbedTLS instead of Nettle.",,0
92,fix setup_stdio for IJuliaStdio (fixes #604),0.73593223,- Trouble installing IJulia (#923),Tell the user to install the jupyter-client package on Debian Update README.md,1
93,Add a proper package init for the Python package.,0.4062523,"PR #791: Jupyter is no longer required for package installation (fixes #692).   Also added jupyterlab() function to launch JupyterLab, and added an env keyword to installkernel to provide control over the kernel environment.",,0
94,Allow modules to attach metadata in IPython display_data & pyout messages,0.4609803,Add InlineIOContext with Jupyter property. (#876) (travigd),,0
95,use invokelatest instead of eval,0.42940846,Mention In and Out in README and how to empty them (#853) (MasonProtter),,0
96,note pyzmq dependency (fixes #46),0.5540567,Fix #776,use new ZMQ api require ZMQ 1.0,0
97,use absolute kernel spec path (fix #379),0.62676036,How to install kernelspec to $CONDA_PREFIX/share/jupyter/kernels/? (#865),,0
98,use @DIR instead of Pkg.dir (#576),0.5155666,"- Fix the ""dev"" docs badge (#943) (@DilumAluthge)",,0
99,Add a bit more info about blocks,0.35471654,v1.21.1 (2020-02-08),,0
100,need to set LINES/COLS before calling init(),0.4202332,Add InlineIOContext with Jupyter property. (#876) (travigd),,0
101,add fallback to complete_type (fixes #935),0.50929815,"Fix #855, add required status field for JupyterLab 1.0 (#856) (drewrobson)",Pkg.* keywords don't work without importing 'Pkg'. Updated read-me so that there's no confusion.,0
102,bugfix in tooltip (object_info_request) - handle qualified names via parse rather than symbol,0.52069,- [feature request] syntax highlight in vscode (#933),,0
103,"switch to IPython v3 protocol, require IPython 3.0 or later",0.52948403,make work with ipc transport (#868) (marius311),Move flush_all() out from @async no need for async around idle message,0
104,note Tornado dependency (thanks @ViralShah),0.39994407,IJulia v1.21.4,See JuliaLang/julia#28694,0
105,workaround for JuliaLang/julia#4259,0.65193826,- support repl_ast_transforms in Julia 1.5 (#947) (@stevengj),,0
106,tests for the correct kernel.jl (#809),0.6840168,- Correct kernelspec name (#1004) (@jks-liu),,0
107,Bump Julia version,0.5065369,IJulia v1.24.0,"Revise checks whether IJulia is running in its init function, and if so defines an appropriate preexecute_hook. However, I believe most users of Revise who also use the REPL configure it in their .julia/config/startup.jl script. It appears that this script runs before IJulia is loaded, and as a consequence Revise has no chance to detect whether it should define the hook. To make both work independent of load order, we therefore have to check symmetrically: Revise checks for IJulia, and IJulia checks for Revise. Fixes link",0
108,Merge pull request #259 from afniedermayer/fix-bug-clear_history,0.56021523,"Fix #855, add required status field for JupyterLab 1.0 (#856) (drewrobson)","replace(string::AbstractString, pat, r[, n::Integer=0]) gets removed in Julia 1.0. The new signature is replace(s::AbstractString, pat=>r; [count::Integer]).",0
109,Clean up execution loop and ensure counters are properly synced.,0.41673577,- flush stdio before display (#999) (@stevengj),,0
110,flush stdio before display (#999),0.87727165,- flush stdio before display (#999) (@stevengj),,1
111,fix #251,0.7510884,Fix #776,,1
112,enable precompilation now that new JSON and Nettle versions have been tagged,0.4434868,- Organize/add docstrings in API docs (#945) (@jlumpe),set the context_module for the REPLCompletions Update handlers.jl,0
113,"Remove further ""source"" => ""julia"" mappings for JupyterLab compat (#638)",0.6571646,- Errors Linking Julia 1.8 and Jupyter Lab 3.3.4-2 (#1050),,0
114,Fix conversion from Vector{UInt8} to UTF8String,0.65786314,- Error in utf-8 decoding (#927),,0
115,"Fix invalid call to rcvmore(), it seems to now be an attribute instead.",0.44524735,- Error: Could not spawn setenv (#1032),,0
116,use Base.REPL.ends_with_semicolon to check for semicolon at end of code cell.  This somewhat improves #109 in Julia 0.6 thanks to JuliaLang/julia#20918,0.5832355,- support repl_ast_transforms in Julia 1.5 (#947) (@stevengj),,0
117,update new REPLCompletions API (fixes #679),0.6524364,Fix REPL-like ? help.,,0
118,tweak,0.51557565,Fix more 0.7 deprecations.,,0
119,fix heartbeat on 1.6 (#985),0.86738884,- fix heartbeat on 1.6 (#985) (@stevengj),findlast/first updates tighten where clause another showable call having pop_foo_hook throw an error if the hook wasn't found seems fine missing paren findlast -> Compat.findlast,1
120,"requires Compat 0.6, remove extraneous hyphens from REQUIRE",0.40838844,Fix more 0.7 deprecations.,"0.7 compatibility (mostly) update appveyor to test nightly too fix merge error missing compat in kernel.jl REPL.REPLCompletions is now in the stdlib don't force Compat into user notebooks fix more deprecations and a crash in heartbeat fix more 0.7 deprecations don't use uppercase STDIO on 0.7 whitespace Add logging override for 0.7 Fix stdout messages not being sent Julia 0.7 changed the String() constructor to deplete Vector{UInt8} arguments, so we must copy() them first to avoid clobbering. fix empty try-catch deprecation add build.log to .gitignore add Conda before using it fix deprecation from spawn use Compat.AbstractDisplay directly Misc 0.7 changes warn() -> at-warn emtpy try-catch remove_destination -> force start -> firstindex endof -> lastindex broadcast + replace global logger in init() test explicit stdout/stderr printing",0
121,bugfix in shutdown_request handler,0.5064647,Closed issues:,,0
122,use correct julia executable name,0.37843192,- Add Julia svg logo (#1053) (@steff456),,0
123,work around JuliaLang/julia#10935 -- make sure IJulia.set_verbose(blah) does not crash IJulia,0.63721555,- IJulia doesnt work (#926),,0
124,Fix broken link (#997),0.83940935,- Fix broken link (#997) (@bluesmoon),,1
125,AbstractString -> String in type signatures,0.4574894,"String interpolation + printf format string = confused syntax highlighter and garbled, uneditable cell (#896)",Use JSON.JSONText for vegalite mime type Add support for vnd.dataresource mime type,0
126,avoid split deprecation warning in Julia 0.4,0.594913,Fix 0.7 deprecation in Interact code.,that is mentioned on some issue but not in the readme...,0
127,Monkeypatch Compat.stdio to match Base. (#691),0.45101383,Slight fix to handling of environment variables for jupyter subcommands (137aed4c98a4be788b6a73df2ef74c2667be5611).,,0
128,fix mkpath in copy_config (don't add juliaprof to path twice,0.44675863,- Update [compat] to allow MbedTLS v1 (#912) (@jaakkor2),,0
129,Drop custom tooltip.js to address #157,0.4733336,- Feature: show methods applicable to object  (methodswith) (#1033),,0
130,"Fix the ""dev"" docs badge (#943)",0.9040159,"- Fix the ""dev"" docs badge (#943) (@DilumAluthge)",,1
131,backwards compatibility for pending mimewritable API change,0.44804245,Fix 0.7 deprecation in Interact code.,stop testing v0.5 on Travis drop Julia v0.5 entirely,0
132,Allow multiple versions of Julia as IPython kernels,0.5567515,- Kernel does not start with Julia 1.9 (#1062),"implement Base.redirect_{stdout,stderr,stdin} fix test brittleness only allow stdio redirection for the matching IJulia stream",0
133,fix inspect_request incorrect call of error_content introduced by #415 (for #417),0.5210694,Permissions problems similar to Issue #616 (#845),"Typo and grammatical corrections Changed ""behaviour"" to ""behavior""",0
134,Note about default environment (#1007),0.8975024,- Note about default environment (#1007) (@lamorton),,1
135,display strings with repl_show (fixes #35),0.59029204,Fix REPL-like ? help.,"Add metadata to complete request Improved compact display Remove extra definition Use eval only for symbols Add keywords, latex symbols and emojis completion Remove empty catch statement",0
136,more 0.7 updates (#696),0.680784,v1.20.2 (2019-11-07),This does not seem to be supported in JupyterLab 0.31.  See this link [0] for more detail [0] link,0
137,fix #446 (fix capture_stderr=false),0.59067637,Fix #776,,0
138,missing invokelatest when flushing display queue,0.5041849,- flush stdio before display (#999) (@stevengj),This provides correct syntax highlighting for struct.,0
139,moved the updating section,0.5427771,Diff since v1.23.3,,0
140,"include date in message headers for Jupyter 5.1 compatibility, simplify message code",0.53915834,Add InlineIOContext with Jupyter property. (#876) (travigd),,0
141,work around JuliaLang/julia#265 -like problem in 0.6,0.6848011,- Errors Linking Julia 1.8 and Jupyter Lab 3.3.4-2 (#1050),,0
142,Fix heartbeat pthread_create segmentation fault,0.49696872,- fix heartbeat on 1.6 (#985) (@stevengj),,0
143,updated README,0.6258021,add info on nteract to README.md? (#841),Add %qtconsole magic Warn if qtconsole is called outside a running IJulia session Error if qtconsole is called outside an IJulia session,0
144,TagBot: use DOCUMENTER_KEY (#944),0.8919619,- TagBot: use DOCUMENTER_KEY (#944) (@DilumAluthge),Capture the parent message locally for idle messages @async no longer implicitly captures variables (link) Add note about changes in @async behavior Update eventloop.jl,1
145,Remove space in kernel spec path,0.49723643,- Jupyter Kernels Getting Overwritten (#908),,0
146,update troubleshooting section of the readme,0.58585113,short comment on nteract to README.md (#842) (PaulSoderlind),use lowercase from Compat.Unicode fix compatibility with 0.7,0
147,implement ;... shell-escaping (fixes #43),0.44927752,"Fix shell mode (#703), Revise (#708), and history (#706).",,0
148,Added pre-execute hooks,0.42271483,- Add to startup (#922),,0
