312,"slight correction to msg_pub protocol (according to current IPython behavior, though not officially part of the spec)",0.5211182,"MIME fixes (#771, #773), store prefs in depot path (#760), fix IPython ""magic"" error reporting (#769).",[WIP] Use Conda.jl if Ipython/jupyter is not found,0
313,grammatical cleanups in comments,0.42263076,Mention In and Out in README and how to empty them (#853) (MasonProtter),link is closed and released.,0
314,Fix for new julia kwargs syntax.,0.6202076,- support repl_ast_transforms in Julia 1.5 (#947) (@stevengj),jupyter/ipython is found.,0
315,Temporary fix for #551 (#552),0.71437526,Fix #776,,1
316,print_history() function (#500),0.38953966,"Makes Conda the default during installation (#501), IJulia.history() function analogous to IPython %history (#500), improved Julia 0.6 compatibility.",,0
317,whoops,0.36457306,nan,,0
318,Use org default funding file.,0.39860344,- Don't use --startup-file=yes (it is default anyways). (#963) (@fredrikekre),Union() -> Union{},0
319,Take off verbose logging,0.40238005,Mention In and Out in README and how to empty them (#853) (MasonProtter),,0
320,use julia-basic.exe on Windows for version >= 0.3- (fix #145),0.6445386,ArchGDAL installation Error on windows 10 using Julia 1.2.0 (#871),,0
321,"flush pending stdio on error, add posterror_hooks",0.5758291,- redirect_stdio is broken by Julia 1.7 (#986),,0
322,Update CI URLs to point to new caching infrastructure (#543),0.47490814,make work with ipc transport (#868) (marius311),,0
323,Merge pull request #498 from JuliaLang/pz/arrayconstructor,0.6672277,Merged pull requests:,,0
324,enable terminal colors in Jupyter stdio,0.5213284,Syntax highlighting issue in JupyterLab 1.0 (#855),,0
325,fix macro hygiene for verbose mode,0.33756435,- Note about default environment (#1007) (@lamorton),,0
326,Merge pull request #53 from staticfloat/nettle,0.6285243,Merged pull requests:,use jupyter kernelspec install when available,0
327,Mention In and Out in README and how to empty them (#853),0.98419064,Mention In and Out in README and how to empty them (#853) (MasonProtter),"and use ipython kernelspec install for IPython 3, rather than attempting to reimplement the install process.",1
328,Add application/javascript as a MIME type (#431),0.54794484,Add support for vega-lite 4 MIME type (#890) (davidanthoff),,0
329,take care of InterruptExceptions for #31; don't send pyerr message and continue on unexpected exception for #20,0.49226558,- Proposed fix for #986. (#989) (@rgobbel),build.jl: Fix word repetition,0
330,draft crash message for #4,0.5122175,v1.21.1 (2020-02-08),,0
331,install all files on all versions of IPython,0.35451648,make work with ipc transport (#868) (marius311),,0
332,version bump,0.5098163,"Fix compat bounds for auto-merging, bump version to 1.20.1. (#884) (fredrikekre)",,0
333,fix In/Out numbering (although issue #10 is still messing us up),0.6018532,- Zero before another number breaks ijulia (#907),,0
334,don't deallocate heartbeat threadid (may help #74),0.6113316,- fix heartbeat on 1.6 (#985) (@stevengj),,0
335,make ipython const,0.4828211,make work with ipc transport (#868) (marius311),,0
336,raise exceptions on NULL return from Julia API (see Julia issue #2755),0.55716527,"Drop Julia 0.6 support, use the ZMQ 1.0 API (#729).",,0
337,Merge pull request #78 from GlenHertz/patch-1,0.70948946,Merged pull requests:,clear_output support (not working yet) for #134,1
338,"notebook command on Windows seems to need fix similar to #363; also, fix #270 by doing explicit kill",0.5843512,- can not start notebook  (#910),,0
339,instructions for checkout out ipython2 branch,0.43564466,Does IJulia follow Manifest.toml branch dependencies? (#837),"switch to IPython v3 protocol, require IPython 3.0 or later",0
340,support repl_ast_transforms in Julia 1.5 (#947),0.91353714,- support repl_ast_transforms in Julia 1.5 (#947) (@stevengj),,1
341,give error when non-functional hmac is found; see loladiro/GnuTLS.jl#5,0.5565301,- Error in installing IJulia.jl (#956),,0
342,use Base.REPLCompletions (Julia 0.3) if available,0.5882578,- support repl_ast_transforms in Julia 1.5 (#947) (@stevengj),Updates to reflect julia 0.3 now being required,0
343,Update IJulia.jl (#806),0.79813826,IJulia v1.23.0,,1
344,tweaks to copy_config in build script,0.40927443,Includes a bunch of patches from @JobJob to enable some great new Interact features. Enables colorful output patch link from @KristofferC and build fixes from @simonbyrne ,Fix #305,0
345,"standardize display-queue mechanism (needed for pyplot, but probably useful for other packages as well)",0.49340028,- support for pdf plot output (#1035),use QUEUE(ROUTER) for heartbeat,0
346,Reorg and create proper test directory.,0.41065705,- Documentation? (#936),,0
347,Move over readmes to markdown.,0.5607705,Mention In and Out in README and how to empty them (#853) (MasonProtter),instead of FORWARDER(REP) due to change in zmq_proxy in 4.0.6.,0
348,Merge pull request #163 from JuliaLang/malmaud/unicode,0.70980895,Merged pull requests:,Better support for system-wise install,1
349,libjulia-release -> libjulia.,0.55957913,Could not load library libgit2 (#869),,0
350,Update readme with instruction to create profile,0.51030874,add info on nteract to README.md? (#841),,0
351,Create FUNDING.yml,0.49663553,- Load InteractiveUtils from the IJulia namespace in src/kernel.jl. (#951) (@fredrikekre),,0
352,Correct kernelspec name (#1004),0.89653414,- Correct kernelspec name (#1004) (@jks-liu),Fix Codemirror mode for proper emoji tab completion.,1
353,Ensure copied code in readme can be rerun (#653),0.42025802,short comment on nteract to README.md (#842) (PaulSoderlind),,0
354,README updates,0.59164524,add info on nteract to README.md? (#841),Update clear_history to use Range instead of Ranges,0
355,"Added ""install IJulia --from a Julia console--""",0.72398615,Failed to install IJulia on windows 10 / Julia 1.1.1 (#843),,1
356,stdout/stderr capture for #23,0.54057014,- flush stdio before display (#999) (@stevengj),,0
357,fix jupyter-lab test on Windows (fixes #866),0.7066732,Calls to jupyterlab() always ask to install on Windows (#866),,1
358,Faster polling IO improvements,0.47694045,- IJulia is very slow at first calculation (#995),Remove space in kernel spec path,0
359,fix another double-escape for #354,0.553026,Fix more 0.7 deprecations.,,0
360,more informative error message when JUPYTER is not a valid executable,0.56409645,Get error in jupyter kernelbut normal in command line (#872),,0
361,reset output throttling on clear_output (closes #537),0.52355015,- Kernel frequently restarts during sessions (#1037),,0
362,Respect environment variables XDG_DATA_HOME and JUPYTER_DATA_DIR (#796),0.9215442,Respect environment variables XDG_DATA_HOME and JUPYTER_DATA_DIR during build (#796).,,1
363,Merge branch 'master' of github.com:JuliaLang/julia-ipython,0.57483745,- Install TagBot as a GitHub Action (#901) (@JuliaTagBot),,0
364,make a few globals const,0.44422945,"Support pkg commands in 0.7 (#715), use soft global scope in 0.7 (#720), unique completions (#712).",,0
365,"unbreak Symbol return values a second time (sigh, redoing commit 9f756d391d91646995d7ecf0791aa613d655f25c)",0.5257459,Fix 0.7 deprecation in Interact code.,Allow multiple versions of Julia as IPython kernels,0
366,short comment on nteract (#842),0.76406527,short comment on nteract to README.md (#842) (PaulSoderlind),"This change allows multiple Julia versions to be registered as IPython/Jupyter 3.0 kernels. You will get entries like Julia 0.3.6 Julia 0.4.0-dev Julia 0.4.0-dev debug depending on which Julia binary is used to build IJulia.jl. To get multiple Julia versions available as IPython kernels, you will need to rebuild IJulia from within each Julia binary. Ref: #224",1
367,some more eval_cell fixes,0.53443635,- Cell content disappears  (#919),add kernelspec for IPython 3.0,0
368,fix heartbeat for Julia 1.9 (closes ##1062),0.7400788,- fix heartbeat on 1.6 (#985) (@stevengj),,1
369,send busy/idle status messages for all message handlers (ipython/ipython#6055),0.46646458,Interrupt messages on Windows (#804) and warning for incorrect kernel path (#809).,,0
370,notebook() command defaults to opening dashboard in your home directory (fixes #449),0.60793257,- can not start notebook  (#910),Fix custom.js for 3.0,0
371,some windows fixes,0.56293964,Fix #776,,0
372,minimal 'eval' patch to align to pyjulia change,0.4828005,- Deprecation from PyCall.jl (#905),,0
373,Provides option to not capture stdout (#483),0.55292153,- flush stdio before display (#999) (@stevengj),,0
374,use Base.Random.uuid4 in Julia 0.4,0.49645603,IJulia v1.24.0,,0
375,"use new include_string (requires today's git master), store ans even for silent cells (like Julia REPL), silence for ; at end of cell, regardless of whether it inside a comment (similar to Julia REPL and IPython REPL)",0.48329735,- support repl_ast_transforms in Julia 1.5 (#947) (@stevengj),,0
376,bump version,0.48469654,"Fix compat bounds for auto-merging, bump version to 1.20.1. (#884) (fredrikekre)",,0
377,fix shell commands in Julia 0.4 due to Base.repl_cmd API change,0.59599704,"Julia 0.6 fixes, dropping Julia 0.4, switching to MbedTLS instead of Nettle.",There is still the limitation that object inspection will not work with identifiers that have a bang (!) in the name while IJulia does not support the kernelspec v5.,0
378,fix(vega): add v4 mime type (#821),0.72690237,"Set --project=@. (#820). New vega mime type (#821).  Various fixes (#813, #819).",,1
379,Added backtick support to julia.js,0.5335868,- support repl_ast_transforms in Julia 1.5 (#947) (@stevengj),,0
380,Update Readme to add julia syntax highlighting (#520),0.5790272,Syntax highlighting issue in JupyterLab 1.0 (#855),,0
381,"Add a full IPython kernel for now, which we'll then gradually juila-fy",0.52689743,How to install kernelspec to $CONDA_PREFIX/share/jupyter/kernels/? (#865),,0
382,handle v5.2 protocol change (jupyter/jupyter_client#262),0.56606203,- Update [compat] to allow MbedTLS v1 (#912) (@jaakkor2),,0
383,Merge pull request #216 from garborg/master,0.63215536,Merged pull requests:,Prevent SIGINT from killing the kernel,0
384,Merge pull request #201 from Carreau/fix-193,0.6593101,Merged pull requests:,,0
385,don't test against Julia 0.3,0.5876483,"Drop Julia 0.6 support, use the ZMQ 1.0 API (#729).",,0
386,enable colors in notebook (#470),0.6194122,Number coloring (#860),fix bug in clear_history,0
387,0.4 compatibility,0.9269531,0.7 compatibility,"The original code gave this error message: delete! has no method matching delete!(::Dict{Integer,UTF8String}, ::Int64, ::Nothing) while loading In[5], in expression starting on line 1 in clear_history at /home/andras/.julia/v0.3/IJulia/src/history.jl:21  in clear_history at /home/andras/.julia/v0.3/IJulia/src/history.jl:31  in clear_history at /home/andras/.julia/v0.3/IJulia/src/history.jl:35",1
388,"use libuv thread functions to ease portability, and hopefully work around #178",0.4946909,"Drop Julia 0.5 (#642), redirect fixes (#641), JupyterLab fixes, module-evaluation control (#651), compatibility with ZMQ.jl master.",,0
389,Fix broken imports.,0.47151357,Fix #776,,0
390,"complete_request: return ""status"" and ""matched_text"" also.",0.46432322,Merged pull requests:,,0
391,Union() -> Union{},0.36199912,- What is the meaning of this? (#1011),,0
392,added support for symbols to julia notebook syntax highlighting,0.6258358,Syntax highlighting issue in JupyterLab 1.0 (#855),add a little pause after flush_cstdio(),0
393,Add application/vnd.vega.v3+json MIME type (#668),0.5892757,Add support for vega-lite 4 MIME type (#890) (davidanthoff),,0
394,update README re: magics,0.47719353,short comment on nteract to README.md (#842) (PaulSoderlind),,0
395,send info to front-end on kernel exception (fixes #20),0.6635616,- errors thrown from a kernel are not pretty printed (#974),,0
396,hmac: default to SHA-256; handle empty string as signature_scheme.,0.39118785,- Convert uuid4 to a string before using as msg_id (#972) (@bluesmoon),,0
397,don't require jupyter for installation (#791),0.72080994,"PR #791: Jupyter is no longer required for package installation (fixes #692).   Also added jupyterlab() function to launch JupyterLab, and added an env keyword to installkernel to provide control over the kernel environment.",set isinteractive via the command line,1
398,silent should not suppress storage of In or incrementing execution counter (fix #171),0.48292536,References to output value of cells kept indefinitely (#851),,0
399,Merge branch 'master' of git://github.com/JuliaLang/IJulia.jl,0.5839712,- Install TagBot as a GitHub Action (#901) (@JuliaTagBot),,0
400,send interrupts to request-handler task (fix #98),0.553965,Interrupt messages on Windows (#804) and warning for incorrect kernel path (#809).,Otherwise it looks like ~/.juliarc.jl will always be loaded too early,0
401,Merge pull request #190 from shashi/comm_rebase,0.679478,Merged pull requests:,,0
402,Additional workarounds for jupyter-kernelspec.exe (#416),0.69837296,- Jupyter Kernels Getting Overwritten (#908),,0
403,Typo and grammatical corrections (#643),0.4053424,- won't catch the wrong syntax (#994),,0
404,Merge pull request #39 from johnmyleswhite/master,0.73359096,Merged pull requests:,,1
405,rm obsolete python-julia kernel,0.5950892,- Kernel on Jupyter Notebook constantly dies  (#1022),,0
406,fix tooltip on dev version,0.5026279,Set version to 1.21.0. (#899) (fredrikekre),,0
407,Organize/add docstrings in API docs (#945),0.9303305,- Organize/add docstrings in API docs (#945) (@jlumpe),,1
408,restore old behavior of treating empty JUPYTER as conda,0.45420983,- IJulia installs conda by itself (#979),,0
409,Get the latest syntax highlighter at build time (#569),0.58241785,- [feature request] syntax highlight in vscode (#933),,0
410,Merge pull request #514 from JuliaLang/yyc/0.6,0.72116816,Merged pull requests:,Update README to reflect subsequent Julia releases,1
411,Merge pull request #161 from Zulko/patch-1,0.6779232,Merged pull requests:,,0
412,Add missing CI configuration for 0.6,0.4795336,- Add to startup (#922),Widget Messaging Protocol (IPEP 21),0
413,Update README to reflect subsequent Julia releases,0.5905964,"Julia 0.6 fixes, dropping Julia 0.4, switching to MbedTLS instead of Nettle.",,0
414,Merge pull request #527 from JuliaLang/yyc/0.6,0.7206992,Merged pull requests:,,1
415,very simple complete_request handler,0.44838676,Merged pull requests:,,0
416,make cfunction const,0.48363546,Add InlineIOContext with Jupyter property. (#876) (travigd),core module is at the same level of directory,0
417,don't swallow build errors (noticed in #516),0.5079552,- won't catch the wrong syntax (#994),,0
418,Merge pull request #319 from garrison/juliav03,0.69509196,Merged pull requests:,"switch from ""run"" to ""eval"", as did the pyjulia project",0
419,Merge pull request #150 from cdsousa/favicon,0.6136224,Merged pull requests:,link,0
420,peel off one LoadError from thrown error (#472),0.50021076,LoadError: Failed to find or install Jupyter 3.0 or later. (#885),,0
421,Convert uuid4 to a string before using as msg_id (#972),0.9253764,- Convert uuid4 to a string before using as msg_id (#972) (@bluesmoon),,1
422,ENH: support plotly mimetype (#773),0.5196063,Custom MIME display (#755).,,0
423,Note REPL requirement in README and remove old completion code,0.57811177,Fix REPL-like ? help.,,0
424,remove advice to patch by hand,0.39472124,- Allow users to opt out of the default kernel. (#958) (@vchuravy),,0
425,fix #365 (completion w/o replacement),0.6701317,Fix #776,Conflicts:     src/stdio.jl,0
426,"replace readavailable with eof/nb_available/readbytes, as suggested by @vtjnash in JuliaLang/julia#7478",0.5868932,short comment on nteract to README.md (#842) (PaulSoderlind),,0
427,"Set version to 1.21.2, limit tagbot to once per day. (#914)",0.93836427,"- Set version to 1.21.2, limit tagbot to once per day. (#914) (@fredrikekre)",Shot in the dark for #193,1
428,shutdown_request for #4,0.53139114,Closed issues:,,0
429,cosmetic: minor reformatting,0.36724052,Fix more 0.7 deprecations.,,0
430,make sure Python uses UTF-8 when printing the profile path (fix #292),0.4627937,- Error in utf-8 decoding (#927),,0
431,added traceback code for future ref,0.44945744,Add InlineIOContext with Jupyter property. (#876) (travigd),Import metadata in inline.jl,0
432,version bump to 1.23,0.652226,v1.20.0 (2019-08-26),,0
433,use .profile in finding ipython on OSX (fix #60),0.46000648,"MIME fixes (#771, #773), store prefs in depot path (#760), fix IPython ""magic"" error reporting (#769).",,0
434,add IPython-like __ and ___ variables for 2nd-to-last and 3rd-to-last results; _ works now due to the previous commit,0.393802,- respect should_complete return value from REPLCompletions.completions (#993) (@stevengj),,0
435,Change uuid to a string in all locations. (#973),0.89766884,- Change uuid to a string in all locations. (#973) (@bluesmoon),Allow modules to attach metadata in IPython display_data & pyout messages,1
436,Fix links to IPython config docs and try to clarify what needs to be done,0.5294943,- Organize/add docstrings in API docs (#945) (@jlumpe),,0
437,work around #60,0.4868395,- Proposed fix for #986. (#989) (@rgobbel),,0
438,slight rearrangement of async loops,0.33066982,Add InlineIOContext with Jupyter property. (#876) (travigd),,0
439,Fixed indenting for list comprehensions,0.40061092,"String interpolation + printf format string = confused syntax highlighter and garbled, uneditable cell (#896)",,0
440,suggest better analogue of %%writefile,0.48773515,- support for pdf plot output (#1035),,0
441,Add tiny example of python zmq kernel.,0.48932007,- ZMQ unsatiable constraints (#971),,0
442,Rename IPython magics extension to simply 'julia.magic'.,0.47240016,"Makes Conda the default during installation (#501), IJulia.history() function analogous to IPython %history (#500), improved Julia 0.6 compatibility.",,0
443,treat empty cells as silent,0.5151942,- Cell content disappears  (#919),,0
444,Clean up juliamagic from old cruft from octave code.,0.50470126,Fix more 0.7 deprecations.,,0
445,"Check whether Revise is running at startup, and if so configure it (#708)",0.6010281,"Fix shell mode (#703), Revise (#708), and history (#706).",Syntax highlighting support added for non-ASCII unicode characters in identifiers,0
446,REQUIRE: replace GnuTLS with Nettle.,0.62088037,"Julia 0.6 fixes, dropping Julia 0.4, switching to MbedTLS instead of Nettle.",,0
447,"ipython -> jupyter, fix notebook() command after #353",0.6073282,- works in Jupyter Notebook but not in Jupyter Lab (#1029),link,0
448,inline PyPlot plots! fixes #15,0.57680786,- support for pdf plot output (#1035),Drop custom tooltip.js to address #157,0
449,added ability to display Pylab figure objects for issue #15,0.48969993,- support for pdf plot output (#1035),,0
450,"complete_request: don't need ""block"" and not sent by the notebook.",0.40507692,- tab completion and unicode not working in Jupyter notebook (#1034),,0
451,Don't send vega if vega-lite is being sent (#669),0.40961847,Permissions problems similar to Issue #616 (#845),"Added ""install IJulia --from a Julia console--""",0
452,Send parent message ID in status messages.,0.39864758,- TagBot: use DOCUMENTER_KEY (#944) (@DilumAluthge),"Coming from the Python world it took me some time to realize that Pkg.add(""Julia"") was actually not a python command so I added 3 words to help the next pythonista.",0
453,"Also try ipython.bat, for IPython 2.0 on Windows",0.4640115,make work with ipc transport (#868) (marius311),Update README.md,0
454,"fix inspect_request, add test (fixes #417)",0.5733411,Fix #776,0.2 was released,0
455,Merge pull request #96 from malmaud/n17,0.68925583,Merged pull requests:,add favicon to Julia IPython profile (partially fixes #70),0
456,fix heartbeat thread for latest ZMQ,0.61043805,- fix heartbeat on 1.6 (#985) (@stevengj),,0
457,fix chr2ind deprecation,0.59202224,Fix more 0.7 deprecations.,Add space to fix incorrect macro call.,0
458,"don't close(STDIN), seems to crash Julia (fix #111)",0.6586067,"- Urgent: Julia on Jupyter notebook, error:keep restarting kernel (#982)","Previously, Pkg.add(""IJulia"") or julia deps/build.jl failed with an error message, the meat of which was ""wrong number of arguments while loading /home/christopher/.julia/v0.3/IJulia/deps/build.jl, in expression starting on line 79"". This was ultimately caused by the fact that the macro name @windows? was immediately followed by an open parenthesis. The parentheses were intended to mark the first argument of @windows?---this argument itself is a nontrivial expression---but instead, because there was no space, Julia expected all the arguments to be inside the parentheses. Adding a space fixes this problem (see link).",0
459,Reorganize into a proper directory layout.,0.34190524,Fix REPL-like ? help.,,0
460,Added support for ipython 1.x,0.5215434,"- Pkg.add(""IJulia"") git proxy error without using proxy (#916)",,0
461,fix 0.7 deprecation,0.84139735,Fix more 0.7 deprecations.,Fix heartbeat pthread_create segmentation fault,1
462,Shot in the dark for #193,0.5002876,- I bulid Ijulia (#879),,0
463,workaround for broken data-rate limit in Jupyter 4.2-5.0 (closes #528),0.5669466,Jupyter display full output results (#844),Enable syntax highlighting in the QT Console,0
464,Merge pull request #165 from JuliaLang/clear_output,0.7076262,Merged pull requests:,Fix #139,1
465,"Add kwarg julia to installkernel (to support JupyterHub with containers, etc.) (#948)",0.91331995,"- Add kwarg julia_cmd to installkernel (to support JupyterHub with containers, etc.) (#948) (@oschulz)",,1
466,Use Conda.jl's python distribution if no system wide python,0.4656834,use _set_conda_env to launch jupyter (#900) (stevengj),,0
467,Merge pull request #450 from JuliaLang/sb/appveyor,0.7353865,Merged pull requests:,,1
468,"fixes to object_info_request, now return methods for functions and datatypes (see issue #13)",0.67876697,- Feature: show methods applicable to object  (methodswith) (#1033),Added pre-execute hooks,0
469,Base.Markdown -> Markdown (fixes #769),0.59097695,Fix #794.,,0
470,Merge pull request #432 from JuliaLang/comm_info,0.7493163,Merged pull requests:,,1
471,"remember jupyter location for subsequent Pkg.build steps, e.g. for Pkg.update",0.5459293,- Pkg output not showing in Jupyter notebook (#1008),Update install instructions with Pkg.update() call.,0
472,delete obsolete docs,0.47820637,"- Fix the ""dev"" docs badge (#943) (@DilumAluthge)",,0
473,allow setting the module which code gets evaluated in (#651),0.50826865,How does this code work? (#861),,0
474,drop more 0.6 code (#728),0.63793105,Fix 0.7 deprecation in Interact code.,,0
475,"use latest showerror, similar to JuliaLang/julia#19916",0.6170026,- support repl_ast_transforms in Julia 1.5 (#947) (@stevengj),,0
476,"bug fixes in @compat; make debugging easier by adding a capture_stderr const flag, make some changes for #238 (not fixed yet)",0.5226252,"- Fix the ""dev"" docs badge (#943) (@DilumAluthge)",,0
477,Add metadata to complete_reply (#632),0.45409912,Add InlineIOContext with Jupyter property. (#876) (travigd),,0
478,Prepend the uncompleted part of of the completion request,0.45726854,Closed issues:,,0
479,Fix typo in finding jupyter_vers (#502),0.60969585,- works in Jupyter Notebook but not in Jupyter Lab (#1029),,0
480,rm stray reference to javascript,0.36971313,- respect should_complete return value from REPLCompletions.completions (#993) (@stevengj),fix tooltip on dev version,0
481,"support explicit calls to display with text/foo, displaying as text/plain, similar to JuliaLang/julia#19993",0.49738353,- support repl_ast_transforms in Julia 1.5 (#947) (@stevengj),,0
482,"Clean up the setup part, hold the PyObject in main Julia interpreter.",0.5523857,Fix Julia 0.7 depwarns and problem with tab completion in latest Jupyter.,,0
483,Improve wording/examples.,0.34821126,Syntax highlighting issue in JupyterLab 1.0 (#855),,0
484,seed explicitly MersenneTwister(0) (#525),0.4785276,- Error: Could not spawn setenv (#1032),Fixed indenting for list comprehensions,0
485,"logging call removed from custom.js, mkpath factored out in build.jl",0.5618184,- IJulia/kernel.jl should not change the global_logger (#1018),,0
486,add debugging info,0.53171945,"IJulia.installkernel function, syntax highlighter updates, build script update for Debian, 0.7 compatibility.",,0
487,bugfix to readline(Pipe) for non-stdin,0.47719187,"- Unlike in REPL, passing (e, catch_backtrace()) to the @error macro displays unreadable raw stacktrace instead of text representation (#1043)",,0
488,Merge remote-tracking branch 'origin/pr/276' into kernelspec,0.5091583,How to install kernelspec to $CONDA_PREFIX/share/jupyter/kernels/? (#865),,0
489,remove spurious print,0.44529712,Mention In and Out in README and how to empty them (#853) (MasonProtter),Fixed some parsing errors involving <: and :: in notebook syntax highlig...,0
490,respect should_complete return value from REPLCompletions.completions (#993),0.92592627,- respect should_complete return value from REPLCompletions.completions (#993) (@stevengj),,1
491,Don't use --startup-file=yes (it is default anyways). (#963),0.88871586,- Don't use --startup-file=yes (it is default anyways). (#963) (@fredrikekre),,1
492,Merge pull request #361 from tkelman/tk/ci,0.6393559,Merged pull requests:,added julia syntax highlighting. Implements #17,0
493,silence another Julia 0.4 warning,0.5634645,- support repl_ast_transforms in Julia 1.5 (#947) (@stevengj),,0
494,Call message handlers with invokelatest on 0.6 (#542),0.5066345,- IJulia not showing output from package manager mode (#1017),,0
495,polish for IPython 3.0.0-rc,0.48029697,"MIME fixes (#771, #773), store prefs in depot path (#760), fix IPython ""magic"" error reporting (#769).",,0
