Commit Message,Score,Correspond Changelog Sentence,Commit Description,Label
don't store Out in itself (#1083),0.43074274,Mention In and Out in README and how to empty them (#853) (MasonProtter),,0
bump version (#1082),0.7982475,- bump version (#1082) (@stevengj),,1
ensure JSONText is never base64-encoded (#1081),0.92442274,- ensure JSONText is never base64-encoded (#1081) (@stevengj),,1
bump version (#1080),0.8410055,- bump version (#1080) (@stevengj),,1
include kspec.jl unconditionally (#1079),0.94111097,- include kspec.jl unconditionally during build (#1079) (@stevengj),,1
Use logo in the documentation (#1064),0.91501015,- Use logo in the documentation (#1064) (@hyrodium),update docs/make.jl to copy logo files update path variables update gitignore fix typo,1
"Add notes on fixing ""Connecting to kernel"" failures. (#1030)",0.95545995,"- Add notes on fixing ""Connecting to kernel"" failures. (#1030) (@jd-foster)",,1
bump version,0.65207064,- bump version (#1080) (@stevengj),,0
fix backtrace to start with In[x] in Julia 1.5+,0.5108582,"Julia 0.6 fixes, dropping Julia 0.4, switching to MbedTLS instead of Nettle.",,0
fix heartbeat for Julia 1.9 (closes ##1062),0.63696223,"Julia 0.6 fixes, dropping Julia 0.4, switching to MbedTLS instead of Nettle.",,0
Correct kernelspec name (#1004),0.9338782,- Correct kernelspec name (#1004) (@jks-liu),Correct kernelspec name Add test for kernelspec_name,1
Update help link (#1006),0.7812075,- Update help link (#1006) (@raphbacher),pkg.julialang.org is now an empty page (url used as a package server),1
Add Julia svg logo (#1053),0.9313991,- Add Julia svg logo (#1053) (@steff456),Add Julia svg logo Add new svg path to kernelspecs,1
Replace SimpleLogger with ConsoleLogger (#1045),0.9073359,- Replace SimpleLogger with ConsoleLogger (#1045) (@BoZenKhaa),Co-authored-by: Jan Mrkos mrkosja1@fel.cvut.cz,1
1.23.3 bump,0.5684306,- bump version (#1082) (@stevengj),,0
respect should_complete return value from REPLCompletions.completions (#993),0.95829076,- respect should_complete return value from REPLCompletions.completions (#993) (@stevengj),,1
Fix broken link (#997),0.7895061,- Fix broken link (#997) (@bluesmoon),Fix broken link Update docs/src/manual/usage.md Co-authored-by: Fredrik Ekre ekrefredrik@gmail.com,1
Compare kernel.jl files rather than filenames (#1025),0.9622427,- Compare kernel.jl files rather than filenames (#1025) (@bluesmoon),"Comparing filenames means we end up warning on directory level symlinks or file level hardlinks. Using stat instead compares the device, inode, and other details about the file itself.",1
Note about default environment (#1007),0.9200189,- Note about default environment (#1007) (@lamorton),"If you add IJulia to a different environment, then Jupyter won't be able to launch the IJulia kernel automatically.  I got bit by this recent.",1
flush stdio before display (#999),0.9168575,- flush stdio before display (#999) (@stevengj),,1
"Fix io redirection for Julia 1.7, fixes #986. (#989)",0.7875092,- redirect_stdio is broken by Julia 1.7 (#986),,1
fix heartbeat on 1.6 (#985),0.9009143,- fix heartbeat on 1.6 (#985) (@stevengj),,1
add color to error output,0.43639418,- errors thrown from a kernel are not pretty printed (#974),,0
limit=true for error output (fixes #974),0.46837345,- errors thrown from a kernel are not pretty printed (#974),,0
Change uuid to a string in all locations. (#973),0.9458915,- Change uuid to a string in all locations. (#973) (@bluesmoon),"additionally, the call to repr is no longer required.",1
Convert uuid4 to a string before using as msg_id (#972),0.9559174,- Convert uuid4 to a string before using as msg_id (#972) (@bluesmoon),"IJulia.uuid4() is defined as repr(UUIDs.uuid4()), however repr(UUIDs.uuid4()) is rendered as UUID("".......""). The result is that in websocket responses from Jupyter, we see the following: {""msg_id"": ""UUID(\""f160847f-81ef-4c2f-b6b8-68659c81a957\"")"", ""msg_type"": ""status"", ""username"": ""username"", ""date"": ""2021-01-08T20:06:10.647000Z"", ""version"": ""5.3"", ""session"": ""1bbf2086-e46f-4174-bb88-72e75a09479d""}, ""msg_id"": ""UUID(\""f160847f-81ef-4c2f-b6b8-68659c81a957\"")"", ""msg_type"": ""status"", ""parent_header"": {""msg_id"": ""317ec8d3-c7a0-4752-bb0d-137c4149268f"", ""notebook_uuid"": ""07423003-fd24-4681-911a-301054ffbcb7"", ""username"": ""username"", ""msg_type"": ""execute_request"", ""date"": ""2021-01-08T20:06:10.646228Z"", ""version"": ""5.0"", ""session"": ""1bbf2086-e46f-4174-bb88-72e75a09479d""}, ""metadata"": {}, ""content"": {""execution_state"": ""busy""}, ""buffers"": [], ""channel"": ""iopub""}' Wrapping it in a call to string() fixes this issue.",1
add nteract to README (#965),0.9630361,- add nteract to README (#965) (@willingc),,1
Run tagbot on issue comments instead of cron.,0.6587852,"- Set version to 1.21.2, limit tagbot to once per day. (#914) (@fredrikekre)",,0
Set version to 1.23.1.,0.8516114,Set version to 1.21.0. (#899) (fredrikekre),,1
Don't use --startup-file=yes (it is default anyways). (#963),0.95755875,- Don't use --startup-file=yes (it is default anyways). (#963) (@fredrikekre),"Pkg launches subprocesses with the startup file if you explicitly start julia with --startup-file=yes. Since it is default anyway it seems like this can be removed, fixes link.",1
version bump to 1.23,0.6712127,Set version to 1.21.0. (#899) (fredrikekre),,0
Allow users to opt out of the default kernel. (#958),0.9448385,- Allow users to opt out of the default kernel. (#958) (@vchuravy),Allow users to opt out of the default kernel. document IJULIA_NODEFAULTKERNEL Co-authored-by: Steven G. Johnson stevenj@alum.mit.edu,1
"Revert ""support repl_ast_transforms in Julia 1.5 (#947)""",0.8935432,- support repl_ast_transforms in Julia 1.5 (#947) (@stevengj),This reverts commit 4fd955afa15c43af6f137e6d27a112958cc6f0e6.,1
Set version to 1.22.0.,0.86051583,Set version to 1.21.0. (#899) (fredrikekre),,1
"Add kwarg julia to installkernel (to support JupyterHub with containers, etc.) (#948)",0.97432125,"- Add kwarg julia_cmd to installkernel (to support JupyterHub with containers, etc.) (#948) (@oschulz)",,1
Load InteractiveUtils from the IJulia namespace in src/kernel.jl. (#951),0.9919994,- Load InteractiveUtils from the IJulia namespace in src/kernel.jl. (#951) (@fredrikekre),,1
support repl_ast_transforms in Julia 1.5 (#947),0.99254006,- support repl_ast_transforms in Julia 1.5 (#947) (@stevengj),,1
Organize/add docstrings in API docs (#945),0.9177573,- Organize/add docstrings in API docs (#945) (@jlumpe),Remove duplicate documentation src file Explicitly list API docstrings to include and group under headings Add @docs blocks for important functions/types currently missing docstrings.,1
TagBot: use DOCUMENTER_KEY (#944),0.93247414,- TagBot: use DOCUMENTER_KEY (#944) (@DilumAluthge),,1
tag 1.21.3,0.5327821,Tag a release (#898),,0
"Fix the ""dev"" docs badge (#943)",0.9025269,"- Fix the ""dev"" docs badge (#943) (@DilumAluthge)",,1
doc link,0.50799114,- Documentation? (#936),,0
Add documentation with Documenter.jl (#941),0.9015316,- Add documentation with Documenter.jl (#941) (@jlumpe),"Documenter.jl src files with README contents Add public API docs page w/ @autodoc, empty docs page on internals Simplify README Set up documentation deployment Add documentation badges to README Run Pkg.build() in documentation workflow",1
add fallback to complete_type (fixes #935),0.6132201,- respect should_complete return value from REPLCompletions.completions (#993) (@stevengj),,0
ensure text/plain output is valid Unicode (closes #927),0.5296559,- Error in utf-8 decoding (#927),,0
"Set version to 1.21.2, limit tagbot to once per day. (#914)",0.9729216,"- Set version to 1.21.2, limit tagbot to once per day. (#914) (@fredrikekre)",Limit TagBot cronjob to once per day. Set version to 1.21.2.,1
Update [compat] to allow MbedTLS v1 (#912),0.9546263,- Update [compat] to allow MbedTLS v1 (#912) (@jaakkor2),,1
JSON 1,0.38145655,- ensure JSONText is never base64-encoded (#1081) (@stevengj),,0
Install TagBot as a GitHub Action (#901),0.9147866,- Install TagBot as a GitHub Action (#901) (@JuliaTagBot),,1
version bump,0.6042828,- bump version (#1080) (@stevengj),,0
use _set_conda_env to launch jupyter (#900),0.99110997,use _set_conda_env to launch jupyter (#900) (stevengj),,1
Set version to 1.21.0. (#899),0.9611149,Set version to 1.21.0. (#899) (fredrikekre),,1
Use org default funding file.,0.25882268,- Use logo in the documentation (#1064) (@hyrodium),,0
Add support for vega-lite 4 MIME type (#890),0.99070895,Add support for vega-lite 4 MIME type (#890) (davidanthoff),,1
only recognize magics at start of cell (fixes #888),0.53250265,- Cell content disappears  (#919),,0
Bump version,0.65207064,- bump version (#1080) (@stevengj),,0
Add InlineIOContext with Jupyter property. (#876),0.9779379,Add InlineIOContext with Jupyter property. (#876) (travigd),Add InlineIOContext with Jupyter property. Fix test case.,1
"Fix compat bounds for auto-merging, bump version to 1.20.1. (#884)",0.9934419,"Fix compat bounds for auto-merging, bump version to 1.20.1. (#884) (fredrikekre)",,1
make work with ipc transport (#868),0.95600283,make work with ipc transport (#868) (marius311),,1
tag 1.20,0.56125784,Tag a release (#898),,0
whoops,0.28326446,Fix #776,,0
fix jupyter-lab test on Windows (fixes #866),0.76991147,Slight fix to handling of environment variables for jupyter subcommands (137aed4c98a4be788b6a73df2ef74c2667be5611).,,1
tag 1.19,0.61445916,Tag a release (#898),,0
"Fix #855, add required status field for JupyterLab 1.0 (#856)",0.99351054,"Fix #855, add required status field for JupyterLab 1.0 (#856) (drewrobson)",,1
Mention In and Out in README and how to empty them (#853),0.91481483,Mention In and Out in README and how to empty them (#853) (MasonProtter),Mention In and Out in README and how to empty them Update README.md Update README.md Co-Authored-By: Nathan Daly 44379820+rai-nhdaly@users.noreply.github.com Update README.md Co-Authored-By: Nathan Daly 44379820+rai-nhdaly@users.noreply.github.com Update README.md Co-Authored-By: Nathan Daly 44379820+rai-nhdaly@users.noreply.github.com,1
Create FUNDING.yml,0.23385274,- Documentation? (#936),,0
Use DEPOT_PATH[1]... to load startup_ijulia.jl (#846),0.94230825,Use DEPOT_PATH[1]... to load startup_ijulia.jl (#846) (macd),Use DEPOT_PATH[1]... to load startup_ijulia.jl First check that DEPOT_PATH is not empty before loading startup_ijulia.jl,1
short comment on nteract (#842),0.8495922,short comment on nteract to README.md (#842) (PaulSoderlind),,1
add Project.toml,0.3734792,- Add documentation with Documenter.jl (#941) (@jlumpe),,0
need to set LINES/COLS before calling init(),0.41680518,Fix lines/cols in displaysize (475dcbe615fd8f0ec50887fa1e56be6f57409403).,,0
Set --project=@. for the default kernel. (#820),0.56807494,- Correct kernelspec name (#1004) (@jks-liu),,0
fix(vega): add v4 mime type (#821),0.86341137,Add support for vega-lite 4 MIME type (#890) (davidanthoff),"fix(vega): add v4 mime type The v4 mime type is what is currently supported out of the box by Jupyter, v3 requires an extension to be installed style(vegaMime): use list comprehensions",1
Fix Issue #815 (#816),0.74202955,Fix #794.,"Fix bug (I think): evaluate each of the user_expressions, rather than returning them untouched Should have evaluated ex, not code. And ignoring SOFTSCOPE setting, as suggested in link Catch and report errors in evaluating user expressions, as suggested in link whoops, didn't mean to use tab characters Update implemantation of user_expressions to match the IPython reference implementation whoops wrong status",1
path is a pointer to UInt16 (#819),0.40968424,Interrupt messages on Windows (#804) and warning for incorrect kernel path (#809).,,0
Move mode and startup global variable into let block (#813),0.3470673,- Note about default environment (#1007) (@lamorton),Move mode global variable into let block Move startup global variable into let block,0
Implement message interrupt mode (#804),0.5911596,Interrupt messages on Windows (#804) and warning for incorrect kernel path (#809).,Default to message mode for Windows and keep the previous behaviour for all other platforms.,0
tests for the correct kernel.jl (#809),0.71389055,- Compare kernel.jl files rather than filenames (#1025) (@bluesmoon),,1
Update IJulia.jl (#806),0.7432264,IJulia v1.23.3,,1
"if appdata not available, use same fallback as in jupyter_core/paths.py",0.5207533,Respect environment variables XDG_DATA_HOME and JUPYTER_DATA_DIR during build (#796).,,0
Respect environment variables XDG_DATA_HOME and JUPYTER_DATA_DIR (#796),0.91749924,Respect environment variables XDG_DATA_HOME and JUPYTER_DATA_DIR during build (#796).,"See link and Jupyter source file ""jupyter_core/paths.py"".",1
more build logic improvements,0.32512167,- include kspec.jl unconditionally during build (#1079) (@stevengj),,0
restore old behavior of treating empty JUPYTER as conda,0.68858135,use _set_conda_env to launch jupyter (#900) (stevengj),,0
don't convert environment vars to uppercase on non-Windows,0.39544863,- Note about default environment (#1007) (@lamorton),,0
note that you can just launch jupyter directly,0.615335,use _set_conda_env to launch jupyter (#900) (stevengj),,0
don't require jupyter for installation (#791),0.7443606,LoadError: Failed to find or install Jupyter 3.0 or later. (#885),"work on jupyter-free installation rebase fix drop compat, save jupyter pref again, add env to installkernel updated notebook command, also jupyterlab command adapted from #783 installkernel test clean up test output whoops rm another compat reference rm more compatibility code updated docs installkernel is exported add .exe suffix on Windows fix path for windows no compat only prompt once for jupyterlab install",1
ignore MIME types that throw errors during display (#777),0.6521045,Custom MIME display (#755).,"ignore MIME types that throw errors during display (fixes #776), split display into separate file tweak test fix",0
close #771: always send text/latex if it is available,0.33621955,Closed issues:,,0
refactor: simplify map call (#775),0.3608563,Fix #776,,0
Base.Markdown -> Markdown (fixes #769),0.4906876,Fix #794.,,0
ENH: support plotly mimetype (#773),0.4768514,- Not seeing any output after running plotly() with julia 1.9 (#1073),,0
store prefs in depot_path/prefs (#760),0.51557064,Use DEPOT_PATH[1]... to load startup_ijulia.jl (#846) (macd),"store prefs in depot_path/prefs As a stopgap until we get proper package options (JuliaLang/Juleps#38), store JUPYTER preference in depot_path/prefs/IJulia so that it isn't forgotten when IJulia is updated.  See also JuliaPy/PyCall.jl#589 misplaced const",0
"Fix typo in display_mimestring, display_mimejson. (#757)",0.6272877,Custom MIME display (#755).,,0
Add custom MIME types to display_dict. (#755),0.73634017,Custom MIME display (#755).,"Add custom MIME types to display_dict. Add tests, fix markdown/latex priority. Improve documentation. Update MIME priority of png/jpeg and html. register_ijulia_mime -> register_mime Vector -> AbstractVector, add test cases for vector-of-MIMEs Fix more types!",1
Update README.md,0.49661738,add info on nteract to README.md? (#841),,0
Tell the user to install the jupyter-client package on Debian (#754),0.6975361,- Package name should ideally be Jupyter.jl (#904),Tell the user to install the jupyter-client package on Debian Update README.md,0
Don't load startup_ijulia.jl with --startup-file=no (#748),0.6799958,- IJulia/kernel.jl should not change the global_logger (#1018),,0
Check for startup_ijulia.jl and load it if present (#745),0.7099136,Use DEPOT_PATH[1]... to load startup_ijulia.jl (#846) (macd),,1
fix 0.7 deprecation,0.8982443,Fix more 0.7 deprecations.,,1
use new ZMQ api (#729),0.58966607,"Drop Julia 0.6 support, use the ZMQ 1.0 API (#729).",use new ZMQ api require ZMQ 1.0,0
silence 0.7 deprecation about Base.Dates,0.42217177,Fix more 0.7 deprecations.,,0
drop more 0.6 code (#728),0.4590328,How does this code work? (#861),,0
drop 0.6 support in master (#726),0.5447801,Fix more 0.7 deprecations.,,0
default to soft global scope (#720),0.46678445,- Handling of local y = (x = i) in soft scope (#938),,0
fixed read me file for updated Pkg keyword use (#714),0.555664,"Support pkg commands in 0.7 (#715), use soft global scope in 0.7 (#720), unique completions (#712).",Pkg.* keywords don't work without importing 'Pkg'. Updated read-me so that there's no confusion.,0
replicate REPL pkg mode for cells starting with ] (#715),0.41710937,- Cell content disappears  (#919),,0
Move flush_all() out from @async (#693) (#711),0.404607,- flush stdio before display (#999) (@stevengj),Move flush_all() out from @async no need for async around idle message,0
make sure completions are unique (#712),0.54393303,- respect should_complete return value from REPLCompletions.completions (#993) (@stevengj),See JuliaLang/julia#28694,0
corrections to history function (fixes #706),0.5457797,"Fix shell mode (#703), Revise (#708), and history (#706).",,0
Fix CI (#710),0.5214419,Fix #776,,0
"Check whether Revise is running at startup, and if so configure it (#708)",0.45442605,"Fix shell mode (#703), Revise (#708), and history (#706).","Revise checks whether IJulia is running in its init function, and if so defines an appropriate preexecute_hook. However, I believe most users of Revise who also use the REPL configure it in their .julia/config/startup.jl script. It appears that this script runs before IJulia is loaded, and as a consequence Revise has no chance to detect whether it should define the hook. To make both work independent of load order, we therefore have to check symmetrically: Revise checks for IJulia, and IJulia checks for Revise. Fixes link",0
Fix shell mode for Julia 1.0 (#703),0.6347326,- Kernel does not start with Julia 1.9 (#1062),"replace(string::AbstractString, pat, r[, n::Integer=0]) gets removed in Julia 1.0. The new signature is replace(s::AbstractString, pat=>r; [count::Integer]).",0
more 0.7 updates (#696),0.631735,Fix more 0.7 deprecations.,,0
Make ipy_mime variable more readable (#694),0.61684394,Custom MIME display (#755).,,0
"use IJULIA_DEBUG env var to enable debugging output in build, rather than requiring user to edit the source",0.5182469,Feature Request : Allow IJulia to run on root. (#895),,0
set the context_module for the REPLCompletions (#680),0.37559938,Add InlineIOContext with Jupyter property. (#876) (travigd),set the context_module for the REPLCompletions Update handlers.jl,0
Monkeypatch Compat.stdio to match Base. (#691),0.4054591,"- Unlike in REPL, passing (e, catch_backtrace()) to the @error macro displays unreadable raw stacktrace instead of text representation (#1043)",,0
fix #688 (? cells),0.5938561,- Cell content disappears  (#919),,0
fix #682: using InteractiveUtils on 0.7 (#687),0.555042,"- v1.21.4 breaks IJulia with ""InteractiveUtils not defined"" Error (#955)",,0
fix #678: override Julia prompt and getpass,0.5763356,- redirect_stdio is broken by Julia 1.7 (#986),,0
update new REPLCompletions API (fixes #679),0.4422844,- Proposed fix for #986. (#989) (@rgobbel),,0
fix chr2ind deprecation,0.4333431,Fix more 0.7 deprecations.,,0
a few more 0.7 updates (#672),0.63818383,Fix more 0.7 deprecations.,findlast/first updates tighten where clause another showable call having pop_foo_hook throw an error if the hook wasn't found seems fine missing paren findlast -> Compat.findlast,0
fixes for 0.7 (#671),0.7129624,Fix more 0.7 deprecations.,"0.7 compatibility (mostly) update appveyor to test nightly too fix merge error missing compat in kernel.jl REPL.REPLCompletions is now in the stdlib don't force Compat into user notebooks fix more deprecations and a crash in heartbeat fix more 0.7 deprecations don't use uppercase STDIO on 0.7 whitespace Add logging override for 0.7 Fix stdout messages not being sent Julia 0.7 changed the String() constructor to deplete Vector{UInt8} arguments, so we must copy() them first to avoid clobbering. fix empty try-catch deprecation add build.log to .gitignore add Conda before using it fix deprecation from spawn use Compat.AbstractDisplay directly Misc 0.7 changes warn() -> at-warn emtpy try-catch remove_destination -> force start -> firstindex endof -> lastindex broadcast + replace global logger in init() test explicit stdout/stderr printing",1
default to system jupyter on non-Apple unices (fixes #615),0.6483453,Slight fix to handling of environment variables for jupyter subcommands (137aed4c98a4be788b6a73df2ef74c2667be5611).,,0
Don't send vega if vega-lite is being sent (#669),0.5390555,Add support for vega-lite 4 MIME type (#890) (davidanthoff),,0
Add application/vnd.vega.v3+json MIME type (#668),0.7493585,Add support for vega-lite 4 MIME type (#890) (davidanthoff),,1
Removed idle_delay! (#655),0.39731607,Fix #794.,,0
Add support for the dataresource MIME type (#630),0.5929639,Add support for vega-lite 4 MIME type (#890) (davidanthoff),Use JSON.JSONText for vegalite mime type Add support for vnd.dataresource mime type,0
super useful info (#656),0.45610607,- Update help link (#1006) (@raphbacher),that is mentioned on some issue but not in the readme...,0
require ZMQ 0.6 for upcoming 0.7 support,0.61121434,"Drop Julia 0.6 support, use the ZMQ 1.0 API (#729).",,0
Ensure copied code in readme can be rerun (#653),0.31592605,short comment on nteract to README.md (#842) (PaulSoderlind),,0
fix heartbeat thread for latest ZMQ,0.61336833,- fix heartbeat on 1.6 (#985) (@stevengj),,0
allow setting the module which code gets evaluated in (#651),0.32638955,- UndefVarError: execute_msg not defined (#1077),,0
Drop Julia v0.5 (#642),0.70749015,"Drop Julia 0.5 (#642), redirect fixes (#641), JupyterLab fixes, module-evaluation control (#651), compatibility with ZMQ.jl master.",stop testing v0.5 on Travis drop Julia v0.5 entirely,1
"implement Base.redirect_{stdout,stderr,stdin} (#641)",0.4646829,- redirect_stdio is broken by Julia 1.7 (#986),"implement Base.redirect_{stdout,stderr,stdin} fix test brittleness only allow stdio redirection for the matching IJulia stream",0
Typo and grammatical corrections (#643),0.60189915,Fix #776,"Typo and grammatical corrections Changed ""behaviour"" to ""behavior""",0
"Remove further ""source"" => ""julia"" mappings for JupyterLab compat (#638)",0.72561806,- Jupyterlab won't work with Julia 1.5 and Python 3.7.7 (#939),,1
Add metadata to complete_reply (#632),0.5104933,- respect should_complete return value from REPLCompletions.completions (#993) (@stevengj),"Add metadata to complete request Improved compact display Remove extra definition Use eval only for symbols Add keywords, latex symbols and emojis completion Remove empty catch statement",0
"Remove ""source"" => ""julia"" mapping (#633)",0.6068755,"Julia 0.6 fixes, dropping Julia 0.4, switching to MbedTLS instead of Nettle.",This does not seem to be supported in JupyterLab 0.31.  See this link [0] for more detail [0] link,0
more informative error message when JUPYTER is not a valid executable,0.64547265,Slight fix to handling of environment variables for jupyter subcommands (137aed4c98a4be788b6a73df2ef74c2667be5611).,,0
Update to latest CodeMirror commit (#627),0.42624757,- Proposed fix for #986. (#989) (@rgobbel),This provides correct syntax highlighting for struct.,0
fix (x...) deprecation,0.7612525,Fix more 0.7 deprecations.,,1
Fix Windows package locations (#619),0.36783332,Permissions problems similar to Issue #616 (#845),,0
Allow failures for builds on julia nightlies (#622),0.5043915,"Drop Julia 0.5 (#642), redirect fixes (#641), JupyterLab fixes, module-evaluation control (#651), compatibility with ZMQ.jl master.",,0
Embed vega-lite JSON directly in JSON message (#621),0.5849179,Add support for vega-lite 4 MIME type (#890) (davidanthoff),,0
Add %qtconsole magic (#620),0.3974775,- Add Julia svg logo (#1053) (@steff456),Add %qtconsole magic Warn if qtconsole is called outside a running IJulia session Error if qtconsole is called outside an IJulia session,0
Capture the parent message locally for idle messages (#618),0.31864867,- Convert uuid4 to a string before using as msg_id (#972) (@bluesmoon),Capture the parent message locally for idle messages @async no longer implicitly captures variables (link) Add note about changes in @async behavior Update eventloop.jl,0
Add vega-lite mime type (#611),0.9159255,Add support for vega-lite 4 MIME type (#890) (davidanthoff),,1
"Use uppercase, lowercase, and now from Compat (#605)",0.37676716,"Fix shell mode (#703), Revise (#708), and history (#706).",use lowercase from Compat.Unicode fix compatibility with 0.7,0
fix setup_stdio for IJuliaStdio (fixes #604),0.600968,- IJulia fails on 1.7 with Mac M1 (#1027),,0
"fix IO colorization for Julia 0.7, remove some type piracy hacks",0.5818139,"Julia 0.6 fixes, dropping Julia 0.4, switching to MbedTLS instead of Nettle.",,0
Fix findfirst depreciation (#598),0.33700466,- Indentation error (#1070),Fix findfirst depreciation equalto is only available in Julia 0.7. When support for Julia 0.6 is dropped it can be changed. Bumping Compat to 0.33.0 Properly compat.,0
allow display of arbitrary MIME types via explict display calls (closes #595),0.6342486,Custom MIME display (#755).,,0
handle 0 indices in more cases (for #589),0.35295495,- Zero before another number breaks ijulia (#907),,0
Merge pull request #588 from JuliaLang/yyc/0.7,0.6250022,Merged pull requests:,Fix 0.7 depwarns,0
Fix 0.7 depwarns,0.5976842,Fix more 0.7 deprecations.,,0
Merge pull request #587 from JuliaLang/yyc/0.7,0.62913895,Merged pull requests:,Fix most depwarns on 0.7,0
Fix most depwarns on 0.7,0.6528379,Fix more 0.7 deprecations.,,0
Allows adding metadata to comm_open message (#583),0.41770524,Custom MIME display (#755).,,0
"widen chr2ind signature, fixes #564",0.4040333,Fix #776,,0
update to using tuple type for cfunction (#577),0.3327776,Fix #776,,0
