Index,Message,Description,Message Abstract,Description Abstract
129,Expose close function for Menu and Menu.Item components (#1897)," expose close function for Menu and Menu.Item components  The Menu will already automatically close if you invoke the Menu.Item (which is typically an a or a button). However you have control over this, so if you add an explicit onClick={e => e.preventDefault()} then we respect that and don't execute the default behavior, ergo closing the menu. The problem occurs when you are using another component like the Inertia Link component, that does have this e.preventDefault() built-in to guarantee SPA-like page transitions without refreshing the browser. Because of this, the menu will never close (unless you go to a totally different page where the menu is not present of course). This is where the explicit close function comes in, now you can use that function to ""force"" close a menu, if your 3rd party tool already bypassed the default behaviour. This API is also how we do it in the Popover component for scenario's where you can't rely on the default behaviour.  update changelog",Expose close function for Menu and Menu.Item components (#1897),"expose close function for Menu and Menu.Item components The Menu will already automatically close if you invoke the Menu.Item (which is typically an a or a button). However you have control over this, so if you add an explicit onClick={e => e.preventDefault()} then we respect that and don't execute the default behavior, ergo closing the menu. The problem occurs when you are using another component like the Inertia Link component, that does have this e.preventDefault() built-in to guarantee SPA-like page transitions without refreshing the browser. Because of this, the menu will never close (unless you go to a totally different page where the menu is not present of course). This is where the explicit close function comes in, now you can use that function to ""force"" close a menu, if your 3rd party tool already bypassed the default behaviour. This API is also how we do it in the Popover component for scenario's where you can't rely on the default behaviour. update changelog"
130,Fix <Popover.Button as={Fragment} /> crash (#1889), prevent infinite loop  When you use as={Fragment} an unmount and remount can happen. This means that the ref gets called with null for the unmount and HTMLButtonElement for the mount. This keeps toggling which results in an infinite loop and eventually a Maximum callback size exceeded issue. This ensures that we only set the button if we have a button.  update changelog,Fix  crash (#1889),prevent infinite loop When you use as={Fragment} an unmount and remount can happen. This means that the ref gets called with null for the unmount and HTMLButtonElement for the mount. This keeps toggling which results in an infinite loop and eventually a Maximum callback size exceeded issue. This ensures that we only set the button if we have a button. update changelog
131,1.7.3,,1.7.3,
132,Fix Tab incorrectly activating on focus event (#1887)," rework Tabs so that they don't change on focus  The ""change on focus"" was an incorrect implementation detail that made it a bit easier but this causes a problem as seen in #1858. If you want to conditionally check if you want to change the tab or note (e.g. by using window.confirm) then the focus is lost while the popup is shown. Regardless of your choice, the browser will re-focus the Tab therefore asking you again what you want to do. This fixes that by only activating the tab if needed while using arrow keys or when you click the tab (not when it is focused).  update changelog",Fix Tab incorrectly activating on focus event (#1887),"rework Tabs so that they don't change on focus The ""change on focus"" was an incorrect implementation detail that made it a bit easier but this causes a problem as seen in #1858. If you want to conditionally check if you want to change the tab or note (e.g. by using window.confirm) then the focus is lost while the popup is shown. Regardless of your choice, the browser will re-focus the Tab therefore asking you again what you want to do. This fixes that by only activating the tab if needed while using arrow keys or when you click the tab (not when it is focused). update changelog"
133,Fix useOutsideClick swallowing events inside ShadowDOM (#1886),  check inside shadow dom for use-outside-click   update changelog   Co-authored-by: Raphael Melloni raphael.melloni@nortal.com,Fix useOutsideClick swallowing events inside ShadowDOM (#1886),check inside shadow dom for use-outside-click update changelog Co-authored-by: Raphael Melloni raphael.melloni@nortal.com
134,Fix crash when children are undefined (#1885),  ensure children always exist   update changelog ,Fix crash when children are undefined (#1885),ensure children always exist update changelog
135,update changelog,,update changelog,
136,Improve Portal detection for Popover components (#1842),  improve Popover heuristics for detecting being inside a Portal   improve performance of checks   make it work in Vue   verify behaviour in tests ,Improve Portal detection for Popover components (#1842),improve Popover heuristics for detecting being inside a Portal improve performance of checks make it work in Vue verify behaviour in tests
137,Fix use of undefined and displayValue in Combobox (#1865),  Work around Vue multi-source + undefined bug   Update changelog ,Fix use of undefined and displayValue in Combobox (#1865),Work around Vue multi-source + undefined bug Update changelog
138,Internal: Refactor Vue playground (#1864),  Add dynamic routes to Vue playground   Simplify   Upgrade to Vite 3.0   Use TypeScript ,Internal: Refactor Vue playground (#1864),Add dynamic routes to Vue playground Simplify Upgrade to Vite 3.0 Use TypeScript
139,1.7.2,,1.7.2,
140,Ensure we handle the static prop in Tab.Panel components correctly (#1856),  ensure we handle static panels   update changelog ,Ensure we handle the static prop in Tab.Panel components correctly (#1856),ensure we handle static panels update changelog
141,Prevent option selection in ComboboxInput while composing (#1850),  Fix should do nothing when event is fired within a composing session   update changelog   link to PR instead of issue   Co-authored-by: Robin Malfait malfait.robin@gmail.com,Prevent option selection in ComboboxInput while composing (#1850),Fix should do nothing when event is fired within a composing session update changelog link to PR instead of issue Co-authored-by: Robin Malfait malfait.robin@gmail.com
142,1.7.1,,1.7.1,
143,Remove forceRerender from Tab component (#1846)," remove forceRerender code  This was necessary to ensure the Panel and the Tab were properly connected with eachother because it could happen that the Tab renders but the corresponding Panel is not the active one which means that it didn't have a DOM node and no id attached. Whenever new Tab became active, it rerendered but the Panel wasn't available yet, after that the Panel rendered and an id was available but the actual Tab was already rendered so there was no link between them. We then forced a re-render because now the Panel does have a DOM node ref attached and the aria-labelledby could be filled in. However, in #1837 we fixed an issue where the order of Tab elements with their corresponding Panel elements weren't always correct. To fix this we ensured that the Panel always rendered a <Hidden /> component which means that a DOM node is always available. This now means that we can get rid of the forceRerender.  update changelog",Remove forceRerender from Tab component (#1846),"remove forceRerender code This was necessary to ensure the Panel and the Tab were properly connected with eachother because it could happen that the Tab renders but the corresponding Panel is not the active one which means that it didn't have a DOM node and no id attached. Whenever new Tab became active, it rerendered but the Panel wasn't available yet, after that the Panel rendered and an id was available but the actual Tab was already rendered so there was no link between them. We then forced a re-render because now the Panel does have a DOM node ref attached and the aria-labelledby could be filled in. However, in #1837 we fixed an issue where the order of Tab elements with their corresponding Panel elements weren't always correct. To fix this we ensured that the Panel always rendered a  component which means that a DOM node is always available. This now means that we can get rid of the forceRerender. update changelog"
144,Ensure Combobox.Label is properly linked when rendered after Combobox.Button and Combobox.Input components (#1838), ensure Combbox.Label is properly linked when rendered after other components  Even when rendered after the Combobox.Input / Combobox.Button  update changelog,Ensure Combobox.Label is properly linked when rendered after Combobox.Button and Combobox.Input components (#1838),ensure Combbox.Label is properly linked when rendered after other components Even when rendered after the Combobox.Input / Combobox.Button update changelog
145,"Ensure Tab order stays consistent, and the currently active Tab stays active (#1837)"," ensure tabs order stays consistent  This ensures that whenever you insert or delete tabs before the current tab, that the current tab stays active with the proper panel. To do this we had to start rendering the non-visible panels as well, but we used the Hidden component already which is position fixed and completely hidden so this should not break layouts where using flexbox or grid.   update changelog   fix TypeScript issue ","Ensure Tab order stays consistent, and the currently active Tab stays active (#1837)","ensure tabs order stays consistent This ensures that whenever you insert or delete tabs before the current tab, that the current tab stays active with the proper panel. To do this we had to start rendering the non-visible panels as well, but we used the Hidden component already which is position fixed and completely hidden so this should not break layouts where using flexbox or grid. update changelog fix TypeScript issue"
146,Add <fieldset disabled> check to radio group options in React (#1835),  wip   Update changelog ,Add  check to radio group options in React (#1835),wip Update changelog
147,Improve iOS scroll locking (#1830)," use a simpler position: fixed approach to prevent scroll locking  This isn't super ideal, but just preventing the default behavior on the entire document while touchmove-ing isn't ideal either because then you can't scroll inside the dialog or on the backdrop if your dialog panel is larger than the viewport. Again, this is not 100% correct, but it is better because you will be able to scroll the dialog, and not the body.  update changelog",Improve iOS scroll locking (#1830),"use a simpler position: fixed approach to prevent scroll locking This isn't super ideal, but just preventing the default behavior on the entire document while touchmove-ing isn't ideal either because then you can't scroll inside the dialog or on the backdrop if your dialog panel is larger than the viewport. Again, this is not 100% correct, but it is better because you will be able to scroll the dialog, and not the body. update changelog"
148,@headlessui/tailwindcss — 0.1.1,,@headlessui/tailwindcss — 0.1.1,
149,1.7.0,,1.7.0,
150,Tweak changelogs,,Tweak changelogs,
151,"Fix ""blank"" screen on initial load of Transition component (#1823)","  use a ""cancellable"" microTask   update changelog ","Fix ""blank"" screen on initial load of Transition component (#1823)","use a ""cancellable"" microTask update changelog"
152,Fix maximum call stack size exceeded error on Tab component when using as={Fragment} (#1826),,Fix maximum call stack size exceeded error on Tab component when using as={Fragment} (#1826),
153,fix incorrect links in CHANGELOGs,,fix incorrect links in CHANGELOGs,
154,Improve scroll lock on iOS (#1824),  improve Dialog scroll lock on iOS   add Dialog example to playground that's scrollable   update changelog ,Improve scroll lock on iOS (#1824),improve Dialog scroll lock on iOS add Dialog example to playground that's scrollable update changelog
155,Expose the value from the Combobox and Listbox components render prop (#1822),  expose the value for Combobox and Listbox   update changelog ,Expose the value from the Combobox and Listbox components render prop (#1822),expose the value for Combobox and Listbox update changelog
156,Fix ref stealing from children (#1820)," fix ref stealing  When a higher-level component (like Transition) provides a ref to its child component, then it will override the ref that was potentially already on the child. This will make sure that these are merged together correctly. Fixes: #985  update changelog",Fix ref stealing from children (#1820),"fix ref stealing When a higher-level component (like Transition) provides a ref to its child component, then it will override the ref that was potentially already on the child. This will make sure that these are merged together correctly. Fixes: #985 update changelog"
157,Fix nullable by prop for combobox and radio group (#1815),  Fix nullable by prop for combobox and radio group   Update changelog ,Fix nullable by prop for combobox and radio group (#1815),Fix nullable by prop for combobox and radio group Update changelog
158,Allow the by prop (as a string) to handle null values (#1814),  Allow the by prop (as a string) to handle null values   Update changelog ,Allow the by prop (as a string) to handle null values (#1814),Allow the by prop (as a string) to handle null values Update changelog
159,Improve accessibility when announcing Listbox.Option and Combobox.Option components (#1812)," ensure that aria-selected is explicitly set to false  The WAI-ARIA Best Practices don't recommend this and prefer aria-selected: true or undefined (aka not existing when it is ""false""). However in practice, both MacOS VoiceOver and NVDA experience strange issues if you don't do this (e.g.: everything before the selected item is also selected)   update tests to ensure we are checking for aria-selected=false   update changelog ",Improve accessibility when announcing Listbox.Option and Combobox.Option components (#1812),"ensure that aria-selected is explicitly set to false The WAI-ARIA Best Practices don't recommend this and prefer aria-selected: true or undefined (aka not existing when it is ""false""). However in practice, both MacOS VoiceOver and NVDA experience strange issues if you don't do this (e.g.: everything before the selected item is also selected) update tests to ensure we are checking for aria-selected=false update changelog"
160,update changelog,,update changelog,
161,Ensure enter transitions work when using unmount={false} (#1811),  ensure we never start transitioning while the node is still hidden   update changelog ,Ensure enter transitions work when using unmount={false} (#1811),ensure we never start transitioning while the node is still hidden update changelog
162,Fix Transition component's incorrect cleanup and order of events (#1803),  improve tracking of transitionableChildren   remove weird outlier snapshots   If anything is still wrong the tests will still fail but the diffs will be easier to read.   remove event handling from useTransition   handle before/after events in Transition directly   fix incorrect logic bug in tests   add very explicit test for transition event order   ignore flakey tests for now   We will get back to these!   ensure cancellation of transitions works properly   update changelog ,Fix Transition component's incorrect cleanup and order of events (#1803),improve tracking of transitionableChildren remove weird outlier snapshots If anything is still wrong the tests will still fail but the diffs will be easier to read. remove event handling from useTransition handle before/after events in Transition directly fix incorrect logic bug in tests add very explicit test for transition event order ignore flakey tests for now We will get back to these! ensure cancellation of transitions works properly update changelog
163,Stop scrolling when hitting end of focus trap (#1789),  wip   wip   fix it   fixit   update changelog ,Stop scrolling when hitting end of focus trap (#1789),wip wip fix it fixit update changelog
164,Only restore focus to the Menu.Button if necessary when activating a Menu.Option (#1782), only restore focus to the Menu Button if necessary  This will check whether the focus got moved to somewhere else or not once we activate an item via click or pressing enter. Pressing escape will still move focus to the Menu Button.  update changelog,Only restore focus to the Menu.Button if necessary when activating a Menu.Option (#1782),only restore focus to the Menu Button if necessary This will check whether the focus got moved to somewhere else or not once we activate an item via click or pressing enter. Pressing escape will still move focus to the Menu Button. update changelog
165,Improve the types of the Combobox component (#1761)," improve types of Combobox  Now given the multiple and/or nullable props we ensure that the types for the value, defaultValue, onChange, by, render prop, ... are all correct. You will also be able to easily tell which type to use instead of inferring it by doing something like this: ```tsx <Combobox   value={...}   onChange={...}   ...  ...  ```   update changelog",Improve the types of the Combobox component (#1761),"improve types of Combobox Now given the multiple and/or nullable props we ensure that the types for the value, defaultValue, onChange, by, render prop, ... are all correct. You will also be able to easily tell which type to use instead of inferring it by doing something like this: ```tsx <Combobox   value={...}   onChange={...}   ... ... ``` update changelog"
166,Fix displayValue syncing problem (#1755),  ensure syncInputValue is updated correctly   WIP   WIP   Don’t resync on open   Fix react value syncing   update   Add comment   Port new setup over to Vue   Remove inputPropsRef   We hardly knew ye   Remove repro   Cleanup   Update changelog   Co-authored-by: Robin Malfait malfait.robin@gmail.com,Fix displayValue syncing problem (#1755),ensure syncInputValue is updated correctly WIP WIP Don’t resync on open Fix react value syncing update Add comment Port new setup over to Vue Remove inputPropsRef We hardly knew ye Remove repro Cleanup Update changelog Co-authored-by: Robin Malfait malfait.robin@gmail.com
167,"Only select the active option when using ""singular"" mode (#1750)","  only select the active option when using ""singular"" mode   update changelog ","Only select the active option when using ""singular"" mode (#1750)","only select the active option when using ""singular"" mode update changelog"
168,Ensure Disclosure.Panel is properly linked (#1747),  ensure Disclosure.Panel is properly linked   update changelog ,Ensure Disclosure.Panel is properly linked (#1747),ensure Disclosure.Panel is properly linked update changelog
169,fixes tailwindlabs/headlessui#1733 (#1734),,fixes tailwindlabs/headlessui#1733 (#1734),
170,Fix person removal from Combobox/Listbox demos (#1603),  Fix person removal from Combobox/Listbox demos   Reset query on focus for Combobox demo with multiple items ,Fix person removal from Combobox/Listbox demos (#1603),Fix person removal from Combobox/Listbox demos Reset query on focus for Combobox demo with multiple items
171,Allow MouseEventHandler types to passed close from Popovers (#1696),  fix: adds the MouseEventHandler type to close   WIP   WIP   Update changelog   Co-authored-by: Jordan Pittman jordan@cryptica.me,Allow MouseEventHandler types to passed close from Popovers (#1696),fix: adds the MouseEventHandler type to close WIP WIP Update changelog Co-authored-by: Jordan Pittman jordan@cryptica.me
172,Improve Combobox re-opening keyboard issue on mobile (#1732)," prevent re-focusing Combobox Input after choosing selection  On mobile this gives a bit of annoying results where after choosing an option, the keyboard is shown again because the input is focused again.  update changelog",Improve Combobox re-opening keyboard issue on mobile (#1732),"prevent re-focusing Combobox Input after choosing selection On mobile this gives a bit of annoying results where after choosing an option, the keyboard is shown again because the input is focused again. update changelog"
173,update changelog,,update changelog,
174,Make form components uncontrollable (#1683)," implement uncontrolled form components  A few versions ago we introduced compatibility with the native form element. This means that behind the scenes we render hidden inputs that are kept in sync which allows you to submit your normal form and get data via new FormData(event.currentTarget). Before this change every form related component (Switch, RadioGroup, Listbox and Combobox) always had to be passed a value and an onChange regardless of this change. This change will allow you to not even use the value and the onChange at all and keep it completely uncontrolled. This has some changes:  value is made optional onChange is made optional (but will still be called if passed   regardless of being controlled or uncontrolled) defaultValue got added so that you can still pre-fill your values   with known values. value render prop got exposed so that you can still use this while   rendering.  This should also make it completely compatible with tools like Remix without wiring up your own state.   update example combinations/form playground to use uncontrolled components   improve types, add missing render prop arguments   add tests for uncontrolled components (React)   implement uncontrolled form elements in Vue ",Make form components uncontrollable (#1683),"implement uncontrolled form components A few versions ago we introduced compatibility with the native form element. This means that behind the scenes we render hidden inputs that are kept in sync which allows you to submit your normal form and get data via new FormData(event.currentTarget). Before this change every form related component (Switch, RadioGroup, Listbox and Combobox) always had to be passed a value and an onChange regardless of this change. This change will allow you to not even use the value and the onChange at all and keep it completely uncontrolled. This has some changes: value is made optional onChange is made optional (but will still be called if passed   regardless of being controlled or uncontrolled) defaultValue got added so that you can still pre-fill your values   with known values. value render prop got exposed so that you can still use this while   rendering. This should also make it completely compatible with tools like Remix without wiring up your own state. update example combinations/form playground to use uncontrolled components improve types, add missing render prop arguments add tests for uncontrolled components (React) implement uncontrolled form elements in Vue"
175,Improve TypeScript 4.7 NodeNext compatibility (#1721),  update script to mass-update import/export statements   rewrite imports on .d.ts files   add idempotency comment ,Improve TypeScript 4.7 NodeNext compatibility (#1721),update script to mass-update import/export statements rewrite imports on .d.ts files add idempotency comment
176,Don’t overwrite element.focus on popover panels (#1719),  Don’t overwrite element.focus on popover panels   Update changelog   Add test   This test isn’t exactly right for JSDOM but it does mirror what we would do in the browser to reproduce the problem,Don’t overwrite element.focus on popover panels (#1719),Don’t overwrite element.focus on popover panels Update changelog Add test This test isn’t exactly right for JSDOM but it does mirror what we would do in the browser to reproduce the problem
177,Ensure by comparison is used in multiple mode (#1717),  use the compare function in multiple mode   add tests to verify fix of incorrect by behaviour   improve TypeScript types for the by prop   update changelog ,Ensure by comparison is used in multiple mode (#1717),use the compare function in multiple mode add tests to verify fix of incorrect by behaviour improve TypeScript types for the by prop update changelog
