Index,Message,Description,Message Abstract,Description Abstract
1,Handle clicks inside iframes (#2485),  Handle clicks inside iframes   Update changelog ,Handle clicks inside iframes (#2485),Handle clicks inside iframes Update changelog
2,Improve control over Menu and Listbox options while searching (#2471),"  add get-text-value helper   use getTextValue in Listbox component   use getTextValue in Menu component   update changelog   ensure we handle multiple values for aria-labelledby   hoist regex   drop child nodes instead of replacing its innerText   This makes it a bit slower but also more correct. We can use a cache on another level to ensure that we are not creating useless work.  add useTextValue to improve performance of getTextValue  This will add a cache and only if the innerText changes, only then will we calculate the new text value.  use better useTextValue hook",Improve control over Menu and Listbox options while searching (#2471),"add get-text-value helper use getTextValue in Listbox component use getTextValue in Menu component update changelog ensure we handle multiple values for aria-labelledby hoist regex drop child nodes instead of replacing its innerText This makes it a bit slower but also more correct. We can use a cache on another level to ensure that we are not creating useless work. add useTextValue to improve performance of getTextValue This will add a cache and only if the innerText changes, only then will we calculate the new text value. use better useTextValue hook"
3,Move types condition to the front (#2469),  move types condition to the front   Update changelog    Co-authored-by: Jordan Pittman jordan@cryptica.me,Move types condition to the front (#2469),move types condition to the front Update changelog Co-authored-by: Jordan Pittman jordan@cryptica.me
4,Stop <Transition appear> from overwriting classes on re-render (#2457), Add raw layout support to Vue playground  We can’t use ?raw here because Vite uses that itself for stuff. So here we opt for ?layout=raw instead   Fix Transition for appear overwriting classes on re-render   Set initial state just before animating   Remove unused import   Refactor   Capture snapshot of element just after first render   With the new setInitial call before the animation starts — we don’t see the actual initial render result in this test because the queue has been emptied by the time it ends  Update changelog,Stop  from overwriting classes on re-render (#2457),Add raw layout support to Vue playground We can’t use ?raw here because Vite uses that itself for stuff. So here we opt for ?layout=raw instead Fix Transition for appear overwriting classes on re-render Set initial state just before animating Remove unused import Refactor Capture snapshot of element just after first render With the new setInitial call before the animation starts — we don’t see the actual initial render result in this test because the queue has been emptied by the time it ends Update changelog
5,Ensure the exposed activeIndex is up to date for the Combobox component (#2463),  ensure the exposed activeIndex is up to date   update changelog ,Ensure the exposed activeIndex is up to date for the Combobox component (#2463),ensure the exposed activeIndex is up to date update changelog
6,refactor Portal to use useOnUnmount hook (#2458),,refactor Portal to use useOnUnmount hook (#2458),
7,ensure cb in useOnUnmount is a stable reference,,ensure cb in useOnUnmount is a stable reference,
8,Ensure FocusTrap is only active when the given enabled value is true (#2456),  fix(tabs): wrong tab focus when Tab contains a Dialog   refactor(focus-trap): rename variable and move logic   test(tabs): improve test by asserting the active element   ensure FocusTrap is not active when enabled = false   fix: move the enabled check to unmounting   refactor to useOnUnmount hook   This will allow us to make the code relatively similar between React and Vue.  update changelog   Co-authored-by: Robin Malfait malfait.robin@gmail.com,Ensure FocusTrap is only active when the given enabled value is true (#2456),fix(tabs): wrong tab focus when Tab contains a Dialog refactor(focus-trap): rename variable and move logic test(tabs): improve test by asserting the active element ensure FocusTrap is not active when enabled = false fix: move the enabled check to unmounting refactor to useOnUnmount hook This will allow us to make the code relatively similar between React and Vue. update changelog Co-authored-by: Robin Malfait malfait.robin@gmail.com
9,cleanup .gitignore,Co-authored-by: Noel De Martin noeldemartin@hey.com,cleanup .gitignore,Co-authored-by: Noel De Martin noeldemartin@hey.com
10,[internal] add demo mode to Menu and Popover components (#2448),  add demo mode to Menu and Popover   update changelog ,[internal] add demo mode to Menu and Popover components (#2448),add demo mode to Menu and Popover update changelog
11,Correctly handle IME composition in <Combobox.Input> (#2426),  Don’t try to open combobox when composing characters   wip   Delay IME composition end until after keydown events   Use d.nextFrame to handle compositionend event   Update changelog ,Correctly handle IME composition in  (#2426),Don’t try to open combobox when composing characters wip Delay IME composition end until after keydown events Use d.nextFrame to handle compositionend event Update changelog
12,Fix memory leak in Popover component (#2430),  move useTabDirection and handleFocus to setup instead of render function   update changelog ,Fix memory leak in Popover component (#2430),move useTabDirection and handleFocus to setup instead of render function update changelog
13,1.7.13 - @headlessui/vue,,1.7.13 - @headlessui/vue,
14,0.1.3 - @headlessui/tailwindcss,,0.1.3 - @headlessui/tailwindcss,
15,1.7.14 - @headlessui/react,,1.7.14 - @headlessui/react,
16,update changelog,,update changelog,
17,update changelog,,update changelog,
18,Ensure DOM ref is properly handled in the RadioGroup component (#2424)," drop by prop  Otherwise it ends up in the DOM which doesn't hurt but isn't ideal either.  ensure we are reading the underlying DOM correctly  We assumed that the optionRef was HTMLElement | null, but if you use a custom component, then it is exposed as { $el: ref }, this is why we use the dom() helper.   add test to ensure using a custom as prop works as expected   update changelog ",Ensure DOM ref is properly handled in the RadioGroup component (#2424),"drop by prop Otherwise it ends up in the DOM which doesn't hurt but isn't ideal either. ensure we are reading the underlying DOM correctly We assumed that the optionRef was HTMLElement | null, but if you use a custom component, then it is exposed as { $el: ref }, this is why we use the dom() helper. add test to ensure using a custom as prop works as expected update changelog"
19,Don't scroll lock when transition isn't showing (#2422),  Add tests   Make transition initial state based on computed show prop   Update changelog ,Don't scroll lock when transition isn't showing (#2422),Add tests Make transition initial state based on computed show prop Update changelog
20,Merge className correctly when it’s a function (#2412), Add className tests for render  Fix snapshots   Merge className correctly when it’s a function   Update changelog ,Merge className correctly when it’s a function (#2412),Add className tests for render Fix snapshots Merge className correctly when it’s a function Update changelog
21,Improve Combobox types to improve false positives (#2411)," swap Combobox type order  If you use the default Combobox component then it defaults to Fragment. This also means that if you provide an additional prop that it would be forwarded to the Fragment but that won't work. You do get a runtime error, but the types aren't 100% clear on what's going on. In fact, they make it very confusing because it will use the last ""fallback"" in all the Combobox definitions which marks the value as ""multiple"". Concretely, this means: ```ts let [value, setValue] = useState('Tom Cook')  ``` Starts complaining about the value and onChange not handling the multiple case correctly. But it should complain about the placeholder. Switching the order does solve this, but it is not the cleanest solution. Maybe we should be explicit about the Fragment case somehow. However, there is a use case where I don't think TypeScript will be able to help and it's a bit unfortunate. ```ts let [value, setValue] = useState('Tom Cook')          {/* ... */}      ``` This is valid because at runtime we will forward all the props to the div. So not 100% sure what we should do here instead.  update changelog",Improve Combobox types to improve false positives (#2411),"swap Combobox type order If you use the default Combobox component then it defaults to Fragment. This also means that if you provide an additional prop that it would be forwarded to the Fragment but that won't work. You do get a runtime error, but the types aren't 100% clear on what's going on. In fact, they make it very confusing because it will use the last ""fallback"" in all the Combobox definitions which marks the value as ""multiple"". Concretely, this means: ```ts let [value, setValue] = useState('Tom Cook') modulets let [value, setValue] = useState('Tom Cook') module ``` This is valid because at runtime we will forward all the props to the div. So not 100% sure what we should do here instead. update changelog"
22,Fix className hydration for <Transition appear> (#2390),  Fix className hydration for <Transition appear>   Update changelog ,Fix className hydration for  (#2390),Fix className hydration for  Update changelog
23,Add ESM and types paths to package.json for TailwindCSS plugin (#2382),  Add ESM and types paths to package.json for TailwindCSS plugin   Move types declaration to first key in exports ,Add ESM and types paths to package.json for TailwindCSS plugin (#2382),Add ESM and types paths to package.json for TailwindCSS plugin Move types declaration to first key in exports
24,Add FocusTrap event listeners once document has loaded (#2389),  feat: addEventListener on document loaded   Refactor   Fix import   Update changelog   use function instead of arrow function   make callback in onDocumentReady mandatory    Co-authored-by: lkr lkr@bytedance.com Co-authored-by: Jordan Pittman jordan@cryptica.me Co-authored-by: Robin Malfait malfait.robin@gmail.com,Add FocusTrap event listeners once document has loaded (#2389),feat: addEventListener on document loaded Refactor Fix import Update changelog use function instead of arrow function make callback in onDocumentReady mandatory Co-authored-by: lkr lkr@bytedance.com Co-authored-by: Jordan Pittman jordan@cryptica.me Co-authored-by: Robin Malfait malfait.robin@gmail.com
25,[vue] Fix Combobox input disabled state (#2375),  [vue] Fix Combobox input disabled state   Add tests for disabled input in React and Vue   Update changelog    Co-authored-by: Jordan Pittman jordan@cryptica.me,[vue] Fix Combobox input disabled state (#2375),[vue] Fix Combobox input disabled state Add tests for disabled input in React and Vue Update changelog Co-authored-by: Jordan Pittman jordan@cryptica.me
26,"Fix ""Can't perform a React state update on an unmounted component."" when using the Transition component (#2374)",  only change flags when mounted   update changelog ,"Fix ""Can't perform a React state update on an unmounted component."" when using the Transition component (#2374)",only change flags when mounted update changelog
27,"Add form prop to form-like components such as RadioGroup, Switch, Listbox, and Combobox (#2356)",  Adds form prop to Switch component   add form prop to Switch component in Vue   tests for both React and Vue   add form prop to Combobox component   add form prop to Listbox comopnent   add form prop to RadioGroup component   update changelog   add Oxford comma   cleanup screen import    Co-authored-by: Robin Malfait malfait.robin@gmail.com,"Add form prop to form-like components such as RadioGroup, Switch, Listbox, and Combobox (#2356)",Adds form prop to Switch component add form prop to Switch component in Vue tests for both React and Vue add form prop to Combobox component add form prop to Listbox comopnent add form prop to RadioGroup component update changelog add Oxford comma cleanup screen import Co-authored-by: Robin Malfait malfait.robin@gmail.com
28,Fix focus styles showing up when using the mouse (#2347),"  update playground examples to use a shared Button   expose a ui-focus-visible variant   keep track of a data-headlessui-focus-visible attribute   do not set the tabindex   The focus was always set, but the ring wasn't showing up. This was also focusing a ring when the browser decided not the add one. Let's make the browser decide when to show this or not.  update changelog",Fix focus styles showing up when using the mouse (#2347),"update playground examples to use a shared Button expose a ui-focus-visible variant keep track of a data-headlessui-focus-visible attribute do not set the tabindex The focus was always set, but the ring wasn't showing up. This was also focusing a ring when the browser decided not the add one. Let's make the browser decide when to show this or not. update changelog"
29,1.7.12 - @headlessui/vue,,1.7.12 - @headlessui/vue,
30,1.7.13 - @headlessui/react,,1.7.13 - @headlessui/react,
31,Ensure hooks in the FocusTrap component only apply when mounted (#2331),  ensure hooks in the FocusTrap component only apply when mounted   update changelog ,Ensure hooks in the FocusTrap component only apply when mounted (#2331),ensure hooks in the FocusTrap component only apply when mounted update changelog
32,"Fix restore focus to buttons in Safari, when Dialog component closes (#2326)"," update dialog playground example  Includes a generic Button component that has explicit focus styles.  keep track of ""focus"" history  Safari doesn't ""focus"" buttons when you mousedown on them. This means that we don't capture the correct element to restore focus to when closing a Dialog for example. Now, we will make sure to keep track of a list of last ""focused"" items. We do this by also capturing elements when you ""click"", ""mousedown"" or ""focus"".   let's use a button instead of a div in tests   make target for Vue consistent with React   update changelog ","Fix restore focus to buttons in Safari, when Dialog component closes (#2326)","update dialog playground example Includes a generic Button component that has explicit focus styles. keep track of ""focus"" history Safari doesn't ""focus"" buttons when you mousedown on them. This means that we don't capture the correct element to restore focus to when closing a Dialog for example. Now, we will make sure to keep track of a list of last ""focused"" items. We do this by also capturing elements when you ""click"", ""mousedown"" or ""focus"". let's use a button instead of a div in tests make target for Vue consistent with React update changelog"
33,retry tests 3 times before failing (#2335),"Some tests are relying on timing specific tests and if the server (GitHub Actions) is a bit busy, then this can result in flakey tests. One day we will switch to tests in a real browser, but in the meantime this should be enough.",retry tests 3 times before failing (#2335),"Some tests are relying on timing specific tests and if the server (GitHub Actions) is a bit busy, then this can result in flakey tests. One day we will switch to tests in a real browser, but in the meantime this should be enough."
34,Fix invalid warning when using multiple Popover.Button components inside a Popover.Panel (#2333),  add a bunch of tests to ensure we won't regress on this again   fix incorrect warning when using multiple Popover.Button inside Popover.Panel   update changelog ,Fix invalid warning when using multiple Popover.Button components inside a Popover.Panel (#2333),add a bunch of tests to ensure we won't regress on this again fix incorrect warning when using multiple Popover.Button inside Popover.Panel update changelog
35,Fix XYZPropsWeControl and cleanup internal TypeScript types (#2329)," cleanup XYZPropsWeControl  The idea behind the PropsWeControl is that we can omit all the fields that we are controlling entirely. In this case, passing a prop like role, but if we already set the role ourselves then the prop won't do anything at all. This is why we want to alert the end user that it is an ""error"". It can also happen that we ""control"" the value by default, but keep incoming props into account. For example we generate a unique ID for most components, but you can provide your own to override it. In this case we don't want to include the ID in the XYZPropsWeControl. Additionally, we introduced some functionality months ago where we call event callbacks (onClick, ...) from the incoming props before our own callbacks. This means that by definition all onXYZ callbacks can be provided.  improve defining types  Whenever we explicitly provide custom types for certain props, then we make sure to omit those keys first from the original props (of let's say an input). This is important so that TypeScript doesn't try to ""merge"" those types together.   cleanup: move useEffect   add defaultValue explicitly   ensure tests are not using any because of onChange={console.log}   The console.log is typed as (...args: any[]) => void which means that it will incorrectly mark its incoming data as any as well. Converting it to x => console.log(x) makes TypeScript happy. Or in this case, angry since it found a bug. This is required because it can be that your value (e.g.: the value of a Combobox) is an object (e.g.: a User), but it is also nullable. Therefore we can provide the value null. This would mean that eventually this resolves to keyof null which is never, but we just want a string in this case. diff -export type ByComparator<T> = (keyof T & string) | ((a: T, b: T) => boolean) +export type ByComparator<T> = +  | (T extends null ? string : keyof T & string) +  | ((a: T, b: T) => boolean)   improve the internal types of the Combobox component   improve the internal types of the Disclosure component   improve the internal types of the Listbox component   improve the internal types of the Menu component   improve the internal types of the Popover component   improve the internal types of the Tabs component   improve the internal types of the Transition component   use Override in Hidden as well   cleanup unused code   don't check the useSyncExternalStoreShimClient   don't check the useSyncExternalStoreShimServer   improve types in the render tests   fix Ref<TTag> to be Ref<HTMLElement>   improve internal types of the Transition component (Vue)   add attrs.class as well   use different type for AnyComponent   update changelog ",Fix XYZPropsWeControl and cleanup internal TypeScript types (#2329),"cleanup XYZPropsWeControl The idea behind the PropsWeControl is that we can omit all the fields that we are controlling entirely. In this case, passing a prop like role, but if we already set the role ourselves then the prop won't do anything at all. This is why we want to alert the end user that it is an ""error"". It can also happen that we ""control"" the value by default, but keep incoming props into account. For example we generate a unique ID for most components, but you can provide your own to override it. In this case we don't want to include the ID in the XYZPropsWeControl. Additionally, we introduced some functionality months ago where we call event callbacks (onClick, ...) from the incoming props before our own callbacks. This means that by definition all onXYZ callbacks can be provided. improve defining types Whenever we explicitly provide custom types for certain props, then we make sure to omit those keys first from the original props (of let's say an input). This is important so that TypeScript doesn't try to ""merge"" those types together. cleanup: move useEffect add defaultValue explicitly ensure tests are not using any because of onChange={console.log} The console.log is typed as (...args: any[]) => void which means that it will incorrectly mark its incoming data as any as well. Converting it to x => console.log(x) makes TypeScript happy. Or in this case, angry since it found a bug. This is required because it can be that your value (e.g.: the value of a Combobox) is an object (e.g.: a User), but it is also nullable. Therefore we can provide the value null. This would mean that eventually this resolves to keyof null which is never, but we just want a string in this case. diff -export type ByComparator = (keyof T & string) | ((a: T, b: T) => boolean) +export type ByComparator = +  | (T extends null ? string : keyof T & string) +  | ((a: T, b: T) => boolean) improve the internal types of the Combobox component improve the internal types of the Disclosure component improve the internal types of the Listbox component improve the internal types of the Menu component improve the internal types of the Popover component improve the internal types of the Tabs component improve the internal types of the Transition component use Override in Hidden as well cleanup unused code don't check the useSyncExternalStoreShimClient don't check the useSyncExternalStoreShimServer improve types in the render tests fix Ref to be Ref improve internal types of the Transition component (Vue) add attrs.class as well use different type for AnyComponent update changelog"
36,Allow root containers from the Dialog component in the FocusTrap component (#2322),  add (failing) test to verify moving focus to 3rd party containers work   pass resolveRootContainers to FocusTrap   handle lazy containers in FocusTrap   update changelog ,Allow root containers from the Dialog component in the FocusTrap component (#2322),add (failing) test to verify moving focus to 3rd party containers work pass resolveRootContainers to FocusTrap handle lazy containers in FocusTrap update changelog
37,Enable native label behavior for Switch component (#2265),  add native label behavior for switch   Add reference tests for React and Vue   These don’t work in JSDOM so they’re skipped but we can use these to reference expected behavior once we have playwright-based tests   Fix Vue playground switch example   Only prevent default when the element is a label   Port change to Vue   Update changelog    Co-authored-by: Jordan Pittman jordan@cryptica.me,Enable native label behavior for Switch component (#2265),add native label behavior for switch Add reference tests for React and Vue These don’t work in JSDOM so they’re skipped but we can use these to reference expected behavior once we have playwright-based tests Fix Vue playground switch example Only prevent default when the element is a label Port change to Vue Update changelog Co-authored-by: Jordan Pittman jordan@cryptica.me
38,Ensure Transition component completes if nothing is transitioning (#2318)," make disposables consistent  Also added a group function, this allows us to spawn a sub disposables group that can be disposed on its own, but will also be disposed the moment the ""parent"" is disposed.   ensure Transition component works when nothing is transitioning   update changelog ",Ensure Transition component completes if nothing is transitioning (#2318),"make disposables consistent Also added a group function, this allows us to spawn a sub disposables group that can be disposed on its own, but will also be disposed the moment the ""parent"" is disposed. ensure Transition component works when nothing is transitioning update changelog"
39,1.7.11 - @headlessui/vue,,1.7.11 - @headlessui/vue,
40,1.7.12 - @headlessui/react,,1.7.12 - @headlessui/react,
41,Fix Dialog cleanup when the Dialog becomes hidden (#2303)," use the Dialog's parent as the root for the Intersection observer  We have some code that allows us to auto-close the dialog the moment it gets hidden. This is useful if you use a dialog for a mobile menu and you resizet he browser. If you wrap the dialog in a md:hidden then it auto closes. If we don't do this, then the dialog is still locking the scrolling, keeping the focus in the dialog, ... but it is not visible. To solve this we use an IntersectionObserver to verify that the boundingClientRect is ""gone"" (x = 0, y = 0, width = 0 and height = 0). However, the intersection observer is not always triggered. This happens if the main content is scrollable. Setting the root of the IntersectionObserver to the parent of the Dialog does seem to solve it. Not 100% sure what causes this behaviour exactly.   use a ResizeObserver instead of IntersectionObserver   implement a ResizeObserver for the tests   update changelog ",Fix Dialog cleanup when the Dialog becomes hidden (#2303),"use the Dialog's parent as the root for the Intersection observer We have some code that allows us to auto-close the dialog the moment it gets hidden. This is useful if you use a dialog for a mobile menu and you resizet he browser. If you wrap the dialog in a md:hidden then it auto closes. If we don't do this, then the dialog is still locking the scrolling, keeping the focus in the dialog, ... but it is not visible. To solve this we use an IntersectionObserver to verify that the boundingClientRect is ""gone"" (x = 0, y = 0, width = 0 and height = 0). However, the intersection observer is not always triggered. This happens if the main content is scrollable. Setting the root of the IntersectionObserver to the parent of the Dialog does seem to solve it. Not 100% sure what causes this behaviour exactly. use a ResizeObserver instead of IntersectionObserver implement a ResizeObserver for the tests update changelog"
