Index,Message,Description,Message Abstract,Description Abstract
245,"Improve ""Scroll lock"" scrollbar width for Dialog component (#1457)"," improve scroll lock, scrollbarWidth  The idea is as follow: If you currently have a scrollbar, and you open a Dialog then we enable a ""Scroll lock"" so that you can't scroll in the background behind the modal. We can achieve this by adding a overflow: hidden; to the html. The issue is that by doing this, we lose the scrollbar and therefore the page will jump to right because now there is a bit more room. To account for this, we set a padding-right on the html of the scrollbarWidth in pixels. This counteracts the visual jump you would see. The issue with this approach is that there could still be a scrollbar once we add the overflow: hidden. This can happen if you use new css features like the scrollbar-gutter: stable;. To take this into account, we will measure the scrollbar again after we set the overflow: hidden. Now we will only apply that counteracting offset if there would actually be a jump by measuring the before and after widths and applying the diff if there is one.  update changelog","Improve ""Scroll lock"" scrollbar width for Dialog component (#1457)","improve scroll lock, scrollbarWidth The idea is as follow: If you currently have a scrollbar, and you open a Dialog then we enable a ""Scroll lock"" so that you can't scroll in the background behind the modal. We can achieve this by adding a overflow: hidden; to the html. The issue is that by doing this, we lose the scrollbar and therefore the page will jump to right because now there is a bit more room. To account for this, we set a padding-right on the html of the scrollbarWidth in pixels. This counteracts the visual jump you would see. The issue with this approach is that there could still be a scrollbar once we add the overflow: hidden. This can happen if you use new css features like the scrollbar-gutter: stable;. To take this into account, we will measure the scrollbar again after we set the overflow: hidden. Now we will only apply that counteracting offset if there would actually be a jump by measuring the before and after widths and applying the diff if there is one. update changelog"
246,Fix playground warning about incorrectly loading stylesheets in Next.js (#1454),,Fix playground warning about incorrectly loading stylesheets in Next.js (#1454),
247,Ensure the Popover.Panel is clickable without closing the Popover (#1443),  ensure the Popover.Panel is clickable without closing   update changelog ,Ensure the Popover.Panel is clickable without closing the Popover (#1443),ensure the Popover.Panel is clickable without closing update changelog
248,Simplify Popover Tab logic by using sentinel nodes instead of keydown event interception (#1440), improve Popover keyboard usage  Use TabSentinel instead of intercepting the Tab keydown events.   use Buttons in Popover example   update changelog ,Simplify Popover Tab logic by using sentinel nodes instead of keydown event interception (#1440),improve Popover keyboard usage Use TabSentinel instead of intercepting the Tab keydown events. use Buttons in Popover example update changelog
249,Improve FocusTrap behaviour (#1432)," refactor VisuallyHidden to Hidden component  This new component will also make sure that it is visually hidden to sighted users. However, it contains a few more features that are going to be useful in other places as well. These features include:  Make visually hidden to sighted users (default) Hide from assistive technology via features={Features.Hidden}    (will add display: none;)  Hide from assistive technology but make the element focusable via    features={Features.Focusable} (will add aria-hidden=""true"")   add useEvent hook   This will behave the same (roughly) as the new to be released useEvent hook in React 18.X This hook allows you to have a stable function that can ""see"" the latest data it is using. We already had this concept using: js let handleX = useLatestValue(() => {   // ... }) But this returned a stable ref so you had to call handleX.current(). This new hook is a bit nicer to work with but doesn't change much in the end.  add useTabDirection hook  This keeps track of the direction people are tabbing in. This returns a ref so no re-renders happen because of this hook.  add useWatch hook  This is similar to the useEffect hook, but only executes if values are actually changing... 😒   add microTask util   refactor useFocusTrap hook to FocusTrap component   Using a component directly allows us to simplify the focus trap logic itself. Instead of intercepting the Tab keydown event and figuring out the correct element to focus, we will now add 2 ""guard"" buttons (hence why we require a component now). These buttons will receive focus and if they do, redirect the focus to the first/last element inside the focus trap. The sweet part is that all the tabs in between those buttons will now be handled natively by the browser. No need to find the first non disabled, non hidden with correct tabIndex element!  refactor the Dialog component to use the FocusTrap component  Also added a hidden button so that we know the correct ""main"" tree of the application. Before this we were assuming the previous active element which will still be correct in most cases but we don't have access to that anymore since the logic is encapsulated inside the FocusTrap component.  ensure <Portal /> properly cleans up  We make sure that the Portal is cleaning up its element properly. We also make sure to call the target.appendChild(element) conditionally because I ran into a super annoying bug where a focused element got blurred because I believe that this re-mounts the element instead of 'moving' it or just ignoring it, if it already is in the correct spot.  refactor: use useEvent instead of useLatestValue  Not really necessary, just cleaner.  update changelog",Improve FocusTrap behaviour (#1432),"refactor VisuallyHidden to Hidden component This new component will also make sure that it is visually hidden to sighted users. However, it contains a few more features that are going to be useful in other places as well. These features include: Make visually hidden to sighted users (default) Hide from assistive technology via features={Features.Hidden}    (will add display: none;) Hide from assistive technology but make the element focusable via    features={Features.Focusable} (will add aria-hidden=""true"") add useEvent hook This will behave the same (roughly) as the new to be released useEvent hook in React 18.X This hook allows you to have a stable function that can ""see"" the latest data it is using. We already had this concept using: js let handleX = useLatestValue(() => {   // ... }) But this returned a stable ref so you had to call handleX.current(). This new hook is a bit nicer to work with but doesn't change much in the end. add useTabDirection hook This keeps track of the direction people are tabbing in. This returns a ref so no re-renders happen because of this hook. add useWatch hook This is similar to the useEffect hook, but only executes if values are actually changing... 😒 add microTask util refactor useFocusTrap hook to FocusTrap component Using a component directly allows us to simplify the focus trap logic itself. Instead of intercepting the Tab keydown event and figuring out the correct element to focus, we will now add 2 ""guard"" buttons (hence why we require a component now). These buttons will receive focus and if they do, redirect the focus to the first/last element inside the focus trap. The sweet part is that all the tabs in between those buttons will now be handled natively by the browser. No need to find the first non disabled, non hidden with correct tabIndex element! refactor the Dialog component to use the FocusTrap component Also added a hidden button so that we know the correct ""main"" tree of the application. Before this we were assuming the previous active element which will still be correct in most cases but we don't have access to that anymore since the logic is encapsulated inside the FocusTrap component. ensure  properly cleans up We make sure that the Portal is cleaning up its element properly. We also make sure to call the target.appendChild(element) conditionally because I ran into a super annoying bug where a focused element got blurred because I believe that this re-mounts the element instead of 'moving' it or just ignoring it, if it already is in the correct spot. refactor: use useEvent instead of useLatestValue Not really necessary, just cleaner. update changelog"
250,Ignore Escape when event got prevented in Dialog component (#1424)," ignore Escape when event got prevented  Some external libraries only use event.preventDefault() and not event.stopPropagation(). This means that the Dialog can still receive an Escape keydown event which closes the Dialog. We can also think about the Escape behaviour inside the modal as the ""default behaviour"" once the Dialog is open. Therefore, we can also check the event.defaultPrevented and ignore this event when this is the case.  update changelog",Ignore Escape when event got prevented in Dialog component (#1424),"ignore Escape when event got prevented Some external libraries only use event.preventDefault() and not event.stopPropagation(). This means that the Dialog can still receive an Escape keydown event which closes the Dialog. We can also think about the Escape behaviour inside the modal as the ""default behaviour"" once the Dialog is open. Therefore, we can also check the event.defaultPrevented and ignore this event when this is the case. update changelog"
251,Fix closing of Popover.Panel in React 18 (#1409),  remove unnecessary SetPanel action   update changelog ,Fix closing of Popover.Panel in React 18 (#1409),remove unnecessary SetPanel action update changelog
252,Ensure DialogPanel exposes its ref (#1404),  ensure we expose the el and $el on DialogPanel   update changelog ,Ensure DialogPanel exposes its ref (#1404),ensure we expose the el and $el on DialogPanel update changelog
253,fix changelog diff links,,fix changelog diff links,
254,1.6.1 - @headlessui/vue,,1.6.1 - @headlessui/vue,
255,1.6.1 - @headlessui/react,,1.6.1 - @headlessui/react,
256,Fix enter transitions in Vue (#1395),  fix enter transitions in Vue   add example slide-over that shows the issue   update changelog   add Heroicons for playground ,Fix enter transitions in Vue (#1395),fix enter transitions in Vue add example slide-over that shows the issue update changelog add Heroicons for playground
257,temporary ignore flaky tests,,temporary ignore flaky tests,
258,Fix hydration issue with Tab component (#1393),  fix hydration issues with Tabs component   update changelog ,Fix hydration issue with Tab component (#1393),fix hydration issues with Tabs component update changelog
259,"Manually passthrough attrs for Combobox, Listbox and TabsGroup component (#1372)"," manually pass through attrs  Due to the return of the Fragment (for form compatibility) the attributes will now be pass onto this Fragment instead of the underlying DOM node. To fix this, we disable the inheritAttrs magic, and passthrough the attributes to the correct component.  update changelog","Manually passthrough attrs for Combobox, Listbox and TabsGroup component (#1372)","manually pass through attrs Due to the return of the Fragment (for form compatibility) the attributes will now be pass onto this Fragment instead of the underlying DOM node. To fix this, we disable the inheritAttrs magic, and passthrough the attributes to the correct component. update changelog"
260,update changelog,,update changelog,
261,Improvements to changelog,,Improvements to changelog,
262,1.6.0,,1.6.0,
263,update changelog,,update changelog,
264,General cleanup of README files (#1361),"  cleanup README files   ignore flakey tests for now   There are a handful of tests that are pretty flakey and fail every once in a while on CI, I don't want to remove them yet, but rather ignore them for now. I am going to experiment with using Playwright/Puppeteer to use a real browser instead.",General cleanup of README files (#1361),"cleanup README files ignore flakey tests for now There are a handful of tests that are pretty flakey and fail every once in a while on CI, I don't want to remove them yet, but rather ignore them for now. I am going to experiment with using Playwright/Puppeteer to use a real browser instead."
265,Prefer incoming open prop over OpenClosed state (#1360),  prefer incoming open prop over OpenClosed state   update changelog ,Prefer incoming open prop over OpenClosed state (#1360),prefer incoming open prop over OpenClosed state update changelog
266,update changelog,,update changelog,
267,fix nullable prop for Vue,,fix nullable prop for Vue,
268,Add explicit multiple prop (#1355)," add explicit multiple prop to the Combobox  This allows you to set the value to a tuple in single-value mode, which was not possible before the multiple prop was introduced, because then it resulted in multi-value mode instead of single-value mode.  add explicit multiple prop to the Listbox  This allows you to set the value to a tuple in single-value mode, which was not possible before the multiple prop was introduced, because then it resulted in multi-value mode instead of single-value mode.   update changelog   update playground to use multiple prop ",Add explicit multiple prop (#1355),"add explicit multiple prop to the Combobox This allows you to set the value to a tuple in single-value mode, which was not possible before the multiple prop was introduced, because then it resulted in multi-value mode instead of single-value mode. add explicit multiple prop to the Listbox This allows you to set the value to a tuple in single-value mode, which was not possible before the multiple prop was introduced, because then it resulted in multi-value mode instead of single-value mode. update changelog update playground to use multiple prop"
269,use older syntax instead of .at(),Fixes: #1344,use older syntax instead of .at(),Fixes: #1344
270,Add Dialog.Backdrop and Dialog.Panel components (#1333),  implement Dialog.Backdrop and Dialog.Panel   cleanup TypeScript warnings   update changelog ,Add Dialog.Backdrop and Dialog.Panel components (#1333),implement Dialog.Backdrop and Dialog.Panel cleanup TypeScript warnings update changelog
271,add React 18 compatibility (#1326),"  bump dev dependencies to React 18   setup Jest to include IS_REACT_ACT_ENVIRONMENT   prefer useId from React 18 if it exists   In React 16 & 17, where useId doesn't exist, we will fallback to our implementation we have been using up until now. The useId exposed by React 18, ensures stable references even in SSR environments.  update expected events  React 18 now uses the proper events: - blur -> focusout - focus -> focusin  ensure to wait a bit longer  This is a bit unfortunate, but since React 18 now does an extra unmount/remount in StrictMode to ensure that your code is ConcurrentMode ready, it takes a bit longer to settle what the DOM sees. That said, this is a temporary ""hack"". We are going to experiment with using tools like Puppeteer/Playwright to run our tests in an actual browser instead to eliminate all the weird details that we have to keep in mind.   prefer .focus() over fireEvent.focus(el)   abstract microTask polyfill code   prefer our focus(el) function over el.focus()   Internally we would still use el.focus(), but this allows us to have more control over that focus function.   add React 18 to the React Playground   improve hooks for React 18   Improving the cleanup of useEffect hooks   useIsoMorphicEffect instead of normal useEffect, so that we can use   useLayoutEffect to be a bit quicker.   improve disposables   This allows us to add event listeners on a node, and get automatic   cleanup once dispose gets called.   We also return all the d.add calls, so that we can cleanup specific   parts only instead of everything or nothing.   reimplement the Transition component to be React 18 ready   wait an additional frame for everything to settle   update playground examples   suppressConsoleLogs for RadioGroup components   update changelog   keep the to classes for a smoother transition   In the next transition we will remove all classes provided and re-add the once we need.  Some extra special thanks:  Thanks @silvenon for your initial work on the transition events in #926 Thanks @thecrypticace for doing late-night debugging sessions  Co-authored-by: =?UTF-8?q?Matija=20Marohni=C4=87?= matija.marohnic@gmail.com Co-authored-by: Jordan Pittman jordan@cryptica.me",add React 18 compatibility (#1326),"bump dev dependencies to React 18 setup Jest to include IS_REACT_ACT_ENVIRONMENT prefer useId from React 18 if it exists In React 16 & 17, where useId doesn't exist, we will fallback to our implementation we have been using up until now. The useId exposed by React 18, ensures stable references even in SSR environments. update expected events React 18 now uses the proper events: - blur -> focusout - focus -> focusin ensure to wait a bit longer This is a bit unfortunate, but since React 18 now does an extra unmount/remount in StrictMode to ensure that your code is ConcurrentMode ready, it takes a bit longer to settle what the DOM sees. That said, this is a temporary ""hack"". We are going to experiment with using tools like Puppeteer/Playwright to run our tests in an actual browser instead to eliminate all the weird details that we have to keep in mind. prefer .focus() over fireEvent.focus(el) abstract microTask polyfill code prefer our focus(el) function over el.focus() Internally we would still use el.focus(), but this allows us to have more control over that focus function. add React 18 to the React Playground improve hooks for React 18 Improving the cleanup of useEffect hooks useIsoMorphicEffect instead of normal useEffect, so that we can use   useLayoutEffect to be a bit quicker. improve disposables This allows us to add event listeners on a node, and get automatic   cleanup once dispose gets called. We also return all the d.add calls, so that we can cleanup specific   parts only instead of everything or nothing. reimplement the Transition component to be React 18 ready wait an additional frame for everything to settle update playground examples suppressConsoleLogs for RadioGroup components update changelog keep the to classes for a smoother transition In the next transition we will remove all classes provided and re-add the once we need. Some extra special thanks: Thanks @silvenon for your initial work on the transition events in #926 Thanks @thecrypticace for doing late-night debugging sessions Co-authored-by: =?UTF-8?q?Matija=20Marohni=C4=87?= matija.marohnic@gmail.com Co-authored-by: Jordan Pittman jordan@cryptica.me"
272,Implement nullable mode on Combobox in single value mode (#1295),"  implement backspace behaviour in tests   add Delete Key   implement nullable mode on Combobox in single value mode   If you pass a nullable prop to the Combobox, then it's possible to unset the Combobox value by setting it to null. This is triggered by removing all text from the input which will reset the value itself as well.  update changelog",Implement nullable mode on Combobox in single value mode (#1295),"implement backspace behaviour in tests add Delete Key implement nullable mode on Combobox in single value mode If you pass a nullable prop to the Combobox, then it's possible to unset the Combobox value by setting it to null. This is triggered by removing all text from the input which will reset the value itself as well. update changelog"
273,"Allow Enter for form submit in RadioGroup, Switch and Combobox improvements (#1285)","  improve rendering of hidden form fields   add attemptSubmit helper   This will allow us to try and submit a form based on any element you pass it. It will try and lookup the current form and if it is submittable it will attempt to submit it. Instead of submitting the form directly, we try to follow the native browser support where it looks for the first input[type=submit], input[type=image], button or button[type=submit], then it clicks it. This allows you to disable your submit button, or have an onClick that does an event.preventDefault() just like the native form in a browser would do.  ensure we can submit a form from a closed Combobox  When the Combobox is closed, then the Enter keydown event will be ignored and thus not use event.preventDefault(). With recent changes where we always have an active option, it means that you will always be able to select an option. If we have no option at all (some edge case) or when the combobox is closed, then the Enter keydown event will just bubble, allowing you to submit a form. Fixes: #1282 This is a continuation of a PR (#1176) provided by Alexander, so wanted to include them as a co-author because of their initial work. Co-authored-by: Alexander Lyon arlyon@me.com   ensure we can submit a form from a RadioGroup   ensure we can submit a form from a Switch   simplify / refactor form playground example   update changelog   Co-authored-by: Alexander Lyon arlyon@me.com","Allow Enter for form submit in RadioGroup, Switch and Combobox improvements (#1285)","improve rendering of hidden form fields add attemptSubmit helper This will allow us to try and submit a form based on any element you pass it. It will try and lookup the current form and if it is submittable it will attempt to submit it. Instead of submitting the form directly, we try to follow the native browser support where it looks for the first input[type=submit], input[type=image], button or button[type=submit], then it clicks it. This allows you to disable your submit button, or have an onClick that does an event.preventDefault() just like the native form in a browser would do. ensure we can submit a form from a closed Combobox When the Combobox is closed, then the Enter keydown event will be ignored and thus not use event.preventDefault(). With recent changes where we always have an active option, it means that you will always be able to select an option. If we have no option at all (some edge case) or when the combobox is closed, then the Enter keydown event will just bubble, allowing you to submit a form. Fixes: #1282 This is a continuation of a PR (#1176) provided by Alexander, so wanted to include them as a co-author because of their initial work. Co-authored-by: Alexander Lyon arlyon@me.com ensure we can submit a form from a RadioGroup ensure we can submit a form from a Switch simplify / refactor form playground example update changelog Co-authored-by: Alexander Lyon arlyon@me.com"
