Commit Message,Score,Correspond Changelog Sentence,Commit Description,Label
fix: isLoading and isValidating should always respect cache value (#2048),0.84404254,fix: isLoading and isValidating should always respect cache value by @promer94 in link,fix: isLoading and isValidating should always respect cache value fix #2030 test: case for #2030,1
fix: Avoid preloading the resource multiple times (#2036),0.7558864,fix: Avoid preloading the resource multiple times by @shuding in link,fix: Avoid preloading multiple times,1
2.0.0-beta.4,0.6778973,After 2.0.0:,,0
feat: add preload function (#2026),0.82616913,feat: Add preload function by @koba04 in link,feat: swr/preload refactor: not add preload as a separate package feat: add preload as a built-in middleware fix: build-in middlewares should be run before use-defined middlewares chore: remove an unnecessary diff refactor: rename the API to preload test: fix a failing test test: add a test for resetting an error fix: handling deduping and errors refactor: variable names refactor: tweak a comment chore: s/middlewares/middleware/ refactor: add a type parameter for the preload function refactor: ignore falsy fetcher refactor: use SWRGlobalState to store preloading requests,1
test: fix all act warnings (#2031),0.86566967,test: fix an act warning by @koba04 in #1888,,1
feat: support functional swr context config (#2024),0.91138554,feat: support functional swr context config by @huozhi in link,feat: support functional swr context config add typing test fix typing fix typing test remove assertion,1
breaking: Rename SWRConfig.default to SWRConfig.defaultValue (#2023),0.9412725,breaking: Rename SWRConfig.default to SWRConfig.defaultValue by @huozhi in link,,1
fix: Adding debounce for autocomplete-suggestions example (#2017),0.93857694,fix: Adding debounce for autocomplete-suggestions example by @Walkeryr in link,fix: add debounce for autocomplete change handler,1
test: add test case for #1974 (#2005),0.6890061,test: add test case for #1974 by @promer94 in link,,0
chore: add engine field to limit pnpm version (#1990),0.8506175,chore: add engine field to limit pnpm version by @huozhi in link,chore: add engine field to limit pnpm version update configs use node 16 for cbx ci switch to pnpm in csb force install pnpm 7 Chore/add engine (#2004) chore: update csb config update stick install version rm node engine Co-authored-by: Yixuan Xu yixuanxu94@outlook.com,1
build: do not abort on watch mode when ts erroring (#1992),0.9195668,build: do not abort on watch mode when ts erroring by @huozhi in link,build: do not abort on watch mode when ts erroring bump,1
Fix typo: getSWRCacahe -> getSWRCache (#2000),0.8392222,Fix typo: getSWRCacahe -> getSWRCache by @sdornan in link,,1
fix: useSWRMutation - clear error after successful trigger (#1973) (#1995),0.9013148,fix: useSWRMutation - clear error after successful trigger (#1973) by @anirudh1713 in link,,1
chore: save some bytes (#1991),0.60187954,chore: Save some bytes by @promer94 in link,chore: save some bytes chroe: use mergeObject from core,0
fix: should only update cache when actually start new request (#1986),0.8970158,fix: Should only update cache when actually start new request by @promer94 in link,,1
chore: switch to pnpm and turborepo (#1983),0.8640529,chore: Switch to pnpm and turborepo by @promer94 in link,,1
refactor: remove useless ref copy (#1981),0.79567575,refactor: remove useless ref copy by @promer94 in link,,1
fix: Should always reset to the original data after mutating with optimistic data (#1982),0.8327806,fix: Should always reset to the original data after mutating with optimistic data by @shuding in link,fix _o bug fix race conditions,1
chore: Add test cases for mutate (#1976),0.7482239,chore: Add test cases for mutate by @shuding in link,add test cases,1
2.0.0-beta.3,0.6612084,After 2.0.0:,,0
Fix race conditions related to optimistic UI (#1970),0.7270237,Fix race conditions related to optimistic UI by @shuding in link,fix optimistic ui race conditions fix test fix,1
fix: try fix codesanbox ci import error (#1971),0.9514173,fix: try fix codesanbox ci import error by @promer94 in link,,1
chore: Faster type checking (#1969),0.68423015,chore: Faster type checking by @shuding in link,,0
Bug fixes (#1968),0.79831666,Bug fixes: #165,type fixes remove unused code cast Promise remove ts-ignore,1
build: import with-selector with extension from useESE (#1967),0.93297243,build: import with-selector with extension from useESE by @huozhi in link,build: import with-selector with extension from useESE fix shim import,1
fix: mutate args for useSWRInfinite hook (#1947),0.9326134,fix: mutate args for useSWRInfinite hook by @sanjeev29 in link,fix: mutate args for useSWRInfinite hook Add swr infinite test for revalidation with arguments Add swr infinite test for non-revalidation with arguments Rename swr infinite mutate test case Update type for infite mutate args Include 'MutatorOptions' import Co-authored-by: sanjeev40 sanjeev@worknetwork.in,1
types: fix type regressions (#1966),0.80879605,types: fix type regressions by @promer94 in link,,1
2.0.0-beta.2,0.6639396,After 2.0.0:,,0
Improved React 18 support (#1962),0.9481417,Improved React 18 support,update state in a transition support snapshotting external state wip move types:check to pre-commit refactor: switch to useSyncExternalStoreWithSelector (#1953) type: extends useConfig cache interface (#1938) remove mount check for react18 (#1927) link related pr #787 #433 lint: dont check unused vars with underscore prefix (#1939) test: upgrade to jest 28 (#1942) Upgrade to jest 28 Upgrade to jest 28 feat: useSyncExternalStoreWithSelector refactor: remove stateUpdate and boardcast state update should be handled by uSESW type: fix test type error remove pnpm.lock fix: import cjs for codesanbox refactor: add selector refactor: add cachestate interface and try fix custom cache fix: custom cache init refactor: remove useless flag chore: codesanbox ci refactor: remove force render in infinite build: add _internal chore: mark warning test fix: dts generation codesanbox ci chore: rename swr folder to core Co-authored-by: Jiachi Liu inbox@huozhi.im chore: useSES should be external (#1960) rename type types: update cache types chore: move @types/useSES to devDependencies Co-authored-by: Shu Ding g@shud.in Co-authored-by: Jiachi Liu inbox@huozhi.im,1
Fix cache types (#1961),0.70696735,Fix: Reusing cache provider: #1539,Fix cache types Guard against undefined originalData Change useSwrConfig populateCache: undefined for currentData,1
test: upgrade to jest 28 (#1942),0.9014515,test: upgrade to jest 28 by @huozhi in link,Upgrade to jest 28 Upgrade to jest 28,1
lint: dont check unused vars with underscore prefix (#1939),0.8682455,lint: dont check unused vars with underscore prefix by @huozhi in link,,1
remove mount check for react18 (#1927),0.90386236,remove mount check for react18 by @promer94 in link,link related pr #787 #433,1
type: extends useConfig cache interface (#1938),0.9081415,type: extends useConfig cache interface by @promer94 in link,,1
breaking: Throw error when using suspense on the server side without fallback in React 18 (#1931),0.8838844,breaking: Throw error when using suspense on the server side without fallback in React 18 by @shuding in link,,1
2.0.0-beta.1,0.67861915,After 2.0.0:,,0
breaking: drop legacy types (#1930),0.85234344,Drop legacy types: #1276,,1
Add keepPreviousData option (#1929),0.8852515,    keepPreviousData: true,add laggy option use keepPreviousData add test cases add new test,1
replace isFallback with isLoading state; optimize code (#1928),0.66773456,New isLoading state (#1928),,0
build: output mutation cjs bundle with named exports (#1926),0.92394745,build: output mutation cjs bundle with named exports by @huozhi in link,,1
Add isFallback state (#1925),0.5980416,Add isFallback state by @shuding in link,add isFallback remove -m add test case,0
2.0.0-beta.0,0.68244183,After 2.0.0:,,0
add missing .mjs build,0.696149,.mjs Support,,0
feat: Hook for remote mutations (#1450),0.70530164,feat: Hook for remote mutations by @shuding in link,(wip) initial impl. fix test (wip) fix deps initial implementation fix linter fix state reset avoid reset race condition fix race conditions code tweaks code tweaks return bound mutate apply review comments fix tsconfig type fixes fix lint errors code tweaks fix type error update types inline serialization result merge main and update argument api add tests fix tests update typing update state api change error condition,1
type: fix type error on SWRConfig (#1913),0.96713793,type: fix type error on SWRConfig by @Himself65 in #1913,Refs: link,1
type: make type inference simpler (#1908),0.7819029,type: make type inference simpler by @promer94 in link,,1
build(deps): bump minimist from 1.2.5 to 1.2.6 (#1903),0.8580129,build(deps): bump minimist from 1.2.5 to 1.2.6 by @dependabot in link,Bumps minimist from 1.2.5 to 1.2.6. - Release notes - Commits updated-dependencies: - dependency-name: minimist   dependency-type: indirect ... Signed-off-by: dependabot[bot] support@github.com Co-authored-by: dependabot[bot] 49699333+dependabot[bot]@users.noreply.github.com,1
Update React 18 dependencies (#1824),0.79252386,chore: update React 18 dependencies by @shuding in #1824,update react@next deps update react 18 Co-authored-by: Jiachi Liu inbox@huozhi.im,1
fix: wrong spell (#1902),0.8091001,fix: wrong spell by @baojie223 in link,,1
Keep all fields with one single key (#1863),0.67344147,Keep all fields with one single key by @shuding in link,store all data fields using one single key fix tests fix bugs and tests fix lint error refactor code get rid of $ and $ simplify serialize,0
breaking: Change the fetcher argument to be consistent with the passed key (#1864),0.7882546,breaking: Change the fetcher argument to be consistent with the passed key by @shuding in link,change the fetcher argument to be consistent with the key fix test cases fix type checks,1
test: fix an act warning (#1888),0.89966995,test: fix an act warning by @koba04 in #1888,,1
feat: support functional optimisticData (#1861),0.95989144,feat: support functional optimisticData by @huozhi in #1861,feat: support functional optimisticData Update src/types.ts Co-authored-by: Shu Ding g@shud.in,1
bugfix: make suspense and revalidateIfStale work together (#1851),0.97566825,bugfix: make suspense and revalidateIfStale work together by @simowe in #1851,bugfix: make suspense and revalidateIfStale work together test: add test for revalidateIfStale used with suspense,1
1.2.2,0.621399,After 2.0.0:,,0
feat: Support populateCache as a function (#1818),0.84452665,populateCache Option Now Supports Function,allow populateCache as function test: add a test for the behavior of revalidateOnMount when the key has been changed (#1847) add tests pass current data update example and deps remove next.lock Co-authored-by: Toru Kobayashi koba0004@gmail.com,1
test: add a test for the behavior of revalidateOnMount when the key has been changed (#1847),0.9371443,test: add a test for the behavior of revalidateOnMount when the key has been changed by @koba04 in link,,1
fix: reset stale unmountedRef in suspense (#1843),0.94429517,fix: reset stale unmountedRef in suspense by @promer94 in link,,1
"refactor: revalidateIfStale has an effect on updates, not only mounting (#1837)",0.9163368,"refactor: revalidateIfStale has an effect on updates, not only mounting by @koba04 in link",,1
1.2.1,0.614482,After 2.0.0:,,0
fix: useSWRInfinite revalidates with revalidateOnMount (#1830),0.88468575,fix: useSWRInfinite revalidates with revalidateOnMount by @koba04 in link,,1
build(deps-dev): bump next from 12.0.8 to 12.0.9 (#1821),0.8649866,build(deps-dev): bump next from 12.0.8 to 12.0.9 by @dependabot in link,,1
feat: shouldErrorRetry accepts a function (#1816),0.4804186,feat: support functional rollbackOnError by @huozhi in link,,0
1.2.0,0.7061279,After 2.0.0:,,1
fix: use the latest reference of fetcher with suspense mode (#1803),0.9460857,fix: use the latest reference of fetcher with suspense mode by @koba04 in link,,1
Add link to security email directly (#1795),0.8079873,chore: Add link to security email directly by @huozhi in link,,1
chore: Move community health files to .github (#1794),0.89239156,chore: move community health files to .github dir by @huozhi in link,,1
chore: Clean up configurations (#1792),0.7093383,Chore: Remove duplicate configs: #1507,clean up config files match minor and patch releases for dev deps,1
test: use @swc/jest (#1790),0.85990256,test: use @swc/jest by @huozhi in link,,1
test: remove flaky focus test case (#1793),0.86069655,test: remove flaky focus test case by @huozhi in link,,1
chore: Update company name (#1791),0.4598949,Chore: rename major branch to main: #1664,,0
chore: Update examples and dependencies (#1789),0.8547196,Chore(examples): update all examples to use v1: #1385,upgrade @swc-node/jest update examples,1
Improve watch commands (#1788),0.6711632,chore: build: improve watch commands by @huozhi in link,,0
simplify example development (#1787),0.55855787,Chore: Code refactoring: #1482,simplify example development move setup to test folder,0
1.2.0-beta.1,0.59885776,After 2.0.0:,,0
polish: display name in devtool (#1779),0.81861025,polish: display name in devtool by @huozhi in link,polish: display name in devtool revert withArgs export,1
type: Required return type when mutating (#1772),0.7045868,Fix return type of mutateCallback: #381,Co-authored-by: ekaterinarazanova ekaterina.ryazanova@sbermarket.ru,1
test: add delay for flaky focus test (#1762),0.9202729,test: add delay for flaky focus test by @huozhi in link,,1
chore: remove useless react-native field (#1761),0.86744666,chore: remove useless react-native field by @huozhi in link,,1
build: support mjs exports (#1760),0.83345854,build: support mjs exports by @huozhi in link,,1
doc: comment helper (#1757),0.7787291,doc: comment helper by @huozhi in link,,1
1.2.0-beta.0,0.6198898,After 2.0.0:,,0
merge extra request states in cache (#1752),0.7868465,Merge extra request states in cache by @shuding in link,,1
rename CONCURRENT_REQUESTS to FETCH (#1749),0.7240871,chore: Rename CONCURRENT_REQUESTS to FETCH by @shuding in link,,1
merge mutation states (#1748),0.6271703,chore: Merge mutation states by @shuding in link,,0
feat: Optimistic mutation with error rollback (#1745),0.8064077,feat: Optimistic mutation with error rollback by @shuding in link,add optimisticData and rollbackOnError add test cases add test for rollback,1
chore: Ignore coverage report (#1744),0.74459493,chore: Ignore coverage report by @shuding in link,remove coverage report ignore coverage,1
1.1.2,0.6058136,After 2.0.0:,,0
Skip error retrying when document is not active and improve tests (#1742),0.8315145,Skip error retrying when document is not active and improve tests by @shuding in link,use the babel coverage reporter improve coverage,1
merge concurrent request states (#1741),0.7079451,Merge states for concurrent requests by @shuding in link,,1
Fix local state sharing example deps (#1737),0.81192625,Fix local state sharing example deps by @huozhi in link,,1
feat: Add populateCache option to mutate (#1729),0.851963,feat: Add populateCache option to mutate by @shuding in link,add populateCache option to mutate rename type and export it,1
re-export InfiniteFetcher (#1728),0.728748,fix: Re-export InfiniteFetcher by @shuding in link,,1
1.1.2-beta.1,0.57226336,After 2.0.0:,,0
resolves #1131 (#1727),0.5552045,Fix #832: #833,,0
Improve test (#1725),0.6703962,Improve test by @promer94 in link,test: improve test coverage ci,0
add moduleNameMapper (#1724),0.5403843,Add package.json to module exports: #1313,,0
fix #1680 (#1720),0.72814065,Fix #832: #833,,1
type(infinite): export SWRInfinteHook and InfiniteKeyLoader from infinite (#1714),0.9619961,type(infinite): export SWRInfinteHook and InfiniteKeyLoader from infinite by @houkanshan in link,type: export SWRInfinteHook and InfiniteKeyLoader from infinite rename InfiniteKeyLoader and InfiniteFetcher,1
1.1.2-beta.0,0.5790702,After 2.0.0:,,0
Make polyfill for requestAnimationFrame more robust (#1707),0.9693494,Make polyfill for requestAnimationFrame more robust by @thomaspaulmann in link,Add check for requestAnimationFrame availability Fix comparison Bring back missing import of hasWindow,1
1.1.1,0.40385652,// SWR 1.x,,0
fix: Return undefined data if key's falsy under suspense mode (#1698),0.95936036,fix: Return undefined data if key's falsy under suspense mode by @icyJoseph in link,,1
"fix: If newData is deeply to the latest state, broadcast the latest state (#1697)",0.91559196,"fix: If newData is deeply to the latest state, broadcast the latest state by @icyJoseph in link",,1
test: add refreshInterval function returns 0 (#1691),0.8992903,test: add refreshInterval function returns 0 by @Andrewnt219 in link,,1
feat: refreshInterval as a function (#1690),0.9325221,feat: refreshInterval as a function by @Andrewnt219 in link,allow passing a function that returns a new interval   for refreshInterval add tests for refreshInterval as a function,1
1.1.0,0.61352587,After 2.0.0:,,0
chore: Add test case for getKey in useSWRInfinite (#1681),0.8518529,chore: Add test case for getKey in useSWRInfinite by @shuding in link,,1
types: remove duplicated typing def (#1675),0.7574642,types: remove duplicated typing def by @huozhi in link,types: remove duplicated typing def add null remove the last overloading,1
remove: unnecessary async (#1676),0.573892,Remove unneeded await statement on fetch lib: #187,,0
chore: upgrade eslint to v8 and prettier to v2 (#1674),0.9542761,chore: upgrade eslint to v8 and prettier to v2 by @huozhi in link,chore: upgrade prettier to v2 update eslint to v8,1
example: update typescript examples with strict ts mode (#1673),0.8696018,example: update typescript examples with strict ts mode by @huozhi in link,,1
1.1.0-beta.12,0.54704845,After 2.0.0:,,0
fix: Add defaults for SWRResponse (#1609),0.98448527,Fix: Add defaults for SWRResponse: #1609,Co-authored-by: Shu Ding g@shud.in,1
fix keyloader index and previousPageData type (#1669),0.9929907,Fix keyloader index and previousPageData type: #1669,,1
chore: rename major branch to main (#1664),0.9858019,Chore: rename major branch to main: #1664,,1
1.1.0-beta.11,0.5082548,After 2.0.0:,,0
type: disbale inference when data generic is provided (#1658),0.9906595,Type: disbale inference when data generic is provided: #1658,type: disbale inference when data generic is provided type: refactor useSWRInfinite type type: make config fetcher type work chore: clean up,1
fix: supports ssr in ie11(#1657) (#1659),0.99538875,Fix: supports ssr in ie11(#1657): #1659,,1
1.1.0-beta.10,0.52740073,After 2.0.0:,,0
Tweak types (#1640),0.9717246,Tweak types: #1640,test: add test for #1586 Author:    YixuanXu yixuanxu94@outlook.com Date:      Tue Nov 16 19:57:15 2021 +0800 fix: allow user to use generics Author:    YixuanXu yixuanxu94@outlook.com Date:      Tue Nov 16 19:58:38 2021 +0800 chore: remove comments fix: allow fallback to origin fetcher chore: remove comment chore: rename to barefetcher add test Co-authored-by: Shu Ding g@shud.in,1
build: output without minification (#1650),0.95958817,Build: output without minification: #1650,,1
fix: typos (#1647),0.9764507,Fix: typos: #1647,,1
1.1.0-beta.9,0.526145,After 2.0.0:,,0
enhance: bind removeEventListener (#1596),0.9942802,Enhance: bind removeEventListener: #1596,fix: bind removeEventListener mock web preset dynamic add check condition,1
"Revert ""chore: Add type: ""module"" and use .mjs extension (#1604)"" (#1618)",0.98988485,"Revert ""chore: Add type: ""module"" and use .mjs extension"" (#1618): #1604",This reverts commit 396644f47f5078057e34d8cf49f07560c00aa0d4.,1
1.1.0-beta.8,0.5419631,After 2.0.0:,,0
"chore: Add type: ""module"" and use .mjs extension (#1604)",0.9925728,"Chore: Add type: ""module"" and use .mjs extension: #1604",add type: module and use mjs extension fix jest config,1
1.1.0-beta.7,0.5355476,After 2.0.0:,,0
fix mutate argument for infinite (#1602),0.97926354,Fix mutate argument for infinite: #1602,,1
Change config alteration process in withMiddleware to be immutable (#1556),0.9680096,Change config alteration process in withMiddleware to be immutable: #1556,Co-authored-by: Junsu Shin junsu.shin@linecorp.com,1
"Revert ""mark data and error as readonly (#1514)"" (#1570)",0.98048174,"Revert ""mark data and error as readonly "" (#1570): #1514",This reverts commit af6353cf3a89d00319276983e8f7e15ac7e70472.,1
fix: compatible with miniprogram (#1595),0.98808444,Fix: compatible with miniprogram: #1595,"""can't find variable removeEventListener"" in miniprogram Co-authored-by: 最刚 ",1
fix: adds undefined as valid Key type to allow falsy Key or Key() (#1594),0.99321914,Fix: adds undefined as valid Key type to allow falsy Key or Key(): #1594,,1
fix: Support for functions that return false (#1586),0.9903978,Fix: Support for functions that return false: #1586,,1
fix react-native issue (#1583),0.9883357,Fix react-native issue: #1583,fix react-native issue v1.1.0-beta.9 update rn-fix fix naming check not needed for document Co-authored-by: Andreas Fink andreas@afink.at,1
1.1.0-beta.6,0.54381657,After 2.0.0:,,0
optimizations (#1578),0.9412138,Optimizations: #1578,,1
test: speed up with @swc-node/jest (#1569),0.9937485,Test: speed up with @swc-node/jest: #1569,,1
test: Add test case for mutation deduplication (#1549),0.9879154,Test: Add test case for mutation deduplication: #1549,add test case for mutation deduplication fix lint error,1
feat: using latest version of axios with fetch interceptor (#1548),0.993333,Feat: using latest version of axios with fetch interceptor: #1548,feat: using latest version of Axios feat: using axios.request to pass TS types,1
chore: Refactor cleanupState (#1544),0.96102744,Chore: Refactor cleanupState: #1544,,1
small fixes (#1541),0.956655,Small fixes: #1541,,1
1.1.0-beta.5,0.5619872,After 2.0.0:,,0
fix: Ensure mutate accepts undefined as the data (#1515),0.98865354,Fix: Ensure mutate accepts undefined as the data: #1515,add test to ensure mutate accepts undefined bugfix fix types fix test case fix warning fix lint errors,1
chore: fix ts comments (#1540),0.93525696,Chore: fix ts comments: #1540,,1
fix: Reusing cache provider (#1539),0.9797671,Fix: Reusing cache provider: #1539,,1
add revalidateFirstPage option to infinite (#1538),0.9674475,Add revalidateFirstPage option to infinite: #1538,,1
chore: Code refactoring (#1533),0.96848124,Chore: Code refactoring: #1533,fix undefined helper update comment revert unnecessary changes,1
fix: Only trigger the success event if not discarded (#1529),0.9883829,Fix: Only trigger the success event if not discarded: #1529,only trigger the success event if not discarded add test,1
test: Add tests for reconnect and merge-config (#1530),0.9882651,Test: Add tests for reconnect and merge-config: #1530,add test for reconnect events add test for merge-config,1
mark data and error as readonly (#1514),0.9872879,Mark data and error as readonly: #1514,,1
output code coverage (#1511),0.9787148,Output code coverage: #1511,Co-authored-by: Jiachi Liu inbox@huozhi.im,1
1.1.0-beta.4,0.5817012,After 2.0.0:,,0
fix error events not deduped (#1522),0.9910844,Fix error events not deduped: #1522,,1
feat: Add new onDiscarded option (#1523),0.9911798,Feat: Add new onDiscarded option: #1523,add onDiscarded add test revert unintended change,1
chore: Code refactoring (#1521),0.9746798,Chore: Code refactoring: #1521,adjust condition use .catch,1
1.1.0-beta.3,0.56284046,After 2.0.0:,,0
chroe: use yalc for local development (#1508),0.9861821,Chroe: use yalc for local development: #1508,use yalc handle watch fail,1
typing: fix-type-generation (#1509),0.9791714,Typing: fix-type-generation: #1509,Author:    YixuanXu yixuanxu94@outlook.com,1
chore: Remove duplicate configs (#1507),0.9848968,Chore: Remove duplicate configs: #1507,chore: merge duplicate configs separate test type checking,1
fix: Refactor core revalidate function and fix isValidating state bug (#1493),0.9919647,Fix: Refactor core revalidate function and fix isValidating state bug: #1493,refactor core revalidate function; fix state bug fix test,1
example: add ref checking condition (#1504),0.96828806,Example: add ref checking condition: #1504,,1
fix: Invalidate the key when mutating without revalidating (#1498),0.98406434,Fix: Invalidate the key when mutating without revalidating: #1498,add test for mount revalidation and deduplication clear dedupling promises when invalidating a key delete concurrent promise when revalidate is set to true Co-authored-by: Shu Ding g@shud.in Co-authored-by: Gang Chen 13298548+MoonBall@users.noreply.github.com disable ts assertion Co-authored-by: Gang Chen 13298548+MoonBall@users.noreply.github.com,1
1.1.0-beta.2,0.58765984,After 2.0.0:,,0
chore: Upgrade eslint and add local cache (#1499),0.9693721,Chore: Upgrade eslint and add local cache: #1499,add cache to eslint upgrade eslint,1
chore: Refine type interfaces (#1496),0.97445464,Chore: Refine type interfaces: #1496,refine type names refine type names cont. simplify SWRConfiguration type apply review comments,1
chore: Improve project file structure (#1497),0.98224837,Chore: Improve project file structure: #1497,move jest-setup.ts to scripts move test-type into test separate tsc type check and build add github actions cache for yarn use setup-node@v2 update include path,1
Type useSWR fetcher (#1477),0.98365545,Type useSWR fetcher: #1477,type useSWR fetcher add comments about implementation add type test scripts for other middleware fix yarn.lock add type check for middleware and fetcher apply review change and type useSWRInfinite simplify the implementation of fetcher type Author:    YixuanXu yixuanxu94@outlook.com,1
ci: multiple dir type checking (#1492),0.97564125,Ci: multiple dir type checking: #1492,,1
1.1.0-beta.1,0.56177723,After 2.0.0:,,0
