Commit Message,Score,Correspond Changelog Sentence,Commit Description,Label
chore: Code refactoring (#1482),0.96983194,Chore: Code refactoring: #1482,rename shouldRevalidate to revalidate bind event listeners refactor shouldDedupe condition fix conditions,1
Upgrade typescript to 4.4.3 (#1486),0.9844599,Upgrade typescript to 4.4.3: #1486,upgrade update ts to 4.4.3 update yarn lock,1
build(deps): bump tmpl from 1.0.4 to 1.0.5 (#1484),0.98684555,Build(deps): bump tmpl from 1.0.4 to 1.0.5: #1484,,1
test: refactor offline and refresh tests (#1483),0.98270357,Test: refactor offline and refresh tests: #1483,,1
"test: refactor key, middlewares, and suspense tests (#1474)",0.98219806,"Test: refactor key, middlewares, and suspense tests: #1474",,1
test: refactor integration and loading tests (#1473),0.98344696,Test: refactor integration and loading tests: #1473,,1
add react 18 to peerDependencies (#1467),0.96958816,Add react 18 to peerDependencies: #1467,,1
test: refactor immutable and infinite hook tests (#1466),0.988654,Test: refactor immutable and infinite hook tests: #1466,,1
1.1.0-beta.0,0.5842947,After 2.0.0:,,0
fix: Support IE11 (#1463),0.9922153,Fix: Support IE11: #1463,fix: Support IE11 Fix type Also consider window,1
test: refactor mutation tests (#1459),0.95566905,Test: refactor mutation tests: #1459,,1
"Revert ""feat: add a warning for invalid arguments with suspense mode (#1402)"" (#1460)",0.9862132,"Revert ""feat: add a warning for invalid arguments with suspense mode "" (#1460): #1402",,1
test: refactor config tests (#1458),0.96927357,Test: refactor config tests: #1458,,1
test: refactor concurrent rendering tests (#1457),0.9798721,Test: refactor concurrent rendering tests: #1457,test: refactor concurrent rendering tests test: use wrapper option that testing-library provides instead of wrapping manually,1
chore: refactor infinite (#1452),0.95307016,Chore: refactor infinite: #1452,Co-authored-by: Jiachi Liu inbox@huozhi.im,1
refactor code related to unsubscribing global listeners (#1451),0.9965499,Refactor code related to unsubscribing global listeners: #1451,,1
test: refactor use-swr-cache-test (#1442),0.98789454,Test: refactor use-swr-cache-test: #1442,,1
enhance: provider release handlers (#1449),0.9599625,Enhance: provider release handlers: #1449,release provider feat: return release handler for initFocus and initReconnect flexible return types update comment,1
chore: remove unused typings (#1448),0.9764261,Chore: remove unused typings: #1448,,1
build: no emit on error (#1446),0.97429764,Build: no emit on error: #1446,,1
Fix initial isValidating when isPaused() returns true (#1440),0.98970425,Fix initial isValidating when isPaused() returns true: #1440,Fix initial isValidating when isPaused returns true Update unit test description,1
"Revert ""Feature: make return state(data, error and isValidating) readonly"" (#1443)",0.95976436,"Revert ""Feature: make return state(data, error and isValidating) readonly"" by @huozhi in link","Revert ""make return state(data, error and isValidating) readonly (#1431)"" This reverts commit ec778e70c8e17c239f2837c14dea99ce9a429fb0. enable diagnostics on CI",1
test: add render utilities and remove TestSWRConfig (#1435),0.99058676,Test: add render utilities and remove TestSWRConfig: #1435,test: add render utilities and remove TestSWRConfig chore: fix a comment,1
Stable hash (#1429),0.9640628,Stable hash: #1429,"code refactor serialize object keys (wip) serialization add stable hash add hash tests optimize support Number, String, Date adjust the order add regex fix string encoding reorganize code reorganize code handle objects and circular refs correctly serialize date adjust code flow add support for object key add test code refactor",1
"make return state(data, error and isValidating) readonly (#1431)",0.8255184,"Feature: make return state(data, error and isValidating) readonly by @anirudh1713 in link",,1
should treat key change as remount (#1430),0.9753494,Should treat key change as remount: #1430,,1
typing: use separated constants instead of enum (#1425),0.97442794,Typing: use separated constants instead of enum: #1425,typing: use separated constants instead of enum make focus test more stable Co-authored-by: Shu Ding g@shud.in,1
Chore: always use config ref (#1397),0.91643846,Chore: always use config ref: #1397,chore: always use config ref and shotern code move func declaration Co-authored-by: Shu Ding g@shud.in,1
test: add tests for a global cache (#1421),0.9895371,Test: add tests for a global cache: #1421,test: add tests for global cache Apply suggestions from code review Co-authored-by: Jiachi Liu inbox@huozhi.im Co-authored-by: Jiachi Liu inbox@huozhi.im,1
1.0.1-beta.0,0.57818514,After 2.0.0:,,0
refactor: use TestSWRConfig for error-test (#1404),0.9861127,Refactor: use TestSWRConfig for error-test: #1404,,1
fix: isValidating cache inconsistence in mutatation (#1411),0.98858196,Fix: isValidating cache inconsistence in mutatation: #1411,,1
fix: useSWRConfig is exported as () => any type (#1409),0.99594855,Fix: useSWRConfig is exported as () => any type: #1409,,1
Export KeyedMutator type from root export (#1406),0.9921576,Export KeyedMutator type from root export: #1406,,1
"Revert ""ci: setup size bot (#1398)"" (#1405)",0.5505332,Ci: remove Travis CI: #887,This reverts commit 321a0c1fa67c2a9d416e4a3c841c6c5ff8726f1d.,0
feat: add a warning for invalid arguments with suspense mode (#1402),0.99346477,Feat: add a warning for invalid arguments with suspense mode: #1402,,1
ci: setup size bot (#1398),0.48814613,Add CodeSandbox CI: #769,,0
fix: isValidating when an error occurred (#1396),0.98740757,Fix: isValidating when an error occurred: #1396,,1
chore: bump swr to latest in examples (#1394),0.9897893,Chore: bump swr to latest in examples: #1394,,1
chore: remove isomorphic-unfetch from examples (#1389),0.98800015,Chore: remove isomorphic-unfetch from examples: #1389,,1
fix typo in test (#1393),0.9698228,Fix typo in test: #1393,,1
1.0.0,0.56828105,After 2.0.0:,,0
chore(examples): update all examples to use v1 (#1385),0.99260545,Chore(examples): update all examples to use v1: #1385,chore(examples): update the api-hooks example chore(examples): update the autocomplete-suggestions example chore(examples): update the axios example chore(examples): update the axios-typescript example chore(examples): update the basic example chore(examples): update the basic-typescript example chore(examples): update the focus-revalidate example chore(examples): update the global-fetcher example chore(examples): update the infinite example chore(examples): update the infinite-scroll example chore(examples): update the local-state-sharing example chore(examples): update the optimistic-ui example chore(examples): update the optimistic-ui-immer example chore(examples): update the prefetch-preload example chore(examples): update the refetch-interval example chore(examples): update the server-render example chore(examples): update the storage-tab-sync example chore(examples): update the suspense example,1
Chore: add test to ensure the unserialized key is passed to middleware (#1384),0.97540414,Chore: add test to ensure the unserialized key is passed to middleware: #1384,,1
1.0.0-beta.15,0.54634565,After 2.0.0:,,0
fix bound mutate (#1383),0.9848188,Fix bound mutate: #1383,,1
doc: update fallbackData usage examples (#1380),0.9606911,Doc: update fallbackData usage examples: #1380,,1
1.0.0-beta.14,0.55348957,After 2.0.0:,,0
rename revalidateWhenStale (#1381),0.9617494,Rename revalidateWhenStale: #1381,,1
[Infinite] Return current data if failed to resolve pages from cache when setting size (#1379),0.9908756,[Infinite] Return current data if failed to resolve pages from cache when setting size: #1379,,1
Add basic test for node env (#1378),0.98034286,Add basic test for node env: #1378,Add test for node env use immutable add is server flag checking,1
rm deprecated warning (#1374),0.99347913,Rm deprecated warning: #1374,,1
fix: cache is missing on server side (#1377),0.99202144,Fix: cache is missing on server side: #1377,,1
Chore: add test for callback setSize (#1373),0.9825716,Chore: add test for callback setSize: #1373,add test for callback setSize replace sleep 1 with nextTick,1
1.0.0-beta.13,0.5232122,After 2.0.0:,,0
Update README and CONTRIBUTING (#656),0.9003668,Update README and CONTRIBUTING: #656,remove docs from readme (wip) contribution guidelines merge master add extra docs link Update README.md,1
Replace Object.defineProperties with getter  (#1371),0.9732263,Replace Object.defineProperties with getter: #1371,some optimizations use getter,1
rename fallbackValues to fallback; rename initialData to fallbackData (#1370),0.9875956,Rename fallbackValues to fallback; rename initialData to fallbackData: #1370,,1
improve tests for cache provider (#1369),0.98933375,Improve tests for cache provider: #1369,,1
Rename middlewares option to use (#1368),0.9627156,Rename middlewares option to use: #1368,,1
New useSWRConfig API and remove createCache (#1361),0.9841305,New useSWRConfig API and remove createCache: #1361,add useSWRProvider send fallback to provider init remove createCache add fallbackValues option rename setup functions; refactor function checks fix provider extending; add tests structuralize provider code refactor; add test refactor add test case for extending cache refactor: move provider and options to SWRConfig rename options to providerOptions refine code fix test merge providerOptions into values; add fallbackValues code refactoring rename useSWRProvider to useSWRConfig Update src/utils/cache.ts Co-authored-by: Paco 34928425+pacocoursey@users.noreply.github.com fix non-null assertion remove defaultProvider Co-authored-by: Paco 34928425+pacocoursey@users.noreply.github.com,1
1.0.0-beta.12,0.5843097,After 2.0.0:,,0
invert middleware order (#1360),0.9365312,Reverse middleware order: #1360,,1
"upgrade bunchee, dedupe yarn lock (#1358)",0.9910647,"Upgrade bunchee, dedupe yarn lock: #1358","upgrade bunchee, dedupe yarn lock replace concurrently with npm-run-all use rimraf instead of rm cmd",1
fix: isValidating should be false when no fetcher is provided (#1352),0.9921623,Fix: isValidating should be false when no fetcher is provided: #1352,,1
Add beta publish script (#1351),0.99020314,Add beta publish script: #1351,,1
1.0.0-beta.11,0.54219204,After 2.0.0:,,0
Refactor code structure (#1350),0.9661947,Refactor code structure: #1350,refactor state and revalidation logic refactor cache decouple utils refine comments fix review suggestions adjust eslint ignore rules,1
fix: alias swr in next client bundle on dev mode (#1349),0.9935198,Fix: alias swr in next client bundle on dev mode: #1349,,1
Local devdelopment with examples (#1330),0.9167334,Local devdelopment with examples: #1330,,1
"lint-staged: remove lint, fix prettier (#1347)",0.9857333,"Lint-staged: remove lint, fix prettier: #1347","lint-staged: remove lint, fix prettier type checking on pre-push, lint changes on commit",1
Export unstable_serialize from SWR (#1337),0.99173474,Export unstable_serialize from SWR: #1337,export serialize from swr and swr-infinite fix API rename api,1
Improvement: return stale data then revalidate when setting size of useSWRInfinite (#1343),0.989949,Improvement: return stale data then revalidate when setting size of useSWRInfinite: #1343,reuse cache when setting size fix tests optimize,1
fix type of MutatorCallback (#1342),0.97344124,Fix type of MutatorCallback: #1342,,1
1.0.0-beta.10,0.550972,After 2.0.0:,,0
Improvement: ensure useSWRInfinite reuses useSWR cache (#1341),0.9922019,Improvement: ensure useSWRInfinite reuses useSWR cache: #1341,make sure swr infinite reuses swr cache update comment,1
build(deps): bump path-parse from 1.0.6 to 1.0.7 (#1334),0.991943,Build(deps): bump path-parse from 1.0.6 to 1.0.7: #1334,Bumps path-parse from 1.0.6 to 1.0.7. - Release notes - Commits updated-dependencies: - dependency-name: path-parse   dependency-type: indirect ... Signed-off-by: dependabot[bot] support@github.com Co-authored-by: dependabot[bot] 49699333+dependabot[bot]@users.noreply.github.com,1
BREAKING: Deprecate revalidate with mutate (#1332),0.9901598,BREAKING: Deprecate revalidate with mutate: #1332,,1
"upgrade bunchee, reduce node_modules size (#1329)",0.9929837,"Upgrade bunchee, reduce node_modules size: #1329",,1
chore: update useSWRInfinite import (#1326),0.98842436,Chore: update useSWRInfinite import: #1326,,1
update bunchee 1.6.2 (#1323),0.9820062,Update bunchee 1.6.2: #1323,,1
test: add a test for getInfiniteKey with current data (#1319),0.9908066,Test: add a test for getInfiniteKey with current data: #1319,,1
refine the infinite hook (#1315),0.96806467,Refine the infinite hook: #1315,,1
Reset cache between tests (#1309),0.9794333,Reset cache between tests: #1309,Co-authored-by: Shu Ding g@shud.in,1
Fix config being ignored when fetcher is null (#1311),0.9960977,Fix config being ignored when fetcher is null: #1311,fix #1274 add unit test Co-authored-by: Jiachi Liu inbox@huozhi.im,1
Add package.json to module exports (#1313),0.98072,Add package.json to module exports: #1313,,1
Code refactoring (#1307),0.9786571,Code refactoring: #1307,structure change improve comments; refactor avoid using timeout code refactor apply review feedback Co-authored-by: Jiachi Liu inbox@huozhi.im,1
1.0.0-beta.9,0.5531678,After 2.0.0:,,0
Rename isDocumentVisible to isVisible (#1308),0.93873584,Rename isDocumentVisible to isVisible: #1308,,1
Breaking: drop the default fetcher (#1304),0.9744973,Breaking: drop the default fetcher: #1304,,1
Code structure refactoring (#1303),0.98910356,Code structure refactoring: #1303,refactor cache code structure simply mutate rearrange assignments build all packages use global state type guard and Revalidator type Co-authored-by: Jiachi Liu inbox@huozhi.im,1
Fix useSWRInfinite doesn't revalidate the first page (#1301),0.99231255,Fix useSWRInfinite doesn't revalidate the first page: #1301,,1
Refine createCache (#1283),0.9787649,Refine createCache: #1283,,1
enhance: simplify deno detection (#1299),0.9836247,Enhance: simplify deno detection: #1299,,1
add test case that covers #1286 (#1297),0.97408354,Add test case that covers #1286: #1297,,1
feat: add getInfiniteKey to mutate the cache for useSWRInfinite (#1257),0.9955052,Feat: add getInfiniteKey to mutate the cache for useSWRInfinite: #1257,,1
Drop legacy types (#1276),0.98086166,Drop legacy types: #1276,,1
Remove myself from codeowners (#1277),0.6477584,Add myself to CODEOWNERS: #38,,0
Move infinite types to swr/infinite and deprecate old ones (#1272),0.9600961,Move infinite types to swr/infinite and deprecate old ones: #1272,,1
Fix types generate (#1266),0.97241735,Fix types generate: #1266,fix: types generation replace resolved swr in tests avoid emit swr types in subpath module use paths for type imports revert few changes,1
1.0.0-beta.8,0.5657391,After 2.0.0:,,0
chore: fix type SWRHookWithdMiddleware to SWRHookWithMiddleware (#1268),0.9905172,Chore: fix type SWRHookWithdMiddleware to SWRHookWithMiddleware: #1268,,1
Fix typo in use-swr (#1267),0.98133653,Fix typo in use-swr: #1267,,1
chore: add watch scripts for sub packages to build them (#1261),0.98258114,Chore: add watch scripts for sub packages to build them: #1261,,1
enhance: use ts for testing (#1260),0.9771999,Enhance: use ts for testing: #1260,enhance: use ts for testing update deps use node 14 for csb Co-authored-by: Shu Ding g@shud.in,1
fix: ignore .d.ts in dist/ for ESLint (#1258),0.9956585,Fix: ignore .d.ts in dist/ for ESLint: #1258,,1
test: run concurrent rendering tests with React v18 alpha (#1259),0.99717176,Test: run concurrent rendering tests with React v18 alpha: #1259,,1
chore: fix to run the build script multiple times (#1255),0.9943993,Chore: fix to run the build script multiple times: #1255,,1
fix: fail accessing navigator on Node (#1254),0.99427694,Fix: fail accessing navigator on Node: #1254,,1
Sub-packages and immutable hook (#992),0.983155,Sub-packages and immutable hook: #992,add immutable mode add test rename as revalidateWhenStale refactor infinite to use middleware refactor immutable sub packages better code-splitting add types remove declarations fix tests fix sub-package and types fix test code optimizations code optimizations code optimizations code optimizations clean up deps fix noop clean up add more test code optimizations code refactoring; fix missing saveData option fix test simplify logic,1
enhance: add $ prefix for non-major keys (#1174),0.98712295,Enhance: add $ prefix for non-major keys: #1174,enhance: add $ prefix for err and isValidating keys update infinite keys Update src/use-swr-infinite.ts Co-authored-by: Jiachi Liu inbox@huozhi.im add $ for inf@ make symbol rich Co-authored-by: Shu Ding g@shud.in,1
chore: bump typescript to use ts-expect-error instead of ts-ignore (#1239),0.9965646,Chore: bump typescript to use ts-expect-error instead of ts-ignore: #1239,chore: update the typescript version to use ts-expect-error instead of ts-ignore refactor: apply prettier chore: revert the usage of ts-expect-error that causes an error refactor: apply rAF regardless of environments refactor: extend the Navigator type to use effectiveType,1
Add condition to check if window.addEventListener exists for React Native compatibility (#1234),0.9596048,Add condition to check if window.addEventListener exists for React Native compatibility: #1234,,1
1.0.0-beta.7,0.56101,After 2.0.0:,,0
Middleware (#1160),0.9745709,Middleware: #1160,clean up code abstract args hoc simplify args add comment decouple handler add middleware layer add test case more examples support extending middlewares via context or per-hook config; fix direction update eslint rules fix type errors fix failed tests Apply suggestions from code review Co-authored-by: Toru Kobayashi koba0004@gmail.com Update src/types.ts Co-authored-by: Toru Kobayashi koba0004@gmail.com allow middlewares to modify keys Co-authored-by: Toru Kobayashi koba0004@gmail.com Co-authored-by: Toru Kobayashi koba0004@gmail.com,1
add codeowner @huozhi (#1221),0.98182356,Add codeowner @huozhi: #1221,,1
build(deps): bump glob-parent from 5.1.0 to 5.1.2 (#1207),0.9943002,Build(deps): bump glob-parent from 5.1.0 to 5.1.2: #1207,Bumps glob-parent from 5.1.0 to 5.1.2. - Release notes - Changelog - Commits updated-dependencies: - dependency-name: glob-parent   dependency-type: indirect ... Signed-off-by: dependabot[bot] support@github.com Co-authored-by: dependabot[bot] 49699333+dependabot[bot]@users.noreply.github.com,1
build(deps): bump lodash from 4.17.19 to 4.17.21 (#1208),0.99043846,Build(deps): bump lodash from 4.17.19 to 4.17.21: #1208,Bumps lodash from 4.17.19 to 4.17.21. - Release notes - Commits updated-dependencies: - dependency-name: lodash   dependency-type: indirect ... Signed-off-by: dependabot[bot] support@github.com Co-authored-by: dependabot[bot] 49699333+dependabot[bot]@users.noreply.github.com,1
build(deps): bump y18n from 4.0.0 to 4.0.3 (#1209),0.98509264,Build(deps): bump y18n from 4.0.0 to 4.0.3: #1209,Bumps y18n from 4.0.0 to 4.0.3. - Release notes - Changelog - Commits updated-dependencies: - dependency-name: y18n   dependency-type: indirect ... Signed-off-by: dependabot[bot] support@github.com Co-authored-by: dependabot[bot] 49699333+dependabot[bot]@users.noreply.github.com,1
build(deps): bump acorn from 6.3.0 to 6.4.2 (#1210),0.9929977,Build(deps): bump acorn from 6.3.0 to 6.4.2: #1210,Bumps acorn from 6.3.0 to 6.4.2. - Release notes - Commits updated-dependencies: - dependency-name: acorn   dependency-type: indirect ... Signed-off-by: dependabot[bot] support@github.com Co-authored-by: dependabot[bot] 49699333+dependabot[bot]@users.noreply.github.com,1
Update package.json (#1205),0.98070335,Update package.json: #1205,,1
Fix typo in placeholder (#1206),0.97591966,Fix typo in placeholder: #1206,,1
Update README.md (#1203),0.95561445,Update README.md: #1203,,1
build(deps): bump ws from 7.4.2 to 7.4.6 (#1184),0.9838011,Build(deps): bump ws from 7.4.2 to 7.4.6: #1184,,1
fix: autocomplete suggestions example (#1183),0.97117645,Fix: autocomplete suggestions example: #1183,,1
build(deps): bump browserslist from 4.16.3 to 4.16.6 (#1181),0.98830974,Build(deps): bump browserslist from 4.16.3 to 4.16.6: #1181,Bumps browserslist from 4.16.3 to 4.16.6. - Release notes - Changelog - Commits Signed-off-by: dependabot[bot] support@github.com Co-authored-by: dependabot[bot] 49699333+dependabot[bot]@users.noreply.github.com,1
enhance: upgrade ts lint config (#1169),0.9906925,Enhance: upgrade ts lint config: #1169,,1
build(deps): bump hosted-git-info from 2.8.5 to 2.8.9 (#1164),0.99182546,Build(deps): bump hosted-git-info from 2.8.5 to 2.8.9: #1164,,1
fix global mutate generic (#1159),0.9805205,Fix global mutate generic: #1159,fix #1155,1
enhance: support exports field (#1154),0.984782,Enhance: support exports field: #1154,,1
Code optimizations (#1150),0.9371337,Code optimizations: #1150,optimizations use effect for ref updates use effect for ref updates fix setTimeout test fix the case that undefined is overridden get rid of object.assign rename isVisible refactor code pass entire config to swr revert isDocumentVisible fix ts,1
Update bound mutate readme (#1127),0.98388886,Update bound mutate readme: #1127,"The bounded mutation example doesn't immediately mutate the cache, instead its waiting for the request to come back and then updating the cache.  I think making this example similar to the one above, where we are trying to optimistically update the local state is a more consistent example",1
Custom cache provider (#1017),0.9651967,Custom cache provider: #1017,custom cache deprecate cache comment tweak the createCache api refactor createCache simplify cache interface improve tests bind swr state to the cache object; simplify internal logic fix merge errors and add cache to deps remove deps revert preset changes refactor code refactor code add multi-level cache test add isolated cache test Co-authored-by: Shu Ding g@shud.in,1
clean code (#1145),0.9630223,Clean code: #1145,,1
add saveData to slowConnection (#1130),0.97409,Add saveData to slowConnection: #1130,,1
Replace deprecated types with latest types in axios-typescript example (#1128),0.9879743,Replace deprecated types with latest types in axios-typescript example: #1128,,1
build: upragde bundler (#1121),0.9648774,Build: upragde bundler: #1121,,1
test: refactor use-swr-suspense.test.tsx (#1113),0.9870571,Test: refactor use-swr-suspense.test.tsx: #1113,,1
test: refactor use-swr-revalidate.test.tsx (#1111),0.98680353,Test: refactor use-swr-revalidate.test.tsx: #1111,,1
Fix setting null cache in useSWRInfinite (#1110),0.9882841,Fix setting null cache in useSWRInfinite: #1110,fix setting null as cache key fix typo,1
docs: optimistic UI examples comments more clearer (#1102),0.97027874,Docs: optimistic UI examples comments more clearer: #1102,,1
test: refactor use-swr-refresh.test.tsx (#1103),0.9875803,Test: refactor use-swr-refresh.test.tsx: #1103,test: use fake timers for refresh tests test: stop using container that the render function returns chore: reset timers on each test,1
Bug fixes (#1096),0.9570807,Bug fixes: #1096,fix type: allow getKey to be null fix leaking internal state when setSize on null key,1
fix: race problem when in dedupingInterval (#1088),0.9890165,Fix: race problem when in dedupingInterval: #1088,,1
Revert #1024 (#1085),0.9300709,Revert #1024: #1085,add dequal fix,1
fix mutate (#1075),0.96995836,Fix mutate: #1075,close #1070; close #1074;,1
add --no-sourcemap (#1079),0.9846567,Add --no-sourcemap: #1079,,1
adopt bunchee as bundler (#1025),0.97681403,Adopt bunchee as bundler: #1025,Co-authored-by: Shu Ding g@shud.in,1
Code refactoring (#1077),0.97155905,Code refactoring: #1077,code refactoring move argument resolving out,1
read cache during render (#794),0.9755212,Read cache during render: #794,fix stale fix types and add safecallback imporve dispatch fix dequal vendor ensure stateRef sync with cache add comment fix isValidating clean up use in operator fix resolveIsValidating fix: error is stale when key changes (wip) refactor (wip) refactoring refactor code add back initialMounted check Co-authored-by: Shu Ding g@shud.in,1
Allow setting the generic on mutate() (#1069),0.98909557,Allow setting the generic on mutate(): #1069,"Allow setting the generic on mutate() Without this change, it is not possible for users to do mutate(...) rm Mutator type add return type Fix types Fix another type issue Can skip Promise.resolve since we're in an async function",1
test: refactor use-swr-offline.test.tsx (#1063),0.98821926,Test: refactor use-swr-offline.test.tsx: #1063,,1
fix #1056 (#1058),0.9304631,Fix #1056: #1058,fix #1056 add test for #1056,1
test: refactor use-swr-local-mutation.test.tsx (#1059),0.9938909,Test: refactor use-swr-local-mutation.test.tsx: #1059,,1
test: refactor use-swr-loading.test.tsx (#1057),0.9914361,Test: refactor use-swr-loading.test.tsx: #1057,,1
0.5.4,0.5544651,After 2.0.0:,,0
test: refactor use-swr-key.test.tsx (#1055),0.9904449,Test: refactor use-swr-key.test.tsx: #1055,,1
types: expose KeyLoader (#1054),0.9738317,Types: expose KeyLoader: #1054,,1
fix: invalid invocation on raf (#1051),0.9850782,Fix: invalid invocation on raf: #1051,,1
test: refactor use-swr-integration.test.tsx (#1049),0.9901637,Test: refactor use-swr-integration.test.tsx: #1049,,1
Export default SWR config to allow more flexible extensions (#1023),0.9521557,Export default SWR config to allow more flexible extensions: #1023,Export default SWR config to allow more flexible extensions export default config as static property on SWRConfig,1
test: refactor use-swr-infinite.test.tsx (#1039),0.9911039,Test: refactor use-swr-infinite.test.tsx: #1039,,1
test: refactor use-swr-focus.test.tsx (#1036),0.9936341,Test: refactor use-swr-focus.test.tsx: #1036,test: refactor use-swr-focus.test.tsx test: make a config callback test more reliable,1
