Commit Message,Score,Correspond Changelog Sentence,Commit Description,Label
refactor: fix a react-hooks/exhaustive-deps warning (#1035),0.99626,Refactor: fix a react-hooks/exhaustive-deps warning: #1035,,1
0.5.3,0.60940033,After 2.0.0:,,0
fix: support multiple useSWRInfinite hooks in a page (#1009),0.9863907,Fix: support multiple useSWRInfinite hooks in a page: #1009,"fix: a flaky test for onLoadingSlow fix: supprt multiple useSWRInfinite hooks in a page test(useSWRInfinite): add a test for shared a page count between the same key fix: inconsistency for the pageCount between useSWRInfinite hooks fix: keep pageCount when persistSize is true refactor: use a local mutate function refactor: fix a react-hooks warning refactor: revert unnecessary diffs refactor: remove unused a ref fix: revert the change removing a rerender with setSize fix: avoid an unnecessary re-render refactor: clear variable names and more strict types refactor: put rAF and useIsomorphicLayoutEffect as one of web-presets Revert ""refactor: put rAF and useIsomorphicLayoutEffect as one of web-presets"" This reverts commit 2bc4ac202804519701234fec366ddda18ee656c6. refactor: create env.ts for a browser environment refactor: remove an ununsed export refactor: remove unnecessary diffs test: make a test using setInterval more reliable Co-authored-by: Shu Ding g@shud.in",1
Micro optimizations (#1018),0.9772873,Micro optimizations: #1018,code refactoring update rerender code refactoring code refactoring Update cache.ts make tests more stable,1
test: refactor use-swr-error.test.tsx (#1031),0.98819387,Test: refactor use-swr-error.test.tsx: #1031,,1
test: refactor tests for configs (#1006),0.98390293,Test: refactor tests for configs: #1006,test: refactor use-swr-configs.test.tsx test: refactor use-swr-context-config.test.tsx,1
fix dequal vendor (#1027),0.97288835,Fix dequal vendor: #1027,,1
0.5.1,0.65293604,After 2.0.0:,,0
Make swr zero dependency (#1024),0.9679007,Make swr zero dependency: #1024,Make swr zero dependencies mark license,1
allow passing undefined config (#1022),0.98264104,Allow passing undefined config: #1022,,1
Update CODEOWNERS,0.7559858,Update CODEOWNERS: dd1bcf99daeacb167b31a7da9547c39ae4452d95,,1
fix: revalidate with initialData when changing the key (#961),0.9724963,Fix: revalidate with initialData when changing the key: #961,fix: revalidate with initialData when changing the key test: add the return data when a request is in flight test: return initialData while revalidating,1
0.5.0,0.5834484,After 2.0.0:,,0
enable typescript strict mode (#1010),0.9845462,Enable typescript strict mode: #1010,strict mode disbale strict in test merge master fix name,1
Clean up types (#1016),0.945778,Clean up types: #1016,deprecate ConfigInterface; fix exported types deprecate SWRInfiniteConfigInterface and SWRInfiniteResponseInterface deprecate CacheInterface deprecate RevalidateOptionInterface and keyInterface deprecate revalidateType deprecate responseInterface reorder clean up internal types,1
Optimize isValidating status (#967),0.97996724,Optimize isValidating status: #967,remove unused command Add useDebugValue to show the data label in the React DevTools set isValidating to be true if will fetch on mount cleanup check key as well when trigger the initial revalidation,1
keep old esm directory structure (#1011),0.9881112,Keep old esm directory structure: #1011,keep old esm directory structure add a new tsconfig.test.json for ts-jest,1
fix: sync cache only on compare returns true (#907),0.9949711,Fix: sync cache only on compare returns true: #907,Co-authored-by: Shu Ding g@shud.in,1
test: refactor use-swr-config-callbacks.test.tsx  (#933),0.9947667,Test: refactor use-swr-config-callbacks.test.tsx: #933,test: create a function to return a dummy response for testing test: refactor use-swr-config-callbacks.test.tsx test: use findByText instead of waiting a response promise test: remove unnecessary assertions,1
fix: sync mutations are applied independently (#1003),0.9934336,Fix: sync mutations are applied independently: #1003,"fix: sync mutations are applied independently test: update the test for sync mutation test: fix type errors in tests Revert ""test: fix type errors in tests"" This reverts commit c18af795b38beee2fec0bb49890e51682854138d. Revert ""test: update the test for sync mutation"" This reverts commit cb053010701af809389ab14b7f1fd0614d9bbcda. test: sync mutations are not batched",1
using vite2 and add playground to master (#995),0.97809374,Using vite2 and add playground to master: #995,using vite2 and add playground to master tweak Co-authored-by: xuyx001 xuyx001@cmft.com,1
test: refactor use-swr-cache.test.tsx (#932),0.9925014,Test: refactor use-swr-cache.test.tsx: #932,test: use @testing-library/jest-dom for asserting DOM test: refactor use-swr-cache.test.tsx test: use eslint-plugin-jest-dom and eslint-plugin-testing-library test: fix jest-dom/prefer-to-have-attribute errors test: remove assert functions for findByText,1
Fix: do not depend on navigator.onLine; code optimizations (#1004),0.996144,Fix: do not depend on navigator.onLine; code optimizations: #1004,fix: do not depend on navigator.onLine chore: use anonymous functions micro optimization micro optimization add test,1
Add example using useSWRInfinite (#968),0.9384562,Add example using useSWRInfinite: #968,add-infinite-example Update package.json Co-authored-by: Reza Babaei reza.tizro@gmail.com,1
perf: avoid unnecessary re-renders with the suspense mode (#979),0.9852724,Perf: avoid unnecessary re-renders with the suspense mode: #979,test: add a test for render count with suspense perf: avoid unnecessary re-renders with the suspense mode,1
refactor: add the register prefix to onFocus and onReconnect (#993),0.9775926,Refactor: add the register prefix to onFocus and onReconnect: #993,,1
add-infinite-scroll-example (#970),0.9600466,Add-infinite-scroll-example: #970,Co-authored-by: Reza Babaei reza.tizro@gmail.com,1
refactor: move DOM event handlers into web-preset (#972),0.9895755,Refactor: move DOM event handlers into web-preset: #972,,1
fix: do not cache when mutate throws an error synchronously (#977),0.9960015,Fix: do not cache when mutate throws an error synchronously: #977,,1
Update README.md (#974),0.96431756,Update README.md: #974,"correct code example for ""Mutation and POST Request""",1
types: makes types fn and config and getKey more strictly (#946),0.96495324,Types: makes types fn and config and getKey more strictly: #946,,1
0.4.2,0.68027776,After 2.0.0:,,0
fix: checking if document is defined (#963),0.98594975,Fix: checking if document is defined: #963,,1
refactor: rename from waitForDedupingInterval to waitForNextTick (#960),0.9803624,Refactor: rename from waitForDedupingInterval to waitForNextTick: #960,,1
test: fix flaky tests for focus and location mutation (#944),0.9857351,Test: fix flaky tests for focus and location mutation: #944,test: fix flaky tests in use-swr-focus.text.tsx test: fix flaky tests in use-swr-local-mutation.test.tsx test: create a waitForDedupingInterval function for sleep(1) test: revert unnecessary change,1
remove legacy useSWRPages types (#938),0.9880637,Remove legacy useSWRPages types: #938,,1
chore: add comments that revalidate will be deprecated (#937),0.98380387,Chore: add comments that revalidate will be deprecated: #937,,1
0.4.1,0.6755498,After 2.0.0:,,0
refactor: fix all react-hooks/exhaustive-deps warnings in useSWR (#927),0.99541575,Refactor: fix all react-hooks/exhaustive-deps warnings in useSWR: #927,,1
chore: add a comment why fetcher accepts null (#918),0.9946933,Chore: add a comment why fetcher accepts null: #918,,1
test: recognize type definition for screen of testing-library/react (#903),0.9955783,Test: recognize type definition for screen of testing-library/react: #903,deps: bump @testing-library/react to v10.1.0 test: enable type checking with ts-jest deps: bump jest packages to 25.x,1
chore: rm duplicated tests (#914),0.9789138,Chore: rm duplicated tests: #914,chore: remove original duplicated tests chore: remove original duplicated tests update test,1
chore: format files (#915),0.96246356,Chore: format files: #915,,1
check key before calling callback (#856),0.9744811,Check key before calling callback: #856,Co-authored-by: Shu Ding g@shud.in,1
Fix the revalidation condition of the first page (#895),0.9796027,Fix the revalidation condition of the first page: #895,fix the revalidation condition of the first page add test simplify logic fix test,1
refactor: fix all react-hooks/exhaustive-deps warnings in useSWRInfinite (#905),0.995861,Refactor: fix all react-hooks/exhaustive-deps warnings in useSWRInfinite: #905,,1
docs: use a fake GraphQL endpoint instead of graph.cool (#904),0.9587375,Docs: use a fake GraphQL endpoint instead of graph.cool: #904,,1
refactor: fix all react-hooks/exhaustive-deps warnings in tests (#902),0.9971771,Refactor: fix all react-hooks/exhaustive-deps warnings in tests: #902,,1
separate tests (#901),0.9614248,Separate tests: #901,separate-tests fix tests,1
test: add a test for useSWRInfinite with initialData (#894),0.9884452,Test: add a test for useSWRInfinite with initialData: #894,,1
fix: react-hooks/exhaustive-deps warnings (#886),0.99560153,Fix: react-hooks/exhaustive-deps warnings: #886,,1
fix: add server check back for rAF (#899),0.97398514,Fix: add server check back for rAF: #899,,1
refactor: use getter functions to avoid unnecessary re-renders (#890),0.97267294,Refactor: use getter functions to avoid unnecessary re-renders: #890,"refactor: use Object.assign to avoid unnecessary re-renders refactor: use getter functions to avoid unnecessary re-renders refactor: use Object.assign to avoid unnecessary re-renders Revert ""refactor: use Object.assign to avoid unnecessary re-renders"" This reverts commit 116fced90a19a4b8b15bc811f09272ec399af8ed. refactor: define properties with enumerable: true",1
fix: revalidateOnFocus not working on '< iOS 14'  (#889),0.9944533,Fix: revalidateOnFocus not working on '< iOS 14': #889,"To support <= 'iOS 13', replace window.addEventListener with document.addEventListener Add guard for environment that doesn't have document Revert ""Add guard for environment that doesn't have document"" This reverts commit 5fd759c9745b51701b68d5082e52530cd6f0b15b. Co-authored-by: dwan dwankim@toss.im",1
Update default fetcher documentation in README.md (#891),0.9761748,Update default fetcher documentation in README.md: #891,Ran into issues with this when using SWR for local state sharing. It seems that the default value for the fetcher is actually window.fetch and not undefined: link,1
docs: add isPaused() into the options (#888),0.968099,Docs: add isPaused() into the options: #888,,1
ci: remove Travis CI (#887),0.9887266,Ci: remove Travis CI: #887,,1
ci: add GitHub Actions for CI (#879),0.9895247,Ci: add GitHub Actions for CI: #879,"ci: add GitHub Actions for CI ci: run CI for pull requets and push to master, next Update test.yml",1
fix: add protection for navigator (#877),0.9867985,Fix: add protection for navigator: #877,,1
enhance: let config.isPaused works with react state (#871),0.989268,Enhance: let config.isPaused works with react state: #871,,1
0.4.0,0.6865155,After 2.0.0:,,0
First page of useSWRInfinite should reuse the cache from useSWR (#799),0.9859868,First page of useSWRInfinite should reuse the cache from useSWR: #799,fix type error simplify code,1
add test for #852 (#855),0.9430084,Add test for #852: #855,add test for #852 improve assert,1
fix: clear refresh timer on effects change and check it on starting new timer (#853),0.99580216,Fix: clear refresh timer on effects change and check it on starting new timer: #853,fix: keep refresh timer refrence simplify clear timer,1
feature: provide config.isIdle indicating idle state and stop revalidation (#845),0.8810539,Feature: provide config.isPaused indicating idle state and stop revalidation: #845,"feature: ignore revalidations when config.isIdle() is truthy add test rename to isPaused(), ignore errors in catch",1
fix act (#839),0.9653131,Fix act: #839,,1
Keep isValidating be true when there are two concurrent requests (#817),0.99549234,Keep isValidating be true when there are two concurrent requests: #817,,1
0.3.11,0.6467446,After 2.0.0:,,0
test(fetch) add test for default fetcher (#834),0.990579,Test(fetch) add test for default fetcher: #834,,1
Fix #832 (#833),0.9327769,Fix #832: #833,,1
0.3.10,0.64499265,After 2.0.0:,,0
close #830 (#831),0.89657366,Close #830: #831,close #830 trigger codesandbox ci,1
Bump ini from 1.3.5 to 1.3.8 (#806),0.9750387,Bump ini from 1.3.5 to 1.3.8: #806,Bumps ini from 1.3.5 to 1.3.8. - Release notes - Commits Signed-off-by: dependabot[bot] support@github.com Co-authored-by: dependabot[bot] 49699333+dependabot[bot]@users.noreply.github.com,1
Return '@null' if args is null ASAP (#767),0.98738897,Return '@null' if args is null ASAP: #767,chore: return 'null' if arg[i] is null ASAP chore: update comment chore: use continue,1
Update api-hooks example README.md (#790),0.9808353,Update api-hooks example README.md: #790,Updated the Vercel deploy link to the correct directory,1
fix: do mount check in config callback (#787),0.9927895,Fix: do mount check in config callback: #787,,1
Fix README.md typo (#783),0.9911157,Fix README.md typo: #783,"'/api/data' => '/api/user' in ""Multiple Arguments""",1
fix: mark isValidating as false when key is falsy (#757),0.99241257,Fix: mark isValidating as false when key is falsy: #757,fix: tear down when key turns to empty use false for empty key,1
0.3.9,0.5776178,After 2.0.0:,,0
Fix suspense (#777),0.9627269,Fix suspense: #777,fix #494 add comment rename to initialMountedRef,1
dispatch's payload type is actionType and run lint (#772),0.9898519,Dispatch's payload type is actionType and run lint: #772,chore: payload is actionType chore: move a ts-ignore comment,1
Add CodeSandbox CI (#769),0.96825755,Add CodeSandbox CI: #769,add CodeSandbox CI add new line fix install cmd Co-authored-by: Paco 34928425+pacocoursey@users.noreply.github.com,1
Fix mutateCallback types (#745),0.986473,Fix mutateCallback types: #745,Fix mutateCallback types WIP,1
fix eslint error (#768),0.99165696,Fix eslint error: #768,,1
refactor: support SSR in Deno (#754),0.99435866,Refactor: support SSR in Deno: #754,refactor: support SSR in Deno refactor: improve Deno determining Add @ts-ignore Co-authored-by: Shu Ding g@shud.in Co-authored-by: Shu Ding g@shud.in,1
Fix race condition when calling mutate synchronously (#735),0.99395025,Fix race condition when calling mutate synchronously: #735,fix race condition when calling mutate synchronously fix test add comment fix code reviews,1
replace rIC with rAF (#744),0.9749005,Replace rIC with rAF: #744,,1
0.3.8,0.6073697,After 2.0.0:,,0
add test for mutate with async-fn (#739),0.9883931,Add test for mutate with async-fn: #739,,1
Allow passing null as the fetcher function for lazy execution (#730),0.9927199,Allow passing null as the fetcher function for lazy execution: #730,Allow passing null as the fetcher function This allows again for lazy execution since passing undefined broke with the introduction of a default fetcher in #367 Fix syntax for null fetcher Co-authored-by: Shu Ding g@shud.in,1
0.3.7,0.5873435,After 2.0.0:,,0
Accept React 17 as a peer dependency (#725),0.9924468,Accept React 17 as a peer dependency: #725,Closes link Let me know if you would like any other changes to accompany this one.,1
feat: make swr more configurable across platform (#690),0.9916327,Feat: make swr more configurable across platform: #690,,1
Add README to examples (#716),0.9585874,Add README to examples: #716,Add README to suspense example Add README to local-state-sharing example,1
0.3.6,0.6246582,After 2.0.0:,,0
fix: error should not be cleared while revalidating (#701),0.9830494,Fix: error should not be cleared while revalidating: #701,,1
doc: fix readme's Request Deduplication example (#699),0.9843471,Doc: fix readme's Request Deduplication example: #699,,1
fix: missing dedupe in updaterInterface (#688),0.9922974,Fix: missing dedupe in updaterInterface: #688,,1
0.3.5,0.47994524,After 2.0.0:,,0
Remove unnecessary dependencies from mutate and setSize (#665),0.9549061,Remove unnecessary dependencies from mutate and setSize: #665,make sure mutate and setSize are stable lint fix swr.mutate being updated,1
0.3.4,0.6048295,After 2.0.0:,,0
Add React and Hook config for ESLint (#270),0.98002887,Add React and Hook config for ESLint: #270,feat: install and config react rules for eslint fix: add names to components in example fix: move use of hook before conditional return chore: bump plugins versions + recommended rules + fixes,1
chore: swap fde for dequal (#655),0.96568084,Chore: swap fde for dequal: #655,,1
0.3.3,0.59696233,After 2.0.0:,,0
Add a default fetcher using Fetch API (#367),0.98362607,Add a default fetcher using Fetch API: #367,,1
Remove Isomorphic Fetch from Axios Typescript example (#607),0.9934598,Remove Isomorphic Fetch from Axios Typescript example: #607,Use axios since it's already in the project remove isomorphic-unfetch from project update typescript example as well. fix: update for proper data handling,1
Promote isValidating to the global level of data and error (#569),0.9854323,Promote isValidating to the global level of data and error: #569,Promote isValidating to the global level of data and error initialIsValidating to boolean,1
chore: fix error when data tobe 0 null (#622),0.9905422,Chore: fix error when data tobe 0 null: #622,chore: fix error when data tobe 0 null chore: prettify code chore: extract initial resolver into a function style: remove semicolon Co-authored-by: anc95 1481988258@qq.com Co-authored-by: anchao.nx anchao.nx@bytedance.com,1
try fix cannot stop polling by setting refreshInterval (#632) (#638),0.99128854,Try fix cannot stop polling by setting refreshInterval  (#638): #632,fix Cannot stop polling by setting refreshInterval (#632) clear exiting the effect when key changes add test case for a-b-a and try fix a-b-a set less task,1
Bump handlebars from 4.5.2 to 4.7.6 (#646),0.980694,Bump handlebars from 4.5.2 to 4.7.6: #646,Bumps handlebars from 4.5.2 to 4.7.6. - Release notes - Changelog - Commits Signed-off-by: dependabot[bot] support@github.com Co-authored-by: dependabot[bot] 49699333+dependabot[bot]@users.noreply.github.com,1
0.3.2,0.69006467,After 2.0.0:,,0
add function key arguments to WeakMap so they trigger revalidation on identity change (#612),0.9781793,Add function key arguments to WeakMap so they trigger revalidation on identity change: #612,,1
chore: optimization dispatch (#621),0.8788138,Chore: optimization dispatch: #621,Co-authored-by: anchao.nx anchao.nx@bytedance.com,1
0.3.1,0.68832904,After 2.0.0:,,0
fix: do not rerender if data unchanged (#464),0.99285537,Fix: do not rerender if data unchanged: #464,,1
swr.vercel.app (#605),0.9689388,Swr.vercel.app: #605,,1
fix: 'revalidateOnFocus' and 'revalidateOnReconnect' shoule be statful (#583),0.98328763,Fix: 'revalidateOnFocus' and 'revalidateOnReconnect' shoule be statful: #583,fix: 'revalidateOnFocus' and 'revalidateOnReconnect' shoule be statful closes #529 delete throttle.ts,1
fix useSWRInfinite response type (#584),0.9881221,Fix useSWRInfinite response type: #584,,1
fix: eventsRef should trigger the lastest version of config callbacks (#521),0.994968,Fix: eventsRef should trigger the lastest version of config callbacks: #521,"fix: eventsRef should trigger the lastest version of config callbacks Currently,the config callbacks captured by the eventsRef is the callbacks created in the initial render of the component. If the config callbacks is pure, everything is fine but if the config callbacks rely on some variables of the components , it would cause some bugs related to the stale closure. test: change the key name fix: update config in each redering revert: update config in each redering(e4d473a7affa5afefbc19ae2e61ab1651ffbb384)",1
Added example for SWR Request De-duplication feature (#519),0.6542425,Doc: fix readme's Request Deduplication example: #699,Added example for SWR Request De-duplication feature Update README.md Co-authored-by: Paco 34928425+pacocoursey@users.noreply.github.com explained the dedupingInterval feature Corrected the option syntax Update README.md Co-authored-by: Paco 34928425+pacocoursey@users.noreply.github.com Update README.md Co-authored-by: Paco 34928425+pacocoursey@users.noreply.github.com Update README.md Co-authored-by: Paco 34928425+pacocoursey@users.noreply.github.com Update README.md reverting prettier edits Update README.md reverting minor prettier edits Update README.md reverting minor edits Update README.md reverting spaces in code Update README.md reverting minor spaces Update README.md reverting space in code Co-authored-by: Paco 34928425+pacocoursey@users.noreply.github.com,0
fix problem of unnecessary revalidates when resolved data is falsy (#524),0.9888742,Fix problem of unnecessary revalidates when resolved data is falsy: #524,,1
Add useDebugValue to show the data label in the React DevTools (#578),0.9806227,Add useDebugValue to show the data label in the React DevTools: #578,remove unused command Add useDebugValue to show the data label in the React DevTools,1
0.3.0,0.6844782,After 2.0.0:,,0
enhance: move online listeners to config (#474) (#476),0.987037,Enhance: move online listeners to config  (#476): #474,enhance: move online listeners to config polish code & merge revalidator manipulation cases still separate revalidators move events attaching to use-swr move global states to user-swr group listeners,1
enhance: fallback to setTimeout when request idle callback is not available (#473),0.99382037,Enhance: fallback to setTimeout when request idle callback is not available: #473,enhance: polyfill irc (#471) run timers fix tests,1
Bump lodash from 4.17.15 to 4.17.19 (#531),0.9666109,Bump lodash from 4.17.15 to 4.17.19: #531,Bumps lodash from 4.17.15 to 4.17.19. - Release notes - Commits Signed-off-by: dependabot[bot] support@github.com Co-authored-by: dependabot[bot] 49699333+dependabot[bot]@users.noreply.github.com,1
fix: should throw when mutate failed (#557),0.9908943,Fix: should throw when mutate failed: #557,,1
fix typescript warning (#530),0.9921837,Fix typescript warning: #530,fix bug link,1
remove unused command (#544),0.9715749,Remove unused command: #544,,1
Export interfaces used by useSWRInfinite (#511),0.98112017,Export interfaces used by useSWRInfinite: #511,export interfaces used by useSWRInfinite rename SWR infinite interfaces,1
update link (#516),0.9040456,Update link: #516,,1
Updated the readme (#513),0.97553414,Updated the readme: #513,Just resolved some basic grammar issues in the readme.,1
fix: check if mounted when trigger rerender (#510),0.9858789,Fix: check if mounted when trigger rerender: #510,,1
don't retry on error if errorRetryCount is set to 0 (#506),0.9908402,Don't retry on error if errorRetryCount is set to 0: #506,don't retry on error if errorRetryCount is set to 0 check for number type for errorRetryCount,1
Fix page size persistence when remounting (#495),0.9927715,Fix page size persistence when remounting: #495,fix page size persistence fix version,1
enhance: remove mutate calls from cache (#493),0.9906606,Enhance: remove mutate calls from cache: #493,enhance: remove mutate from cache add test,1
"Revert ""add microbundle (#487)"" (#492)",0.9575705,"Revert ""add microbundle "" (#492): #487",This reverts commit 415ab934717087a60dbbcf60af3af6331d998e5e.,1
add persistSize option to useSWRInfinite (#490),0.98168993,Add persistSize option to useSWRInfinite: #490,,1
add microbundle (#487),0.98156035,Add microbundle: #487,,1
New infinite loading API (#435),0.9863017,New infinite loading API: #435,add useSWRInfinite add tests memorize methods and fix tests don't revalidate all when changing page count fix page count cache fix set page count cache make setPage return promise Update src/use-swr-infinite.tsx Co-authored-by: Yamagishi Kazutoshi ykzts@desire.sh remove useSWRPages do not notify when updating cache change tsx to ts change page to size in api Co-authored-by: Yamagishi Kazutoshi ykzts@desire.sh,1
test: add test case for error updating in cache when mutate (#481),0.99365586,Test: add test case for error updating in cache when mutate: #481,test: add test case for error updating in cache when mutate resolve conflicts,1
Update keyErr on the cache when mutating (#480),0.98089147,Update keyErr on the cache when mutating: #480,Update keyErr on the cache when mutating Move cache set keyErr out of condition,1
Change name to Vercel (#467),0.94911873,Change name to Vercel: #467,,1
0.2.3,0.7155037,After 2.0.0:,,1
Make trigger return a promise resolved to the new cache value (#391),0.99403477,Make trigger return a promise resolved to the new cache value: #391,Make trigger return a promise resolved to the new cache value Add promise of the updated value after calling the updaters in mutate,1
docs: setup issue template (#453),0.8977005,Docs: setup issue template: #453,docs: setup issue template polish,1
Use initialData in suspense mode if provided (#448),0.9530177,Use initialData in suspense mode if provided: #448,Use initialData in suspense mode if provided Signed-off-by: Joern Bernhardt joern.bernhardt@compose.us Fix review comment Signed-off-by: Joern Bernhardt joern.bernhardt@compose.us,1
Update docs to explain dependent fetching with falsy (#449),0.9910662,Update docs to explain dependent fetching with falsy: #449,Update docs to explain dependent fetching with falsy This doesn't appear to be well documented. (See #426.) Update README.md Co-authored-by: Shu Ding ds303077135@gmail.com Co-authored-by: Shu Ding ds303077135@gmail.com,1
