Commit Message,Score,Correspond Changelog Sentence,Commit Description,Label
Bump typescript and assemble pnpm scripts (#2133),0.8054278,Bump typescript and assemble pnpm scripts by @huozhi in https://github.com/vercel/swr/pull/2133,Bump typescript to 4.8 and assemble pnpm scripts,1
Upgrade bunchee (#2132),0.69884217,Update bunchee 1.6.2: #1323,  Upgrade bunchee   remove scripts ,0
Reorder exports conditions (#2130),0.7382659,Reorder exports conditions by @huozhi in https://github.com/vercel/swr/pull/2130,,1
"chore: exclude .tsbuildinfo from files, reduce install size (#2119)",0.8737575,"chore: exclude .tsbuildinfo from files, reduce install size by @promer94 in https://github.com/vercel/swr/pull/2119",,1
type: make tsconfig simpler and fix type error (#2115),0.8499892,type: make tsconfig simpler and fix type error by @promer94 in https://github.com/vercel/swr/pull/2115,  type: make tsconfig simpler and fix type error   fix: lint error ,1
fix: add swr/_internal to paths (#2105),0.9100951,fix: add swr/_internal to paths by @jason89521 in https://github.com/vercel/swr/pull/2105,,1
types: add generic for SWRInfiniteKeyLoader (#2104),0.921238,types: add generic for SWRInfiniteKeyLoader by @jason89521 in https://github.com/vercel/swr/pull/2104,,1
chore: add basic tsdoc (#2089),0.6770406,Chore: fix ts comments: #1540,chore: add basic tsdocs,0
Chore: Typos and grammar (#2094),0.7300563,Chore: Typos and grammar by @AllanOliveiraM in https://github.com/vercel/swr/pull/2094,  chore: processed all high-level texts for grammatical corrections   chore: the sense was incorrectly corrected by the processor   chore: fixed unnecessary commas and grammar correction nuances   Apply suggestions from code review   Apply suggestions from code review   Co-authored-by: Jiachi Liu inbox@huozhi.im,1
bump typescript and apply nodenext module resolution (#2084),0.84656966,bump typescript and apply nodenext module resolution by @huozhi in https://github.com/vercel/swr/pull/2084,  bump typescript and apply nodenext module resolution   update ts path   fix path   reorder ci job   update lockfile ,1
Use pnpm workspace (#2085),0.7437239,Use pnpm workspace by @huozhi in https://github.com/vercel/swr/pull/2085,  use dir filter and remove version field   Use pnpm ws and remove turbo ,1
Remove unused info from dummy package.json (#2083),0.8395707,Remove unused info from dummy package.json by @huozhi in https://github.com/vercel/swr/pull/2083,,1
Fix: raf return type (#2074),0.7510801,Fix: invalid invocation on raf: #1051,  Fix: raf return type   add typing test ,1
breaking: Revert SWR config generic for cache (#2065),0.7933239,Fix cache types by @chibicode in https://github.com/vercel/swr/pull/1961,  Revert swr config generic   explicit typing ,1
Upgrading use-sync-external-store lib (#2063),0.75382894,Upgrading use-sync-external-store lib by @sanjaiyan-dev in https://github.com/vercel/swr/pull/2063,  Upgrading use-sync-external-store lib   Update pnpm-lock.yaml   Co-authored-by: Shu Ding g@shud.in,1
2.0.0-beta.6,0.63890386,After 2.0.0:,,0
Use consistent typing imports (#2061),0.70292914,Use consistent typing imports by @huozhi in https://github.com/vercel/swr/pull/2061,,1
feat: add DevTools hook (#2016),0.62101144,feat: add DevTools hook by @koba04 in https://github.com/vercel/swr/pull/2016,  feat: add SWR_DEVTOOLS_USE hook   refactor: define the devtools hook in web-preset   feat: expose the React instance as window.SWR_DEVTOOLS_REACT   refactor: create devtools preset and a setup function   test: fix a failed test for devtools   test: add a test for window.SWR_DEVTOOLS_REACT   refactor: inject the devtools middleware as a built-in middleware   fix: inject SWR_DEVTOOLS_REACT only .SWR_DEVTOOLS_USE is defined   refactor: sort an import statement ,0
Fix typos (#2052),0.8052262,Fix: typos: #1647,,1
2.0.0-beta.5,0.6596083,After 2.0.0:,,0
feat: mutate filter (#1989),0.70502895,feat: mutate filter by @huozhi in https://github.com/vercel/swr/pull/1989,"  feat: mutate filter   tweak typing   add test   tweak typings   chore: remove useless overload (#1993)   fix typing   chore: change internalMutate type (#1997)   chore: change internalMutate type   chore: useoverload for internal mutate   store keys in global state   add type truthy key   polish truthy key   dont remove key   add clear test case, fix empty key   store key in cache   use values   fix cache test   pass original argument to the filter   fix types   fix types   fix failed tests; use useSyncExternalStore and memorized selector   move function declaration   fix infinite use cases   fix lint error   Co-authored-by: Yixuan Xu yixuanxu94@outlook.com Co-authored-by: Shu Ding g@shud.in",1
Fix ts type generation (#2038),0.77391016,Fix ts type generation by @huozhi in https://github.com/vercel/swr/pull/2038,  Fix ts type generation   update types path   fix type checking job ,1
fix: isLoading and isValidating should always respect cache value (#2048),0.7832439,fix: isLoading and isValidating should always respect cache value by @promer94 in https://github.com/vercel/swr/pull/2048, fix: isLoading and isValidating should always respect cache value  fix #2030  test: case for #2030,1
fix: Avoid preloading the resource multiple times (#2036),0.74256444,fix: Avoid preloading the resource multiple times by @shuding in https://github.com/vercel/swr/pull/2036,fix: Avoid preloading multiple times,1
2.0.0-beta.4,0.6778973,After 2.0.0:,,0
feat: add preload function (#2026),0.7297416,Preload API (#2026),  feat: swr/preload   refactor: not add preload as a separate package   feat: add preload as a built-in middleware   fix: build-in middlewares should be run before use-defined middlewares   chore: remove an unnecessary diff   refactor: rename the API to preload   test: fix a failing test   test: add a test for resetting an error   fix: handling deduping and errors   refactor: variable names   refactor: tweak a comment   chore: s/middlewares/middleware/   refactor: add a type parameter for the preload function   refactor: ignore falsy fetcher   refactor: use SWRGlobalState to store preloading requests ,1
test: fix all act warnings (#2031),0.86566967,test: fix an act warning by @koba04 in #1888,,1
feat: support functional swr context config (#2024),0.9072311,feat: support functional swr context config by @huozhi in https://github.com/vercel/swr/pull/2024,  feat: support functional swr context config   add typing test   fix typing   fix typing test   remove assertion ,1
breaking: Rename SWRConfig.default to SWRConfig.defaultValue (#2023),0.9180739,BREAKING: rename SWRConfig.default to SWRConfig.defaultValue by @huozhi in https://github.com/vercel/swr/pull/2023,,1
fix: Adding debounce for autocomplete-suggestions example (#2017),0.82291454,fix: Adding debounce for autocomplete-suggestions example by @Walkeryr in https://github.com/vercel/swr/pull/2017,fix: add debounce for autocomplete change handler,1
test: add test case for #1974 (#2005),0.6874854,Add test case that covers #1286: #1297,,0
chore: add engine field to limit pnpm version (#1990),0.89620733,chore: add engine field to limit pnpm version by @huozhi in https://github.com/vercel/swr/pull/1990,  chore: add engine field to limit pnpm version   update configs   use node 16 for cbx ci   switch to pnpm in csb   force install pnpm 7   Chore/add engine (#2004)   chore: update csb config   update   stick install version   rm node engine   Co-authored-by: Yixuan Xu yixuanxu94@outlook.com,1
build: do not abort on watch mode when ts erroring (#1992),0.86819196,build: do not abort on watch mode when ts erroring by @huozhi in https://github.com/vercel/swr/pull/1992,  build: do not abort on watch mode when ts erroring   bump ,1
Fix typo: getSWRCacahe -> getSWRCache (#2000),0.77072513,Fix typo: getSWRCacahe -> getSWRCache by @sdornan in https://github.com/vercel/swr/pull/2000,,1
fix: useSWRMutation - clear error after successful trigger (#1973) (#1995),0.82608926,fix: useSWRMutation - clear error after successful trigger (#1973) by @anirudh1713 in https://github.com/vercel/swr/pull/1995,,1
chore: save some bytes (#1991),0.61552316,chore: Save some bytes by @promer94 in https://github.com/vercel/swr/pull/1991,  chore: save some bytes   chroe: use mergeObject from core ,0
fix: should only update cache when actually start new request (#1986),0.7629514,fix: Should only update cache when actually start new request by @promer94 in https://github.com/vercel/swr/pull/1986,,1
chore: switch to pnpm and turborepo (#1983),0.71961594,chore: switch to pnpm and turborepo by @promer94 in https://github.com/vercel/swr/pull/1983,,1
refactor: remove useless ref copy (#1981),0.77313006,refactor: remove useless ref copy by @promer94 in https://github.com/vercel/swr/pull/1981,,1
fix: Should always reset to the original data after mutating with optimistic data (#1982),0.7953376,fix: Should always reset to the original data after mutating with optimistic data by @shuding in https://github.com/vercel/swr/pull/1982,  fix _o bug   fix race conditions ,1
chore: Add test cases for mutate (#1976),0.7316258,chore: Add test cases for mutate by @shuding in https://github.com/vercel/swr/pull/1976,add test cases,1
2.0.0-beta.3,0.6612084,After 2.0.0:,,0
Fix race conditions related to optimistic UI (#1970),0.78420615,Fix race conditions related to optimistic UI by @shuding in https://github.com/vercel/swr/pull/1970,  fix optimistic ui race conditions   fix test   fix ,1
fix: try fix codesanbox ci import error (#1971),0.8069141,fix: try fix codesanbox ci import error by @promer94 in https://github.com/vercel/swr/pull/1971,,1
chore: Faster type checking (#1969),0.77971315,chore: Faster type checking by @shuding in https://github.com/vercel/swr/pull/1969,,1
Bug fixes (#1968),0.79831666,Bug fixes: #165,  type fixes   remove unused code   cast Promise   remove ts-ignore ,1
build: import with-selector with extension from useESE (#1967),0.80056536,build: import with-selector with extension from useESE by @huozhi in https://github.com/vercel/swr/pull/1967,  build: import with-selector with extension from useESE   fix shim import ,1
fix: mutate args for useSWRInfinite hook (#1947),0.76938725,fix: mutate args for useSWRInfinite hook by @sanjeev29 in https://github.com/vercel/swr/pull/1947,  fix: mutate args for useSWRInfinite hook   Add swr infinite test for revalidation with arguments   Add swr infinite test for non-revalidation with arguments   Rename swr infinite mutate test case   Update type for infite mutate args   Include 'MutatorOptions' import   Co-authored-by: sanjeev40 sanjeev@worknetwork.in,1
types: fix type regressions (#1966),0.7791553,types: fix type regressions by @promer94 in https://github.com/vercel/swr/pull/1966,,1
2.0.0-beta.2,0.6639396,After 2.0.0:,,0
Improved React 18 support (#1962),0.9481417,Improved React 18 support,  update state in a transition   support snapshotting external state   wip   move types:check to pre-commit   refactor: switch to useSyncExternalStoreWithSelector (#1953)   type: extends useConfig cache interface (#1938)   remove mount check for react18 (#1927)   https://github.com/reactwg/react-18/discussions/82 related pr #787 #433   lint: dont check unused vars with underscore prefix (#1939)   test: upgrade to jest 28 (#1942)   Upgrade to jest 28   Upgrade to jest 28   feat: useSyncExternalStoreWithSelector   refactor: remove stateUpdate and boardcast   state update should be handled by uSESW   type: fix test type error   remove pnpm.lock   fix: import cjs for codesanbox   refactor: add selector   refactor: add cachestate interface and try fix custom cache   fix: custom cache init   refactor: remove useless flag   chore: codesanbox ci   refactor: remove force render in infinite   build: add _internal   chore: mark warning test   fix: dts generation   codesanbox ci   chore: rename swr folder to core   Co-authored-by: Jiachi Liu inbox@huozhi.im   chore: useSES should be external (#1960)   rename type   types: update cache types   chore: move @types/useSES to devDependencies   Co-authored-by: Shu Ding g@shud.in Co-authored-by: Jiachi Liu inbox@huozhi.im,1
Fix cache types (#1961),0.72106236,Fix cache types by @chibicode in https://github.com/vercel/swr/pull/1961,  Fix cache types   Guard against undefined originalData   Change useSwrConfig   populateCache: undefined for currentData ,1
test: upgrade to jest 28 (#1942),0.76192117,test: upgrade to jest 28 by @huozhi in https://github.com/vercel/swr/pull/1942,  Upgrade to jest 28   Upgrade to jest 28 ,1
lint: dont check unused vars with underscore prefix (#1939),0.8638259,lint: dont check unused vars with underscore prefix by @huozhi in https://github.com/vercel/swr/pull/1939,,1
remove mount check for react18 (#1927),0.91273487,remove mount check for react18 by @promer94 in https://github.com/vercel/swr/pull/1927,https://github.com/reactwg/react-18/discussions/82 related pr #787 #433,1
type: extends useConfig cache interface (#1938),0.8215252,type: Extends useConfig cache interface by @promer94 in https://github.com/vercel/swr/pull/1938,,1
breaking: Throw error when using suspense on the server side without fallback in React 18 (#1931),0.9680665,breaking: Throw error when using suspense on the server side without fallback in React 18 by @shuding in https://github.com/vercel/swr/pull/1931,,1
2.0.0-beta.1,0.67861915,After 2.0.0:,,0
breaking: drop legacy types (#1930),0.85234356,Drop legacy types: #1276,,1
Add keepPreviousData option (#1929),0.8852515,    keepPreviousData: true,  add laggy option   use keepPreviousData   add test cases   add new test ,1
replace isFallback with isLoading state; optimize code (#1928),0.66773456,New isLoading state (#1928),,0
build: output mutation cjs bundle with named exports (#1926),0.886989,build: output mutation cjs bundle with named exports by @huozhi in https://github.com/vercel/swr/pull/1926,,1
Add isFallback state (#1925),0.6185332,Add isFallback state by @shuding in https://github.com/vercel/swr/pull/1925,  add isFallback   remove -m   add test case ,0
2.0.0-beta.0,0.68244183,After 2.0.0:,,0
add missing .mjs build,0.696149,.mjs Support,,0
feat: Hook for remote mutations (#1450),0.7406675,feat: Hook for remote mutations by @shuding in https://github.com/vercel/swr/pull/1450,  (wip) initial impl.   fix test   (wip) fix deps   initial implementation   fix linter   fix state reset   avoid reset race condition   fix race conditions   code tweaks   code tweaks   return bound mutate   apply review comments   fix tsconfig   type fixes   fix lint errors   code tweaks   fix type error   update types   inline serialization result   merge main and update argument api   add tests   fix tests   update typing   update state api   change error condition ,1
type: fix type error on SWRConfig (#1913),0.96713793,type: fix type error on SWRConfig by @Himself65 in #1913,Refs: https://github.com/DefinitelyTyped/DefinitelyTyped/pull/56210,1
type: make type inference simpler (#1908),0.8004504,type: make type inference simpler by @promer94 in https://github.com/vercel/swr/pull/1908,,1
build(deps): bump minimist from 1.2.5 to 1.2.6 (#1903),0.7943884,build(deps): bump minimist from 1.2.5 to 1.2.6 by @dependabot in https://github.com/vercel/swr/pull/1903,Bumps minimist from 1.2.5 to 1.2.6. - Release notes - Commits  updated-dependencies: - dependency-name: minimist   dependency-type: indirect ... Signed-off-by: dependabot[bot] support@github.com Co-authored-by: dependabot[bot] 49699333+dependabot[bot]@users.noreply.github.com,1
Update React 18 dependencies (#1824),0.823926,Update React 18 dependencies by @shuding in https://github.com/vercel/swr/pull/1824,  update react@next deps   update react 18   Co-authored-by: Jiachi Liu inbox@huozhi.im,1
fix: wrong spell (#1902),0.7011485,Fix: typos: #1647,,1
Keep all fields with one single key (#1863),0.6744461,Keep all fields with one single key by @shuding in https://github.com/vercel/swr/pull/1863,  store all data fields using one single key   fix tests   fix bugs and tests   fix lint error   refactor code   get rid of $ and $   simplify serialize ,0
breaking: Change the fetcher argument to be consistent with the passed key (#1864),0.76638234,Fetcher no longer accepts multiple arguments (#1864),  change the fetcher argument to be consistent with the key   fix test cases   fix type checks ,1
test: fix an act warning (#1888),0.89966995,test: fix an act warning by @koba04 in #1888,,1
feat: support functional optimisticData (#1861),0.9598914,feat: support functional optimisticData by @huozhi in #1861,  feat: support functional optimisticData   Update src/types.ts   Co-authored-by: Shu Ding g@shud.in,1
bugfix: make suspense and revalidateIfStale work together (#1851),0.97566825,bugfix: make suspense and revalidateIfStale work together by @simowe in #1851,  bugfix: make suspense and revalidateIfStale work together   test: add test for revalidateIfStale used with suspense ,1
1.2.2,0.621399,After 2.0.0:,,0
feat: Support populateCache as a function (#1818),0.84452665,populateCache Option Now Supports Function,  allow populateCache as function   test: add a test for the behavior of revalidateOnMount when the key has been changed (#1847)   add tests   pass current data   update example and deps   remove next.lock   Co-authored-by: Toru Kobayashi koba0004@gmail.com,1
test: add a test for the behavior of revalidateOnMount when the key has been changed (#1847),0.81638247,test: add a test for the behavior of revalidateOnMount when the key has been changed by @koba04 in https://github.com/vercel/swr/pull/1847,,1
fix: reset stale unmountedRef in suspense (#1843),0.8058467,fix: reset stale unmountedRef in suspense by @promer94 in https://github.com/vercel/swr/pull/1843,,1
"refactor: revalidateIfStale has an effect on updates, not only mounting (#1837)",0.84993243,"refactor: revalidateIfStale has an effect on updates, not only mounting by @koba04 in https://github.com/vercel/swr/pull/1837",,1
1.2.1,0.614482,After 2.0.0:,,0
fix: useSWRInfinite revalidates with revalidateOnMount (#1830),0.8401549,fix: useSWRInfinite revalidates with revalidateOnMount by @koba04 in https://github.com/vercel/swr/pull/1830,,1
build(deps-dev): bump next from 12.0.8 to 12.0.9 (#1821),0.77138925,build(deps-dev): bump next from 12.0.8 to 12.0.9 by @dependabot in https://github.com/vercel/swr/pull/1821,,1
feat: shouldErrorRetry accepts a function (#1816),0.4335736,Fix: Support for functions that return false: #1586,,0
1.2.0,0.7061279,After 2.0.0:,,1
fix: use the latest reference of fetcher with suspense mode (#1803),0.8517097,fix: use the latest reference of fetcher with suspense mode by @koba04 in https://github.com/vercel/swr/pull/1803,,1
Add link to security email directly (#1795),0.7211132,chore: Add link to security email directly by @huozhi in https://github.com/vercel/swr/pull/1795,,1
chore: Move community health files to .github (#1794),0.8793242,chore: move community health files to .github dir by @huozhi in https://github.com/vercel/swr/pull/1794,,1
chore: Clean up configurations (#1792),0.7093383,Chore: Remove duplicate configs: #1507,  clean up config files   match minor and patch releases for dev deps ,1
test: use @swc/jest (#1790),0.8226783,test: use @swc/jest by @huozhi in https://github.com/vercel/swr/pull/1790,,1
test: remove flaky focus test case (#1793),0.71818304,test: remove flaky focus test case by @huozhi in https://github.com/vercel/swr/pull/1793,,1
chore: Update company name (#1791),0.45989496,Chore: rename major branch to main: #1664,,0
chore: Update examples and dependencies (#1789),0.8547195,Chore(examples): update all examples to use v1: #1385,  upgrade @swc-node/jest   update examples ,1
Improve watch commands (#1788),0.60825056,chore: build: improve watch commands by @huozhi in https://github.com/vercel/swr/pull/1788,,0
simplify example development (#1787),0.55855787,Chore: Code refactoring: #1482,  simplify example development   move setup to test folder ,0
1.2.0-beta.1,0.59885776,After 2.0.0:,,0
polish: display name in devtool (#1779),0.88440704,polish: display name in devtool by @huozhi in https://github.com/vercel/swr/pull/1779,  polish: display name in devtool   revert withArgs export ,1
type: Required return type when mutating (#1772),0.78358257,Required return type when mutating by @RKatarine in https://github.com/vercel/swr/pull/1772,Co-authored-by: ekaterinarazanova ekaterina.ryazanova@sbermarket.ru,1
test: add delay for flaky focus test (#1762),0.78866553,test: add delay for flaky focus test by @huozhi in https://github.com/vercel/swr/pull/1762,,1
chore: remove useless react-native field (#1761),0.93201137,chore: remove useless react-native field by @huozhi in https://github.com/vercel/swr/pull/1761,,1
build: support mjs exports (#1760),0.787619,build: support mjs exports by @huozhi in https://github.com/vercel/swr/pull/1760,,1
doc: comment helper (#1757),0.68091464,doc: comment helper by @huozhi in https://github.com/vercel/swr/pull/1757,,0
1.2.0-beta.0,0.6198898,After 2.0.0:,,0
merge extra request states in cache (#1752),0.8094474,Merge extra request states in cache by @shuding in https://github.com/vercel/swr/pull/1752,,1
rename CONCURRENT_REQUESTS to FETCH (#1749),0.72465694,chore: Rename CONCURRENT_REQUESTS to FETCH by @shuding in https://github.com/vercel/swr/pull/1749,,1
merge mutation states (#1748),0.723505,chore: Merge mutation states by @shuding in https://github.com/vercel/swr/pull/1748,,1
feat: Optimistic mutation with error rollback (#1745),0.84013057,feat: Optimistic mutation with error rollback by @shuding in https://github.com/vercel/swr/pull/1745,  add optimisticData and rollbackOnError   add test cases   add test for rollback ,1
chore: Ignore coverage report (#1744),0.7590529,chore: Ignore coverage report by @shuding in https://github.com/vercel/swr/pull/1744,  remove coverage report   ignore coverage ,1
1.1.2,0.6058136,After 2.0.0:,,0
Skip error retrying when document is not active and improve tests (#1742),0.83858484,Skip error retrying when document is not active and improve tests by @shuding in https://github.com/vercel/swr/pull/1742,  use the babel coverage reporter   improve coverage ,1
merge concurrent request states (#1741),0.76580906,Merge states for concurrent requests by @shuding in https://github.com/vercel/swr/pull/1741,,1
Fix local state sharing example deps (#1737),0.7905215,Fix local state sharing example deps by @huozhi in https://github.com/vercel/swr/pull/1737,,1
feat: Add populateCache option to mutate (#1729),0.8472032,feat: Add populateCache option to mutate by @shuding in https://github.com/vercel/swr/pull/1729,  add populateCache option to mutate   rename type and export it ,1
re-export InfiniteFetcher (#1728),0.67972475,- import { InfiniteFetcher } from 'swr/infinite',,0
1.1.2-beta.1,0.57226336,After 2.0.0:,,0
resolves #1131 (#1727),0.5552045,Fix #832: #833,,0
Improve test (#1725),0.63798624,Fix typo in test: #1393,  test: improve test coverage   ci ,0
add moduleNameMapper (#1724),0.58419514,Add moduleNameMapper to jest by @shuding in https://github.com/vercel/swr/pull/1724,,0
fix #1680 (#1720),0.72814065,Fix #832: #833,,1
type(infinite): export SWRInfinteHook and InfiniteKeyLoader from infinite (#1714),0.90379393,type(infinite): export SWRInfinteHook and InfiniteKeyLoader from infinite by @houkanshan in https://github.com/vercel/swr/pull/1714,  type: export SWRInfinteHook and InfiniteKeyLoader from infinite   rename InfiniteKeyLoader and InfiniteFetcher ,1
1.1.2-beta.0,0.5790702,After 2.0.0:,,0
Make polyfill for requestAnimationFrame more robust (#1707),0.9278027,Make polyfill for requestAnimationFrame more robust by @thomaspaulmann in https://github.com/vercel/swr/pull/1707,  Add check for requestAnimationFrame availability   Fix comparison   Bring back missing import of hasWindow ,1
1.1.1,0.40385652,// SWR 1.x,,0
fix: Return undefined data if key's falsy under suspense mode (#1698),0.8168797,fix: Return undefined data if key's falsy under suspense mode by @icyJoseph in https://github.com/vercel/swr/pull/1698,,1
"fix: If newData is deeply to the latest state, broadcast the latest state (#1697)",0.8056115,"fix: If newData is deeply to the latest state, broadcast the latest state by @icyJoseph in https://github.com/vercel/swr/pull/1697",,1
test: add refreshInterval function returns 0 (#1691),0.7106735,test: add refreshInterval function returns 0 by @Andrewnt219 in https://github.com/vercel/swr/pull/1691,,1
feat: refreshInterval as a function (#1690),0.78798306,feat: refreshInterval as a function by @Andrewnt219 in https://github.com/vercel/swr/pull/1690, allow passing a function that returns a new interval   for refreshInterval add tests for refreshInterval as a function,1
1.1.0,0.61352587,After 2.0.0:,,0
chore: Add test case for getKey in useSWRInfinite (#1681),0.8263025,chore: Add test case for getKey in useSWRInfinite by @shuding in https://github.com/vercel/swr/pull/1681,,1
types: remove duplicated typing def (#1675),0.739037,types: remove duplicated typing def by @huozhi in https://github.com/vercel/swr/pull/1675,  types: remove duplicated typing def   add null   remove the last overloading ,1
remove: unnecessary async (#1676),0.573892,Remove unneeded await statement on fetch lib: #187,,0
chore: upgrade eslint to v8 and prettier to v2 (#1674),0.8459931,chore: upgrade eslint to v8 and prettier to v2 by @huozhi in https://github.com/vercel/swr/pull/1674,  chore: upgrade prettier to v2   update eslint to v8 ,1
example: update typescript examples with strict ts mode (#1673),0.8613542,example: update typescript examples with strict ts mode by @huozhi in https://github.com/vercel/swr/pull/1673,,1
1.1.0-beta.12,0.54704845,After 2.0.0:,,0
fix: Add defaults for SWRResponse (#1609),0.98448527,Fix: Add defaults for SWRResponse: #1609,Co-authored-by: Shu Ding g@shud.in,1
fix keyloader index and previousPageData type (#1669),0.9929905,Fix keyloader index and previousPageData type: #1669,,1
