2786,Merge pull request #2397 from pixijs/color-matrix-filter-fix,0.67920977,Moves PIXI.filters.BlurYFilter to PIXI.filters.BlurFilterPass #4702 ,"Update Contributing Guide with new branch flow. Added more details, links to GitHub docs about forking, and the new branching flow. As a bonus, also changed some minor things in the editorconfig. Fix typo. a couple more minor details",0
2787,webGL 2 where possible..,0.7961602,New webGL renderer,"Adding private jsdoc tag Added jsdoc @private tag to relevant functions moved private variables to above the setter, but out of the way of getting jsdocced",1
2788,Lots of core renderer-related updates,0.6249968,Adds RenderTexturePool to core (#5771),,0
2789,v5.2.1,0.70741695,"Small fixes and tweaks for v5 (#5329, #5343)",,1
2790,v2.2.9,0.7336714,v2 Maintenance Release,,1
2791,Fix DisplayObject.destroy should call listener removed (#6210),0.9999999,Fix DisplayObject.destroy should call listener removed (#6210),,1
2792,Merge pull request #2428 from digibo/dev-v4.0.0,0.57362646,"Cleanup devDependencies, don't require package order (#7664) @bigtimebuddy ",,0
2793,Chore: Cleanup useContextAlpha deprecation (#8866),0.91264004,Chore: Cleanup useContextAlpha deprecation (#8866) @bigtimebuddy ,webpack temp fix use minified version,1
2794,Check for webserved files by looking at the protocol,0.5509287,webp image support.,,0
2795,Merge pull request #40 from englercj/event-aliases,0.56838953,Fix federated events API with TypeScript (#8085) @caasi ,Conflicts: src/accessibility/AccessibilityManager.js src/core/text/Text.js,0
2796,Made it so that you can change which dom element receives mouse/touch events,0.7024354,- Added 'moveWhenInside option to interactive manager. his property determins if mousemove and touchmove events are fired only when the cursror is over the object. Setting to true will make things work more in line with how the DOM verison works.,Fixes for PIXI + Cocoon,1
2797,Add parsers to loader; remove unused import,0.61048985,Cleans up BasePrepare importing settings like other packages (#5364),"some more es6 changes const instead of let if possible arrow functions string templates argument defaults object property shorthand some more es6 changes const instead of let if possible arrow functions string templates argument defaults Revert ""Merge branch 'dev-es6-sb' of github.com:stbaer/pixi.js into dev-es6-sb"" This reverts commit 8d3af819529c9899df0302c254d730dd3ebfdef6, reversing changes made to e8b994803c9faabe104c177cbf72c68404fef53c. Revert ""Merge branch 'dev-es6' into dev-es6-sb"" This reverts commit 3eeaf79220a65a3fde644f30d21dab4b288bce33, reversing changes made to fb695360b0b54a7024d079b305ebb351833c6914. Revert ""Revert ""Merge branch 'dev-es6-sb' of github.com:stbaer/pixi.js into dev-es6-sb"""" This reverts commit c860228b67cd3a99e35ba37654667d652bcede94. fix RenderTexture, incomplete merge fix for text font properties reverted some changes checked out License, Readme and Contributinf from dev-es6 editorconfig updated: 2 spaces for .eslintrc added eslint rule: spaces around fat arrow used eslint fix for consistent spaces around fat arrow don't allow scale.x or scale.y to be 0 in displayObject setTransform removed jshint comments (again)",0
2798,For some reason I forgot to fix the remaining this.style references half way through. Oops,0.54288745,Adds missing to clone prop for alignment (#5305),,0
2799,removed emptyTexture object,0.61515117,Renamed Texture.removeTextureFromCache to Texture.removeFromCache #3834,,0
2800,fix that allows render targets to be passed to samplers,0.5645253,Move settings.TARGET_FPMS to Ticker.targetFPMS ,,0
2801,"fix #1309, export built non-minified",0.760767,- Fix some missing exports (#1790),Conflicts: src/core/Shader.js src/core/graphics/Graphics.js src/core/math/shapes/Rectangle.js src/core/renderers/webgl/managers/FilterManager.js src/core/sprites/webgl/generateMultiTextureShader.js,1
2802,Adds textureScale constructor parameter to SimpleRope/RopeGeometry (#5547),0.9999998,Adds textureScale constructor parameter to SimpleRope/RopeGeometry (#5547),removed old jshint comments; replaced jshint in CONTRIBUTING.md with â€¦,1
2803,Chore: improve documentation linting (#8342),0.8791796,Chore: improve documentation linting (#8342) @Zyie ,,1
2804,Fast rect blendMode problem (#3707),0.7380165,Fix BlendMode in BatchRenderer (#6236),fixed filter issue,1
2805,"Reformat documentation for RenderTexture, RenderTextureSystem, RenderTexturePool (#7882)",0.85955024,Update RenderTexture constructor documentation (#5729),,1
2806,Fix the fault after merge (#3766),0.68560517,Fix #1594,Derp merge master-dev,0
2807,Merge pull request #358 from mattdesl/detector-fix,0.6383507,"Fix detector code (#358, @mattdesl)","Multiple renerers for Graphics fastRect, solution that will work for sure",0
2808,shine new builds,0.5715012,New features,,0
2809,"Docs fixes, almost got rid of the globals",0.6986865,- Fix some docs,,0
2810,"Removes PIXI.loaders namespace, adds consistent loader plugin structure (v5) (#4471)",0.7933317,Removes PIXI.loaders.Loader.addPixiMiddleware #4471 ,Small updates to fix some es6 conversion issues,1
2811,removed unessential filters,0.7508212,Fix issue with removing children with filters,Removed some require references that were preventing mixins like interaction from working. Fixed Text,1
2812,build publish,0.6740035,Development Build:,,0
2813,updated compiled builds,0.6313578,Updated,,0
2814,isWebGLSupported util function is now cached (#5604),1.0000001,isWebGLSupported util function is now cached (#5604),,1
2815,"Add main property to package.json, closes #244",0.7160426,package.json,,1
2816,Fixed setTexture bug with TilingSprite and Fixed SpriteBatch canvas transform bug,0.78917015,Fix canvas rendering transform of TilingSprite (#6869),,1
2817,remove a todo,0.78048074,Removed,,1
2818,Documentation reformatting for accessibility (#7113),0.74757504,"Reformat documentation to better support documentation in types (#7942, #7876, #7965, #7966, #7963, #7992, #8009, #8010, #7993) @ShukantPal @Reza9472 ",Migration to ES6 classes Migration to ES6 classes Migration to ES6 classes Migration to ES6 classes Using babelify to transpile ES6 code Adding babel-preset-es2015 in devDependencies,1
2819,More typing fixes (#5790),0.8834734,"Typings fixes (#5450, #5452)","Do not create touch hooks for accessibility - this stops cocoon from working Do not use gradient text, just use the first colour listed in the array - cocoon displays text with gradients as black otherwise",1
2820,Merge pull request #452 from lachenmayer/ellipse,0.5196347,Fix missing removeEventListener in ResizePlugin (#7271) @epaezrubio ,,0
2821,Replace use of self with globalThis (and polyfill) (#8050),0.91556996,Replace use of self with globalThis (and polyfill) (#8050) @JoshuaPelealu ,,1
2822,Converted to grunt build,0.52640915,Production Build:,,0
2823,Fix Graphics color/textureId filling (#7529),0.90923995,Fix Graphics color/textureId filling (#7529) @eXponenta ðŸ”¥  Major Bug,,1
2824,republish,0.5295262,Massive refactoring/rewritting of the entire library.,,0
2825,return old resolution code for canvas,0.73557895,Restructured the canvas renderer,Conflicts: README.md,1
2826,Improve deprecations for core (#7182),0.6830751,"Fix deprecation on BaseTexture in NineSlicePlane (#6205, #6206)",,0
2827,update minimum resource-loader version,0.8367996,- Updated to resource loader v1.6.4,,1
2828,Tweaked base Texture,0.6671769,Adds BaseTexture.from() consistent with Texture.from #3736,,0
2829,added alpha to emboss,0.57126504,Add ALPHA_MODES instead of not-obvious premultiplyAlpha value (#6100),,0
2830,Fix el(l)ipse spelling error,0.57805157,Pedantic spelling fixes (#4797),,0
2831,Fix missing publishConfig for webworker,0.64585567,Fix an issue with npm publish,,0
2832,More WebGL docs,0.7739625,New webGL renderer,,1
2833,cleanup canvas renderers,0.81730044,Restructured the canvas renderer,,1
2834,Added some new Matrix functions..,0.851051,Lots of new functions added to the matrix class,,1
2835,stopPropagation function added to event data,0.63374746,Fix InteractionManager's stopPropagation (#6043),,0
2836,properly initialize projectionMatrix; fixes #1811,0.8582042,- Properly initialize projectionMatrix in TextureShader (#1811),,1
2837,extras cleanup,0.73531544,Chore: Cleanup documentation (#9162) @SuperSodaSea ,,1
2838,Add GlobalMixin types for Application plugins (#7145),0.71738386,Fix GlobalMixins with TypeScript 4.7+ (#8800) @bigtimebuddy ,,1
2839,Add stricter types for resource options and resource plugins (#6373),0.664672,"Add Generics to Texture, BaseTexture for Resource types (#7246)",,0
2840,Fix simple tiling sprite syntax issue (#7917),0.91873074,Fix simple tiling sprite syntax issue (#7917) @animanathome,if theres nothing left - assume the source is a texture,1
2841,cointainsPoint test,0.5505554,Adds MockPointer test code #3475 ,,0
2842,Use ObservablePoint instead of comparing the anchor every frame,0.5798086,Adds option to update anchor with defaultAnchor when frame changes. (#5419),,0
2843,Giant tilingSprite refactoring.,0.69977343,Fix canvas rendering transform of TilingSprite (#6869),Add docs to branch Adds multiple bin and docs Bump jaguarjs,0
2844,Fixed Graphics getBounds,0.7794463,Fix Graphics' getLocalBounds after generateCanvasTexture #3398 ,,1
2845,tiny bump to pixi-gl-core,0.6564042,PIXI.settings.GC_MAX_IDLE,,0
2846,Move items into their namespace,0.9370438,Move items back into their namespaces,,1
2847,production test fixes,0.64123785,Adds unit tests for both of these fixes. #3857,,0
2848,Squashed commit of the following (unittest-refactor):,0.5654888,Group unit-tests together by package (#7595) @bigtimebuddy ,Update README.md fastrect sprite tint+color,0
2849,Document caching behavior of BaseTexture.from (#4390),0.71121156,Texture states caching #3201,,1
2850,new approach to fix,0.7103542,Many bug fixes,,1
2851,Merge pull request #84 from Jephery/master,0.48135394,Add crossOrigin with credentials support for XHR requests (#7948) @sergaks ,Text width was being incorrectly reported when padding is used,0
2852,Fix wheel events not getting a nativeEvent (#7350),0.69320595,Fix wrong DOM_DELTA_* from WheelEvent API (#9130) @jramstedt ,also added a unit test,0
2853,"Deprecate batch settings, move to BatchRenderer (#8877)",0.76348567,BatchRenderer refactoring to increase performance (#6162),Fixes a typo and the link for CDN Fixes link,1
2854,Fix error with assets import path,0.6247772,- Fix some missing exports (#1790),,0
2855,Merge pull request #995 from agamemnus/patch-4,0.4976142,"Fix issue with query params on asset loader (#400, @hugeen)",Added 1 extra check in the procesInteractive to check if children exists before attempting to call children.length this would've thrown an error if you remove stuff in an onMouseClick for example. smaller diff maybe changed remark Better and faster fix set interactive and interactiveChildren to false on the DisplayObject.destroy() this way no extra check is needed in the processInteractive function.,0
2856,Merge pull request #3192 from staff0rd/test_coverage,0.5224067,Add crossOrigin with credentials support for XHR requests (#7948) @sergaks ,,0
2857,Fix BaseTexture member types (#9385),0.7775191,Updates old examples for BaseRenderTexture (#5262),,1
2858,simplified masking further,0.727278,New example added to showcase masking.,Conflicts: README.md bin/pixi.js bin/pixi.js.map bin/pixi.min.js bin/pixi.min.js.map package.json src/accessibility/AccessibilityManager.js src/core/display/Container.js src/core/renderers/webgl/WebGLRenderer.js src/core/text/Text.js src/extras/TilingSprite.js src/interaction/InteractionManager.js src/loaders/spritesheetParser.js,1
2859,fixed interaction manager bug,0.90178275,- Fix some issues with interaction manager.,,1
2860,Merge pull request #2678 from gameofbombs/dev2,0.53776824,Fix: Prevent BlobResource.load from loading the data multiple times (#9331) @dev7355608 ,Fixes #2840 Default destroy options for text are now all true. tweak the tests passing unit tests.. simpler code thanks @bigtimebuddy !,0
2861,"Revert ""Switched TextStyle to version based instead of an EventEmitter. Changed""",0.66894734,DisplayObject.updateTransform function rewritten with for better performance,,0
2862,implement smart blur and displacement filters; fix some doc issues,0.79031074,- Fix some small issues with the blur filter.,fixes #2841,1
2863,remove some changes from texture,0.77038544,Removed Texture and BaseTexture's textureCacheId and changed to textureCacheIds #3834,,1
2864,Fix destroy method test of WebGLRenderer,0.7986776,- Fix an issue with WebGL destroy(),,1
2865,Merge pull request #973 from krzysztof-o/bitmap_text_kerning_fix,0.6380534,"Fix crash with ""kernings"" field in BitmapFont txt-based format (#6841)",,0
2866,Merge pull request #1050 from photonstorm/dev,0.4997203,"Fix IE11 check (#442, @photonstorm)",,0
2867,"Docs, spine and tiling sprite fixes, another deprecation warning",0.7474221,Fix docs for Sprite and TilingSprite (#6314),,1
2868,move object renderers to a webgl folder of feature,0.601579,New webGL renderer,,0
2869,Merge pull request #1558 from FlorianLudwig/patch-1,0.5149001,Fix documentation of Rectangle.intersection and Rectangle.union (#8240) @dev7355608 ,"Travis CDN deployment Try simple upload Test again all branches Add option for latest for branch Changed bucket names Specify region Fixed release bucket Remove the commits for now, only tags and branches all_branches also does tags Don't ignore bin",0
2870,Remove interaction and accessibility namespaces (#6681),0.9861511,"Remove interaction and accessibility namespaces (#6681, #6703)",,1
2871,Merge pull request #2646 from pixijs/dev-filter-fix-up,0.6572394,Moves PIXI.filters.BlurYFilter to PIXI.filters.BlurFilterPass #4702 ,,0
2872,fix #1384,0.92039555,Fix #1594,some stuff in renderer unused variable,1
2873,Adds support for multiple font families,0.81542826,"Allows support for multiple fonts in the TextStyle#fontFamily property. Either expressed as a comma separated string, or an Array of font names. #3513 ","blendMode can be 2, so we have to set 32 to avoid problems",1
2874,Fix documentation and typings for lineStyle (#7146),0.82798517,TextStyle.lineJoin documentation improvement #4412 ,InteractionManager event documentation line lenth fix,1
2875,Consolidated shader compilers,0.6938667,Shader compiling optimization (#7268) @GoodBoyDigital ,,0
2876,"fix #1745, convert number colors to style strings",0.99500877,"- Fix #1745, convert number colors to style strings",,1
2877,Support text alignment 'justify' in BitmapText (#6968),1.0000002,Support text alignment 'justify' in BitmapText (#6968),,1
2878,Merge pull request #1645 from FletcherD/dev,0.5030646,Fix unbind issue when using different targets (#6914),sprite bounds tweaks added a trimmed sprite test tweaks to tint wrong place i know..,0
2879,add missing default exports.,0.7793177,- Fix some missing exports (#1790),,1
2880,Rebuild pixi.js files,0.66769063,Moves PIXI.loaders.getResourcePath to PIXI.SpritesheetLoader.getResourcePath,,0
2881,Fix documentation (#5944),0.87874734,"Fix documentation and typings (#5944, #5950, #5963, #5971, #5986)",should fix weird blur filter effect when near edges of the renderer,1
2882,sprite bounds issue,0.69970304,Fix Sprite.getLocalBounds corrupting bounds (#8087) @dev7355608 ,Destroying a DisplayObject will remove itself Container removes children before destroying Fixed destroy order Removes extra whitespace Updates with Ivan's suggestion for Container destroy Removes listeners when destroying More verbose destroy comments Typo,0
2883,Merge pull request #1419 from serprex/webgl-enabled-103,0.5912787,"Fix issue where urls have http in the resource (#443, @sirflo)",,0
2884,Filter tweaks,0.7872044,Move settings.FILTER_RESOLUTION to Filter.defaultResolution ,,1
2885,Convert canvas-extract to TypeScript (#6503),0.6386322,Removed extract property from CanvasRenderer (#6503),,0
2886,Fix destroy method of WebGLRenderer.js,0.82477367,- Fix an issue with WebGL destroy(),,1
2887,Fix types (#6076),0.75233793,Fix #1594,,1
2888,transform,0.62963825,ðŸ”¥ Reverted,,0
2889,changed PIXI.blendModesCanvas to PIXI.blendModesWebGL in webGL renderer,0.7905799,PIXI.Graphics blendMode property now works in webGL.,,1
2890,v7.0.0-beta,0.66655076,v2 Maintenance Release,,0
2891,Small docs fix for #855,0.7525903,- Fix some docs,"fastRect problem, again remove async dependency",1
2892,implement bitmap font loader,0.7943699,Support Text-based format for BitmapText example (#6347),,1
2893,Fixes linting errors,0.56586283,Fix some SpriteBatch issues,,0
2894,"sprite fix, again, compatible with v3",0.743791,Fix some SpriteBatch issues,,1
2895,Fixes video type wrongly incorrectly with query string (#5077),0.7278536,Fix missing event parameter from VideoResource (#6750),,1
2896,Added interactiveChildren property,0.6514804,addChild / addChildAt functions now return the child.,,0
2897,fixed copy issue in Rectangle,0.62991405,Fix documentation of Rectangle.intersection and Rectangle.union (#8240) @dev7355608 ,text now matchs renderers resolution much cleaner! tweaked textStyle to no longer use events its a little lighter! padding now applied to width as well as height,0
2898,fix gulp watch,0.5531751,Fix filter clamping #3030 ,added enabled to filters lint that code!,0
2899,Add ability to override loadParser when loading assets (#9226),0.9065504,* Add ability to override loadParser when loading assets (#9226) @GoodBoyDigitalts,,1
2900,Fixing the Graphics class,0.8029301,Fix broken batch rendering of Graphics by custom Graphics plugin (#6061),,1
2901,Right button docs,0.81058615,Right-left buttons differentiation,,1
2902,Fix to clear temporary texture in BlurFilter (#6270),1.0000001,Fix to clear temporary texture in BlurFilter (#6270),,1
2903,make default bg color black,0.7023077,Fix handling of black colors (#288),,1
2904,-[SPINE] Empty slots are handled properly.,0.5246515,Fix fillGradientStops descending ordered (#7081),,0
2905,First batch of examples cleaned up,0.7077392,Examples have received a bit of a tidy,fixed issue where sprite getLocalBounds did not return correct bounds if it had children.,1
2906,Merge pull request #1496 from woutercommandeur/fs-cleanup,0.59226096,Cleanup WebGLState #2826 ,,0
2907,Merge pull request #3363 from ggarek/fix/3433-graphics-arc,0.6592609,Fix prepare plugin with Graphics (#6193),,0
2908,update some meta files,0.6308299,Updated,Updates tests to use Floss/Electron Adds testing after building Don't run test twice,0
2909,Added ticker class to utils,0.6736802,"Adds priority to Ticker handlers, adds the following APIs #3859 #3904",Multiple sites using pixi have been throwing the following error: Uncaught TypeError: Cannot read property 'data' of undefined. Additional context - I use a few extensions to prevent canvas fingerprinting and they seem to be the cause of my error.,0
2910,Reformat documentation for ProjectionSystem (#7884),0.69974494,"Use only sourceFrame to calculate projectionMatrix (#6683, #6739, #6754)",2679 changed segments to vertices in param and variable names. 2679 better names,0
2911,Fix TilingSprite shader on some mobile devices (#6946),1.0,Fix TilingSprite shader on some mobile devices (#6946),,1
2912,godray,0.45588148,@hellraisercenobit,,0
2913,Merge pull request #74 from englercj/movie-loop,0.4968778,Add a callback for when MovieClip changes frames #2948,deprecation layer is only include in debug build Removes the debug content,0
2914,Fix compressed texture docs (#6911),0.7693069,Fix internal format constants for compressed textures (#7338) @bigtimebuddy ,,1
2915,Merge pull request #1640 from bronzehedwick/patch-2,0.49239913,Critical fix for forceStencil with WebGL1 (#6115),added unit test to check too,0
2916,Fix bug in FramebufferSystem.forceStencil (#7623),0.9800293,Fix bug in FramebufferSystem.forceStencil (#7623) @dev7355608 ,,1
2917,Merge pull request #1526 from woutercommandeur/dev,0.5297409,Removes accessibility manager hook div from DOM on destruction (#5348),,0
2918,rename primitives folder to graphics,0.5941485,moved shapes to geom folder,,0
2919,remove SpriteBatch doc change,0.6677528,Removes default loadType from the spritesheetParser load options #4573 #4590,,0
2920,moved mouse move event to the document,0.6363596,Fix bug touch move event handling.,also allowed for resolution of texture to be specified when retrieving from the filter texture cache,0
2921,republished pixi files,0.7077911,PIXI.UPDATE_PRIORITY,,1
2922,Change DisplayObject#hitArea type declaration to support more hit-area classes (#5827),1.0,Change DisplayObject#hitArea type declaration to support more hit-area classes (#5827),same for mesh,1
2923,Fix: Always await loading of resource in loadSVG (#9317),0.9717486,Fix: Always await loading of resource in loadSVG (#9317) @dev7355608 ,"Convert to NPM scripts, removes Gulp Requires node bump for jshint-stylish-summary Missing mkdirp Fixes bundling sourcemap problem Fixes linting Bumps Travis to supported NodeJS version Typo Fixes build script for Windows Fixes watch on Windows Removes unused dependency Remove unused dep",1
2924,Fix the name of the util function (#6019),0.64437044,Deprecation util function (#5126),,0
2925,fix sprite docs a bit,0.8204198,Fix some SpriteBatch issues,"Revert ""Adds .npmignore file""",1
2926,Removed merge conflict tags from Detector,0.5525862,Removed this.local in InteractionData.,,0
2927,jslinted code,0.71810144,```js,,1
2928,Fixed webGL texture update bug,0.8206703,Fix WebGL transparent canvas issues,Got an issue of the alpha value of NineSlicePlane. Adding  worldAlpha value to context if rendered via CanvasRenderer.,1
2929,Read texture via _texture directly in sprite (#3780),0.9781707,Read texture directly via _texture in Sprite #3780 ,,1
2930,requiresUpdate is no longer used,0.64218825,Updates dependencies (#5600),,0
2931,Add currentFrame mutable in AnimatedSprite (#8639),0.91897774,Add currentFrame mutable in AnimatedSprite (#8639) @YunYouJun ,,1
2932,fix issue with worldVisible on Stage,0.5884082,Fix issue where Application.destroy ignored stageOptions (#5999),,0
2933,Fixed filter area clone bug,0.7845682,Fix legacy filters that use filterArea/filterClamp failing the first time they are used (#8033) @dev7355608 ,"Currently when applying a mask to a -x2 Sprite, the Sprite resolution is lowered to that of the mask.",1
2934,Merge pull request #811 from MortimerGoro/dev,0.50761294,Removes accessibility manager hook div from DOM on destruction (#5348),,0
2935,Support BitmapText resolution on high-density displays (#6564),1.0,Support BitmapText resolution on high-density displays (#6564),,1
2936,fixup some docs in deprecation,0.79153275,- Fix some docs,,1
2937,renamed static transform,0.78027236,static transforms - objects only updated if changed,,1
2938,fixed po2 issue,0.5987402,Fix #1594,,0
2939,Transfer the shiftKey property for federated events (#8674),0.9493956,Transfer the shiftKey property for federated events (#8674) @bhousel ,,1
2940,first pass at using VAOs,0.5163567,Rebind vao before glData upload. #3455,,0
2941,"Remove internal filter aliases on PIXI.filters, expose on PIXI instead as PIXI.AbstractFilter",0.768039,Moves PIXI.filters.BlurXFilter to PIXI.filters.BlurFilterPass #4702 ,"link link If IE or Edge shows up the message ""WEBGL11258: Temporarily switching to software rendering to display webGL content"", WebGL detection should fail because the software rendering is slow as hell.",1
2942,merge #1018; replace tabs with 4 spaces in examples,0.5328405,Fix geometry merging when geometries are of different sizes (#7493) @SukantPal ,"fix for lineHeight, canvas is actually too small if the line height is smaller than the font size.",0
2943,Added Resolution property to items,0.63566434,Adds resolution property in BitmapText (#8357) @Aysen69 ,,0
2944,Chore: Cleanup document for renderer options (#9120),0.81651926,Chore: Cleanup document for renderer options (#9120) @SuperSodaSea ,fixed issue with masks and filters + cacheAsBitmap interaction also refactored a little to have use a CacheData that means we lower the memory footprint of displayObjects a little.,1
2945,Disable additional breaking Ticker test,0.65367603,stopPropagation flag now gets cleared on each tick automatically #2929,,0
2946,Fixed docs,0.8843877,- Fix some docs,,1
2947,"when you manually bind a texture, please switch renderer active texture location to it",0.63953686,Moved resolution check to when a texture is created (#5480),,0
2948,Merge pull request #2964 from pixijs/master,0.6017567,Moves PIXI.loaders.Resource to PIXI.LoaderResource #4471 ,,0
2949,ParticleContainer wrong buffer index (#4864),1.0,ParticleContainer wrong buffer index (#4864),,1
2950,merge upstream/dev,0.44945768,"Cleanup devDependencies, don't require package order (#7664) @bigtimebuddy ","Add NineSlicePlane.js to enable 9Slice scaling,  without the bin folder this time. added canvas rendering for NineSlicePlane",0
2951,Merge pull request #2407 from ivanpopelyshev/dev-v4.0.0,0.4938402,Fix SVGResource test for data-URIs (#8655) @ivanpopelyshev,"Precision errors can be very strange on some devices. Especially if you are rendering 3d transform. This is part of gameofbombs/pixi.js fork, I didnt think that it will be needed in 2D scenes too. looks better",0
2952,Updating package.json descriptions (#5362),1.0,Updating package.json descriptions (#5362),simple transform refactoring TransformManual deprecation,1
2953,added inline play,0.52138305,- Added setStageRefferance function added to DisplayObject,,0
