1739,Fix incorrect typing of OnLoadSignal (#7894),0.9153044,Fix incorrect typing of OnLoadSignal (#7894) @fluffy-heinzelman ,,1
1740,Fixed canvas graphics tinting.,0.85997933,Fix issue with tinting in canvas,,1
1741,centralise isWebGLSupported (#3740),0.83730316,Centralize isWebGLSupported in unit-tests #3740,,1
1742,removed some white spaces,0.6867408,Removed the trailing whitespace when wordwrapping a PIXI.Text.,"Updates internal dependencies Updates dependencies, removes bit-twiddle, removes circular import Removes render tests app Oops, copypasta Fixes Graphics tests Removes unused test, caches isWebGLSupported Revert changes to isWebGLSupported Use environment variable to disable WebGL tests Fixes env line Missed one!",0
1743,Add wordbreak option,0.6409143,Add TextMetrics.wordWrapSplit customization of splitting method (#6251),,0
1744,Merge pull request #2562 from ivanpopelyshev/dev,0.48758543,Fix SVGResource test for data-URIs (#8655) @ivanpopelyshev,,0
1745,Merge pull request #2474 from themoonrat/ticket-negative-deltaTime,0.50224876,"Federated Events API, alternative package to interaction (#7213, #7350, #7381, #7376, #7616, #7652) @SukantPal @bigtimebuddy @miltoncandelero ",,0
1746,Merge pull request #1768 from gprzybylowicz/rope_supports_spritesheets,0.6193973,"- Add support for spritesheets in Rope (#1768, thanks @gprzybylowicz)",,0
1747,remove debug,0.6671995,Remove v6 deprecations (#8415) @bigtimebuddy ,,0
1748,browserify display objects,0.6104144,CacheAsBitmap added to displayObjects,,0
1749,Tweaked tiling texture and jshinted code,0.6574428,Fix kerning rendering with letterSpacing (#6090),,0
1750,Merge pull request #1063 from SebastianNette/patch-4,0.5496774,Fix node WebGLRenderingContext (#8643) @michaeljherrmann,,0
1751,Allow for easier overriding of Text resolution (#8912),0.81983566,Allow for easier overriding of Text resolution (#8912) @Zyie ,,1
1752,v6.0.3,0.67292076,v3 Release Candidate 1 (developer preview),,0
1753,Upgrade to webdoc 1.5.5 (#7829),0.8790378,"Chore: Upgrade webdoc to 1.5.5 (#7791, 7829) @ShukantPal",,1
1754,Merge pull request #2417 from frankbaele/patch-1,0.5130766,Fix unbind issue when using different targets (#6914),,0
1755,remove movie clip update using context; fixes #1693,0.6656974,Updates MovieClip frame immediately with gotoAndPlay #3203,,0
1756,add bunny mark benchmark baseliner,0.5299587,Add unit tests for Application.ticker setter (#4730),,0
1757,"Fixed references to global variables (window, document) that prevent Pixi from being loaded into environments that donâ€™t necessarily have these available (like Node)",0.6435333,Fix GlobalMixins for @pixi/node (#8634) @Zyie ,,0
1758,Fix sync of uniform arrays of size 1 (#8585),0.96148324,Fix sync of uniform arrays of size 1 (#8585) @dev7355608,,1
1759,Fix: BaseTexture.fromBuffer creating float texture with wrong type (#9330),0.98048735,Fix: BaseTexture.fromBuffer creating float texture with wrong type (#9330) @dev7355608 ,,1
1760,tweak graphics,0.71431804,Fix for Graphics: get points for newly created shape #3363 ,,1
1761,Fixes SpriteMaskFilter clear param (#5435),0.74817896,Fix some SpriteBatch issues,,1
1762,tweak tempDisplayObjectTransform,0.69105774,DisplayObject.updateTransform function rewritten with for better performance,,0
1763,alpha update,0.63084066,Rename PREMULTIPLY_ALPHA to  PREMULTIPLIED_ALPHA (#7846) @ShukantPal ,disabled batching for now as I noticed an issue that needs fixing,0
1764,Fixed tiny cacheAsBitmap alpha issue for graphics,0.85216355,Fix cacheAsBitmap problem with Renderer (#6742),,1
1765,Updating the buffer to have proper size,0.60884726,Vertex buffer and and vertex shader optimisation and reduced memory footprint on the tint and alpha : @bchevalier,fixed the premultiply issue with graphics fixed tinting in webGL graphics,0
1766,update docs a smidge,0.73678374,Doc updates and minor API updates/fixes,,1
1767,update colorAttribute to be aColor,0.73420703,Add ColorSource support for BaseRenderTexture's clearColor,"Also defaults precision fragment on ios to 'highp' - to stop issues of wobbling sprites by default like with link canUploadSameBuffer to not use it's own ios detection code, and use 'ismobilejs'",1
1768,Merge pull request #2199 from ivanpopelyshev/dev,0.47957408,Fix BitmapText regressions (#8699) @ivanpopelyshev ,,0
1769,code review fixes,0.6507012,Code clean up in TransformStatic.updateTransform #3404 #3435,,0
1770,"Remove unused field, fix typings (#5527)",0.9999999,"Remove unused field, fix typings (#5527)",This reverts commit 4743491b6186c675866e13ff0fb144ade6c86842.,1
1771,fixed mask issue,0.8374432,Fix an issue with empty masks (#313),,1
1772,Fix comment mistake for Matrix (#4655),1.0,Fix comment mistake for Matrix (#4655),,1
1773,fix cacheAsBitmap alpha issue,0.9175864,Fix for cacheAsBitmap (#5603),,1
1774,Remove accessibility event listeners with capture (#5085),0.9999999,Remove accessibility event listeners with capture (#5085),,1
1775,Merge branch 'webgl-speed-up' into dev,0.6516683,- Speed up dev builds,Fixes test,0
1776,Remove redundant defaults in Mesh (#6908),1.0,Remove redundant defaults in Mesh (#6908),Fixes test,1
1777,"Karma cleanup, spec reporter",0.6424386,Karma verison updated,,0
1778,Merge pull request #1654 from spaceribs/blurfix,0.51469046,Fix error event for BaseTexture resources (#6035),,0
1779,Fix SVG disposed while loading (#6486),1.0000002,Fix SVG disposed while loading (#6486),,1
1780,"Strip and rope docs, and usage examples",0.52900195,"- Add support for spritesheets in Rope (#1768, thanks @gprzybylowicz)",,0
1781,"merge #969, fix a logic error in spine impl",0.559752,Fix rendering tinted Spines (#6923),,0
1782,Fix parameter typings of BasePrepare (#7954),0.9558598,Fix parameter typings of BasePrepare (#7954) @andrewstart ,,1
1783,add brfs browserify transform,0.5079279,- BlendModes tweaked in webGL to work with pre-multiplied alpha sprites.,,0
1784,Merge remote-tracking branch 'upstream/dev' into dev-rotateTexture,0.4507259,Account for scaling between sourceFrame â†’ destinationFrame in ScissorSystem (#6867),Fixes test,0
1785,Fix: Workaround for transpilation failure with create-react-app (#9093),0.819768,Fix: Workaround for transpilation failure with create-react-app (#9093) @SuperSodaSea ,Fix,1
1786,Fix core usage of extensions,0.5691726,"Extensions now Self-Install, users do not need to call extensions.add anymore (#8558, #8667) @bigtimebuddy ",,0
1787,Merge pull request #2986 from pixijs/bower-workflow,0.5870306,Moves PIXI.loaders.Resource to PIXI.LoaderResource #4471 ,,0
1788,Linting,0.58165264,Chore: improve documentation linting (#8342) @Zyie ,,0
1789,[next] Math copy inconsistencies (#4595),0.5868659,Temporarily remove math-extra divide (#8202) @bigtimebuddy ,,0
1790,Fixes trimming a Text object with an empty string (#5045),0.5897621,Adds ability to customize strings in TextMetrics.measureFont() (#4550),"As it was the code did check for exact equality of X and Y coordinates. This wasn't sufficient, since extremely small differences still lead to problems further down the line due to floating point inaccuracies.",0
1791,Tiny docs improvements,0.7306896,- Fix some docs,,1
1792,"use a different name than char, which is reserved. Fixes #177",0.5296689,Rename parameters for user-friendly (#5274),,0
1793,"remove watch, we don't use it right now",0.46893656,Removed,,0
1794,fix texture size,0.86173254,- Fixed a resize bug in render textures,"When defining a path, any call to beginFill results in the path being closed, but only for the Canvas renderer, not for the WebGL renderer. This commit removes the check that sets the shape to be closed when a fill is active. This unifies the rendering behavior between Canvas and WebGL.",1
1795,Fix import issue in canvas-renderer (#8469),0.74715424,"Fix CanvasRenderer ""translate"" parameter behavior (#6133)",,1
1796,cross hatch..,0.44975105,        },,0
1797,"Added TextStyle object, a reusable style setter for PIXI.Text.",0.85801595,Introduces PIXI.TextStyle class to manage the styling of text fields,,1
1798,minor README cleanup from #3137,0.6085907,Link improvements to README (#8149) @bigtimebuddy ,,0
1799,Added removeStageReference fix,0.6394251,Fix missing removeEventListener in ResizePlugin (#7271) @epaezrubio ,"The default alignement value is 0.5, not 1.",0
1800,added state to vaos,0.55920494,Mesh created Extra VAO #3293 ,,0
1801,commit 3.0.3 builds,0.5855188,"Forgot to upload new builds in v2.2.4, this fixes that...",,0
1802,ensure that sprite width and height are never negative,0.62103724,Don't render rectangles with negative width/height (#8312) @dev7355608 ,,0
1803,Add callback for when children change; #1988,0.6383188,addChild / addChildAt functions now return the child.,,0
1804,Merge pull request #1488 from woutercommandeur/todo-spritemaskfilter,0.5854199,Fix docs removeEventListener & addEventListener (#7487) @bigtimebuddy ,,0
1805,Chore: Jest running on Windows (#8864),0.8031892,Chore: Jest running on Windows (#8864) @SuperSodaSea ,,1
1806,renamed totalTime to currentTime,0.44160244,Changed,,0
1807,bump version to 2.2.8,0.80443245,Bump tar from 2.2.1 to 2.2.2 (#5730),,1
1808,Add example #24 of rigid body physics Box2DJS integration,0.45555097,Improve Graphics calculateBounds to consider matrix (#5991),,0
1809,Uses super instead of prototype.call (#5898),0.9999998,Uses super instead of prototype.call (#5898),,1
1810,Explicitly prioritize the LoaderParser extensions (#8577),0.88438475,Explicitly prioritize the LoaderParser extensions (#8577) @bigtimebuddy ,,1
1811,Adds format and quality options to extract plugins (#5592),1.0000002,Adds format and quality options to extract plugins (#5592),Fixes listener not getting removed Update Sprite.js blah,1
1812,Merge pull request #1806 from FletcherD/dev,0.48011035,Fix loseContext/restoreContext (#8835) @dev7355608,,0
1813,"Decentralize Asset extensions, remove Loader (#8616)",0.73846006,Decentralize Asset extensions (#8616) @Zyie ,,1
1814,"fix typo in texture docs, fixes #332",0.733023,"Update typo on docs (#6072, #6076)",Do something,1
1815,fixed text not resizing,0.60915995,Fix canvas resizing in Text when resolution is not 1 (#7571) @ShukantPal ,,0
1816,Merge pull request #1696 from gprzybylowicz/currentFrame_renamed,0.5618574,Fix Cubemap resources not being reuploaded on GL context loss (#8479) @lunarraid ,,0
1817,Clarify STRICT_TEXTURE_CACHE documentation (#6602),0.6215385,"Reformat documentation to better support documentation in types (#7942, #7876, #7965, #7966, #7963, #7992, #8009, #8010, #7993) @ShukantPal @Reza9472 ",Updated tests,0
1818,Fixed render texture issue where textures not getting uploaded to GPU before render,0.7451036,Fix broken batch rendering of Graphics by custom Graphics plugin (#6061),,1
1819,3.0.5 builds,0.61125815,"Updates build tool dependencies, Lerna v3, Rollup v1, etc (#5327)",,0
1820,minor doc cleanup,0.794534,- Lots of docs cleanup.,,1
1821,Merge pull request #1792 from drkibitz/chore/move2core,0.5584106,Fix loading assets that need the resolver (#9119) @Zyie ,,0
1822,v6.5.0-rc.4,0.6601502,"This is the first release candidate for 6.0.0. This replaces what would have been 5.4.0-rc.4; there will be no 5.4.0 release moving forward, only patch updates for 5.3.x. We have decided to make a major version bump to not break our TypeScript users since the types were overhauled. Official release will have full release notes of changes including breaking changes.",,0
1823,Fix running unit-tests on Windows (#7609),0.69667226,Fix unit-test failures from npm@7.12.0 (#7476) @bigtimebuddy ,,0
1824,Add support for RGB Float format (#7425),0.91654956,Add support for RGB Float format (#7425) @GoodBoyDigital ,,1
1825,Improvement of PR #3053,0.67402893,Updated documentation #3529 #3548 #3553 #3555 #3597 #3591 #3603 #3604,,0
1826,Fix some loading issues; fixes #2687,0.71459806,Fix #1594,,1
1827,Renamed CanvasExtract Class,0.74400926,Restructured the canvas renderer,,1
1828,Doc update (#3661),0.86425173,Doc updates #3401 #3399  #3470 #3471 ,,1
1829,fixes #2884,0.88887215,Fix #1594,,1
1830,Added touches to InteractionManger,0.7537815,add touchenter and touchleave support to interaction manager,,1
1831,Adds exports to package.json in Assets (#8504),0.95627713,Adds exports to package.json in Assets (#8504) @Nahdus,,1
1832,Set GLTexture.samplerType based on the internal format (#9333),0.7680058,Fix default type and internalFormat of GLTexture (#7438) @dev7355608 ,,1
1833,Fixed MovieClip when using negative animationSpeed,0.8468994,"- Support negative animation speeds in MovieClip (#1762, thanks @snc)",,1
1834,Reformat Sprite documentation (#7841),0.71350014,Fix Sprite documentation (#6784),,1
1835,fixed cachAsBitmap issue,0.79727376,Fix for cacheAsBitmap (#5603),"No allows you to specify if a line is inner or outer aligned. 0 = inner, 1 = outer, 0.5 = middle (default)",1
1836,Merge pull request #3069 from pixijs/fix-bucket,0.60429466,Moves PIXI.loaders.Resource to PIXI.LoaderResource #4471 ,,0
1837,Support v4 filters as legacy in v5 (#4703),0.81158334,Make default filter work like in v4 (#5310),,1
1838,pass one of geom,0.502332,        },Fixes tests,0
1839,tons of jshint and typo fixes,0.6672879,Fix typos in documentation (#8177) @jasonsturges ,,0
1840,Add jsdoc for Filter.uniforms,0.66854006,Make default filter work like in v4 (#5310),,0
1841,Hotfix cached OffscreenCanvas in TextMetrics (#8318),0.95083994,Hotfix cached OffscreenCanvas in TextMetrics (#8318) @bigtimebuddy ,"More work to remove from methods from tests, docs, code Fixes linting",1
1842,move CAN_UPLOAD_SAME_BUFFER to settings (#3309),0.83104825,Move settings.CAN_UPLOAD_SAME_BUFFER to BatchRenderer.canUploadSameBuffer ,,1
1843,Forcing the loss of the WebGL context after detecting WebGL capabilities,0.78427964,Fix WebGL context cannot be restored (#5872),,1
1844,added blendModes to depracation,0.71664566,Adds more Blend Modes (#5391),,1
1845,fix mesh canvas rendering for resolution=2,0.86626637,Fix Mesh rendering on canvas (#7463) @dev7355608 ,,1
1846,Texture and Resources Refactor (v5) (#4507),0.691331,"Add Generics to Texture, BaseTexture for Resource types (#7246)",,0
1847,math -> PIXI,0.8290402,@pixi/math,,1
1848,Update documentation for TextStyle.padding,0.78842735,TextStyle.lineJoin documentation improvement #4412 ,,1
1849,Minor update,0.98773074,Minor update:,,1
1850,added from function to texture and sprite,0.69822526,- Plane now support textures from a sprite sheets.,,0
1851,jsdocs shapes list for issue #2425,0.6312822,Updating jsdocs for settings (#5214),Clean up of sprite helper functions Full deprecated Sprite.from and Texture.from methods,0
1852,v7.0.5,0.67357624,"Small fixes and tweaks for v5 (#5329, #5343)","Fixes IE11, which doesn't have this functionality (as reported in link) Moved file",0
1853,Fixing cachAsBitmap functionality,0.80289006,Fix for cacheAsBitmap (#5603),,1
1854,Merge pull request #1395 from serprex/glTexturesIsArray,0.5414372,Fix: add SVG Assets parser to list of parsers (#9046) @MattTreichelYeah ,,0
1855,Merge pull request #1515 from drkibitz/feature/sourcemaps,0.6234601,Use fetch for createImageBitmap for prevent synced decoding ImageBitmap (#7450) @eXponenta ,,0
1856,"fix up more extras, graphics, and text with new render methods",0.7333921,Fix for Graphics' generateCanvasTexture() #3605 ,,1
1857,uniforms separated from shader part 1,0.6338221,Adds support for structs in shader uniforms (#6298),,0
1858,Give the possibility to get the local position with your own global position.,0.6096542,globalmousemove,,0
1859,Add generic type variable for ParticleContainer (#9350),0.718228,Adds autoResize parameter for ParticleContainer #4295,,1
1860,Fix documents. (#3765),0.7596675,"Fix documentation and typings (#6105, #6139, #6145)",,1
1861,Merge pull request #3096 from staff0rd/more_container_tests,0.5492753,Fix LoaderResource tests (#8518) @Julien-Marcou ,,0
1862,Merge pull request #2608 from webbiesdk/dev,0.5577005,Fix README Webpack link formatting (#8685) @StanFlint ,,0
1863,Fixes #2073,0.8159427,Fix #1594,,1
1864,VideoBaseTexture fixes and changes,0.70541006,Fix VideoResource for non-looping playback (#8806) @animanathome ,,1
1865,Fix federated events API with TypeScript (#8085),0.9361584,Fix federated events API with TypeScript (#8085) @caasi ,,1
1866,Adds fullScreen (#4722),0.7180723,"Creates implicit fullscreen mode for filters that match renderers screen size (#4682, #4736)",,1
1867,Merge pull request #727 from wojciak/master,0.50217557,Add crossOrigin with credentials support for XHR requests (#7948) @sergaks ,,0
1868,First-Class Support for Rendering with Node.js (#8397),0.79352045,"First-Class Support for Rendering with Node.js (#8397, #8493, #8495, #8497, #8505) @Zyie @bigtimebuddy ",,1
1869,filter fix,0.8559529,Fix filter clamping #3030 ,,1
1870,Chore: Bump @pixi/webdoc-template 1.5.5 (#8927),0.8501174,Chore: Bump @pixi/webdoc-template 1.5.5 (#8927) @SuperSodaSea ,,1
1871,removed spaces,0.6835102,Removed,,0
1872,fixing up render texture,0.8180031,Fix some canvas rendering issues,,1
1873,update scale modes constants,0.6150043,- #2166: Fix scale being 0,,0
1874,"Merge and close #347, use inherit for cursor style instead of default",0.6187742,Reworked cursor handling to expand cursor options. #3331,,0
1875,Implemented animationSpeed for Spine animations.,0.6169092,"- Support negative animation speeds in MovieClip (#1762, thanks @snc)",,0
1876,Small jsdoc fixes.,0.69468635,Updating jsdocs for settings (#5214),,0
1877,fix issues w/ Container destroy; see #2863 and #2995,0.6814984,- Fix some issues in a couple destroy methods,,0
1878,fix for lineHeight (#2749),0.77819824,Line-height fix from v3 #2837 ,,1
1879,fix the font name parsing,0.6781945,Fix generic font families (#5598),"Fixed up fromBuffer Lint Options can now be passed to from methods Full power to all! Recommended defaults are used for buffer texture creation., but can be overridden if required.",0
1880,"Multiple renerers for Graphics fastRect, solution that will work for sure.",0.7778039,Multiple renderers for Graphics fastRect #2963,,1
1881,v7.1.2,0.678966,v2 Maintenance Release,,0
1882,fixed initial mesh values,0.633328,Add writable Mesh.geometry property (#7744) @dev7355608 ,Lets do it :) Docs for property,0
1883,fixed updateTransform bug,0.8903843,Fix an issue with updateTransform (#569),,1
1884,Clarify the onProgress limitations in documentation (#8962),0.84885186,Clarify the onProgress limitations in documentation (#8962) @bigtimebuddy,,1
1885,Adds Graphics close points epsilon (#5988),1.0,Adds Graphics close points epsilon (#5988),,1
1886,Merge pull request #2038 from mjhasbach/DisplayObject.setParent,0.5775322,Add getter for DisplayObject destroyed (#7582) @ShukantPal ,Set globals in the correct place Fixed lint issue,0
1887,Update package.json,0.88478464,Updating package.json descriptions (#5362),First pass at tidying up shader reduced GLShader to be a storage object also GLShader renamed to GLProgram as it is attached to programs This above two points bring it in line with GLTexture and GLBuffer Now shader inspection only happens once instead of twice! Removed unused classes moved precision check to program Fixes linting tidy up of GLProgram Set type to be object,1
1888,Chore: Bump required Node.js in repo to 18+ (#9135),0.92298836,Chore: Bump required Node.js in repo to 18+ (#9135) @bigtimebuddy ,Fixed nested stencil masks not rendering correctly. Fixed jslint errors. Documented the changes. Fixed Matrix.setTransform gives different result from Transform.updateLocalTransform. Return rotation instead of skew if skewX+skewY is slightly below 360 degrees. Reset rotation when there is skew. Added test case for setTransform->decompose. 2 * Math.PI -> PI_2,1
1889,Hotfix for Spritesheet memory leak PR #6508 (#6580),1.0000004,Hotfix for Spritesheet memory leak PR #6508 (#6580),,1
1890,Convert text-bitmap package to TypeScript (#6479),0.7958906,Support Text-based format for BitmapText example (#6347),"Done filters working nested filters working Less GPU calls than v4 Now passing destination and source frames to shader to calculate verbs ONLY Color Matrix Filter working Filter Area is now transformed (like hit area, much more useful!) Less code :D Todo - Apply Filter no complete - Multiple filters not. Complete - Refactor other filters Optimisations - need to pool the FilterStates Smarter check to eliminate needles enabling of stencil Quad draws with triangle strip multiple filters now working Fixed up resolution Not only does resolution now work - but any texture pass can be ANY resolution and it works like a champ! Moved docs removed a needless comment More optimisations Added caching layer to viewport renamed getRenderTarget -> getFilterTexture added active state to filter for easy access fixed and optimised blur filter at least 66% less gpu calls required now :) Fix up alpha filter Fixed up all bundled filters! Filter clamp added to Displacement filter Fixed lint fail Fixed up use of ba instead of zw in shader Also added defaultFilter vert Added doc to state in filter space.. Added pooling and a few docs bits more tweaks fixed blur Y filter bug Fixed default filter frag bug Set default padding to 0 Removed the slice from filters #3639 Added auto fit back in We now Loop through filters to find appropriate padding / autoFit / resolution rather than just checking first filter. Also clamped blur in vertex shader so that it does not bleed transparency around its edges Update eslint package this seemed to fix it last time..",1
1891,Chore: More optional-chaining and startsWith/includes (#8730),0.66874135,"Chore: nullish coalescing and optional chaining (#8419, #8730) @bigtimebuddy ",,0
1892,fix #2757 by adding to cache by name & url,0.6694956,Fix for cacheAsBitmap (#5603),,0
1893,Tweaked interaction manager to include resolution,0.6531361,- Fix some issues with interaction manager.,,0
1894,Fixed Canvas mask issue,0.8593739,Fix some canvas rendering issues,Fixed issue where uTransform was not being set causing uvs to be calculated incorrectly oops.. used PIXI instead of importing,1
1895,Fixes a bug when resizing RenderTexture with resolution other than one (#5492),0.8502407,- Fixed a resize bug in render textures,,1
1896,Merge pull request #3060 from englercj/fix-image-url-detect,0.66301584,Fix ImageResource load behavior (#6374),,0
1897,Manually merge #2970,0.641528,"Merge PRs: #1592, #1601, #1607, #1609, #1627, #1640",,0
1898,little tweak,0.870355,- Various Minor tweaks. ,See: link,1
1899,"Adds support for inline version with babel, not browserify",0.6456425,Add Browser Module Bundles (#6832),,0
1900,Merge pull request #2098 from mreinstein/dev,0.49242872,Fix loading assets that need the resolver (#9119) @Zyie ,,0
1901,Supports resolutions less than 1 (#5836),0.99999976,Supports resolutions less than 1 (#5836),,1
1902,Fixed parameter ordering (#5589),0.62124753,Fix fillGradientStops descending ordered (#7081),,0
1903,Updated deprecation file,0.6369473,Updated,,0
1904,removed sneaky console.log,0.62791383,Rebuilt with clean dependencies (removes console.logs from pixi-gl-core),,0
1905,Merge pull request #1524 from JanAmbrozic/v2.x,0.543356,Add crossOrigin with credentials support for XHR requests (#7948) @sergaks ,,0
1906,bump version to 3.0.2,0.7539797,Bump tar from 2.2.1 to 2.2.2 (#5730),,1
1907,Adding CanvasRender worldAlpha (#2763),0.96804136,Adds CanvasRenderer worldAlpha #2763 ,copy-from and copy-to inconsistency faster copyFrom for ObservablePoint deprecations Fixes deprecations docs,1
1908,Merge pull request #157 from namuol/master,0.5319119,"Implement swapChildren (#431, @namuol)",,0
1909,Fixed webGL tiling sprite bug,0.76977515,- Fixed tiling sprite resolution issue.,,1
1910,Merge branch 'dev',0.39600745,Remove redundant release branch pushes upon publish #4099,,0
1911,Small Texture Cache enhancements (#3789),0.7074715,Adds a strict mode for using texture caches (#6034),,1
1912,updated some deps,0.73432076,Updated,,1
1913,Merge pull request #2489 from pixijs/dependencies-fix,0.6353613,Moves PIXI.loaders.Resource to PIXI.LoaderResource #4471 ,fixed jsdoc annotations Converts function tag to method tag,0
1914,Only use spritesheet batching and timeouts for resources larger than one batch size,0.61191857,Move settings.SPRITE_BATCH_SIZE to BatchRenderer.defaultBatchSize ,,0
1915,Create a DEPTH_STENCIL buffer only if depth is enabled (#9335),0.6670079,Initial pass at enabling depthTexture support (#5395),,0
1916,fixed destroy and tests,0.6612793,- Fix some issues in a couple destroy methods,,0
1917,Make @pixi/unsafe-eval self-installed (#8805),0.871987,Make @pixi/unsafe-eval self-installed (#8805) @SuperSodaSea ,,1
1918,Fix self-imports in @pixi/core (#6485),0.67603385,@pixi/settings,"Fixes issue with frame buffers if depthTexture or colour texture are auto generated Easy fix, we forgot to update the texture constructors to use the new resource / object format. Lint fix, oops",0
1919,Fixed canvas mesh renderer,0.8527378,Fix mesh TextureMatrix and CanvasMeshRenderer (#5278),,1
1920,fix for #3027,0.81863415,Fix #1594,,1
1921,Fixes #3536 (#3538),0.8189812,Fix #1594,,1
1922,Fix docs for DecomposedDataUri (#6312),1.0000001,Fix docs for DecomposedDataUri (#6312),,1
1923,Properly deprecate roundPixels Renderer option (#5276),0.8614828,ðŸ”¥ Breaking change: Removes roundPixels from Renderer options,,1
1924,Fixes FilterSystem padding every frame (#5017),0.7835505,Fix FilterSystem frame rounding precision issue (#7485) @SukantPal ,Documentation specifies incorrect default value for autoResize param to constructor of ParticleContainer. #4504,1
1925,new dev builds,0.74689883,- Speed up dev builds,,1
1926,v5.1.1,0.7077352,"Small fixes and tweaks for v5 (#5329, #5343)",,1
1927,Merge pull request #2645 from Hachitus/dev,0.49386308,Remove redundant release branch pushes upon publish #4099,,0
