4142,change objectRenderers to plugins,0.6285644,Application plugin structure (#4933),,0
4143,Fix Sprite UVs updating (#6065),1.0000002,Fix Sprite UVs updating (#6065),,1
4144,Improved Particle Shader performance by discarding transparent pixels,0.649025,"Improve particle shader perf (#1864, thanks @bchevalier)",,0
4145,Add hitTest function to cacheAsBitmap,0.7378211,"Add cacheAsBitmapMultisample to add multisampling to cacheAsBitmap (#7441, #7637) @dev7355608 ",More ticker fixes,1
4146,Reduce getBounds() number of comparisons,0.60166466,Reduce Graphics.getlocalBounds test cruft #3397 ,,0
4147,return empty rect if container has no visible children,0.64756763,Adds Container events for childAdded and childRemoved (#5472),because Iâ€™m a donut..,0
4148,Merge branch 'dev-filter-refactor' into dev-v4.0.0,0.60599315,Add support for multisampled filters (#7423) @dev7355608 ,,0
4149,Favor Discord for PixiJS community chat (#8298),0.899095,Favor Discord for PixiJS community chat (#8298) @bigtimebuddy ,,1
4150,Merge pull request #2267 from oal/patch-2,0.46108338,Batch renderer fix O(N^2) memory problem (#5280),,0
4151,Fix documented parameters (#6645),0.70757896,"Fix documentation typo (#6555, #6554)",,1
4152,Slack Invite! (#6632),0.9999999,Slack Invite! (#6632),,1
4153,Adds support for setting anisotropic filtering level (#5537),0.99999994,Adds support for setting anisotropic filtering level (#5537),,1
4154,Merge pull request #2104 from SanderSpies/delete_renderBuffer,0.60679066,Unsubscribe from baseTexture loaded event on Texture destroy (#6534),,0
4155,Implementing classes using the new ES6 syntax (#2936),0.66506976,"Build System, Babel and ES6 src #3289",,0
4156,deprecation of canUseNewCanvasWhateverIDontRememberTheFunctionName,0.71270025,"Declare _renderCanvas, _generateCanvasTexture as a methods not function properties (#7378) @SukantPal ",added todos,1
4157,Chore: Add trigger workflow to update beta.pixijs.com (#9282),0.95518875,Chore: Add trigger workflow to update beta.pixijs.com (#9282) @baseten ,,1
4158,Minor typings fix for ViewableBuffer (#5913),0.7248553,Minor fixes to Framebuffer (#5899),,1
4159,Rename webdoc-template package (#7172),0.85467863,Rename pixi-webdoc-template package (#7172),,1
4160,"Removed the ceil'ing of width and height, as going back and forth you lose precision (#5959)",1.0000001,"Removed the ceil'ing of width and height, as going back and forth you lose precision (#5959)",,1
4161,"Fixed issue with mouseupoutside not firing, when mouse is out of document body",0.66423476,InteractionManager dispatch 'mouse/pointer-over' after 'mouse/pointer-out' (#5989),Added more depracation API,0
4162,Merge pull request #1706 from krzysztof-o/canvas_sprite_resolution,0.63741624,Fix rendering Sprites after destroyed with CanvasSpriteRenderer (#7783) @owendwyer ,,0
4163,"Oops, typo",0.5839511,Doc tweaks / typo corrections.,,0
4164,simplify matrix apply methods,0.70268464,Improve Graphics calculateBounds to consider matrix (#5991),,1
4165,Rebased fixes for canvas masking/renderMode,0.7871442,Restructured the canvas renderer,,1
4166,I think that I modified this correctly after reviewing the documentation here: link and here: link,0.5425541,updated some doc comments #3038,,0
4167,Reformat StateSystem.ts documentation (#7786),0.6971581,"Reformat documentation (#8161, #8162, #8165, #8166, #8168, #8169, #8171, #8163, #8164, #8170, #8167) @ShukantPal ",,0
4168,Fixes #543,0.78091645,Fix #1594,More Ticker changes,1
4169,version updated to 2.1.0,0.69501674,"More fixes and cleanup from alpha.2. Whenever relevant, this release cherry-picks all changes from 4.8.0 and 4.8.1.",,0
4170,Updated PIXI.loaders.Loader docs (#3752),0.8650311,Moves PIXI.loaders.Resource to PIXI.LoaderResource #4471 ,,1
4171,run clean on textures,0.6700709,Fix: Clear full texture in filter system (#7074),,0
4172,Fix display bounds typings (#6339),0.7204838,Fix Geometry typings (#6118),With: - PIXI.ticker.Ticker: Ticker constructor - PIXI.ticker.shared: instance of Ticker,1
4173,pick up IE events,0.60209715,Fix issues with IE ajax,,0
4174,Fix ImageResource load behaviour (#6374),0.9979317,Fix ImageResource load behavior (#6374),,1
4175,"Added a 2nd parameter, newPos",0.5723656,New Features,,0
4176,Fixed Canvas RenderTexture Clear bug,0.9166501,Fix RenderTexture clear in CanvasRenderer (#6712),"These additional Ticker refactor changes include: - Separate update() from requesting an animation frame     - This allows calling update() with a completely separate animation/ticking API if necessary or one chooses - Complete all TODOs     - Added const.TARGET_FPMS     - Added readonly property ticker.FPS     - Added readwrite property ticker.minFPS - added polyfilled ""performance"" to jshint globals     - removed global in usages of it",1
4177,Merge pull request #905 from DebanVG/dev,0.5133737,Deprecation file now works with excluded modules #4067,,0
4178,Added a bit of docs,0.7296747,- Fix some docs,fixes #1647,1
4179,v6.1.0-rc.6,0.63785934,"This is the first release candidate for 6.0.0. This replaces what would have been 5.4.0-rc.4; there will be no 5.4.0 release moving forward, only patch updates for 5.3.x. We have decided to make a major version bump to not break our TypeScript users since the types were overhauled. Official release will have full release notes of changes including breaking changes.",fixes #1655,0
4180,add fromImage to BaseTexture,0.77628446,Adds BaseTexture.from() consistent with Texture.from #3736,,1
4181,expose moveWhenInside docs (#3471),0.57458675,Add transparent option to 6.x docs (#8921) @terekite ,,0
4182,v6.1.0-rc.4,0.6439558,"This is the first release candidate for 6.0.0. This replaces what would have been 5.4.0-rc.4; there will be no 5.4.0 release moving forward, only patch updates for 5.3.x. We have decided to make a major version bump to not break our TypeScript users since the types were overhauled. Official release will have full release notes of changes including breaking changes.",,0
4183,"Fixed incorrect Canvas.context call (should be fillRect, not colorRect)",0.7546062,Add ColorSource support for CanvasContextSystem's clear,,1
4184,optimize the rounded rectangle point array creation,0.67189926,Make trim be a rectangle instead of a point,,0
4185,RenderTexture update,0.8393897,Update RenderTexture constructor documentation (#5729),,1
4186,Line width now more accurate,0.65623224,Text width and height now returns the correct values,,0
4187,rename eventTarget; fix pluginTarget export,0.5788806,Fix export namespace to the declaration files (#7413) @JetLua ,Refactor PIXI.extras.Ticker,0
4188,Chore: Remove unused lib references from packages (#8463),0.8819996,Chore: Remove unused lib references from packages (#8463) @Zyie ,,1
4189,Fixed jshint warnings,0.59496576,Chore: Fix some Webdoc warnings (#8737) @SuperSodaSea ,,0
4190,Support XML fonts in Webworker (#8904),0.8932996,Support XML fonts in Webworker (#8904) @bigtimebuddy,"This refactor changes ticker to only request frames when necessary. Whether the ticker has been started and has listeners are the conditions that need to be met in order to request a frame. The API has also changed and the ticker composes itself around an emitter instead of extended the class. This not only minimizes and simplifies the API, it also allows for the previous functionality without being overly complex.",1
4191,Chore: Improve the data-flow for DetectionParser formats (#8654),0.87225294,Chore: Improve the data-flow for DetectionParser formats (#8654) @bigtimebuddy ,added pixel data retrieval functions to RenderTexture,1
4192,Merge pull request #2766 from pixijs/revert-2764-npmignore,0.60622334,Removes PIXI.utils.URL_FILE_EXTENSION and PIXI.utils.getUrlFileExtension #4397 ,fixes #1617 Use bitmap font texture from spritesheet,0
4193,fixes wrong jsdoc param name,0.5919738,"Fix issue with query params on asset loader (#400, @hugeen)",Use removeListener instead of remove in PIXI.Texture.destroy.,0
4194,Merge pull request #795 from Cristy94/dev,0.482558,Fix documentation of Rectangle.intersection and Rectangle.union (#8240) @dev7355608 ,,0
4195,Merge pull request #3285 from giraluna/jsdoc-renderer-extract,0.5618728,Remove unused extractUniformsFromSrc (#7223),,0
4196,Merge pull request #3127 from staff0rd/container_mocks,0.51592755,Fix docs removeEventListener & addEventListener (#7487) @bigtimebuddy ,,0
4197,Removed unnecessary check in texture,0.7654822,Texture.from function will assume the source is a texture if all other checks fail,,1
4198,rework v3 to use EE3 instead of a custom emitter,0.67103606,Updated EE3 and resource-loader versions #3037,,0
4199,Modified trim to be a rectangle instead of point,0.96655065,Make trim be a rectangle instead of a point,,1
4200,Fix: Typos in deprecation message (#9060),0.8180109,Fix: Typos in deprecation message (#9060) @SuperSodaSea ,,1
4201,"-[SPINE] Spine.js file only contains the spine runtime, modifications needed made it to the official library. link",0.5587839,Spine runtime now supports skins.,,0
4202,Fix interaction performance with global events (#9228),0.86698437,Fix interaction performance with global events (#9228) @Zyie ,,1
4203,Add BaseTexture.from() & fix a bug of Texture.from (#3736),0.85904896,Fix Texture.from not accepting a BaseTexture as texture source (#7807) @ShukantPal ,,1
4204,republished again!,0.5024963,This release didn't publish correctly. Please discard.,fixes #1579,0
4205,fixes #2115,0.91916436,Fix #1594,,1
4206,sprite renderer update to fix new version of chrome,0.6180837,Fix rendering Sprites after destroyed with CanvasSpriteRenderer (#7783) @owendwyer ,,0
4207,Merge pull request #1507 from GoodBoyDigital/alvin/dev,0.57514536,Fix asset ID clashes between bundles (#8950) @GoodBoyDigital ,,0
4208,"Deprecate FILTER_* settings, move to Filter static members (#8865)",0.7716173,Move settings.FILTER_RESOLUTION to Filter.defaultResolution ,fixes #1295,1
4209,Chore: Eliminate redundant handling code for extensions (#8485),0.6224714,Chore: Convert systems into extensions (#8423) @bigtimebuddy ,this means mouse move gets called all the time even if the user is not over the renderer. fixes #1564,0
4210,Fix setting webGLVersion with external context (#6856),0.99999994,Fix setting webGLVersion with external context (#6856),fixes #1596,1
4211,Stricter typings for event emitter and federated events (#7718),0.88613415,"Stricter typings for event emitter and federated events (#7718, #8784) @s-r-x @bigtimebuddy ",fixes #1608,1
4212,Rename PREMULTIPLY_ALPHA to  PREMULTIPLIED_ALPHA (#7846),0.92893803,Rename PREMULTIPLY_ALPHA to  PREMULTIPLIED_ALPHA (#7846) @ShukantPal ,,1
4213,Added MockPointer (#3475),0.8594034,Adds MockPointer test code #3475 ,,1
4214,Merge pull request #2015 from stbaer/dev-pr,0.49882728,Fix docs for DecomposedDataUri (#6312),also fixes alpha issue,0
4215,Merge pull request #1831 from ivw/patch-1,0.517045,"Splits the BasePrepare.register(addHook,uploadHook) into 2 separate methods registerFindHook and registerUploadHook #3830",,0
4216,Delete _config.yml,0.5378709,redundant variables removed,fixes #1606,0
4217,Merge remote-tracking branch 'upstream/dev' into more_container_tests,0.52663696,Centralize isWebGLSupported in unit-tests #3740,,0
4218,Initial commit,0.6282901,Commits: link,,0
4219,Space,0.40411758,"- Implement full 5x4 color matrix support (#1651, thanks @spaceribs)",cacheAsBitmap should respect .visible property,0
4220,Dev bounds refactor (#2729),0.634441,Dev texture states #3258 ,remove consol.log,0
4221,Merge pull request #1651 from spaceribs/dev,0.5083345,Fix BufferResource/DepthResource upload size (#7366) @dev7355608 ,,0
4222,Merge branch 'dev' into events,0.47905242,Workaround for JSDoc events in v3.5.5 (#4994),,0
4223,"Fixed IE11 check. IE11 no longer has MSIE in the userAgent, you need to check for Trident/7.0 instead.",0.65531707,- Fix a multitude of IE9 issues (thanks @alvinsight),Fixed typo in the clone method of the Graphics class,0
4224,Graphics refactor for extendibility (#6077),1.0000002,Graphics refactor for extendibility (#6077),,1
4225,minor optimisation of quadratic bezier curve calculation. (#3712),0.99597764,Minor optimization of quadratic bezier curve calculation. #3712,,1
4226,Fix for TilingSprite.tilePosition with textureResolution > 1 on CanvasRenderer (#3896),0.86942875,Fix canvas rendering transform of TilingSprite (#6869),,1
4227,Merge pull request #1718 from JiDW/dev,0.46980718,Fix docs for DecomposedDataUri (#6312),,0
4228,fix some weird parens,0.60843086,- Fix some docs,,0
4229,Merge pull request #644 from mattdesl/bugfix-641,0.56419814,Fix extract plugin alpha and flipping bug (#6430),,0
4230,remove some dead whitespace,0.619262,Removed the trailing whitespace when wordwrapping a PIXI.Text.,,0
4231,"Revert ""fix #612; implement skew (needs optimization pass)""",0.66992396,"Fix order of skew and scale in transform. Note: this resolves a long-standing issue with skew when combined with scale and may visually break project that rely heavily on working-around this bug.  #3382, fix #3424",Add syntax highlighting to readme code sample,0
4232,Antialiasing now an option for renderer (off by default),0.7764113,Option to enable/disable antialiasing when creating a webGL renderer.,,1
4233,Fix Geometry typings (#6118),1.0,Fix Geometry typings (#6118),,1
4234,Merge pull request #3286 from pixijs/spritesheet-scale,0.6312475,Moves PIXI.loaders.spritesheetParser to PIXI.SpritesheetLoader.use,Added optional lineHeight parameter to setStyle method.,0
4235,Merge pull request #442 from photonstorm/dev,0.5365177,"Fix IE11 check (#442, @photonstorm)","Not sure how that got uploaded, sorry bout that!",0
4236,Re-adds missing blendFuncSeparate from StateSystem (#4728),0.7149993,- #2229: Fix issue in CanvasRenderer where previous blend mode was used,Added lineHeight parameter,1
4237,expose ObjectRenderer and RenderTarget,0.65494144,Update RenderTexture constructor documentation (#5729),,0
4238,Fix linting issues,0.6170509,Fix some SpriteBatch issues,,0
4239,Fix BufferResource/DepthResource upload size (#7366),0.9774557,Fix BufferResource/DepthResource upload size (#7366) @dev7355608 ,,1
4240,removed sub array,0.60981643,Removed,,0
4241,removed gl-matrix from file system,0.5021384,Remove extra gl-flush and extra GC checks (#6195),,0
4242,Chore: Add strict null checks to mixin-get-child-by-name (#9242),0.58596796,"Chore: Add strict null checks  (#9211, #9215, #9223, #9188, #9229, #9236, #9242, #9247) @SuperSodaSea ",,0
4243,Merge pull request #286 from mdoch/dev,0.51953214,Removes accessibility manager hook div from DOM on destruction (#5348),,0
4244,Fix Mesh rendering on canvas (#7463),0.9744284,Fix Mesh rendering on canvas (#7463) @dev7355608 ,Update InteractionManager.js,1
4245,update some dependencies,0.89853084,Updates dependencies (#5600),Avoid errors messages on destroy,1
4246,Merge pull request #3000 from stbaer/dev-pr,0.5142226,Fix BufferResource/DepthResource upload size (#7366) @dev7355608 ,Spine FlipX/FlipY timeline fix,0
4247,added bit-twiddle,0.6557333,Adds letterSpacing property to BitmapText (#4642),,0
4248,"Added RenderTexture.clear - because, well, it's really useful :)",0.70943093,Add ColorSource support for RenderTextureSystem's clear,Spine plugin: ScaleX and ScaleY of attachments,1
4249,merge bubbling events (#914),0.59422046,"Federated Events API, alternative package to interaction (#7213, #7350, #7381, #7376, #7616, #7652) @SukantPal @bigtimebuddy @miltoncandelero ",,0
4250,v7.0.0-beta.6,0.6620192,"Small fixes and tweaks for v5 (#5329, #5343)",,0
4251,cached bind for InteractiveManger,0.67918897,isWebGLSupported util function is now cached (#5604),silly me..,0
4252,Tiling Sprite refactor,0.7649816,Fix docs for Sprite and TilingSprite (#6314),,1
4253,Merge pull request #1101 from rsbohn/dev,0.5052947,Fix: Prevent BlobResource.load from loading the data multiple times (#9331) @dev7355608 ,,0
4254,Set antialising to true to Graphics example,0.6262554,Graphics chaining functions,,0
4255,Next Restructure for v5 (#4387),0.7304909,"Small fixes and tweaks for v5 (#5329, #5343)",Spine plugin: sometimes attachments have their own alpha,1
4256,WebGL 2 Lets do it :) (#4711),0.70510614,New webGL renderer,,1
4257,v4.4.4,0.7029321,This release adds continuing hot-fixes for v4.4.0. Note: download links below are now accessible from HTTPS as well as HTTP. ,,1
4258,RenderTexture tidy up,0.7515328,Fix RenderTexture clear in CanvasRenderer (#6712),,1
4259,Fixes SpriteMask filterArea lagging by 1 frame (#5444),0.79540837,Fix FilterSystem frame rounding precision issue (#7485) @SukantPal ,,1
4260,added file,0.56803143,PIXI.extensions.add(),Fix for NaN duration values for 'looping' fix,0
4261,Make renderer use alpha in main framebuffer by default (#7062),0.7180951,"Deprecate Renderer's transparent option, adds useContextAlpha and backgroundAlpha instead (#7062, #7067, #7072, #7135)",,1
4262,Fixed crash in WebGLState::push(). (#3652),0.7239136,- Fix an issue with WebGL destroy(),,1
4263,no-one likes a missed semi-colon :/,0.518175,};,,0
4264,add nativeLines option for Graphics (#3328),0.7609463,"Add support for lineJoin, lineCap and miterLimit to Graphics line rendering example (#6502, #6545, #6584) ",reverted this back so as to fix the #1584. I know undos the fix for 1579 but I have a good fix for that in the works.. watch this space.,1
4265,Merge pull request #1020 from kambing86/dev,0.54930925,Fix: Prevent BlobResource.load from loading the data multiple times (#9331) @dev7355608 ,,0
4266,Fixes Graphics clear (#5514),0.80455756,Fix for the empty Graphics batchability issue (#5821),,1
4267,Merge pull request #2609 from pixijs/fix-jaguarjs-jsdoc,0.6177231,Replaces jaguarjs-jsdoc with @pixi/jsdoc-template for rendering docs #4311,,0
4268,Merge pull request #2390 from jiborobot/text-letter-spacing,0.59884787,Fix jittering caused by incorrect BitmapText text width (#8536) @grebinka ,,0
4269,Merge pull request #1487 from gitter-badger/gitter-badge,0.4852221,"Chore: nullish coalescing and optional chaining (#8419, #8730) @bigtimebuddy ",Make properties to upload for ParticleContainer easier to understand,0
4270,Change to black as default renderer color.,0.70266044,Fix handling of black colors (#288),,1
4271,Expose image resource to public API,0.5671291,webp image support.,This reverts commit e4c13a65a4e4639ac350d69f3d0c9f9c049b07a5.,0
4272,Merge pull request #2579 from ivanpopelyshev/dev-filterClamp,0.6184226,Add support for multisampled filters (#7423) @dev7355608 ,,0
4273,GroupD8 documentation (#5849),0.70887077,Renamed GroupD8.isSwapWidthHeight to GroupD8.isVertical #4363,,1
4274,Fragment shader precision detection (#5602),1.0,Fragment shader precision detection (#5602),,1
4275,Fixes issues with build process (#4415),0.72436434,Fix circular dependencies in build process (#9088) @bigtimebuddy ,,1
4276,"-[SPINE] Separates the PIXI.Spine portion into its own file, allows for easier spine.js library updates. Implements new loading system, IK, per bone flip and skinned mesh attachments.",0.69653946,Moves PIXI.loaders.spritesheetParser to PIXI.SpritesheetLoader.use,,0
4277,Enable scissor mask support by default (#6983),1.0,Enable scissor mask support by default (#6983),Feature/cleanup,1
4278,Stage now interactive by default,0.5114269,interactiveTarget.cursor is the cursor mode to be used when moused over. It is not limited to just 'default' and 'pointer'.,,0
4279,update resource-loader version,0.92262566,Update to the latest version of resource-loader (#5870),,1
4280,Fix follow up to Blend Modes None (#5392),0.8363574,Adds more Blend Modes (#5391),,1
4281,fixed a filter pool texture issue,0.7850461,Fix: Clear full texture in filter system (#7074),,1
4282,Cleans up BasePrepare importing settings like other packages (#5364),0.99999994,Cleans up BasePrepare importing settings like other packages (#5364),Don't export things that don't export things Consistency in core requires,1
4283,context,0.6114416,{,,0
4284,using a single JS source for all examples instead of duplicating files unnecessarily.,0.48797393,```js,,0
4285,update travis script,0.7584923,Travis configuration update (#6418),,1
4286,DisplayObject tests,0.60107255,Check if DisplayObject has children before looping in AccessibilityManager (#7849) @ShukantPal ,,0
4287,Merge pull request #1478 from GoodBoyDigital/alvin/namespacing,0.62427354,Fix asset ID clashes between bundles (#8950) @GoodBoyDigital ,,0
4288,fixed couple of errors from the new structure,0.5966328,- Fix some issues in a couple destroy methods,,0
4289,Added an error event dispatch when an image cannot be loaded.,0.6894423,Fix ImageResource load behavior (#6374),,0
4290,Canvas mesh alpha. Fix for #4534 (#4535),0.8596896,Fix mesh TextureMatrix and CanvasMeshRenderer (#5278),,1
4291,Adds TypeScript typings to bundles (#4760),0.9891343,Adds TypeScript typings for bundles #4760,,1
4292,Implemented texture caching for fromCanvas method,0.8439049,Add canvas cache for Texture.fromCanvas,,1
4293,Adds defaults uniform names to Filter (#4714),0.99487346,Adds defaults uniform names to Filter #4714,,1
4294,CanvasMask patch,0.77531123,Fix some canvas rendering issues,,1
4295,Add IBatchableElement to AbstractBatchRenderer (#6692),0.68129516,Adds clear method to CanvasRenderer #3423,,0
4296,Merge pull request #1870 from endel/container-added-removed-events,0.56641996,Adds Container events for childAdded and childRemoved (#5472),,0
4297,Updates resource-loader to support cross-origin via iframe (#5268),0.9940237,"Updates resource-loader to support cross-origin via iframe (#5268, #5288)",,1
4298,"Revert ""[next] Sprite, Mesh and Graphics refactor to including in batching (#5069)"" (#5127)",0.9419384,"Sprite, Mesh and Graphics refactor to including in batching (#5069, #5127, #5132)",,1
4299,Maskin added to pixi.js,0.6572636,updateSourceImage added to PIXI.BaseTexture.,sneaky console.log.. why you there?,0
4300,Fixed stage ref bug,0.70188934,Fix issue where Application.destroy ignored stageOptions (#5999),mainly changing core.math.Point to core.Point,1
4301,Updates documentation and types (#5671),0.99999994,Updates documentation and types (#5671),,1
4302,Rename CanvasTinter (canvasUtils) and GroupD8 (groupD8) (#6068),1.0,Rename CanvasTinter (canvasUtils) and GroupD8 (groupD8) (#6068),,1
4303,add destroy plugins method,0.68459654,Destroy generated RenderTexture in extract plugin #4562,"This commit also: fixes some dangling whitespace, fixes some incorrect docs in extras/mesh, moves Text to core moves BitmapText to extras moves math constants to const.js",0
4304,fix typo in convolution filter,0.8166226,- Fix typo in ConvolutionFilter,,1
4305,Fix for overwriting falsy values.. or even (possibly) undefined ones.,0.52314204,Fix wordWrap override not working if style is true and override is false (#5082),,0
4306,Fixed typo in URL,0.604398,"Fix issue where urls have http in the resource (#443, @sirflo)",,0
4307,Fixed texture from SVG (#5630),0.7196457,Fix SVG disposed while loading (#6486),,1
4308,removed some old flight details..,0.5251657,Removed,,0
4309,Fixes non-batched Graphics (#5401),0.8479856,Fix broken batch rendering of Graphics by custom Graphics plugin (#6061),,1
4310,add out param to Matrix#toArray,0.9965574,Add out param to Matrix#toArray,,1
4311,Initial Reorganization,0.531248,Overview,,0
4312,Re-organize contributor documentation (#4778),0.99999994,Re-organize contributor documentation (#4778),,1
4313,bump versions to v1.6.1,0.77286935,- Bump resource loader version to 1.5.2,,1
4314,Merge branch 'Interactive-Update',0.54923266,Update Contributing Guide with new branch flow. #2983,,0
4315,Merge pull request #555 from photonstorm/dev,0.49762312,"Fix IE11 check (#442, @photonstorm)",,0
4316,"Revert ""Fix #1001""",0.79808486,Fix #1594,,1
4317,Merge pull request #3219 from ericvandever/expand_svg_size_regex,0.62510914,Adjust SVG_SIZE regex to support finding either format of quotes #3219,,0
4318,remove an unecessary todo,0.69680715,Removed,,0
4319,properly handle context restore; fixes #1788,0.86316717,- Fix an issue with context restore (#1788).,fixed retrieve Canvas from RenderTexture bug,1
4320,Remove the rest of internal module coupling between packages,0.70202553,Chore: Remove all dependencies from module bundles (#9203) @SuperSodaSea ,,1
4321,fixes #1403,0.8477491,Fix #1594,,1
4322,Merge pull request #2497 from maksr51314/dev,0.5385268,"Merge PRs: #1592, #1601, #1607, #1609, #1627, #1640",,0
4323,Merge pull request #3073 from gameofbombs/dev4,0.5409435,Fix: Prevent BlobResource.load from loading the data multiple times (#9331) @dev7355608 ,add some space in the â€œsayHelloâ€ console.log,0
4324,Fixing link for Fight for Everyone game.,0.51560324,link,Feature/docs,0
4325,fix cacheAsBitmap memory leak with destroy; fixes #1633,0.88861895,- Fix cacheAsBitmap leak,Feature/object assign,1
4326,Fixes DATA_URI regex to allow charset=utf8;base64 for the encoding part (#4880),0.5886724,"Normalizes SVGResource parsing to support inline SVG strings, base64 data URIs, and URLs (#5697)",change karma path to pixi build,0
4327,geom updates,0.58169305,Updated,gulp build pixi to bin/pixi.js,0
4328,Merge branch 'dev-unload' into dev,0.50585485,"Cleanup devDependencies, don't require package order (#7664) @bigtimebuddy ",Add some padding and some âœ° stars âœ°,0
4329,Set globals in the correct place (#4700),0.65508723,globalpointermove,,0
4330,fixing mesh canvas,0.93876207,- Fixed canvas mesh issue.,,1
4331,Added Plane to Mesh class,0.9160675,"- Add new ""Plane"" mesh class.",,1
4332,Merge pull request #78 from englercj/texture,0.52951634,Add crossOrigin with credentials support for XHR requests (#7948) @sergaks ,,0
4333,removed updateChildTransform,0.7188209,Made RemoveChild no longer returns error,,1
4334,Merge pull request #49 from ze0nni/master,0.52538586,Fix nested interaction (#9301) @Zyie,,0
