Commit Message,Score,Correspond Changelog Sentence,Commit Description,Label
Move title above image & allow multiline title,0.22093517,Fix styling of messages (#37 fixed in #54 by @hugegreenbug),,0
Make title bold,0.33095208,Add dark mode (#26 via #110),,0
Reduced the title font size (#54),0.38008118,Fix styling of messages (#37 fixed in #54 by @hugegreenbug),,0
Document steps to update client,0.3716145,Update dependencies,,0
Update code to use new client,0.38629442,Update dependencies,,0
Update swagger client,0.33242816,Update dependencies,,0
Use master for generating spec,0.12921213,Add fastlane metadata + images,,0
Fix race condition while loading messages,0.6077099,Fix crash when polling new messages and the request fails,"Images didn't load correctly when the following scenario occurred: * ApplicationHolder#request * MessagesActivity.SelectApplicationAndUpdateMessages#execute * MessagesActivity.SelectApplicationAndUpdateMessages#doInBackground   - method returns List, but images are ""null"" because     apps aren't loaded yet. * MessagesActivity#onUpdateApps   - Now apps were loaded and cached. * MessagesActivity.SelectApplicationAndUpdateMessages#onPostExecute   - receives List from #doInBackgroud with ""null"" images -> Messages with ""null"" images are rendered in the ListView",0
Support URLs with path prefix (#46),0.46331483,Show full url in connection string (#59 fixed in #60),See gotify/server#127 gotify/server#122,0
Merge pull request #43 from eternal-flame-AD/upstream-autolink,0.43796492,Migrate to GitHub actions (#157),Add android autolink to message item layout,0
message body autolink,0.653262,Add android autolink to message item (#39 fixed in #43 by @eternal-flame-AD),,0
Merge pull request #41 from eternal-flame-AD/upstream-patch-network,0.3803193,Migrate to GitHub actions (#157),listen for network changes,0
Remove obsolete reconnect callbacks,0.64567995,Listen to network changes to prevent unnecessary reconnects (#40 fixed in #41 by @eternal-flame-AD),removes obsolete reconnect callbacks scheduled before network reconnects to prevent unwanted reconnection also renamed WebSocketConnection.onFailure to onNetworkFailure to clear confusion,0
Wait for network when websocket connection failed,0.72332,Fix closed WebSocket connection on timeout (#129 via #137),,1
Add permission ACCESS_NETWORK_STATE,0.46512985,Remove unused permission (READ_PHONE_STATE),,0
Add battery and notification improvements,0.4822043,Notification improvements (#18 partly fixed in #16 & #22 by @schwma),,0
Improve readme,0.3072972,Improve link colors by @Sternagfonkel,,0
Limit reconnect timeout,0.90853727,Limit the reconnect timeout link,,1
Version 2.0.4,0.41483903,Fix release,,0
Merge pull request #35 from gotify/deps,0.42290583,Start Gotify on boot (#25 fixed in #32 by @schwma),Update retrofit,0
Update retrofit,0.47065496,Update to Java 11,,0
Merge pull request #34 from gotify/cleartext-traffic,0.47549176,Allow cleartext traffic (#31 fixed in #34),Allow cleartext traffic,0
Add warning message when using http,0.4154434,HTTP2 Support (#24 fixed in #27),,0
Allow clear text traffic,0.5779826,Allow cleartext traffic (#31 fixed in #34),,0
Merge pull request #33 from ialokim/foreground-notification,0.5669893,Make the foreground notification less intrusive (#30 fxied in #33 by @ialokim),Some changes to foreground notification (channel),0
Merge pull request #32 from schwma/start-on-boot,0.42618093,Start Gotify on boot (#25 fixed in #32 by @schwma),Start Gotify WebSocketService on boot completed,0
added some lines to get foreground notification (a little) less intrusive,0.8654319,Make the foreground notification less intrusive (#30 fxied in #33 by @ialokim),,1
Change class variable to local variable,0.18596941,Rename some texts,,0
Start Gotify WebSocketService on boot completed,0.6666918,Start Gotify on boot (#25 fixed in #32 by @schwma),,0
Version 2.0.3,0.4081328,Fix release,,0
Update oauth package and ignore linting for it,0.3666473,Update dependencies (link),OAuth2 isnt used therefore we can ignore it,0
Migrate gotify to new client,0.4641012,Start Gotify on boot (#25 fixed in #32 by @schwma),,0
Change client to retrofit2,0.39416263,Update to Java 11,,0
Version 2.0.2,0.4167247,Initial Release,,0
Use singleTask launch mode,0.3948679,Do not start message activity twice (#23),New notifications created a new activity even if the activity was already on top,0
Add logs button to Login,0.9567392,Add logs button to login (#23),,1
Merge pull request #22 from schwma/master,0.4307164,Migrate to GitHub actions (#157),Map Gotify message priorities to notification channels,0
Merge pull request #15 from gjabell/feature/self-signed-ssl,0.63557774,Support self-signed certificates (#13 fixed in #15 by @gjabell),Added SSL Validation Override and CA Selection,0
Enable vibration by default for high and default importance notification channels,0.5118072,Add setting for separate notification channels per Gotify application by @cyb3rko and @newhinton ,,0
Removed catch-all hostname verifier if a cert is present,0.46727717,Support self-signed certificates (#13 fixed in #15 by @gjabell),,0
Adjust notification channel names to include their corresponding gotify priorities,0.7507647,Add setting for separate notification channels per Gotify application by @cyb3rko and @newhinton ,,1
Fix formatting as suggested by spotlessJava,0.4784376,Fix styling of messages (#37 fixed in #54 by @hugegreenbug),,0
Map Gotify message priorities to notification channels,0.745204,Add setting for separate notification channels per Gotify application by @cyb3rko and @newhinton ,,1
Added local Picasso instance instead of singleton,0.44405356,Cache images in messages with picasso (#79 via #87),MessagesActivity now constructs a new Picasso instance each onCreate   and passes it to ListMessageAdapter,0
Merge branch 'master' of github.com:gotify/android into feature/self-signed-ssl,0.40521502,Support self-signed certificates (#13 fixed in #15 by @gjabell),,0
Cherry-picked Advanced Settings dialog,0.26392496,Add notification permission popup,Switched raw strings to string resources Removed unused fields / views from LoginActivity Reset 'Check Version' button text when changing SSL settings Fixed formatting,0
Use an dialog to show advanced settings,0.41803527,Add notification permission popup,,0
Fixed Picasso + refactors,0.45163244,Cache images in messages with picasso (#79 via #87),Removed comment Moved SSLSettings to its own top-level class Fixed picasso not setting SSL settings and failing to load images over   self-signed connection,0
Merge request changes,0.30908543,Migrate to GitHub actions (#157),Moved certificate-related utilities to separate class Added settings method to return an entire SSLSettings object; refactored   methods using separate parameters to take single SSLSettings parameter Advanced Settings section on login page now hides / shows along with   other buttons to prevent it from showing up in front of the loading   spinner Fixed star imports Refactored applySslSettings as per code from merge request Fixed formatting,0
Set color on foreground notification,0.6708262,Change label of foreground notification by @Sternagfonkel,,0
Prevent duplicate notification sounds from message group notification,0.513276,Do not start message activity twice (#23),,0
Set message notification accent color to colorPrimary,0.52366424,Change label of foreground notification by @Sternagfonkel,,0
Add LED light for message notifications,0.5280174,Make the foreground notification less intrusive (#30 fxied in #33 by @ialokim),,0
Adjust notification channel importances,0.66656154,Add setting for separate notification channels per Gotify application by @cyb3rko and @newhinton ,,0
Move encrypting key to before deploy,0.26568022,Migrate to GitHub actions (#157),With PRs from forked repositories the release key can't be decrypted because the secured variables are hidden.,0
Added SSL Validation Override and CA Selection,0.4193481,Allow usage of user certificates (#131 by @KROSF),Added fields to login page to a) disable ssl validation or b) select   a custom Certificate Authority certificate to use with the server. Changed visibility of widgets on login page from INVISIBLE to GONE so   they don't take up space while hidden (since this was causing weird   spacing issues with the new fields). Added state to settings to store ssl validation choice or certificate   data. Added fields to various HTTP methods to disable ssl validation or set   valid certificate authority if either setting is enabled.,0
Add fdroid badge,0.29561168,Change notification icon by @PanderMusubi,,0
Add License,0.3016398,Fix APK signing,,0
Version 2.0.1,0.43097192,Initial Release,,0
Fix websocket connection on refresh,0.8370801,Improve websocket reconnects,"On refresh the service was restarted but the connection wasn't closed, therefore each incoming message was handled n times.",1
Show full messages,0.56454855,Add compact message layout by @cyb3rko,,0
Version 2.0.0,0.41860786,Initial Release,,0
Add Readme,0.35042742,  See link,,0
Add travis script,0.21166307,Add fastlane metadata + images,,0
Fix sportless issues,0.2428692,Fix release,,0
Make gradlew executable,0.27082863,Fix CVE-2019-11932 by removing the android-gif-drawable-library (#87),,0
Add empty proguard rules,0.2694221,Disallow sending messages if no applications exists (#182 by @Sternagfonkel),,0
Add push service,0.59271896,Add share and push message support (#72 via #122 by @tomasvanagas),,0
Add LogsActivity,0.5968531,Add logs button to login (#23),,0
Add MessagesActivity,0.6071558,Add setting to exclude the message activity from the recent apps by @sgpublic ,,0
Add state holder for message activity,0.5416348,Do not start message activity twice (#23),,0
Add missed messages util,0.52908516,Add 'no messages' text with explanation how to send messages (#97 by @leopoldsedev),,0
Add LoginActivity,0.5631323,Add logs button to login (#23),,0
Add common utils,0.20067829,Add dark mode (#26 via #110),,0
Add init activity,0.40439236,Do not start message activity twice (#23),,0
Add notification support,0.6151917,Add notification permission popup,,0
Add log utils,0.6431509,Add logs button to login (#23),,0
Add settings wrapper,0.30776733,Add compact message layout by @cyb3rko,,0
Add api utils,0.24042614,Update app design by @cyb3rko ,,0
Add values,0.2474001,Add dark mode (#26 via #110),,0
Add image resources,0.41831553,Add fastlane metadata + images,,0
Add manifest,0.33575064,Show app icon in notifications (#106 by @newhinton),,0
Add generated client,0.40024424,Delete client on logout (#114),,0
Add gradle config,0.30550465,Increase targetSdkVersion to 33,,0
Add gradlew,0.31100452,Update dependencies (link),,0
Add gitignore,0.36923692,Migrate to GitHub actions (#157),,0
Remove old project,0.4481567,Add delete application button (#150 by @p1gp1g),,0
Version 1.0.1,0.4458195,Initial Release,,0
Format android manifest,0.36294153,Fix APK signing,,0
Remove READ_PHONE_STATE permission,0.95069504,Remove unused permission (READ_PHONE_STATE),,1
Rename de.gotify to com.github.gotify,0.5667615,Start Gotify on boot (#25 fixed in #32 by @schwma),,0
Update compileSdkVersion,0.584355,Increase targetSdkVersion to 33,,0
Fix ugly hacky oreo notification support,0.58247894,Notification improvements (#18 partly fixed in #16 & #22 by @schwma),,0
Fix icons,0.5017215,Change notification icon by @PanderMusubi,,0
Add ugly hacky oreo notification support,0.562067,Make the foreground notification less intrusive (#30 fxied in #33 by @ialokim),,0
Show messages that were missed while being disconnected & Use models,0.45183086,Add 'no messages' text with explanation how to send messages (#97 by @leopoldsedev),,0
Add model structures,0.19779176,Add dark mode (#26 via #110),,0
Add navigation for Home - Messages,0.4620156,Add 'no messages' text with explanation how to send messages (#97 by @leopoldsedev),,0
Add Logs-Component,0.59187907,Add logs button to login (#23),,0
Add logo,0.35888934,Change notification icon by @PanderMusubi,,0
Add Home-Component,0.24199574,Add delete application button (#150 by @p1gp1g),,0
Change login icons to ion & Format,0.47247452,Change notification icon by @PanderMusubi,,0
Set connection timeout to 10 seconds,0.7677567,Limit the reconnect timeout link,,1
Try to instantly reconnect to WS on first error,0.5208177,Listen to network changes to prevent unnecessary reconnects (#40 fixed in #41 by @eternal-flame-AD),,0
Only restart web socket if url/token was changed,0.55552244,Improve websocket reconnects,,0
Use big style for foreground notification,0.66889095,Make the foreground notification less intrusive (#30 fxied in #33 by @ialokim),,0
Use constants for preference keys,0.18592913,Keep selected application on screen rotation (#207 via #208 by @Sternagfonkel),,0
Adjust log messages,0.5054457,Update log view after log is cleared,,0
Add LogManager for reading the logs in react-native,0.41620797,Add logs button to login (#23),,0
Add in memory log,0.44025704,Add logs button to login (#23),logcat doesn't really support showing logs see link Solution is to delegate to the logcat log and save the logs in memory that it can be viewed later.,0
Add README,0.35042742,  See link,,0
Add travis build,0.33267507,Increase targetSdkVersion to 33,,0
Add react native js components,0.2927363,Add native android splash screen,,0
Add main activity and push service,0.41914612,Add setting to exclude the message activity from the recent apps by @sgpublic ,,0
Add strings & styles.xml,0.32757115,Add compact message layout by @cyb3rko,,0
Add manifest (with push service),0.42863673,Add share and push message support (#72 via #122 by @tomasvanagas),,0
Add gotify icon,0.62034506,Show app icon in notifications (#106 by @newhinton),,0
Add auto generated configuation,0.2533126,Add setting for separate notification channels per Gotify application by @cyb3rko and @newhinton ,,0
Add .gitignore,0.38186893,Migrate to GitHub actions (#157),,0
