Index,Message,Description
1040,nuget: use nuget.config to force only NuGet.org source,Add a local nuget.config file to force the package source used for NuGet packages to be only the nuget.org public feed. There have been problems with some CI agents that don't have a global/default nuget.org package source.
1041,osx: ensure /usr/local/bin dir exists on install,Ensure the /usr/local/bin directory exists on macOS installations before we create the symlink for GCM Core. The directory does not exist on freshly installed Macs.
1042,Update Homebrew install instructions,Fixes #248
1043,Merge pull request #241 from AlexanderLanin/subdomain,Detect github.my-company-server.com as GitHub
1044,Make tests actually test mixed case input,Uri converts to lowercase.
1045,Make comparisons case insensitive,Co-authored-by: Matthew John Cheetham link
1046,Merge branch 'release' into master,
1047,Update FAQ with some SSH questions,"Some users had questions about SSH, and if it HTTPS-based remotes with GCM Core was preferred to SSH. SSH is here to stay and is a perfectly fine and valid mechanism. GCM Core is only useful for HTTP(S) remotes. Fixes #191"
1048,Merge pull request #244 from mjcheetham/libsecretfix,Use down-level libsecret functions to get secret values
1049,libsecret: use downlevel functions to get secrets,"Replace our use of module which was only introduced in libsecret 0.19.0, with module and a separate module call which is available in all versions. This will allow us to work on older distributions that may only include older versions of libsecret, specifically Ubuntu 18.04 LTS which includes libsecret 0.18. Version 0.20 of libsecret was only introduced from Ubuntu 19.04."
1050,Merge pull request #243 from mjcheetham/noboxchars,Remove use of box drawing characters in warning output
1051,http: remove use of box drawing chars in warning output,"Remove the use of box drawing characters in the warning output messages for TLS verification being disabled. Some systems (looking at you Windows) struggle with such characters. Replace them with simpler characters. Whilst we're at it, also remove box drawing characters from code comments. Even though these aren't a problem, let's just do it for consistency."
1052,Detect github.my-company-server.com as GitHub,
1053,Merge pull request #236 from mjcheetham/githubpatmode,Add explicit PAT authentication mode for the GitHub Provider
1054,authbase: quote cmdargs passed to helpers,Correctly quote and escape arguments passed to authentication helpers via the process arguments.
1055,github: update Windows GitHub UI to add PAT support,"Update the WPF-based Windows GUI for GitHub authentication prompts to support the third authentication mode ""PAT"". Also make some changes to how the dialog window is sized to scale with the size of the content (mins and maxes included), which may now vary in the extreme from all three auth options, to just one."
1056,github: add PAT authentication mode,"Add an authentication mode to the GitHub provider whereby a Personal Access Token can be returned directly, as generated by a user manually. Update the terminal-based UI menu to support the new PAT mode."
1057,Merge pull request #234 from mjcheetham/fixconfigmatching,Match Git config in a mixed-sensitively way
1058,stringcmp: add more tests to GitConfigKeyComparer,"Add more tests to the GitConfigurationKeyComparer tests, specifically around cases that contain no period/dots '.'. In these cases we behave as StringComparer.Ordinal."
1059,config: match Git config mixed-sensitively,"Git configuration entry keys are neither case sensitive, nor in-sensitive. They are mixed sensitive. The section and property names are NOT sensitive, but the 'scope' or inner component of the full name IS sensitive. For example, module is the same as module, but module is NOT. We introduce a new StringComparer type that performs insensitive comparison on the section and property components, and sensitive comparison on the scope component."
1060,Merge pull request #233 from mjcheetham/credsuppress,Add suppressions for credscan false positives
1061,credscan: add suppressions for credscan false positives,"Add the required source suppressions for false positive identification of credentials, raised by the internal CredScan tool. Most of the identified matches are fake credentials for unit tests. One match was the GitHub OAuth2 application client secret, which per issue #228 valid and an accepted & required 'secret' to be public."
1062,Merge pull request #227 from AlexanderLanin/master,Refactor in order to simplify adding more tests
1063,Remove dependency of GHES to gitub.com constant,Co-authored-by: Matthew John Cheetham link
1064,Refactor in order to simplify adding more tests: GetSupportedAuthenticationModes_WithMetadata,
1065,Refactor in order to simplify adding more tests: GetSupportedAuthenticationModes,
1066,Refactor in order to simplify adding more tests: GetCredentialServiceUrl,
1067,Refactor in order to simplify adding more tests: IsSupported,
1068,Create apt-get release pipeline (#221),Create a new Github workflow for deploying the .deb installer from a release to packages.microsoft.com
1069,Merge pull request #224 from mjcheetham/fix-nbgv,Update GitVersioning package
1070,build: update GitVersioning package,"Update the Nerdbank.GitVersioning package to the latest version (3.3.37) to consume a fix for the removal of the module command in GitHub Actions. Previous versions of GitVersioning use the module command to set the cloud build number. The new version uses ""environment files"" which is the replacement for module."
1071,Merged PR 585338: Cut new release including security fix,Changes:  Fix NTLM proxy authentication Fix reading empty Git configuration entry values Allow users to select the type of interactive authentication flow for the Microsoft auth stack
1072,Merged PR 585167: [Security] Enumerate the PATH environment variable to locate programs on Windows,"Enumerate the PATH environment variable to manually locate executables/programs rather than shell out to where.exe on Windows locate these for us. The where.exe utility first checks the current working directory before the PATH for the executable, which we do not want for various security reasons. The which utility on UNIX/POSIX systems does NOT include the current working directory in the search; only the PATH, which is exactly what we want - leave this in place on those platforms. Additionally for locating module we first check in the module directory for the executable, if that environment variable was set."
1073,env: enumerate the PATH envar to locate programs on Windows,"Enumerate the PATH environment variable to manually locate executables/programs rather than shell out to where.exe on Windows locate these for us. The where.exe utility first checks the current working directory before the PATH for the executable, which we do not want for various security reasons. The which utility on UNIX/POSIX systems does NOT include the current working directory in the search; only the PATH, which is exactly what we want - leave this in place on those platforms. Additionally for locating module we first check in the module directory for the executable, if that environment variable was set."
1074,Merge pull request #217 from mjcheetham/ntlm-proxy-auth,Treat empty credential proxy configuration as use system default credentials
1075,http: treat empty cred proxy as system default creds,"To enable using the default system credentials for authenticated proxies we must set the module property to module. (For example, with Windows Integrated Authentication-based proxies - NTLM or Kerberos.) Currently we set this if no username and password information is specified at all in the proxy configuration. However, Git itself when presented with this configuration will prompt the user for a username/password (which isn't required). Specifying an empty string username/password in the proxy configuration will stop Git from prompting for them, and allow cURL to auto-negotiate proxy auth. However, GCM reads that same configuration as having a username/password based proxy with the empty string for both values. We change GCM to use the system default credentials when configuring a proxy if there is no userinfo OR if BOTH the username and password values are the empty string. Example proxy config value: http://:@proxy.example.com"
1076,Merge pull request #215 from mjcheetham/config-empty-fix,Fix reading of empty string Git configuration values
1077,config: fix reading of empty string Git config values,"Previously trying to read a single Git configuration setting that had the value of """" empty string resulted in returning module in our module method. Move to using the null-terminating output from Git for easier parsing, just like we use for the other read-commands. The module method didn't have this issue as it was already using module."
1078,Merge pull request #212 from mjcheetham/msauth-choice,Allow user to override which interactive authentication flow used for MS auth
1079,azdev: use the localhost redirect URI for VS's client ID,"Use the localhost redirect URI specified in the VS AAD application configuration. The localhost option allows us to use the system web view, whereas 'urn:ieft:wg:oauth:2.0:oob' does not."
1080,msauth: allow user to select auth flow type,"Allow the user to override which Microsoft authentication flow to use when interaction is required. The options available are:  - embedded web view  - system web view  - device code Previously we always picked one of these flows (or used a native external helper) to use. In some instances it may be desirable for the user to force a particular flow, for instance to take advantage of browser sign-in state or OS integrations by using 'system'. If no option is set, or module is selected the existing behaviour is preserved (we pick for the user)."
1081,Merge pull request #208 from microsoft/master,Cut another release with fix to macOS publishing
1082,Merge pull request #207 from mjcheetham/osx-realsign-fix,osx-sign: fix macOS release build sign/upload
1083,osx-sign: fix macOS release build sign/upload,"Fix the macOS real-signed release build YAML files to also create the product archive (not just the component package), and upload and sign that instead."
1084,Merge pull request #206 from microsoft/master,Release GCM Core with various fixes and new Windows user-installer
1085,Merge pull request #203 from mjcheetham/fixtypowin,"Make the system installer always append GCM Core entries, not outright set/replace existing values (and fix a typo)"
1086,Merge pull request #205 from mastercoms/patch-1,Fix missing space in username input
1087,fix missing space in username input,this caused the preceding argument to fail due to lack of separation between args
1088,Merge pull request #204: Actions: use workflow_dispatch for manually running workflows,See [1] for more information. [1] https://github.blog/changelog/2020-07-06-github-actions-manual-triggers-with-workflow_dispatch/
1089,Actions: use workflow_dispatch for manually running workflows,See [1] for more information. [1] https://github.blog/changelog/2020-07-06-github-actions-manual-triggers-with-workflow_dispatch/ Signed-off-by: Derrick Stolee link
1090,git: fix --get-all output parsing bug,Since --null means that each config entry terminates with a null character ('\0') we are left with one extra entry in the array after splitting the string. This is NOT a real entry and we shouldn't return it from the method.
1091,azrepos-cfg: only clear useHttpPath on Windows if no manager-core,"Only clear the useHttpPath=true option on calls to unconfigure if the ""manager-core"" option is not present and we're in the system config on a Windows platform. This would be the case for the bundled GCM Core in Git for Windows, which we would break by removing this option."
1092,git: better gitcfg error and trace messages,
1093,configure: handle subsequent empty entries after GCM,"If we have empty helper entries after GCM, then we should attempt to reconfigure to put GCM back ""at the front"", since otherwise it's effectively being disabled by those subsequent empty entries."
1094,git: drop the redundant 'Value' from Get/Set methods,
1095,git: add --get-all and --add Git config commands,"Add the --get-all and --add Git configuration commands, and use them in place of --get-regexp and --replace-all where applicable."
1096,configure: append GCMCore even in system case,"Rather than set the helper to be only GCM Core in the system configuration when called with module, we do what we are already doing in the user-case. We only append an empty ("""") reset entry, and then the GCM full path entry. This means on uninstall of the standalone GCM (be that the system or user install), we restore the previous entry, always."
1097,windows: fix a typo in the user windows installer,
1098,Merge pull request #197 from mjcheetham/winstall-split,Split Windows installer in to user/system flavours
1099,Merge pull request #201: Setup Microsoft ESRP Signing for .deb installer,"This adds a new workflow build-installers.yml, where hopefully we can either migrate all installer builds in the future (or rename and split them across the platforms.) This workflow is heavily dependent on a lot of internal Microsoft infrastructure. What we have so far results in a GPG signed .deb for GCM-Core. This is currently uploaded as an artifact on the workflow itself but it not yet published. The 3rd and last build job yet to be added is using setting up yet another internal tool with the right security to use our internal publishing service. This does the signing, but does not actually publish the package to the Microsoft package feed. Replaces #170."
1100,Merge pull request #202 from mjcheetham/osxinstall-fixwording,Fix incorrect wording of installer welcome msg
1101,osx: fix incorrect wording of installer welcome msg,Fix the incorrect wording of the macOS installer welcome screen. We do not configure different gitconfig files depending on the install mode - we always update the current user's gitconfig only.
1102,Merge pull request #198 from mjcheetham/osx-installv2,Update the Mac installer to make a product archive package/installer
1103,Merge pull request #199 from mjcheetham/install-fix,Update the configure command to set the full path to GCM Core
1104,windows: split Windows installer in to user/system,"Split the Windows installer into two versions: a single-user installer, and a system-wide installer. The old installer installed in Program Files (x86) and set the system Git configuration, which is now what the system-flavoured installer does. The new single-user installer places files in %LOCALAPPDATA% and updates the ~/.gitconfig (global) user Git configuration instead. The benefit of the single-user installer is that it does not require an administrator to install it, and doesn't affect other users of the system."
1105,configuration: update config cmd to set full path,"Update the configure and unconfigure actions to now set the full file path to GCM Core, rather than rely on module resolving to module on the PATH by Git. This was a problem because Git for Windows now bundles GCM Core, and even if a standalone install of GCM Core was present on the system with a higher version, since the bundled copy is found on the PATH before anything else, Git was always picking the old one. The change to using full paths helps fix this issue, and also another issue on macOS where sometimes the /usr/local/bin directory is not on the PATH (such as for the root user, or during a postinstall script for a flat-package [.pkg] file)."
1106,Release: build and sign Linux installers,"This launches a job that downloads the ESRP signing tool client, then loads it with the necessary information for our signing abilities. Finally, it publishes our signed .deb to the build artifacts. Signed-off-by: Derrick Stolee link"
1107,Signing: add python script for Linux signing,The .github/run_esrp_signing.py script is executed on the signing machines. This mostly accumulates a set of JSON input files before running the ESRP signing tool that was securely downloaded. Signed-off-by: Derrick Stolee link
1108,.gitignore: ignore signing outputs,Signed-off-by: Derrick Stolee link
1109,Merge pull request #200: Just two tiny typos,
1110,Just two tiny typos,
1111,git: ensure that Git config quotes cmd args,"Ensure that we are correclty quoting arguments to Git configuration commands. We must ensure double-quotes are escaped correclty, and also any runs of back-slashes ('\') are preserved UNLESS a double-quote ('""') follows."
1112,osx: update the Mac installer to make product archives,"Update the macOS installer build to also create a distribution/product archive package, that contains the flat component package we were already building. The product archive allows us to do things like set welcome and conclusion messages, titles, and display a license (like the Windows installers do). In the new welcome and conclusion screens we include helpful links and instructions on how to uninstall GCM Core, and how to configure it for other users on the system. The macOS installer continues to install in a global location, but only configure the user's global Git configuration."
1113,Merge pull request #196 from mjcheetham/fix-wia,Fix bug where Allow Windows Integrated Authentication setting default wrong
1114,wia: fix bug where Allow WIA setting default wrong,"Fix a bug where the 'Allow Windows Integrated Authentication' setting was evaluating to module when unset, rather than module as per design and the documentation."
1115,Merge pull request #195 from microsoft/gh-patdoc-update,Update GitHub auth change document PAT link
1116,Update GitHub auth change document PAT link,"Update the GitHub auth change document PAT link to auto-select the module, module, and module scopes."
1117,docs: add GitHub auth API deprecation docs,Add documentation regarding the upcoming removal of user/pass access to the authorizations API on GitHub. Outline how to upgrade to GCM Core from GCM4W to fix.
1118,Merge pull request #187 from mjcheetham/winget,winget: update winget pkg on release
1119,winget: update winget pkg on release,Automatically create a new PR to update the winget package for GCM Core on release.
1120,Update readme to say Linux support is in preview,
1121,Merge pull request #185 from mjcheetham/docupdate,Update readme and FAQs and drop preview wording
1122,docs: update readme and FAQs; drop preview wording,"Update the readme and FAQ documentation to include Linux preview support, and elevate macOS and Windows from ""preview"" to GA."
1123,Merge pull request #184 from microsoft/master,Cut new release to fix deadlock with large Git configs
1124,Merge pull request #183 from dscho/avoid-deadlocks-when-reading-the-config,gitconfig: avoid deadlock on large amounts of config data
1125,gitconfig: avoid deadlock on large amounts of config data,"As per the Remarks section in https://docs.microsoft.com/en-us/dotnet/api/system.diagnostics.processstartinfo.redirectstandardoutput we should first read the output until the end before waiting for the module process to finish, to avoid deadlocks. This indeed helps in the situation of this developer whose config is so large that module produces 25 kilobyte worth of output. Apparently, this fills up some buffer that seems to be around 8kB and then module waits for its output to be consumed, and before this patch, the consumer (i.e. GCM Core) would wait for module to exit already."
1126,Merge pull request #179 from kyle-rader/user/kyrader/support-email,Linux build script updates
1127,Update src/linux/Packaging.Linux/build.sh,Co-authored-by: Matthew John Cheetham link
1128,Update src/linux/Packaging.Linux/build.sh,Co-authored-by: Matthew John Cheetham link
1129,Update src/linux/Packaging.Linux/build.sh,Co-authored-by: Matthew John Cheetham link
1130,Merge pull request #181 from microsoft/master,New release to fix Linux web browser launching
1131,Merge pull request #180 from mjcheetham/fix-webopen,Disconnect standard output/error streams from module and friends
1132,oauth: disconnect streams from xdg-open,"When using the module class to open the user's default browser on Linux, utilities like module are used. Some of these utilities do not disconnect child processes from our standard input/output/error streams. At the same time, browsers like Chromium like to write to stdout and stderr, which gets fed back to Git or the user's terminal, respectively. The latter looks messy, and the former causes Git to fail. On Linux, we instead manually locate a suitable 'shell execute' utility and launch them directly - this way we can redirect the standard output/error streams. For Windows and macOS, this is not an issue and we continue to use the Framework code to do 'shell execute'."
1133,env: introduce TryLocateExecutable method,"Introduce a module method version of the existing module method on module, for locating executables with module and module."
1134,Update support email and github url and run on pushes to release,
1135,Merge pull request #176 from microsoft/master,Fix previous release (linux support) by adding config bug fix
1136,Merge pull request #175 from mjcheetham/fix-config,Fix bug in Git configuration filtering logic
1137,gitconfig: ensure config filter is passed down,"Ensure the desired GitConfigurationLevel is passed to the GitConfiguration object so that the correct filter level can be selected. This is not so important for reading keys, but will fail when modifying keys since you need to specific which configuration level to edit. This bug resulted in calls to module to fail. Add some tests of the config methods that modify values."
1138,Merge pull request #173 from microsoft/master,"Create new release including ""alpha"" Linux support"
1139,Merge pull request #174 from microsoft/linux-release-build,Add Linux Azure Pipelines release
1140,linux: add Linux Azure Pipelines release,
1141,Merge pull request #172 from mjcheetham/linux-credstores,Add a variety of credential stores on Linux
1142,linux-credstore: extract credstore option constants,Extract the Linux Credential Store option constant values.
1143,docs: add docs for configuring Linux cred stores,Add a document outlining the different credential stores available on Linux.
1144,gpg-credstore: add GPG/pass based credential store,"Add a module compatible credential store that uses GPG to store encrypted credentials in files on disk. Defaults to the default module password store, but can be overriden using standard module envars."
1145,"tests: introduce ""Posix"" and ""All"" PlatformFact support","Refactor the PlatformFact attribute to support a flags enum, such that compound platforms can be specified (e.g., Posix = Linux | Mac)."
1146,plaintext-credstore: add plaintext credstore,"Add a plaintext credential store option for Linux. Credentials are stored in plaintext files, by default in ~/.gcm/store, but configurable by settings/environment variables. Users can select between the Secret Service API and plaintext-based credential storage using the GCM_CREDENTIAL_STORE setting."
1147,credstore: change contruction of existing credstores,"Change how we construct the existing credential stores by simply new-ing them up, rather than calling a static module method."
1148,Merge pull request #171 from mjcheetham/gh-oauthonly,Remove username/password authentication for GitHub.com
1149,"github: fix a typo in ""DotCom"" (- ""DotDom"")",Fix a typo in a constant variable indicating the available authentication modes for GitHub.COM.
1150,github: remove user/pass auth for GitHub.com,"Now that we have the GCM OAuth application in the allow-list for GitHub apps, we no longer need to offer username/password authentication for GitHub.com!"
1151,Merge pull request #162 from mjcheetham/newcred2,Revamp credential storage system to allow for smarter searching
1152,environment: fix environment process locator,"Fix a bug in the WindowsEnvironment implementation of the LocateExectuable method. On .NET Core the UseShellExecute property of ProcessStartInfo defaults to false, whereas on .NET Framework (the runtime that we target on Windows) defaults to true. You must set this to false if you want to redirect standard streams (which we want to do). The .NET Framework-targeting build on Windows was throwing an exception here(!)"
1153,docs: update documentation to reflect changes,Update the GCM Core Host Provider spec document and architecture document to reflect the changes made to the abstract HostProvider class; replacing GetCredentialKey with GetServiceName.
1154,credstore: add support for custom cred namespaces,"Add support for customising the namespace/prefix used to store credentials in the OS credential store. By default we use ""git:{service}"". Users can use GCM_NAMESPACE or credential.namespace to set this to something different. These configuration options are the same as in GCM for Windows to help with migration."
