Index,Message,Description
1,Return GitHub PAT token from view model (#1241),Fix a bug in the in-proc UI logic for returning the personal access token. We were accidentally returning the password field rather than the token field for PATs.
2,github: return PAT token from view model,Fix a bug in the in-proc UI logic for returning the personal access token. We were accidentally returning the password field rather than the token field for PATs.
3,Lazily initalise the HttpClient for the Bitbucket OAuth2ClientRegistry (#1239),Lazily acquire the module instance from the factory inside of the module. There is a relatively large cost to creating a new module instance (especially the first; due to config reading) that is being paid each time we just register the entire Bitbucket host provider. Whilst we are here also cleanup some of the styling/field naming in this class to be consistent with the rest of GCM. This saves approximately 120ms of startup time.
4,bitbucket: guard against disposing a null ref,
5,bitbucket: lazily init the HttpClient for OAuthRegistry,Lazily acquire the HttpClient instance from the factory inside of the OAuth2ClientRegistry. There is a relatively large cost to creating a new HttpClient instance (especially the first; due to config reading) that is being paid each time we just register the entire Bitbucket host provider. Whilst we are here also cleanup some of the styling/field naming in this class to be consistent with the rest of GCM.
6,Fix several UI bugs in 2.1 pre-release (#1238),Fix a few bugs that were spotted during testing of the 2.1 pre-release:  Missing Atlassian logo resource from the compiled binaries Remote URL is shown even for Bitbucket cloud with in-proc GUI In-proc basic auth GUI user name field should only be set if non-null or whitespace  Also bump the VERSION to 2.1.1 in the expectation for this to replace 2.1.0.
7,version: bump to 2.1.1.0,
8,basic-auth: only set username if not-null,
9,bitbucket: only show URL if not Bitbucket Cloud,Only show the URL if the remote is NOT Bitbucket Cloud in the in-proc UI. This is same behaviour as the helper UI.
10,bitbucket: include Atlassian logo resource,Make sure to include the Atlassian logo as an AvaloniaResource so it's included in the compiled binaries.
11,Merge branch 'release' into main,
12,Add support for using the current Windows user for WAM on DevBox (#1197),"Add the ability to configure MSAL to use the default OS account when the broker is enabled. Also detect when we are in a Microsoft Dev Box environment, and if we are, then default to enabling the new setting (and enable WAM). Show a confirmation prompt before continuing to use the current OS account, which is similar to how Microsoft Teams operates. image Left: Avalonia UI, Right: fallback WPF window Fixes #917"
13,build(deps): bump DavidAnson/markdownlint-cli2-action from 10.0.0 to 10.0.1 (#1232),Bumps link from 10.0.0 to 10.0.1.
14,build(deps): bump DavidAnson/markdownlint-cli2-action,Bumps link from 10.0.0 to 10.0.1. - link - link  updated-dependencies: - dependency-name: DavidAnson/markdownlint-cli2-action   dependency-type: direct:production   update-type: version-update:semver-patch ... Signed-off-by: dependabot[bot] link
15,versioning: transition from nerdbank to version file (#1231),"With the link, it became clear that link was no longer an option for versioning the project. This is because module requires history to calculate things like link, and the formula requires a tarball to build, which, of course, has no history. This change pivots GCM to the simpler strategy of using a version specified in a module file at root. This version will be updated by maintainers prior to release - giving them more granular control of versioning, which in turn allows for versioning to be more predictable (i.e. maintainers will know what the version will be before publication of the release). The version specified in the file is the one slated for the next release: module. Note: This change link due to a link unless we ensure all projects have at least 1 dependency. We are working around this issue by adding Newtonsoft.Json as this dependency (since we were already shipping it anyway)."
16,workflows: update checkout actions,"Remove fetch-depth from checkout actions, since that was required by Nerdbank.GitVersioning. Also take this opportunity to use consistent version and naming for checkout actions."
17,version: remove nerdbank tasks,Remove Nerdbank.GitVersioning tasks (which have been superceded by the use of the new VERSION file) from the release workflow.
18,version: update release workflow versioning,"Update release workflow to use VERSION file for versioning, rather than Nerdbank.GitVersioning."
19,version: replace nerdbank with version file,"Remove Nerdbank.GitVersioning dependency from project in favor of a new VERSION file, which will be updated ahead of each release. Versioning in this file will begin with the version we plan to use for the next release: 2.1.0.0. This change involves the addition of a new custom MSBuild task, which reads in the contents of the VERSION file, converts it to a Version object, and then sets the various version-related MSBuild properties with the correct value (some with the module component appended, others without). Note that there is a bug in MSAL link that causes build failures for projects without dependencies with this change. We add Newtonsoft.Json as a global dependency in Directory.Build.props to work around this problem until the fix is released."
20,build(deps): bump DavidAnson/markdownlint-cli2-action from 9.0.0 to 10.0.0 (#1223),Bumps link from 9.0.0 to 10.0.0.
21,docs: add trace2 to config/env documentation (#1230),Add Trace2 config/env var options to GCM's configuration/environment documentation to improve discoverability.
22,docs: add trace2 to config/env documentation,Add Trace2 config/env var options to GCM's configuration/environment documentation to improve discoverability.
23,Add Git configuration options for trace & debug (#1228),Add options for enabling tracing and debugging in Git configuration. Today the below options were only supported via environment variable:  module module module module
24,settings: add git cfg options for trace & debug,Add options for enabling tracing and debugging in Git configuration. Today the below options were only supported via environment variable:  GCM_TRACE GCM_TRACE_SECRETS GCM_TRACE_MSAUTH GCM_DEBUG
25,build(deps): bump DavidAnson/markdownlint-cli2-action,Bumps link from 9.0.0 to 10.0.0. - link - link  updated-dependencies: - dependency-name: DavidAnson/markdownlint-cli2-action   dependency-type: direct:production   update-type: version-update:semver-major ... Signed-off-by: dependabot[bot] link
26,docs: add link to dotnet sdk,"Add link to the install instructions for the dotnet SDK. Note that, due to installation instructions differing based on the distro and version users are running, the best we are able to do is link to the page that provides further links for users to follow to use their respective package managers to install."
27,devbox: enable msauth default account and broker in devbox,"Detect when we are in a Microsoft Dev Box environment, and if we are, then default to enabling the default OS account setting and enabling WAM."
28,msauth: use default OS account when enabled,Add the ability to configure MSAL to use the default OS account when the broker is enabled. Default to disabled.
29,Make Avalonia UI the default on all platforms and move in-process (#1207),"Today GCM has an architecture that delegates all GUI prompting to (bundled) external executables, using WPF-based helpers on Windows and Avalonia UI helpers on Mac and Linux. Each host provider has its own GUI helper executable, meaning we currently bundle four (GitHub.UI, GitLab.UI, Atlassian.Bitbucket.UI, git-credential-manager.ui [for generic auth]) helpers in addition to the core git-credential-manager CLI executable. On Linux we use the ""publish as a single-file"" model for each of these executables, meaning we have a copy of the CLR included for each executable! That means five CLRs! Now that the Avalonia UI-based GUI helpers have matured, we can look at dropping the WPF helpers and reduce the effort required to ship new GUI by 50% (we no longer need to do everything twice: once with WPF and once with Avalonia UI). In addition, in a recent spike, I found that it may be possible to bring the Avalonia UI helpers in-process, with nearly zero net-new code. This would help reduce our installation footprint on Linux down to approximately 1/4 of the current size. The single executable model would also help decrease build times, and increase end-user performance since we no longer pay the process startup costs using external processes! We need to be mindful that this change may result in a small increase in the Windows installation as we now bring in extra libraries used to support Avalonia UI, whereas previously we relied on WPF libraries as included with Windows 'for free'. This is expected to be minimal. As for the current GUI extensibility model, we are not aware of any consumers, but it would not be much effort to keep the existing external process model, but now just default to using our in-process GUI options in the absence of external configuration. This still gives tools like VS or VSCode options to integrate native UI for GCM in the future. Initially, we are still keeping the WPF helpers around on Windows but disabled by default. We can drop these after at least one release using the in-proc Avalonia helpers. To switch back to the WPF helpers, use module or module."
30,windows: simplify Inno setup defn and reduce payload size,"To keep the size of the Windows distribution small, directly target the Win32 Avalonia packages rather than the Desktop package that includes macOS and Linux dependencies."
31,ui: draw window border on windows,
32,ui: fix textbox layout bug in v11,
33,ui: workaround AvaloniaUI/Avalonia #10296,
34,ui: add app version to about window,
35,ui: enable IDE Avalonia designer,
36,ui: fix deadlock in Avalonia runloop start on Windows,
37,ui: use custom window chrome on Windows,
38,ui: support dark theme base colour resources,Support dark theme resource dictionaries.
39,ui: target latest version of AvaloniaUI,
40,ui: only include Avn.Diagnostics in debug,
41,gitlab: move logos to resource files,
42,gitlab: simplify terminal/interaction checks,"Simplify where we check for user interaction and/or terminal prompts during authentication, to only need to check at the start of each module call. Note that is is a behaviour change - we now require user interaction to be allowed to perform authentication even with only 1 mode available. This is technically more 'correct' because when the user disables interactivity, we should never require interaction to continue. Although we are not asking the user to select a mode of authentication, we still either need them to enter a username/password, or respond to a browser OAuth flow."
43,gitlab: add in-proc UI implementation,
44,github: add in-proc UI implementation,
45,bitbucket: add in-proc UI implementation,
46,oauth: add in-proc UI implementation,
47,basic: add in-proc UI implementation,
48,docs: add bitbucket app password requirements (#1213),"Separate instructions for authentication into a new module file. For Password/Token authentication, add a callout that, when using an App Password, account read permissions are required. Closes #1119"
49,docs: add bitbucket app password requirements,Separate Bitbucket Authentication information for users from development information for developers. Use this opportunity to also add the permissions requirements for users attempting to authenticate to Bitbucket with an App Password.
50,build(deps): bump lycheeverse/lychee-action from 1.6.1 to 1.7.0 (#1206),Bumps link from 1.6.1 to 1.7.0.
51,ui: add window parent/cancellation helpers,
52,ui: set default GUI window title,
53,ui: default to showing GCM branding in generic prompts,
54,ui: use in-proc by default with fallback option for WPF,"Default to using the in-proc Avalonia GUI on all platforms, with a fallback flag that can be set on Windows to continue to use the legacy WPF, out-of-proc UI helpers."
55,gitlab: extract Helper and TTY prompt methods,
56,github: extract Helper and TTY prompt methods,
57,bitbucket: extract Helper and TTY prompt methods,
58,oauth: extract Helper and TTY prompt methods,
59,basic: rename ByUi method to ViaHelper,
60,gitlab: merge .UI.Avn and .UI in to GitLab,
61,github: merge .UI.Avn and .UI in to GitHub,
62,bitbucket: merge .UI.Avn and .UI in to Atlassian.Bitbucket,
63,gcm-ui: merge GCM.UI.Avn in to Core,
64,core: merge Core.UI.Avn and Core.UI into Core,
65,gcm: set up message pump in main GCM executable,"Set up a message pump on the main thread in the primary GCM executable in preparation to adding in-process, AvaloniaUI-based UI. Also move to explicitly shutdown the dispatcher correctly rather than just killing the process."
66,wpf: add .Windows to WPF project namespaces,Add the .Windows suffix to the WPF project namespaces to prevent name collisions that would otherwise occur in future commits where the Avalonia UI types are to be merged in to the core projects. Also clean up some unused XML namespace imports.
67,wpf: explicitly target WPF Dispatcher object,"Explicitly target the WPF Dispatcher type using the fully qualified type name to prevent an ambiguous reference that would otherwise occur in upcomming commits where the Avalonia Dispatcher, and the GCM Dispatcher are merged in to the Core project."
68,wpf: rename DialogWindow to WpfDialogWindow,Rename the WPF implementation of DialogWindow to prevent name collisions that would otherwise occur in upcoming commits where we merge the Avalonia implementation of DialogWindow into the Core project.
69,gcm-ui: fix WPF device code view namespaces,
70,build(deps): bump lycheeverse/lychee-action from 1.6.1 to 1.7.0,Bumps link from 1.6.1 to 1.7.0. - link - link  updated-dependencies: - dependency-name: lycheeverse/lychee-action   dependency-type: direct:production   update-type: version-update:semver-minor ... Signed-off-by: dependabot[bot] link
71,Update MSAL libraries and use new MSALRuntime-based broker implementation (#1191),"Use the new Windows broker which is based on the MSALRuntime; an export wrapper around a native, cross-platform MSAL library. In this new set up, we drop the module package in favour of the module package that also means we drop the WebView2Loader.dll, which we didn't make use of anyway. There are a few new binaries to be distributed in the new model, including a P/Invoke layer, IdentityModel abstractions library, and the native module. Note that GCM still only support x86 on Windows, and only supports broker use on Windows. For this reason we don't bother adding the broker package on non-.NET Framework builds to keep the sizes on Mac/Linux to a minimum. Also update the MSAL extensions library whilst we are here to pick up various bug fixes, and drop workarounds that are no longer required for this new broker implementation!"
72,readme: add link to project roadmap (#1204),Add link to the new GCM roadmap to the README to increase discoverability.
73,readme: add link to project roadmap,Add link to the new GCM roadmap to the README to increase discoverability.
74,msauth: update MSAuth flow comment to reflect today,Update the large block comment on how we select which types of flows to use for Microsoft authentication.
75,msauth: use dummy window for WAM if no parent,"If we are unable to get a parent window handle; because for example, we don't have a console, then create a small 'dummy' window using WinForms that we can use to pass a handle to MSAL."
76,Catch OAuth refresh token errors for generic provider (#1196),"In case we have an existing refresh token, but it has expired or been revoked, we should gracefully fall back to performing an interactive OAuth flow."
77,generic: catch OAuth refresh token errors,"In case we have an existing refresh token, but it has expired or been revoked, we should gracefully fall back to performing an interactive OAuth flow."
78,docs: update configure command for install from source,The current install from source instructions are out of date - they still recommend using module rather than module. Update the documentation to instruct users to run the correct command.
79,msauth: always set the parent window for MSAL,"Always set the parent window handle for MSAL on Windows. Previously we only set this if provided a handle by the user/config. Now however we must always try and provide a handle because using the new MSALRuntime-based Windows broker means we must do so - MSAL no longer provides us with a 'dummy' handle to use. Use the parent console window handle, as recommended by the MSAL docs: https://github.com/AzureAD/microsoft-authentication-library-for-dotnet/wiki/wam#parent-window-handles"
80,msauth: use new Windows broker based on MSALRuntime,"Use the new Windows broker which is based on the MSALRuntime; an export wrapper around a native, cross-platform MSAL library. In this new set up, we drop the module package in favour of the module package that also means we drop the WebView2Loader.dll, which we didn't make use of anyway. There are a few new binaries to be distrubuted in the new model, including a P/Invoke layer, IdentityModel abstractions library, and the native msalruntime_x86.dll. Note that GCM still only support x86 on Windows, and only supports broker use on Windows. For this reason we don't bother adding the broker package on non-.NET Framework builds to keep the sizes on Mac/Linux to a minimium."
81,msauth: update MSAL library packages to latest,
82,Fix app path name of Windows dropping file extension (#1181),"During some refactoring we accidentially introduced an error in the 'app path' on the CommandContext`; rather than trimming the file extension off (for detection of the old executable name on Windows) on a local copy, we are now updating the app wide copy! Only mutate a local copy."
83,main: fix app path name of Windows dropping exe,"During some refactoring we accidentially introduced an error in the 'app path' on the module; rather than trimming the file extension off (for detection of the old executable name on Windows) on a local copy, we are now updating the app wide copy! Only mutate a local copy."
84,issue templates: remove core suffix (#1180),"The Authentication Issue template currently directs users to run module rather than module, which results in a warning regarding the removal of the core suffix. This change corrects the applicable commands so that users will not see this warning."
85,Ensure we start child processes created with module (#1177),Ensure that we actually start processes (and check they have started correctly) using the new ProcessManager/ChildProcess abstractions. Fixes #1170 Replaces #1171
86,issue templates: remove core suffix,"The Authentication issue template currently directs users to run module rather than module, which results in a warning regarding the removal of the core suffix. This change corrects the applicable commands so that users will not see this warning."
87,procmgr: ensure we start processes,Ensure that we actually start processes (and check they have started correctly) using the new ProcessManager/ChildProcess abstractions.
88,Target *-latest runner images in CI workflow (#1178),"We are using the module runner images for release builds (link, link), but for CI we're instead using module, module, and module (alongside module). Let's run CI against the latest of all three OS images to match what we're using to build release bits. Ubuntu 18.04 is also link as a GitHub hosted runner."
89,workflows: target *-latest runner images,"We are using the *-latest runner images for release builds, but for CI we're instead using ubuntu-18.04, ubuntu-20.04, and windows-2019 (alongside macos-latest). Let's run CI against the latest of all three OS images to match what we're using to build release bits."
90,Cache Git configuration used in Settings for the lifetime of the process (#1172),"When enumerating all Git configuration values in module, we currently cache a copy of all values for the lifetime of the module method. This saves us some calls to Git, but we can do better. Pull-up the cache of Git configuration entries to the lifetime of the module object, meaning all calls to module over the lifetime of the process can benefit from the cache! The savings here can be significant as each module property typically results in a call to module. Whilst in this space we can fix a couple of bugs:   We were not calling module for module variables when resolving settings, and instead consulting the cache first. We always want to go to Git for these types of values.   We were not using the existing cache for unscoped entries!   In my limited testing this results in a 2-3x speedup in calls to module!"
91,settings: replace module with module when we know,"We have already checked module is true before calling module, so let's just pass module in these calls."
92,settings: cache Git config values across process,"When enumerating all Git configuration values in module, we currently cache a copy of all values for the lifetime of the module method. This saves us some calls to Git, but we can do better. Pull-up the cache of Git configuration entries to the lifetime of the module object, meaning all calls to module over the lifetime of the process can benefit from the cache! The savings here can be significant as each module property typically results in a call to module."
93,settings: use cached Git config entries for unscoped vars,"Use the cached copy of Git configuration entries not only for URL-scoped keys, but unscoped keys too!"
94,settings: fix bug in path-type setting reading,"If we are asked for a path-type setting then we should always consult Git directly for the value, and not used cached copies of values that were acquired using module without a module parameter."
95,trace2: add regions (#1162),"Add module region tracing capability. The first six commits contain minor refactors, bug fixes, and cleanups. The first moves Trace2 messages into their own file. The second removes the unnecessary module method. The third fixes certain conflated timing information in module and module events. The fourth ensures we're writing exit message times in UTC. The fifth adds descriptive comments to Trace2-related classes that did not yet have them. The sixth adds best-effort logic to capture thread names. The next three commits are dedicated to preparing for and adding region-related logic. The seventh commit updates custom performance format span handling to account for the repo and category fields, which are used in region tracing. The eighth adds region-related events, encapsulated in a class that inherits from module (which in turn inherits from module). The ninth adds region tracing to methods of interest pertaining to OAuth authentication. The final commit updates GCM's documentation to inform users of how to enable and utilize Trace2 tracing. A final note: This implementation does not support nested regions, as it is not required for the current regions of interest."
96,trace2: documentation,Document how users can set up and utilize the Trace2 API.
97,trace2: add regions to OAuth,Add region tracing to key methods in OAuth2Client. This was deemed a good starting point for regions due to the server interaction required to obtain tokens. Additional regions can and should be added to additional sections of the code that are deemed performance-critical in the future.
98,trace2: add region infrastructure,"Add supporting infrastructure for regions. This includes the normal module methods in Trace2 and corresponding Trace2 messages with a few notable distinctions:  There is an abstract parent RegionMessage that inherits from Trace2Message. The RegionEnterMessage and RegionLeave messages inherit from this parent (rather than Trace2Message) to maximize reuse of shared fields. We create a new Region class that implements DisposableObject and call it using a CreateRegion method in Trace2. This ensures that we call WriteRegionLeave before a Region object is disposed - a key requirement of Git's Trace2 API for regions.  Additionally, it allows us to manage getting the executing thread name and region timings within the class, thus removing this burden from consumers.  An additional note is that the region_enter and region_leave events will always have the same line number with this model. This was deemed to be acceptable, however, given that knowing where a region begins executing provides enough information for inspection of the region if it is needed."
99,trace2: update span handling,"Previously, we only set up custom performance format span handling for time-related information (see [1]). However, with the upcoming introduction of regions, we will need custom spans for the category and repo strings. This change refactors and adds to the current logic to correctly handle all 3 span types (i.e. time, repo, and category). [1] 59a2692"
100,trace2: capture thread name,"With the upcoming introduction of regions, we will need to capture thread names. This change adds a new static BuildThreadName() method that defines a thread name by:  Determining if it is the entry thread and, if so, calling it ""main"", per Trace2 convention. If it's not the main thread, determining whether it is a thread pool thread and naming it with a static prefix and the thread pool thread id. If it is not the entry thread or a thread pool thread, use the thread name, if it has one. Return an empty string if none of the above are true."
101,trace2: add comments,Add descriptive comments to Trace2-related classes that currently do not have any.
