Index,Message,Description
692,registry: speed up auto-detect and make more robust,"Speed up the auto-detection mechanism in the HostProviderRegistry by setting a short(er) timeout on the probing network call (2 seconds). The default value from the framework is otherwise 100 seconds(!). We introduce a setting for the user to be able to configure this timeout value with the granularity of 1 millisecond. Another problem that occured with this network call was crashes due to TLS configuration issues. The network call was not wrapped in a try-catch block which meant that the entire process would crash if there was a problem. This isn't ideal for what is supposed to be a ""best effort"" feature. Here we wrap the HEAD call in a try-catch and display an appropriate warning message to the user. For completeness, add documentation that explains the auto-detection feature, how to configure the timeout, and how to disable this network call."
693,http: only wait for headers in HEAD calls,"Speed up HTTP HEAD calls made via the HeadAsync extension method by only waiting until the headers have been received, rather than the entire message content."
694,Merge pull request #480 from mjcheetham/fix-winstall,Add missing assemblies/files to Windows installer
695,Merge pull request #479 from nimatt/patch-1,Added missing quotes in WSL instructions
696,windows: add missing assemblies/files to Windows installer,"Add missing assemblies and files to the Windows installer setup script. Since the introduction of the shared UI view models between WPF and Avalonia, we neglected to include the new assemblies in the Windows installer package! Also include the NOTICE file that was left out."
697,Merge pull request #478 from mjcheetham/gh-device-ui,Add explicit GitHub device code authentication option
698,docs: update docs for new GitHub auth modes,Update documentation to include the new module and module authentication modes for GitHub. The old module value expands to both module for compatibility.
699,github: add explicit device code auth mode to UIs,"Add the device code option to the Avalonia and WPF helper UI applications for GitHub. This includes adding a new explicit ""device code"" button to the primary authentication prompt view, and a new device code display prompt."
700,github: implement explicit device code flow option,"Implement an explicit OAuth device code authentication mode for the GitHub host provider. Previously the 'web browser' option combined both the interactive/browser based flow (when a UI was present), and a TTY-based device code flow. This change allows users to select the device code flow even when they have a desktop/UI session present. This is useful to workaround possible problems with the browser loopback/redirect mechanism."
701,Added missing quotes in WSL instructions,One of the commands for WSL configuration was missing quotes which resulted in invalid configuration.
702,github: consolidate helper options; add --all option,"Consolidate all the UI helper options for the GitHub module view in to an module class (rather than bloat the execution handler with more arguments). Also fix a bug whereby the GitHub host provider would attempt to invoke the UI helper with an module option when all authentication modes are available, but no such option is available! This option was only available on the old WPF UI helper, and was never carried forward to the Avalonia UI."
703,github: rename OAuth authmode to Browser,Rename the OAuth GitHub authentication mode to Browser to better match what interaction will happen when selecting this mode. Also prepare for the introduction of an explicit device code OAuth flow mode.
704,Merge pull request #472 from mjcheetham/combined-ui,Combine WPF and Avalonia UI view models and commands
705,avalonia: update to Avalonia 0.10.7,"Update to the latest version of Avalonia to fix various rendering problems including, shadow issues on macOS, and DPI issues on macOS. Fixes #408."
706,bitbucket: reimplement credential and OAuth views,"Reimplement WPF views for the Bitbucket credential and OAuth prompts. The layout is largely unchanged, but now more closely matches the Avalonia layout/implementation of these views."
707,bitbucket: add stub WPF-based UI helper for Bitbucket,
708,github: reimplement credential and 2FA WPF views,"Reimplement WPF views for the credential and 2FA GitHub prompts. The layout is now much simpler, and matches the Avalonia-based UI."
709,github: readd WPF GitHub divider and 2FA controls,Reimplement/readd the WPF-based GitHub horizontal divider and six digit (2FA code) controls.
710,github: add stub WPF-based UI helper for GitHub,
711,wpf: readd WPF UI/threading helpers,
712,wpf: readd shared WPF controls and styles,"Readd various WPF shared controls and styles including:  DialogWindow control PromptTextBox control WPF converters Password Prompt control   Reintroduce a password text box control, that supports watermarked text   when empty. This is the same control as before, except now it uses a   plain System.String, rather than a SecureString (which is pointless in   practice).  wpf: readd shared WPF styles and colours"
713,wpf: delete old WPF UI helpers for BB and GH,"Delete the old WPF-based UI helpers for both Bitbucket and GitHub. These will be rebuilt using the view models, commands, and architecture extracted from the Avalonia-based UI helpers."
714,xui: target netstandard2.0 for shared UI projects,Change the target for the shared projects to .NET Standard 2.0 so they can be referenced from .NET Framework 4.7.2 and .NET 5 projects.
715,bitbucket: split Avalonia UI from agnostic VM/cmds,"Extract Avalonia specific components from the Bitbucket UI helper in to their own project. The remaining agnostic components (view models, commands) can be shared with the WPF implementation."
716,github: split Avalonia UI from agnostic VM/cmds,"Extract Avalonia specific components from the GitHub UI helper in to their own project. The remaining agnostic components (view models, commands) can be shared with the WPF implementation."
717,xui: extract Avalonia specific pieces from shared UI project,"Pull out all Avalonia specific components from the shared UI project. This will later allow us to share the agnostic shared UI project components with the WPF implementation of the UI helpers, reducing duplicated code."
718,xui: remove Avalonia deps in WindowViewModel,"Remove the direct dependency on Avalonia types in the base WindowViewModel. This will allow us later to extract UI framework agnostic components, to be shared between WPF and Avalonia implementations of the UI helpers."
719,xui: return -1 on exception in UI helpers,Return a non-zero exit code when encountering an exception in a UI helper.
720,helper: trace helper UI process starts,"Trace each UI helper invocation, along with any arguments."
721,Merge pull request #475: Update README.md,Typo.
722,Update README.md,typo
723,docs: update FAQ with comment on credential.useHttp,Update the FAQ document with an explanation on why the module setting is required for Azure DevOps.
724,Merge pull request #468 from microsoft/support-matrix,supported platforms
725,Update README.md,Co-authored-by: Matthew John Cheetham link
726,Merge pull request #464 from mjcheetham/dpapi,Add DPAPI based credential store on Windows
727,dpapi: add unit tests of DPAPI cred store,
728,supported platforms,
729,Merge pull request #463 from mjcheetham/diagnose,Add diagnostic command for debugging issues
730,Merge pull request #461 from mjcheetham/wsl,Add support for using WSL Git for configuration
731,Merge pull request #465 from mjcheetham/win11,Correctly detect Windows 11 version numbers
732,fixup! docs: update docs for new credstore options,
733,win11: expand Win10 check to Win10+,"Expand existing checks for ""is Windows 10"" to ""is at least Windows 10"" to also capture Windows 11."
734,diagnose: add GitHub API diagnostic tests,
735,diagnose: add MS auth diagnostic tests,
736,diagnose: add credential storage diagnostic tests,
737,diagnose: add Git diagnostic tests,
738,diagnose: add networking diagnostic tests,
739,diagnose: add file system diagnostic tests,
740,diagnose: add environment diagnostic tests,
741,diagnose: add diagnose command,Add a diagnostic command module that can run various tests to verify the operation of various components of GCM. Log files can be written to an output directory.
742,platformutils: add ability to read OS version,Add the ability to read the current OS version string.
743,docs: update docs for new credstore options,
744,wincred: add explicit test for cred persistence,"Add an explicit test for credential persistence. If Windows indicates that either we don't have a credential set for the logon session, or the maximum allowed persistence for generic credentials is less than ""local machine"" then fail."
745,dpapi: add new credstore on Windows using DPAPI,"Add a new credential store on Windows that uses DPAPI to encrypt the password field in a file. The file format is otherwise identical to the Plaintext credential store. The default location for the DPAPI store is ~/.gcm/dpapi_store and this can be configured with the GCM_DPAPI_STORE_PATH or credential.dpapiStorePath. The addition of the DPAPI credential store allows for secure credential storage on Windows in cases where the Windows Credential Manager cannot work/has limitations. Specifically, DPAPI works over network sessions (like SSH) and is not subject to size limits."
746,credentialstore: allow users to select more credstores,"Implement a unified proxy pattern for the available credential stores. This allows users to select from multiple stores on all platforms, as we currently support for Linux."
747,sln: remove unused external file nodes from solution,
748,fixup! wsl: support calling Git inside of WSL,
749,fixup! docs: add WSL documentation,
750,docs: add WSL documentation,
751,wsl: support calling Git inside of WSL,Add support for calling back to the Git executable in a Windows Subsystem for Linux (WSL).
752,git: use IEnvironment::CreateProcess,Use the new CreateProcess method on the IEnvironment component in the GitProcess class.
753,env: introduce CreateProcess method in IEnvironment,Introduce a CreateProcess method on the IEnvironment component. This will serve as a place to consolidate Process object creation that currently exists in multiple places.
754,Merge pull request #456 from ldennington/upgrade-winget,Upgrade module action to v1.4
755,Upgrade module action to v1.4,This version allows us to update existing module manifests by specifying a manifest's SHA if it already exists in module. Pull Requests  link: Allow updates to existing winget manifests
756,Merge pull request #450 from mjcheetham/dropubuntu16,Drop ubuntu 16.04 from CI before GitHub drops the runner
757,Merge pull request #449 from mjcheetham/proxy-noproxy,Treat empty proxy settings as a signal to not use a proxy
758,ci: drop ubuntu 16.04 from CI before GitHub drop,Drop the Ubuntu 16.04 CI build and test before GitHub drop the Ubuntu 16.04 hosted runner. https://github.blog/changelog/2021-04-29-github-actions-ubuntu-16-04-lts-virtual-environment-will-be-removed-on-september-20-2021/
759,Merge pull request #446 from microsoft/codeql,Add CodeQL scanning
760,Merge pull request #439 from vdye/git-config-prefix-expansion,Use built-in module path interpolation for config settings
761,proxy: treat empty proxy settings as reset value,"When proxy settings are set in Git, an empty value is treated as ""do not use a proxy"". We update GCM to do the same thing; when an empty value is set, we do not use a proxy. This allows for the scenario where a proxy has been set globally (unscoped) but a specific (scoped) remote does NOT have a proxy set."
762,Update codeql-analysis.yml,
763,Update codeql-analysis.yml,
764,remove autobuild,
765,Create codeql-analysis.yml,
766,git: add module type and module property to module,"The module property (calculated only once, on first access) has type module, made up of the pre-custom components of a Git version (i.e., before a module or module). This version is currently only used in module in order to determine whether to use the now-deprecated canonical type constraint flags (for backwards-compatibility purposes) when accessing a config value. Signed-off-by: Victoria Dye link"
767,Merge pull request #441 from mjcheetham/exiterror,Return non-zero exit code on exception
768,fixup! config: update module to use module,Switch to deprecated settings for config type (for better compatibility).
769,settings: add path expansion to settings,Path interpolation enabled (using module) for the credential helper path and custom cert bundle (module) path. Signed-off-by: Victoria Dye link
770,settings: add path config handling in module,"The module function is updated to include an module flag which, when module, will pass the flag to module when applicable. In order to have this work when a module is specified, module is called directly if module is module after enumerating all settings (since module does not allow specifying a canonical type). Additionally, module is added as a convenience function for getting the first found path setting from module. This commit does not change the value of any existing settings  - it only introduces the ability to read settings as canonical paths (if sourced from the git config). Signed-off-by: Victoria Dye link"
771,config: update module to use module,"This change adds a module enum to module and includes it as an argument to module, module, and module. This argument (if not module) includes the appropriate module flag in the module. In the module extension function, an module boolean maps to usage of module for module and module for module. Existing usage of the updated functions has not changed (that is, all usages specify module). Signed-off-by: Victoria Dye link"
772,app: return non-zero exit code on exception,Return a non-zero program exit code when an unhandled exception is encountered at the top-level command line handling.
773,Merge pull request #438 from microsoft/hubbify,Changes to comply with GitHub OSS
774,remove metadata,
775,Merge branch 'main' into hubbify,
776,Merge pull request #436 from mjcheetham/termios,Split macOS and Linux implementations and fix password echo bug
777,bring readme in line with GitHub requirements,
778,introduce SECURITY,
779,introduce CoC,
780,introduce CONTRIBUTING,
781,Merge pull request #437 from mjcheetham/bb-async-fix,Drop unnecessary async keyword from method in tests
782,PosixTerminal: split macOS and Linux impl and fix,"Previously the PosixTerminal class used the POSIX termios structure and tcgetattr/tcsetattr functions for both macOS and Linux systems. However, it transpires that the definition of the termios flags fields differs between Mac and Linux. On Linux the fields are unsigned int (4 bytes), but on macOS the fields are unsigned long (8 bytes). This change splits the termios structure into Mac and Linux flavours and sets the correct field offsets."
783,docs: update readme with new features,Update readme doc to reflect current state of Linux support and features.
784,Merge pull request #431 from karlhorky/patch-1,"Remove planned features section, completed feature"
785,Merge pull request #426 from microsoft/copyright,Update copyright information
786,"Remove planned features section, completed feature",The native UI feature from issue https://github.com/microsoft/Git-Credential-Manager-Core/issues/136 was completed in https://github.com/microsoft/Git-Credential-Manager-Core/pull/336 by https://github.com/mjcheetham .
787,bitbucket: drop unnecessary async keyword from method,"Remove the unnecessary async keyword from the GetSupportedAuthModes method's test, and drop the Async suffix from the method name. This removes a warning from the build of the test assemblies that there is an async method."
788,Merge pull request #401 from mminns/ISSUE-329-force-bitbucket-oauth,Allow a user to force the GCMC to use Basic Auth and/or OAuth for interactions with bitbucket.org. Issue #329
789,ISSUE 329 address PR comments by simplifying the use of ThrowIfUserInteractionDisabled(),
790,update copyright holder,
791,remove copyright headers from .cs files,
792,Merge pull request #420 from microsoft/wam-doc-improvements,address feedback from Azure Identity team
793,note that dialogs can change,
794,address feedback from Azure Identity team,
795,Merge pull request #417 from mjcheetham/azr-binding-fix,Only enumerate local Azure Repos user bindings when inside a repository
796,Merge pull request #411 from vdye/242-respect-sslCAInfo,242-respect-ssl-ca-info
797,http: respect module setting(s) in Git,"Replicate the behavior of module (internally, cURL's module/ OpenSSL's module arguments). Implemented by manually comparing the server certificate with the config-specified CA file."
798,Merge pull request #405 from vdye/387-add-ui-and-symlink-deb,Add UI helpers to .deb package & change install location w/ symlinking
799,app: show exception stack trace if tracing enabled,"If application tracing is enabled, also print any exception stack traces to standard error."
800,azrepos: only enumerate local bindings inside repo,"Only attempt to enumerate Azure Repos user bindings in the local Git configuration, when inside a Git repository."
801,ISSUE 329 address PR comments with minor updates,
802,docs: nest Ubuntu install options and add configure,
803,"deb: move binary install location, add symlinks in /usr/bin",
804,Merge pull request #409 from microsoft/main,Cut new release
805,fixup! linux: add option for GCM_GPG_PATH environment variable,Whitespace cleanup
806,docs: clarify GCM_GPG_PATH has no config equiv.,
807,Merge pull request #406 from vdye/356-manually-specify-gpg-path,Add option for module environment variable (Linux-only)
808,deb: add UI helpers to debian package,
809,linux: add option for GCM_GPG_PATH environment variable,"If GCM_GPG_PATH is specified, it is assumed to be the path to the GPG executable used by module and will throw an exception if it is not found. If GCM_GPG_PATH is not specified, GCM Core will attempt to find the correct GPG executable by mimicking the behavior (currently) used by module (that is, first searching for module, then falling back on module if module is not found)."
810,Merge pull request #397 from mjcheetham/chmod,Create plaintext credential store directory with safer permissions
811,Merge pull request #404 from mjcheetham/os-config,Add ability to specify default settings values from the registry on Windows
812,osx: dynamically skip keychain test if invalid,"Dynamically skip the macOS Keychain read/write/delete test if the Keychain is in a ""strange"" state. There is an unknown issue that the keychain can sometimes get itself in where all API calls result in an errSecAuthFailed error. The only solution seems to be a machine restart; not possible in CI! The problem has plagued others who are calling the same Keychain APIs from C# such as the MSAL.NET team - they don't know either. It might have something to do with the code signing signature of the binary (our collective best theory). It's probably only diagnosable at this point by Apple, but we don't have a reliable way to reproduce the problem."
813,docs: clarify registry settings for sysadmins and ordering,"Clarify that the new registry settings are aimed at enterprises and system administrators, and that the settings are at the lowest precedence; they can always be overridden by the user."
814,Merge pull request #402 from garvit-joshi/main,Updated ISSUE_TEMPLATE from version to --version
815,Merge pull request #398 from hickford/patch-1,Clarify that is necessary to run git-credential-manager-core configure.
816,docs: update docs for new enterprise default cfg,Add documentation about the new enterprise/registry settings.
817,settings: add extra settings layer from WinRegistry,"Introduce the concept of another layer of settings (lowest precedence; default values only) below the existing environment variable and Git configuration file mechanisms. Implement on Windows using the Registry, under key: HKLM\SOFTWARE\GitCredentialManager\Configuration"
818,docs: add instructions how to enable WAM,
819,ISSUE 329 Ignore auth overrides when calling Bitbucket DC,
820,Updated ISSUE_TEMPLATE from version to --version,
821,ISSUE-329 Document the addition of Bitbucket AuthModes,
822,Update linuxcredstores.md,Clarify that is necessary to run module.
823,plaintextcredstore: create plaintext store with 700,"When creating the plaintext credential store root directory, create it with permissions such that only the owner/user can read/write/execute, and not the group or other users. This only impacts newly created store directories; existing directories do not have their permissions modified. Only applies to POSIX platforms."
824,ISSUE-329 Add configuration option to force Basic Auth or OAuth for Bitbucket,
825,ISSUE-329 Add tests before refactoring and extending provider code.,
826,Merge pull request #388 from microsoft/vtbassmatt-patch-1,Add a stable anchor for linking to Linux instructions
827,Update README.md,
828,Merge pull request #386 from ldennington/update-linux,Add instructions for module install to module
829,Clarify module input description,"We are currently using 'Release tag' to describe the required input to our module trigger. This is inaccurate - this field actually requires a 'Release id', which I discovered when testing GCM Core module deployments yesterday. Updating so that the description doesn't confuse folks running the workflow for a release that is not 'latest'."
830,Add instructions for module install to module,Updating README.md with instructions for apt-get setup and install for Ubuntu Bionic and Hirsute.
831,Merge pull request #377 from ldennington/update-linux-deployments,Update apt-get workflow to publish to official bionic/hirsute repos
832,Consolidate apt-get release flow,This change replaces Python scripts we were calling from the module pipeline with inline scripts. It also adds support for releasing to Ubuntu repositories hosted at http://packages.microsoft.com/ (hosting location for Microsoft's official apt/yum repos). This allows users to install via apt-get on Hirsute/Bionic. Details to configure appropriate repos can be found here: https://docs.microsoft.com/en-us/windows-server/administration/Linux-Package-Repository-for-Microsoft-Software).
833,Merge pull request #383 from microsoft/vtbassmatt-patch-1,"a small ""how to use"" tweak"
834,Merge pull request #373 from mminns/issue-267-auto-detect-bitbucket-dc,"Issue-267 Add fingerprint header, to autodetect Bitbucket DC instances."
835,"a small ""how to use"" tweak",
836,"Issue-267 Add fingerprint header, to autodetect Bitbucket DC instances.",Copied and refreshed the Bitbucket development doc from the Git Credential Manager for Windows project.
837,Merge pull request #379 from mjcheetham/fix-macos-hang,Avoid extra restore in macOS installer creation (fix CI hangs)
838,osx: only publish using one MSBuild node,
839,osx: avoid extra restore in macOS installer creation,"Avoid an extra module during the module commands in module when building the macOS installer. For some reason, the CI machines (and sometimes locally) hang during this step with: ``` Building Installer.Mac Copying uninstall script... Microsoft (R) Build Engine version 16.10.0-preview-21181-07+073022eb4 for .NET Copyright (C) Microsoft Corporation. All rights reserved. Determining projects to restore... ``` Avoiding the restore during publish should be OK since the hosting Installer.Mac.csproj project will have already built (and restored) packages for the dependent projects."
840,Merge pull request #378 from ldennington/fix-tag-formatting,Fix winget tag specification
841,!fixup winget tag specification,
842,Merge pull request #375 from microsoft/main,Cut release
843,Merge pull request #374 from mjcheetham/fix-win-apppath,Fix app entry path computation on Windows
844,app: fix app entry path computation on Windows,The way we located the application (GCM) path was broken on .NET Framework (it worked OK for .NET Core/5.0+).
845,Merge pull request #361 from microsoft/main,Cut another another release
846,Merge pull request #360 from mjcheetham/github-xui-fix,Fix bug in GitHub x-platform UI command line parsing/binding
847,github: fix bug in x-UI cmdline parsing,"The System.CommandLine command line binding requires the parameter names match the option names. During the rebasing of the x-platform UI work, the argument name for the module option was left as module which means the OAuth browser flow is never shown, even though the base GCM program is passing the right argument/options."
848,Merge pull request #359 from microsoft/main,Cut another release (fixed this time)
849,Merge pull request #358 from mjcheetham/fixed-dotnet-sdk,Fix the .NET SDK used in release builds
850,dotnet: fix the .NET SDK used in release builds,"Fix the .NET SDK version used on Mac and Linux to build release builds in Azure Pipelines. The release build started to hang since .NET SDK 5.0.300 was available. Others have reported issues with new SDK patches: https://github.com/dotnet/sdk/issues/16204 The last successful release build used .NET SDK 5.0.203, so let's fix to that version. Last success: https://mseng.visualstudio.com/AzureDevOps/_build/results?buildId=15246465 Current failure: https://mseng.visualstudio.com/AzureDevOps/_build/results?buildId=15390460"
851,Merge pull request #357 from microsoft/main,Cut new release with GHES OAuth support and x-platform UI
852,Merge pull request #336 from mjcheetham/xui2,Add cross-platform UI based on Avalonia
853,"main: drop the useless ""Run!"" comments from prog.cs",
854,Merge pull request #354 from mjcheetham/ghes-oauth,Mark GHES 3.2 as supporting GCM Core OAuth
855,Merge pull request #353 from ldennington/bump-winget-version,Bumping version of update-winget action
