Commit Message,Score,Correspond Changelog Sentence,Commit Description,Label
Merge pull request #740 from wallabag/Strubbl-gh-issue-template-2fa,0.44790488,"Important changes if you're coming from a 1.x version : This release drops wallabag v1 support. If you need support for wallabag v1, you must build yourself the sources from the v1_legacy branch.",Update issue_template.md,0
tts: avoid NPE when calling abandonAudioFocusRequest,0.51599085,fix crash when TTS Enable/Disable and when switching to another app while TTS is running (thanks @tyndare #741),,0
tts: fix issue #735: create notification channel,0.5117067,"We fixed notifications not being displayed, leading to other issues.","Update for Android >= 8.1  - create a notification channel, and use its id to send notifications  - create an audio focus request object",0
Update issue_template.md,0.36857998,Update deps,add question Do you have Two-Factor-Authentication enabled?,0
Merge pull request #728 from NWuensche/Catch-Socket-Exception,0.342178,Better handling of network-related errors.,Save socket exception in log when network shuts down,0
Catch Socket Exception properly,0.42576563,* Handle server 500 errors with message,Fix #727 A java.net.SocketException occurs when syncing started and the internet connection shuts down while syncing. Instead of showing the exception to the user it will be caught in IntentServiceBase.processException() now.,0
Only change text color in navigation bar for dark (high contrast) theme,0.6550458,fix navbar color in dark themes in Android 9 (@Strubbl #766),Only change the text color for this theme and not for the other ones.,0
Adjust text color in navigation bar,0.59445983,fix navbar color in dark themes in Android 9 (@Strubbl #766),"Because the space behind the items isn't black anymore, a grey was used as the icon and text color of the selected navbar item. Fixes #552",0
Use right color for dark contrast theme,0.7423277,fix theme Black on black (dark high contrast) to make it consistent (thanks @NWuensche #730),Use a real black instead of grey in the dark contrast theme for the app bar. Also remove the black square in the navigation bar for the selected item and instead use grey to highlight it. This was done by changing the primary color of the theme and not changing the background attribute in the theme to not always be black.,1
Merge pull request #709 from tyndare/tts-language-select,0.47983962,tts: automatic switch to article's language (thanks @tyndare  #709),tts: automatic switch to article's language,0
Merge pull request #725 from kpchungdev/feature-696-show-password,0.44051296,• feed credentials no longer have to be input and can automatically be fetched when you provide username and password,Feature 696: Show Password,0
Merge branch 'NWuensche-screenOnReading',0.28547844,"Thanks to @di72nn and @NWuensche, the following fixes were added:",,0
Merge branch 'screenOnReading' of link into NWuensche-screenOnReading,0.36748073,@The-Compiler introduced an option to inspect chromium webviews to assist debugging link,,0
Merge pull request #726 from Strubbl/update-gradle-3.1.4,0.54516673,@Strubbl updated the okhttp (#791) and gradle (#790) deps,update gradle to 3.1.4,0
update gradle to 3.1.4,0.5374455,@Strubbl updated the okhttp (#791) and gradle (#790) deps,,0
Merge branch 'feature-696-show-password' of link into feature-696-show-password,0.29595315,@Strubbl updated the okhttp (#791) and gradle (#790) deps,,0
Added password toggle,0.5069485,in setup wizard add option to unhide the password entered (thanks @kpchungdev #725),,0
Merge pull request #699 from wallabag/update-to-okhttp-3.10.0,0.5260712,@Strubbl updated the okhttp (#791) and gradle (#790) deps,update okttp to 3.10.0,0
Add password toggle,0.43966082,in setup wizard add option to unhide the password entered (thanks @kpchungdev #725),,0
Fix typo,0.46622005,Corrects bugs,,0
Merge pull request #717 from wallabag/Strubbl-patch-1,0.4597731,"Important changes if you're coming from a 1.x version : This release drops wallabag v1 support. If you need support for wallabag v1, you must build yourself the sources from the v1_legacy branch.",Update README.md,0
"Add functionality behind ""keep screen on"" option",0.70231193,add setting to keep screen on while reading an article (thanks @nwuensche #724),Close #436,1
Add checkbox to keep screen on in settings,0.6893307,add setting to keep screen on while reading an article (thanks @nwuensche #724),Also add German localization. This commit just contains the placeholders without any functionality.,0
Merge branch 'master' of link,0.24765216,add Share and Copy options for link menu (thanks @NWuensche #677),,0
modification of the French translation,0.67739457,Translations:,,0
Merge pull request #720 from wallabag/Strubbl-patch-2,0.4579062,"Important changes if you're coming from a 1.x version : This release drops wallabag v1 support. If you need support for wallabag v1, you must build yourself the sources from the v1_legacy branch.",Update issue_template.md,0
Merge pull request #718 from Strubbl/update-okhttp311,0.53795844,@Strubbl updated the okhttp (#791) and gradle (#790) deps,update okhttp-urlconnection to 3.11.0,0
update okhttp-urlconnection to 3.11.0,0.5715502,@Strubbl updated the okhttp (#791) and gradle (#790) deps,,0
Merge pull request #690 from silberzwiebel/scrollArticleList,0.39174193,"Thanks to @di72nn and @NWuensche, the following fixes were added:",add scrolling via hardware keys in article lists,0
Merge pull request #707 from wallabag/add-issue-template,0.43128446,"Important changes if you're coming from a 1.x version : This release drops wallabag v1 support. If you need support for wallabag v1, you must build yourself the sources from the v1_legacy branch.",Add issue template,0
Merge pull request #716 from Strubbl/attapalace-master,0.36940938,@Strubbl updated the okhttp (#791) and gradle (#790) deps,android & dependency updates,0
update android support libs to 27.1.1,0.53335404,Target SDK version updated to 30 (Android 11) (#1072).,,0
update okhttp3 to 3.11.0,0.58134794,This version updates the dependencies to the okhttp libraries. That means Android 5.0 is now the minimum Android version for running this app. ,,0
"travis: android sdk, update build-tools",0.5092781,Target SDK version updated to 30 (Android 11) (#1072).,,0
update dependencies and NotificationCompat support library,0.67878866,Dependencies updates,,0
issue template: add closing question,0.2176914,@di72nn added extra stacktrace details when an error happens and also added a button on the error notification to copy the details to the clipboard link,add final question w.r.t. user's experience with the app fix displaying of  tag in path to server logs (was left out in the markdown view) inspired by second holiday story from Joey link/,0
tts: automatic switch to article's language,0.9778882,tts: automatic switch to article's language (thanks @tyndare  #709),,1
Add issue template,0.32964185,@di72nn added extra stacktrace details when an error happens and also added a button on the error notification to copy the details to the clipboard link,,0
fix broken back button,0.30925804,@di72nn fixed D-pad navigation. #795 ,,0
add null checks,0.20802784,Basic error messages,,0
add scrolling via hardware keys in article lists,0.97793883,add scrolling via hardware keys in article lists (thanks @silberzwiebel #690),,1
update okttp to 3.10.0,0.56201583,This version updates the dependencies to the okhttp libraries. That means Android 5.0 is now the minimum Android version for running this app. ,,0
Add Share and Copy options for link menu Fix #610 (#677),0.88701653,add Share and Copy options for link menu (thanks @NWuensche #677),Add Share and Copy options for link menu Fix #610 Added the option to add a link to clipboard or share it. Also add a German translation for both of them. Reuse methods to copy and share URL Overload shareArticle the Right Way Rename and Overload copyOriginalURL,1
Merge pull request #683 from wallabag/fix-337-adding-icons-all-colors,0.5466608,@NWuensche improved the theming system and fixed TTS icons color on dark theme,theme: define per theme icon colors,0
Merge pull request #695 from wallabag/update_dependencies,0.54814065,"Important changes if you're coming from a 1.x version : This release drops wallabag v1 support. If you need support for wallabag v1, you must build yourself the sources from the v1_legacy branch.",update to okhttp 3.9.1 and aboutlibraries 6.0.2,0
Fixed typo,0.41612062,Changed,,0
Added credits for the new app icon,0.44107172,Adaptive icon.,,0
update to okhttp 3.9.1 and aboutlibraries 6.0.2,0.5558431,AboutLibraries was automatically bumped to v7.0.3,,0
Merge pull request #590 from wallabag/fix-567-ArrayIndexOutOfBoundsException,0.53186995,"@di72nn updated their wallabag API wrapper library to the latest version, which brings a few optimizations and compatibility with latest wallabag versions link",Fixes #567 ArrayIndexOutOfBoundsException itemList.get(position),0
Merge pull request #659 from Strubbl/fix-lint-assertions,0.38782886,"Thanks to @di72nn and @NWuensche, the following fixes were added:",fix lint Assert: Assertions,0
Merge pull request #665 from Strubbl/fix-lint-hardcoded-text,0.41319716,"Thanks to @di72nn and @NWuensche, the following fixes were added:",fix lint Hardcoded text,0
Merge pull request #693 from wallabag/update_translations,0.5432417,Translations fixes (@di72nn),Update translations,0
fix lint Hardcoded text,0.36693606,UI fixes on links and quotes,"fixes lint message in src/main/res/layout/list_item.xml:56: Hardcoded string ""5 min"", should use @string resource",0
"fix icon color (read, star) in list_item.xml for light theme",0.53871834,@NWuensche improved the theming system and fixed TTS icons color on dark theme,,0
Merge pull request #678 from silberzwiebel/fullscreenCleanBranch,0.46248227,@di72nn fixed issues with themes in fullscreen view and action bar when watching full screen videos link,"fullscreen article view (clean branch, supersedes #642)",0
Merge pull request #689 from wallabag/update_translations,0.5495979,Translations fixes (@di72nn),Update translations,0
Merge pull request #688 from wallabag/update_translations,0.5523619,Translations fixes (@di72nn),Update translations,0
Merge pull request #681 from comradekingu/patch-2,0.3891949,"Thanks to @di72nn and @NWuensche, the following fixes were added:",Spelling: Mark as read,0
Merge pull request #686 from wallabag/2fa-warning,0.4617031,"Important changes if you're coming from a 1.x version : This release drops wallabag v1 support. If you need support for wallabag v1, you must build yourself the sources from the v1_legacy branch.",concretize error message usually coming from 2FA,0
Merge pull request #687 from yoannsculo/french_translation,0.50155336,Up-to-date french and spanish translations,French translation: fix agreement,0
French: fix agreement,0.52454793,Many fixes and translations,,0
concretize error message usually coming from 2FA,0.4605423,Conscrypt initialization errors are ignored now (#1103).,"until #359 is implemented, the user gets a concretized error message.",0
Merge pull request #684 from wallabag/update_translations,0.5483371,Translations fixes (@di72nn),Update translations,0
theme: define per theme icon colors,0.5731691,* Icons and logo should now render better on each theme,fixes #337,0
Merge pull request #679 from wallabag/scroll_over_bottom,0.46041095,"@di72nn updated their wallabag API wrapper library to the latest version, which brings a few optimizations and compatibility with latest wallabag versions link","Improve ""scroll over bottom"" logic",0
Spelling: Mark as read,0.5140581,Adding a Mark as Read button in the action bar,,0
Merge pull request #680 from wallabag/update_translations,0.5603955,Translations fixes (@di72nn),Update translations,0
Translations corrections,0.80968124,Updated translations,,1
"Improve ""scroll over bottom"" logic",0.47705585,"add possibility to scroll towards the bottom to mark article as read (especially useful for e-ink device, configurable via preference, only enabled with physical key presses) (thanks @silberzwiebel  #648) ",,0
Merge pull request #673 from yoannsculo/french_translation,0.49799442,Up-to-date french and spanish translations,French translation,0
Merge pull request #648 from silberzwiebel/scrollToBottom,0.40784144,"Thanks to @di72nn and @NWuensche, the following fixes were added:",add possibility to scroll towards the bottom to mark article as read,0
use ACTION_UP only for PAGE_UP/DOWN keys,0.4713143,Scroll with PAGE_UP/PAGE_DOWN (e-ink readers),,0
hide actionBar as well for fullscreen article view; fixes #114 and #636,0.6081129,fullscreen article view (thanks #678 from @silberzwiebel),,0
added TODOs of smaller issues that should be resolved before a pull-request,0.4292323,several minor bugfixes,,0
"added fullscreen support for article view, toggable via settings",0.732671,fullscreen article view (thanks #678 from @silberzwiebel),,1
French: remove uppercase when incorrect,0.40301585,* French,,0
French: add missing translation,0.6068873,German and French translations strings,,0
French: align translation order to English file,0.5921625,German and French translations strings,"By sorting the file and aligning with reference English translation, it eases future translation. Signed-off-by: Yoann Sculo yoann@printk.fr",0
French: misc translation correcting,0.551786,Bugs and translations,,0
French: translate remove_tag,0.4548892,German and French translations strings,,0
French: reorder and fully translate Miscellaneous category,0.47529337,Improved translations,,0
French: add Miscellanea group to Interface settings category,0.3199724,Olivier Mehani (@shtrom) added a context menu item to add tag from selection. link,not fully translated yet,0
French: be consistent with Wallabag (web) translations,0.6295882,Up-to-date french and spanish translations,,0
Merge pull request #672 from yoannsculo/master,0.32525563,Version 2.3.0 was started in August 2019 and contained over a hundred commits.,Add missing French translation,0
set scroll to bottom to def. value 3,0.47031677,Scroll with PAGE_UP/PAGE_DOWN (e-ink readers),,0
merge,0.28723836,Changed,,0
add preference for scroll over bottom to mark as read; only enable scroll over bottom via physical key presses,0.64394516,"add possibility to scroll towards the bottom to mark article as read (especially useful for e-ink device, configurable via preference, only enabled with physical key presses) (thanks @silberzwiebel  #648) ",,0
merge master branch,0.269464,Fix migrations,,0
Merge branch 'master' into scrollToBottom,0.24959892,add scrolling via hardware keys in article lists (thanks @silberzwiebel #690),,0
French translation: remove uppercase,0.43913066,* French,,0
add missing French translation,0.6230561,Up-to-date french and spanish translations,,0
fix lint Assert: Assertions,0.3687775,Corrects bugs,fixes lint messages in src/main/java/fr/gaulupeau/apps/Poche/tts/TtsService.java: Assertions are unreliable in Dalvik and unimplemented in ART. Use BuildConfig.DEBUG conditional checks instead.,0
Merge pull request #666 from Strubbl/update-dep-aboutlibraries-5.9.6,0.4612609,AboutLibraries was automatically bumped to v7.0.3,update aboutlibraries to latest stable 5.9.6,0
Merge pull request #669 from wallabag/update_translations,0.5552369,Translations fixes (@di72nn),Update translations,0
Merge pull request #663 from Strubbl/fix-lint-missing-contentDescription,0.43013707,"Thanks to @di72nn and @NWuensche, the following fixes were added:",fixes lint Image without contentDescription,0
Merge pull request #662 from Strubbl/fix-lint-ObsoleteSdkInt,0.42019415,@Strubbl updated the okhttp (#791) and gradle (#790) deps,fix lint messages w.r.t. minSdkVersion is 14 and never below,0
Merge pull request #664 from Strubbl/fix-lint-click-focus,0.40311676,"Thanks to @di72nn and @NWuensche, the following fixes were added:",fix lint Keyboard inaccessible widget,0
Merge pull request #660 from Strubbl/fix-lint-missing-translations,0.45990026,Translations fixes (@di72nn),fix lint MissingTranslation: Incomplete translation,0
Merge pull request #658 from Strubbl/fix-lint-Implied-default-locale-in-case-conversion,0.41330773,"Thanks to @di72nn and @NWuensche, the following fixes were added:",fix lint DefaultLocale: Implied default locale in case conversion,0
Translation corrections,0.7948541,Updated translations,,1
update aboutlibraries to latest stable 5.9.6,0.73590857,AboutLibraries was automatically bumped to v7.0.3,,1
fix lint Keyboard inaccessible widget,0.40524575,@Strubbl increased max widget counter value. (#1170),"fixes lint message in src/main/res/layout/fragment_tts.xml:198: 'clickable' attribute found, please also add 'focusable'",0
fixes lint Image without contentDescription,0.33431977,@cloud-oak made it possible to disable the preview image,"fixes the lint messages: src/main/res/layout/nav_header_main.xml:16: Missing contentDescription attribute on image --> only decorative, so not needed here, hence ignore lint src/main/res/layout/tag_list_removable_item.xml:18: Missing contentDescription attribute on image --> is an important button, add string for accessibility",0
fix lint messages w.r.t. minSdkVersion is 14 and never below,0.50985616,Bump minSdkVersion to 10 (Gingerbread : Android 2.3.4 / Android 2.3.3),fix lint messages: src/main/res/values-v14: This folder configuration (v14) is unnecessary; minSdkVersion is 14. Merge all the resources in this folder into values src/main/java/fr/gaulupeau/apps/Poche/tts/TtsFragment.java:758: Unnecessary; SDK_INT is never < 14 src/main/java/fr/gaulupeau/apps/Poche/tts/TtsService.java: Unnecessary; SDK_INT is never < 14,0
fix lint Formatting argument types inconsistent,0.31717998,UI fixes on links and quotes,"fixes lint messages in strings.xml. Lint message was Inconsistent number of arguments in formatting string pref_name_ui_article_fontSize; found both 0 and 1. So this commit adds formatted=""false"" to the strings where we do not want formatting but the percentage sign.",0
fix lint MissingTranslation: Incomplete translation,0.5443666,Translations fixes (@di72nn),fixes lint messages for untranslatable string arrays cause they are numbers in src/main/res/values/arrays.xml,0
fix lint DefaultLocale: Implied default locale in case conversion,0.39580786,tts: automatic switch to article's language (thanks @tyndare  #709),fixes lint messages in src/main/java/fr/gaulupeau/apps/Poche/ui/ManageArticleTagsActivity.java: Implicitly using the default locale is a common source of bugs,0
Merge pull request #643 from wallabag/update-gradle,0.5104863,@di72nn added a Gradle Wrapper Validation Github Action to prevent bad gradle-wrapper.jar binaries,update gradle to 3.0.1 and wrapper to 4.1,0
fix lint Invalid vector paths in ic_star_black,0.41845554,solar theme icon bugfix (@Strubbl #683),lint error was: src/main/res/drawable/ic_star_black_24dp.xml:9: Use -0.61 instead of -.61 to avoid crashes on some devices,0
update gradle to 3.0.1 and wrapper to 4.1,0.575451,@di72nn added a Gradle Wrapper Validation Github Action to prevent bad gradle-wrapper.jar binaries,,0
Merge pull request #657 from comradekingu/patch-1,0.39844528,"Thanks to @di72nn and @NWuensche, the following fixes were added:",String rework,0
String rework,0.39113832,German and French translations strings,,0
add possibility to scroll towards the bottom to mark article as read,0.875216,"add possibility to scroll towards the bottom to mark article as read (especially useful for e-ink device, configurable via preference, only enabled with physical key presses) (thanks @silberzwiebel  #648) ",,1
Merge branch 'update_translations',0.59280264,Translation updates,,0
Merge pull request #639 from wallabag/bump-dependencies,0.5173504,"Important changes if you're coming from a 1.x version : This release drops wallabag v1 support. If you need support for wallabag v1, you must build yourself the sources from the v1_legacy branch.",bump dependencies & version,0
bump travis,0.3223046,Bump version name for F-Droid users.,Signed-off-by: Thomas Citharel tcit@tcit.fr,0
bump dependencies & version,0.6959691,Update dependencies,,0
Update icon to new flat icon,0.55612737,Adaptive icon.,,0
Merge branch 'master' of link into OriginalFannibal-update-readme-icon,0.32092574,solar theme icon bugfix (@Strubbl #683),,0
Merge branch 'silberzwiebel-master',0.32653373,Update german translation,,0
Merge pull request #1 from di72nn/silberzwiebel/disable-touch-improvements,0.5391996,Option to disable touch input,Disable touch improvements,0
"Minor fixes for ""disable touch input""",0.71913946,Option to disable touch input,,1
"Use last ""disable touch input"" state when opening an article",0.6667193,Option to disable touch input,,0
"Add a dialog to configure ""disable touch input"" button",0.7385418,Option to disable touch input,,1
Disable touch input as an option,0.9431836,Option to disable touch input,,1
ReadArticleActivity: refactor touch and key event handling,0.45732674,Option to disable touch input,,0
formatting code properly,0.3809812,Layout improvements,,0
only one switch-case,0.24376191,tts: automatic switch to article's language (thanks @tyndare  #709),,0
fix double scrolling due to key_up and key_down events,0.5166089,Scroll with PAGE_UP/PAGE_DOWN (e-ink readers),,0
remove unused code,0.65098834,Removed legacy code. (#1114),,0
"implement enabling / disabling touch screen via physical button press in ReadArticleActivity, fixes #623",0.5750792,Option to disable touch input,,0
Merge branch 'leblanc-simon/fix/497-detect-form-minified',0.336761,Removed legacy code. (#1114),,0
Merge pull request #629 from wallabag/fix_selected_tag_in_ui,0.4563735,"Thanks to @di72nn and @NWuensche, the following fixes were added:",Set selected tag in UI when restoring main activity,0
Merge pull request #630 from wallabag/clear_tag_text_field_when_suggestion_clicked,0.44400924,@scubajeff fixed custom text selection actions. (#1176),Clear tag search text field when a suggested tag is selected,0
Clear tag search text field when a suggested tag is selected,0.37284335,Olivier Mehani (@shtrom) added a context menu item to add tag from selection. link,,0
Set selected tag in UI when restoring main activity,0.4576535,Olivier Mehani (@shtrom) added a context menu item to add tag from selection. link,,0
Merge branch 'di72nn-leblanc-simon/fix/497-detect-form-minified-patch1' into fix/497-detect-form-minified,0.38755852,Removed legacy code. (#1114),,0
"Fix TestConnectionTask, precompile patterns",0.43397433,Better tests for connexion issues,,0
Merge pull request #626 from wallabag/update_translations,0.5548297,Translations fixes (@di72nn),Update translations,0
Fix login page detection when html code is minified,0.90641,Fix login detection when html is minified on server,,1
Correct translations,0.82024384,Translations,,1
Added translation using Weblate (Turkish),0.6066107,Updates to turkish translations (@Ardakilic),,0
Merge branch 'handle_page_up-down_key_events',0.3632214,Removed legacy code. (#1114),,0
Minor translation updates,0.8929843,Translation updates,,1
Use PAGE_UP and PAGE_DOWN keycodes for scrolling,0.69658524,Scroll with PAGE_UP/PAGE_DOWN (e-ink readers),,0
Added translation using Weblate (Basque),0.49341226,Translation updates,,0
Merge branch 'ngosang/quotes',0.3038085,@cheywood improved quote style. (#1165),,0
Improve CSS styles for quotes,0.66344965,UI fixes on links and quotes,,0
Merge branch 'ngosang/links_style',0.3163498,Removed legacy code. (#1114),,0
Merge pull request #597 from ngosang/feature/es_translation,0.4990523,Translation updates,Update Spanish translation,0
Change article links style,0.49225935,Previous and next article buttons,,0
Update Spanish translation,0.75482416,Updated translations.,,1
Update readme icon,0.45163414,Adaptive icon.,,0
Merge pull request #593 from wallabag/better_url_handling,0.43837243,Full support for wallabag v2 API (link),Better URL handling,0
Merge pull request #592 from wallabag/follow-up-pr-492-simounet-feature/reading-time-main-screen,0.44198847,"@di72nn updated their wallabag API wrapper library to the latest version, which brings a few optimizations and compatibility with latest wallabag versions link",Follow up pr 492 simounet feature/reading time main screen,0
Improve URL handling,0.509146,Fix Error when incorrect URL entered.,,0
Suppress deprecation warning,0.4270725,Updated deps,,0
Minor layout corrections,0.88100505,Layout improvements,,1
"list item alignment for title, reading time, star and archive",0.4777999,Show reading time for entry in list view,,0
Update lists on Reading Speed changes,0.4470178,Show reading time for entry in list view,,0
Changes for Estimated Reading Time,0.57700866,Show reading time for entry in list view,,0
Dynamic reading time on the main screen,0.6255323,Show reading time for entry in list view,,0
Adding the reading time on articles' main screen,0.7070634,Show reading time for entry in list view,,1
Fixes #567 ArrayIndexOutOfBoundsException itemList.get(position),0.3190722,@Strubbl increased max widget counter value. (#1170),,0
Merge pull request #587 from wallabag/multiple_file_formats_for_download,0.5735044,Multiple format download,Multiple file formats for download,0
Merge pull request #588 from wallabag/fix_duplicate_tag_crash,0.48987043,"Important changes if you're coming from a 1.x version : This release drops wallabag v1 support. If you need support for wallabag v1, you must build yourself the sources from the v1_legacy branch.",Correctly process multiple tags with the same label in article filtering,0
Correctly process multiple tags with the same label,0.3560282,"""Untagged"" list.",...in article filtering,0
Replace PDF mentions in strings,0.3454788,* Fix PDF Downloading,,0
Add a dialog to choose file format to download,0.629844,Multiple format download,,0
Correct download file notification tag,0.4317007,Multiple format download,,0
