Index,Commit Message,Score,Correspond Changelog Sentence,Commit Description,Label
936,Merge remote-tracking branch 'gh-wallabag/dev' into share-article,0.44342458,Full support for wallabag v2 API (https://github.com/di72nn/wallabag-api-wrapper),,0
937,Ajout de la licence GNU.,0.4676407,dependency updates,update okttp to 3.10.0,0
938,restructured MainActivity: moved downloading and parsing to external AsyncTask,0.45757875,Theme and downloading pictures fixes,,0
939,"Modify Share label to ""Add in the poche""",0.5296298,add Share and Copy options for link menu (thanks @NWuensche #677),,0
940,Merge pull request #588 from wallabag/fix_duplicate_tag_crash,0.51863015,• Fix connexion to wallabag v2.0.1 servers,Update README.md,0
941,Sweeping: optimizations,0.45056272,• Much faster synchronization,Close #436,0
942,Update URL hint in Settings,0.558301,add Share and Copy options for link menu (thanks @NWuensche #677),Also add German localization. This commit just contains the placeholders without any functionality.,0
943,update spanish translation,0.8042113,Updated translations,,1
944,Version 2.0.1,0.70553386,"Replaces version 2.4.0-beta.2, which APK didn't have the latest changes.",,1
945,Merge remote-tracking branch 'upstream/master' into devel,0.4080704,Background service to handle actions offline and sync them when network is available,,0
946,Merge pull request #684 from wallabag/update_translations,0.524163,"@di72nn updated their wallabag API wrapper library to the latest version, which brings a few optimizations and compatibility with latest wallabag versions https://github.com/wallabag/android-app/pull/861",Update issue_template.md,0
947,"Hide ""Sync local changes"" option if in sync",0.6438169,Automatic sync,,0
948,Added translation using Weblate (Chinese (Simplified)),0.67119104,Improved translations,update okhttp-urlconnection to 3.11.0,0
949,TTS: fix media button handling in background,0.62409943,fix crash when TTS Enable/Disable and when switching to another app while TTS is running (thanks @tyndare #741),,0
950,Added translation using Weblate (Portuguese),0.6780007,Improved translations, add two features to the list remove paragraph that we are actively developing the app now,0
951,Merge pull request #769 from Strubbl/fix-624-wbg-server-cached-image-display,0.52673376,• Fix connexion to wallabag v2.0.1 servers,add scrolling via hardware keys in article lists,0
952,Merge pull request #629 from wallabag/fix_selected_tag_in_ui,0.51900864,Drops wallabag v1 support : Framabag will not work anymore with this version.,Add issue template,0
953,Merge pull request #363 from wallabag/update_translations,0.51682246,Translation updates,android & dependency updates,0
954,Merge pull request #433 from wallabag/update_permissions,0.5038284,• Fix connexion to wallabag v2.0.1 servers,,0
955,Merge pull request #581 from wallabag/update_translations,0.5335741,"@di72nn updated their wallabag API wrapper library to the latest version, which brings a few optimizations and compatibility with latest wallabag versions https://github.com/wallabag/android-app/pull/861",,0
956,Update ReadArticleActivity options menu on events,0.65723455,Adding a Mark as Read button in the action bar,,0
957,Use AndroidX Media Compat classes for audiofocusrequest,0.43904158,"Note: We provide a legacy APK file attached for devices running Android 4.x. The legacy package should also be distributed through Google Play. However, if you're using F-Droid, it will only have the updated version, and we suggest installing the attached legacy APK instead (and investigate upgrading your Android device).",,0
958,"Make the ""Scan a QR code"" button less pronounced",0.5872427,@di72nn added the possibility to launch a QR code scanner app for easier wallabag credentials setup https://github.com/wallabag/android-app/pull/369, add final question w.r.t. user's experience with the app fix displaying of  tag in path to server logs (was left out in the markdown view)  inspired by second holiday story from Joey http://joeyh.name/blog/entry/two_holiday_stories/,0
959,"ConnectionWizard: change init with ""magic url""",0.6469395,Connection wizard,,0
960,Correct download file notification tag,0.54814696,* Fix PDF Downloading,,0
961,Improve connection test (introduce error codes),0.79944146,Better tests for connexion issues,,1
962,alpha 3,0.3369009,• wallabag v2 support !,,0
963,Merge pull request #214 from Strubbl/use-api-for-version-guess,0.4781903,"@di72nn updated their wallabag API wrapper library to the latest version, which brings a few optimizations and compatibility with latest wallabag versions https://github.com/wallabag/android-app/pull/861",,0
964,update gradle to 2.3.3,0.5742197,"Replaces version 2.4.0-beta.2, which APK didn't have the latest changes.",update okttp to 3.10.0,0
965,Merge pull request #84 from shtrom/high-contrast,0.40547478,@di72nn added two new actions in the settings to help fix queue/synchronization issues : the ability to dump the queue to a local file and the possibility to remove the first queue item found. https://github.com/wallabag/android-app/pull/915,,0
966,Merge pull request #1028 from wallabag/fix_annotations,0.5013688,@di72nn fixed a sync error when deleting all tags from an article, Add Share and Copy options for link menu Fix #610 Added the option to add a link to clipboard or share it. Also add a German translation for both of them. Reuse methods to copy and share URL Overload shareArticle the Right Way Rename and Overload copyOriginalURL,0
967,Merge pull request #1158 from wallabag/dependabot/gradle/androidx.media-media-1.3.1,0.5132308,@di72nn fixed a webview crash happening with Android 5 https://github.com/wallabag/android-app/pull/877,theme: define per theme icon colors,0
968,trad fr & version 1.9.3.1,0.45089304,Compatibility with wallabag 2.4 (by @di72nn),update to okhttp 3.9.1 and aboutlibraries 6.0.2,0
969,Implement main actions and queue sync,0.6172489,• fast sync option,,0
970,Merge pull request #147 from strobeltobias/patch-1,0.5218736,@Strubbl updated the okhttp (#791) and gradle (#790) deps,,0
971,set scroll to bottom to def. value 3,0.58580494,Scroll with PAGE_UP/PAGE_DOWN (e-ink readers),,0
972,Version 2.0.0 !,0.6287738,"Replaces version 2.4.0-beta.2, which APK didn't have the latest changes.",Fixes #567 ArrayIndexOutOfBoundsException itemList.get(position),0
973,Change tags processing,0.70719326,"Basic tags support (list by tag, add/modify/delete tags on articles) ",fix lint Assert: Assertions,1
974,fix the v2 check for valid Wallabag instance,0.5320422,Full support for wallabag v2 API (https://github.com/di72nn/wallabag-api-wrapper),fix lint Hardcoded text,0
975,Merge pull request #1078 from wallabag/release_2.4.1,0.5574285,"@di72nn updated their wallabag API wrapper library to the latest version, which brings a few optimizations and compatibility with latest wallabag versions https://github.com/wallabag/android-app/pull/861",Update translations,0
976,Release 2.4.0-beta.4,0.7161466,"Replaces version 2.4.0-beta.2, which APK didn't have the latest changes.","fixes lint message in src/main/res/layout/list_item.xml:56: Hardcoded string ""5 min"", should use @string resource",1
977,Translated using Weblate (Portuguese),0.65517426,Translations:,Currently translated at 100.0% (259 of 259 strings),0
978,"Revert ""Add fake dep to override another dep's dep version""",0.6701137,Updated deps,,0
979,"Don't show ""empty DB dialog"", just start update",0.48565814,Dialogues suggesting to sync if needed,Currently translated at 100.0% (259 of 259 strings),0
980,Merge pull request #152 from di72nn/devel,0.525216,@di72nn added two new actions in the settings to help fix queue/synchronization issues : the ability to dump the queue to a local file and the possibility to remove the first queue item found. https://github.com/wallabag/android-app/pull/915,"fullscreen article view (clean branch, supersedes #642)",0
981,Use foreground service only if failed with normal,0.49102655,Allow to disable the preview image (by @cloud-oak),Update translations,0
982,Fix WebView crash on Android 5,0.81526697,@di72nn fixed a webview crash happening with Android 5 https://github.com/wallabag/android-app/pull/877,Currently translated at 100.0% (257 of 257 strings),1
983,new fix release,0.6756776,Other fixes and improvements,Currently translated at 100.0% (257 of 257 strings),0
984,Merge pull request #801 from NWuensche/773-fix-white-on-white,0.5105112,@NWuensche made the app use the white logo when using dark themes (#816) and added a setting to disable wrapping long preformated lines (#812).,Update translations,0
985,Merge pull request #1073 from wallabag/dependabot/gradle/com.android.tools.build-gradle-4.0.2,0.54927814,"@di72nn updated their wallabag API wrapper library to the latest version, which brings a few optimizations and compatibility with latest wallabag versions https://github.com/wallabag/android-app/pull/861",Currently translated at 100.0% (257 of 257 strings),0
986,Added translation using Weblate (Ukrainian),0.6912856,Improved translations,Currently translated at 100.0% (257 of 257 strings),0
987,Autoformat ReadArticleActivity,0.5522547,Ability to toggle justified text,Currently translated at 94.1% (242 of 257 strings),0
988,update dependencies and NotificationCompat support library,0.84019387,Update dependencies,Spelling: Mark as read,1
989,Merge pull request #941 from wallabag/dependabot/gradle/com.android.tools.build-gradle-3.6.2,0.5302345,"@di72nn updated their wallabag API wrapper library to the latest version, which brings a few optimizations and compatibility with latest wallabag versions https://github.com/wallabag/android-app/pull/861",concretize error message usually coming from 2FA,0
990,Merge pull request #811 from wallabag/update_api_wrapper,0.623579,"@di72nn updated their wallabag API wrapper library to the latest version, which brings a few optimizations and compatibility with latest wallabag versions https://github.com/wallabag/android-app/pull/861",French translation: fix agreement,0
991,Merge pull request #921 from wallabag/update-dep-eventbus-3.2.0,0.53373635,• Fix connexion to wallabag v2.0.1 servers,,0
992,Use PAGE_UP and PAGE_DOWN keycodes for scrolling,0.77358353,Scroll with PAGE_UP/PAGE_DOWN (e-ink readers),"until #359 is implemented, the user gets a concretized error message.",1
993,Add full-text search,0.59595585,Basic search,Update translations,0
994,"Fix TestConnectionTask, precompile patterns",0.68440735,Better tests for connexion issues,Currently translated at 99.6% (256 of 257 strings),0
995,fix lint messages w.r.t. minSdkVersion is 14 and never below,0.5011172,* Handle server 500 errors with message,Currently translated at 100.0% (257 of 257 strings),0
996,Merge pull request #597 from ngosang/feature/es_translation,0.49932975,Translations fixes (@di72nn),Currently translated at 100.0% (257 of 257 strings),0
997,update okttp to 3.10.0,0.552779,"Replaces version 2.4.0-beta.2, which APK didn't have the latest changes.",fixes #337,0
998,articleList: switch between Show All <-> Show Unread,0.8350322,Switch between « Show all » and « Unread articles » (still not synced),"Improve ""scroll over bottom"" logic",1
999,Rework tags managing layout,0.6440443,Layout improvements,,0
1000,TTS: better states handling,0.55397576,TTS Speech,Update translations,0
1001,Merge pull request #875 from wallabag/dependabot/gradle/androidx.recyclerview-recyclerview-1.1.0,0.5469849,@di72nn fixed a webview crash happening with Android 5 https://github.com/wallabag/android-app/pull/877,,0
1002,add some debug output to analyze #856,0.48941422,@The-Compiler introduced an option to inspect chromium webviews to assist debugging https://github.com/wallabag/android-app/pull/884,Currently translated at 100.0% (253 of 253 strings),0
1003,Merge pull request #209 from tyndare/tts-support,0.5744492,fix crash when TTS Enable/Disable and when switching to another app while TTS is running (thanks @tyndare #741),Currently translated at 91.3% (231 of 253 strings),0
1004,Added translation using Weblate (Dutch),0.70569277,Improved translations,Currently translated at 83.0% (210 of 253 strings),1
1005,Catch Socket Exception properly,0.41988623,Basic error messages,Currently translated at 84.9% (215 of 253 strings),0
1006,Merge pull request #782 from di72nn/tenkabuto-patch-1,0.54598856,@di72nn added two new actions in the settings to help fix queue/synchronization issues : the ability to dump the queue to a local file and the possibility to remove the first queue item found. https://github.com/wallabag/android-app/pull/915,Currently translated at 100.0% (253 of 253 strings),0
1007,Merge pull request #1218 from wallabag/dependabot/gradle/com.squareup.okhttp3-okhttp-4.9.3,0.50691044,@Strubbl updated the okhttp (#791) and gradle (#790) deps,Currently translated at 100.0% (253 of 253 strings),0
1008,update to okhttp:4.8.0 from okhttp:4.7.2,0.6785654,@Strubbl updated the okhttp (#791) and gradle (#790) deps,Currently translated at 100.0% (253 of 253 strings),0
1009,Lower max query length of the exists API request,0.4333625,Fix login detection when html is minified on server,,0
1010,Merge branch 'NWuensche-fixExceptionAddEntryNoServer',0.47464728,Fix migrations,French translation,0
1011,"Add a dialog to configure ""disable touch input"" button",0.88013905,Option to disable touch input,add possibility to scroll towards the bottom to mark article as read,1
1012,Persist cookies,0.3434793,* Better progress bars,,0
1013,Merge pull request #256 from wallabag/fix-http2,0.66547537,• Fix connexion to wallabag v2.0.1 servers,,0
1014,"review fixes, remove unnecessary try-catch-block",0.5943754,Fix bugs,,0
1015,Fix custom text selection actions on Android 11+,0.5768596,@scubajeff fixed custom text selection actions. (#1176),,0
1016,Merge pull request #498 from wallabag/image_fetching_pagination,0.5000872,wallabag unread items widget,,0
1017,Merge pull request #372 from wallabag/update_translations,0.5194849,Translation updates,,0
1018,Extract PreferenceKeysMap and defer its init,0.38320726,Swipe UI for Unread/Favorite/Archive,"By sorting the file and aligning with reference English translation, it eases future translation. Signed-off-by: Yoann Sculo yoann@printk.fr",0
1019,Merge pull request #1229 from wallabag/translations,0.47216275,"@di72nn updated their wallabag API wrapper library to the latest version, which brings a few optimizations and compatibility with latest wallabag versions https://github.com/wallabag/android-app/pull/861",,0
1020,Récupération des articles par flux RSS,0.56128,"• sync articles status (favourite,read) from your device to the remote server",,0
1021,Version 2.2.0,0.6764176,"Replaces version 2.4.0-beta.2, which APK didn't have the latest changes.",,0
1022,Merge pull request #1170 from Strubbl/increase-widget-number,0.5720737,@Strubbl increased max widget counter value. (#1170),not fully translated yet,0
1023,hide actionBar as well for fullscreen article view; fixes #114 and #636,0.61045516,* Improve bottom toolbar on article view,,0
1024,Merge pull request #1222 from wallabag/dependabot/gradle/org.greenrobot-eventbus-annotation-processor-3.3.0,0.5134459,"@di72nn updated their wallabag API wrapper library to the latest version, which brings a few optimizations and compatibility with latest wallabag versions https://github.com/wallabag/android-app/pull/861",,0
1025,French: misc translation correcting,0.6817513,* French,Add missing French translation,0
1026,add credit,0.39266586,* Added Framabag preset,,0
1027,Merge pull request #248 from di72nn/refactoring,0.5296401,@di72nn fixed a sync error when deleting all tags from an article,,0
1028,version beta3,0.5293403,"Release was borked, see https://github.com/wallabag/android-app/releases/tag/2.4.0-beta.3",,0
1029,minimal code optimization to avoid Boolean wrapper (#108),0.43639374,@NWuensche made the app use the white logo when using dark themes (#816) and added a setting to disable wrapping long preformated lines (#812).,,0
1030,"update deps, fix bug with new version of the deps & translations & new version",0.79285455,Update deps,,1
1031,Set lower priority to BGService thread,0.45740944,• Fix connexion to wallabag v2.0.1 servers,,0
1032,Clean up MainActivity a bit,0.60933775,- Many fixes & background improvements,,0
1033,Translated using Weblate (Galician),0.7266273,• Spanish and German translation,fixes lint messages in src/main/java/fr/gaulupeau/apps/Poche/tts/TtsService.java: Assertions are unreliable in Dalvik and unimplemented in ART. Use BuildConfig.DEBUG conditional checks instead.,1
1034,Refactor ReadArticleActivity a bit,0.54156715,Ability to toggle justified text,update aboutlibraries to latest stable 5.9.6,0
1035,Merge pull request #1177 from wallabag/fix_custom_text_selection_actions,0.48653373,wallabag unread items widget,Update translations,0
1036,Merge branch 'master' of https://hosted.weblate.org/git/wallabag/android-app into translation-updates,0.5578169,Full support for wallabag v2 API (https://github.com/di72nn/wallabag-api-wrapper),fixes lint Image without contentDescription,0
1037,IconUnreadWidget: update unreadCount implementation to use greendao3 instead of android dbutils,0.5216446,This version updates the dependencies to the okhttp libraries. That means Android 5.0 is now the minimum Android version for running this app. ,fix lint messages w.r.t. minSdkVersion is 14 and never below,0
1038,update french translation,0.77878606,Up-to-date french and spanish translations,fix lint Keyboard inaccessible widget,1
1039,Add selected tag to activity title and nav bar,0.6091839,Tags (clickable) are displayed in the article view.,fix lint MissingTranslation: Incomplete translation,0
1040,Merge pull request #249 from di72nn/upload_offline_urls_fix,0.5565963,• send URLs to server when they were added offline,fix lint DefaultLocale: Implied default locale in case conversion,0
1041,add widget that displays icon and unread count,0.6707628,- wallabag unread items widget,,0
1042,Translated using Weblate (French),0.67707705,Up-to-date french and spanish translations,Currently translated at 100.0% (226 of 226 strings),0
1043,Add dialog to select action for URL,0.51784796,Adding a Mark as Read button in the action bar,,0
1044,Merge pull request #1019 from wallabag/startup_optimizations,0.47311288,"@di72nn updated their wallabag API wrapper library to the latest version, which brings a few optimizations and compatibility with latest wallabag versions https://github.com/wallabag/android-app/pull/861","fixes lint message in src/main/res/layout/fragment_tts.xml:198: 'clickable' attribute found, please also add 'focusable'",0
1045,Merge pull request #1113 from wallabag/release_2.4.2,0.56254387,Drops wallabag v1 support : Framabag will not work anymore with this version.,"fixes the lint messages: src/main/res/layout/nav_header_main.xml:16: Missing contentDescription attribute on image --> only decorative, so not needed here, hence ignore lint src/main/res/layout/tag_list_removable_item.xml:18: Missing contentDescription attribute on image --> is an important button, add string for accessibility",0
1046,Add confirmation dialog for DB wiping,0.5314926,Dialogues suggesting to sync if needed,fix lint messages: src/main/res/values-v14: This folder configuration (v14) is unnecessary; minSdkVersion is 14. Merge all the resources in this folder into values src/main/java/fr/gaulupeau/apps/Poche/tts/TtsFragment.java:758: Unnecessary; SDK_INT is never < 14 src/main/java/fr/gaulupeau/apps/Poche/tts/TtsService.java: Unnecessary; SDK_INT is never < 14,0
1047,Merge pull request #142 from di72nn/testing,0.50614226,Better tests for connexion issues,"fixes lint messages in strings.xml. Lint message was Inconsistent number of arguments in formatting string pref_name_ui_article_fontSize; found both 0 and 1. So this commit adds formatted=""false"" to the strings where we do not want formatting but the percentage sign.",0
1048,Ignore ActionBar when switching to fullscreen videos,0.70750326,@di72nn fixed issues with themes in fullscreen view and action bar when watching full screen videos https://github.com/wallabag/android-app/pull/870,fixes lint messages for untranslatable string arrays cause they are numbers in src/main/res/values/arrays.xml,1
1049,"show info message and open Settings, if app is not configured.",0.57631785,* shows an appropriate notification when trying to add an article from the share menu when the app hasn't any configured server (#807).,fixes lint messages in src/main/java/fr/gaulupeau/apps/Poche/ui/ManageArticleTagsActivity.java: Implicitly using the default locale is a common source of bugs,0
1050,Update API wrapper to v2.0.0-beta.3,0.6812984,"@di72nn updated their wallabag API wrapper library to the latest version, which brings a few optimizations and compatibility with latest wallabag versions https://github.com/wallabag/android-app/pull/861",update gradle to 3.0.1 and wrapper to 4.1,0
1051,Add Tap-to-scroll preference category,0.5685308,Swipe UI for Unread/Favorite/Archive,lint error was: src/main/res/drawable/ic_star_black_24dp.xml:9: Use -0.61 instead of -.61 to avoid crashes on some devices,0
1052,Merge pull request #1 from di72nn/silberzwiebel/disable-touch-improvements,0.5328375,@di72nn added two new actions in the settings to help fix queue/synchronization issues : the ability to dump the queue to a local file and the possibility to remove the first queue item found. https://github.com/wallabag/android-app/pull/915,,0
1053,TTS JS parser: break text on more element types,0.43079698,tts: automatic switch to article's language (thanks @tyndare  #709),String rework,0
1054,Move all Configuration Test-related code in one place,0.4727354,Better application of runtime settings changes.,,0
1055,Better manage tags UI,0.6097351,"Basic tags support (list by tag, add/modify/delete tags on articles) ",,0
1056,Introduce a new settings system,0.67278945,Better application of runtime settings changes.,,0
1057,Update strings.xml,0.46179956,Translation updates,bump dependencies & version,0
1058,Reorganize async tasks,0.48117626,* the app now keeps the set sort order between restarts (#805),Signed-off-by: Thomas Citharel tcit@tcit.fr,0
1059,ImageCacheUtils: use correct bytes-to-string conversion,0.44899794,Multiple format download,,0
1060,Merge branch 'handle_page_up-down_key_events',0.40583837,* Improve bottom toolbar on article view,,0
1061,Save article progress only after it's loaded,0.5646616,"• sync articles status (favourite,read) from your device to the remote server",,0
1062,TTS: duration-based rewind/fast-forward,0.5121895,• Much faster synchronization,Currently translated at 100.0% (226 of 226 strings),0
1063,Merge pull request #1082 from weblate/weblate-wallabag-android-app,0.59704775,@di72nn fixed a webview crash happening with Android 5 https://github.com/wallabag/android-app/pull/877,Currently translated at 100.0% (226 of 226 strings),0
1064,Bump aboutlibraries from 7.0.3 to 7.0.4,0.76451385,AboutLibraries was automatically bumped to v7.0.3,Currently translated at 100.0% (226 of 226 strings),1
1065,"implement enabling / disabling touch screen via physical button press in ReadArticleActivity, fixes #623",0.73261845,Option to disable touch input,,1
1066,Merge pull request #432 from wallabag/fix_image_caching_npe,0.552287,Theme and downloading pictures fixes,Disable touch improvements,0
1067,Use EndlessRecyclerViewScrollListener in ArticlesListFragment,0.52369493,Brings swiping between articles,,0
1068,Correction bug #11 et #13,0.7194705,Various fixes #1004 #1005 #1006 #1011,,1
1069,Bump conscrypt-android from 2.5.0 to 2.5.1,0.6060027,Bump minSdkVersion to 10 (Gingerbread : Android 2.3.4 / Android 2.3.3),,0
1070,Migrate to AndroidX,0.6224493,@msfjarvis bumped the app's dependencies and handled the migration to AndroidX #803 ,,0
1071,Put reflection-related code in try-catch block,0.38650608,@scubajeff fixed custom text selection actions. (#1176),,0
1072,Merge pull request #648 from silberzwiebel/scrollToBottom,0.50097907,wallabag unread items widget,,0
1073,Detailed ArticlesChangedEvent,0.62655044,Brings swiping between articles,,0
1074,Use FLAG_IMMUTABLE for pending intents,0.3903607,Ability to toggle justified text,,0
1075,Add basic search,0.8768743,Basic search,,1
1076,"Revert ""Set white logo in dark themes programmatically""",0.7081137,@NWuensche made the app use the white logo when using dark themes (#816) and added a setting to disable wrapping long preformated lines (#812).,,1
1077,Merge pull request #770 from Strubbl/update-gradle-3.3.2,0.59121037,@Strubbl updated the okhttp (#791) and gradle (#790) deps,,0
1078,Merge pull request #759 from Strubbl/update-dep,0.59140503,@Strubbl updated the okhttp (#791) and gradle (#790) deps,Set selected tag in UI when restoring main activity,0
1079,Add support for Framabag custom login page,0.68803626,* Added Framabag preset,Clear tag search text field when a suggested tag is selected,0
1080,Don't crash with FileUriExposedException,0.4824627,Basic error messages,,0
1081,Apply theme to Settings,0.7010615,Theme and downloading pictures fixes,,1
1082,Move pdf downloading logic to AsyncTask,0.62774205,* Fix PDF Downloading,,0
1083,Bump okhttp-urlconnection from 4.1.0 to 4.1.1,0.6265881,• Fix connexion to wallabag v2.0.1 servers,,0
1084,French translation: remove uppercase,0.6505293,* French,Update translations,0
1085,hardware accelerated webview,0.52261204,• fast sync option,,0
1086,Add transactions in some places,0.42474666,• Add token creation to v2,,0
1087,Bump Gradle wrapper to 5.6,0.54403293,Bump version name for F-Droid users.,Currently translated at 100.0% (226 of 226 strings),0
1088,Added translation using Weblate (Indonesian),0.65505433,Improved translations,,0
