Index,Commit Message,Score,Correspond Changelog Sentence,Commit Description,Label
1,Bump graddle,0.59825045,Bump version name for F-Droid users.,Translations update from Hosted Weblate,0
2,Update pref_desc_connection_autofill string for v2,0.50475645,• Fix connexion to wallabag v2.0.1 servers,Currently translated at 95.8% (322 of 336 strings),0
3,"Fix ""add dialog"" crash",0.49923652,Dialogues suggesting to sync if needed,Currently translated at 7.7% (26 of 336 strings),0
4,Replace deprecated method usage,0.49003333,Removed legacy code. (#1114),Currently translated at 73.5% (247 of 336 strings),0
5,Update Italian translation,0.74403393,Italian,Currently translated at 1.1% (4 of 336 strings),1
6,remove link in article view since we have Open Original menu item,0.64313984,Add menu entry to copy article url to clipboard,Currently translated at 43.7% (147 of 336 strings),0
7,Merge pull request #981 from wallabag/dependabot/gradle/com.squareup.okhttp3-okhttp-4.7.1,0.51092374,@Strubbl updated the okhttp (#791) and gradle (#790) deps,Currently translated at 76.4% (257 of 336 strings),0
8,Show preview picture in article view,0.9847233,* Show preview picture in article view,Currently translated at 76.4% (257 of 336 strings),1
9,Refactor CsrfToken parsing,0.4117793,* Added Framabag preset,,0
10,Added translation using Weblate (Thai),0.7035766,Improved translations,Currently translated at 76.4% (257 of 336 strings),1
11,Supperess network_security_config warnings,0.6205696,Better handling of network-related errors.,,0
12,Merge pull request #1045 from wallabag/metadata_formatting,0.48083863,wallabag unread items widget,Currently translated at 73.5% (247 of 336 strings),0
13,French: add Miscellanea group to Interface settings category,0.47547045,• New interface !,Currently translated at 100.0% (336 of 336 strings),0
14,Bump slf4j-android from 1.7.33 to 1.7.35,0.6805293,Bump version name for F-Droid users.,Currently translated at 95.8% (322 of 336 strings),0
15,Merge pull request #245 from tyndare/tts-fix-issue-234,0.562952,fix crash when TTS Enable/Disable and when switching to another app while TTS is running (thanks @tyndare #741),,0
16,"added ""settings"" button to main view. Removed options menu from main view.",0.5579013,* Improve bottom toolbar on article view,Currently translated at 75.5% (254 of 336 strings),0
17,Fix alarmReceived delay,0.61716497,"We fixed notifications not being displayed, leading to other issues.",Currently translated at 100.0% (336 of 336 strings),0
18,Update Polish translation,0.76021826,Polish,Currently translated at 70.2% (236 of 336 strings),1
19,re-establishes v1 login connection test successful,0.49468216,Better tests for connexion issues,Currently translated at 17.2% (58 of 336 strings),0
20,Merge pull request #1033 from wallabag/dependabot/gradle/com.squareup.okhttp3-okhttp-urlconnection-4.8.1,0.5720594,• Fix connexion to wallabag v2.0.1 servers,Currently translated at 100.0% (336 of 336 strings),0
21,added buttons in toolbar and previous and next buttons,0.72667223,Previous and next article buttons,,1
22,Merge pull request #160 from di72nn/devel,0.5184171,@di72nn added two new actions in the settings to help fix queue/synchronization issues : the ability to dump the queue to a local file and the possibility to remove the first queue item found. https://github.com/wallabag/android-app/pull/915,Bumps okhttp-urlconnection from 4.9.3 to 4.10.0. - Release notes - Changelog - Commits  updated-dependencies: - dependency-name: com.squareup.okhttp3:okhttp-urlconnection   dependency-type: direct:production   update-type: version-update:semver-minor ... Signed-off-by: dependabot[bot] support@github.com,0
23,Fixed URL,0.7869506,Fix Error when incorrect URL entered.,,1
24,Add menu and share option in Article view,0.7156904,Share-menu: favorite/archive/tag articles right after sharing.,Bumps okhttp from 4.9.3 to 4.10.0. - Release notes - Changelog - Commits  updated-dependencies: - dependency-name: com.squareup.okhttp3:okhttp   dependency-type: direct:production   update-type: version-update:semver-minor ... Signed-off-by: dependabot[bot] support@github.com,1
25,Attempt to update translations for article header style tweaks,0.6848787,Updated translations,Translations update from Hosted Weblate,0
26,French: translate remove_tag,0.59014106,German and French translations strings,Currently translated at 100.0% (336 of 336 strings),0
27,TTS js parser: rewrite traversal,0.46274292,tts: automatic switch to article's language (thanks @tyndare  #709),Currently translated at 100.0% (336 of 336 strings),0
28,Try to optimize replacements in ImageCache,0.54911923,Theme and downloading pictures fixes,Currently translated at 34.8% (117 of 336 strings),0
29,Merge pull request #564 from wallabag/update_dependencies,0.55969954,• Fix connexion to wallabag v2.0.1 servers,Currently translated at 32.7% (110 of 336 strings),0
30,Add tags sync support,0.6317384,"Basic tags support (list by tag, add/modify/delete tags on articles) ",Currently translated at 99.7% (335 of 336 strings),0
31,Bump gradle from 4.2.0 to 4.2.1,0.53257006,Bump version name for F-Droid users.,,0
32,Merge pull request #688 from wallabag/update_translations,0.524801,"@di72nn updated their wallabag API wrapper library to the latest version, which brings a few optimizations and compatibility with latest wallabag versions https://github.com/wallabag/android-app/pull/861",Bumps slf4j-android from 1.7.35 to 1.7.36.  updated-dependencies: - dependency-name: org.slf4j:slf4j-android   dependency-type: direct:production   update-type: version-update:semver-patch ... Signed-off-by: dependabot[bot] support@github.com,0
33,Release 2.2.1,0.65898657,"Replaces version 2.4.0-beta.2, which APK didn't have the latest changes.",,0
34,Bump Gradle and AGP to 7.0.2,0.48485842,AboutLibraries was automatically bumped to v7.0.3,Bumps slf4j-android from 1.7.33 to 1.7.35.  updated-dependencies: - dependency-name: org.slf4j:slf4j-android   dependency-type: direct:production   update-type: version-update:semver-patch ... Signed-off-by: dependabot[bot] support@github.com,0
35,Merge pull request #957 from wallabag/track_token_expiration,0.47798762,Drops wallabag v1 support : Framabag will not work anymore with this version.,Translations update from Hosted Weblate,0
36,Add Croatian translation for metadata,0.67203397,Croatian,Currently translated at 100.0% (336 of 336 strings),0
37,Update readme icon,0.5448884,Adding a Mark as Read button in the action bar,Currently translated at 100.0% (336 of 336 strings),0
38,Translated using Weblate (English),0.72327745,Translations:,Currently translated at 17.3% (58 of 335 strings),1
39,better values for swipe,0.46178442,Better fetching of pictures,"Make the ""Scan a QR code"" button less pronounced",0
40,"added missing gradle wrapper. build app by running ""./gradlew assembleDebug""",0.5042352,@di72nn added a Gradle Wrapper Validation Github Action to prevent bad gradle-wrapper.jar binaries,,0
41,Translated using Weblate (Italian),0.6439502,Translations:,Bumps slf4j-android from 1.7.32 to 1.7.33.  updated-dependencies: - dependency-name: org.slf4j:slf4j-android   dependency-type: direct:production   update-type: version-update:semver-patch ... Signed-off-by: dependabot[bot] support@github.com,0
42,Merge pull request #205 from Strubbl/update-gradle-to-2.1.0-alpha5,0.53949785,@Strubbl updated the okhttp (#791) and gradle (#790) deps,Translations update from Weblate,0
43,TTS JS parser: split text into sentences,0.51488787,TTS Speech,,0
44,Merge pull request #1186 from wallabag/dependabot/gradle/androidx.appcompat-appcompat-1.3.1,0.5844589,@di72nn fixed a webview crash happening with Android 5 https://github.com/wallabag/android-app/pull/877,,0
45,Bump eventbus from 3.0.1 to 3.1.1,0.5263886,Bump version name for F-Droid users.,Article header style tweak,0
46,"Update strings: remove redundant ""Press here""",0.5094731,UI fixes on links and quotes, Less gap between stats and tags Slightly more horizontal padding within tag Slightly more horizontal space between tags,0
47,Limit the number of suggested tags to 50,0.9795005,Limit the number of suggested tags to 50.,,1
48,Translated using Weblate (Chinese (Simplified)),0.67862153,Chinese (Simplified), Use material icons ala Wallabag web for statistics labels Add a little more spacing,0
49,Merge pull request #1041 from milotype/croatian-2020,0.47297102,Croatian,,0
50,using support library 21 to add material action bar.,0.64041686,material action bar,Bumps eventbus-annotation-processor from 3.3.0 to 3.3.1. - Release notes - Commits  updated-dependencies: - dependency-name: org.greenrobot:eventbus-annotation-processor   dependency-type: direct:production   update-type: version-update:semver-patch ... Signed-off-by: dependabot[bot] support@github.com,0
51,Merge pull request #1080 from weblate/weblate-wallabag-android-app,0.5889439,@di72nn fixed a webview crash happening with Android 5 https://github.com/wallabag/android-app/pull/877,,0
52,Add action to copy error text to clipboard,0.6663074,Add menu entry to copy article url to clipboard,,0
53,Better error reporting for FeedUpdater,0.56962895,Better notifications,Bumps eventbus from 3.3.0 to 3.3.1. - Release notes - Commits  updated-dependencies: - dependency-name: org.greenrobot:eventbus   dependency-type: direct:production   update-type: version-update:semver-patch ... Signed-off-by: dependabot[bot] support@github.com,0
54,bump dependencies & version,0.7158836,Update dependencies,Bumps gradle from 7.0.3 to 7.0.4.  updated-dependencies: - dependency-name: com.android.tools.build:gradle   dependency-type: direct:production   update-type: version-update:semver-patch ... Signed-off-by: dependabot[bot] support@github.com,1
55,Replace all v2.wallabag.org mentions,0.58306515,Share title with url and option to remove the (via @wallabagapp),,0
56,Translated using Weblate (Swedish),0.654161,Translations:,Bumps eventbus-annotation-processor from 3.2.0 to 3.3.0. - Release notes - Commits  updated-dependencies: - dependency-name: org.greenrobot:eventbus-annotation-processor   dependency-type: direct:production   update-type: version-update:semver-minor ... Signed-off-by: dependabot[bot] support@github.com,0
57,Bump okhttp-urlconnection from 4.8.1 to 4.9.0,0.61012805,• Fix connexion to wallabag v2.0.1 servers,Translations update from Hosted Weblate,0
58,TTS: read  alt text,0.6741688,TTS Speech,Currently translated at 9.5% (32 of 335 strings),0
59,Merge pull request #1051 from wallabag/dependabot/gradle/org.conscrypt-conscrypt-android-2.5.0,0.512485,Conscrypt initialization errors are ignored now (#1103).,,0
60,Don't read  elements,0.41263404,- wallabag unread items widget,Bumps eventbus from 3.2.0 to 3.3.0. - Release notes - Commits  updated-dependencies: - dependency-name: org.greenrobot:eventbus   dependency-type: direct:production   update-type: version-update:semver-minor ... Signed-off-by: dependabot[bot] support@github.com,0
61,update travis to container system,0.40686822,Updated Connection Wizard (wallabag.it support).,Translations update from Hosted Weblate,0
62,Add basic auto sync,0.86463046,Automatic sync,Currently translated at 76.1% (255 of 335 strings),1
63,Merge pull request #281 from di72nn/fixes_for_new_api_level,0.5507432,@di72nn fixed a sync error when deleting all tags from an article,Translations update from Weblate,0
64,"Use foreground services instead of ""normal"" ones",0.57383054,Background service to handle actions offline and sync them when network is available,Currently translated at 75.8% (254 of 335 strings),0
65,cleaning up source code,0.49396092,Removed legacy code. (#1114),Currently translated at 7.1% (24 of 335 strings),0
66,Make webviews inspectable for debug builds,0.6700696,@The-Compiler introduced an option to inspect chromium webviews to assist debugging https://github.com/wallabag/android-app/pull/884,Currently translated at 1.1% (4 of 335 strings),0
67,bump version name,0.78345025,Bump version name for F-Droid users.,Currently translated at 100.0% (335 of 335 strings),1
68,Fetch unread articles from API,0.60193187,Switch between « Show all » and « Unread articles » (still not synced),Currently translated at 72.5% (243 of 335 strings),0
69,Merge pull request #1145 from wallabag/dependabot/gradle/org.conscrypt-conscrypt-android-2.5.2,0.50268865,"@di72nn updated their wallabag API wrapper library to the latest version, which brings a few optimizations and compatibility with latest wallabag versions https://github.com/wallabag/android-app/pull/861",Currently translated at 87.1% (292 of 335 strings),0
70,Merge pull request #1225 from wallabag/dependabot/gradle/org.greenrobot-eventbus-annotation-processor-3.3.1,0.5107817,"@di72nn updated their wallabag API wrapper library to the latest version, which brings a few optimizations and compatibility with latest wallabag versions https://github.com/wallabag/android-app/pull/861",Currently translated at 100.0% (335 of 335 strings),0
71,Merge pull request #1032 from wallabag/dependabot/gradle/com.squareup.okhttp3-okhttp-4.8.1,0.49922675,@Strubbl updated the okhttp (#791) and gradle (#790) deps,Currently translated at 100.0% (335 of 335 strings),0
72,Release 2.4.0-beta.1,0.71528924,"Replaces version 2.4.0-beta.2, which APK didn't have the latest changes.",,1
73,Merge pull request #881 from wallabag/extra_error_details,0.4963823,Drops wallabag v1 support : Framabag will not work anymore with this version.,Bumps okhttp-urlconnection from 4.9.2 to 4.9.3. - Release notes - Changelog - Commits  updated-dependencies: - dependency-name: com.squareup.okhttp3:okhttp-urlconnection   dependency-type: direct:production   update-type: version-update:semver-patch ... Signed-off-by: dependabot[bot] support@github.com,0
74,French: add missing translation,0.69610214,* French,,0
75,Merge pull request #446 from wallabag/fixes,0.56288505,• Fix connexion to wallabag v2.0.1 servers,Bumps okhttp from 4.9.2 to 4.9.3. - Release notes - Changelog - Commits  updated-dependencies: - dependency-name: com.squareup.okhttp3:okhttp   dependency-type: direct:production   update-type: version-update:semver-patch ... Signed-off-by: dependabot[bot] support@github.com,0
76,fixing bug: article list scrolling back to top after reading article.,0.6982329,* Improve bottom toolbar on article view,Translations update from Weblate,0
77,Version 2.2.4,0.69419557,"Replaces version 2.4.0-beta.2, which APK didn't have the latest changes.",Currently translated at 100.0% (335 of 335 strings),0
78,DownloadPdfTask: make some variable declarations final,0.45120174,* Fix PDF Downloading,App strings reworked,0
79,Merge pull request #31 from kevmeyer/rss-feed,0.437124,@di72nn fixed a sync error when deleting all tags from an article,,0
80,Merge pull request #468 from wallabag/add_change_title_dialog,0.5284846,Share title with url and option to remove the (via @wallabagapp),"URL sharing: add an option to put title in EXTRA_TITLE, but not in EXTRA_TEXT",0
81,Merge pull request #1115 from weblate/weblate-wallabag-android-app,0.59110993,@di72nn fixed a webview crash happening with Android 5 https://github.com/wallabag/android-app/pull/877,Translations update from Weblate,0
82,travis: update to build-tools-29.0.2,0.4322739,- Many fixes & background improvements,,0
83,Customize EventBus configuration,0.4390572,Better application of runtime settings changes.,Currently translated at 92.8% (314 of 338 strings),0
84,Merge pull request #664 from Strubbl/fix-lint-click-focus,0.4793142,Fix bugs,Currently translated at 91.4% (309 of 338 strings),0
85,Merge pull request #1083 from wallabag/dependabot/add-v2-config-file,0.6146871,• Fix connexion to wallabag v2.0.1 servers,Remove framabag mentions,0
86,Adjust text color in navigation bar,0.6648039,fix navbar color in dark themes in Android 9 (@Strubbl #766),Fix some lint issues,0
87,Merge pull request #1223 from wallabag/dependabot/gradle/com.android.tools.build-gradle-7.0.4,0.5495052,"@di72nn updated their wallabag API wrapper library to the latest version, which brings a few optimizations and compatibility with latest wallabag versions https://github.com/wallabag/android-app/pull/861",Translations update from Weblate,0
88,Merge pull request #279 from di72nn/fix_270,0.5096948,@di72nn added two new actions in the settings to help fix queue/synchronization issues : the ability to dump the queue to a local file and the possibility to remove the first queue item found. https://github.com/wallabag/android-app/pull/915,Currently translated at 93.7% (317 of 338 strings),0
89,update french translations,0.80135494,Up-to-date french and spanish translations,,1
90,Add a string resource for a menu item,0.49856696,Add menu entry to copy article url to clipboard,,0
91,Fix DB migration,0.7441874,Fix migrations,Bumps media from 1.4.2 to 1.4.3.  updated-dependencies: - dependency-name: androidx.media:media   dependency-type: direct:production   update-type: version-update:semver-patch ... Signed-off-by: dependabot[bot] support@github.com,1
92,Adding Settings menu + some layout,0.6410821,Layout improvements,Bumps gradle from 7.0.2 to 7.0.3.  updated-dependencies: - dependency-name: com.android.tools.build:gradle   dependency-type: direct:production   update-type: version-update:semver-patch ... Signed-off-by: dependabot[bot] support@github.com,0
93,Add logos for dark themes,0.6927505,fix theme Black on black (dark high contrast) to make it consistent (thanks @NWuensche #730),,0
94,Merge pull request #1047 from wallabag/release,0.5277108,Drops wallabag v1 support : Framabag will not work anymore with this version.,,0
95,Don't show error dialogs if credentials empty,0.5244062,Fix crash if username or password not set,,0
96,Restore Settings screen state after activity recreation,0.5187196,Proper preferences screen,Because that's not clear which Android versions use correct language codes.,0
97,fix image display when wbg server caches them,0.60872155,Fix HTTP Auth issues with pictures on Android 4.2.2.,,0
98,Merge branch 'fix-poche-article-leak' into fix-poche-article-leak-dev,0.4833134,Fix bugs,,0
99,update gradle wrapper to 5.6.4 (from 5.6),0.5683032,"@di72nn updated their wallabag API wrapper library to the latest version, which brings a few optimizations and compatibility with latest wallabag versions https://github.com/wallabag/android-app/pull/861",Bumps okhttp-urlconnection from 4.9.1 to 4.9.2. - Release notes - Changelog - Commits  updated-dependencies: - dependency-name: com.squareup.okhttp3:okhttp-urlconnection   dependency-type: direct:production   update-type: version-update:semver-patch ... Signed-off-by: dependabot[bot] support@github.com,0
100,Use domain in UI,0.6205224,View domain and not full url,,0
101,workaround for okhttp not working with http2,0.5674784,Brings http mode,Bumps okhttp from 4.9.1 to 4.9.2. - Release notes - Changelog - Commits  updated-dependencies: - dependency-name: com.squareup.okhttp3:okhttp   dependency-type: direct:production   update-type: version-update:semver-patch ... Signed-off-by: dependabot[bot] support@github.com,0
102,Merge pull request #519 from wallabag/suggest_https_by_default,0.49453336,Full support for wallabag v2 API (https://github.com/di72nn/wallabag-api-wrapper),Translations update from Weblate,0
103,Merge pull request #680 from wallabag/update_translations,0.50895363,"@di72nn updated their wallabag API wrapper library to the latest version, which brings a few optimizations and compatibility with latest wallabag versions https://github.com/wallabag/android-app/pull/861",Currently translated at 100.0% (338 of 338 strings),0
104,Replace null values from API with empty strings,0.33419836,@di72nn fixed a sync error when deleting all tags from an article,,0
105,version 1.9.9.1,0.80977106,This is the first release of 1.9,Bump media from 1.4.1 to 1.4.2,1
106,"Add logging when ""fragment is null""",0.43489262,Ability to export logcat to file,"Update gradle, Android gradle plugin, and fix some lint issues",0
107,fixed warnings: removed unused strings...,0.4956824,Corrects bugs,Bumps media from 1.4.1 to 1.4.2.  updated-dependencies: - dependency-name: androidx.media:media   dependency-type: direct:production   update-type: version-update:semver-patch ... Signed-off-by: dependabot[bot] support@github.com,0
108,Don't use expired access token,0.4805168,• Add token creation to v2,,0
109,Merge pull request #969 from wallabag/update_changelog,0.52487487,"@di72nn updated their wallabag API wrapper library to the latest version, which brings a few optimizations and compatibility with latest wallabag versions https://github.com/wallabag/android-app/pull/861",Required for Android 12.,0
110,Fix Favorites/Archived flag on updates,0.5178845,• view archived articles and favorited ones,Required for Android 12.,0
111,Add a Connection Wizard,0.8361398,Connection wizard,...to fix a lint error.,1
112,TTS: set MediaController on Activity,0.564654,fix crash when TTS Enable/Disable and when switching to another app while TTS is running (thanks @tyndare #741),,0
113,Merge pull request #1152 from wallabag/dependabot/gradle/androidx.recyclerview-recyclerview-1.2.0,0.53642225,"@di72nn updated their wallabag API wrapper library to the latest version, which brings a few optimizations and compatibility with latest wallabag versions https://github.com/wallabag/android-app/pull/861",,0
114,"Replace ""updateInTx"" call with ""update"" call in loop",0.4898347,Faster update mecanism,Bumps media from 1.3.1 to 1.4.1.  updated-dependencies: - dependency-name: androidx.media:media   dependency-type: direct:production   update-type: version-update:semver-minor ... Signed-off-by: dependabot[bot] support@github.com,0
115,TTS: Support automatic switching to next article.,0.7311411,tts: automatic switch to article's language (thanks @tyndare  #709),,1
116,Merge pull request #693 from wallabag/update_translations,0.52244604,Translation updates,,0
117,Escape HTML-markup in title,0.6311042,Share title with url and option to remove the (via @wallabagapp),,0
118,Some cosmetic changes on main view,0.6272226,Layout improvements,Fix the link menu,0
119,Don't cache credentials in ListArticlesActivity,0.42563075,UI should no longer be blocked by database operations.,This reverts commit f214a3b165a6fbf690e2a961962dfba39a9fa701. Turns out the suggested method is not called before API 24.,0
120,Merge pull request #297 from wallabag/add-missing-german-translation,0.6482352,Update german translation,Translations update from Weblate,0
121,Merge pull request #223 from Strubbl/fix-218-title-encoding-problem,0.46864766,@di72nn fixed a sync error when deleting all tags from an article,Currently translated at 84.6% (286 of 338 strings),0
122,Bump version to 1.12.1,0.647618,Bump minSdkVersion to 10 (Gingerbread : Android 2.3.4 / Android 2.3.3),,0
123,Merge remote-tracking branch 'origin/main-list' into main-list-merge,0.44674972,Fix migrations,,0
124,Add support for tags changing,0.78834623,"Basic tags support (list by tag, add/modify/delete tags on articles) ",Bumps appcompat from 1.3.0 to 1.3.1.  updated-dependencies: - dependency-name: androidx.appcompat:appcompat   dependency-type: direct:production   update-type: version-update:semver-patch ... Signed-off-by: dependabot[bot] support@github.com,1
125,Merge pull request #447 from wallabag/fix_tab_layout_padding,0.51992923,• Fix connexion to wallabag v2.0.1 servers,Bumps slf4j-android from 1.7.31 to 1.7.32.  updated-dependencies: - dependency-name: org.slf4j:slf4j-android   dependency-type: direct:production   update-type: version-update:semver-patch ... Signed-off-by: dependabot[bot] support@github.com,0
126,"fixing issue #45: removing leading, trailing and multiple whitespaces.",0.6229302,bug fixed when spaces in the title,Bumps material from 1.3.0 to 1.4.0. - Release notes - Commits  updated-dependencies: - dependency-name: com.google.android.material:material   dependency-type: direct:production   update-type: version-update:semver-minor ... Signed-off-by: dependabot[bot] support@github.com,0
127,Add stacktrace to some error notifications,0.67005265,@di72nn added extra stacktrace details when an error happens and also added a button on the error notification to copy the details to the clipboard https://github.com/wallabag/android-app/pull/881,,0
128,Merge pull request #866 from wallabag/dependabot/gradle/org.slf4j-slf4j-android-1.7.29,0.554059,"@di72nn updated their wallabag API wrapper library to the latest version, which brings a few optimizations and compatibility with latest wallabag versions https://github.com/wallabag/android-app/pull/861",Bumps gradle from 4.2.1 to 4.2.2.  updated-dependencies: - dependency-name: com.android.tools.build:gradle   dependency-type: direct:production   update-type: version-update:semver-patch ... Signed-off-by: dependabot[bot] support@github.com,0
129,Merge pull request #707 from wallabag/add-issue-template,0.49820513,@di72nn fixed a sync error when deleting all tags from an article,,0
130,Merge pull request #341 from wallabag/fix-lint-issues-2,0.614576,• Fix connexion to wallabag v2.0.1 servers,Bumps slf4j-android from 1.7.30 to 1.7.31.  updated-dependencies: - dependency-name: org.slf4j:slf4j-android   dependency-type: direct:production   update-type: version-update:semver-patch ... Signed-off-by: dependabot[bot] support@github.com,0
131,Replace some PNG icons with vector drawables,0.5274282,* Icons and logo should now render better on each theme,Version 2.4.3,0
132,Merge branch 'no_splash_for_empty_activity',0.4416352,Fix activity not closing when bagging.,Signed-off-by: Thomas Citharel tcit@tcit.fr,0
133,Merge pull request #1208 from wallabag/lint,0.52740043,• Fix connexion to wallabag v2.0.1 servers,Fix custom text selection actions on Android 11+,0
