Index,Commit Message,Score,Correspond Changelog Sentence,Commit Description,Label
1268,Bump slf4j-android from 1.7.35 to 1.7.36,0.68982995,Bump version name for F-Droid users.,,0
1269,Add new changelog,0.47422317,Changed,,0
1270,"Improve ""scroll over bottom"" logic",0.5938301,* Improve bottom toolbar on article view,,0
1271,Bump gradle from 4.1.1 to 4.1.3,0.5328607,Bump version name for F-Droid users.,Avoid IllegalStateException in ConnectionWizardActivity,0
1272,Update app and DB schema versions,0.54747856,Target SDK version updated to 30 (Android 11) (#1072).,Remove cancel menu item from ManageArticleTagsActivity. Fixes #448,0
1273,Unescape HTML characters in title,0.5898212,Share title with url and option to remove the (via @wallabagapp),Use dialog instead of activity for adding new url,0
1274,Bump okhttp-urlconnection from 4.7.0 to 4.7.1,0.6156745,• Fix connexion to wallabag v2.0.1 servers,,0
1275,Merge pull request #153 from di72nn/devel,0.5129944,@di72nn added two new actions in the settings to help fix queue/synchronization issues : the ability to dump the queue to a local file and the possibility to remove the first queue item found. https://github.com/wallabag/android-app/pull/915,,0
1276,Merge branch 'ngosang/quotes',0.3964641,UI fixes on links and quotes,,0
1277,Merge pull request #120 from di72nn/devel,0.53154624,@di72nn added two new actions in the settings to help fix queue/synchronization issues : the ability to dump the queue to a local file and the possibility to remove the first queue item found. https://github.com/wallabag/android-app/pull/915,,0
1278,Merge pull request #300 from AndyScherzinger/master,0.42663348,add Share and Copy options for link menu (thanks @NWuensche #677),,0
1279,Bump gradle from 3.4.2 to 3.5.0,0.5298058,Bump version name for F-Droid users.,,0
1280,Bump okhttp from 4.2.1 to 4.2.2,0.60995436,@Strubbl updated the okhttp (#791) and gradle (#790) deps,More fixes,0
1281,Minor formatting changes,0.66002905,Other minor changes,Escape HTML-markup in title,0
1282,Merge branch 'di72nn-leblanc-simon/fix/497-detect-form-minified-patch1' into fix/497-detect-form-minified,0.51302826,Various fixes #1004 #1005 #1006 #1011,,0
1283,default generated AppWidget by Android Studio,0.502044,Splash screen when starting app https://github.com/wallabag/android-app/pull/1008,Remove fitsSystemWindows property from layout with tabs,0
1284,Update filters in articles list,0.5917128,• limit articles,,0
1285,Use write-ahead logging and non-exclusive DB transactions,0.44565308,* Added possibility to move database to internal or external storage,Fix an issue with incorrectly updated tagIDs,0
1286,remove buildToolsVersion,0.49902272,Removed,...to work around a bug in greendao,0
1287,Added translation using Weblate (Aragonese),0.6953738,Improved translations,,0
1288,Correction de quelques bugs avec le offline,0.6049003,Better handling of network-related errors.,,0
1289,Merge pull request #48 from wallabag/dev,0.53016526,• Fix connexion to wallabag v2.0.1 servers,Fixes,0
1290,update aboutlibraries to latest stable 5.9.6,0.7046399,AboutLibraries was automatically bumped to v7.0.3,,1
1291,Fix login page detection when html code is minified,0.8940157,Fix login detection when html is minified on server,,1
1292,Merge pull request #364 from wallabag/update_readme,0.52742743,"@di72nn updated their wallabag API wrapper library to the latest version, which brings a few optimizations and compatibility with latest wallabag versions https://github.com/wallabag/android-app/pull/861",,0
1293,update gradle to 2.2.3,0.5880095,"Replaces version 2.4.0-beta.2, which APK didn't have the latest changes.",,0
1294,Show more info in case of malformed feeds,0.4874629,Basic error messages,v2 API,0
1295,TTS: show notification whenever TTS is active,0.61189175,fix crash when TTS Enable/Disable and when switching to another app while TTS is running (thanks @tyndare #741),,0
1296,Merge pull request #450 from wallabag/avoid_connection_wizard_exception,0.5134413,• Fix connexion to wallabag v2.0.1 servers,,0
1297,Merge pull request #916 from wallabag/fix_null_content,0.4919048,wallabag unread items widget,,0
1298,Merge pull request #687 from yoannsculo/french_translation,0.51216865,Translations fixes (@di72nn),,0
1299,Merge pull request #439 from wallabag/various_changes,0.44988567,"@di72nn updated their wallabag API wrapper library to the latest version, which brings a few optimizations and compatibility with latest wallabag versions https://github.com/wallabag/android-app/pull/861",,0
1300,adds menu entry to copy article url to clipboard,0.99176586,Add menu entry to copy article url to clipboard,,1
1301,Add SyncQueue operation notification (for debug),0.6712109,Automatic sync,,0
1302,Fix migration to schema version 104,0.66058856,Fix migrations,,0
1303,Bump media from 1.4.2 to 1.4.3,0.5951195,Bump version name for F-Droid users.,,0
1304,Merge pull request #546 from ngosang/feature/img_regex,0.48508474,@di72nn fixed a sync error when deleting all tags from an article,,0
1305,TTS: Fix notification problems.,0.7604508,fix crash when TTS Enable/Disable and when switching to another app while TTS is running (thanks @tyndare #741),,1
1306,Minor tweaks to tags styling in article,0.68912405,"Basic tags support (list by tag, add/modify/delete tags on articles) ",,0
1307,Merge pull request #269 from wallabag/nicosomb-patch-1,0.5442984,• Fix connexion to wallabag v2.0.1 servers,,0
1308,Add release changelog,0.5323633,Update dependencies,Also make article sweeping optinal,0
1309,Bump okhttp-urlconnection from 4.2.1 to 4.2.2,0.6447021,• Fix connexion to wallabag v2.0.1 servers,,0
1310,Apply themes without [explicit] restart,0.62056565,"* Fix display of tables, quotes and <pre> elements in all themes",,0
1311,Added translation using Weblate (Swedish),0.68153524,Improved translations,,0
1312,Update issue_template.md,0.65585774,Update dependencies,,0
1313,Merge pull request #924 from wallabag/dependabot/gradle/com.squareup.okhttp3-okhttp-urlconnection-4.4.0,0.5708605,• Fix connexion to wallabag v2.0.1 servers,Instead of parsing URL,0
1314,TTS: fix vector drawable crash on android 5.0,0.6212801,fix crash when TTS Enable/Disable and when switching to another app while TTS is running (thanks @tyndare #741),,0
1315,Merge pull request #49 from wallabag/dev,0.5101668,• Fix connexion to wallabag v2.0.1 servers,,0
1316,use dialog instead of activity for adding new url,0.49500835,Add menu entry to copy article url to clipboard,,0
1317,Fixes #239 NullPointerException on Article.getTitle(),0.5246813,@di72nn fixed a sync error when deleting all tags from an article,,0
1318,TTS JS parser: fix emphasis handling,0.4721633,tts: automatic switch to article's language (thanks @tyndare  #709),,0
1319,Make highlight color different from background color,0.70078486,@NWuensche fixed the highlight color for several themes #808,,1
1320,Merge pull request #948 from wallabag/dependabot/gradle/com.squareup.okhttp3-okhttp-urlconnection-4.5.0,0.55844015,• Fix connexion to wallabag v2.0.1 servers,,0
1321,Translated using Weblate (Arabic),0.685673,Translations:,,0
1322,Allow to see a list of untagged articles,0.74941266,"""Untagged"" list.",,1
1323,Merge pull request #626 from wallabag/update_translations,0.5424835,"@di72nn updated their wallabag API wrapper library to the latest version, which brings a few optimizations and compatibility with latest wallabag versions https://github.com/wallabag/android-app/pull/861",,0
1324,Minor strings.xml correction,0.46871758,Corrects bugs,,0
1325,"Fix ""wallabag"" name in strings",0.48868817,Share title with url and option to remove the (via @wallabagapp),Add navigation drawer. Add tags list and filtering by tags. Various other changes.,0
1326,Merge branch 'master' into update-to-greendao-3,0.4147055,Update dependencies,,0
1327,Merge pull request #387 from wallabag/fix_comparison_error_in_settings,0.55360186,• Fix connexion to wallabag v2.0.1 servers,"Also: ImageCaching is started via ""nextRequest"". Minor event changes.",0
1328,fix lint Invalid vector paths in ic_star_black,0.3584345,Fix Error when incorrect URL entered.,,0
1329,Bump appcompat from 1.0.2 to 1.1.0 (#830),0.60504353,Bump minSdkVersion to 10 (Gingerbread : Android 2.3.4 / Android 2.3.3),Still no UI,0
1330,Merge pull request #1133 from wallabag/dependabot/gradle/com.squareup.okhttp3-okhttp-4.9.1,0.49120653,@Strubbl updated the okhttp (#791) and gradle (#790) deps,,0
1331,Bump stetho-okhttp3 from 1.5.0 to 1.5.1,0.5819882,@Strubbl updated the okhttp (#791) and gradle (#790) deps,,0
1332,Merge branch 'fix_getCredentials',0.47696614,Fix bugs,,0
1333,Merge pull request #832 from wallabag/dependabot/gradle/com.squareup.okhttp3-okhttp-4.2.0,0.5229006,@Strubbl updated the okhttp (#791) and gradle (#790) deps,,0
1334,Fix images in case of HTTP Auth (for some devices),0.8903405,Fix HTTP Auth issues with pictures on Android 4.2.2.,,1
1335,introduce Setting for Wallabag version,0.62894225,Full support for wallabag v2 API (https://github.com/di72nn/wallabag-api-wrapper),Only debug UI,0
1336,Translated using Weblate (Dutch),0.67444193,Translations:,,0
1337,Correction problème encodage. Possibilité de vider la BD locale.,0.5362257,* Fix PDF Downloading,,0
1338,Reorganize DAO-packages,0.4517467,Updated deps,,0
1339,merge,0.46125492,About activity,Take advantage of server-side sort,0
1340,Don't perform sweeping if local total <= remote total,0.2980979,Background service to handle actions offline and sync them when network is available,,0
1341,Replace UpdateFeedTask with service call,0.5290625,Update on startup, except for downloading PDF,0
1342,Merge pull request #400 from wallabag/fix_default_value_for_theme,0.50328887,Share title with url and option to remove the (via @wallabagapp),,0
1343,Version 2.4.1,0.6982788,"Replaces version 2.4.0-beta.2, which APK didn't have the latest changes.",Various changes,0
1344,Add request chaining,0.4087976,• Add token creation to v2,,0
1345,udpate stetho to 1.5.0,0.4683993,"Lots of dependency updates (stetho, conscrypt, okhttp, material).",,0
1346,"Revert ""Replace deprecated method usage""",0.5155926,Removed,Currently translated at 100.0% (209 of 209 strings),0
1347,Merge pull request #1134 from wallabag/dependabot/gradle/com.squareup.okhttp3-okhttp-urlconnection-4.9.1,0.5556458,• Fix connexion to wallabag v2.0.1 servers,Fix storage access for image caching,0
1348,update okhttp to 3.14.2 from 3.13.1,0.6607066,This version updates the dependencies to the okhttp libraries. That means Android 5.0 is now the minimum Android version for running this app. ,,0
1349,update gradle to 4.0 and gradle distribution to 6.1.1,0.48292014,"Replaces version 2.4.0-beta.2, which APK didn't have the latest changes.",Bump version to 1.12.1,0
1350,Merge remote-tracking branch 'upstream/fix-weblate-duplicate-lang-en',0.45841455,Fix migrations,,0
1351,Bump okhttp from 4.3.1 to 4.4.0,0.6029519,This version updates the dependencies to the okhttp libraries. That means Android 5.0 is now the minimum Android version for running this app. ,Update translations,0
1352,Merge pull request #57 from kevmeyer/dev,0.4402026,@di72nn added two new actions in the settings to help fix queue/synchronization issues : the ability to dump the queue to a local file and the possibility to remove the first queue item found. https://github.com/wallabag/android-app/pull/915,Currently translated at 100.0% (209 of 209 strings),0
1353,Fix NPE in SecondaryService.fetchImages(),0.5574468,Theme and downloading pictures fixes,Currently translated at 100.0% (209 of 209 strings),0
1354,new release,0.6459917,This is the first release of 1.9,Currently translated at 100.0% (209 of 209 strings),0
1355,Delete app.iml,0.5114734,Removed,Currently translated at 99.5% (209 of 209 strings),0
1356,Bump okhttp from 4.2.0 to 4.2.1,0.61237335,This version updates the dependencies to the okhttp libraries. That means Android 5.0 is now the minimum Android version for running this app. ,Update permissions and README,0
1357,Update the Android Plugin for Gradle to 2.2.0,0.58037114,This version updates the dependencies to the okhttp libraries. That means Android 5.0 is now the minimum Android version for running this app. ,,0
1358,Simplify listener,0.45176786,Ability to toggle justified text,,0
1359,Updater: minor changes,0.7376052,Other minor changes,ImageCache: fix NPE,1
1360,update build-tools for travis,0.4428018,- Many fixes & background improvements,,0
1361,Make date in article view non-breaking,0.53974473,Show reading time for entry in list view,Fix Spanish translation,0
1362,Merge pull request #765 from Strubbl/translation-updates,0.55698586,@Strubbl updated the okhttp (#791) and gradle (#790) deps,,0
1363,Add text and layout for overflow/prewrap setting,0.5575408,Layout improvements,ImageCache: fix responsiveParametersPatterns,0
1364,add the fix for http2 back,0.6749392,• Fix connexion to wallabag v2.0.1 servers,,0
1365,Add an option to reverse list order,0.7217311,Reverse sort order,,1
1366,Optimize offline queue during sync,0.7505966,Background service to handle actions offline and sync them when network is available,,1
1367,Merge pull request #1039 from wallabag/add_russian_metadata,0.42892617,@di72nn fixed a sync error when deleting all tags from an article,,0
1368,Merge pull request #1000 from weblate/weblate-wallabag-android-app,0.5476092,@di72nn fixed a webview crash happening with Android 5 https://github.com/wallabag/android-app/pull/877,,0
1369,Fix wrong icons after list scroll,0.55682886,Display Favourite and Read icons in list of articles,,0
1370,Merge branch 'leblanc-simon/fix/497-detect-form-minified',0.42022657,Fix bugs,,0
1371,travis: enable lint report as text on commandline,0.4652682,Ability to export logcat to file,,0
1372,Merge pull request #833 from wallabag/dependabot/gradle/com.squareup.okhttp3-okhttp-urlconnection-4.2.0,0.57260895,• Fix connexion to wallabag v2.0.1 servers,,0
1373,Autoformat and apply recommendations to list fragments,0.49540415,"Basic tags support (list by tag, add/modify/delete tags on articles) ",,0
1374,Rename auto-update to auto-sync,0.6613165,Automatic sync,ImageCache: ignore images with relative/incorrect URLs,0
1375,"Context-dependent ""Prev""/""Next"" buttons",0.69366,Previous and next article buttons,,0
1376,Merge pull request #1046 from weblate/weblate-wallabag-android-app,0.5842004,@di72nn fixed a webview crash happening with Android 5 https://github.com/wallabag/android-app/pull/877,,0
1377,Added translation using Weblate (Occitan),0.7027971,Improved translations,Currently translated at 100.0% (209 of 209 strings),1
1378,display the article content in a webview,0.70416373,Tags (clickable) are displayed in the article view.,Currently translated at 100.0% (209 of 209 strings),1
1379,Bump okhttp-urlconnection from 4.9.1 to 4.9.2,0.60995275,• Fix connexion to wallabag v2.0.1 servers,,0
1380,Remove framabag mentions,0.5443102,@di72nn fixed a sync error when deleting all tags from an article,Also use BaseActionBarActivity class as base for more activities,0
1381,review fixes,0.83052945,Other fixes and improvements,,1
1382,Don't crash if full-text search returns an error,0.53524375,Jeff Held (@solkaz) fixed a crash during search when certain characters are used. (#1125),,0
1383,Merge pull request #985 from wallabag/dependabot/gradle/com.squareup.okhttp3-okhttp-urlconnection-4.7.2,0.56202346,• Fix connexion to wallabag v2.0.1 servers,Update lists,0
1384,UpdateFeedTask for v2,0.6158943,Update dependencies,,0
1385,Added translation using Weblate (Basque),0.7003378,Improved translations,,1
1386,Merge branch 'theme_fixes',0.5323132,Theme and downloading pictures fixes,,0
1387,Bump okhttp-urlconnection from 4.9.0 to 4.9.1,0.59813213,• Fix connexion to wallabag v2.0.1 servers,,0
1388,Add background service and change a lot of stuff,0.65971094,- Many fixes & background improvements,,0
1389,"Add ""delete article"" function",0.5980637,"Basic tags support (list by tag, add/modify/delete tags on articles) ",,0
1390,Add support for annotation modifications,0.62068045,@di72nn added experimental support for annotations. This feature is disabled by default until we polish the angles and can be activated in the settings. https://github.com/wallabag/android-app/pull/843,,0
1391,Merge pull request #324 from wallabag/fix_user_changing,0.54114854,• Fix connexion to wallabag v2.0.1 servers,,0
1392,Add basic options to dump and clean offline queue,0.5955747,Background service to handle actions offline and sync them when network is available,,0
1393,Merge pull request #1192 from wallabag/fix_link_menu,0.599753,• Fix connexion to wallabag v2.0.1 servers,,0
1394,Merge pull request #312 from auroszx/master,0.458521,• HTTP Auth,,0
1395,App strings reworked,0.46639395,UI Improvements,,0
1396,Close transparent activity in BagItProxyActivity,0.5741303,Fix activity not closing when bagging.,,0
1397,Save and restore article reading progress,0.6016946,"• sync articles status (favourite,read) from your device to the remote server",,0
1398,Merge pull request #1044 from wallabag/readme_icon,0.55875266,wallabag unread items widget,,0
1399,Merge pull request #1220 from weblate/weblate-wallabag-android-app,0.5800997,@di72nn fixed a webview crash happening with Android 5 https://github.com/wallabag/android-app/pull/877,,0
1400,Merge pull request #1029 from weblate/weblate-wallabag-android-app,0.5926974,@di72nn fixed a webview crash happening with Android 5 https://github.com/wallabag/android-app/pull/877,DB: add migration from 5 to 6,0
1401,Merge pull request #592 from wallabag/follow-up-pr-492-simounet-feature/reading-time-main-screen,0.5180867,@di72nn added two new actions in the settings to help fix queue/synchronization issues : the ability to dump the queue to a local file and the possibility to remove the first queue item found. https://github.com/wallabag/android-app/pull/915,,0
1402,beta 5,0.35811105,"Release was borked, see https://github.com/wallabag/android-app/releases/tag/2.4.0-beta.3",Fix default theme name (to match enum),0
1403,Version 2.3.0-beta.2,0.73598635,"Replaces version 2.4.0-beta.2, which APK didn't have the latest changes.",,1
1404,use AppCompatActivity,0.48008063,UI Improvements,add source app info to notifications,0
1405,Merge pull request #763 from Strubbl/update-to-okhttp-3.13.1,0.6445869,@Strubbl updated the okhttp (#791) and gradle (#790) deps,Update transtations,0
1406,Show ImageFetching notification only if there are images to fetch,0.6006175,Allow to disable the preview image (by @cloud-oak),,0
1407,Use MainActivity with fragments,0.44801137,"Basic tags support (list by tag, add/modify/delete tags on articles) ",Currently translated at 100.0% (207 of 207 strings),0
1408,Add attributes to v21/styles themes,0.5362792,* Icons and logo should now render better on each theme,Currently translated at 100.0% (207 of 207 strings),0
1409,Merge pull request #935 from wallabag/dependabot/gradle/org.conscrypt-conscrypt-android-2.4.0,0.48719734,"@di72nn updated their wallabag API wrapper library to the latest version, which brings a few optimizations and compatibility with latest wallabag versions https://github.com/wallabag/android-app/pull/861",Currently translated at 100.0% (206 of 206 strings),0
1410,Fix non-unique PendingIntent,0.5242705,Various fixes #1004 #1005 #1006 #1011,,0
1411,Merge pull request #1156 from weblate/weblate-wallabag-android-app,0.59397733,@di72nn fixed a webview crash happening with Android 5 https://github.com/wallabag/android-app/pull/877,,0
1412,Bump okhttp from 4.2.2 to 4.3.0,0.61152923,This version updates the dependencies to the okhttp libraries. That means Android 5.0 is now the minimum Android version for running this app. ,,0
1413,Merge pull request #1012 from wallabag/version-2.4.0-beta.4,0.57862437,Drops wallabag v1 support : Framabag will not work anymore with this version.,This commit adds the information to a notification that wallabag is the source of that notification. Otherwise notification from similar apps cannot be distinguished.,0
1414,Merge pull request #504 from wallabag/update-debug-msgs,0.5363721,Drops wallabag v1 support : Framabag will not work anymore with this version.,Development,0
1415,Merge pull request #1 from di72nn/magic_urls,0.5044413,View domain and not full url,,0
1416,"Add ""Open original"" option to context menu",0.47872353,Share-menu: favorite/archive/tag articles right after sharing.,,0
1417,indicate download with progressBar in MainActivity,0.59628093,* Better progress bars,,0
1418,Unset isConfigurationOk flag in Settings,0.43973118,@NWuensche fixed a display issue with the 3 dot menu on dark theme (thanks!) #801 ,,0
1419,Fix initial sort order of articles (#805),0.75045276,Reverse sort order,,1
1420,1.9.3,0.5378709,This is the first release of 1.9,,0
1421,Fetch images in SecondaryService,0.65675163,Better fetching of pictures,Fix image link in README,0
1422,Merge pull request #695 from wallabag/update_dependencies,0.5514014,• Fix connexion to wallabag v2.0.1 servers,... in widget layout,0
1423,Add read-only tags support,0.72374827,"Basic tags support (list by tag, add/modify/delete tags on articles) ",,1
1424,added back button to action bar.,0.7461008,Adding a Mark as Read button in the action bar,,1
1425,Change full update wipe order,0.5698438,* the app now keeps the set sort order between restarts (#805),,0
1426,Replace tabs with spaces,0.54446805,bug fixed when spaces in the title,,0
1427,Fix support dependency version,0.8354108,Update dependencies,,1
1428,Bump gradle from 3.5.1 to 3.5.2,0.5210332,Bump version name for F-Droid users.,,0
1429,Update libraries,0.7553839,Update dependencies,,1
1430,Merge pull request #845 from wallabag/dependabot/gradle/com.android.tools.build-gradle-3.5.1,0.5356819,@di72nn fixed a webview crash happening with Android 5 https://github.com/wallabag/android-app/pull/877,,0
1431,Minor layout corrections,0.8082986,Layout improvements,,1
1432,Update gradle from 3.4.1 to 3.4.2,0.55615544,"Replaces version 2.4.0-beta.2, which APK didn't have the latest changes.",,0
1433,Merge pull request #755 from wallabag/weblate-update,0.53748274,• Fix connexion to wallabag v2.0.1 servers,,0
1434,"added fullscreen support for article view, toggable via settings",0.71410185,add setting to keep screen on while reading an article (thanks @nwuensche #724),Minor README updates,1
1435,Added translation using Weblate (Hindi),0.71176594,Improved translations,,1
1436,Validate gradle wrapper only on pushes to the default branch,0.54311293,@di72nn added a Gradle Wrapper Validation Github Action to prevent bad gradle-wrapper.jar binaries,  Resources for updating the readme.   Updates to the readme   Folder for image resources   A folder to hold all the images used in the readme.   Delete Wallabag Article View.png   Delete Wallabag Reading List.png   Delete unnamed.png   Images for the readme   Images uploaded again into the folder created for the readme. Logo file has a proper name now.   Make necessary corrections   Fixed a problem with the link   Fixed problem with the F-Droid link showing up for succeeding text.  Update README.md,0
1437,Replace JCenter with Maven Central,0.39471588,• Fix connexion to wallabag v2.0.1 servers,,0
1438,Added ReadAll option + some cosmetic changes.,0.5706508,Layout improvements,These changes were rebased and squashed by @di72nn. Blame @di72nn for rebase-related mistakes.,0
1439,Autoformat list adapters,0.51367307,Automatic sync,"Not in the UI, though",0
1440,Merge pull request #376 from wallabag/404_workaround,0.5018032,• Fix connexion to wallabag v2.0.1 servers,,0
1441,Added translation using Weblate (Croatian),0.64968204,Improved translations,Fix FeedsUserID change detection,0
1442,Minor changes,0.97347283,Other minor changes,,1
1443,Merge pull request #80 from etnadji/master,0.411936,@di72nn fixed a sync error when deleting all tags from an article,double default limit of article list items,0
1444,"Try to fix ""accept all SSL certs"" function",0.5690514,Fix Self-signed certificates issue,Try to fix IllegalArgumentEx on Dialog.dismiss(),0
1445,Merge pull request #927 from wallabag/dependabot/gradle/com.android.tools.build-gradle-3.6.0,0.54040843,"@di72nn updated their wallabag API wrapper library to the latest version, which brings a few optimizations and compatibility with latest wallabag versions https://github.com/wallabag/android-app/pull/861",,0
1446,Merge pull request #978 from wallabag/dependabot/gradle/com.squareup.okhttp3-okhttp-urlconnection-4.7.0,0.56310594,• Fix connexion to wallabag v2.0.1 servers,,0
1447,show error messages when feed downloading is not successful.,0.64872396,Basic error messages,Show more info in case of malformed feeds,0
1448,Merge pull request #149 from di72nn/devel,0.5313331,@di72nn added two new actions in the settings to help fix queue/synchronization issues : the ability to dump the queue to a local file and the possibility to remove the first queue item found. https://github.com/wallabag/android-app/pull/915,Streamline wallabag.it configuration with QR-code,0
1449,Use DiffUtil to update lists,0.5196068,Update deps,Update dependencies,0
1450,Merge pull request #794 from wallabag/notification_channels,0.5022327,• Fix connexion to wallabag v2.0.1 servers,,0
1451,Make BaseActionBarActivity abstract,0.48103428,material action bar,,0
1452,Merge pull request #894 from weblate/weblate-wallabag-android-app,0.5814181,@di72nn fixed a webview crash happening with Android 5 https://github.com/wallabag/android-app/pull/877,Update translations,0
1453,Add logos as attributes in style files,0.5467154,* Icons and logo should now render better on each theme,Don't stuck on deleted articles,0
1454,Improve progress bars,0.938029,* Better progress bars,,1
1455,Merge pull request #1200 from wallabag/dependabot/gradle/androidx.media-media-1.4.2,0.514221,Compatibility with wallabag 2.4 (by @di72nn),,0
