Commit Message,Score,Correspond Changelog Sentence,Commit Description,Label
Use non-exclusive DB transactions,0.3564486,UI should no longer be blocked by database operations.,,0
Classify some more exceptions as Temporary,0.40029976,Better handling of network-related errors.,,0
Hide update UI if error occurs,0.38542145,UI should no longer be blocked by database operations.,,0
Add scrolling with volume buttons,0.49925762,add scrolling via hardware keys in article lists (thanks @silberzwiebel #690),,0
Merge pull request #310 from wallabag/fix_settings,0.534773,"Important changes if you're coming from a 1.x version : This release drops wallabag v1 support. If you need support for wallabag v1, you must build yourself the sources from the v1_legacy branch.",Settings: better application of runtime changes,0
Merge pull request #311 from wallabag/use_job_scheduler,0.46068856,Full support for wallabag v2 API (link),Use JobScheduler on Android 5+,0
Merge pull request #312 from auroszx/master,0.32471776,Version 2.3.0 was started in August 2019 and contained over a hundred commits.,updated Spanish translation for v1.10,0
updated Spanish translation for v1.10,0.6816956,Updates to the following translations were made:,,0
Use JobScheduler on Android 5+,0.37590033,Note: We don't do special releases for Android < 5 anymore.,,0
Settings: better application of runtime changes,0.92504233,Better application of runtime settings changes.,Use onStart/Stop instead of onResume/Pause. Fix application of autosync enabled/interval changed.,1
bump version to 1.10,0.53808856,This is the first release of 1.9,,0
Add Tap-to-scroll preference category,0.5100174,add scrolling via hardware keys in article lists (thanks @silberzwiebel #690),,0
Don't allow decimal point in Int preferences,0.28727803,Option to disable touch input,,0
Add tap-to-scroll option,0.5644969,add scrolling via hardware keys in article lists (thanks @silberzwiebel #690),,0
Merge pull request #297 from wallabag/add-missing-german-translation,0.5907916,Update german translation,"add German translation strings, fix some English and a Spanish string",0
Merge pull request #301 from wallabag/preferences-screen-categories,0.42845887,"Important changes if you're coming from a 1.x version : This release drops wallabag v1 support. If you need support for wallabag v1, you must build yourself the sources from the v1_legacy branch.",improve UI in preference screen by using categories,0
Merge pull request #300 from AndyScherzinger/master,0.3843112,Version 2.3.0 was started in August 2019 and contained over a hundred commits.,wallabag:// magic URLs,0
Merge pull request #1 from di72nn/magic_urls,0.36704123,Huge thanks to @di72nn.,"Better init with ""magic url""",0
"ConnectionWizard: change init with ""magic url""",0.42104766,Connection wizard,,0
wallabag:// magic URLs,0.6001201,- wallabag can show up as a browser,,0
improve UI in preference screen by using categories,0.5281769,Proper preferences screen,"This commit adds preference categories as indication in which of the setting's sub menu you currently are. This was already done for the ""Connection"" menu, but not for the other tree menu points. This commit moves the ""Delete cookies"" option visually (not syntactically) from the HTTP Basic Auth category to the ""Advanced connection settings"". That way the cookies option is not linked to the HTTP basic auth options anymore.",0
German: add string array pref_option_autoSync_type,0.39977646,German and French translations strings,,0
improve German translation,0.74356997,Update german translation,,1
"add German translation strings, fix some English and a Spansish string",0.71183217,German and French translations strings,,1
Merge pull request #269 from wallabag/nicosomb-patch-1,0.44936463,"Thanks to @di72nn and @NWuensche, the following fixes were added:",Update f-droid logo,0
Update Google Play and F-Droid badges,0.51685584,Bump version name for F-Droid users.,,0
Merge pull request #296 from wallabag/french-trad,0.4280218,"Important changes if you're coming from a 1.x version : This release drops wallabag v1 support. If you need support for wallabag v1, you must build yourself the sources from the v1_legacy branch.",up-to-date french translation,0
use unicode …,0.49963838,"thanks to @Strubbl and @di72nn, the special characters in the title are now HTML decoded link",,0
Update the Android Plugin for Gradle to 2.2.0,0.5176521,"Replaces version 2.4.0-beta.2, which APK didn't have the latest changes.",,0
typos,0.4711843,bugs and translations...,,0
up-to-date translation,0.83190393,Up-to-date french and spanish translations,,1
Merge pull request #294 from di72nn/282_follow-up,0.4182087,Huge thanks to @di72nn.,Minor improvements,0
Add article auto-downloading triggered by URL upload,0.63832915,- Downloading PDFs of articles,,0
Update Android support libs,0.59846693,@msfjarvis bumped the app's dependencies and handled the migration to AndroidX #803 ,,0
Re-apply some connection params changes w/o restart,0.38786322,Better application of runtime settings changes.,,0
Add an option to clear cookies,0.40625018,• save page without having to login each time inside your browser,,0
Replace connection wizard stub line with decent one,0.57517916,Connection wizard,,0
"Hide ""Sync local changes"" option if in sync",0.4743991,Dialogues suggesting to sync if needed,,0
"Remove ""Test Configuration"" from menu",0.34240657,Proper preferences screen,,0
Put reflection-related code in try-catch block,0.3100081,* Handle server 500 errors with message,Just in case.,0
Update feeds after connection test if DB is empty,0.3285419,• feed credentials no longer have to be input and can automatically be fetched when you provide username and password,,0
Merge pull request #282 from di72nn/background_improvements,0.47414044,Many fixes & background improvements,[WIP] Decent offline functionality and other improvements,0
Rename auto-update to auto-sync,0.5343529,Automatic sync,,0
"Add ""Wipe DB"" option to new Settings",0.36536258,* Added possibility to move database to internal or external storage,,0
Clean up strings.xml,0.3329642,@di72nn fixed a sync error when deleting all tags from an article,,0
Extract strings from Connection Wizard layout,0.4863349,Connection wizard,,0
Connection Wizard: disable the Summary page by default,0.48667157,Connection wizard,,0
"Revert ""travis: enable lint report as text on commandline""",0.31245863,AboutLibraries was automatically bumped to v7.0.3,This reverts commit a27e90c973e21945f553df20c33edc37555f250b.,0
Yet another try to fix CI build,0.36801776,Corrects bugs,,0
travis: enable lint report as text on commandline,0.27703258,Konrad Heidler (@khdlr) added LaTeX rendering (optional) (#1104).,,0
Connection Wizard: fix first page backstack issue,0.45298475,Connection wizard,,0
Widget: include Favorite articles in unread count,0.6453859,wallabag unread items widget,,0
"Revert ""Try to fix CI build""",0.3955873,Corrects bugs,This reverts commit 1bfde891884858d690b787bf1f13fd59486b5e35.,0
fix travis error: Buildtools 24.0.2 requires Java 1.8 or above.  Current JDK version is 1.7.,0.39672834,@Strubbl updated the okhttp (#791) and gradle (#790) deps,,0
Escape apostrophe,0.37190378,@cheywood improved quote style. (#1165),,0
Skip Welcome page in Connection Wizard if ran from Settings,0.49720937,Connection wizard,,0
Remove old SettingsActivity,0.36501288,Proper preferences screen,,0
Minor changes,0.9271275,Other minor changes,Mostly string-resources-related,1
"Don't show ""empty DB dialog"", just start update",0.41176248,Update on startup,,0
Minor behavioral changes,0.48005003,Other minor changes,,0
Merge remote-tracking branch 'upstream/master' into background_improvements,0.3462512,- Many fixes & background improvements,,0
Persist cookies,0.5791647,• save page without having to login each time inside your browser,,0
Add a non-dev DB OpenHelper,0.43818069,* Added possibility to move database to internal or external storage,,0
Remove unused property from DB schema,0.28376228,Removed legacy code. (#1114),,0
Minor strings.xml correction,0.4200728,Translations fixes (@di72nn),,0
Add summaries for password fields,0.27853954,in setup wizard add option to unhide the password entered (thanks @kpchungdev #725),,0
Apply theme to Settings,0.45386663,"Better theming (Dark/Light themes, high contrast themes)",,0
Use reflection to map pref keys,0.15005703,Option to have serif/non-serif fonts,,0
Use a HashMap to resolve pref keys to res ids,0.16098577,* Added Framabag preset,,0
Add summaries to some Preferences,0.43900234,Proper preferences screen,,0
Move preferences-related classes into a separate package,0.34520945,Proper preferences screen,,0
Try to fix CI build,0.35206,Fix bugs,,0
Update SDK level in .travis.yml,0.3644237,Bump version name for F-Droid users.,,0
Merge ArticleChangedEvent with FeedsChangedEvent,0.43163258,Switch between « Show all » and « Unread articles » (still not synced),,0
Set lower priority to BGService thread,0.34821522,@di72nn added two new actions in the settings to help fix queue/synchronization issues : the ability to dump the queue to a local file and the possibility to remove the first queue item found. link,,0
Remove OkHttpClient compatibility hack,0.49716273,This version updates the dependencies to the okhttp libraries. That means Android 5.0 is now the minimum Android version for running this app. ,,0
Update libraries,0.6401672,Update dependencies,,0
Update Android SDK to 24,0.6095123,Target SDK version updated to 30 (Android 11) (#1072).,,0
Fix widget update,0.5140989,@Strubbl increased max widget counter value. (#1170),,0
Use Toast instead of Dialog as a successful result,0.24930376,Dialogues suggesting to sync if needed,,0
Don't show multiple ConfigurationCheck dialogs,0.3995887,Proper preferences screen,,0
"Add ""autofill"" to Settings",0.3836014,Automatic sync,,0
Move all Configuration Test-related code in one place,0.33672035,Better application of runtime settings changes.,,0
Connection Test: detect incorrect server version,0.5015378,Better tests for connexion issues,,0
Unset isConfigurationOk flag in Settings,0.3876913,in setup wizard add option to unhide the password entered (thanks @kpchungdev #725),,0
Add Configuration Test,0.38256568,Better tests for connexion issues,,0
Add TestFeedsTask,0.4007178,• feed credentials no longer have to be input and can automatically be fetched when you provide username and password,Also move some code,0
Connection Wizard: merge Feeds page into Config page,0.46968368,Connection wizard,,0
Connection Wizard: add v2.wallabag.org preset,0.8478417,Updated Connection Wizard (wallabag.it support).,,1
Add a Connection Wizard,0.87108254,Connection wizard,,1
Improve Connection test,0.7313814,Better tests for connexion issues,"Improve Connection test: add an ability to find possible URL (for example HTTPS, if HTTP specified). Also other minor network-related changes.",1
Merge pull request #289 from strobeltobias/patch-1,0.42639452,"Thanks to @di72nn and @NWuensche, the following fixes were added:","Add new, update and rearrange strings",0
"Add new, update and rearrange strings",0.3576334,German and French translations strings,Missing strings added. Old strings updated to be (grammatical) better understandable. Strings rearranged to match the string order of the main strings.xml (in English). Might better help to translate and add new strings in future.,0
Add basic PreferenceFragment-based settings,0.4697144,Proper preferences screen,,0
Update gradle and Android plugin versions,0.50649613,@Strubbl updated the okhttp (#791) and gradle (#790) deps,,0
Introduce a new settings system,0.53707933,Better application of runtime settings changes.,,0
Minor changed feed type detection fix,0.3644622,• feed credentials no longer have to be input and can automatically be fetched when you provide username and password,,0
Set lint checker to fail on errors,0.35712686,* Handle server 500 errors with message,"Lower severity of some lint localization issues to ""Warning"". Also fix two minor lint errors.",0
Improve notifications,0.93269014,Better notifications,"Less hardcoded values, addsome logic",1
Treat UnknownHostException as a temporary error,0.5495874,Fix Error when incorrect URL entered.,,0
Unregister from EventBus in onDestroy(),0.3334295,Fix activity not closing when bagging.,So events are not missed while Activity is in background.,0
Minor changes to ArticlesListActivity,0.43619627,Display Favourite and Read icons in list of articles,,0
"Change ""empty DB"" dialog logic",0.41644794,UI should no longer be blocked by database operations.,,0
ArticlesListActivity: do not update valid lists,0.3562799,Switch between « Show all » and « Unread articles » (still not synced),,0
Minor depracation-related update,0.5866273,Updated deps,,0
Rename isNetworkOnline to isNetworkAvailable,0.29758114,Updates to the following translations were made:,,0
Remove GenericArticleTask,0.3488148,Removed legacy code. (#1114),,0
Add a string resource for a menu item,0.41682428,Olivier Mehani (@shtrom) added a context menu item to add tag from selection. link,,0
Remove OfflineURL from DB and DAO,0.5160916,• send URLs to server when they were added offline,,0
Remove UploadOfflineURLsTask,0.34996232,• send URLs to server when they were added offline,,0
Delete some of obsolete network tasks,0.39531982,Background service to handle actions offline and sync them when network is available,,0
Better error reporting for FeedUpdater,0.44690764,Better handling of network-related errors.,,0
Remove delay on AlarmReceived,0.31090486,Better interruption handling.,,0
Fix alarmReceived delay,0.33038995,Startup time improvements.,,0
Add a debug message about network availability,0.5937016,Better handling of network-related errors.,,0
Add a delay before autosync,0.49758452,Automatic sync,,0
Add a separate option to sync offline queue,0.57859504,@di72nn added two new actions in the settings to help fix queue/synchronization issues : the ability to dump the queue to a local file and the possibility to remove the first queue item found. link,...on network change,0
Fix autosync interval chooser in SettingsActivity,0.34512013,Automatic sync,sigh,0
Post sticky events outside of the methods,0.20620304,UI should no longer be blocked by database operations.,"Guarantees the event to be removed and ""Finished"" event to be posted. Fixes not removed ""Sync queue"" notification in case of unavailable network.",0
Fix auto sync interval default value,0.54302096,Automatic sync,,0
Do not always unset isConfigurationOk flag,0.46080786,Better application of runtime settings changes.,,0
Add basic auto sync,0.837255,Automatic sync,,1
Add Toast messages for AddLink in headless mode,0.3560439,• send URLs to server when they were added offline,,0
"Remove WallabagSettings, other Settings-related changes",0.4366087,Better application of runtime settings changes.,,0
Fix pull-to-refresh icon on fail,0.32405317,solar theme icon bugfix (@Strubbl #683),,0
Consider IOException as Unknown error,0.49165556,Basic error messages,,0
Remove debug notifications,0.43398637,"We fixed notifications not being displayed, leading to other issues.",,0
Set IntentRedelivery to true in BGService,0.3401795,Fix activity not closing when bagging.,,0
Update ReadArticleActivity options menu on events,0.44914287,Adding a Mark as Read button in the action bar,,0
"Perform local changes in the main thread, other stuff",0.43107507,Better application of runtime settings changes.,Introduce OperationsHelper to perform local DB changes in the main thread (so these not get delayed because of IntentService's queue). Also move some code around.,0
Add SyncQueue operation notification (for debug),0.47225097,Dialogues suggesting to sync if needed,,0
"Fix missing ""queue changed"" detection",0.68307316,@di72nn added two new actions in the settings to help fix queue/synchronization issues : the ability to dump the queue to a local file and the possibility to remove the first queue item found. link,,0
Add basic auto-sync on network connection event,0.65682125,Automatic sync,Add basic one-way (client->server) auto-sync when a network connection becomes available.,0
Fix exception name logging in BGService,0.40459567,@di72nn added extra stacktrace details when an error happens and also added a button on the error notification to copy the details to the clipboard link,,0
Improve ActionRequest/Result stuff,0.3624017,few improvements,"Introduce separate ActionReqeust and ActionResult. Add EventProcessor, move notification logic from BGService to it. Other minor changes.",0
Fix widget updating,0.5023827,@Strubbl increased max widget counter value. (#1170),,0
Fix sticky broadcast parameter in ArticlesListActivity,0.40036994,* shows an appropriate notification when trying to add an article from the share menu when the app hasn't any configured server (#807).,,0
Improve event system,0.44321734,Better notifications,,0
Merge pull request #283 from gdiazm/master,0.34817493,"Thanks to @di72nn and @NWuensche, the following fixes were added:",Spanish Translation Fixed,0
Spanish Translation Fixed,0.66021186,• Spanish and German translation,,0
Improve error handling a bit,0.59204936,Basic error messages,,0
Replace UpdateFeedTask with service call,0.42089653,Background service to handle actions offline and sync them when network is available,Implement feed update processing in the service. Replace UpdateFeedTAsk with the service call. Add basic notification support to service.,0
Split FeedUpdaterTask,0.3726862,• feed credentials no longer have to be input and can automatically be fetched when you provide username and password,,0
Implement main actions and queue sync,0.5465131,@di72nn added two new actions in the settings to help fix queue/synchronization issues : the ability to dump the queue to a local file and the possibility to remove the first queue item found. link,"Implement and replace the following actions:  * archive/unarchive article,  * favorite/unfavorite article,  * delete article,  * add link. Implement queue sync (client->server) (triggered via menu item).",0
Introduce custom exceptions to distinguish connection errors,0.5733068,Better handling of network-related errors.,,0
Add background service and change a lot of stuff,0.5579604,Background service to handle actions offline and sync them when network is available,Update and add some dependencies. Update DB schema. Add an IntentService and some basic logic to perform network-related operations in BG service and to enqueue failed actions for later sync.,0
Merge pull request #281 from di72nn/fixes_for_new_api_level,0.41126847,"Thanks to @di72nn and @NWuensche, the following fixes were added:",Replace Android-internal icons with SVG-resources,0
Replace Android-internal icons with SVG-resources,0.49414587,Better status Icons on list of articles (svg),,0
Merge pull request #279 from di72nn/fix_270,0.42447263,"Thanks to @di72nn and @NWuensche, the following fixes were added:",Fix minor NPE in getCredentials(),0
Fix minor NPE in getCredentials(),0.5726278,Fix crash if username or password not set,,0
Update f-droid logo,0.61414784,Bump version name for F-Droid users.,Fix #268,0
new fix release,0.65995264,Other fixes and improvements,,0
add the fix for http2 back,0.574338,Brings http mode,,0
Merge pull request #261 from di72nn/hotfix_260,0.41404516,Huge thanks to @di72nn.,Fix all-trusting TrustManager init,0
Fix all-trusting TrustManager init,0.39434415,Fix Self-signed certificates issue,,0
new release,0.5086899,New Features,,0
translations,1.0000002,Translations,,1
Merge pull request #259 from wallabag/Strubbl-feature-216-export-articles-as-pdf,0.41681248,"@di72nn updated the API wrapper, allowing to display the article's publication date and authors, if determined by wallabag. #811 ",Strubbl feature 216 export articles as pdf,0
fixes,0.8408342,Bug fixes,,1
Rewrite DownloadPdfTask,0.47829008,* Fix PDF Downloading,Refactoring Add download notification,0
Oops,0.3727442,Removed,,0
Move pdf downloading logic to AsyncTask,0.56316197,* Fix PDF Downloading,,0
Rewrite logic of downloading PDFs,0.6708976,- Downloading PDFs of articles,,0
Rewrite WallabagConnection.createClient() a bit,0.60947835,Updated Connection Wizard (wallabag.it support).,,0
"bump to okhttp3, increase timeout to get big pdfs and use title for article save",0.5012043,- Downloading PDFs of articles,,0
Implements #216 Export articles as pdf,0.5781648,Downloading PDFs of articles,This resolves #216 and adds the feature that you can download an article to your device. When the download starts a Toast message is displayed for the destination path and a thread handles the download in the   background.,0
Merge pull request #257 from Strubbl/debug-build-different-app,0.39527547,@Strubbl updated the okhttp (#791) and gradle (#790) deps,building as debug results in different app (id),0
Merge pull request #256 from wallabag/fix-http2,0.5245605,Full support for wallabag v2 API (link),workaround for okhttp not working with http2 on nginx,0
building as debug results in different app (id),0.32265118,@The-Compiler introduced an option to inspect chromium webviews to assist debugging link,"This commit introduces a different package name for the debug build of this application. It is useful when having installed Wallabag app from an app store and besides developing the app. You can now have a debug and release version installed on your device in parallel. The debug version of this app has a different app id, a different version name and a different launcher icon (same as release, but with a small green bug).",0
workaround for okhttp not working with http2,0.45189106,UPDATED : Fix for self-signed certificates and http2 nginx servers,,0
Merge pull request #253 from di72nn/handle_http_scheme,0.44295242,UPDATED : Fix for self-signed certificates and http2 nginx servers,Add an option to handle HTTP scheme,0
Merge pull request #255 from di72nn/log_skipped_for_175,0.41723585,Huge thanks to @di72nn.,Log more info for #175,0
Log more info for #175,0.36990243,@di72nn added extra stacktrace details when an error happens and also added a button on the error notification to copy the details to the clipboard link,,0
Add an option to handle HTTP scheme,0.51906914,Brings http mode,AKA show the app in the list of web browser,0
Merge pull request #254 from di72nn/test_240,0.42358923,Huge thanks to @di72nn.,Try to fix the root of the problem of #240,0
Merge pull request #213 from Strubbl/app-widget-unread-article-count,0.4774061,@Strubbl increased max widget counter value. (#1170),App widget unread article count,0
Don't leak BagItProxyActivity context,0.44501305,Fix activity not closing when bagging.,,0
Merge pull request #249 from di72nn/upload_offline_urls_fix,0.4329786,• send URLs to server when they were added offline,Offline URLs upload: skip failed URLs,0
Merge pull request #250 from di72nn/custom_ssl_option,0.50969326,UPDATED : Fix for self-signed certificates and http2 nginx servers,"Add ""Custom SSL settings"" option",0
Merge pull request #244 from Strubbl/fix-175-processFeed-Query.unique-bind-value-at-index-1-is-null,0.40676782,"Thanks to @di72nn and @NWuensche, the following fixes were added:",Fixes #175 IllegalArgumentException: the bind value at index 1 is nul…,0
Log failed URLs,0.5946552,Fix Error when incorrect URL entered.,,0
"Add ""Custom SSL settings"" option",0.5698085,• option to accept self-signed certificates,,0
Offline URLs upload: skip failed URLs,0.6159556,• send URLs to server when they were added offline,,0
Merge pull request #242 from Strubbl/fix-239-Article.getTitle-nullpointer,0.42177647,bug fixed when spaces in the title,Fixes #239 NullPointerException on Article.getTitle(),0
center widget in its cell,0.31935242,@Strubbl increased max widget counter value. (#1170),,0
trigger widget update on delete and archive of article,0.39516687,wallabag unread items widget,,0
on the widget click start article list activity,0.55831635,Brings swiping between articles,,0
trigger Widget update on article feed update,0.44658569,"• sync articles status (favourite,read) from your device to the remote server",,0
add widget that displays icon and unread count,0.6904585,wallabag unread items widget,,0
default generated AppWidget by Android Studio,0.36718112,"Replaces version 2.4.0-beta.2, which APK didn't have the latest changes.",,0
Merge pull request #248 from di72nn/refactoring,0.44563484,Removed legacy code. (#1114),Refactoring,0
Add wallabag server version selection to Settings,0.63229936,Updated Connection Wizard (wallabag.it support).,Autofill server version on 'Get Credentials' Don't detect server version on every request,0
Merge pull request #245 from tyndare/tts-fix-issue-234,0.48988402,@NWuensche improved the theming system and fixed TTS icons color on dark theme,"TTS: fix for issues #234,#237,#238",0
"review fixes, remove unnecessary try-catch-block",0.4614305,Corrects bugs,,0
review fixes,0.6580382,Bug fixes,,0
Log exceptions in BaseActionBarActivity,0.38316858,@di72nn added extra stacktrace details when an error happens and also added a button on the error notification to copy the details to the clipboard link,Just in case...,0
Minor refactoring: Endpoints,0.3626492,few improvements,,0
Minor refactoring: UpdateFeedTask,0.40096307,Better notifications,,0
Service endpoint lazy initialization,0.3359254,Startup time improvements.,We shouldn't guess Wallabag version in constructor since the constructor is sometimes called from UI thread,0
Refactor CsrfToken parsing,0.30320296,• Add token creation to v2,,0
Move HTML-related constants from Settings,0.39610958,"* Fix display of tables, quotes and  elements in all themes",,0
