Commit Message,Score,Correspond Changelog Sentence,Commit Description,Label
Merge pull request #1421 from johanneslumpe/examples-fixes,0.45665574,f5d4f36 [fixed] Docs Update,Removed parentheses after new Hashhistory,0
Removed unnecessary parens,0.45150793,76fe696 [fixed] trailing comma,,0
Removed reference to indexComponent in README.md,0.5306108,Bugfix: Fix this in getComponent and getComponents (#3306),,0
not using routerState,0.64944583,<RouterProvider>,,0
reimplemented AsyncProps,0.41680497,Improve support for server rendering async routes #2883,now loads all async props in parallel instead of the waterfall from before,0
Docs: link for huge apps,0.5423298,"Please note: with great power comes great responsibility. If you create a custom Link, be sure to render an actual HTML anchor element, otherwise your app will likely be inaccessible without a significant amount of additional work which, I assure you, you don't want to do!",,0
donâ€™t mutate props.style,0.5515969,4e48b6b [changed] Pass named children as props,,0
Merge pull request #1380 from nginz/patch-1,0.4685111,Upstream changes from v2.7.0 through v2.8.1:,Update 0 Overview.md,0
Merge pull request #1382 from olimsaidov/patch-1,0.4311339,"Skipping the changelog on this one, as @ryanflorence has a heavily refactored version coming in the next day or two. Please wait for that release before upgrading if you're not blocked by the previous release's packaging issues. ",Fix Router.handleAbort call misspell,0
Merge pull request #1381 from vramana/fix-examples,0.45723003,Bug fixes will continue to be accepted. We are not going to leave anyone hanging and want to assure you that v3 development will be alive and well.,Fix errors in examples,0
Merge pull request #1387 from rblakeley/master,0.40376678,"Skipping the changelog on this one, as @ryanflorence has a heavily refactored version coming in the next day or two. Please wait for that release before upgrading if you're not blocked by the previous release's packaging issues. ",Fixed typo,0
Fixed typo,0.5560751,ca96f86 [fixed] typo in Link,,0
Fix Router.handleAbort call misspell,0.60623574,"Router.run(routes, (Handler) => {",,0
[fixed] errors in examples,0.8920411,5bd62b5 [fixed] errors in examples,,1
remove references to indexComponent,0.52012414,Bugfix: Fix this in getComponent and getComponents (#3306),,0
Merge pull request #1295 from sherodtaylor/master,0.4073186,"Skipping the changelog on this one, as @ryanflorence has a heavily refactored version coming in the next day or two. Please wait for that release before upgrading if you're not blocked by the previous release's packaging issues. ",[fixed] Link module adds an extra space to className,0
[fixed] URI escape path components with special chars,0.959965,4e2ca3c [fixed] URI escape path components with special chars,Fixes #1025,1
[fixed] Link module adds extra space,0.9424517,0630488 [fixed] Link module adds extra space,,1
Reformat comment,0.39907926,2447ecb [added] formatPattern util method,,0
Evaluate if prevLocation is null,0.40353128,useLocationPending hook that returns true if a transition to a new location is pending,,0
[fixed] Use encodeURI for splat params,0.83790624,26400c1 [fixed] Use encodeURI for splat params,See https://github.com/rackt/react-router/issues/1128#issuecomment-106295587,1
[fixed]  when using HashHistory,0.81582236,178efc3 [fixed]  when using HashHistory,,1
Merge pull request #1355 from gmaclennan/test-link-makehref,0.4612643,8459755 [fixed] Include the hash prop on Links,Add failing test for  on HashHistory,0
[fixed] Properly escape splats,0.74393976,41bd525 [fixed] Properly escape splats,,1
Run path components through encode/decodeURIComponent,0.48942572,4e2ca3c [fixed] URI escape path components with special chars,,0
[fixed] URLUtils recognize values containing \n,0.85865873,4759961 [fixed] URLUtils recognize values containing \n,,1
Add test for  on HashHistory,0.62205136,178efc3 [fixed]  when using HashHistory,,0
Merge pull request #1311 from clearjs/master,0.41144723,f8cb7f9 [changed] use Object.assign instead of merge,Fixed incomplete edits,0
Merge pull request #1336 from oliveiraa/master,0.38915837,"Skipping the changelog on this one, as @ryanflorence has a heavily refactored version coming in the next day or two. Please wait for that release before upgrading if you're not blocked by the previous release's packaging issues. ",Quick fix to Passing Props to Children example,0
Merge pull request #1339 from gmaclennan/patch-1,0.4331398,"Skipping the changelog on this one, as @ryanflorence has a heavily refactored version coming in the next day or two. Please wait for that release before upgrading if you're not blocked by the previous release's packaging issues. ",fix docs history={HashHistory},0
Merge pull request #1342 from ttakezawa/fix-remove-event-handler,0.49634624,Bugfix: Remove unintentionally released code change (#3280),Use detachEvent in old IE,0
Merge pull request #1345 from heebtob/master,0.40910566,ebf54ab [removed] Dependency on react/lib/merge,Some doc changes for server side rendering in 1.0.0-beta2,0
Merge pull request #1346 from jepezi/hashhistory-instance,0.50019354,178efc3 [fixed]  when using HashHistory,Pass instance of HashHistory to Router,0
Merge pull request #1349 from gmaclennan/patch-2,0.42795753,"Skipping the changelog on this one, as @ryanflorence has a heavily refactored version coming in the next day or two. Please wait for that release before upgrading if you're not blocked by the previous release's packaging issues. ",Docs: Add Link import to first example,0
Docs: Add Link import to first example,0.46424416,Use named import of history module. (#5589 by @RoboBurned),,0
Pass instance of HashHistory to Router,0.6409253,"Router.run(routes, Router.BrowserHistory, (Handler) => {",,0
Some fixes for server side rendering for 1.0.0-beta2,0.68836665,1b1a62b [added] Server-side rendering,,0
Use detachEvent in old IE,0.474353,b237238 [fixed] Removed getter for IE8 compat,,0
fix history={HashHistory},0.73287135,178efc3 [fixed]  when using HashHistory,history={HashHistory} should be history = {new HashHistory()},1
Quick fix to Passing Props to Children example,0.78970206,4e48b6b [changed] Pass named children as props,,1
Fix broken examples,0.6645517,5bd62b5 [fixed] errors in examples,,0
publish v1.0.0-beta2,0.5327821,Released! No code changes from 4.0.0-beta.8,,0
Fix example,0.63967896,5bd62b5 [fixed] errors in examples,,0
"Remove gitter.im, use reactiflux",0.437619,React 0.12,Fixes #1203,0
Added a test for transitionTo with colon,0.56861347,Pass transition hook's arguments correctly (#4123 by @arkist),Fixes #1321,0
Separate route matching tests into separate file,0.57939816,Pass through the parent match object to <Route>s w/out a path. This also,,0
Remove unneeded optional flag,0.5092784,    // specify future flags here,,0
support IE8 in babel builds,0.610645,Support IE8 (#2540),closes #1325,0
Merge pull request #1323 from rackt/export-history-classes,0.61411554,2389c61 [changed] Export history classes,[changed] Export history classes,0
Merge pull request #1320 from BerkeleyTrue/fix/remove-babelrc,0.54610294,Minor: Upgrade to Babel 6 (#3362),remove babelrc from npm package,0
[changed] Export history classes,0.92177,2389c61 [changed] Export history classes,"This commit normalizes the way we export history classes. Instead of automatically creating a new Browser/HashHistory for people when they require the module, we just export the class like we do with History and MemoryHistory. This gives us a few things: 1) We don't have to explain to people that they need to    import { HashHistory } in order to create their own HashHistory. 2) We don't require people using CommonJS to    var HashHistory = require('react-router/lib/HashHistory').default    which sucks",1
remove babelrc from npm package,0.61990714,Remove the entire website application from the npm package (@timdorr in a5e05f7),closes #1318,0
add note about browser support,0.513957,- 'browser',closes #592,0
Merge pull request #1306 from swirlycheetah/patch-1,0.41764116,"Skipping the changelog on this one, as @ryanflorence has a heavily refactored version coming in the next day or two. Please wait for that release before upgrading if you're not blocked by the previous release's packaging issues. ",Fix tiny spelling error in readme,0
Merge pull request #1307 from abhilashsajeev/patch-1,0.4150768,f5d4f36 [fixed] Docs Update,Remove Unwanted Brackets in line 17 and 18,0
Fixed a minor typo.,0.5525379,ca96f86 [fixed] typo in Link,,0
Updated Link's doc comment.,0.6150057,"Several docs improvements (see #6410, thanks @justsml)",Link doesn't accept params anymore.,0
Fixed property name,0.47707528,Manually set displayName for components,,0
Fixed incomplete edit,0.48460305,Minor Changes,,0
Remove Unwanted Brackets in line 17 and 18,0.55693626,559c604 [changed] Use empty bracket notation for arrays,,0
use location.state in transitions,0.6479232,useLocationPending hook that returns true if a transition to a new location is pending,,0
[fixed]  handling,0.7289226,824ed63 [fixed]  handling,[added]  [added] ,1
Added failing  test,0.42600176,187eb0e [fixed] Added missing require statement,,0
[added] formatPattern util method,0.9103559,2447ecb [added] formatPattern util method,,1
fix spelling error,0.49338335,ca96f86 [fixed] typo in Link,,0
add link to docs site,0.5890564,"<Link to=""//neworigin.com/some/path"">          {/* Document request */}","closes #1232, #1271",0
remove alpha1 from website config,0.3822385,696a706 [fixed] Use defaultProps of config components,,0
publish v1.0.0-beta1,0.54155684,Released! No code changes from 4.0.0-beta.8,,0
Merge pull request #1305 from guotie/patch-1,0.43413797,f5d4f36 [fixed] Docs Update,Update Route.js,0
Merge pull request #1297 from andreogle/master,0.40476036,"Skipping the changelog on this one, as @ryanflorence has a heavily refactored version coming in the next day or two. Please wait for that release before upgrading if you're not blocked by the previous release's packaging issues. ",minor typo fix,0
Merge pull request #1304 from tikotzky/patch-1,0.42981216,"Skipping the changelog on this one, as @ryanflorence has a heavily refactored version coming in the next day or two. Please wait for that release before upgrading if you're not blocked by the previous release's packaging issues. ",change to RootRoute.indexRoute,0
update docs for server rendering,0.6642854,1b1a62b [added] Server-side rendering,,0
update auth-flow to new transition objects,0.47002327,"Auth Example â€“ Demonstrates an authentication flow including using the new useNavigate() hook, the <Navigate> element, and location.state",,0
Update Route.js,0.64450467,var routes = (,,0
Add Transition tests,0.53729755,    willTransitionTo (transition) {,,0
Use Transition class,0.71583635,    this.transitionTo('something');,,1
Update error message,0.487681,âš ï¸ Upgrade Warning âš ï¸,,0
Change order of Router.run args to match transition hooks,0.6276719,"Router.transitionTo, replaceWith, goBack",,0
Clean up some more internals,0.36992908,Other housekeeping that was done:,,0
Added back DOM scroll management,0.6918815,Manage scroll position with <ScrollRestoration>,"Also:  Renamed Router.match => Router.run Changed 3rd arg of Router.run to an array of transition hooks Removed ""transition delegate"" code (and unnecessary public methods on   ) Cleaned up a few other internals",0
change to RootRoute.indexRoute,0.65127593,4b8e994 [fixed] Index routes with extraneous slashes,based in the example it seems like this should be RootRoute.indexRoute instead of RootRoute.defaultRoute.,0
Merge pull request #1296 from mfunkie/master,0.42224708,"Skipping the changelog on this one, as @ryanflorence has a heavily refactored version coming in the next day or two. Please wait for that release before upgrading if you're not blocked by the previous release's packaging issues. ",Adding momentum scrolling for iOS on Main div in website,0
Merge pull request #1208 from vasanthk/master,0.3358826,"Skipping the changelog on this one, as @ryanflorence has a heavily refactored version coming in the next day or two. Please wait for that release before upgrading if you're not blocked by the previous release's packaging issues. ",getDOMNode() has been deprecated. Use React.findDOMNode() instead.,0
Move propTypes,0.61904275,PropTypes are now exported (@alisd23 in #3910),,0
Use react.findDOMNode() instead of deprecated getDOMNode(),0.5289799,react-router-dom@6.4.0-pre.8,,0
Update transition hook docs,0.72286445,Pass transition hook's arguments correctly (#4123 by @arkist),,1
Add some docs about query parsing/stringifying,0.57635146,"We've added lots of goodies to our docs and examples, and there's a lot more yet to come. Take a look and see if you find something that makes your work a little easier! We think the lazy loading and custom query parsing examples are particularly cool! ðŸ¤“ ",,0
Tweak warning messages,0.62277985,Introduced more warnings in development builds,,0
Fix links in server-side rendering,0.74194944,"Fix rendering <Link>s on the server (see https://github.com/ReactTraining/react-router/pull/7126, thanks @danpantry)",,1
Update transitions example,0.59858096,6f8ceac [fixed] Transitions example,,0
Add Router.match,0.6884088,f2bf4bd [added] Router.RouteLookup for looking up routes,"Also, added a transition object that is passed to transition hooks that can be used to abort the transition or send it off somewhere else.",0
minor typo fix,0.57459444,Minor Changes,,0
Adding momentum scrolling for iOS on Main div in website.,0.5197603,"<Routes scrollBehavior=""scrollToTop""/>",,0
Merge pull request #1294 from nthtran/patch-1,0.42106664,"Skipping the changelog on this one, as @ryanflorence has a heavily refactored version coming in the next day or two. Please wait for that release before upgrading if you're not blocked by the previous release's packaging issues. ",childRoute -> childRoutes,0
childRoute -> childRoutes,0.6958444,createRoutesFromElements (alias of createRoutesFromChildren),,0
Merge pull request #1177 from darmou/master,0.38666907,Full Changelog: v6.6.2...v6.7.0,"Fix css to signal that the component can be removed from the DOM, remâ€¦",0
Merge pull request #1240 from werme/master,0.38885832,"Skipping the changelog on this one, as @ryanflorence has a heavily refactored version coming in the next day or two. Please wait for that release before upgrading if you're not blocked by the previous release's packaging issues. ",Add missing font-family fallback for monospaced headers,0
Merge pull request #1260 from leungwensen/master,0.37136784,"Skipping the changelog on this one, as @ryanflorence has a heavily refactored version coming in the next day or two. Please wait for that release before upgrading if you're not blocked by the previous release's packaging issues. ",fix camo's size in README.md,0
donâ€™t add bower version,0.50027555,e827870 [added] bower support,https://github.com/bower/bower.json-spec/commit/a325da3,0
update package.json homepage,0.5419279,Re-add module entry to package.json,,0
Merge pull request #1283 from kkirsche/patch-1,0.42645735,"Skipping the changelog on this one, as @ryanflorence has a heavily refactored version coming in the next day or two. Please wait for that release before upgrading if you're not blocked by the previous release's packaging issues. ",Remove moot version property from bower.json,0
Merge pull request #1292 from Dashed/patch-1,0.39596224,ebf54ab [removed] Dependency on react/lib/merge,Consistent usage of Router,0
Merge pull request #1293 from arasmussen/master,0.40869585,"Skipping the changelog on this one, as @ryanflorence has a heavily refactored version coming in the next day or two. Please wait for that release before upgrading if you're not blocked by the previous release's packaging issues. ",fix overview guide link in README.md,0
publish alpha2,0.44379425,"This release fixes a few bugs with the previous alpha, namely:",hopefully can npm install and require it now,0
added .npmignore,0.56358063,fae04bc [added] Greedy splat (**),,0
fix overview guide link in README.md,0.47560018,ca96f86 [fixed] typo in Link,,0
Consistent usage of Router,0.5752667,router.,,0
fix website select some more,0.54814935,Updated website,,0
fix website select,0.4275717,Updated website,,0
ignore website output,0.40129083,Donâ€™t create browserHistory on the server,,0
fix website hrefs/src,0.5325624,Fix SSR of absolute <Link to> urls (#10112),,0
publish the right versions for the website,0.4187266,Updated website,,0
publish alpha,0.40361705,"This is a pretty big change from the alpha versions, so the diff isn't super helpful.",,0
Merge branch 'next',0.33746648,    // specify future flags here,Conflicts:     README.md     doc/01 Route Configuration/NotFoundRoute.md     doc/03 Components/Link.md     docs/guides/flux.md     docs/guides/overview.md,0
moar docs,0.5309049,Examples and Docs Site,,0
meh â€¦,0.30324244,  ...,,0
s/const/var/,0.42812604,"  path: ""/"",","I know, this is the opposite of what Iâ€™m supposed to do.",0
add links to the overview,0.44688123,    <NavLink,,0
a little ascii never hurt a docs page,0.47241965,"Several docs improvements (see #6410, thanks @justsml)",,0
add tags directory so doc website script works,0.41563347,Made docs easier to find in individual packages directories,,0
doc updates,0.54824436,Docs,,0
add version drop down to docs website,0.3807169,Made docs easier to find in individual packages directories,,0
Fix warning message,0.65645605,Warning,,0
Add  alias,0.4338475,ca9e3b7 [added] IndexRedirect,,0
Group framework methods,0.302874,These methods have been moved to mixins.,,0
couple doc tweaks,0.68875563,Several docs improvements - #6410 (thanks @justsml),,0
fix pinterest example,0.39037323,Use Prettier on the code (e6f9017 by @mjackson),,0
"avoid early return, remove debugging",0.498219,  return (,,0
Avoid early returns,0.29679218,  return ,,0
More sound logic,0.33429492,  // no arguments,,0
Fix isActive query detection,0.66206133,19c7086 [added] Handle undefined query values in isActive,,0
Fix animations example,0.70714444,b8018b1 [added] animation example,,1
Make Router#cancelTransition restore previous location,0.7105099,    Router.goBack();,,1
Fix auth-flow example,0.51089114,"Auth Example â€“ Demonstrates an authentication flow including using the new useNavigate() hook, the <Navigate> element, and location.state",,0
Fix HashHistory#makeHref signature,0.70829177,178efc3 [fixed]  when using HashHistory,,1
fix transitions example,0.71430147,6f8ceac [fixed] Transitions example,,1
fix master-detail example,0.41406485,5bd62b5 [fixed] errors in examples,,0
fix passing-props example,0.73570037,4e48b6b [changed] Pass named children as props,,1
wip,0.34567836,Roadmap,,0
fix error for routes without paths,0.69495887,Fix pathless route's match when parent is null (#5964 by @pshrmn),,0
updated huge apps demo,0.47025418,"Now that we are in beta, you can expect fewer breaking changes (if any) between releases in the next channel. We are actively developing features targeted at supporting suspense for data loading in the experimental channel. The main thing left to do is documentation and guides (and fix bugs, ofc). If you can spare some time, we'd love to have some help :) ","AsyncProps isnâ€™t quite demo ready, so switched all data to just looking up off the global in render",0
added experimental AsyncProps and example,0.48656118,5fea685 [added] Router.AsyncState mixin,,0
Add routeParams prop,0.7580962,"- Feature: Add params, location, and routes to props injected by withRouter and to properties on context.router (#3444, #3446)",,1
Use MemoryHistory directly,0.49817523,587e54f [added] static history singleton getter for HashHistory and BrowserHistory,,0
Fix isActive,0.6985381,      isActive,,0
updated the README,0.5920267,f5d4f36 [fixed] Docs Update,,0
Remove moot version property from bower.json,0.4088372,Remove references to Link hash/query/state props (#4377 by @insin),Per bower/bower.json-spec@a325da3,0
Remove histories from top-level exports,0.57303226,2389c61 [changed] Export history classes,,0
added State mixin docs,0.7908807,"  mixins: [ State ],",,1
a few typos,0.5437988,Minor Changes,,0
Fix ReferenceError,0.5587218,"    ErrorBoundary: HomeError,",,0
Put query on location object instead of state,0.54525954,| getQuery() | location.search |,,0
updated guides,0.6797286,Updated the contributing guide,,0
API doc sweep,0.49983278,Modified APIs,,0
Consistent naming props => state,0.6473492,    return {this.props.name} {this.props.foo},,0
some doc updates,0.7175006,Several docs improvements - #6410 (thanks @justsml),,1
More work on tests,0.49502504,Improved testing infrastructure to improve developer workflow,,0
Add TransitionHook mixin tests,0.5723529,Pass transition hook's arguments correctly (#4123 by @arkist),,0
Only pass non-null components to this.props.createElement,0.6271386,// Export a Component directly instead of needing to create a React Element from it,,0
"Revert ""allow HashHistory to use DefaultQueryKey""",0.622447,178efc3 [fixed]  when using HashHistory,This reverts commit 78336763a7967b475218818514a413fbec5a3cd6.,0
Donâ€™t require context.router for Link to render,0.6561194,Bugfix: Explicitly throw error in onClick handler of <Link> rendered outside of router context (#3572),"This allows people to be able to unit test their route components w/o having to set up a wrapper component that stubs context.router. In a unit test you wonâ€™t be needing to transition anywhere, so itâ€™s okay that we assume itâ€™s rendered in context in the click handler. If a unit test wants to click the links, then it should render a Router. May all the people rejoice.",0
fix broken tests,0.4738121,Fix broken UMD builds.,,0
updated pinterest example title,0.34283155,Updated website,,0
style tweaks to pinterest example,0.4146267,Use Prettier on the code (e6f9017 by @mjackson),,0
allow HashHistory to use DefaultQueryKey,0.61352664,178efc3 [fixed]  when using HashHistory,,0
"updated transitions example, fixed hash bug",0.58004606,4af3c18 [fixed] HashLocation triggers 'replace' state on transition.redirect(),"the hash change was not being ignored, causing router._updateState to run twice, calling the transition hooks right when the component registering the hook was rendered",0
updated sidebar example,0.39835584,Updated website,,0
updated shared root example,0.35731182,154afba [changed] location of public modules,,0
updated query-params example,0.5059658,24ad58c [changed] Query changes aren't route changes,,0
pinterest example is working :D,0.43515053,Simple demo on stackblitz,needs some polish though â€¦,0
Require ,0.3613873,187eb0e [fixed] Added missing require statement,,0
added failing isActive tests for links with params,0.62886083,7536d96 [fixed] warning on links w/o params,,0
updated master detail example,0.3385157,Full Changes,,0
updated/renamed data-flow example,0.33622718,"Dynamic Segments, keys, and lifecycle methods",,0
updated auth-flow example,0.5385549,"Auth Example â€“ Demonstrates an authentication flow including using the new useNavigate() hook, the <Navigate> element, and location.state",,0
wip async-data,0.49391645,    let data = await fetchData(request);,,0
Remove ,0.5063907,"6526e70 [removed] location=""disabled""",,0
added createElement prop to Router,0.76764685,- Added render prop to Router,"This gives control of rendering the route components to the consumer. Particularly useful for data abstractions like Relay/Falkor/AsyncProps, where components need to be rendered by a container component that uses static properties of the component to load data and subscribes to the data stores, re-rendering the route component when data updates, instead of only when the routes change.",1
Remove extraneous code,0.37319893,    this.replaceWith('something');,,0
Require routes to have a path to match,0.6542899,Pass through the parent match object to <Route>s w/out a path. This also,,0
added links being animated out,0.46714926,#3645 [fixed] Passing through extra props to <Link>,shows how they ask for the old state of the world in isActive,0
Optionally async transition hooks,0.70836574,Returning promises from transition hooks,,1
Add some TODOs,0.4064961,"If you find anything is missing from this list, please open an issue and we will get it added here ASAP.",,0
Add persistent state support to HashHistory,0.67951566,587e54f [added] static history singleton getter for HashHistory and BrowserHistory,,0
Add location.state,0.57220435,Use history.createLocation where possible (#2910),,0
Remove unused tests,0.45203477,Use use a _resetModuleScope singleton for our tests,,0
added missing proptypes to RoutingContext,0.7571254,Add back deprecated RoutingContext export #2851,,1
move context to RoutingContext,0.76515645,3545ab2 [removed] params from RoutingContext child context,"this will allow us to â€œpause the worldâ€, allowing animations between screens to have the correct rendering state. animation, for example: the old screenâ€™s Link components will still be â€œactiveâ€ during the animation even though they are not active according to the true state of the router",1
update animation example,0.7050407,b8018b1 [added] animation example,,1
Add back BrowserHistory and HashHistory tests,0.7388413,- Added singleton browserHistory and hashHistory,,1
Add Location tests,0.55818826,4a770e8 [fixed] Using TestLocation without DOM,,0
Fix syntax errors,0.48940593,5bd62b5 [fixed] errors in examples,,0
Add MemoryHistory tests,0.47374973,a030648 [changed] Relaxed MemoryStore invariant,,0
Remove unused test files,0.34292808,Use use a _resetModuleScope singleton for our tests,,0
"Add RoutingContext, better encapsulation of utils",0.74838555,9d346fc [added] params on RoutingContext child context,,1
