Commit Message,Score,Correspond Changelog Sentence,Commit Description,Label
update types for mockPromiseThatResolvesImmediatelyWith,0.4423281,Use use a _resetModuleScope singleton for our tests,,0
fix broken import and setup file reference,0.45253092,Importing,,0
refactor react-native tests to TS,0.54278505,Use Jest for testing (172dc16 by @mjackson),,0
markdown formatting,0.43024978,2447ecb [added] formatPattern util method,,0
Update various deps for internal scripts,0.4402468,Updated dependencies,,0
Refactor tests to TS,0.4760267,Use Jest for testing (172dc16 by @mjackson),,0
ts: refactor navigate-push-test,0.52232873,"useSearchParams now returns [searchParams, setSearchParams] (similar to useState). setSearchParams is a wrapper for navigate that updates the query string on the current URL. See the updated guide on working with the query string.",,0
Update ESLint + Prettier,0.5020218,// 0.13.x w/ ES6 fanciness, ESLint and all related dependencies updated Prettier updated Ran prettier . --write to reduce potential formatting issues in   later commits,0
convert several tests to TS,0.41083878,Use Jest for testing (172dc16 by @mjackson),,0
update prettier config,0.52718437,Use Prettier on the code (e6f9017 by @mjackson),,0
prettier,0.36455205,Use Prettier on the code (e6f9017 by @mjackson),,0
refactor useRoutes test to TS,0.52517366,"let userId = match?.params.user; // wrong param, but TS doesn't know that!",,0
Update test config to support TS,0.42182857,Use Jest for testing (172dc16 by @mjackson),,0
Use default Prettier settings,0.63192487,Use Prettier on the code (e6f9017 by @mjackson),,0
Regenerate yarn.lock,0.39057726,yarn add react-router-config@next,,0
Do not replace + with ' ' (#7876),0.5340742,20c2c9b [fixed] Do not decode + in pathname,Fixes #7765,0
Replace undefined matches with '',0.48345637,    this.replaceWith('something');,,0
Fix greedy trailing * bug,0.57627606,Bugfix: Do not ignore extraneous slashes in matching (#3285),Fixes #7529,0
Remove prop-types,0.7174547,Strip propTypes in production (@mjackson in eb8a4ef),"Also, use useState instead of useReducer in router wrapper components",1
Close Route Tag (#7665),0.60727257,4d8c7a1 [removed] <Routes onAbortedTransition>,,0
[v6] Fix 'getting started' link (#7580),0.51473093,"Fix with missing pathname: <Link to=""?foo=bar""> (#5489 by @pshrmn)",,0
Mentioned  in the migration guide (#7519),0.46904215,You can also check out the docs here and here.,,0
Add note to install history,0.46969587,- Added createMemoryHistory,,0
Typo (#7486),0.58332264,ca96f86 [fixed] typo in Link,,0
Fix Link and navigate for absolute paths with basename,0.8718434,Link and navigate should properly respect the basename when using absolute paths.,,1
[v6] Added documentation for NavLink end prop (#7451),0.66532457,<NavLink> can now receive a child function for access to its props. (#8164),,0
Version 6.0.0-beta.0,0.672713,// 0.6.x,,0
Remove pending/preload APIs,0.57555246,Fix requests sent to revalidating loaders so they reflect a GET request (#9660),These will go into the experimental channel until useTransition is stable.,0
Use collapsible blocks for type declarations,0.35859063,blockTransitions returns teardown function (@maxdeviant in #4058),,0
More work on docs,0.66534525,Docs,,0
Finish up API reference,0.54423153,"We have a lot more documentation work to do around guides, examples, and use-cases, but the API reference documentation on the new beta site is already quite complete.",,0
Ignore missing .d.ts file,0.41568932,Migrated the core codebase to TypeScript and added TypeScript declarations,,0
Update fixture to history v5,0.5326886,This release updates the internal history dependency to 5.2.0.,,0
Use tsc-generated source maps as input to Rollup,0.7677632,"We now re-use the sourcemap output from tsc as input into the Rollup toolchain, so sourcemaps go all the way back to the original source instead of stopping at the tsc-generated files",,1
Add back missing .d.ts files to the output,0.4369782,"We now re-use the sourcemap output from tsc as input into the Rollup toolchain, so sourcemaps go all the way back to the original source instead of stopping at the tsc-generated files",,0
Add missing space,0.33712628,Refactor as follows:,,0
Fix failing build,0.56384706,Fix build scripts on windows (@alisd23 in #4088),,0
Rename things to better align with history lib,0.49103522,Use named import of history module. (#5589 by @RoboBurned),resolveLocation => resolvePath useResolvedLocation => useResolvedPath,0
Make react-router a regular dep of rrd and rrn,0.68930805,react-router@6.4.4,,0
"Update to history v5, move to peer dep",0.632505,3cc7d6d [added] Peer dependency on history package,,0
More docs,0.75933164,Docs,,1
Use tsc directly in Rollup,0.6195415,"We now re-use the sourcemap output from tsc as input into the Rollup toolchain, so sourcemaps go all the way back to the original source instead of stopping at the tsc-generated files",,0
Use ESM in all repo scripts (and node 12.17.0),0.5010935,e42a4ad [changed] Stop using npm prepublish script,,0
Add experimental release id to version script,0.43444955,"I've swapped out the version string to better represent the prerelease nature of the v4 branch currently. It may not have been obvious before, but according to semver, any version string with a -anything on the end is considered a prerelease version. I've seen some references to the versions before as 4.0.1 and 4.0.2. This isn't correct, as we haven't yet pushed a 4.0.0 final version. This is not production-ready code. We're not done building 4.0! ",,0
Add experimental release channel to publish script,0.44440082,Development on v6's experimental channel is happening on the dev-experimental branch.,,0
Remove timeout propType from ,0.5327399,"A timeoutMs prop that may be passed to a <BrowserRouter>, <HashRouter>, <MemoryRouter>, or <NativeRouter>. This timeout dictates how long these routers will wait before transitioning to a new page after the URL has changed. The default timeoutMs is 5000 (5 seconds).",,0
Version 6.0.0-alpha.5,0.6747567,Warning: This release breaks compatibility with 6.0.0-alpha.2,,0
Add  and route.preload,0.6471133,  // they don't load until the user navigates to those routes,,0
Add  and  props,0.6049157,    props = props || this.props;,This makes it possible for  to match just like  does.,0
Add missing  prop to interface,0.53367525,- Added render prop to Router,,0
Small docs tweaks,0.56625104,Several docs improvements - #6410 (thanks @justsml),,0
Usage of the record ts type (#7338),0.36783636,``tsx,,0
Correctly infer the read only type (#7337),0.38608214,a030648 [changed] Relaxed MemoryStore invariant,,0
Unnecessary type declaration (#7342),0.45086843,a4ce7c8 [changed] isActive is an instance method,,0
Add script for generating API docs from d.ts files,0.41261947,Migrated the core codebase to TypeScript and added TypeScript declarations,,0
Fix arg definition in RRN as well,0.35840988,"Stop incorrectly matching on partial named parameters, i.e. <Route path=""prefix-:param"">, to align with how splat parameters work. If you were previously relying on this behavior then it's recommended to extract the static portion of the path at the useParams call site: (#9506)",See #7325,0
[v6] Fix definition for useSearchParams arguments and return type (#7325),0.70977294,Fix bug with search params removal via useSearchParams (#9969),,1
Add documentation for moving the basename (#7324),0.5464952,Add back basename support in match (#3054),  Add documentation for moving the basename   Add change-to example ,0
Never return placeholders from generatePath,0.84138954,"Changed generatePath so it never returns placeholders. Instead, it will throw if a needed placeholder is missing.",Fixes #7237,1
Add Navigator interface,0.4966153,Navigation Mixin,,0
Add --watch flag to yarn test script,0.4039027,$ yarn add history react-router-native@experimental,,0
"Don't allow empty params, just splats",0.6031213,Optional Params Examples,See #7237,0
Bump size allowances,0.37206134,2f19e63 [changed] Bump qs dependency version,,0
Refactored high-level Router components,0.6705633,The new Router component is a property of the top-level module.," Moved history.listen calls into BrowerRouter, HashRouter, and   MemoryRouter components and added  prop Use useLayoutEffect cleanup callback to teardown the listener Removed useTransition shim and timeout props. Will integrate this   later in a new ""experimental"" release channel  Fixes #7195 Fixes #7308",0
Split navigate function signature (#7315),0.521189,The navigate function now prepends hash and search strings by default:,,0
[v6] Allow generatePath to use empty string params (#7238),0.89734995,Fix generatePath when optional params are present (#9764),,1
Remove unnecessary State | null,0.5077437,Preserve state from initialEntries (#9288),See also #7309,0
Improve useSearchParams types (#7309),0.6999323,Fix bug with search params removal via useSearchParams (#9969),"This types the return as const to correctly infer the items within the array. Previously, the return array was (searchParams|setSearchParams)[], instead of [searchParams , setSearchParams], which made the usage impossible with correct typings. Also setSearchParams  is now typed instead of just being any.",0
Version 6.0.0-alpha.4,0.67963076,Warning: This release breaks compatibility with 6.0.0-alpha.4,,0
"Fixed useMatch implementation, added matchPath",0.7815825,useMatch takes a route path (instead of a link to value as it did previously). It should have always taken a route path; this was just a simple oversight.,,1
Convert to TypeScript,0.6491982,Migrated the core codebase to TypeScript and added TypeScript declarations,,0
Update install snippet to reference @next (#7302),0.4899389,Minor: Remove support for installing from source (#3164),,0
Bump size limit on production web bundle,0.38626292,2f19e63 [changed] Bump qs dependency version,,0
Fix clean working directory check,0.45905408,"    path: '/',",,0
Refactor out separate stableSort function,0.36952943,"function and close over the information you need, or simply define those",,0
Improve route sorting algorithm,0.67820793,Automatic<Route> ranking with a new <Routes> API, Traverse child routes first so nested / match deeply Use stable sort for routes that otherwise score the same and are not   siblings,0
Bump size limits,0.35340542,2f19e63 [changed] Bump qs dependency version,,0
"Add useLocationPending, useInRouterContext hooks",0.6874547,"When using BrowserRouter, these hooks remain unstable across location changes because they still rely on useLocation()",Fixes #7164 Helps with #7230,0
Better useSearchParams,0.61717194,Fix bug with search params removal via useSearchParams (#9969),This makes useSearchParams mirror useState in that it now returns both a URLSearchParams object and a setter function you can use to change the current params.,0
Don't use react/react-dom's default export,0.72246957,// Export a Component directly instead of needing to create a React Element from it,,1
added @reach/router migration guide,0.47682375,f2bf4bd [added] Router.Transitions for transitioning to other routes,,0
Remove  API,0.77893925,Removed APIs,"We no longer support navigation on the initial render, so it doesn't make sense to support any kind of navigation in a .",1
Version 6.0.0-alpha.3,0.6777855,Warning: This release breaks compatibility with 6.0.0-alpha.3,,0
Update warning wording,0.6391302,âš ï¸ Upgrade Warning âš ï¸,,0
Treat all navigation as a side effect,0.6146029,Navigation Mixin," Removes  Removes support for { redirectTo } in useRoutes() Warns if navigate() is used during the initial render Warns when  is used on the initial render in   This began as a discussion on GitHub (see #7203). Essentially we need to treat all navigation as a side effect, which means it needs to happen in a useEffect. If people need v5's  functionality (when it was used in the route config inside a ), they either need to a) do the redirect on the server (the best solution) or b) render a  on the initial render. However, (b) will only show the new route on the subsequent render. This should also eliminate warnings in the dev-experimental builds. Closes #7203 Fixes #7199",0
Add useSearchParams hook + doc,0.66953135,Search Params Example â€“ Demonstrates how to build a simple search form that uses the new useSearchParams() hook,,0
Use explicit install step,0.59821355,Installation,,0
Re-enable publishing from Travis,0.41968277,e42a4ad [changed] Stop using npm prepublish script,,0
Use annotated tags for releases,0.3525508,"I've swapped out the version string to better represent the prerelease nature of the v4 branch currently. It may not have been obvious before, but according to semver, any version string with a -anything on the end is considered a prerelease version. I've seen some references to the versions before as 4.0.1 and 4.0.2. This isn't correct, as we haven't yet pushed a 4.0.0 final version. This is not production-ready code. We're not done building 4.0! ",,0
Rename script,0.43224078,Fix scripts on windows (#4447 by @pshrmn),,0
"Fix warning by setting displayName on context object, fixes #7204 (#7205)",0.5992037,160c5ba [fixed] Removed  warning about no history in context,,0
Add script for checking links on GitHub docs,0.36538827,bb066b8 [added] Browser build script,,0
Fix more broken docs links,0.51398444,Fix SSR of absolute <Link to> urls (#10112),,0
Fix a few broken docs links,0.51324296,Fix SSR of absolute <Link to> urls (#10112),,0
"Revert ""Add createRoutesFromFiles to react-router-dom/server""",0.7273855,Missing generatePath in react-router-dom package.,This reverts commit 07ab970449224ce2a07ac142ad148d537b022100.,1
Use same optimizations on react-router modules build,0.66313064,Add ES build to react-router and react-router-dom (#4432 by @billyjanitsch),See #7184,0
Slightly smaller modern output for react-router-dom (#7184),0.7455033,react-router-dom@6.4.0-pre.15,,1
Fix link to getting started guide,0.4918641,Updated the contributing guide,,0
Use  as default ,0.4938347,// or default to hash location,This allows easier grouping of routes by base URLs.,0
Keep all console spies in before/afterEach blocks,0.3968365,Remove inaccurate console warning for POP navigations and update active blocker logic (#10030),,0
Better warning message,0.65973794,Warning,,0
Add integration test for navigation param encoding,0.56399786,NavLink exact & strict tests (#4454 by @pshrmn),,0
"Add support for + in URL params, warn on error",0.5239849,6c74c69 [changed] Combine URL helpers into URL module,,0
Automatically decode URL-encoded params,0.8055004,URL decode all parameters (@tyrsius in #3991),,1
Remove prop-types from react-router-dom build,0.7750157,react-router-dom and react-router-native now re-exports all types exported from react-router,Helps with #7168,1
Remove fcc link,0.46831024,"          ""inactive-link""",,0
Fix rename import (#7170),0.5290646,Importing,,0
docs: fix sample code in v6 document (#7180),0.56065345,f5d4f36 [fixed] Docs Update,,0
Update README.md (#7179),0.59546256,Full Changelog: v6.6.2...v6.7.0,"Update link to migration guide from 4.x, 5.x to 6.x.",0
Document v5 to v6 migration from go/goBack/goForward (#7165),0.45184368,"Please note that although there are several breaking changes we are still working on the migration path and will continue to publish improvements and helpers in v5 that should help you upgrade as smoothly as possible. We are not done with v5. Heck, we're still cutting releases of v3.",,0
Add note about production CRA configuration,0.2899778,Introduced more warnings in development builds,,0
Version 6.0.0-alpha.2,0.6740657,Warning: This release breaks compatibility with 6.0.0-alpha.2,,0
Small tweak to install docs,0.5862986,Made docs easier to find in individual packages directories,,0
A few minor tweaks to website install docs,0.5179374,Several docs improvements - #6410 (thanks @justsml),,0
add docs for CRA and parcel setup (#7161),0.46011496,Several docs improvements - #6410 (thanks @justsml),,0
Fix matching of nested splats (*),0.5183012,41bd525 [fixed] Properly escape splats,,0
Add tutorial outline,0.3680437,"We are actively working on documentation. For now, if you're just interested in testing things out you may be interested in the getting started guide. If you're interested in upgrading an existing app, please check out the v5 to v6 migration guide.",,0
Enable server-side creation of URLs from pieces,0.52958584,"Fix URL creation in Cloudflare Pages or other non-browser-environments (#9682, #9689)",,0
Fix route ordering bug,0.69773924,Force stable sort in browsers that don't have it so routes that otherwise rank equally maintain the order in which they were originally defined,,0
"Revert ""Add support for . in """,0.47369456,"- Breaking: Remove all deprecated functionality as of v2.6.0 (#3603, #3646)",This reverts commit f7a56851652427c914d94400b44a99f36a17d155.,0
Add version + publish scripts to package.json,0.5623519,Re-add module entry to package.json,,0
Keep version in react-router/package.json,0.67767715,react-router@6.4.0-pre.8,Don't need package version in root package.json,0
More docs outlines,0.56062037,Several docs improvements - #6410 (thanks @justsml),,0
[dev] Fix code example in the guide for migrating 5 to 6 (#7146),0.6148807,Development for v6 has switched from dev to the main branch.,Stringify argument of navigate because history.go is called if the argument is a number.,0
Add Advanced Guides index,0.46619803,ca9e3b7 [added] IndexRedirect,,0
Added some docs outlines,0.5538521,Several docs improvements - #6410 (thanks @justsml),,0
Fix size checks,0.3425823,baf79b6 [fixed] Avoid some warnings,,0
Move some source files around,0.40585518,ci: simplify dist/ directory for CJS/ESM only (#9017),,0
Fix a crash when  was used within  (#7126),0.44203573,Bugfix: Remove unintentionally released code change (#3280),,0
Emit trailing splat warning only once per pathname,0.49049878,07b4972 [fixed] Allow repetition in child paths,,0
Better warning for routes missing trailing *,0.6977017,A * in a child route path matches after a slash following its parent route path. This fixes some situations where the * was overly greedy (see #7972),,0
Add support for . in ,0.6613341,. in params support,This lets people do stuff like  and . It's a little confusing because  can't ever have .. but there's a warning for that too. See discussion here: https://github.com/ReactTraining/react-router/issues/5127#issuecomment-582088622,0
Tweak comment,0.46148452,df38294 [fixed] Allow comments in JSX config,,0
Merge branch 'dev' of https://github.com/kristoferbaxter/react-router into kristoferbaxter-dev,0.6763699,https://github.com/rackt/react-router/compare/v1.0.0-alpha2...v1.0.0-beta1,,0
docs: Add No Match 404 for v6 FAQ (#7121),0.529621,fix: Handle fetcher 404s as normal boundary errors (#9015),,0
Fix merge conflict,0.5385522,f8cb7f9 [changed] use Object.assign instead of merge,,0
Re-enable closure compiler,0.41108686,Removed use of eval in development to be compliant with unsafe-eval CSP - #6611,,0
Add createRoutesFromFiles to react-router-dom/server,0.7562425,Missing generatePath in react-router-dom package.,"This little helper lets you create a routes config object from files on the filesystem, ala Next.js or Gatsby.",1
Add more to v6 FAQ,0.49945736,"We have begun creating some examples for v6 that we hope will help developers make effective use of all the new features we have. So far, we have examples for the following:",,0
Add v6 FAQ,0.51012003,"If you're thinking about upgrading to v6, I published a few notes this past week that may help you:",,0
Small tweak + better error message,0.63938063,A few error message improvements (#8202),,0
Fix incorrect self closing tags (#7118),0.44757265,"Fix for <Link rel=""_self""> (thanks @ericyang89)",,0
Clarify a few things,0.37353283,Several docs improvements - #6410 (thanks @justsml),,0
Update website install docs,0.50996494,Updated website,,0
Version 6.0.0-alpha.1,0.66902685,Warning: This release breaks compatibility with 6.0.0-alpha.2,,0
Re-arrange re-exports of core imports,0.44754744,Importing,,0
Ensure version number specifier is valid,0.5097461,"I've swapped out the version string to better represent the prerelease nature of the v4 branch currently. It may not have been obvious before, but according to semver, any version string with a -anything on the end is considered a prerelease version. I've seen some references to the versions before as 4.0.1 and 4.0.2. This isn't correct, as we haven't yet pushed a 4.0.0 final version. This is not production-ready code. We're not done building 4.0! ",,0
Make history a regular dep instead of peer dep,0.6662215,Made history a peer dependency,Not sure why it wasn't a regular dep in the first place...,0
Improve migration guide with nav links,0.535161,"You'll probably want to reread the section in the v5 => v6 migration guide about <Link to> values (it has been updated), but it basically boils down to this: any leading .. segment in a <Link to> value traverses ""up"" one route and builds upon that route's path instead of just removing one URL segment. This feature really completes the story of relative routes and links.",,0
Update migrating-5-to-6.md,0.5934353,"Please note that although there are several breaking changes we are still working on the migration path and will continue to publish improvements and helpers in v5 that should help you upgrade as smoothly as possible. We are not done with v5. Heck, we're still cutting releases of v3.",,0
Version 6.0.0-alpha.0,0.68239486,Warning: This release breaks compatibility with 6.0.0-alpha.2,,0
Add release script,0.45946378,bb066b8 [added] Browser build script,,0
Remove v5 website,0.44604325,This note talks about removing <Redirect> elements from any <Switch>es you may have in your v5 app and how you can get better SEO in the process if you're currently relying on client-side redirects.,,0
Remove Lerna,0.3207946,"6526e70 [removed] location=""disabled""",,0
Add version script,0.480953,bb066b8 [added] Browser build script,,0
Add tests for react-router re-exports,0.6880693,You might enjoy reading this issue: https://github.com/rackt/react-router/issues/2646,,0
Include prop-types in dev UMD bundles,0.5435746,Include react-router in react-router-dom's UMD bundle,So people don't have to use a separate ,0
Remove react-router from react-router-dom UMD,0.8269292,Include react-router in react-router-dom's UMD bundle,"This is because our UMD builds double as our CommonJS builds, so we don't want CommonJS users to get 2 copies of react-router.",1
Remove react-router from regular deps of react-router-native,0.8183434,Made react-router a regular dependency of react-router-dom and react-router-native,,1
Remove v5 docs and examples,0.43195203,Both of those posts contain steps you can take today in your v5 app without upgrading to v6.,,0
Tweak Jest configs,0.5855544,Use Jest for testing (172dc16 by @mjackson),,0
v6,0.4902504,Development for v6 is happening on the dev branch.,,0
Remove deprecated imports,0.5327517,Backwards Compatibility and Deprecation Warnings,,0
add more detail to useRouteMatch hook documentation (#7009),0.58797854,"Add useParams, useLocation, useHistory, and useRouteMatch hooks (d6224d6a)",,0
Make react-router exports explicit,0.7898234,react-router@6.4.4,,1
Add funding info,0.3437633,Updated the contributing guide,,0
Update authors fields,0.3543451,Updated the contributing guide,,0
Fix failing tests,0.4198907,Fix broken UMD builds.,,0
Use json instead of json5,0.5352193,Example JSON Syntax,,0
Do not Prettify build output,0.43805015,Introduced more warnings in development builds,,0
"Revert ""Remove husky""",0.43234062,Bugfix: Remove unintentionally released code change (#3280),This reverts commit ad340b64989997775f111c11b438187bdf5ab176.,0
Ran prettier,0.28415424,// Before,,0
Update ESLint configs and fix warnings/errors,0.5618397,2fc9976 [fixed] eslint cleanup; trailing comma fix for IE,,0
Use .js extension for all relative imports,0.5284424,"The problem here is that, although it may not be obvious the first import is actually using the CommonJS build while the 2nd import is (probably, depending on what your bundler is doing) using the ES modules build. Your bundler can probably handle the variation in module formats just fine, but when you go to run your code you'll see a warning like:",,0
Remove husky,0.284263,handlers) so we've removed it.,So it doesn't change files out from under us right before committing stuff. Super annoying.,0
Update all badge URLs,0.39794394,e0b708f [added] Ability to transitionTo absolute URLs,,0
Update build link and badge,0.4356182,Updated website,,0
Update build link,0.50335205,92b9077 [changed] file name of dist builds,,0
Remove react-router-native moduleNameMapper in root,0.6940502,Made react-router a regular dependency of react-router-dom and react-router-native,"None of the other packages use RRN in any of their tests, so we don't need this.",0
Update website deploy key,0.43806702,Updated website,,0
Simplify Jest config,0.55514425,Use Jest for testing (172dc16 by @mjackson),,0
Merge branch 'build-setup' of https://github.com/Andarist/react-router into Andarist-build-setup,0.628594,npm install react-router@beta,,0
fix typo (#6988),0.61770624,ca96f86 [fixed] typo in Link,I think useRouterMatch should be useRouteMatch here,0
Move commentary into comment,0.33909795,df38294 [fixed] Allow comments in JSX config,,0
Simplify animation example,0.6231046,b8018b1 [added] animation example,,0
Eliminate more floating s,0.4996723,"196390f [fixed] Make s global, again","Also, added a useQuery hook, which I imagine a lot of people will find useful.",0
Merge branch 'master' into website,0.28700328,Updated website,,0
Update examples and docs to use hooks API (#6976),0.61420107,The hooks are now useAsyncValue/useAsyncError,,0
