Commit Message,Score,Correspond Changelog Sentence,Commit Description,Label
"Add Support for ""Blank"" Link components. (#3803)",0.695403,"f3b4de8 [added] support for extra props in Links, fixes #170","  adds test for rendering Links that do not specify ""to"" prop   Modifies Link to return an empty  tag when no ""to"" prop is given.   Adds example of empty links   Adds spec for passing down of additional props   Updates documentation for Link.   Adds a word to a sentence in Link documentation, cleans up whitespace.   Removes unecessary example page.   Removes default ""to"" prop on Link component.   Compares ""to"" to null   Fixes typo in Link-test   Whitespace nit ",0
Use replace instead of transitionTo for redirects (#3799),0.81784195,- Refactor: Use history.replace instead of history.transitionTo for redirects (#3799),,1
Merge pull request #3801 from springuper/fix-lang,0.43478802,Minor: Upgrade to Babel 6 (#3362),Replace jsx with js to correctly highlight code,0
replace jsx with js to correctly highlight code,0.54594874,    // and use the new jsx syntax,,0
Remove broken link in API doc (#3798),0.5768354,Add <Link component> API (#5437),  Remove broken link in README   Update API.md location doc link ,0
Merge pull request #3794 from DannyDelott/patch-1,0.44894326,"Skipping the changelog on this one, as @ryanflorence has a heavily refactored version coming in the next day or two. Please wait for that release before upgrading if you're not blocked by the previous release's packaging issues. ",Improve syntax highlighting in docs,0
Improve syntax highlighting,0.51528883,Use Prettier on the code (e6f9017 by @mjackson),,0
Merge pull request #3787 from viniciusdacal/location-descriptor-link,0.44566512,Note: You can always abstract over this feature in a custom NavLink if you prefer the old v5 API.,Fix broken link to location descriptor reference,0
Fix broken link to location descriptor reference,0.6027479,Fix NavLink location variable (#4403 by @inuscript),,0
Replaces npmcdn to upkg in README (#3785),0.4528494,2f19e63 [changed] Bump qs dependency version,,0
s/ancestor/descendant/,0.40963042,// see further down for more information on what can be passed down,,0
remove state from MatchProvider,0.5281697,Fix initial routing state after match (#2965),it doesnâ€™t change over time so no reason to keep it in state ðŸ‘ž,0
Use an instance variable for match tracking.,0.43733162,Match exactly takes parent into account (@alisd23 in #4001),"When accessing state along context, something is up with setState enqueued updates not dispatching. It might have to do with ReactNoopUpdateQueue being used on the server side, but I'm not 100% sure. For now, this non-idiomatic workaround gets the job done...",0
Merge pull request #3759 from reactjs/matching-outfits,0.5557623,ebf54ab [removed] Dependency on react/lib/merge,Support nested relative Match patterns,0
Add the various *Router docs,0.6598785,The new Router component is a property of the top-level module.,,0
Remove use of renderToString in integration tests.,0.5006063,Streamline jsdom bug workaround in tests (#9824),"Causes setState's enqueued updates not to complete in time to check the rendered output, resulting in Miss not working.",0
Fix up some minor things after rebasing.,0.489674,Rebuilt with history correctly included.,,0
Remove some unneeded sanity checks.,0.4886517,Bugfixes,,0
Also test nested absolute paths.,0.6245682,Absolute nested path support,,0
Support nested relative Matches.,0.58834666,Match exactly takes parent into account (@alisd23 in #4001),,0
Make counter a more robust match-tracking context.,0.38154128,Limit size of matcher cache (@alisd23 in #4004),,0
clean up files,0.26396164,Other housekeeping that was done:,,0
add ServerRouter,0.61524844,Create your router with createBrowserRouter/createHashRouter,"Regarding onRedirect  in the client needs to do its work in cDM otherwise we break React if we tried to do it in cWM. On the server, however, we need to do the work in cWM because we donâ€™t ever get cDM. I was thinking we could use the canUseDom to detect server v. client to avoid creating ServerRouter, but react native canâ€™t use dom either, so we needed a more explicit way to know weâ€™re on the server, so, we have ServerRouter again. Regarding onMiss This allows folks to send 404 responses on the server.",0
change minor stuff about the website,0.582063,Updated website,,0
"add Miss, Redirect, NavigationPrompt tests",0.6237267,NavLink tests (#4421 by @pshrmn)," Canâ€™t test NavigationPrompt yet Testing much about redirect seems a little pointless, if we really   want to we can call toString on Redirect.prototype.componentDidMount   and see that we called the right method name in there ðŸ˜‚",0
s/isTerminal/isExact/,0.54530054,      isActive,,0
make assertions clearer with constants not strings,0.34796864,  foo () {,,0
fixup StaticRouter propTypes,0.73086095,Fix missing StaticRouter (#4389 by @supasate),"  blockTransitions isnâ€™t required, can imagine some MemoryHistory   usages not requiring it (or we could default to ()=>{})   accept string or location descriptor for location prop ",1
add lots of Link test coverage,0.52953124,NavLink exact & strict tests (#4454 by @pshrmn),"sorry â€¦ I just have to say this here, unit testing React components is actually fun. And these new Link components taking location as a prop or reading from context is awesome.",0
fix broken test,0.45155048,Use use a _resetModuleScope singleton for our tests,,0
update some docs a bit,0.64035904,f5d4f36 [fixed] Docs Update,,0
Fix so lint passes.,0.38721585,Other housekeeping that was done:,Someone hasn't been running tests... :P,0
use a real router for examples,0.6232989,router.,,0
add initial work for redux/prompt examples,0.45176968,"2. Provide cleaner integrations with other libraries like Redux, Relay, Async Props etc.",,0
get route config example working again,0.6674211,Route Config,,0
get ambiguous matches example working again,0.6022557,Match exactly takes parent into account (@alisd23 in #4001),,0
get animation example working,0.7102953,b8018b1 [added] animation example,,1
get more examples working,0.5782803,5bd62b5 [fixed] errors in examples,,0
get auth example working,0.4803976,"Auth Example â€“ Demonstrates an authentication flow including using the new useNavigate() hook, the <Navigate> element, and location.state",,0
get examples running again,0.5431284,fc8a7a4 [changed] Run examples using HTML5 history,,0
add router context to render callback of StaticRouter,0.78008336,Add staticContext route prop when rendering <Route>s inside a <StaticRouter>,,1
get the website working again,0.5254699,Updated website,,0
merge location and path utils together,0.5563117,Absolute nested path support,,0
add search and query support to Link,0.55172944,Link params,,0
add location descriptor support to Link,0.5845502,"Add support for functions in <Link to> and <NavLink to> (#5331, #5368)",,0
fix trailing comma from debugging,0.660499,76fe696 [fixed] trailing comma,,0
Merge remote-tracking branch 'rewrite/master' into v4,0.3853336,Upstream changes from v2.7.0 through v2.8.1:,,0
ðŸ’¥ðŸ’¥ðŸ’¥ðŸ’¥ðŸ’¥ðŸ’¥ðŸ’¥ðŸ’¥ðŸ’¥ðŸ’¥ðŸ’¥ðŸ’¥ðŸ’¥ðŸ’¥,0.52820903,ðŸ§° Examples,,0
Remove top-level ServerRouter export,0.6143822,Breaking: Removed default top-level <Router> export (#2906),,0
add some clicking around tests :D,0.42778218,"As always, you can try everything out using the next tag:",,0
add some integration tests,0.4413609,Use Jest for testing (172dc16 by @mjackson),"also, no more forceUpdate in MatchCountProvider, we are calling increment in willMount of descendant components, which was calling forceUdpate in an ancestor. I talked to Sebastian, React does not intentionally support it (`setState in ancestor during willMount is also not supported).",0
remove old tests covered in StaticRouter tests,0.55449396,Remove an extraneous <div> sometimes added by <StaticRouter>,,0
unskip a few more tests,0.36761916,NavLink tests (#4421 by @pshrmn),,0
kill ServerRouter,0.5331405,RouteHandler,,0
get MemoryRouter â€œworkingâ€ ðŸŽ‰,0.5321697,Fix memory leak in ConnectedRouter during server side rendering (#5203 by @klis87),,0
add query string parsing,0.5942224,5a1ed33 [fixed] Path.decode/encode with query string,,0
got first StaticRouter test passing,0.7251188,Fix missing StaticRouter (#4389 by @supasate),After the GREAT REFACTOR of the GREAT REWRITE,1
remove HistoryRouter,0.67183846,"In v6.1.0 we inadvertently shipped a new, undocumented API that will likely introduce bugs (#7586). We have flagged HistoryRouter as unstable_HistoryRouter, as this API will likely need to change before a new major release.",since we have the history object in the render callback we donâ€™t need it to access history from context to pass to StaticRouter anymore,0
organize index exports,0.4651661,69a9240 [fixed] Added missing IndexLink to exports,,0
Version 2.7.0,0.6759131,// v0.10.x,,0
Merge pull request #3746 from reactjs/release,0.59164464,ebf54ab [removed] Dependency on react/lib/merge,Update docs and changelog for release [ci skip],0
Update docs and changelog for release [ci skip],0.50158966,Full Changelog,,0
Better code formatting,0.45703098,Use Prettier on the code (e6f9017 by @mjackson),,0
Add some prop types,0.5744724,Minor: Update PropTypes (#3218),,0
Add action prop,0.52256185,Route addHandlerKey prop,,0
Fix the withRef mess (#3740),0.415635,Fix non-exact match of pattern with trailing slash (@aaugustin in #3923),,0
Merge pull request #3732 from pleunv/fix-examples,0.42165706,f5d4f36 [fixed] Docs Update,Fix auth-with-shared-route example,0
Fix auth-with-shared-root example,0.32324627,87b1c2a [fixed] Navigation to root URL can fail,Fix for the changed default export behavior in babel 6. Fix auth-with-shared-root example,0
Some organization and style around withRouter ref.,0.5097422,"This release includes a notable performance boost by separating the ""Router"" context from the ""History"" context internally. We also allow every element type for Link's component prop and support a sensitive prop on NavLink for control over case sensitive matching.",,0
Adding support to get the component instance that withRouter HOC wraps (#3735),0.7466622,Add wrappedComponentRef prop to the component returned by withRouter,"  More code style fixes   Fixing code style, and updating ref to be a function ref   updating error message from not passing in proper options object   Updating withRouter based on comments   Reverting change to withRouter   Last minute spacing issues   Fixing some spacing issues   withRouter now supports withRef as an option, to better support getting the wrapped instance ",1
Add location to StaticRouter context,0.780738,Add a default <StaticRouter location> value (#8243),,1
Add various routers to top-level exports,0.6900089,Router default export.,,0
Docs guides index fix (#3737),0.5973408,f5d4f36 [fixed] Docs Update,,0
Add TODO,0.4493322,Add  and  (@aaugustin in #3912),,0
Add back history dep for now,0.79699147,042cffc [changed] Removed histories/added history dep,,1
Add per-env router implementations,0.53345066,"  mixins: [ Router.CurrentPath ],",,0
Remove a bunch of stuff that lives in react-history now,0.78282857,Remove react-history dep (@ryanflorence in d041434),,1
Allow a router prop to take priority over context prop. (#3729),0.7595878,- Feature: Support router as a prop on withRouter-wrapped components for overriding the router object from context (#3729),"withRouter should allow a router prop specified on a wrapped component to be used instead of the router in context; this pattern is more flexible, avoids overwriting explicitly set tests, and makes testing components wrapped by withRouter more simple.",1
Warn on invalid middlewares (#3717),0.7442857,- Bugfix: Warn on invalid router middlewares (#3717),,1
Add Promise support to async route functions (#3719),0.95876753,- Feature: Add Promise support to async route functions (#3719),  Add Promise support in getComponent(s).   Add Promises to get(Child/Index)Routes.   Chain getComponents default export handling too.   Point out that it's actually Babel 6 that's doing it.   Don't swallow exceptions.   Add babel-polyfill for Promises in tests.   Remove .default convenience on Promise handlers. ,1
Add root path,0.66018486,"  path: ""/"",",,0
Readme: Add root path to Route component (#3724),0.6860059,e028768 [added] <DefaultRoute> component,"Just getting started with React-Router, but thought it was a little unclear that the root URL isn't specified in the Route that renders the App component. While /groups and /users will still render correctly, navigating to the root URL '/' will give an error.",0
Add test for blocking the back button (i.e. go(-1)),0.57953,    this.goBack();,,0
Rename test file,0.36990458,92b9077 [changed] file name of dist builds,,0
Unblock when  unmounts,0.4543097,Decouple AbortController usage between revalidating fetchers and the thing that triggered them such that the unmount/deletion of a revalidating fetcher doesn't impact the ongoing triggering navigation/revalidation (#10271),,0
Make  behave more like browsers on revert,0.5577656,    this.goBack();,,0
Remove  component,0.51512146,"    Component: Home,",,0
Add  component,0.6141995,"    Component: Home,",,0
"Pass { action, location } to children",0.5166127,"// if you're not a route component, you need to pass location down the",,0
Add revert capabilities to DOM histories,0.50981236,395a590 [changed] fallback to window.location for history,,0
Remove unused module,0.4669965,Remove the entire website application from the npm package (@timdorr in a5e05f7),,0
More stringent test,0.44071057,NavLink exact & strict tests (#4454 by @pshrmn),,0
Remove missing import,0.5825688,Importing,,0
Use location state for storage,0.5195626,Use history.createLocation where possible (#2910),,0
Handle hashchange as POP,0.5378541,Ensure revalidations happen when hash is present (#10516),,0
Spread import across multiple lines,0.4796726,Importing,,0
Merge pull request #3716 from bengotow/patch-1,0.4575687,f5d4f36 [fixed] Docs Update,Update README.md to clarify versioning scheme vs versions,0
Update README.md,0.5322455,Updated dependencies:,,0
Merge pull request #3715 from reactjs/node-oops,0.5666269,ebf54ab [removed] Dependency on react/lib/merge,Make code work on Node 4,0
Make code work on Node 4,0.41427645,3be6a2d [fixed] Workaround for nasty npm bug,,0
Update Babel config (#3703),0.7576302,Minor: Upgrade to Babel 6 (#3362),  Update Babel config   Update for Babel 6.13.2   Lint all the things   DEV is a non-writable global ,1
Remove key/state from hash history locations,0.54918706,This is intended and part of createHashHistory (which is the default history approach used if one is not specified). You can read more about the feature here and how to opt out here.,,0
Add  w implementation in ,0.34322742,c43fb61 [added]  prop,,0
Use default prop,0.5353001,    // scenario that's pretty much what the old prop did,,0
Better warning messages,0.6325662,A few error message improvements (#8202),,0
Give hashbang URLs a leading slash,0.6250799,fix: Fix trailing slash behavior on pathless routing when using a basename (#9045),,0
Add action to history context,0.6712623,Separate history to its own context (#7103 by @illuminist),,0
 defaults to -1,0.3454588,"old behavior will still work, you should update your code soon because",,0
s/pop/go/ in context.history,0.4118276,Separate history to its own context (#7103 by @illuminist),,0
Use willMount/willReceiveProps in history actions,0.41886362,Decouple AbortController usage between revalidating fetchers and the thing that triggered them such that the unmount/deletion of a revalidating fetcher doesn't impact the ongoing triggering navigation/revalidation (#10271),,0
Better prop name,0.5060151,    // scenario that's pretty much what the old prop did,,0
Always clamp index value,0.45946252,"    index: true,",,0
Replace changes the location key,0.5184239,4af3c18 [fixed] HashLocation triggers 'replace' state on transition.redirect(),,0
Refactor history render tests,0.4877435,fc8a7a4 [changed] Run examples using HTML5 history,,0
Add tests for various hashType values,0.44776386,Ensure revalidations happen when hash is present (#10516),,0
Merge pull request #3708 from reactjs/syntax-highlight,0.5754491,#3607 [added] Support for React v0.15,Revert to npm-friendly syntax setting in README [ci skip],0
Revert to npm-friendly syntax setting in README [ci skip],0.61493045,3be6a2d [fixed] Workaround for nasty npm bug,,0
More strict prop types,0.55395555,"Note: This work is still ongoing, as the React team still has some outstanding issues to figure out themselves. Keep an eye on this issue and the prop-types repo for updates as we all work through this craziness. ",,0
Fix linting errors,0.47184396,2fc9976 [fixed] eslint cleanup; trailing comma fix for IE,,0
Add ,0.520884,Add  and  (@aaugustin in #3912),,0
Remove stray .only :/,0.38298517,"6526e70 [removed] location=""disabled""",,0
Add  w tests,0.4018991,NavLink tests (#4421 by @pshrmn),,0
More precise tests,0.40798926,NavLink exact & strict tests (#4454 by @pshrmn),,0
Consolidate render test sequence logic,0.4557943,pattern and handle the rendering of the deferred data inline:,,0
"Add , , , and ",0.56611,Add  and  (@aaugustin in #3912),,0
Switch to babel-plugin-istanbul (#3701),0.583809,Minor: Upgrade to Babel 6 (#3362),,0
refactor out StaticRouter from Router,0.6718304,Fix missing StaticRouter (#4389 by @supasate),,0
fix css,0.42378312,Use Prettier on the code (e6f9017 by @mjackson), wasnâ€™t rendering in safari anymore elements heights werenâ€™t bound by the window   anymore,0
fix controlled Router,0.5515443,Render your router with <RouterProvider>,"onChange was not being passed on to History, so we werenâ€™t able to control it anymore",0
fix Miss example,0.6586509,5bd62b5 [fixed] errors in examples,,0
NavigationPrompt: fix unbound method and pass location,0.62876236,Fix bug when calling useNavigate from <Routes> inside a <RouterProvider> (#10432),,0
Merge pull request #3698 from reactjs/update-gitignore,0.58389485,ebf54ab [removed] Dependency on react/lib/merge,Update .gitignore,0
Update .gitignore,0.43179986,8152d67 [changed] repo location to rackt/react-router,,0
Version 3.0.0-alpha.3,0.6768367,| v0.13 | v1.0 |,,0
Merge pull request #3696 from reactjs/createMemoryHistory-docs-tweak,0.56017876,#2262 [added] Support for React v0.14,Improve copyediting on createMemoryHistory docs,0
Improve copyediting on createMemoryHistory docs,0.49308786,Export createMemoryHistory #2792,,0
add note about possible use case for memoryHistory (#3693),0.53071296,0e7a182 [added] pluggable history implementations closes #166,"While developing a widget which is meant to be embedded into websites via an iframe, we noticed history taking over the parent pageâ€™s back/forward button (not a bug, just the way browser history works). We were able to isolate the routing to the widget by using memoryHistory. This PR just adds a tiny note that createMemoryHistory can be useful for a case like that.",0
Merge pull request #3687 from reactjs/function-to-docs,0.5454223,ebf54ab [removed] Dependency on react/lib/merge,Add docs for function to on ,0
Add docs for function to on ,0.41545212,"Add support for functions in <Link to> and <NavLink to> (#5331, #5368)",,0
Version 2.6.1,0.66501534,// v0.10.x,,0
Merge pull request #3686 from reactjs/chore,0.5680654,ebf54ab [removed] Dependency on react/lib/merge,Fix lint issue in test against new ESLint,0
Fix lint issue in test against new ESLint,0.5264517,2fc9976 [fixed] eslint cleanup; trailing comma fix for IE,,0
Fix handling of patterns that are method names (#3680),0.45869794,Fix non-exact match of pattern with trailing slash (@aaugustin in #3923),,0
Use only Codecov for coverage (#3685),0.30416495,Removed use of eval in development to be compliant with unsafe-eval CSP - #6611,,0
Add codecov config,0.3394529,ca9e3b7 [added] IndexRedirect,,0
Merge pull request #3684 from reactjs/react-15.3,0.6500567,#3607 [added] Support for React v0.15,Run CI against new React release,0
Run CI against new React release,0.59388703,React 16.3 support,,0
Merge pull request #3678 from reactjs/fix-browserstack,0.5961772,ebf54ab [removed] Dependency on react/lib/merge,Fix BrowserStack config,0
Merge pull request #3681 from reactjs/goBack-docs-tweak,0.53310853,ebf54ab [removed] Dependency on react/lib/merge,Tweak goBack docs a bit,0
Tweak goBack docs a bit,0.64831287,62c49d2 [changed] Change Navigation to return the result of goBack(),,0
Fix BrowserStack config,0.48026514,Donâ€™t create browserHistory on the server,,0
Merge pull request #3674 from stevenyap/patch-1,0.4603419,f5d4f36 [fixed] Docs Update,Add instruction on navigating back to previous page,0
Merge goBack with previous example,0.5992111,62c49d2 [changed] Change Navigation to return the result of goBack(),,0
Merge pull request #3673 from reactjs/syntax-jsx,0.5518861,ebf54ab [removed] Dependency on react/lib/merge,Improve syntax highlighting in docs,0
Add instruction on navigating back to previous page,0.588797,62c49d2 [changed] Change Navigation to return the result of goBack(),I have been searching in the tutorials and guides but unable to find the instruction on how to navigate back to the previous page. I hope this addition will help more users.,0
Improve syntax highlighting in docs,0.4910723,"Several docs improvements (see #6410, thanks @justsml)",,0
Add support for function to (#3669),0.6030902,"Add support for functions in <Link to> and <NavLink to> (#5331, #5368)",,0
Add module entry point for webpack 2 (#3672),0.9021927,- Chore: Add module entry point for webpack 2 (#3672),,1
Move the ES modules build where it belongs (#3670),0.87632406,- Chore: Move ES module build to es/ (#3670),,1
Clean up cruft in tests (#3668),0.3957207,Unit tests are a pain because you need to find a way to reset the singleton in-between tests,,0
Merge pull request #3660 from thaiphan/patch-1,0.4593377,f5d4f36 [fixed] Docs Update,Add an example on how to use the onEnter callback,0
Update API.md,0.6252746,Modified APIs,,0
Address code review comments,0.3960539,df38294 [fixed] Allow comments in JSX config,,0
Fix derp,0.3739277,824ed63 [fixed]  handling,,0
Add an example on how to use the onEnter callback,0.46528023,      somePromise().then(callback);,This change adds an example on how to use the onEnter callback to redirect a user to another page.,0
Merge pull request #3650 from jblock/fix-doc-links,0.48646274,f5d4f36 [fixed] Docs Update,Updates links to old docs in README,0
PR feedback--fix link to 1.0.0 upgrade docs,0.56883484,"Skipping the changelog on this one, as @ryanflorence has a heavily refactored version coming in the next day or two. Please wait for that release before upgrading if you're not blocked by the previous release's packaging issues. ",,0
Updates links to old docs in README,0.43513674,f5d4f36 [fixed] Docs Update,,0
Version 3.0.0-alpha.2,0.68790317,| v0.13 | v1.0 |,,0
Add missing changelog entry,0.60538536,Full Changelog,,0
Support history v3 (#3647),0.6765726,- Breaking: Support history v3 instead of history v2 (#3647),,0
Update CoC version (#3649),0.61548305,Updated dependencies [c3406eb9],,0
Merge pull request #3646 from reactjs/remove-deprecated-propTypes,0.71795964,"Note: This work is still ongoing, as the React team still has some outstanding issues to figure out themselves. Keep an eye on this issue and the prop-types repo for updates as we all work through this craziness. ",Remove deprecated propTypes,1
Remove deprecated propTypes,0.6930084,Re-enable proptypes warnings (@mjackson in 5f4b649),,0
Version 2.6.0,0.6843264,// v0.10.x,,0
Fix when the  onClick invariant runs (#3636),0.86325693,- Bugfix: Fix when the <Link> onClick invariant runs (#3636),,1
Update helpers for warning messages (#3638),0.6355255,A few error message improvements (#8202),This doesn't change any behavior. It just syncs up the logic to the latest that I have elsewhere.,0
Merge pull request #3639 from reactjs/fix-history-link,0.6178534,Remove react-history dep (@ryanflorence in d041434),Fix links to history repo,0
Fix links to history repo,0.5440434,Bumps the history dependency to version 4.9.0,,0
Fix my mistakes in test setup (#3637),0.44480574,7d52d55 [changed] TestLocation is a constructor,  Fix my mistakes in test setup   Update dependencies ,0
Fix up the base website template.,0.49612716,Updated website,,0
Fix Auth example,0.4421625,"Auth Example â€“ Demonstrates an authentication flow including using the new useNavigate() hook, the <Navigate> element, and location.state",,0
Use expressions instead of function bodies,0.49085838,"function and close over the information you need, or simply define those",,0
Clarify intent,0.32943797,and not mess with context:,,0
Tweak instance var name,0.47106454,Manually set displayName for components,,0
Use real warning instead of stub,0.5286874,Introduced more warnings in development builds,,0
Inline ,0.35202995,an option:,,0
Remove context.history completely,0.6820363,160c5ba [fixed] Removed  warning about no history in context,,0
Add blockTransitions to context.router,0.6721289,Split context.router into two parts: context.history and context.route,,0
Better  prop type,0.5863446,    // scenario that's pretty much what the old prop did,Only warn if  was actually given (it's controlled) and there is no onChange handler.,0
Be more explicit about which props  gets,0.5833547,// and then in your methods you have what you need on props,,0
Add missing location prop type,0.65429956,    location: React.PropTypes.object,,0
"Fix up these damn, dirty package.json's!",0.58896816,0a7298c [removed] browserify.transforms from package.json,,0
