Index,Commit Message,Score,Correspond Changelog Sentence,Commit Description,Label
1813,chromecast: show WebTorrent before torrent name,0.75475276,Do not automatically set WebTorrent as the default handler for torrents (#771),Fixes #404,1
1814,Merge pull request #198 from feross/update,0.4826216,Remove unneeded dependencies (feross),,0
1815,Merge pull request #826 from feross/readme,0.41122025,Remove unneeded dependencies (feross),,0
1816,chore: Set node 16 and npm 7 as minimum versions (#1977),0.42599544,Update Windows build documentation #1715 (RecoX),,0
1817,gitter,0.5385214,Trackers.,"This works around a WebTorrent bug where calling client.add(torrentFilePath) to add a duplicate torrent -- in other words, one whose infoHash we're already torrenting -- creates a new torrent object and later throws an error. Inconsistently, calling client.add(magnetURI) or client.add(infoHash) to add a duplicate torrent returns the existing torrent object that we're already torrenting and doesn't throw an error. This also fixes a prety nasty bug where pasting a dupe magnet link changed the torrentKey of an existing torrent, breaking the communication between the main and WebTorrent windows Fixes #364",0
1818,Merge pull request #104 from feross/greenkeeper-webtorrent-0.83.0,0.49243784,Moved project from Feross's GitHub account to the WebTorrent GitHub organization,Fixes #386,0
1819,fixes for Electron 9,0.73660374,Update to Electron 9 #1729 #1832,,1
1820,Merge branch 'master' of https://github.com/webtorrent/webtorrent-desktop into original,0.5699949,- Renamed WebTorrent.app to WebTorrent Desktop,Fixes #402,0
1821,Merge pull request #510 from feross/dc/fix,0.50278026,Remove unneeded dependencies (feross),,0
1822,ProBot Welcome: tweak comments,0.41715336,Add announcement feature,http://greenkeeper.io/,0
1823,Ignore JetBrains IntelliJ IDEA project files,0.39169937,Remove '(BETA)' from app window title #1562 (dsernst),,0
1824,fix(deps): update dependency webtorrent to v1.8.24,0.7015554,Fix crash when updating from WebTorrent 0.5.x in some situtations (#583),,1
1825,Bump electron from 10.1.1 to 10.1.2,0.7686174,Updated to electron@1.6.16," packager: call callbacks consistently  Before this, the callbacks would not being called, which would lead to an incomplete build on non-OS X platforms when trying to build all for all platforms.  packager: Always produce OS X update file regardless of --package option  This makes it consistent with how the windows build always produces the .nupkg autoupdate files  packager: fix duplicate npm install  Move ""npm prune && npm dedupe"" into the release script. Remove an extra ""npm install""  Make Windows portable app  When a folder named ""Portable Settings"" exists in same folder as WebTorrent.exe, then use it instead of the default application config path. Closes #358   packager: remove redundant signing warning   cross platform zip function   Set config file path to match config.CONFIG_PATH   portable app: make electron settings portable   portable: fix poster/torrent paths   use cross-zip   portable app: default download folder inside 'Portable Settings' ",1
1826,Telemetry: handle undefined values (#851),0.60152376,"Better telemetry: log error versions, report more types of errors",,0
1827,Don't load cast module when seeking,0.41630352,"Fix the ""Play in VLC"" functionality #1850 (Hinara)",http://greenkeeper.io/,0
1828,Torrent list: overlay scrollbar,0.6520159,Torrent list style improvements,"  Many packager improvements; Windows signing!   Windows signing works now! (Certs are on an external USB stick that must be plugged into the build machine during build. We can't do the same for OS X because certs need to exist in the login Keychain to be found.)   Fixes #219   Signing is now optional (so OS X and Windows contributors can run npm run package without errors)   zip, dmg, and deb arguments are now passed in as e.g. ""--package=dmg""   Print a huge warning when signing is disabled so we're less likely to ship unsigned binaries to users.   Make console.logs during packaging consistent and parallel (""creating..."" followed by ""created."")   More aggressive signing warnings   Warn when building OS X app on non-OS X platform (because signing will never work on non-OS X platforms)  Warn when building Windows app on non-Windows platform (because signing doesn't work yet on non-Windows platforms)",0
1829,chore(deps): update actions/upload-artifact action to v3 (#2158),0.5736123,Update React (v16) and Material-UI (v0.20) #1483 (mathiasvr),  add multiple subtitles support   cleanup and remove log ,0
1830,1426 Consistent error message if no suitable poster image could be found.,0.6843704,Use poster.jpg file as the poster image if available (#558),,0
1831,Move webtorrent icons into static/,0.7068387,- Renamed WebTorrent.app to WebTorrent Desktop,,1
1832,Merge remote-tracking branch 'origin/greenkeeper/walk-sync-1.1.3' into small-updates,0.45883387,Asynchronous music metadata updates while streaming #1449 (Borewit),"I found it awkward to listen to the video tags 'playing' and 'paused' events, when we're controlling the state that defines what state it's in in the first place. This commit removes those listeners, in favor of just setting things to the right state immediately when play(), pause(), or playPause() is called. Added play(), pause() methods for clarity.",0
1833,Delete unused defaultPlayFileIndex,0.5306036,App uninstaller (Windows),,0
1834,fixpack,0.55245906,"Fix a sad, sad bug that resulted in 100+ MB config files","  fix error about pop   location-history: add optional callbacks   set handler on first tick   discovered by @dcposch  Show error when media format is unsupported  Before this change, the player would just get stuck on the loading screen forever without notifying the user.",0
1835,Merge pull request #611 from feross/close_caption,0.4512257,Fix silently failing to open magnets links on Linux (#1367),,0
1836,Merge pull request #206 from feross/osx-bundle-id,0.4513506,Remove unneeded dependencies (feross),Fixes #397,0
1837,handle case where cb is undefined,0.48030058,Fix rare case where config file could not be completely written (#733),  add default torrent: The WIRED CD   remove additional unneeded files ,0
1838,sound: Reduce volume even further,0.87622046,Reduce UX sound volume,  Stop media on Tray Icon > Hide   Linux tray support: check for libappindicator1   Fixes #383,1
1839,Fix: Increase Height of 'About' window even more,0.9306954,Fix: Increase height of 'About' window #1737 (akaustav),Made a smaller version (32x32) of the .png icon,1
1840,Add rpm package creation support,0.5506364,Add support for multiple audio tracks #1712 (hicom150),,0
1841,chore(deps): update dependency electron to v15.3.3,0.6953244,Update Electron to 1.4.15,Fixes #359 and #349.,0
1842,"Save .torrent dialog: Add ""All Files"" option",0.77506185,Save .torrent File,,1
1843,"Update music-metadata to 1.1.0, which I expected to be part of #1396.",0.7054454,Update to music-metadata 4.8.0 #1719 (Borewit),Now we use a function closure to capture the destArch variable so the for loop can't change it.,1
1844,disable background throttling in all windows,0.6258397,Pause audio reliably when closing the window,,0
1845,Move Escape keyboard shortcut to shortcuts.js,0.68182987,"Change ""Step Forward"" keyboard shortcut to Alt+Left (Windows)",This was a rare race condition during app shutdown where a 'wt-' message would be sent from the hidden webtorrent window to the main window after the main window was already closed. Fixes #373,0
1846,rely on electron's automatic ASAR handling,0.55371994,"    the next version of Electron, where the bug is fixed.",For #333,0
1847,fix(deps): update dependency webtorrent to v1.8.1,0.70609415,Fix crash when updating from WebTorrent 0.5.x in some situtations (#583),"  rm dist at start of build   renderer style   preload sound files for instant playback   The first time a sound file is played, the Audio object is cached. 5s after startup, all sound files are automatically preloaded.",1
1848,Fix integration test setup,0.82345945,Add integration tests,,1
1849,Remove lodash.merge require() hack,0.52427495,Remove unneeded dependencies (feross),While we have 0.x versions :),0
1850,remove console.log,0.470487,Don't kill unrelated processes on uninstall. (Windows),  issue template   cleanup closePlayer() and stopServer()   Add subtitle support (via drag-n-drop)   Drag and drop a subtitles file (.srt or .vtt) onto the player (or the app icon on OS X) to add subtitles to the currently playing video. For #281   add multiple subtitles structure   add open subtitle dialog from cc player controls ,0
1851,fix(deps): update dependency webtorrent to v1.8.22,0.6977471,Fix crash when updating from WebTorrent 0.5.x in some situtations (#583),  Add 32 bit arch for Linux   Fix trailing spaces ,0
1852,"Right click -> ""Save torrent file"" without using streams",0.7798571,Save .torrent File,"For audio-only .mov files, which are 0x0. Closes #340",1
1853,correct boolean attribute,0.32944888,Auto-focus the 'OK' button in modal dialogs (#1058),  Error on zero-byte poster   return cb to stop execution ,0
1854,Update music-metadata to 3.4.1,0.80673426,Update to music-metadata 4.8.0 #1719 (Borewit),,1
1855,Preserve audio between sessions,0.6191835,Pause audio reliably when closing the window,,0
1856,perf: Only require('./user-tasks') on windows,0.46424946,"Add ""About"" window (Windows, Linux)",,0
1857,Merge pull request #8 from feross/player-controls,0.45894638,Restore playback state when reopening player (#877),,0
1858,style,0.7486612,Nicer modal styles,,1
1859,Windows/Linux: Fix broken Quit option in Tray icon,0.74158776,Windows tray icon now stays in the right state,,1
1860,fixed styling issue,0.5592651,"Fix cast screen background: cover, don't tile",,0
1861,feat(a11y): Added roles and labels to the playback controls (#2167),0.5639919,Show audio track and disk number #1454 (Borewit),,0
1862,React: clean up App component,0.5596714,"Clean up the code. Split main.js, refactor lots of things",,0
1863,Merge pull request #183 from grunjol/feature-linux-desktop-icon,0.4714384,Fix Linux desktop file #1309 (bilelmoussaoui),This reverts commit 9c550997c90743a35272ba3cc7cbd94f247c913f.,0
1864,Windows: use remote releases URL for updates,0.5228226,"Re-enable WebRTC (web peers)! (OS X, Windows)",http://greenkeeper.io/,0
1865,Small style tweaks,0.63124746,Nicer modal styles,,0
1866,Fix processing arguments from second instance,0.39654183,Fix state.playing.jumpToTime behavior,,0
1867,Replace deprecated react-tools with babel,0.52675676,Remove unneeded dependencies (feross),  overwrite symlink on update   fix size and list definition ,0
1868,fix: replace dependency open with opn,0.5342524,Remove unneeded dependencies (feross),Before it only paused video...,0
1869,v0.17.2 changelog,0.53190935,Changed,,0
1870,Add alternate fullscreen shortcut âŒ˜+Shift+F (fix #26),0.65450144,Add additional video player keyboard shortcuts (#275),,0
1871,Merge pull request #138 from feross/readme-alt,0.43856466,Remove unneeded dependencies (feross),,0
1872,Fix JS error on app quit (#377),0.73527944,Fix App.js crash in Linux (#882),,1
1873,Fix error with menus.,0.66828936,Mac: Fix window not showing in Window menu,,0
1874,chore(deps): update actions/stale action to v6 (#2259),0.5582082,Update React (v16) and Material-UI (v0.20) #1483 (mathiasvr),,0
1875,"After creating torrent, remove create torrent page from forward stack",1.0000001,"After creating torrent, remove create torrent page from forward stack","It will leave the app in a bad state, now that we hae a separate WebTorrent process",1
1876,Update modal: improve buttons,0.5646659,Auto-focus the 'OK' button in modal dialogs (#1058),,0
1877,Merge pull request #205 from feross/compress,0.44300538,Remove unneeded dependencies (feross),,0
1878,chore(deps): update actions/setup-node action to v3 (#2154),0.50263214,Update React (v16) and Material-UI (v0.20) #1483 (mathiasvr),,0
1879,fix(package): update cp-file to version 7.0.0,0.54172546,Mac: Update Squirrel.Mac to 0.2.1 (fixes situations in which updates would not get applied),,0
1880,Check for type === video in clearPreview(),0.5440005,"Drag-and-drop files on video, or choose from file selector.",,0
1881,Only show previews for video,0.5075753,"Drag-and-drop files on video, or choose from file selector.", Files that are either 100% downloaded OR streamble should be enabled Disabled files should not be clickable  This fixes both bugs.,0
1882,1332: Fix selection of poster.jpg|png|gif image,0.7746294,Use poster.jpg file as the poster image if available (#558),,1
1883,Update to version 2.0.1 fixing bug: Borewit/music-metadata#100,0.77422196,Fix music metadata not showing up #1847 (Borewit),,1
1884,Fix copy magnet URI to clipboard,0.81654316,Copy Magnet Link to Clipbaord,,1
1885,Merge pull request #957 from feross/f/perf,0.46202707,Remove unneeded dependencies (feross),,0
1886,Avoid promise resolve results are ending up as error objects in callback handler.,0.43285283,Fix Uncaught TypeError: Cannot read property 'update' of undefined (#567),,0
1887,move release instructions to contributing.md,0.4511245,"Write application support files to the ""Portable Settings"" folder",,0
1888,show all supported architectures,0.41683385,Windows support!,Works around #303,0
1889,Electron 1.4.0,0.8987378,Update Electron to 1.4.2," No more pause icon in the file list Reset state.playng completely after each play Fixes #318: false ""cannot add dupe torrent"" error",1
1890,Merge pull request #1757 from webtorrent/greenkeeper/semver-7.0.0,0.49947113,Fix crash when updating from WebTorrent 0.5.x in some situtations (#583),"  fix ipc logs   minWidth 425   So title ""WebTorrent (BETA)"" doesn't get cut off  clear cast interval when casting stops; naming  Fix #300",0
1891,chore(deps): update dependency hosted-git-info to 2.8.9 [security] (#2138),0.55883443,ðŸ”’ This release contains a critical security fix. Please update as soon as possible.,Ignore OS X -psn_xxxx command line argument,0
1892,update auto-launch,0.74787205,"Fix auto-updater (OS X, Windows).",Fix #214,1
1893,make WINDOW_MIN_HEIGHT use existing values,0.6975345,Fix: Increase height of 'About' window #1737 (akaustav),Prevent killing the WebTorrent process,0
1894,Fixed Material UI Getting Started link,0.616081,Add support for pasting instant.io links (#559),Fox #304,0
1895,Nicer player controls,0.75701386,Nicer player UI,"Also, add shortcut for opening webtorrent inspector",1
1896,Header should not show when .hide-video-controls,0.6986488,Don't hide header when moused over player controls,Fixes #309,0
1897,"Resume playback from saved position, even if we had to restart the torrent",0.7443367,"Save video position, resume playback from saved position",,1
1898,Merge pull request #1406 from Borewit/code-style/merge,0.4011535,Fix startup problems #1419 (Borewit),Use Chromecast connected icon when applicable,0
1899,code style,0.5434966,Nicer modal styles,,0
1900,faster animation fade in,0.63144064,Switch UI to React to improve UI rendering speed (#729),Consistent error handling on all cast devices,0
1901,Material UI: finish Create Torrent,0.75769544,"When creating a torrent, show it in UI immediately",,1
1902,fix(package): update parse-torrent to version 7.0.0,0.6311195,"Fix ""Save Torrent File As..."" #1743 (gpatarin)",,0
1903,Merge pull request #49 from feross/fix-44,0.5284399,Remove unneeded dependencies (feross),Show video controls immediately on mouse move,0
1904,Treat .FLAC as playable audio,0.9488257,Treat .FLAC as playable audio (#1127),,1
1905,add .travis.yml,0.42727524,Fix path-selector in preferences page #1704 (mathiasvr),Notification Fixes,0
1906,Merge pull request #1927 from webtorrent/dependabot/npm_and_yarn/y18n-4.0.1,0.51881206,Fix Delete Torrent + Data for newly added magnet links,,0
1907,Notification: Focus/unminimize/activate window on click,0.6887026,- Highlight window on drag-and-drop,,0
1908,Pass FileInfo into music-metadata.parseStream() according API v6.,0.6471391,Audio file metadata gets shown in the UI,,0
1909,Update music-metadata tp version 3.6.1,0.78406286,Update to music-metadata 4.8.0 #1719 (Borewit),"Before, we would only focus, but not unminimize or show, etc.",1
1910,Merge branch 'master' into feature/external-player.js-cleanup,0.6174153,"Clean up the code. Split main.js, refactor lots of things",Fix #305,0
1911,Merge pull request #813 from avamsi/patch-1,0.4059863,Fix crash when updating from WebTorrent 0.5.x in some situtations (#583),to fix missing mime dep until https://github.com/grunjol/dlnacasts/pull/1 is merged,0
1912,Merge pull request #744 from feross/f/engines,0.49183923,Remove unneeded dependencies (feross),,0
1913,Do not use setVolume for storing global volume,0.39648187,"Stop writing Electron ""single instance"" lock file to ""%APPDATA%\Roaming\WebTorrent""",,0
1914,Merge pull request #1657 from hicom150/update_spectron,0.4623946,Fix electron SUID sandbox error #1707 (hicom150),"  Separate hidden window, with its own renderer process, for WebTorrent   (Must be a window. You cannot run WebRTC at all in a Web Worker, and you can't    run it well in a node process like the electron main process.)   Disabled the create-torrent-modal for now. That gives us a consistent UX   regardless of whether the user dragged files or folders onto the app or opened   the Create New Torrent menu item.   Main process routes all messages between the main and webtorrent windows.   The renderer index.js is smaller now (but still too big), with the WebTorrent   interface moved to webtorrent.js / it's own process.   The UI should be faster now, and should not lag under load. ",0
1915,chore(deps): update dependency nodemon to v2.0.12,0.48741525,Support Debian Jessie,,0
1916,Fix subtitle controls radio button size,0.894565,Fix subtitle selector radio button UI size glitch,Remove media queries,1
1917,chore(deps): update dependency open to v8.2.1 (#1996),0.51616573,Remove unneeded dependencies (feross),They make the app feel too much like a webpage. I don't like the UI jumping around as I resize the window.,0
1918,es6ify,0.44613445,Fix keyboard shortcuts Space and ESC being captured globally (#585),Add DLNA support,0
1919,chore(deps): update dependency nodemon to v2.0.21,0.48311982,Support Debian Jessie,,0
1920,chore(deps): update dependency @babel/core to v7.20.2,0.5097068,Update Electron to 1.4.2,,0
1921,chore(deps): update dependency tape to v5.3.1,0.5051501,Remove unneeded dependencies (feross),,0
1922,fix(deps): update dependency music-metadata to v7.13.3,0.6868094,Update to music-metadata 4.8.0 #1719 (Borewit),,0
1923,Windows Volume Mixer fix (#387),0.6942412,Properly size the Windows volume mixer icon.,Add crash reporting,0
1924,Windows: register protocol handler without needing Admin privledges,0.5265881,"Windows app signing, for fewer install warnings.",,0
1925,native apps don't use the pointer cursor,0.50975335,Don't show pointer cursor on torrent list checkbox,,0
1926,mono is needed to create setup.exe (#1715),0.47047192,"Write application support files to the ""Portable Settings"" folder",This reverts commit 509e2804e00476f15065ab84b18e3d55b6e05fad.,0
1927,ProBot Lock: 90 days,0.47984564,Wait 10 seconds (instead of 60 seconds) after app launch before checking for updates.,,0
1928,Design: torrent list expand and collapse handle,0.78476644,Torrent list redesign,,1
1929,v0.17.1 changelog,0.53693724,Changed,"If user refreshes after renderer crashes, the this line throws an exception",0
1930,Update music-metadata to version 7.0.2,0.8079704,Update to music-metadata 4.8.0 #1719 (Borewit),,1
1931,1332: Improve cover image score algorithm:,0.43882143,Improve audio poster selection: #1368 (Borewit),Uninstall handlers on Windows uninstall/npm run clean,0
1932,buble@0.15,0.45679322,Show audio track and disk number #1454 (Borewit),,0
1933,Fix Uncaught TypeError: Cannot read property 'update' of undefined (#567),0.9999999,Fix Uncaught TypeError: Cannot read property 'update' of undefined (#567),Windows Installer improvements,1
1934,add CHANGELOG.md,0.547524,Changed,,0
1935,cross-zip@2.1.6,0.44386753,Copy Magnet Link to Clipbaord,,0
1936,conditionally load migrations requires,0.37495995,Remove unneeded dependencies (feross),,0
1937,Merge pull request #508 from feross/fix-handler,0.49966496,Remove unneeded dependencies (feross),"OS X: Name update file with ""-darwin.zip""",0
1938,better default torrent bg,0.7014437,"Lightweight, fast torrent client",,1
1939,chore(deps): update dependency electron to 11.1.0 [security] (#1939),0.6359527,Update to Electron 9 #1729 #1832,,0
1940,fix paths in clean script,0.45790997,Fix paste shortcut in tracker list on Create Torrent page (#1112),,0
1941,Update copyright a year later,0.40363434,"New ""Create torrent"" page to modify:",,0
1942,fix(deps): update dependency webtorrent to v1.8.3 (#2149),0.7182315,Fix crash when updating from WebTorrent 0.5.x in some situtations (#583),,1
1943,Merge pull request #209 from feross/subtler-app-sounds,0.5203063,Add support for multiple audio tracks #1712 (hicom150),,0
1944,fix(package): update simple-get to version 3.0.3,0.5616852,Fix exception that affects users upgrading from v0.5.1 or older,,0
1945,Merge pull request #1830 from webtorrent/dependabot/npm_and_yarn/lodash-4.17.19,0.49332845,Fix crash when updating from WebTorrent 0.5.x in some situtations (#583),,0
1946,0.18.0,0.61292464,Updated to material-ui@0.17,Follow debian package name convention,0
1947,Fix clean script,0.5289505,"Cleanup unsupported codec detection (#569, #570)",,0
1948,TorrentSummary.getFileOrFolder,0.728173,Support creating torrents that contain .torrent files.,Name the .deb file consistently,1
1949,show notifications even when window is focus,0.60429215,- Highlight window on drag-and-drop,"Instead of ""webtorrent-desktop_0.2.0-1_amd64.deb"", name it ""WebTorrent-v0.2.0.deb""",0
1950,Fix lint error,0.56847596,Fix Linux desktop file #1309 (bilelmoussaoui),Linux: Create .deb package,0
1951,toggle fullscreen on end,0.78707784,Add pinch-to-zoom gesture to enter/exit fullscreen (#1148),Windows/Linux: Fix broken Quit option in Tray icon,1
1952,fix(deps): update dependency webtorrent to v1.8.31,0.69827604,Fix crash when updating from WebTorrent 0.5.x in some situtations (#583),"This also cleans up the code by handling quit in the same way for all platforms, removing the special case in tray.js for darwin. We already have a 'before-quit' handler in main/index.js, so this is now handled there :)",0
1953,added missing method to menu.js,0.48002684,Missing 'About WebTorrent' menu item. (Windows),,0
1954,fix(deps): update dependency webtorrent to v1.3.2,0.7013211,Fix crash when updating from WebTorrent 0.5.x in some situtations (#583),OS X: Use app.setAsDefaultProtocolClient,1
1955,Add macOS Notarization,0.898405,Add macOS Notarization #1834 (feross)," OS X: Register as default handler for ""magnet"" on startup  Also:  Log errors in the renderer process, like the rest of errors in the main process Windows: Less chance of registry write race condition  Fix #285",1
1956,Run ImageOptim over static images,0.5136548,Fix app DMG background image,Just like other OSes. There's no reason for there to be a difference.,0
1957,Resuming paused torrents when streaming torrent finishes downloading (wt-done).,0.7583454,"Add a new ""Transfers"" menu for pausing or resuming all torrents (#1027)",  refactor cast module   fix standard   remove debug dependency ,1
1958,"Design: no gradients, nicer default colors",0.5609158,Nicer modal styles,,0
1959,use instant.io as starting point,0.5459257,Add support for pasting instant.io links (#559),,0
1960,"WebTorrent, LLC",0.7183763,Supports WebTorrent protocol â€“Â for connecting to WebRTC peers (i.e. web browsers),,1
1961,Fix scrub button position,0.52732706,Fix subtitle selector radio button UI size glitch,Fixes #253,0
1962,Merge pull request #1712 from hicom150/change_audio_tracks,0.7130017,Add support for multiple audio tracks #1712 (hicom150),Fixes https://github.com/feross/webtorrent-desktop/issues/254,1
1963,Remove mkdirp,0.55458426,Remove torrent file and poster image when deleting a torrent,Update electron-prebuilt to version 0.37.4 ðŸš€,0
1964,fix(deps): update dependency webtorrent to v1.8.8,0.70985365,Fix crash when updating from WebTorrent 0.5.x in some situtations (#583),http://greenkeeper.io/,1
1965,Fix typo in renderer/views/player.js (#673),0.5465385,"Update to the latest webtorrent.js, fixing some more uncaught errors",,0
1966,Automatically add subtitle tracks,0.81234163,"When manually adding subtitle track(s), always switch to the new track.",,1
1967,config.COPYRIGHT,0.47531497,"Re-enable WebRTC (web peers)! (OS X, Windows)",,0
1968,Merge pull request #1751 from hicom150/update_to_dialog_sync_functions,0.42497212,Add support for pasting instant.io links (#559),,0
1969,chore(deps): update dependency @babel/core to v7.17.9,0.5084838,Remove unneeded dependencies (feross),Update webtorrent to version 0.90.0 ðŸš€,0
1970,Merge pull request #925 from feross/capture-frame,0.4701333,Remove unneeded dependencies (feross),http://greenkeeper.io/,0
1971,"Remove ""Add Fake Airplay/Chromecast"" menu items (#411)",0.9533595,"Remove ""Add Fake Airplay/Chromecast"" menu items.",,1
1972,"add binary, fix #247",0.5272574,"Fix several uncaught errors (#889, #891, #892)",Keep track of the most recent file modtimes at which we verified that the torrent piece hashes all match.,0
1973,Merge pull request #314 from feross/cast-connected,0.46929663,Better error handling when Chromecast/Airplay cannot connect,,0
1974,Merge pull request #226 from feross/fix-ubuntu-crash,0.4765959,Fix startup problems #1419 (Borewit),,0
1975,Disable view menu items when window is hidden,0.7448946,Windows top menu is no longer automatically hidden.,,1
