Index,Commit Message,Score,Correspond Changelog Sentence,Commit Description,Label
570,Merge branch 'save-prefs' of https://github.com/webtorrent/webtorrent-desktop into save-prefs,0.55146694,Save .torrent File,,0
571,fix(deps): update dependency webtorrent to v1.8.19 (#2200),0.70753795,Fix crash when updating from WebTorrent 0.5.x in some situtations (#583),Update dependencies (prep for release),1
572,ProBot Welcome: PR message tweak,0.47698566,Add announcement feature,This doesn't actually change package-lock.json in a meaningful way. But I want package.json to list the latest version.,0
573,Add missing key to torrent status element,0.62809443,Add (+) button now also accepts non .torrent files and creates a torrent from,For: https://github.com/webtorrent/webtorrent-desktop/issues/1599,0
574,Fix type errors,0.74070096,Fix a few type errors #1720 (mathiasvr),,1
575,webtorrent@0.88,0.7004052,Updated WebTorrent engine to 0.98.5,,1
576,Merge pull request #1165 from janza/chromecast-subtitles,0.7368188,Add support for subtitles on Chromecast #1165 (janza),,1
577,"Pixel values should use numbers, not strings",0.3075272,Fix percentage rounding error #1716 (pR0Ps),,0
578,Disable playback controls while in external player (#909),1.0000001,Disable playback controls while in external player (#909),,1
579,Merge pull request #297 from feross/win,0.43294394,Remove unneeded dependencies (feross),,0
580,fix(package): update drag-drop to version 5.0.1,0.5796872,Fix crash when updating from WebTorrent 0.5.x in some situtations (#583),,0
581,Merge branch 'master' into open-in-vlc-preferences,0.4518901,"New Preference to ""Always play in VLC"" (#674)",,0
582,Update CHANGELOG.md,0.6404136,Changed,,0
583,fix(deps): update dependency music-metadata to v7.12.5,0.68769777,Update to music-metadata 4.8.0 #1719 (Borewit),,0
584,build(deps): bump nanoid from 3.1.23 to 3.3.1 (#2144),0.5294321,Update Electron to 1.3.2 (#738) (#739) (#740) (#747) (#756),,0
585,Merge pull request #674 from codealchemist/open-in-vlc-preferences,0.484295,"Fix the ""Play in VLC"" functionality #1850 (Hinara)",,0
586,1332: Add unit test for cover selection algorithm.,0.47107646,Add integration tests,To address minor xss vulnerability in http server. See: https://github.com/webtorrent/webtorrent/pull/1714,0
587,Integration tests: README,0.8381736,Add integration tests,,1
588,cross-zip@4,0.45653987,Copy Magnet Link to Clipbaord,,0
589,Preferences update,0.6235838,Fix path-selector in preferences page #1702 (314eter),Greenkeeper/drag drop 5.0.1,0
590,Merge pull request #973 from feross/feross/style,0.53035885,Remove unneeded dependencies (feross),,0
591,Fix Cli Test fails: JavaScript Standard Style,0.47973037,Improve codec unsupported detection #1711 (hicom150),Closes #1663,0
592,fix application-config update,0.69100136,"Fix auto-updater (OS X, Windows).",,0
593,electron-prebuilt@1.3.0,0.788259,Updated to electron@1.6.16,,1
594,add downloads folder - fix #53,0.62740195,Fix paste shortcut in tracker list on Create Torrent page (#1112),,0
595,Cast buttons and fullscreen in player controls,0.6724309,Show player controls immediately on mouse move,Closes #1609,0
596,Merge branch 'greenkeeper/electron-4.0.0' into update-electron,0.7295754,Update Electron to 1.4.2,Update dependency music-metadata to v4.3.0,1
597,0.17.0,0.6936896,Updated to material-ui@0.17,,0
598,Fix window bounds restore on OSx,0.73731744,Mac 10.9: Fix window having border,Cleanup preferences page,1
599,Merge pull request #170 from feross/windows-torrent-handler,0.52282286,Prevent opening multiple stacked Preference windows or Create Torrent windows (#770),,0
600,Merge pull request #1835 from webtorrent/osx-notarize,0.56981313,Associate .torrent files to WebTorrent Desktop (OS X) (#553),,0
601,update deps,0.566169,ðŸ”’ This release contains a critical security fix. Please update as soon as possible.,,0
602,main: Start loading state before app is ready (#952),0.54411304,Fix installing when the app is already installed. (Windows),supersede #1583,0
603,deep-equal@1.1.0,0.33709407,Updated to material-ui@0.17,Removed zero-fill,0
604,Windows/Linux: Add About Window (#220),0.80106026,"Add ""About"" window (Windows, Linux)",,1
605,"Fix issue #1833, only pass metadata. Prevent MetadataCollector (from music-metadata) is serialized.",0.73448277,Fix music metadata not showing up #1847 (Borewit),Pass title metadata in media url,1
606,Pref: start automatically on login,0.85094285,Option to start automatically on login,Fixes: https://github.com/webtorrent/webtorrent-desktop/pull/1576,1
607,Fix lintian warnings,0.5404091,"Fix several uncaught errors (#889, #891, #892)",,0
608,fix(package): update languagedetect to version 2.0.0,0.4984903,Fix exception that affects users upgrading from v0.5.1 or older,,0
609,fix(deps): update dependency parse-torrent to v9.1.5,0.6011393,Updated WebTorrent engine to 0.98.5,,0
610,Merge pull request #474 from feross/application-config,0.5213301,Remove unneeded dependencies (feross),,0
611,Bugfix: window title shouldn't be stuck on 'Preferences',0.60347944,"Fix window title on ""About WebTorrent"" window",,0
612,Merge pull request #1514 from webtorrent/greenkeeper/music-metadata-3.2.2,0.5836085,Fix music metadata not showing up #1847 (Borewit),,0
613,Issue #92: Merge with master & exclude some of the proposed changes.,0.4183463,Changed,,0
614,Mitigate protocol handler vulnerability,0.7339575,[SECURITY] Mitigate Electron protocol handler issue (Windows),,1
615,Fix title in About Window,0.8047792,"Fix window title on ""About WebTorrent"" window",Update rimraf to the latest version ðŸš€,1
616,fix(package): update application-config to version 2.0.0,0.5965364,Mac: Update Squirrel.Mac to 0.2.1 (fixes situations in which updates would not get applied),,0
617,perf: ~40ms improvement: Lazy load controllers and page components,0.5103521,Reduce the number of DOM updates substantially,,0
618,introduce linux arm64 support,0.7502539,Linux .rpm packages and arm64 builds are now available! #1694 (hicom150),,1
619,"smaller font, smaller torrent list item",0.83432245,"UI tweaks: Reduce font size, reduce torrent list item height.",,1
620,Merge pull request #593 from mathiasvr/duplicate,0.4351696,Fix a few type errors #1720 (mathiasvr),,0
621,Merge pull request #541 from feross/remove-concat-stream,0.4826731,Remove unneeded dependencies (feross),,0
622,merged,0.4039049,Add integration tests,,0
623,update plist dependency,0.47018075,Remove unneeded dependencies (feross),Update to Electron 6,0
624,Merge pull request #16 from feross/dc/player-controls,0.44642395,Remove unneeded dependencies (feross),Fix uninstall handlers in Linux,0
625,Pref: default torrent file handler,0.78254974,Do not automatically set WebTorrent as the default handler for torrents (#771),,1
626,Merge pull request #974 from feross/feross/portable,0.52884084,Remove unneeded dependencies (feross),,0
627,auto updater: code style,0.6095065,"Includes auto-updater, just like the OS X version.",StandardJS is getting this rule in standard v14.,0
628,Merge pull request #1642 from webtorrent/remove-32,0.54925585,Fix crash when updating from WebTorrent 0.5.x in some situtations (#583),,0
629,Merge pull request #772 from feross/electron-1.3.3,0.63545185,Update to Electron 10.1.0 #1864 (feross),Update to Electron 5,0
630,Remove debug console.logs,0.5042819,Remove unneeded dependencies (feross),For: https://github.com/webtorrent/webtorrent-desktop/issues/1637,0
631,Merge pull request #1233 from emilbayes/nojitter-time,0.39863694,Fix music metadata not showing up #1847 (Borewit),,0
632,e -> err,0.29520392,"Fix several uncaught errors (#889, #891, #892)",electron-packager@^14.0.4,0
633,Merge pull request #1707 from hicom150/no_sandbox,0.5010033,Fix electron SUID sandbox error #1707 (hicom150),,0
634,merged with latest master,0.30263576,"Clean up the code. Split main.js, refactor lots of things",,0
635,Update Electron to 1.4.1 (#955),0.92739767,Update Electron to 1.4.15,Update changelog for v0.21.0,1
636,remove unneeded title tag,0.60932684,Improve subtitle positioning (#551),,0
637,File details,0.7322391,  those files,,1
638,Show filename in window title. Fix #245,0.7147296,"Fix window title on ""About WebTorrent"" window",Changed function name handlesoundNotificationsChange for handleSoundNotificationsChange,1
639,add volume icon and slider (#330),0.6296377,"Volume slider, with mute/unmute button.",Update music-metadata to version 4.2,0
640,Merge pull request #46 from feross/persist,0.44102302,Remove unneeded dependencies (feross),,0
641,Fix the auto updater,0.83746195,"Fix auto-updater (OS X, Windows).",,1
642,Integration test: screenshot compare ignoring transparency,0.5932697,Add integration tests,,0
643,fixed styling issues,0.5621563,"Fix cast screen background: cover, don't tile",,0
644,Clean up handlers.js,0.6839411,"Clean up the code. Split main.js, refactor lots of things",Helps primarily module developers (like me) who set their local .npmrc to package-lock=false,0
645,spectron@9,0.5617344,Update to Electron 9 #1729 #1832,,0
646,Merge pull request #1887 from webtorrent/fix_lintian_warnings,0.6684514,Fix crash when updating from WebTorrent 0.5.x in some situtations (#583),"Update to electron 4; it may not be perfect, but we have to move on",0
647,Integration test: use /tmp,0.7511038,Add integration tests,,1
648,fix(package): update cp-file to version 6.0.0,0.58418036,Mac: Update Squirrel.Mac to 0.2.1 (fixes situations in which updates would not get applied),,0
649,Fix isProduction() detection,0.58317935,Improve codec unsupported detection #1711 (hicom150),Conflicts: package-lock.json package.json,0
650,remove unused css selector,0.44736266,"Remove ""Add Fake Airplay/Chromecast"" menu items.",,0
651,Fix selections migration,0.50552285,Fix path-selector in preferences page #1702 (314eter),,0
652,Use .ico format on Windows,0.7437634,Use .ico format for better icon rendering quality (Windows),,1
653,Add file name to state,0.5327993,Displaying filename while music metadata is being downloaded (#1361),Update babel-eslint to the latest version ðŸš€,0
654,Merge branch 'filename' into feature/improve-audio-torrent-poster-selection,0.5823157,Improved the poster selection for audio/music based torrents (#1334),Conflicts: package.json,0
655,Merge pull request #1664 from webtorrent/greenkeeper/drag-drop-5.0.1,0.5393369,Updated WebTorrent engine to 0.98.5,Greenkeeper/walk sync 2.0.2,0
656,Allow seeding torrents that contain subtitles,0.8543056,"Automatically include subtitle files (.srt, .vtt) from torrent in the subtitles menu.",Recommended readings to start working in the app.,1
657,0.17.1,0.6472498,Updated to material-ui@0.17,Update depcheck to the latest version ðŸš€,0
658,Fix state loading and saving,0.59353966,Ensure state.saved.prefs configuration exists,,0
659,added open in vlc feature.,0.6133677,Launch VLC player without the --video-on-top flag (#1286),Closes #1610,0
660,Fix exception caused by incorrect file ordering,0.71010214,"Fix ""gray screen"" exception caused by incorrect file list order",Update capture-frame to the latest version ðŸš€,1
661,Sync lock file,0.5750524,"Stop writing Electron ""single instance"" lock file to ""%APPDATA%\Roaming\WebTorrent""",,0
662,main modules use require() instead of arguments,0.3872682,Remove unneeded dependencies (feross),,0
663,Add 'Start Speaking' and 'Stop Speaking' menu item (Mac),0.9722922,Add 'Start Speaking' and 'Stop Speaking' menu item (Mac) (#439),Update parse-torrent to the latest version ðŸš€,1
664,Merge pull request #140 from feross/power-saver,0.51399195,Remove unneeded dependencies (feross),,0
665,"rename ""npm run cleanup"" to ""npm run clean""",0.42677262,Don't kill unrelated processes on uninstall. (Windows),,0
666,Merge pull request #499 from feross/fix-fullscreen-button,0.5174777,Mac 10.9: Fix the fullscreen button showing,,0
667,Merge pull request #543 from feross/on-open,0.4640943,Remove unneeded dependencies (feross),,0
668,Torrent details,0.7773682,Torrent comment.,,1
669,Switch from virtualdom to React,0.42190826,Update React (v16) and Material-UI (v0.20) #1483 (mathiasvr),Update create-torrent to the latest version ðŸš€,0
670,Refactor main.js: prefs controller,0.6263013,"Clean up the code. Split main.js, refactor lots of things",,0
671,Merge pull request #617 from feross/electron,0.58538395,Update to Electron 10.1.0 #1864 (feross),,0
672,window: set min height of one row visible,0.7396525,Fix: Increase height of 'About' window #1737 (akaustav),Closes #1611,1
673,"Write poster images into ""$CONFIG_PATH/posters"" (fix #155)",0.7593482,Use poster.jpg file as the poster image if available (#558),,1
674,chore(deps): update dependency electron to v15.4.0 (#2150),0.71575844,Update Electron to 1.4.15,,1
675,Auto populate 'Magnet Link' field with the address from clipboard,0.7412175,Copy Magnet Link to Clipbaord,,1
676,Pass title metadata in media url,0.542908,Displaying filename while music metadata is being downloaded (#1361),,0
677,Cross platform VLC detection,0.55247784,Improve codec unsupported detection #1711 (hicom150),Electron 4: Migrate .openDevTools() for new 'detach' pattern,0
678,Letterbox video. Hide toolbar in fullscreen,0.54682446,"Make the video window ""float on top"" for watching video while you work!",,0
679,chore(deps): update dependency pngjs to v7 (#2326),0.5201615,"Update to the latest webtorrent.js, fixing some more uncaught errors",Fix hiddenInset (Mac) titlebar style for electron 4,0
680,Merge pull request #317 from feross/f/psn,0.4476776,Remove unneeded dependencies (feross),,0
681,Material UI: consistent JSX style,0.57339317,Modals now use Material UI,,0
682,chore(package): update electron-prebuilt to version 0.37.5,0.78825796,Update Electron to 0.37.5,,1
683,chore(deps): update dependency plist to v3.0.6,0.5141691,Remove unneeded dependencies (feross),,0
684,Only use 'app.asar.unpacked' path where it is needed,0.5052302,Seed files/folders by dragging them onto the app,Conflicts: package.json,0
685,Toggle fullscreen on pinch to zoom,0.76077163,Add pinch-to-zoom gesture to enter/exit fullscreen (#1148),Fix the desktop file,1
686,chore(deps): update dependency electron to v15.4.2,0.70376176,Update Electron to 1.4.15,Toggle the sound notifications,1
687,Fix integration tests,0.86476284,Add integration tests,,1
688,Merge pull request #1920 from BlueManCZ/tray-fix,0.47583762,Fix for an issue that caused some magnet links to fail to open.,,0
689,added Playback preferences; added Play in VLC preference.,0.681735,"New Preference to ""Always play in VLC"" (#674)",sets the version the same way webtorrent dose https://github.com/webtorrent/webtorrent/blob/f8923a66a8b1178a412b067bc913e267025b3d57/index.js#L27-L29,0
690,Merge pull request #609 from mathiasvr/menu-items,0.4371088,Fix a few type errors #1720 (mathiasvr),,0
691,Clean up thumbar (thumbnail) code (#670),0.59015965,"Cleanup unsupported codec detection (#569, #570)",,0
692,"Show ""Download Complete"" notification",0.8396385,"""Download Complete"" notification shows consistently",Add YouTube style hotkeys. Closes #1395,1
693,changelog fixes,0.5301902,Changed,,0
694,add todo comment,0.50517654,Torrent comment.,,0
695,Merge remote-tracking branch 'origin/greenkeeper/iso-639-1-2.0.5' into small-updates,0.41885048,Asynchronous music metadata updates while streaming #1449 (Borewit),,0
696,fix(deps): update dependency chromecasts to v1.10.2,0.56966555,Fix crash when updating from WebTorrent 0.5.x in some situtations (#583),,0
697,OS X: Bounce the Downloads stack when download completes,0.982373,Bounce the Downloads stack when download completes. (OS X),,1
698,Prep for 0.22.0 release,0.60884476,ðŸ”’ This release contains a critical security fix. Please update as soon as possible.,Small updates,0
699,Removed zero-fill,0.491062,Bug Fix: Empty Array Reduce #1494 (clujin),,0
700,"Use direct file access, if the individual file has completed downloading.",0.6438784,"Default to the user's OS-defined, localized ""Downloads"" folder.",,0
701,Telemetry: address PR comments,0.5834782,Only send telemetry in production,,0
702,add pre-commit,0.5589571,Ensure state.saved.prefs configuration exists,,0
703,fix(package): update semver to version 6.0.0,0.52730006,ðŸ”’ This release contains a critical security fix. Please update as soon as possible.,Conflicts: package-lock.json,0
704,only show title in html toolbar on OS X,0.62760836,Show prompt text in title bar for open dialogs (OS X),,0
705,chore(deps): update actions/stale action to v5 (#2155),0.5459355,Update React (v16) and Material-UI (v0.20) #1483 (mathiasvr),,0
706,Associate .torrent files to WebTorrent Desktop (OS X) (#553),0.99999994,Associate .torrent files to WebTorrent Desktop (OS X) (#553),,1
707,Stop casting if you hit ESC or Back while casting,0.63764524,Stop casting to TV when player is closed,,0
708,"UI progress, material icons",0.5714103,Nicer player UI,,0
709,PR #278 fixes,0.5471511,"Fix several uncaught errors (#889, #891, #892)",Related: https://github.com/Borewit/music-metadata/releases/tag/v3.6.0,0
710,Design: progress bar styling,0.47535336,Beautiful user experience,,0
711,fix(deps): update dependency webtorrent to v1.2.2,0.693618,Fix crash when updating from WebTorrent 0.5.x in some situtations (#583),,0
712,add missing path-exists dep,0.49814007,"Crash when "".local/share/{applications,icons}"" path did not exist (Linux)",,0
713,chore(deps): update dependency @babel/core to v7.18.13,0.5014354,Remove unneeded dependencies (feross),,0
714,Add more peer ID entropy (#960),0.9489504,Add more peer ID entropy,,1
715,fix(deps): update dependency create-torrent to v4.7.1,0.6030841,"New ""Create torrent"" page to modify:",,0
716,Merge pull request #743 from feross/f/mac,0.5506845,Add macOS Notarization #1834 (feross),,0
717,Added missing dots for supported media extensions.,0.46619123,Add support for multiple audio tracks #1712 (hicom150),,0
718,Integration test: yet another round of fixes,0.86790246,Add integration tests,,1
719,Error on duplicate add,0.62441325,Show an error when adding a duplicate torrent.,Closes #1559,0
720,fix(deps): update dependency webtorrent to v1.5.1,0.7024428,Fix crash when updating from WebTorrent 0.5.x in some situtations (#583),,1
721,use org-wide security file,0.48390296,Private torrent flag.,,0
722,Major refactor -- split windows into separate files,0.59623384,Fix Delete Data File on Windows,,0
723,state: Use debounce to throttle saves,0.50298315,Block power save while casting to a remote device.,Update music-metadata to 3.5.2,0
724,add back removed log statement,0.42962265,"Telemetry improvements: redact stacktraces, log app version",,0
725,Merge pull request #840 from feross/playback-priority,0.4577802,Remove unneeded dependencies (feross),,0
726,Show main window before ipcReady,0.5108387,"When fullscreen, make controls use the full window. (OS X)",,0
727,Design: address PR comments,0.46778995,Add announcement feature,,0
728,fix(deps): update dependency drag-drop to v7 (#1964),0.5779355,Fix exception that affects users upgrading from v0.5.1 or older,,0
729,Fix formatting of measurement units,0.45404702,"Some temp data is still written to ""%APPDATA%\Temp"" (will be fixed in future version)",,0
730,chore(deps): update dependency tape to v5.5.0,0.50833255,Remove unneeded dependencies (feross),,0
731,delay install splash screen so user sees it,0.5580512,Wait 10 seconds (instead of 60 seconds) after app launch before checking for updates.,"As there is no too much information in the readme.md in how is this made, I think put a link of Electron and React to have an idea of the technologies used here is a good starter.",0
732,update material icons font,0.58220494,"UI tweaks: Reduce font size, reduce torrent list item height.",,0
733,"Convert Create Torrent modal to page, clean up App",0.77015793,"New ""Create torrent"" page to modify:",,1
734,push/unshift from submenu in linux/windows (#504),0.64008486,"Remove OS X-style Window menu. (Linux, Windows)",,0
735,Update music-metadata to v4.8.0,0.7990001,Update to music-metadata 4.8.0 #1719 (Borewit),,1
736,Use largest image in torrent as the poster,0.66106015,Better default window size that fits all the default torrents,Closes #1523,0
737,Merge pull request #283 from feross/greenkeeper-electron-prebuilt-0.37.4,0.6147288,Update to Electron 10.1.0 #1864 (feross),Greenkeeper/music metadata 3.3.0,0
738,"style: prefix all test commands with ""test-""",0.4631105,Add integration tests,Conflicts: package-lock.json,0
739,Update drag-drop to the latest version ðŸš€ (#1744),0.5753976,Updated to material-ui@0.17,,0
740,fix chromecast support,0.7512454,Better error handling when Chromecast/Airplay cannot connect,Update React and Material-UI,1
741,Use subtler UI sounds (#945),0.7481491,Subtler app sounds.,,1
742,Merge pull request #98 from feross/window-ui-improvements,0.48469913,Remove unneeded dependencies (feross),,0
743,Windows Portable App (#417),0.87465733,Windows Portable App build.,,1
744,1039: Formatting fixed.,0.5517251,Fix formatting issue in the speed stats on the Player page (#1039),,0
745,Fix npm run package,0.51481366,Fix Linux desktop file #1309 (bilelmoussaoui),,0
746,electron 10: re-enable remote module,0.5982901,Updated to electron@1.6.16,"remove react-tap-event-plugin, as it is not needed anymore.",0
747,move console.time/timeEnd to same file,0.44341844,"On startup, do not re-verify files when timestamps are unchanged",Update auto-launch,0
748,Fix bugs in LocationHistory,1.0000002,Fix bugs in LocationHistory,,1
749,Tweak pinch-to-zoom timing,0.5131826,Fix time and duration so it doesn't bounce in the UI (#1233),,0
750,"fix hide on hover, always show playback position",0.6475561,"Save video position, resume playback from saved position",,0
751,fix(deps): update dependency webtorrent to v1.5.4,0.69718623,Fix crash when updating from WebTorrent 0.5.x in some situtations (#583),Remove clashing .mp4 extension (with video) from audio.,0
752,chore(deps): update dependency electron to v13.1.0 (#1983),0.670925,Update Electron to 1.4.15,,0
753,perfectly vertically center OS menu buttons (OS X),0.6239225,Windows top menu is no longer automatically hidden.,,0
754,chore(package): update gh-release to version 3.2.1,0.5023048,ðŸ”’ This release contains a critical security fix. Please update as soon as possible.,Ensure that the minutes field in playback indicator is zero-padded.,0
755,Merge pull request #1497 from LinusU/prefer-const,0.40781218,"Re-enable WebRTC (web peers)! (OS X, Windows)",The minutes field should be zero-padded as long as the playback media is longer than 9 minutes (including hours). Fixes #1438.,0
756,Merge pull request #1317 from webtorrent/bugfix-1315,0.5825879,"Update to the latest webtorrent.js, fixing some more uncaught errors",Prefer const over let,0
757,chore(deps): update babel monorepo to v7.18.10,0.47851318,Update React (v16) and Material-UI (v0.20) #1483 (mathiasvr),,0
758,Fixes for PR #607,0.5791286,Fix percentage rounding error #1716 (pR0Ps),,0
759,React: convert functions to controls,0.482741,Show player controls immediately on mouse move,,0
760,fix(deps): update dependency webtorrent to v1.8.26,0.7064378,Fix crash when updating from WebTorrent 0.5.x in some situtations (#583),1436: Fix bug empty array reduce in audio poster selection,1
761,chore(deps): update dependency nodemon to v2.0.14,0.47970366,Remove unneeded dependencies (feross),,0
762,fix typo,0.5428292,Fix a few type errors #1720 (mathiasvr),,0
763,Add support for video progress time in player controls.,0.6267944,Show player controls immediately on mouse move,,0
764,Remove 'hat' dependency,0.6661459,Remove unneeded dependencies (feross),,0
765,Use capture-frame package,0.49444976,Support the .m2ts video container format (hicom150),fix: replace dependency open with opn,0
766,Removed console log.,0.44605872,Fix Delete Data File on Windows,,0
767,Refactor main.js: controllers.playback.skip() (#706),0.66540116,"Clean up the code. Split main.js, refactor lots of things",,0
768,0.1.0,0.5798423,Updated to material-ui@0.17,Save preferences immediately when changed,0
769,chore(deps): update dependency electron to v15.2.0,0.7035674,Update Electron to 1.4.15,,1
770,Update dependency music-metadata to version 0.9.5,0.77438915,Update to music-metadata 4.8.0 #1719 (Borewit),,1
771,Merge branch 'ebraminio-master',0.29864782,Add integration tests,,0
772,Remove unnecessary IPC,0.57575583,Fix crash when sending IPC messages,,0
773,Video controls: never hide when paused,0.61872256,Disable playback controls while in external player (#909),,0
774,fix(deps): update dependency @electron/remote to v2.0.4,0.71453077,Update Electron to 1.4.2,,1
775,travis: test node LTS only,0.40299094,Only send telemetry in production,,0
776,Update no-response.yml,0.5159284,"Update to the latest webtorrent.js, fixing some more uncaught errors",,0
777,Wait for .torrent files to finish downloading.,0.71975815,Save .torrent File,Add back loading spinner for player page.,1
