Index,Commit Message,Score,Correspond Changelog Sentence,Commit Description,Label
632,Backers: anon → Marius Meisenzahl,0.28603816,Pretty output Flatpak package origins by @meisenzahl in https://github.com/elementary/appcenter/pull/1962,Currently translated at 100.0% (237 of 237 strings) Translation: AppCenter/AppCenter Translate-URL: https://l10n.elementary.io/projects/appcenter/appcenter/pl/,0
633,StripeDialog: rewrite entry validation (#1655),0.4574942,AppListUpdateView: Rewrite with ListStore by @danirabbit in https://github.com/elementary/appcenter/pull/1979,Currently translated at 100.0% (237 of 237 strings) Translation: AppCenter/AppCenter Translate-URL: https://l10n.elementary.io/projects/appcenter/appcenter/ja/,0
634,Support for AppStream 0.9 and removed the homegrown description markup parsing,0.5286788,Get brand colors from the AppStream standard so more apps are supported,,0
635,Error install notifications (#128),0.6202185,Fix for notification not appearing when a restart is required,Currently translated at 100.0% (237 of 237 strings) Translation: AppCenter/AppCenter Translate-URL: https://l10n.elementary.io/projects/appcenter/appcenter/he/,0
636,Add agent-style icon to Stripe Dialog (#798),0.5496466,Gresource: add more category icons by @danirabbit in https://github.com/elementary/appcenter/pull/1948,Currently translated at 100.0% (237 of 237 strings) Translation: AppCenter/AppCenter Translate-URL: https://l10n.elementary.io/projects/appcenter/appcenter/fr/,0
637,Better management of updates/install/remove.,0.6349644,"Prevent suspending when installing, updating, or removing packages",Currently translated at 100.0% (237 of 237 strings) Translation: AppCenter/AppCenter Translate-URL: https://l10n.elementary.io/projects/appcenter/appcenter/ca/,0
638,comment style,0.49829134,StripeDialog: Add translator comment by @davidmhewitt in https://github.com/elementary/appcenter/pull/2009,Currently translated at 100.0% (237 of 237 strings) Translation: AppCenter/AppCenter Translate-URL: https://l10n.elementary.io/projects/appcenter/appcenter/uk/,0
639,Re-organize source files (#139),0.41009277,"To de-clutter the updates view, extensions are now only shown if they require updates","Updated by ""Update PO files to match POT (msgmerge)"" hook in Weblate. Translation: AppCenter/AppCenter (Extra) Translate-URL: https://l10n.elementary.io/projects/appcenter/extra/",0
640,Launchpad automatic translations update.,0.6318955,Updated translations,"Updated by ""Update PO files to match POT (msgmerge)"" hook in Weblate. Translation: AppCenter/AppCenter Translate-URL: https://l10n.elementary.io/projects/appcenter/appcenter/",0
641,Update meson.build,0.7740007,* Meson build system fixes,,1
642,AbstractPackageRowGrid: Rmove changed signal to InstalledPackageRowGrid (#1577),0.4552673,PackageKitBackend: resolve addons in appstream pool by @danirabbit in https://github.com/elementary/appcenter/pull/1946,,0
643,Delete period from '%u Update Available' string,0.39937317,* Present update availability more accurately,,0
644,Release 0.2.9,0.5994441,AppCenter 0.2.2 is out!,,0
645,Spelling: PIN (#487),0.341866,More reliably set the Dock badge number,Currently translated at 58.6% (139 of 237 strings) Translation: AppCenter/AppCenter Translate-URL: https://l10n.elementary.io/projects/appcenter/appcenter/en_CA/,0
646,Backers: John Ferguson → John Urquhart Ferguson,0.3349157,@vjr made their first contribution in https://github.com/elementary/appcenter/pull/1973,Currently translated at 3.3% (8 of 237 strings) Translation: AppCenter/AppCenter Translate-URL: https://l10n.elementary.io/projects/appcenter/appcenter/en_AU/,0
647,Translated using Weblate (Português (Brasil)),0.5977295,- Updated translations,Currently translated at 1.6% (4 of 237 strings) Translation: AppCenter/AppCenter Translate-URL: https://l10n.elementary.io/projects/appcenter/appcenter/af/,0
648,BACKERS.md: Callum → TailRed,0.42729235,Metainfo Improvements by @danirabbit in https://github.com/elementary/appcenter/pull/1972,Currently translated at 100.0% (237 of 237 strings) Translation: AppCenter/AppCenter Translate-URL: https://l10n.elementary.io/projects/appcenter/appcenter/en_GB/,0
649,Release 0.2.4,0.59488344,This release includes several bug fixes,Currently translated at 8.8% (13 of 147 strings) Translation: AppCenter/AppCenter (Extra) Translate-URL: https://l10n.elementary.io/projects/appcenter/extra/fa/,0
650,Various update badge fixes (#1298),0.6711067,This release includes several bug fixes,Currently translated at 42.1% (100 of 237 strings) Translation: AppCenter/AppCenter Translate-URL: https://l10n.elementary.io/projects/appcenter/appcenter/fa/,0
651,AbstractAppContainer: Use source.remove (#981),0.5129806,Prevent unescaped XML entities from appearing in application names,Currently translated at 42.1% (100 of 237 strings) Translation: AppCenter/AppCenter Translate-URL: https://l10n.elementary.io/projects/appcenter/appcenter/fa/,0
652,Update Package.vala (#694),0.6006391,This release includes several bug fixes,Currently translated at 100.0% (147 of 147 strings) Translation: AppCenter/AppCenter (Extra) Translate-URL: https://l10n.elementary.io/projects/appcenter/extra/ja/,0
653,Release 7.2.0 (#1992),0.5175255,This release includes several bug fixes,,0
654,Backers: anon → Daniel Lindenfelser,0.3109929,@vjr made their first contribution in https://github.com/elementary/appcenter/pull/1973,Currently translated at 100.0% (237 of 237 strings) Translation: AppCenter/AppCenter Translate-URL: https://l10n.elementary.io/projects/appcenter/appcenter/ckb/,0
655,Remove 'by' from developer string (#401),0.3430576,Prevent unescaped XML entities from appearing in application names,Currently translated at 42.1% (100 of 237 strings) Translation: AppCenter/AppCenter Translate-URL: https://l10n.elementary.io/projects/appcenter/appcenter/ckb/,0
656,"The FeaturedButton now uses Gtk Widgets to render, lightweight code and handles all the placement logic for us.",0.4977487,Improve styling and contrast of buttons,Currently translated at 97.8% (232 of 237 strings) Translation: AppCenter/AppCenter Translate-URL: https://l10n.elementary.io/projects/appcenter/appcenter/fi/,0
657,AppListUpdateView: Don't re-use cancellable (#1863),0.7371331,AppListUpdateView: Rewrite with ListStore by @danirabbit in https://github.com/elementary/appcenter/pull/1979,Currently translated at 30.8% (73 of 237 strings) Translation: AppCenter/AppCenter Translate-URL: https://l10n.elementary.io/projects/appcenter/appcenter/uz/,1
658,Show restart button and notification,0.8122695,Fix for notification not appearing when a restart is required,Currently translated at 100.0% (237 of 237 strings) Translation: AppCenter/AppCenter Translate-URL: https://l10n.elementary.io/projects/appcenter/appcenter/sk/,1
659,Merge remote-tracking branch 'upstream/master' into usmerge,0.39178765,Support system-wide Flatpak remotes,Currently translated at 97.0% (230 of 237 strings) Translation: AppCenter/AppCenter Translate-URL: https://l10n.elementary.io/projects/appcenter/appcenter/es/,0
660,Translated using Weblate (Albanian),0.54980177,- Updated translations,Currently translated at 87.3% (207 of 237 strings) Translation: AppCenter/AppCenter Translate-URL: https://l10n.elementary.io/projects/appcenter/appcenter/ro/,0
661,Translated using Weblate (Estonian),0.6145413,- Updated translations,Currently translated at 86.0% (204 of 237 strings) Translation: AppCenter/AppCenter Translate-URL: https://l10n.elementary.io/projects/appcenter/appcenter/ro/,0
662,Core: Pass the ChangeInformation object around instead of its callback (#1783),0.4531393,Update application details when changes happen outside of AppCenter,Currently translated at 79.3% (188 of 237 strings) Translation: AppCenter/AppCenter Translate-URL: https://l10n.elementary.io/projects/appcenter/appcenter/zh/,0
663,Backers: binternagel → Eike Binternagel,0.4729853,Pretty output Flatpak package origins by @meisenzahl in https://github.com/elementary/appcenter/pull/1962,Currently translated at 100.0% (237 of 237 strings) Translation: AppCenter/AppCenter Translate-URL: https://l10n.elementary.io/projects/appcenter/appcenter/zh_Hant/,0
664,Run build and install in GitHub CI (#1208),0.57943887,Gettext: install git by @danirabbit in https://github.com/elementary/appcenter/pull/1968,Currently translated at 100.0% (237 of 237 strings) Translation: AppCenter/AppCenter Translate-URL: https://l10n.elementary.io/projects/appcenter/appcenter/zh_Hans/,0
665,Translated using Weblate (gu (generated)),0.59731877,- Updated translations,Currently translated at 100.0% (237 of 237 strings) Translation: AppCenter/AppCenter Translate-URL: https://l10n.elementary.io/projects/appcenter/appcenter/hu/,0
666,Package refactoring (#955),0.5766566,This release includes several bug fixes.,,0
667,AbstractAppContainer: Remove package_author (#1574),0.5223171,PackageKitBackend: resolve addons in appstream pool by @danirabbit in https://github.com/elementary/appcenter/pull/1946,Currently translated at 100.0% (147 of 147 strings) Translation: AppCenter/AppCenter (Extra) Translate-URL: https://l10n.elementary.io/projects/appcenter/extra/ru/,0
668,Don't translate bolded string (#653),0.48446184,* Updated translations,Currently translated at 100.0% (147 of 147 strings) Translation: AppCenter/AppCenter (Extra) Translate-URL: https://l10n.elementary.io/projects/appcenter/extra/ru/,0
669,Show notification when application installed,0.910434,Show in-app notification when an app is installed,Currently translated at 100.0% (237 of 237 strings) Translation: AppCenter/AppCenter Translate-URL: https://l10n.elementary.io/projects/appcenter/appcenter/ru/,1
670,"Turns package IDs from something like: PK_NAME;PK_VERSION;PK_ARCH;OS_VERSION, to something like PK_NAME;PK_VERSION;PK_ARCH;",0.47035325,Correctly display names of Flatpak runtime updates,Currently translated at 100.0% (237 of 237 strings) Translation: AppCenter/AppCenter Translate-URL: https://l10n.elementary.io/projects/appcenter/appcenter/pl/,0
671,AppInfoView: Remove oars_header (#1675),0.5499903,"Gresource: mark OARS icons as scalable, scale all to 32px by @danirabbit in https://github.com/elementary/appcenter/pull/1970",Currently translated at 100.0% (237 of 237 strings) Translation: AppCenter/AppCenter Translate-URL: https://l10n.elementary.io/projects/appcenter/appcenter/ja/,0
672,Core/Client: Adapt to vala 0.40 / PackageKit binding changes (#663),0.51425874,PackageKitBackend: resolve addons in appstream pool by @danirabbit in https://github.com/elementary/appcenter/pull/1946,Currently translated at 100.0% (237 of 237 strings) Translation: AppCenter/AppCenter Translate-URL: https://l10n.elementary.io/projects/appcenter/appcenter/cs/,0
673,Add a manual refresh button to update all caches (#1791),0.6151233,Manually check for new updates,Currently translated at 100.0% (237 of 237 strings) Translation: AppCenter/AppCenter Translate-URL: https://l10n.elementary.io/projects/appcenter/appcenter/he/,0
674,"Revert the gschema being translated, we don't care.",0.44475424,- Updated translations,Currently translated at 100.0% (237 of 237 strings) Translation: AppCenter/AppCenter Translate-URL: https://l10n.elementary.io/projects/appcenter/appcenter/fr/,0
675,only use visible,0.42062953,Ensure flatpak applications show in the category views,Currently translated at 100.0% (237 of 237 strings) Translation: AppCenter/AppCenter Translate-URL: https://l10n.elementary.io/projects/appcenter/appcenter/ca/,0
676,Include dependencies in flatpak download size calculations (#1139),0.6571396,Make download size estimates more accurate,Currently translated at 100.0% (237 of 237 strings) Translation: AppCenter/AppCenter Translate-URL: https://l10n.elementary.io/projects/appcenter/appcenter/de/,0
677,"Revert ""gettext: Set the next version as action runner""",0.4479125,AppListUpdateView: Rewrite with ListStore by @danirabbit in https://github.com/elementary/appcenter/pull/1979,Currently translated at 100.0% (237 of 237 strings) Translation: AppCenter/AppCenter Translate-URL: https://l10n.elementary.io/projects/appcenter/appcenter/tr/,0
678,Merge pull request #48 from pop-os/usmerge,0.4315862,CategoryView: Fix crash by @meisenzahl in https://github.com/elementary/appcenter/pull/1993,Currently translated at 100.0% (237 of 237 strings) Translation: AppCenter/AppCenter Translate-URL: https://l10n.elementary.io/projects/appcenter/appcenter/uk/,0
679,CategoryView: Fix crash (#1993),0.85344267,CategoryView: Fix crash by @meisenzahl in https://github.com/elementary/appcenter/pull/1993,"Updated by ""Update PO files to match POT (msgmerge)"" hook in Weblate. Translation: AppCenter/AppCenter (Extra) Translate-URL: https://l10n.elementary.io/projects/appcenter/extra/",1
680,Backers: anon → Paul Rabin,0.3427511,@vjr made their first contribution in https://github.com/elementary/appcenter/pull/1973,"Updated by ""Update PO files to match POT (msgmerge)"" hook in Weblate. Translation: AppCenter/AppCenter Translate-URL: https://l10n.elementary.io/projects/appcenter/appcenter/",0
681,Center justify Science category (#205),0.57689965,* Add Math to Science category,,0
682,Styles: Add fallbacks for downstreams (#1411),0.585938,Better fallback icons for components,"  Added 'Try for Free' on pay_button label when amount is 0   Regenerate translation files   Revert ""Regenerate translation files""   This reverts commit 13d1ad4b557e996687873d5aa2a388e798ba1bac. Co-authored-by: Cassidy James Blaede c@ssidyjam.es",0
683,The daemon is now fully in-sync with the AppCenter.,0.51519334,Ensure AppCenter is reopened at the correct position,Currently translated at 100.0% (236 of 236 strings) Translation: AppCenter/AppCenter Translate-URL: https://l10n.elementary.io/projects/appcenter/appcenter/ru/,0
684,Application: installfaildialog present,0.58011,Add support for Flatpak apps,Currently translated at 81.6% (120 of 147 strings) Translation: AppCenter/AppCenter (Extra) Translate-URL: https://l10n.elementary.io/projects/appcenter/extra/tr/,0
685,AppListUpdateView: Rewrite with ListStore (#1979),0.8926929,AppListUpdateView: Rewrite with ListStore by @danirabbit in https://github.com/elementary/appcenter/pull/1979,Currently translated at 81.6% (120 of 147 strings) Translation: AppCenter/AppCenter (Extra) Translate-URL: https://l10n.elementary.io/projects/appcenter/extra/tr/,1
686,"New interface, make it more simple.",0.5413884,Show installation progress in a more compact way,Currently translated at 80.9% (119 of 147 strings) Translation: AppCenter/AppCenter (Extra) Translate-URL: https://l10n.elementary.io/projects/appcenter/extra/tr/,0
687,Translated using Weblate (English (Canada)),0.633373,- Updated translations,Currently translated at 100.0% (236 of 236 strings) Translation: AppCenter/AppCenter Translate-URL: https://l10n.elementary.io/projects/appcenter/appcenter/tr/,0
688,Disallow scrolling with mouse wheel on screenshot carousel (#1868),0.615287,"Screenshot carousels fill the width of the window, showing more screenshots at once",Currently translated at 100.0% (236 of 236 strings) Translation: AppCenter/AppCenter Translate-URL: https://l10n.elementary.io/projects/appcenter/appcenter/de/,0
689,Add x-appcenter-color-primary to appdata (#135),0.69613874,Get brand colors from the AppStream standard so more apps are supported,Currently translated at 100.0% (236 of 236 strings) Translation: AppCenter/AppCenter Translate-URL: https://l10n.elementary.io/projects/appcenter/appcenter/hu/,0
690,Translated using Weblate (Norwegian Bokmål),0.58995247,- Updated translations,Currently translated at 100.0% (236 of 236 strings) Translation: AppCenter/AppCenter Translate-URL: https://l10n.elementary.io/projects/appcenter/appcenter/zh_Hans/,0
691,Replace deprecated Component.get_desktop_id (#842),0.54261494,Don't show uninstall buttons for essential system components,Currently translated at 100.0% (236 of 236 strings) Translation: AppCenter/AppCenter Translate-URL: https://l10n.elementary.io/projects/appcenter/appcenter/nl/,0
692,New version of upstream,0.40766054,New features,Currently translated at 100.0% (236 of 236 strings) Translation: AppCenter/AppCenter Translate-URL: https://l10n.elementary.io/projects/appcenter/appcenter/nl/,0
693,Provide a custom error message from stripe (#282),0.41527078,StripeDialog: Add translator comment by @davidmhewitt in https://github.com/elementary/appcenter/pull/2009,Currently translated at 81.7% (193 of 236 strings) Translation: AppCenter/AppCenter Translate-URL: https://l10n.elementary.io/projects/appcenter/appcenter/nl/,0
694,Update screenshots (#767),0.59000975,Show screenshot captions in a tooltip,Currently translated at 81.7% (193 of 236 strings) Translation: AppCenter/AppCenter Translate-URL: https://l10n.elementary.io/projects/appcenter/appcenter/nl/,0
695,Delay cache update after network up and do not force,0.52267444,Prevent potential crashes when updating,Currently translated at 81.7% (193 of 236 strings) Translation: AppCenter/AppCenter Translate-URL: https://l10n.elementary.io/projects/appcenter/appcenter/nl/,0
696,PackageKitBackend: only refresh PK cache on changes (#1271),0.63597727,Fix Flatpak runtime updates getting stuck,Currently translated at 97.8% (231 of 236 strings) Translation: AppCenter/AppCenter Translate-URL: https://l10n.elementary.io/projects/appcenter/appcenter/fi/,0
697,Translated using Weblate (Marathi),0.65412027,- Updated translations,Currently translated at 100.0% (147 of 147 strings) Translation: AppCenter/AppCenter (Extra) Translate-URL: https://l10n.elementary.io/projects/appcenter/extra/ca/,0
698,Add Music to Audio category (#754),0.3510037,Recently updated apps are shown at the top of category views,Currently translated at 100.0% (236 of 236 strings) Translation: AppCenter/AppCenter Translate-URL: https://l10n.elementary.io/projects/appcenter/appcenter/ca/,0
699,Homepage: remove unuseed page_loaded (#1843),0.5944123,Don't show plugins on the homepage,Currently translated at 100.0% (147 of 147 strings) Translation: AppCenter/AppCenter (Extra) Translate-URL: https://l10n.elementary.io/projects/appcenter/extra/pl/,0
700,Merge changes from part1 and resolve conflicts; remove whitespace.,0.4768639,Fix long origin comboboxes breaking the header layout,Currently translated at 100.0% (147 of 147 strings) Translation: AppCenter/AppCenter (Extra) Translate-URL: https://l10n.elementary.io/projects/appcenter/extra/cs/,0
701,AppInfoView.vala: code style and simplify (#339),0.57802707,App Info Page Improvements:,Currently translated at 100.0% (236 of 236 strings) Translation: AppCenter/AppCenter Translate-URL: https://l10n.elementary.io/projects/appcenter/appcenter/pl/,0
702,Show category name in header for category list view,0.58675665,Categories show as a grid instead of a list,Currently translated at 100.0% (236 of 236 strings) Translation: AppCenter/AppCenter Translate-URL: https://l10n.elementary.io/projects/appcenter/appcenter/cs/,0
703,fix Lern typo,0.4143367,Fix some layout issues,Currently translated at 100.0% (236 of 236 strings) Translation: AppCenter/AppCenter Translate-URL: https://l10n.elementary.io/projects/appcenter/appcenter/de/,0
704,Redirect the input to the search entry.,0.6767006,Pressing down in the search field moves the keyboard focus to the search results list,Currently translated at 100.0% (236 of 236 strings) Translation: AppCenter/AppCenter Translate-URL: https://l10n.elementary.io/projects/appcenter/appcenter/ja/,0
705,Merge changes from trunk r288,0.37152174,Full Changelog: https://github.com/elementary/appcenter/compare/3.8.1...3.8.2,Currently translated at 100.0% (147 of 147 strings) Translation: AppCenter/AppCenter (Extra) Translate-URL: https://l10n.elementary.io/projects/appcenter/extra/fr/,0
706,AppInfoView: right-align footer links (#348),0.59777963,Wrap links at the bottom pages instead of ellipsize,Currently translated at 100.0% (236 of 236 strings) Translation: AppCenter/AppCenter Translate-URL: https://l10n.elementary.io/projects/appcenter/appcenter/fr/,0
707,Hide/show card number on focus (#639),0.5277101,"Redesigned ""Fun & Games"" category card",Currently translated at 100.0% (147 of 147 strings) Translation: AppCenter/AppCenter (Extra) Translate-URL: https://l10n.elementary.io/projects/appcenter/extra/he/,0
708,update appdata.xml,0.59447944,App Info Page Improvements:,Currently translated at 95.3% (225 of 236 strings) Translation: AppCenter/AppCenter Translate-URL: https://l10n.elementary.io/projects/appcenter/appcenter/nb/,0
709,Added support for Intltool.,0.47777158,New features,Currently translated at 100.0% (236 of 236 strings) Translation: AppCenter/AppCenter Translate-URL: https://l10n.elementary.io/projects/appcenter/appcenter/he/,0
710,Don't send notifications when installation is canceled,0.6293467,Fix for notification not appearing when a restart is required,Currently translated at 98.7% (233 of 236 strings) Translation: AppCenter/AppCenter Translate-URL: https://l10n.elementary.io/projects/appcenter/appcenter/de/,0
711,Appdata: Add release info for 3.2.0 (#1108),0.6549382,appcenter 3.2.0 is out! ,Currently translated at 100.0% (147 of 147 strings) Translation: AppCenter/AppCenter (Extra) Translate-URL: https://l10n.elementary.io/projects/appcenter/extra/ja/,0
712,StripeDialog: Add email to Houston post data,0.41864452,Add contextual badges to notifications,Currently translated at 100.0% (147 of 147 strings) Translation: AppCenter/AppCenter (Extra) Translate-URL: https://l10n.elementary.io/projects/appcenter/extra/uk/,0
713,Move the banner left and right (#287),0.60966134,- Navigate banners on the home page with multitouch gestures,Currently translated at 100.0% (236 of 236 strings) Translation: AppCenter/AppCenter Translate-URL: https://l10n.elementary.io/projects/appcenter/appcenter/uk/,0
714,AppListRow: Remove unused has_package (#1328),0.55269355,AppListUpdateView: Rewrite with ListStore by @danirabbit in https://github.com/elementary/appcenter/pull/1979,"Updated by ""Update PO files to match POT (msgmerge)"" hook in Weblate. Translation: AppCenter/AppCenter (Extra) Translate-URL: https://l10n.elementary.io/projects/appcenter/extra/",0
715,Translated using Weblate (Czech),0.63529897,- Updated translations,"Updated by ""Update PO files to match POT (msgmerge)"" hook in Weblate. Translation: AppCenter/AppCenter Translate-URL: https://l10n.elementary.io/projects/appcenter/appcenter/",0
716,Fix get_style_valist crashes (#380),0.51268977,Fix crashes,,0
717,UbuntuDrivers: Also install related kernel modules (#1581),0.69611996,Install Linux kernel headers for device drivers that use DKMS,,0
718,AppListUpdateView: move list population from InstalledView to here (#1860),0.631258,AppListUpdateView: Rewrite with ListStore by @danirabbit in https://github.com/elementary/appcenter/pull/1979,,0
719,Fix po/CMakeLists.txt,0.46665213,CategoryView: Fix crash by @meisenzahl in https://github.com/elementary/appcenter/pull/1993,Currently translated at 100.0% (146 of 146 strings) Translation: AppCenter/AppCenter (Extra) Translate-URL: https://l10n.elementary.io/projects/appcenter/extra/cs/,0
720,Don't add the screenshot box if there are no screenshots (#237),0.657256,Show screenshot captions in a tooltip,Currently translated at 80.8% (118 of 146 strings) Translation: AppCenter/AppCenter (Extra) Translate-URL: https://l10n.elementary.io/projects/appcenter/extra/tr/,0
721,Banner: Transition all CSS properties (#209),0.49103454,- Navigate banners on the home page with multitouch gestures,Currently translated at 100.0% (231 of 231 strings) Translation: AppCenter/AppCenter Translate-URL: https://l10n.elementary.io/projects/appcenter/appcenter/id/,0
722,"Fix typo in ""performance"" word (#707)",0.50471246,Performance improvments,Currently translated at 100.0% (231 of 231 strings) Translation: AppCenter/AppCenter Translate-URL: https://l10n.elementary.io/projects/appcenter/appcenter/cs/,0
723,Add gnome-shell search provider (#531),0.4933039,Fix some apps incorrectly showing as not installed during search,Currently translated at 100.0% (231 of 231 strings) Translation: AppCenter/AppCenter Translate-URL: https://l10n.elementary.io/projects/appcenter/appcenter/tr/,0
724,Further code clean up,0.4629756,Minor fixes,Currently translated at 100.0% (146 of 146 strings) Translation: AppCenter/AppCenter (Extra) Translate-URL: https://l10n.elementary.io/projects/appcenter/extra/cs/,0
725,Show current job type in overlaybar (#1919),0.64242303,A status overlay bar is now shown when tasks are in progress,Currently translated at 100.0% (231 of 231 strings) Translation: AppCenter/AppCenter Translate-URL: https://l10n.elementary.io/projects/appcenter/appcenter/cs/,0
726,Homepage: Disallow plugins in banner and carousel (#1711),0.77250016,Don't show plugins on the homepage,Currently translated at 90.9% (210 of 231 strings) Translation: AppCenter/AppCenter Translate-URL: https://l10n.elementary.io/projects/appcenter/appcenter/cs/,1
727,don't overly abstract (#123),0.48612365,More concise and consistent language,Currently translated at 21.2% (31 of 146 strings) Translation: AppCenter/AppCenter (Extra) Translate-URL: https://l10n.elementary.io/projects/appcenter/extra/hu/,0
728,Homepage: remove dead currently_viewed_category (#1876),0.46191955,Fix crash activating category while checking for updates by @vjr in https://github.com/elementary/appcenter/pull/1973,Currently translated at 100.0% (231 of 231 strings) Translation: AppCenter/AppCenter Translate-URL: https://l10n.elementary.io/projects/appcenter/appcenter/hu/,0
729,Update AppListView to display ElementaryOS apps as curated apps (#355),0.6700938,Recently updated apps are shown at the top of category views,Currently translated at 68.4% (100 of 146 strings) Translation: AppCenter/AppCenter (Extra) Translate-URL: https://l10n.elementary.io/projects/appcenter/extra/cs/,0
