Index,Commit Message,Score,Correspond Changelog Sentence,Commit Description,Label
920,appdata: update bug tracker URL (#363),0.58539987,Show warnings when an app may not be localized by @danirabbit in https://github.com/elementary/appcenter/pull/1975," fix(AppInfoView): Change app description to Gtk.Label  This was originally a Gtk.Label in the very beginning, but early on was changed to be a Gtk.TextView in e37fc748b4693d64d48a119f532e181eb3dfd3c7 While working on changes to make AppCenter function at narrow window widths, I noticed that some applications (Notably Veloren in Flathub) had description widgets that prevented the window from shrinking below a minimum width which was very wide and unsuitable for narrow windows. Changing the App description to a label seems to prevent this, however, I was unsure of the original reasons for the change to a TextView   fix(style): minor code style fix   Update AppData with fix description.   Update src/Views/AppInfoView.vala   Updates based on feedback in PR Co-authored-by: Cassidy James Blaede cassidy@elementary.io  Update src/Views/AppInfoView.vala  Set description text property directly instead of using setter Co-authored-by: Cassidy James Blaede cassidy@elementary.io   Set correct property for label text   fix: remove extra git file   Co-authored-by: Cassidy James Blaede cassidy@elementary.io",0
921,Release 0.2.1,0.599682,AppCenter 0.2.2 is out!,Currently translated at 100.0% (138 of 138 strings) Translation: AppCenter/AppCenter (Extra) Translate-URL: https://l10n.elementary.io/projects/appcenter/extra/en_GB/,0
922,Do not show uninstall button for OS updates,0.7352085,Don't show uninstall buttons for essential system components,Currently translated at 21.0% (29 of 138 strings) Translation: AppCenter/AppCenter (Extra) Translate-URL: https://l10n.elementary.io/projects/appcenter/extra/zh_Hans/,1
923,Translated using Weblate (Portuguese (Brazil)),0.59190214,- Updated translations,Currently translated at 100.0% (225 of 225 strings) Translation: AppCenter/AppCenter Translate-URL: https://l10n.elementary.io/projects/appcenter/appcenter/zh_Hans/,0
924,Remove maximum size restriction (#371),0.57096463,Allow window to shrink to much narrower sizes,Currently translated at 100.0% (138 of 138 strings) Translation: AppCenter/AppCenter (Extra) Translate-URL: https://l10n.elementary.io/projects/appcenter/extra/ca/,0
925,"Use dbus to reboot via GNOME, if possible (#819)",0.5033567,Ask the user to manually restart if we can't ask the session to prompt,Currently translated at 100.0% (138 of 138 strings) Translation: AppCenter/AppCenter (Extra) Translate-URL: https://l10n.elementary.io/projects/appcenter/extra/ja/,0
926,Release 3.7.1 (#1639),0.54998004,appcenter 3.2.3 is out! ,Currently translated at 100.0% (138 of 138 strings) Translation: AppCenter/AppCenter (Extra) Translate-URL: https://l10n.elementary.io/projects/appcenter/extra/uk/,0
927,Stop action button moving (Fixes #836) (#862),0.7570156,* Prevent action buttons from jumping around,,1
928,AppInfoView: Fix layout for overly wide origin combobox (#1417),0.72705203,Fix long origin comboboxes breaking the header layout,Currently translated at 97.1% (134 of 138 strings) Translation: AppCenter/AppCenter (Extra) Translate-URL: https://l10n.elementary.io/projects/appcenter/extra/ru/,1
929,Remove a duplicated line (#589),0.39679942,Fix long origin comboboxes breaking the header layout, FlatpakBackend: Improve XML parsing efficiency  Potential minor efficiency follow up to #1731,0
930,gettext: Set the next version as action runner,0.4441103,Gettext: install git by @danirabbit in https://github.com/elementary/appcenter/pull/1968,Currently translated at 100.0% (138 of 138 strings) Translation: AppCenter/AppCenter (Extra) Translate-URL: https://l10n.elementary.io/projects/appcenter/extra/he/,0
931,Update translation files,0.8622108,Updated translations,Currently translated at 100.0% (138 of 138 strings) Translation: AppCenter/AppCenter (Extra) Translate-URL: https://l10n.elementary.io/projects/appcenter/extra/fr/,1
932,Remove unneded code,0.472874,Prevent unescaped XML entities from appearing in application names,Currently translated at 100.0% (138 of 138 strings) Translation: AppCenter/AppCenter (Extra) Translate-URL: https://l10n.elementary.io/projects/appcenter/extra/tr/,0
933,Add command line option to fake updates (#434),0.5585613,Manually check for new updates,"Updated by ""Update PO files to match POT (msgmerge)"" hook in Weblate. Translation: AppCenter/AppCenter (Extra) Translate-URL: https://l10n.elementary.io/projects/appcenter/extra/",0
934,Prevent the daemon refreshing on every startup (#1272),0.6182866,Fix for notification not appearing when a restart is required,"Updated by ""Update PO files to match POT (msgmerge)"" hook in Weblate. Translation: AppCenter/AppCenter Translate-URL: https://l10n.elementary.io/projects/appcenter/appcenter/",0
935,Don't show share popover for OS updates (#373),0.60344684,Show Operating System Updates and Runtime Updates only if available by @meisenzahl in https://github.com/elementary/appcenter/pull/1960,,0
936,l10n: Correctly setup the locales (#1586),0.40724263,- Populate banner on home locally instead of relying on an external API,  FlatpakBackend: Sort stable apps in XML first   Update appdata ,0
937,Add polkit action to allow updates without admin prompt (#1305),0.6035696,Fix for notification not appearing when a restart is required,,0
938,Release 3.2.0 (#1110),0.6226618,appcenter 3.2.0 is out! ,  Release 3.8.1   Update meson.build   Co-authored-by: Cassidy James Blaede cassidy@elementary.io,0
939,Revamp Office CSS (#905),0.50497746,Improve update badge styling and category styling,We are checking the type in the previous condition. Silence the possible null.,0
940,Translated using Weblate (Uzbek),0.62234646,- Updated translations,Currently translated at 100.0% (137 of 137 strings) Translation: AppCenter/AppCenter (Extra) Translate-URL: https://l10n.elementary.io/projects/appcenter/extra/en_GB/,0
941,Fix a typo: improvments --> improvements (#1377),0.5526508,Minor fixes,Currently translated at 100.0% (137 of 137 strings) Translation: AppCenter/AppCenter (Extra) Translate-URL: https://l10n.elementary.io/projects/appcenter/extra/ja/,0
942,meson: explicit the filenames replacement as meson has issues with automagic,0.50063723,* Meson build system fixes,Currently translated at 100.0% (225 of 225 strings) Translation: AppCenter/AppCenter Translate-URL: https://l10n.elementary.io/projects/appcenter/appcenter/ja/,0
943,Pack the screenshot into a revealer.,0.6678752,Animate screenshot background while loading,Currently translated at 100.0% (137 of 137 strings) Translation: AppCenter/AppCenter (Extra) Translate-URL: https://l10n.elementary.io/projects/appcenter/extra/fr/,0
944,CategoryFlowBox: Refactor category making (#189),0.6351859,* Category graphics revamped,Currently translated at 100.0% (137 of 137 strings) Translation: AppCenter/AppCenter (Extra) Translate-URL: https://l10n.elementary.io/projects/appcenter/extra/ca/,0
945,Banner: reduce method scope (#1619),0.48228034,Wrap links at the bottom pages instead of ellipsize,Currently translated at 100.0% (137 of 137 strings) Translation: AppCenter/AppCenter (Extra) Translate-URL: https://l10n.elementary.io/projects/appcenter/extra/he/,0
946,New optional libunity support.,0.37641263,New features,Currently translated at 100.0% (137 of 137 strings) Translation: AppCenter/AppCenter (Extra) Translate-URL: https://l10n.elementary.io/projects/appcenter/extra/tr/,0
947,Fix CI (#1937),0.5264053,Minor fixes,Currently translated at 100.0% (137 of 137 strings) Translation: AppCenter/AppCenter (Extra) Translate-URL: https://l10n.elementary.io/projects/appcenter/extra/uk/,0
948,Clean up AbstractAppList and AppListView (#418),0.6254421,AppListUpdateView: Rewrite with ListStore by @danirabbit in https://github.com/elementary/appcenter/pull/1979,"Updated by ""Update PO files to match POT (msgmerge)"" hook in Weblate. Translation: AppCenter/AppCenter (Extra) Translate-URL: https://l10n.elementary.io/projects/appcenter/extra/",0
949,Fixed translation credits.,0.70785,* Updated translations,"Updated by ""Update PO files to match POT (msgmerge)"" hook in Weblate. Translation: AppCenter/AppCenter Translate-URL: https://l10n.elementary.io/projects/appcenter/appcenter/",1
950,Cache list of Ubuntu driver packages (#1007),0.6011181,Install Linux kernel headers with NVIDIA drivers,,0
951,Add ISSUE_TEMPLATE.md,0.46852636,StripeDialog: Add translator comment by @davidmhewitt in https://github.com/elementary/appcenter/pull/2009,,0
952,FlatpakBackend: Improve XML parsing efficiency (#1733),0.90447843,FlatpakBackend: Improve XML parsing efficiency by @davidmhewitt in https://github.com/elementary/appcenter/pull/1733,Currently translated at 100.0% (133 of 133 strings) Translation: AppCenter/AppCenter (Extra) Translate-URL: https://l10n.elementary.io/projects/appcenter/extra/fr/,1
953,Only call update on backends which have updates available (#1129),0.5944585,Show Operating System Updates and Runtime Updates only if available by @meisenzahl in https://github.com/elementary/appcenter/pull/1960,Currently translated at 100.0% (225 of 225 strings) Translation: AppCenter/AppCenter Translate-URL: https://l10n.elementary.io/projects/appcenter/appcenter/es/,0
954,make categories not static,0.6012517,Categories show as a grid instead of a list,Currently translated at 100.0% (133 of 133 strings) Translation: AppCenter/AppCenter (Extra) Translate-URL: https://l10n.elementary.io/projects/appcenter/extra/tr/,0
955,AppInfoView: Make screenshot carousel full page width (#1572),0.68982,"Screenshot carousels fill the width of the window, showing more screenshots at once",Currently translated at 88.8% (200 of 225 strings) Translation: AppCenter/AppCenter Translate-URL: https://l10n.elementary.io/projects/appcenter/appcenter/es/,0
956,Refresh screenshots (#814),0.6256565,"Screenshot carousels fill the width of the window, showing more screenshots at once",Currently translated at 100.0% (133 of 133 strings) Translation: AppCenter/AppCenter (Extra) Translate-URL: https://l10n.elementary.io/projects/appcenter/extra/ru/,0
957,Use symbolic find icon in no apps found view,0.5865725,Fix some apps incorrectly showing as not installed during search,Currently translated at 100.0% (225 of 225 strings) Translation: AppCenter/AppCenter Translate-URL: https://l10n.elementary.io/projects/appcenter/appcenter/sk/,0
958,Add Flatpak support (#971),0.81192255,Add support for Flatpak apps,Currently translated at 100.0% (133 of 133 strings) Translation: AppCenter/AppCenter (Extra) Translate-URL: https://l10n.elementary.io/projects/appcenter/extra/ja/,1
959,AbstractAppContainer: Remove progress_grid (#1854),0.4723579,AppListUpdateView: Rewrite with ListStore by @danirabbit in https://github.com/elementary/appcenter/pull/1979,Currently translated at 19.5% (26 of 133 strings) Translation: AppCenter/AppCenter (Extra) Translate-URL: https://l10n.elementary.io/projects/appcenter/extra/fi/,0
960,Move Deck to MainWindow (#1882),0.46125492,* Improve window state restoration,,0
961,Release 3.2.4 (#1256),0.5879656,This release includes several bug fixes,,0
962,AppInfoView: Fix layout for OS updates (#1043),0.65596956,App Info Page Improvements:,,0
963,Translated using Weblate (Welsh),0.62598246,- Updated translations,,0
964,Use the cmake-elementary package.,0.4455089,Install PackageKit based Operating System Updates as Offline Updates by @meisenzahl in https://github.com/elementary/appcenter/pull/1943,,0
965,AppListUpdateView: Fix typo in package row compare (#1917),0.61789125,AppListUpdateView: Rewrite with ListStore by @danirabbit in https://github.com/elementary/appcenter/pull/1979,Currently translated at 100.0% (133 of 133 strings) Translation: AppCenter/AppCenter (Extra) Translate-URL: https://l10n.elementary.io/projects/appcenter/extra/ca/,0
966,Add a margin for mode button to draw box shadow (#177),0.571398,Improve styling and contrast of buttons,Currently translated at 100.0% (133 of 133 strings) Translation: AppCenter/AppCenter (Extra) Translate-URL: https://l10n.elementary.io/projects/appcenter/extra/he/,0
967,Add missing languages to LINGUAS files (#868),0.5763444,Many fixed and updated translations,Currently translated at 100.0% (133 of 133 strings) Translation: AppCenter/AppCenter (Extra) Translate-URL: https://l10n.elementary.io/projects/appcenter/extra/uk/,0
968,Perform flatpak uninstalls with a transaction (#1460),0.7185907,"Fully uninstall Flatpaks, including locales","Updated by ""Update PO files to match POT (msgmerge)"" hook in Weblate. Translation: AppCenter/AppCenter (Extra) Translate-URL: https://l10n.elementary.io/projects/appcenter/extra/",1
969,"Changes ""Updates"" tab to ""Installed"" (#638)",0.62034297,Updates View Improvements:,"Updated by ""Update PO files to match POT (msgmerge)"" hook in Weblate. Translation: AppCenter/AppCenter Translate-URL: https://l10n.elementary.io/projects/appcenter/appcenter/",0
970,"Revert ""Merge branch 'master' into master""",0.30248874,* Updated translations,,0
971,AppInfoView: make project license a link (#357),0.50192475,Properly display proprietary licenses,,0
972,Use theme variables when it makes sense (#922),0.43553597,More concise and consistent language,,0
973,Delete .travis.yml,0.4652513,"Fully uninstall Flatpaks, including locales",Currently translated at 100.0% (225 of 225 strings) Translation: AppCenter/AppCenter Translate-URL: https://l10n.elementary.io/projects/appcenter/appcenter/de/,0
974,AppData: Update release notes (#1551),0.6338093,App Info Page Improvements:,Currently translated at 100.0% (225 of 225 strings) Translation: AppCenter/AppCenter Translate-URL: https://l10n.elementary.io/projects/appcenter/appcenter/pl/,0
975,Add title to StripeDialog (#803),0.51308346,Improve update badge styling and category styling,Currently translated at 100.0% (225 of 225 strings) Translation: AppCenter/AppCenter Translate-URL: https://l10n.elementary.io/projects/appcenter/appcenter/pl/,0
976,Revert r291,0.3672229,Fix crash activating category while checking for updates by @vjr in https://github.com/elementary/appcenter/pull/1973,Currently translated at 100.0% (225 of 225 strings) Translation: AppCenter/AppCenter Translate-URL: https://l10n.elementary.io/projects/appcenter/appcenter/pl/,0
977,Workaround PackageKit issue to fix restart notification (#1130),0.78208184,Fix for notification not appearing when a restart is required,Currently translated at 100.0% (225 of 225 strings) Translation: AppCenter/AppCenter Translate-URL: https://l10n.elementary.io/projects/appcenter/appcenter/pl/,1
978,Add privacy info (#273),0.5411802,Fix missing privacy policy in payments dialog,Currently translated at 82.2% (185 of 225 strings) Translation: AppCenter/AppCenter Translate-URL: https://l10n.elementary.io/projects/appcenter/appcenter/pl/,0
979,Animate screenshot background while loading (#1051),0.9364073,Animate screenshot background while loading,Currently translated at 82.2% (185 of 225 strings) Translation: AppCenter/AppCenter Translate-URL: https://l10n.elementary.io/projects/appcenter/appcenter/pl/,1
980,Gresource symbolic mail icon (#1561),0.6346886,Fix missing mail icon in payments dialog,Currently translated at 82.2% (185 of 225 strings) Translation: AppCenter/AppCenter Translate-URL: https://l10n.elementary.io/projects/appcenter/appcenter/pl/,0
981,Non-curated warning (#1105),0.57734483, - Show content warnings on app info pages,Currently translated at 81.3% (183 of 225 strings) Translation: AppCenter/AppCenter Translate-URL: https://l10n.elementary.io/projects/appcenter/appcenter/pl/,0
982,Show Operating System Updates and Runtime Updates only if available (#1960),0.83256674,Show Operating System Updates and Runtime Updates only if available by @meisenzahl in https://github.com/elementary/appcenter/pull/1960,Currently translated at 81.3% (183 of 225 strings) Translation: AppCenter/AppCenter Translate-URL: https://l10n.elementary.io/projects/appcenter/appcenter/pl/,1
983,Add Publishing to Office category (#569),0.4177091,Properly display proprietary licenses,Currently translated at 81.3% (183 of 225 strings) Translation: AppCenter/AppCenter Translate-URL: https://l10n.elementary.io/projects/appcenter/appcenter/pl/,0
984,use correct icon name for share (#343),0.47637612,Fix twitter share URLs,Currently translated at 75.1% (169 of 225 strings) Translation: AppCenter/AppCenter Translate-URL: https://l10n.elementary.io/projects/appcenter/appcenter/pl/,0
985,CategoryView: change append to add_package (#1908),0.57947123,* Category graphics revamped,Currently translated at 75.1% (169 of 225 strings) Translation: AppCenter/AppCenter Translate-URL: https://l10n.elementary.io/projects/appcenter/appcenter/pl/,0
986,enforce package row icon size for hidpi,0.47628677,Ensure flatpak applications show in the category views,Currently translated at 98.2% (221 of 225 strings) Translation: AppCenter/AppCenter Translate-URL: https://l10n.elementary.io/projects/appcenter/appcenter/nb/,0
987,Release 3.1.1,0.6221974,AppCenter 3.1.0 is out!,Currently translated at 100.0% (132 of 132 strings) Translation: AppCenter/AppCenter (Extra) Translate-URL: https://l10n.elementary.io/projects/appcenter/extra/ru/,0
988,AbstractAppList: Remove list.add connect (#1909),0.56393236,AppListUpdateView: Rewrite with ListStore by @danirabbit in https://github.com/elementary/appcenter/pull/1979,Currently translated at 100.0% (132 of 132 strings) Translation: AppCenter/AppCenter (Extra) Translate-URL: https://l10n.elementary.io/projects/appcenter/extra/de/,0
989,Use icons from the theme when available,0.6514149,Swap the main and overlay icons for extensions to more clearly associate extensions with their app,Currently translated at 100.0% (132 of 132 strings) Translation: AppCenter/AppCenter (Extra) Translate-URL: https://l10n.elementary.io/projects/appcenter/extra/en_GB/,0
990,Core: Reduce the memory footprint and avoid unnecessary reference increase (#1768),0.68785775,* Memory management refinements,Currently translated at 100.0% (225 of 225 strings) Translation: AppCenter/AppCenter Translate-URL: https://l10n.elementary.io/projects/appcenter/appcenter/en_GB/,0
991,Alphabetize categories (#887),0.52935874,Categories show as a grid instead of a list,Currently translated at 100.0% (132 of 132 strings) Translation: AppCenter/AppCenter (Extra) Translate-URL: https://l10n.elementary.io/projects/appcenter/extra/ca/,0
992,Translated using Weblate (Afrikaans),0.6512269,- Updated translations,Currently translated at 100.0% (132 of 132 strings) Translation: AppCenter/AppCenter (Extra) Translate-URL: https://l10n.elementary.io/projects/appcenter/extra/tr/,0
993,Track paid-for applications in GSettings (#559),0.58379316,* Remove reset paid apps gsettings key,Currently translated at 100.0% (225 of 225 strings) Translation: AppCenter/AppCenter Translate-URL: https://l10n.elementary.io/projects/appcenter/appcenter/fr/,0
994,Release 0.1,0.5845587,This release includes several bug fixes,Currently translated at 97.7% (220 of 225 strings) Translation: AppCenter/AppCenter Translate-URL: https://l10n.elementary.io/projects/appcenter/appcenter/fr/,0
995,Update default banner to new brand purple (#827),0.57726014,Improve update badge styling and category styling,Currently translated at 97.7% (220 of 225 strings) Translation: AppCenter/AppCenter Translate-URL: https://l10n.elementary.io/projects/appcenter/appcenter/fr/,0
996,Gtk.Dialog → Granite.Dialog (#1481),0.45138222,StripeDialog: Add translator comment by @davidmhewitt in https://github.com/elementary/appcenter/pull/2009,Currently translated at 90.6% (204 of 225 strings) Translation: AppCenter/AppCenter Translate-URL: https://l10n.elementary.io/projects/appcenter/appcenter/fr/,0
997,Fixup package origins for focal (#1565),0.56479686,This release includes several bug fixes,Currently translated at 90.6% (204 of 225 strings) Translation: AppCenter/AppCenter Translate-URL: https://l10n.elementary.io/projects/appcenter/appcenter/fr/,0
998,Application: use active_window (#1903),0.505792,Show an error dialog when opening an app fails,Currently translated at 89.7% (202 of 225 strings) Translation: AppCenter/AppCenter Translate-URL: https://l10n.elementary.io/projects/appcenter/appcenter/fr/,0
999,"Added a ""Search All Apps"" button",0.6414646,Recently updated apps are shown at the top of category views,Currently translated at 100.0% (132 of 132 strings) Translation: AppCenter/AppCenter (Extra) Translate-URL: https://l10n.elementary.io/projects/appcenter/extra/he/,0
1000,Translated using Weblate (Spanish),0.64112675,- Updated translations,Currently translated at 100.0% (132 of 132 strings) Translation: AppCenter/AppCenter (Extra) Translate-URL: https://l10n.elementary.io/projects/appcenter/extra/ja/,0
1001,ScreenshotCache: don't bail if modified time is null (#1539),0.49773213,Only check for updates at device startup if it's more than 24 hours since we last checked,Currently translated at 100.0% (132 of 132 strings) Translation: AppCenter/AppCenter (Extra) Translate-URL: https://l10n.elementary.io/projects/appcenter/extra/uk/,0
1002,Add app info header to scrolled box (#309),0.62180686,App Info Page Improvements:,"Updated by ""Update PO files to match POT (msgmerge)"" hook in Weblate. Translation: AppCenter/AppCenter (Extra) Translate-URL: https://l10n.elementary.io/projects/appcenter/extra/",0
1003,"Always show ""Search Apps"" button",0.6608912,Fix some apps incorrectly showing as not installed during search,"Updated by ""Update PO files to match POT (msgmerge)"" hook in Weblate. Translation: AppCenter/AppCenter Translate-URL: https://l10n.elementary.io/projects/appcenter/appcenter/",0
1004,Fix deprecations for AppStream 0.16 (#2015),0.62077975,PackageKitBackend: resolve addons in appstream pool by @danirabbit in https://github.com/elementary/appcenter/pull/1946,Currently translated at 79.2% (103 of 130 strings) Translation: AppCenter/AppCenter (Extra) Translate-URL: https://l10n.elementary.io/projects/appcenter/extra/es/,0
1005,Add info icon and tooltip for download size (#1037),0.59691596,Size information for Runtime Updates by @meisenzahl in https://github.com/elementary/appcenter/pull/1957,Currently translated at 88.0% (198 of 225 strings) Translation: AppCenter/AppCenter Translate-URL: https://l10n.elementary.io/projects/appcenter/appcenter/es/,0
1006,"Spelling: ""reddit"" → ""Reddit"" (#718)",0.36608306,StripeDialog: Add translator comment by @davidmhewitt in https://github.com/elementary/appcenter/pull/2009,,0
1007,AppData: Update release info,0.67210394,App Info Page Improvements:,"  AppData: More details, bump to 3.8   Update meson.build   Update io.elementary.appcenter.appdata.xml.in   Co-authored-by: Danielle Foré daniel@elementary.io",0
1008,Don't provide the Gtk+3.0 vapi for a simple binding issue.,0.44248372,Don't show plugins on the homepage,,0
1009,MainWindow: use system badge styles (#1630),0.5865953,Improve update badge styling and category styling,Currently translated at 89.3% (201 of 225 strings) Translation: AppCenter/AppCenter Translate-URL: https://l10n.elementary.io/projects/appcenter/appcenter/ro/,0
1010,center and width_request app info view,0.6043913,Ellipsize long app names in App Info views,Currently translated at 100.0% (225 of 225 strings) Translation: AppCenter/AppCenter Translate-URL: https://l10n.elementary.io/projects/appcenter/appcenter/uk/,0
1011,Use string.length rather than string.len (#534),0.36494517,Ellipsize long app names in App Info views,Currently translated at 100.0% (225 of 225 strings) Translation: AppCenter/AppCenter Translate-URL: https://l10n.elementary.io/projects/appcenter/appcenter/uk/,0
1012,Make Package-Finding Operations Async (#805),0.47753626,Make loading updates async from main AppCenter window by @meisenzahl in https://github.com/elementary/appcenter/pull/1964,,0
1013,Houston.vala: combine houston API endpoint calls (#336),0.34165692,- Populate banner on home locally instead of relying on an external API,Currently translated at 100.0% (225 of 225 strings) Translation: AppCenter/AppCenter Translate-URL: https://l10n.elementary.io/projects/appcenter/appcenter/ru/,0
1014,Release 0.2.6,0.60272294,AppCenter 0.2.6 is out!,Currently translated at 98.6% (222 of 225 strings) Translation: AppCenter/AppCenter Translate-URL: https://l10n.elementary.io/projects/appcenter/appcenter/ru/,0
1015,Add package information to OS Updates details (#518),0.6042321,Show Operating System Updates and Runtime Updates only if available by @meisenzahl in https://github.com/elementary/appcenter/pull/1960,Currently translated at 100.0% (225 of 225 strings) Translation: AppCenter/AppCenter Translate-URL: https://l10n.elementary.io/projects/appcenter/appcenter/tr/,0
1016,Finance category (#889),0.5105598,"* New categories: Communication, Finance, Media Production",Currently translated at 100.0% (130 of 130 strings) Translation: AppCenter/AppCenter (Extra) Translate-URL: https://l10n.elementary.io/projects/appcenter/extra/ru/,0
1017,AbstractAppContainer: Fix missing uninstall button margin (#1040),0.5723873,Don't show uninstall buttons for essential system components,Currently translated at 89.3% (201 of 225 strings) Translation: AppCenter/AppCenter Translate-URL: https://l10n.elementary.io/projects/appcenter/appcenter/ru/,0
1018,Translated using Weblate (Ukrainian),0.6209825,- Updated translations,Currently translated at 98.2% (221 of 225 strings) Translation: AppCenter/AppCenter Translate-URL: https://l10n.elementary.io/projects/appcenter/appcenter/tr/,0
1019,Mark compulsory for desktop apps as non-launchable (#1214),0.54936373,No longer prompt for approval to update non-curated apps,,0
