Index,Commit Message,Score,Correspond Changelog Sentence,Commit Description,Label
1,Extracted @redux-saga/delay-p & @redux-saga/symbols,0.7842525,@redux-saga/delay-p@1.2.1,"Regarding the @redux/toolkit documents, an object will be passed to the configureStore function. The current code in line 91 won't work and throws a typescript error.",1
2,Update prettier,0.5980217,"This is rather a smaller release, but some things have changed or got improved.",Co-authored-by: github-actions[bot] github-actions[bot]@users.noreply.github.com,0
3,Grammar fix,0.5245236,"},","We already allowed channel to be passed into createSagaMiddleware, this change simply updates our types to match our implementation. I also added a recipe for batching redux actions since it is a very common paradigm and something I've had to re-write multiple times from memory. Co-authored-by: Mateusz Burzyński mateuszburzynski@gmail.com",0
4,Fix error in rootSaga pattern code example,0.6356609,import rootSaga from './sagas',,0
5,Merge pull request #356 from chentsulin/patch-2,0.5113404,A small patch with the following merges,,0
6,Merge pull request #402 from Moeriki/master,0.4756767,- issue with joiner not ending in cancelled state when joining cancelled task ,This allows us to automatically deploy the docs website when pushing or merging to our main branch.,0
7,comments on why async dispatch is necessary,0.5692581,"  dispatch: ...,",,0
8,Tweaked .eslintignore rule,0.4710453,#2261 5ae6578 Thanks @neurosnap! - Require CpsCallback in all functions passed to the cps effect creator. This fixes a regression caused by TS 4.0 changing the behavior around spreading never into tuple types,The documentation here doesn't match what the real behavior is. (Also inconsistent with the readme docs),0
9,Update type test and docs for join/cancel effects,0.5319731,"- signature of join & cancel, they both accept now a single task descriptor or an array of those (previously they have accepted variadic length of arguments)", use configureStore instead of createStore,0
10,Merge pull request #338 from raychouio/fix/example-package,0.5168161,#2270 d2579a2 Thanks @Methuselah96! - Inlined Redux Action type to fix compatibility with strict package managers.,Co-authored-by: github-actions[bot] github-actions[bot]@users.noreply.github.com,0
11,Made sagaStack property non-enumerable (closes #934),0.6360701,        // error is an instance of SagaCancellationException,,0
12,Updated with feedback,0.6158361,Improved:, bug: throttle now accepts a channel as originally intended  Co-authored-by: Mateusz Burzyński mateuszburzynski@gmail.com Closes: #1805  Update .changeset/neat-wolves-wink.md  Co-authored-by: Mateusz Burzyński mateuszburzynski@gmail.com,0
13,Allow to transform/filter actions sent to the Sagas,0.67486835,allowing sagaMonitor to be used in react-native (thanks to @benhughes),values,0
14,Merge pull request #1759 from Dai7Igarashi/igarashi/fix-saga,0.49582145,#2270 d2579a2 Thanks @Methuselah96! - Inlined Redux Action type to fix compatibility with strict package managers.,Co-authored-by: github-actions[bot] github-actions[bot]@users.noreply.github.com,0
15,Update README_zh-cn.md (#1337),0.4411311,"Updated dependencies [bed4458, 612cae8, 979b8b4, 20f22a8, d2579a2, 2d2214e]:",,0
16,TypeScript: update Task interface,0.65193105,#2004 20f22a8 Thanks @gilbsgilbs! - A generic type has been added to the Task interface and that should be preferred over using a generic parameter in Task#result and Task#toPromise.,Co-authored-by: github-actions[bot] github-actions[bot]@users.noreply.github.com,0
17,added more docs,0.7895682,- many docs improvements,,1
18,update docs/api: yield take(...) return an action object (#1616),0.582672,"yield* takeEvery('ACTION', worker) // this WON'T work, as effect is just an object",,0
19,babel-plugin: dont cache process.cwd,0.5215234,"- we are reusing @babel/runtime helpers, this has helped us to remove some bytes from our bundles",,0
20,Fix hot reducer loading in examples/real-world,0.50343263,"- fixed internal scheduler and its recursive nature, now its trampolining and cannot cause stack's overflow, thanks to @pbadenski and @wilsaj",,0
21,typo: paylaod => payload,0.45433652,- madesagaStackproperty non-enumerable (this is attached sometimes byredux-saga` to the thrown Errors),  add package entry points   Add package.json#exports to more packages and introduce import-condition-proxy.mjs where needed   Co-authored-by: Mateusz Burzyński mateuszburzynski@gmail.com,0
22,package.json update,0.6419553,"- Added ""jsnext:main"" entry to package.json for ES2015 module import (PR #204)",,0
23,Add note regarding PUT effects on the store,0.4925955,  storeIO(store),As per https://github.com/redux-saga/redux-saga/issues/1831,0
24,added more tests for put effect,0.4746251,"test('getData', assert => {","  Adds isAborted and joiners to mock task   Refactors mock task internals to have status enum   Removes setRunning, ensures valid transitions, adds tests & updates docs   Adds more cancel & join tests for mock tasks   Re-adds setRunning with deprecation warning   Creates changeset ",0
25,import monitor directly;,0.6605344,- monitor,  Updates types to eliminate void-emitting channel pitfall   Creates changeset ,0
26,"Fixed internal matcher for take effects, so it supports Symbol action.types (#781)",0.6507841,take effect supporting Symbol types again - thanks to @iMoses ,,0
27,Merge pull request #258 from saiyeek/master,0.46157968,Task cancellation support. Thanks to @aikoven for this one. (issue #14).,"The explanation surrounding the example race() use didn't previously mention that if call(fetchUsers) rejects, that rejection reason is thrown by race.  Clarify what happens when a racing effect throws.",0
28,Only call onError with uncaught errors,0.70442766,Also onError should get called now even if you throw non-Errors in your code.,  fix heading for using channels to communicate between sagas   first step documenting multicastChannel ,1
29,"Added npm scripts to build, serve locally and publish documentation",0.4687556,"import { createStore, applyMiddleware } from 'redux'",,0
30,babel-plugin: fixed template issue,0.5340245,"- removed#PUREannotations from the source code, adding them automatically with [annotate-pure-calls babel's plugin](https://github.com/Andarist/babel-plugin-annotate-pure-calls)",  Remove bundlesize CI check and instead use compressed-size-action to check for bundle sizes   rm bundlesize   update yarn.lock ,0
31,Add dev-only warning when saga gets used with async generator (#1604),0.7972058,"- added dev warning about using async generators, they are not supported by redux-saga",Add closing parenthesis,1
32,Removing mentions of .done and replacing with .toPromise() (#1456),0.5700666,- task.done getter was changed to be task.toPromise method," docs(BeginneruTutorial): manual browser tab opening  Added mention that tab will not open automatically, you need to open it manually  Update docs/introduction/BeginnerTutorial.md  Co-authored-by: Eric Bower me@erock.io Co-authored-by: Eric Bower me@erock.io",0
33,Use jest.useFakeTimer instead of lolex. (#1687),0.46680143,#2297 fdca798 Thanks @lourd! - Adds missing isAborted method to mock task and deprecates its setRunning method,Tried to see if it had been hosted elsewhere but no luck.,0
34,Update filename references in package.json,0.6106329,"- Added ""jsnext:main"" entry to package.json for ES2015 module import (PR #204)",  Improve Task typing.   Default to the outer type param within Task interface   Add changeset   Co-authored-by: Mateusz Burzyński mateuszburzynski@gmail.com,0
35,update tests,0.5211762,A patch release including some fixes,  Add redux as dependency of @redux-saga/types   Create silly-dogs-compete.md   Inline Action type   Update silly-dogs-compete.md   Action type is string   Update .changeset/silly-dogs-compete.md   Co-authored-by: Mateusz Burzyński mateuszburzynski@gmail.com,0
36,Add 'What is Redux-Saga?' blog post to external resources (#1501),0.57009506,- is helper should be imported from @redux-saga/is.,,0
37,Using files entry in package.json instead of .npmignore file (closes #1113),0.6729934,"#2308 8207e33 Thanks @Andarist, @neurosnap! - exports field has been added to the package.json manifest. It limits what files can be imported from a package but we've tried our best to allow importing all the files that were considered to be a part of the public API.",  update ci yml   update contributing guide   remove expectation thats failing tests   update bundlesize   dtslint failing because of concurrency issues   use new setup-node gh action   remove parallel from tests because dtslint tests are clobbering each other   fix cps type error when function provided doesn't have a cps callback function   remove conditional type for cps   Tweak types for cps   Require cps callback in all overloads   add pull request to github action   add changeset   upgrade dtslint   Update .changeset/itchy-worms-give.md   Co-authored-by: Mateusz Burzyński mateuszburzynski@gmail.com,0
38,Updated TS definition to include saga helpers in redux-saga/effects,0.69375443,"- added TS typings for helpers' effect creators from the redux-saga/effects, that means takeEvery, takeLatest, throttle (thanks to @mcrawshaw)",  Banner: stop war in ukraine   Revert formatting.   Revert automatic formatting.   Simplify styles a little bit   Co-authored-by: Mateusz Burzyński mateuszburzynski@gmail.com,0
39,Merge branch 'single-std-channel',0.49091572,"- internal stdChannel got reworked to be a singleton object (it is wrapped multicastChannel's instance'), also it is an exported API to support new runSaga's signature - this should also result in being a small perf boost",,0
40,Fixed throttle to accept a channel as originally intended  (#2340),0.85003436,#2340 345b828 Thanks @neurosnap! - throttle now accepts a channel as originally intended,,1
41,added resolution time,0.46513015,#2293 2d2214e Thanks @neurosnap! - Fixed an issue with arguments that exceed the maximum value for the internally-used setTimeout. Previously it could overflow based on the input that was too big and thus a timeout could resolve immediately.,,0
42,Update redux-saga.js,0.6072824,"This small update allows you to integrate better with some other redux libraries, like redux-actions and redux-act.",,0
43,manual impl. of higher level API using fsm,0.57173055,Middleware API,,0
44,Add TypeScript definitions,0.6044789,take effect supporting Symbol types again - thanks to @iMoses ,so that they can follow the following changes https://github.com/redux-saga/redux-saga/commit/89a11479a6ed953c522b57ef23b6e14758d64278#diff-04c6e90faac2675aa89e2176d2eec7d8 https://github.com/redux-saga/redux-saga/commit/1a3b846908a0a0501955deb92a5660700646b4e8#diff-04c6e90faac2675aa89e2176d2eec7d8,0
45,Allow to decorate builtin emitter,0.44165188,- made take and put effects redeclarable (thanks to @Rokt33r),,0
46,Merge pull request #566 from komcal/master,0.45979482,- issue with joiner not ending in cancelled state when joining cancelled task ,,0
47,Update README_ja.md (#1612),0.4327458,"Let's face it. Errors coming from redux-saga were unreadable and made finding a root cause of the problem really difficult. We really want to improve this situation and with this release (thanks to @restrry's amazing contribution) we start to log ""saga stacks"" along with original errors. This works similar to what React already does with its ""component stacks"". Just look at this one:",  fix image and doc links   fix code blocks rendering without theme   make footer links open in same tab ,0
48,Merge pull request #1527 from redux-saga/refactor-join-cancel,0.5309477,"- signature of join & cancel, they both accept now a single task descriptor or an array of those (previously they have accepted variadic length of arguments)",,0
49,Merge pull request #595 from jfairbank/add-redux-saga-router-addon,0.5062348,- got redux-saga/effects and redux-saga/utils working properly for webpack2 and rollup users (or any other bundle which recognizes jsnext:main/module entry). Thanks to @Ephys. How was it achieved can be seen here. Neat trick which I think is not publicly known and it was an issue for quite some time and also allowed me to help fixing this in some other libraries.,Move documentation to Docusaurus,0
50,fixed tests,0.58460504,"test('getData', assert => {",,0
51,"Use ""lerna bootstrap"" as postinstall script",0.54045385,import { createMockTask } from 'redux-saga/lib/testUtils',,0
52,Don't stringify args[0] in checks of io.call().,0.5046944,     if(isCance(error) ,,0
53,Some misc grammar fixes,0.5108621,"},",,0
54,babel-plugin: fix examples in comments,0.6150695,"- removed#PUREannotations from the source code, adding them automatically with [annotate-pure-calls babel's plugin](https://github.com/Andarist/babel-plugin-annotate-pure-calls)",,0
55,Remove old typescript tests.,0.54168373,Removed:,,0
56,Add tests for async example.,0.5057438,"test('getData', assert => {",,0
57,(Update) Update gitignore to no include .idea files,0.5583242,The documentation is now using GitBook thanks to @cef62,,0
58,0.10.3,0.56313014,  // No longer valid with 0.9.1,,0
59,fix link in README,0.4074617,"- fix #316 Compare END action by string type, not by reference, to allow middleware-transformed actions",,0
60,Improved documentation wording,0.51606566,- many docs improvements,,0
61,中文,0.7959299,- Add Chinese Traditional translation (thanks to @neighborhood999),,1
62,fixed links,0.4620224,This patch fixes synchronous errors handling (see #152 and #165),,0
63,"replace some template content, begin restyle",0.45746547,// resume the generator with mockAction,,0
64,Merge pull request #809 from xanf/patch-1,0.4682941,- issue with joiner not ending in cancelled state when joining cancelled task ,,0
65,Refactored flatMap implementation,0.45017216,- made take and put effects redeclarable (thanks to @Rokt33r),,0
66,Create CNAME,0.44856545,const store = createStore(,,0
67,updated tests (call support for instance methods),0.58634484,"test('getData', assert => {",,0
68,"enhanced support for monitoring, log monitor",0.695943,- monitor,,0
69,Merge pull request #494 from Andarist/fix-deprecated-dependency,0.51921993,"Updated dependencies [bed4458, 612cae8, 20f22a8, d2579a2]:",,0
70,Migrate all links to the new organization URL (fixes #719),0.38831896,Also migrated examples to webpack. All build infrastructure use webpack,,0
71,refactored function checks to is.func,0.56588084,     if(isCance(error) ,,0
72,Merge branch 'rec',0.41630805,"This small update allows you to integrate better with some other redux libraries, like redux-batched-actions.",,0
73,Handle symbol patterns properly,0.6273242,take effect supporting Symbol types again - thanks to @iMoses ,  Docs fix   Docs correction ,0
74,Merge pull request #639 from yenshih/patch-3,0.43483484,Task cancellation support. Thanks to @aikoven for this one. (issue #14).,,0
75,updated docs for the new release,0.76648295,- many docs improvements,  Add warnings for invalid use of take effect   A little bit more descriptive changeset   Co-authored-by: Mateusz Burzyński mateuszburzynski@gmail.com,1
76,Merge pull request #393 from vcarl/master,0.46091825,- issue with joiner not ending in cancelled state when joining cancelled task ,,0
77,Merge pull request #1296 from willem-h/master,0.44488,#2270 d2579a2 Thanks @Methuselah96! - Inlined Redux Action type to fix compatibility with strict package managers.,Add chat article to external resources list,0
78,ignore package-lock (#1572),0.56384057,#2270 d2579a2 Thanks @Methuselah96! - Inlined Redux Action type to fix compatibility with strict package managers.,markdown change,0
79,added select effect handling,0.5386545,- detach helper returns a new effect instead of mutating the input one,Removed --save option from npm install,0
80,add root flag to monitor interface,0.6530303,- new rootSagaStarted hook for saga monitor,,0
81,Merge branch 'deps/rollup',0.3758252,A small patch with the following merges,As of npm 5 and in latest npm/cli save is a default option. One may use --no-save to skip saving to package.json,0
82,fix eventChannel#close issue,0.8508158,"- fixed issue with eventChannels not closing automatically upon emitting END, thanks to @baldwmic",,1
83,0.3.1,0.5605419,  // No longer valid with 0.9.1,"Fix links for ""dispatch"" to a proper page: https://redux.js.org/api/store/#dispatchaction, the previous one leaded to 404.",0
84,Merge pull request #1630 from redux-saga/lower-kb-limit,0.49167237,- babel-plugin-redux-saga - can be used to enhance stack traces of thrown errors,to be in line with rest of code,0
85,Update redux-saga dependency version of example,0.6508523,Updated dependencies [345b828]:,xstate was listed as the opencollective url - this should be https://opencollective.com/redux-saga instead.,0
86,rename channel to actionChannel,0.54484093,Support for Channels and Event channels,,0
87,0.6.0,0.5954037,  // No longer valid with 0.9.1,,0
88,add vanila html example,0.50539863,someModule.js,,0
89,do not attach cancel functions on noop,0.5853751,    // ensure this is not a Cancellation error before handling the error,,0
90,added tests for sync dispatches,0.61122775,Fix Synchronous puts behaviors to be consistent with pre 0.10 releases,,0
91,Edit phrasing to account for scheduling,0.55949616,- New scheduler to handle synchronous & deeply nested forks/puts (see #622),,0
92,fix for dark theme,0.3963245,For background see #336,,0
93,Added gitbook-cli module to devDependencies,0.575908,The documentation is now using GitBook thanks to @cef62,  Add square logo   Update logo readme   Resize logo in the readme   Fix alt text in Readme   Resize image to reach the edges for uniformity in logo designs   Use alternative square logo design ,0
94,Fix error in the API reference CPS section,0.5472077,- Fix issues with Error handling,,0
95,Update README.md (#1472),0.54917866,"Updated dependencies [bed4458, 612cae8, 20f22a8, d2579a2]:",,0
96,Add three links to for root saga page inn readmes (#1513),0.5996206,- new rootSagaStarted hook for saga monitor,,0
97,Unify how getFnCallDescriptor is handled (#1605),0.5567229,"  getState: ...,",,0
98,fixed: npm test now runs linter and example tests,0.5316757,"- cloneableGenerator utils, which can ease ur unit testing when logic branching is needed, thanks to @nihaux ",,0
99,example/cancellable-counter: update webpack and react,0.5995675,Also migrated examples to webpack. All build infrastructure use webpack,,0
100,Merge remote-tracking branch 'baldwmic/createMockTaskDoc',0.52146566,fix #360 : added option logger to customize logging (see  API docs for createSagaMiddleware),,0
101,Migrate to dtslint and more types improvements.,0.6199374,- many docs improvements,,0
102,Merge pull request #818 from nktssh/patch-1,0.45789617,- got redux-saga/effects and redux-saga/utils working properly for webpack2 and rollup users (or any other bundle which recognizes jsnext:main/module entry). Thanks to @Ephys. How was it achieved can be seen here. Neat trick which I think is not publicly known and it was an issue for quite some time and also allowed me to help fixing this in some other libraries.,,0
103,Upgrade some devDeps (mainly Babel-related),0.5615936,Updated dependencies [345b828]:,,0
104,add license & package.json,0.6721852,"#2308 8207e33 Thanks @Andarist, @neurosnap! - exports field has been added to the package.json manifest. It limits what files can be imported from a package but we've tried our best to allow importing all the files that were considered to be a part of the public API.",,0
105,chore: move prettier config to .prettierrc.json (#1522),0.507257,configureStore.js,,0
106,updated old docs,0.78729504,- many docs improvements,,1
107,updated builds,0.5723645,New features:,,0
108,完成一半,0.6811776,  },  Add dev mode error for fork   Fix test ,0
109,Fix range of supported redux versions. Fix #1306 (#1419),0.6509858,Updated dependencies [2466c79]:,,0
110,Renamed proc to saga in task descriptions,0.5346296,const task = runSaga(,,0
111,updated docs for task descriptor,0.68783045,- many docs improvements,,0
112,experiment with lon running sagas,0.52714485,- Support for starting Sagas dynamically (issues #5 and #13),,0
113,Bulding umd files as part of precommit hook,0.46559784,- Support for umd builds Thanks to @cef62 ,,0
114,"minor edit, 2 -> two",0.6116907,Minor Changes,,0
115,Update lerna,0.70120686,A patch release including some fixes,,1
116,[FIX] Setting BABEL_ENV to use es modules before running bundesize,0.5918884,- Fix issue with ES build (thanks @Andarist),,0
117,v0.12.0,0.62265193,A patch release including some fixes,,0
118,small docs improvement,0.86946166,- many docs improvements,Leverage TS 3.6 generator return types for Saga Iterators.,1
119,Merge branch 'context',0.43928027,"- added getContext and setContext effects (thanks for the idea to @aikoven). It's not properly documented yet, but its a feature which allows sharing context properties across tasks without need to import them in each file or passing them explicitly through arguments. The feature is implemented as dynamic scoping which should sounds familiar for JS devs. In general you cannot share a context property from a child task to the parent, its only passed 'down'. You can read more in related issue and PR till its not documented.",Also removed files that should have remained untracked and that have confused dtslint.,0
120,Merge pull request #75 from Aweary/grammar-fixes,0.5471102,"- signature of join & cancel, they both accept now a single task descriptor or an array of those (previously they have accepted variadic length of arguments)",,0
121,fix #336 Race condition in 0.10.x,0.558425,This patch fixes synchronous errors handling (see #152 and #165),,0
122,Merge pull request #66 from jihchi/update_zh_hant_to_0.6.0,0.4400624,#2270 d2579a2 Thanks @Methuselah96! - Inlined Redux Action type to fix compatibility with strict package managers.,Reword api docs for PUT,0
123,Update FutureActions.md,0.5121245,"Updated dependencies [bed4458, 612cae8, 20f22a8, d2579a2]:",,0
124,Hid all argument checks behind env check - it should be extra validated only in dev mode,0.5189955,- Uncaught cancellation exception are logged into the console only in dev mode (process.env.NODE_ENV set to 'development'),,0
125,trans-table for channels,0.6525997,Support for Channels and Event channels,"doc: takeLatest: ""spawns"" => ""forks""",0
126,Move all effect runners to a separated file (#1659),0.49611506,"- removed redux-saga/utils entirely, move of those are moved to separate packages",,0
127,Merge pull request #1915 from sultanassi95/patch-1,0.43314677,"- signature of join & cancel, they both accept now a single task descriptor or an array of those (previously they have accepted variadic length of arguments)",Fix grammar mistake in docs,0
128,clarify the first sentence in readme,0.46167704,"},",,0
129,Merge pull request #464 from Andarist/eventchannel-doc,0.47278124,- Only check eventChannel matcher if defined #273 (thanks @secobarbital),Add an article to external resources,0
130,Translate README in Japanese based on b5f341,0.47582784,- Add Chinese Traditional translation (thanks to @neighborhood999),do not attach cancel functions on noop,0
131,Refactor io.join and runJoinEffect,0.5590594,This patch fixes the createMockTask result to be conform to the API of Task object (see #182),,0
132,added race winner indicator,0.57493925,- END will now finish the race effects,Hi! I wrote an article about Redux-Saga on my blog. The idea is to understand it better by reimplementing it in a minimalistic way. I thought it could help some other developers.,0
133,1309 Revamp testing docs (#1433),0.6134145,- many docs improvements,,0
134,Merge pull request #92 from prashaantt/docs,0.47829324,A small patch with the following merges,See https://github.com/redux-saga/redux-saga/pull/1892#discussion_r304728796,0
135,Fixed bug in Retrying XHR calls recipe,0.47184232,- Fix issues with Error handling,,0
136,Merge pull request #1823 from antododo/patch-1,0.461851,A small patch with the following merges,,0
137,Merge branch 'self-cancel',0.43150222,"- signature of join & cancel, they both accept now a single task descriptor or an array of those (previously they have accepted variadic length of arguments)", Add a generic return type to SagaIterator Update effect types to set the proper return type Improve type inference for CombinatorEffect,0
138,Merge pull request #585 from knpwrs/patch-1,0.41813964,- issue with joiner not ending in cancelled state when joining cancelled task ,,0
139,Handle errors without Error objects,0.7624259,Error handling,,1
140,Use modern API and conventions in README,0.53560746,(see API docs for detailed infos),,0
141,fix: zh-cn Readme title,0.37877053,- fix #287 weird error stack trace and error printing,,0
142,updated with latest builds,0.6071426,New features:,Update Root Saga Patterns docs,0
143,Fix grammar error,0.578381,- Fix issues with Error handling,,0
144,docs: improve wording for task cancellation (#1650),0.6742231,Task descriptor enhanced with a new cancel method,,0
145,typo (let's -> lets) (#1731),0.50254786,});,Add html-webpack-plugin module in package.json,0
146,Merge pull request #390 from nhjk/patch-1,0.47474334,- issue with joiner not ending in cancelled state when joining cancelled task ,Update pronoun usage in FutureActions.md,0
147,Merge pull request #284 from hamczu/basics-docs-fix,0.5117481,"Updated dependencies [bed4458, 612cae8, 20f22a8, d2579a2]:",1848 Fix broken unpkg links for redux-saga,0
148,added monitorActions export,0.6083126,"+ sagaMonitor: monitor,",Update HelperWorkerParameters to match saga that don't use action,0
149,fix export in introcution docs,0.6766838,// export the middleware,Fix error in docs: rootSaga pattern code example,0
