Index,Commit Message,Score,Correspond Changelog Sentence,Commit Description,Label
800,fix { delay } import in tutorial - it previously gave this error:,0.672837,- delay function (not effect!) should be imported from @redux-saga/delay-p,,0
801,channel + put(channel) supp,0.64246184,Support for Channels and Event channels,,0
802,Merge pull request #791 from felixgomez/patch-1,0.45199016,- issue with joiner not ending in cancelled state when joining cancelled task ,,0
803,Reworked middleware custom emitter test,0.6850319,"- effectMiddlewares - useful especially for testing, you can intercept/hijack any effect and resolve it on your own - passing it very redux-style to the next middleware (last being redux-saga itself). How it might be used can be checked here. Many thanks to @eloytoro for this feature",,0
804,Version Packages (#2322),0.637787,Updated dependencies [2466c79]:,fix doc typo in ForkModel page,0
805,Merge pull request #506 from PeterAronZentai/master,0.4912666,Task cancellation support. Thanks to @aikoven for this one. (issue #14).,,0
806,add recent articles,0.5690384,"Beside that few things have changed, you can read more about them below.",fix-typo,0
807,Add warnings for invalid use of take effect (#2068),0.64404225,"#2068 586179c Thanks @mikabytes! - Added warnings when using take(channelOrPattern) incorrectly with more than one parameter. It helps to surface problem with take(ACTION_A, ACTION_B) being used instead of take([ACTION_A, ACTION_B]).",,0
808,Add default type to PutEffect (#1566),0.48492563,- put.sync got renamed to put.resolve,Fix typo in tutorial title,0
809,added test helpers to spy internal channel state,0.5253572,Support for Channels and Event channels,"Here is the logo in 3 different flavors, two resolutions, with README and LICENSE",0
810,fixed select error msg,0.579705,- Fix issues with Error handling,,0
811,Merge pull request #1396 from AbdulKabia/Issue#1287,0.46144706,Task cancellation support. Thanks to @aikoven for this one. (issue #14).,,0
812,remove caret in package.json,0.5380089,"#2308 8207e33 Thanks @Andarist, @neurosnap! - exports field has been added to the package.json manifest. It limits what files can be imported from a package but we've tried our best to allow importing all the files that were considered to be a part of the public API.",,0
813,Added downloads/month badge,0.5104054,And yet another patch release,,0
814,breaking change in middleware API,0.8373478,Middleware API,,1
815,Updated dist files,0.53378874,"- removed redux-saga/utils entirely, move of those are moved to separate packages",,0
816,Fix typos in recipes README.md,0.4653609,"- got rid of createSagaMiddleware({ onerror }) which got into library because of a typo and we have supported it for some time, please use onError instead",,0
817,Updated rollup deps,0.5681278,"This release contains mostly deprecations, but only a mild ones. Mainly few things got better, more descriptive names to indicate their behaviour and helpers got their way into effects. Of course as those are deprecations only, we are still planning to support old APIs for a time being, but as those do not require much change in the code they old versions will get removed eventually.",,0
818,Merge pull request #239 from Mistereo/master,0.46108615,- issue with joiner not ending in cancelled state when joining cancelled task ,,0
819,is not are,0.4810378,Instead of ,,0
820,Resolved bootstrap hoisting mismatches,0.46330982,Error handling,,0
821,开始+等待将来的Action,0.58212984,- delay became an effect,,0
822,Tweaked bundlesize setup,0.5980942,"- got us a rolluped UMD build, which is way smaller than the one which was produced by a webpack, thanks to the so called 'flat-bundling'",,0
823,Add a correctly spelled arrayOfDeferred,0.69684196,- exported util of arrayOfDeffered got renamed to the correct arrayOfDeferred,,0
824,Refactored export style in sagaHelpers/index.js,0.5997856,allowing sagaMonitor to be used in react-native (thanks to @benhughes),,0
825,removed is.generator dependency,0.5832398,Removed:,,0
826,Merge pull request #539 from Andarist/std-channel-extracted,0.51852304,- eventChannel does no longer accept matcher argument - it was a hacky way to support previous implementation of stdChannel,Missing RouterContext import in Root.prod.js,0
827,but the Logo in Landscape,0.70445645,- got us a logo! Thanks to @thekarland,,1
828,Add new signature for runSaga,0.85465574,Breaking change in the signature of runSaga,,1
829,Merge pull request #740 from aikoven/update-typings,0.49172014,Task cancellation support. Thanks to @aikoven for this one. (issue #14).,,0
830,docs(API): fix typo,0.5565928,- Fix issues with Error handling,docs: modify Channel.flush and Channel.close decription  description,0
831,updated the docs,0.8488416,- many docs improvements,,1
832,Dont use is.sagaAction in core (saves 20b),0.50228804,Breaking change in the signature of runSaga,,0
833,Bubble error if put is blocking,0.5666935,1. put doesn't block waiting the returned promise to resolve,,0
834,add issue templates (#1437),0.5017045,- fix #287 weird error stack trace and error printing,,0
835,fix broken link in ExternalResources.md,0.526797,"Updated dependencies [bed4458, 612cae8, 20f22a8, d2579a2]:",,0
836,Merge pull request #106 from paul42/patch-1,0.4627976,A small patch with the following merges,,0
837,were not was,0.46824118,Instead of ,,0
838,fixed memory leak with recursive sagas,0.68190277,- small memory leak for closed actionChannels,,0
839,Merge pull request #1836 from gingerrific/gingerrific-docs,0.463729,import { detach } from 'redux-saga',,0
840,task.done -> task.toPromise(),0.8381302,- task.done getter was changed to be task.toPromise method,,1
841,Migrated to Babel7 and Webpack3,0.63542986,Also migrated examples to webpack. All build infrastructure use webpack,,0
842,Fixed docs information about default limit in buffers. (spotted in #511),0.61140966,TL/DR: Use buffer.fixed(limit) when you need a bounded buffer (will throw an error when the untaked messages exceed the buffer limit). Use buffer.expanding(limit) when you need an auto expanding buffer.,add README translation into russian,0
843,sagaMiddleware options passing cleanup (#1654),0.7648033,sagaMiddleware.run(dynamicSaga),,1
844,Add deprecation warning for join(...tasks) and cancel(...tasks),0.70704156,- issue with joiner not ending in cancelled state when joining cancelled task ,"Improve ""External Resources"" document with new links",1
845,npmingore gitbook specific files,0.6021836,The documentation is now using GitBook thanks to @cef62,,0
846,0.15.2,0.553967,  },,0
847,Fix grammar (#1926),0.52827984,"},",,0
848,Update rollup-plugin-babel to v5 (alpha),0.5795741,Updated dependencies [345b828]:,,0
849,remove eslint-disable,0.5702375,Removed:,,0
850,fix table and link to blocking,0.4718068,Include fix #71 'yield [] should return immediately an empty array instead of blocking forever' (thanks to @slorber ) ,,0
851,Merge pull request #748 from JisuPark/master,0.50236535,- issue with joiner not ending in cancelled state when joining cancelled task ,,0
852,cleanup of examples dirs,0.39724445,"We've recently extracted some modular packages, you can see @redux-saga/deferred, @redux-saga/delay-p, @redux-saga/is & @redux-saga/symbols. At the same time we've managed to shave off some bytes from the core build - according to some tests of our we've managed remove over 1kb, but your YMMV ofc.",,0
853,docs(readme): add discord link (#2365),0.5493339,This patch fixes #118. The implementation of argument passing to forked tasks in takeEvery/takeLatest didn't match the specs in docs and examples,Improved documentation wording,0
854,Merge pull request #857 from neighborhood999/typo,0.39388496,- optional cancel property on CpsCallback (thanks to @dannsam) ,,0
855,add channel effect,0.6382661,"- Updated docs, added a section on channels",,0
856,Remove explicit installation of yarn on CI - as it is available by default when using actions/setup-node,0.3802859,- optional cancel property on CpsCallback (thanks to @dannsam) ,,0
857,fixed runSaga docs,0.65935475,sagaMiddleware.run(rootSaga),,0
858,Fixed eslint rule override,0.47357106,- Fix issue with ES build (thanks @Andarist),BeginnerTutorial.md: Include full render method,0
859,Merge pull request #811 from aryzing/master,0.49890494,- issue with joiner not ending in cancelled state when joining cancelled task ,Add onError as option to runSaga,0
860,TypeScript: simplify Pattern type,0.5266179,take effect supporting Symbol types again - thanks to @iMoses ,runSaga actually accepts onError option in the same way as it is done in middleware,0
861,exclude auth recipe until fix of timeout,0.4541715,"- Make delay cancellable (#314 thanks to @aikoven, Also thanks @itinance for issuing #327). ",Remove obsolete argument in throttleHelper,0
862,Merge pull request #847 from helfer/patch-1,0.49144137,- issue with joiner not ending in cancelled state when joining cancelled task ,,0
863,Merge pull request #572 from michaelgilley/docs/edit-channels,0.5670751,"- Updated docs, added a section on channels",,0
864,Merge pull request #2039 from smilealdway/patch-1,0.47118095,- issue with joiner not ending in cancelled state when joining cancelled task ,,0
865,Rebuild dist libs,0.4770509,"- we are reusing @babel/runtime helpers, this has helped us to remove some bytes from our bundles",Fixed surfaced API from join([tasks]) to join(...tasks),0
866,Merge pull request #1772 from 37108/fix-japanese-readme,0.4775555,- issue with joiner not ending in cancelled state when joining cancelled task ,,0
867,fix async startup issue,0.49462414,"- added dev warning about using async generators, they are not supported by redux-saga",fixed import of throttle,0
868,Merge pull request #1365 from redux-saga/babel-plugin-redux-saga-readme,0.61393416,- babel-plugin-redux-saga - can be used to enhance stack traces of thrown errors,,0
869,added link to the chinese traduction of the docs site,0.67376095,- Add Chinese Traditional translation (thanks to @neighborhood999),Escape brackets on markdown,0
870,"Made helpers non blocking, they return task descriptors back into saga so it can continue its execution without wrapping it additionally into a fork. It also makes them cancelable now, like regular forked tasks.",0.6720568,"In prior release, all forked tasks were detached from their parents. The parent Saga terminates as soon as its own body of instructions is fully executed and errors from forked tasks do not propagate up to their parents which in some situations caused errors from forks to be swallowed. Also cancellation of a Parent task do not automatically propagate to child tasks, which means one have to maintain the list of running tasks manually and take care of cancelling them if the parent was cancelled",They create some extra anchor closing tab on github doc at https://redux-saga.github.io/redux-saga/,0
871,Add funding information,0.43831193,(see API docs for detailed infos),BeginnerTutorial.md: Include full render method,0
872,clean up channel end symbols (#1464),0.6672392,#2296 612cae8 Thanks @lourd! - Updates Channel type to eliminate void-emitting pitfall,"In the tutorial as is the original redux action creators onIncrement and onDecrement are not shown as props on the Counter component. This makes it so that the other buttons will no longer work if you follow the instructions to the letter. Since the entire render method is very small I suggest including the whole render method like this: lang-javascript function render() {   ReactDOM.render(     <Counter       value={store.getState()}       onIncrement={() => action('INCREMENT')}       onDecrement={() => action('DECREMENT')}        onIncrementAsync={() => action('INCREMENT_ASYNC')} />,     document.getElementById('root')   ) } Making it much more clear how the main.js file should end up looking. This is relating to the tutorial beginner tutorial: https://github.com/justsayno/redux-saga/edit/master/docs/introduction/BeginnerTutorial.md and the instructions on adding the onIncrementAsync={() => action('INCREMENT_ASYNC')} to the render method in main.js in the tutorial project.",0
873,"Added ""jsnext:main"" entry to package.json to support ES2015 module import.",0.97827196,"- Added ""jsnext:main"" entry to package.json for ES2015 module import (PR #204)",Make the code snippet consistent with repo,1
874,Added support for self cancellation via yield cancel(),0.76895964,"- implemented possibility for self cancellation, this means you can now yield cancel() inside a task and handle both cancel(task) + self cancellation via cancel() within the same finally block",The button and the div were formated on three lines in the repo. Makes it harder to find the place to put the code.,1
875,add readme,0.4127525,- typings fordetachgot added thanks to @aikoven ,,0
876,Add Readme,0.3946827,  let task,,0
877,Make the code snippet consistent with repo,0.5031894,Fix Synchronous puts behaviors to be consistent with pre 0.10 releases,"Fixed internal matcher for take effects, so it supports Symbol action.types",0
878,Merge pull request #1573 from redux-saga/flatten-calls,0.5046452,"import { take, fork, cancel } from 'redux-saga'",Changed wording,0
879,Update Channels.md,0.74128795,"- Updated docs, added a section on channels",,1
880,Added support for cancel(...tasks),0.86926365,- implemented cancel(...tasks) in similar manner ,,1
881,"simplify ""recipes"" path",0.48341936,import reducer from './path/to/reducer',,0
882,starting app sagas from outside using runSaga,0.68124497,"In previous releases, the library provided the runSaga method to start Sagas dynamically. However, there were some issues due to how runSaga was implemented (related issues #48, #76)",Add support for stringable action creators as a take pattern (closes #732),0
883,remove redundant check npm script,0.48998916,Removed:,,0
884,merged branch generator,0.4179218,"This new release includes a new fork model. By default, all forked tasks are attached to their parents. The whole parent + direct and indirect children form an execution tree (vs execution path in sequential programming). This implies new semantics from the prior releases",Expose onError in runSaga,0
885,Finished Traditional Chinese translation,0.82065547,- Add Chinese Traditional translation (thanks to @neighborhood999),,1
886,Add is.iterable typing,0.6060961,- typings fordetachgot added thanks to @aikoven ,Updated docs with RollupJS troubleshooting section,0
887,Merge branch 'master' into master,0.37670827,"This new release includes a new fork model. By default, all forked tasks are attached to their parents. The whole parent + direct and indirect children form an execution tree (vs execution path in sequential programming). This implies new semantics from the prior releases",,0
888,Fix prettierignore,0.78136647,  },Fix the link to unpkg in README,1
889,Fix typos,0.53905237,TS Typings,Removing significant whitespace,0
890,Merge pull request #594 from juangl/patch-1,0.50511837,- issue with joiner not ending in cancelled state when joining cancelled task ,The space between the brackets and the link are breaking the CDNJS badge when the markdown is rendered at https://redux-saga.github.io/redux-saga/,0
891,update builds to 0.8.2,0.61100113,A patch release including some fixes,,0
892,fixed signature of createMockTask result,0.6270829,  const mockTask = createMockTask(),,0
893,Add all effect,0.54862654,"- all effect - explicit effect for parallel effects, which is exactly what we had been supporting by accepting yielded arrays, so the latter is become deprecated now in favor of this explicitness which nicely maps to the Promise.all API. Please use this from now on",,0
894,Update delayP function,0.71253973,- delay function (not effect!) should be imported from @redux-saga/delay-p,,1
895,Merge pull request #1289 from jonhester/remove-error-wrapping,0.5457761,- issue with joiner not ending in cancelled state when joining cancelled task ,,0
896,Make sure to export the saga from sagas.js,0.59589386,"Starting from this release, you export the saga middleware itself and uses its run method",,0
897,Merge pull request #652 from yelouafi/put-resolve,0.47039217,1. put doesn't block waiting the returned promise to resolve,,0
898,lerna --parallel ignores build order,0.39990395,// mock fork result,docs(translate): Add Korean translation,0
899,Merge pull request #308 from tinybug/patch-1,0.48780796,A small patch with the following merges,,0
900,Merge pull request #479 from alexicum/master,0.4699418,- issue with joiner not ending in cancelled state when joining cancelled task ,Updated broken article link in docs,0
901,Merge pull request #251 from michaelsbradleyjr/react-15,0.49020094,Task cancellation support. Thanks to @aikoven for this one. (issue #14).,,0
902,Rewritten almost all tests (3 files left) so the internal proc API becomes hidden,0.52879554,"- removed some deprecated APIs - takeEvery, takeLatest, throttle from the redux-saga entry point (they are and were importable from redux-saga/effects), takem, put.sync and executing array of effects, there is explicit API for this for already some time - all effect",,0
903,Merge pull request #583 from yelouafi/fix/578,0.50626004,- Fix issues with Error handling,,0
904,Merge pull request #150 from abroz/patch-1,0.44373614,Task cancellation support. Thanks to @aikoven for this one. (issue #14).,This reverts commit efb6778653415d390ffc6882497984169f2abc19.,0
905,Merge pull request #1736 from redux-saga/add-typing-test-race-array,0.49956465,"- signature of join & cancel, they both accept now a single task descriptor or an array of those (previously they have accepted variadic length of arguments)",add backers & sponsors,0
906,clarification for eventchannel and another example,0.70907307,Support for Channels and Event channels,Add backers and sponsors to your readme automatically.  Add badges on top.  more info: https://github.com/opencollective/opencollective/wiki/Github-banner,1
907,Merge pull request #121 from wizardzloy/patch-1,0.44455194,"yield detach(takeEvery(ACTION_A, mightThrowSaga))",,0
908,Update example/shopping-cart,0.48503855,  storeIO(store),,0
909,added clarification in apply docs,0.68138695,- many docs improvements,,0
910,Now using else if,0.6257453,  while (true) {,,0
911,Merge pull request #798 from eks1985/master,0.45811674,- issue with joiner not ending in cancelled state when joining cancelled task ,,0
912,Merge pull request #130 from Gpx/patch-1,0.40558136,A small patch with the following merges,Added short descriptions for join(...tasks) and mixed array patterns,0
913,Added failing test for missed END in forked task (should be fixed by single stdChannel),0.6114135,- keeping single stdChannel in the internals allowed to fix 2 bugs with missed actions (see #707 and #1146),,0
914,Add test for delay effect,0.789011,- delay became an effect,Added support for mixed array of types and predicates while matching …,1
915,fixed sync tests,0.67755437,Fix Synchronous puts behaviors to be consistent with pre 0.10 releases,Support for passing array of task descriptors to the join effect creator,0
916,Merge pull request #596 from yelouafi/declarative-helpers,0.47879496,"- signature of join & cancel, they both accept now a single task descriptor or an array of those (previously they have accepted variadic length of arguments)",,0
917,added more docs on declarative effects,0.66244435,- many docs improvements,,0
918,Merge pull request #466 from y0za/fix-docs,0.51188487,- Fix issues with Error handling,,0
919,v1.0.1,0.5975677,  // No longer valid with 0.9.1,,0
920,Merge pull request #556 from alexaivars/patch-1,0.4917923,A small patch with the following merges,,0
921,Merge pull request #204 from ynohtna/master,0.4579963,Task cancellation support. Thanks to @aikoven for this one. (issue #14).,,0
922,Fixed npm audit reported issues,0.52701473,- Fix issues with Error handling,,0
923,Merge pull request #341 from nmalancea/doc-example-fix,0.51404166,- Fix issues with Error handling,Updated TS definition to include saga helpers in redux-saga/effects,0
924,Merge pull request #94 from gunar/master,0.46773762,- issue with joiner not ending in cancelled state when joining cancelled task ,,0
925,fix + updates,0.7783375,A patch release including some fixes,,1
926,fix blockquote style,0.39582407,"- removed#PUREannotations from the source code, adding them automatically with [annotate-pure-calls babel's plugin](https://github.com/Andarist/babel-plugin-annotate-pure-calls)",This was required to match library changes in version 0.14.,0
927,add warning,0.5066692,"#2068 586179c Thanks @mikabytes! - Added warnings when using take(channelOrPattern) incorrectly with more than one parameter. It helps to surface problem with take(ACTION_A, ACTION_B) being used instead of take([ACTION_A, ACTION_B]).",,0
928,Make Channel.put and Buffer.flush non-optional,0.75201124,- channel and actionChannel have default buffer of buffers.expanding(),check buffer correctness,1
929,Tweaked fsmIterator name passing + safeName function,0.47359928,"- new yield apply(context, fn, args) effect for calling function with this context  (issue #27)",,0
930,Add readme section to explain our choice to use generators (#1400),0.50503635,// resume the generator with mockAction,,0
931,added error message for undefined actions,0.6601999,Throw an Error if the Saga was provided an undefined action,,0
932,v1.0.0-rc.0,0.5789737,  // No longer valid with 0.9.1,,0
933,"Revert ""Allow to transform/filter actions sent to the Sagas""",0.63780266,"- Saga helpers (takeEvery, takeLatest, throttle) are now non blocking (thanks to @Andarist).",,0
934,remove isDev util,0.626636,Removed:,,0
935,Merge remote-tracking branch 'upstream/master' into delay-tweaks,0.47913224,- New scheduler to handle synchronous & deeply nested forks/puts (see #622),blocking/non-blocking effect. fix table and link in docs,0
936,Added Carbon Ads to sidebar,0.4080357,For background see #336,,0
937,added typescript definition,0.55442685,take effect supporting Symbol types again - thanks to @iMoses ,[TypeScript] Added actionDispatched to Monitor interface,0
938,renamed fork.detached to spawn,0.71985686,New fork model,[TypeScript] add root flag to monitor interface,1
939,Merge branch 'is-redux-action',0.533705,"This small update allows you to integrate better with some other redux libraries, like redux-actions and redux-act.",,0
940,Merge pull request #520 from neighborhood999/translation-tw,0.4190476,A small patch with the following merges,Code improvement in the beginner tutorial,0
941,added test for nested puts from #277,0.46217823,"test('getData', assert => {","Renamed takem to take.maybe for clarity, also it pairs up nicely with…",0
942,v1.0.3,0.6218202,Starting from this release,,0
943,update contributor info of @shinima,0.65878224,Many thanks once more to @restrry and @shinima who made it possible with their contributions.,,0
944,Addons section to External Resources doc,0.553301,"- Updated docs, added a section on channels",Reworked throttle test to be dependant on the custom mock clock isnte…,0
945,catch promise rejections from external Cancellations,0.6027225,- fix Rejected Promise does not throw inside Generators if rejected with an undefined error #283,,0
946,Merge pull request #728 from mcrawshaw/master,0.46200907,- issue with joiner not ending in cancelled state when joining cancelled task ,Pushed downwards the stack scheduling of dispatched actions to channe…,0
947,Hide useESModules config inside createConfig,0.51024485,createSagaMiddleware({,,0
948,Merge pull request #195 from hpurmann/fix_test_filename,0.4832111,- Fix issues with Error handling,Added a blocking / non-blocking cheatsheet to the API reference section of the docs.,0
949,Merge pull request #36 from thinkloop/patch-1,0.48539406,This patch fixes the createMockTask result to be conform to the API of Task object (see #182),,0
950,Create authorization-flow.md,0.4757451,fix #360 : added option logger to customize logging (see  API docs for createSagaMiddleware),Fixes CHANNEL_END public export (fixes #689),0
951,Preserving CNAME file when publishing docs,0.4438075,- many docs improvements,,0
952,Add pull request template (#1534),0.47148952,someModule.js,,0
953,example/async: update dependencies and webpack config,0.56985664,Updated dependencies [2cccf48]:,This reverts commit ca60600198c000003f7a6a6f26ac2ab12ef0e9ac.,0
954,Merge pull request #222 from coryhouse/patch-7,0.4485759,- issue with joiner not ending in cancelled state when joining cancelled task ,This reverts commit 80ffb8450b164bb50eabb84b37846a78b2470e79.,0
955,Added actionDispatched to Monitor interface per #609,0.6625891,- Monitor actions are also dispatched only in dev mode,Fix minor grammar errors in TaskCancellation.md,0
956,Removed --save option from npm install,0.59802866,Removed:,,0
957,"Added support for passing names of methods in string for call etc when passing context, i.e call([context, 'method'])",0.81204784,"- call([obj, 'method']) - now you can pass a string as method's name which should be called on the passed context",,1
958,Added declarative effect creators for helpers,0.60512435,- detach helper returns a new effect instead of mutating the input one,"Small documentation update that attempts to reduce confusion about the implementation of the saga helpers. They are no longer actually implemented as generators. However, my understanding is that the examples in the docs are meant more as higher level illustrations of how the saga helpers could be implemented.",0
