Index,Commit Message,Score,Correspond Changelog Sentence,Commit Description,Label
309,fix doc typo in ForkModel page,0.5218017,This patch fixes #118. The implementation of argument passing to forked tasks in takeEvery/takeLatest didn't match the specs in docs and examples,,0
310,Moved building umd files from the lint-staged task to the precommit itself,0.4485076,- task.done getter was changed to be task.toPromise method,,0
311,Updated babel deps,0.6165728,Updated dependencies [345b828]:,,0
312,Change ValidEffect to Effect in @redux-saga/types,0.65236175,@redux-saga/types@1.2.0,  @redux-saga/is: stricter check for is.pattern   tests: add test for error check when constructing action channels   Replace all process.env.NODE_ENV === 'development' to process.env.NODE_ENV !== 'production'   Fix failed tests ,0
313,Docs apply js highlighting,0.50142825,``` js,,0
314,Loosen type restriction on yielded values,0.5459889,    let { data } = yield take(types.GET_DATA),,0
315,"Docs: Fix low-level impl of takeEvery, takeLatest, and throttle",0.57823324,This patch fixes #118. The implementation of argument passing to forked tasks in takeEvery/takeLatest didn't match the specs in docs and examples,,0
316,add Symbol.iterator to results,0.6090822,take effect supporting Symbol types again - thanks to @iMoses ,  redux-saga/symbols: use String as symbols   babel-plugin: get rid of Symbol in code   babel-plugin: fix tests ,0
317,Fix anchor link to blocking / non-blocking,0.42745918,"- Saga helpers (takeEvery, takeLatest, throttle) are now non blocking (thanks to @Andarist).",  examples/sagaMonitor: format code   core: Remove asEffect; Add is.effect to test whether an object is an effect; Export effectTypes   core: Add ROOT as an effect type   examples/sagaMonitor: refactor sagaMonitor   examples/sagaMonitor: Add support for logging other types of effect   examples/sagaMonitor: add '@redux-saga/is' as dependency   effects: remove ROOT from effectTypes.js. Use string literal for ROOT effect type   examples/sagaMonitor: add Manager#childIdsMap for bookkeeping a map from parent-id to child-id-array   Add rootSagaStarted as a new monitor method   docs: Update doc about sagaMonitor.rootSagaStarted   fix monitoring tests ,0
318,add channel support,0.8026626,Support for Channels and Event channels,,1
319,Merge remote-tracking branch 'upstream/master' into feat/run-saga-middleware,0.5500702,// export the middleware,Issue#1478 retry,0
320,Update emitter typings,0.60498667,- revamped TS typings (thanks to @aikoven),,0
321,Merge pull request #442 from Baisang/doc-apply-fix,0.48013455,- Fix issues with Error handling,,0
322,"Update babel, rollup & babel-loader",0.5517601,Updated dependencies [345b828]:,,0
323,Update example/real-world,0.50026035,Changed:,"Remove doc for all(fork, fork, fork) pattern; Add explanation for difference between one big all effect and multiple fork effects; Add warning for nesting fork in all/race.",0
324,Add files entry in babel-plugin-redux-saga package.json,0.6563958,"- Added ""jsnext:main"" entry to package.json for ES2015 module import (PR #204)",,0
325,takeLatest parameter error should be more specific: Issue #1241 (#1284),0.66424453,- Fixes 'yield* takeEvery causing 'not a function' error'. (issue #197),,0
326,Update docs to avoid confusion over saga helper implementations,0.645542,sagaMiddleware.run(rootSaga),Refactored flatMap implementation,0
327,Merge pull request #599 from mjrussell/patch-1,0.45716083,#2270 d2579a2 Thanks @Methuselah96! - Inlined Redux Action type to fix compatibility with strict package managers.,,0
328,Fix potential stack overflow in scheduler,0.71234334,"- fixed internal scheduler and its recursive nature, now its trampolining and cannot cause stack's overflow, thanks to @pbadenski and @wilsaj",,1
329,Merge pull request #320 from billyjanitsch/cleanup-code,0.5028935,"- we are reusing @babel/runtime helpers, this has helped us to remove some bytes from our bundles",,0
330,fixed uglifying,0.46068454,- Fixed cancellable-counter example,,0
331,added cancel support,0.6971569,// now expect a cancel,,0
332,Added ignore list for gitbook cli,0.52321386,The documentation is now using GitBook thanks to @cef62,,0
333,FIX Vocab.,0.6585903,"},",Don't interpret effects returned from fork,0
334,marked overloaded put.sync TS typing as deprecated,0.8380543,- marked overloaded put.sync as deprecated,,1
335,Merge pull request #1408 from redux-saga/babel-plugin-relative-path-babel-6-fix,0.57823265,- babel-plugin-redux-saga - can be used to enhance stack traces of thrown errors,,0
336,Make the code examples a bit clearer,0.4704232,"- We have started to use babel@7-beta, hopefully it won't break anything. I've investigated differences between outputs and everything seems to be ok, but you never know ;) This should result in a little bit smaller and a little bit more performant code.",Refactor create task iterator,0
337,Merge branch 'failing-tests' into single-std-channel,0.50378114,- keeping single stdChannel in the internals allowed to fix 2 bugs with missed actions (see #707 and #1146),,0
338,added takeLeading typings (#1344),0.6285387,- typings fordetachgot added thanks to @aikoven ,,0
339,disable monitoring for non developement envs,0.61445975,"Monitor actions are no longer fired by default in dev mode. To activate monitoring, you'll have to pass the {sagaMonitor} option explicitly to the middleware factory. Also monitor events are now dispatched to the Saga monitor via direct method calls instead of dispatching actions to the Store. See repo examples for usage examples.",,0
340,remove sagastack and logError method,0.8000798,"- removed logError, use only onError option (it's signature is onError(error, { sagaStack }))",,1
341,fix other test fixtures for plugin,0.5508453,Updated dependencies [345b828]:,,0
342,"Finished ""任務取消（Task cancellation）"" chapter",0.58966416,Task cancellation support. Thanks to @aikoven for this one. (issue #14).,,0
343,Merge pull request #1892 from gilbsgilbs/generator-return-types,0.49708703,#2004 20f22a8 Thanks @gilbsgilbs! - A generic type has been added to the Task interface and that should be preferred over using a generic parameter in Task#result and Task#toPromise.,Remove support for join(...tasks) and cancel(...tasks),0
344,renamed status to cancelled,0.53647256,"Starting with this release; the check is no longer necessary. If you want to react to cancellations, you can do it inside finally block. A new effect cancelled() is provided to check if the Saga has been cancelled",,0
345,Added gitbook generated folder to git ignore list,0.5187452,The documentation is now using GitBook thanks to @cef62,,0
346,Clarify race behavior when one effect throws (#2234),0.48372155, emitter: emit => action => {,,0
347,Updated standalone builds,0.5485393,Updated dependencies [345b828]:,,0
348,Tweak README about polyfilling generators,0.5327316,// resume the generator with mockAction,,0
349,v0.3.3 (fix is.generator),0.5859496,A patch release fixing some issues,,0
350,docs: tweak RootSaga.md (#1611),0.6707251,import rootSaga from './sagas',,0
351,Use error stack only if it exists,0.5266264,Error handling,,0
352,fixed proc not ending on manual cancel,0.5692098,    // ensure this is not a Cancellation error before handling the error,,0
353,add codesandbox ttemplate for issues (#1486),0.5335015,This patch fixes synchronous errors handling (see #152 and #165),,0
354,Merge pull request #501 from Andarist/flush-effect,0.48868763,- detach helper returns a new effect instead of mutating the input one,,0
355,example/async: remove unused code,0.5468529,"- added dev warning about using async generators, they are not supported by redux-saga",,0
356,"Finished ""自動的取消（Automatic cancellation）"" subsection",0.6152589,Task cancellation support. Thanks to @aikoven for this one. (issue #14).,,0
357,Merge pull request #365 from scyclow/patch-1,0.46320763,A small patch with the following merges,,0
358,"Refactored runSaga in such a way that sagaMiddleware.run uses that now internally, so the latter can be treated as the former with partially applied second argument (storeInterface)",0.8212446,"- refactored runSaga API, runSaga(iterator, storeInterface) got depreacted in favor of runSaga(storeInterface, saga, ...args). It allowed us to leverage the change internally so now sagaMiddleware.run became partially applied runSaga, they wont now go out of sync (in the past changes and bug fixes had to implemented in both of them).",,1
359,fix #323 add common use-case for multiple async API request sagas,0.5293332,- createSagaMiddleware supports a new (optional) option: onError API docs to detect uncaught exceptions from Sagas (thanks to @secobarbital),,0
360,Update NonBlockingCalls.md,0.5308841,- optional cancel property on CpsCallback (thanks to @dannsam) ,,0
361,Begginer Tutorial: Fix wrong saga name in snippet,0.5253301,- Support for starting Sagas dynamically (issues #5 and #13),,0
362,Add root saga docs file. (#1487),0.6379953,sagaMiddleware.run(rootSaga),,0
363,v1.0.0,0.6078179,  // No longer valid with 0.9.1,,0
364,Add external link to article about redux-saga.,0.5806285,The path import for Effects has changed from redux-saga to redux-saga/effects,,0
365,babel-plugin: visit saga as expression,0.66120315,allowing sagaMonitor to be used in react-native (thanks to @benhughes),,0
366,fix typos in documentation (#1992),0.54149824,- Fix issues with Error handling,,0
367,Merge pull request #140 from yelouafi/no-getState,0.46348488,- issue with joiner not ending in cancelled state when joining cancelled task ,,0
368,Translation 70% done,0.36130708,Also - finally the build for rollup should be fixed (public export of CHANNEL_END got fixed).,,0
369,Update DeclarativeEffects.md,0.5844747,- many docs improvements,Update examples (upgrade react/webpack version),0
370,Remove support for join(...tasks) and cancel(...tasks),0.7117178,- implemented cancel(...tasks) in similar manner ,,1
371,Merge pull request #693 from granmoe/docs-blocking-non-blocking,0.40618014,- createSagaMiddleware supports a new (optional) option: onError API docs to detect uncaught exceptions from Sagas (thanks to @secobarbital),Use import * as React from 'react',0
372,Update docs replacing getState with select,0.63165927,- yield getState() same as select but retrieves the entire state (Api docs),,0
373,BeginnerTutorial.md: Include full render method,0.54768366,createSagaMiddleware({,Refactor join and cancel (#1515),0
374,reworked docs structure,0.76060677,- many docs improvements,,1
375,added array support,0.46531457,- exported util of arrayOfDeffered got renamed to the correct arrayOfDeferred,,0
376,add select/getState support,0.69811094,"  getState: ...,",,0
377,remove unused variable,0.61247456,Removed:,,0
378,update lock,0.48759586,A patch release including some fixes,,0
379,remove custom error wrapping,0.4830312,"- removed redux-saga/utils entirely, move of those are moved to separate packages",,0
380,"Rename mainTask.isRunning to mainTask._isRunning, rename mainTask.isCancelled to mainTask._isCancelled",0.4741917,This patch fixes the createMockTask result to be conform to the API of Task object (see #182),,0
381,fixed issue with arg passing to forked tasks,0.6567353,This patch fixes #118. The implementation of argument passing to forked tasks in takeEvery/takeLatest didn't match the specs in docs and examples,,0
382,Docs: Add missing race import,0.49417907,import configureStore from './configureStore ',,0
383,Merge pull request #129 from iamakulov/patch-1,0.4676087,"yield detach(takeEvery(ACTION_A, mightThrowSaga))",,0
384,0.4.0,0.5855967,Updated dependencies [2cccf48]:,,0
385,Slight refactoring of the effectMiddlewares feature and its tests,0.77577907,"- effectMiddlewares - useful especially for testing, you can intercept/hijack any effect and resolve it on your own - passing it very redux-style to the next middleware (last being redux-saga itself). How it might be used can be checked here. Many thanks to @eloytoro for this feature",,1
386,Merge pull request #1 from yeerkkiller1/put-typings,0.49468446,- issue with joiner not ending in cancelled state when joining cancelled task ,,0
387,"fix ""edit this page"" links",0.45069116,Just a small patch version with:,,0
388,Discovered a flaw and updated all images,0.5231914,A patch release fixing some issues,,0
389,updated docs,0.85732627,- many docs improvements,,1
390,Fix: Spelling mistake,0.43887365,- Fix issues with Error handling,,0
391,Api.storeItem missed in last sample,0.5189514,  storeIO(store),,0
392,exports delay fom the root,0.56518245,- delay function (not effect!) should be imported from @redux-saga/delay-p,,0
393,Fix call and put outputs in docs,0.5653388,- many docs improvements,,0
394,Merge pull request #345 from joemcelroy/patch-1,0.461192,- issue with joiner not ending in cancelled state when joining cancelled task ,,0
395,Merge pull request #536 from romseguy/patch-1,0.46821392,- issue with joiner not ending in cancelled state when joining cancelled task ,,0
396,"yield [] should return immediately an empty array instead of blocking forever, like Promise.all([]) did",0.6823256,Include fix #71 'yield [] should return immediately an empty array instead of blocking forever' (thanks to @slorber ) ,"  deps: update babel to latest version   babel-config: decoratorsLegacy=true to @babel/stage-2; rename .babelrc.js to babel.config.js   update package-lock.json   Fix .lintstagerc. Update fixtures   Update babel-plugin-annotate-pure-calls to ^0.3.0   Remove @babel/preset-stage-2, add @babel/plugin-proposal-object-rest-spread   Update babel.config.js ",0
397,Replace setTimeout call with 2-args version,0.52928257,"- changed API of runSaga  - it no longer accepts subscribe option, you should create a channel (preferably stdChannel), pass it as channel argument to the runSaga API and communicate with through it with take and put methods","  Issue #1241   Check worker at takeLates, takeEvery and throttle   move validation to io.js   Merge branch 'master' of https://github.com/redux-saga/redux-saga   Conflicts: packages/core/src/internal/io.js  Merge branch 'master' of https://github.com/redux-saga/redux-saga  Conflicts: packages/core/src/internal/io.js  revert package-lock",0
398,latest builds,0.68496585,New features:,  put.resolve --> putResolve   move helpers under effect part   add debounce   update take.maybe --> takeMaybe ,0
399,cancel forks on error,0.69096065,- Fixes issues of taking puts nested inside a fork call (forked child puts before fork Effect returns) #277,,0
400,Remove redundant test and fix typos in test files (#1474),0.48826876,- fix #298 Long error messages should be cut in production,  setup eslint for react; add examples/ in .lintstagedrc   update npm lock file ,0
401,update UsingSagaHelpers doc style and wording,0.60228634,createSagaMiddleware({,  Add test for passing thrown error in onError   remove excessive test case ,0
402,0.16.0,0.5648536,  // No longer valid with 0.9.1,,0
403,Merge pull request #1265 from jaimemendozadev/master,0.50799173,#2270 d2579a2 Thanks @Methuselah96! - Inlined Redux Action type to fix compatibility with strict package managers.,  doc: eventChannel emitting errors   test: Add test for saga taking from and eventChannel ,0
404,Removed dep on restrry's babel plugin repository,0.6277505,"- removed#PUREannotations from the source code, adding them automatically with [annotate-pure-calls babel's plugin](https://github.com/Andarist/babel-plugin-annotate-pure-calls)","  Removing mentions of .done and replacing with .toPromise()   Changing back toPromise to done   This .done was the iterator flag, not a task  Changing back other toPromise back to done  I guess this one is also an iterator, and also noticed a typo above",0
405,export cancellation related types,0.6431385,export default function configureStore(initialState) {,  core: finish race on END. change tests   core: finish race on END. change implementation   Remove isEnd check in shouldComplete ,0
406,Modify publication script to use gh-pages package,0.42011863,The documentation is now using GitBook thanks to @cef62,remove unused iterator reference,0
407,add home page example usage,0.38231525,Example usage:,,0
408,Merge pull request #517 from rauliyohmc/callEffect-api-docs-enhancement,0.49975687,- createSagaMiddleware supports a new (optional) option: onError API docs to detect uncaught exceptions from Sagas (thanks to @secobarbital),issue# 1500: pin beta version until stable release,0
409,Create README.md,0.5174092,createSagaMiddleware({,,0
410,fixed messages in unit tests,0.48418504,"- cloneableGenerator utils, which can ease ur unit testing when logic branching is needed, thanks to @nihaux ",,0
411,simplify generator stepper code,0.5516412,"    reducer,",remove unused variable,0
412,Merge pull request #487 from andresmijares/docs,0.50806063,A small patch with the following merges,,0
413,fixed examples hot reload method. v2,0.4978992,- Fixed cancellable-counter example,,0
414,Merge pull request #3 from quicksnap/patch-1,0.47650242,A small patch with the following merges,,0
415,Merge pull request #709 from yelouafi/take.maybe,0.48266032,Task cancellation support. Thanks to @aikoven for this one. (issue #14).,"  Change effect structure to { [IO]: true, type, payload }   Edit effects.d.ts to reflect the new effect structure   Remove asEffect in proc   Remove unnecessary return statement; Turn off no-extra-semi rule in ESLint. ",0
416,Use properties of task to track the task running status.,0.5486605,  let task,,0
417,Update to TS 3.6.,0.7041826,- TS typings got revamped - they require TS@>3.1 now,,1
418,more informative error when passed a non func arg,0.4852193,take will now throw an error if provided with an argument and that argument is undefined. (see #35.  thanks @tgriesser) ,,0
419,Merge pull request #621 from pvnr0082t/add-badge,0.49941593,#2324 2466c79 Thanks @neurosnap! - Add LICENSE file,  Remove unused function updateIncentive; Change mockTask.running to mockTask._isRunning   core: Introducing saga env.   core: Move logError definition from proc() to runSaga()   core: Refactor proc() signature   internal: Make env as the first arg of proc(); Add check for onError; Rename env.channel to env.stdChannel   internal: Use env.finalizeRunEffect to simplify implementation of digestEffect. (#1481) ,0
420,Fixed the docs for basics/DeclarativeEffects,0.66521674,- many docs improvements,,0
421,Build esmodules bundle properly,0.58168066,- Fix issue with ES build (thanks @Andarist),  add tests for helpers finished with END   remove unused termination condition ,0
422,"Reword many docs sentences mentioning something is ""easy"" (i.e. use ""basic"") (#1465)",0.48190165,Example usage:,Use properties of task to track the task running status. Unify mainTask._isRunning and mainTask._isCancelled.,0
423,Fixed test,0.5976954,"test('getData', assert => {",,0
424,Import apply from redux-saga/effects in ex.,0.85027206,import { takeEvery } from 'redux-saga/effects',  core: clean up channel end   core: fix naming   fix lintstaged   core: use TERMINATE symol as result of iteration   core: change naming for status predicate ,1
425,Inlined Redux Action type to fix compatibility with strict package managers (#2270),0.86489445,#2270 d2579a2 Thanks @Methuselah96! - Inlined Redux Action type to fix compatibility with strict package managers.,  Remove redundant test; fix test names   Fix typos in test files ,1
426,edited docs comments,0.63976955,- many docs improvements,,0
427,Merge pull request #2017 from manonthemat/docs,0.41907942,#2270 d2579a2 Thanks @Methuselah96! - Inlined Redux Action type to fix compatibility with strict package managers.,,0
428,Boring typos,0.50850266,TS Typings,,0
429,Merge pull request #1300 from sunyongjian/patch-1,0.43982393,Task cancellation support. Thanks to @aikoven for this one. (issue #14).,Debounce helper,0
430,Added effectMiddlewares test for nested sagas,0.6905352,"- effectMiddlewares - useful especially for testing, you can intercept/hijack any effect and resolve it on your own - passing it very redux-style to the next middleware (last being redux-saga itself). How it might be used can be checked here. Many thanks to @eloytoro for this feature",,0
431,Merge pull request #44 from paul42/patch-1,0.4651068,A small patch with the following merges,,0
432,Merge branch 'add-codesanbox-examples',0.51329505,"- signature of join & cancel, they both accept now a single task descriptor or an array of those (previously they have accepted variadic length of arguments)",,0
433,Prevent cancellation of ended joined tasks,0.7539855,- issue with joiner not ending in cancelled state when joining cancelled task ,,1
434,Fixed undefined variable error in effectCancelled.,0.5897671,Error handling,,0
435,Fix property name in beginner tutorial example,0.4794389,"    initialState,",,0
436,fixed typo,0.48695236,  } catch(error) {,,0
437,Added main gitbook manifesto files,0.649894,The documentation is now using GitBook thanks to @cef62,chore: npm doesnt support node 10,0
438,migrate examples to webpack,0.81547236,Also migrated examples to webpack. All build infrastructure use webpack,,1
439,improved throttle example to handle trailing actions,0.49979177,"- added TS typings for helpers' effect creators from the redux-saga/effects, that means takeEvery, takeLatest, throttle (thanks to @mcrawshaw)",,0
440,babel-plugin: refactoring with babel-template,0.6746629,"- removed#PUREannotations from the source code, adding them automatically with [annotate-pure-calls babel's plugin](https://github.com/Andarist/babel-plugin-annotate-pure-calls)",  Removes a lot of implications that redux-sagas is simple to grasp Renames some instances of the word 'simple' to 'basic'   Don't change non-documentation files ,0
441,TypeScript: support predicates with guards and stringable action creators to infer action type in takeEvery etc.,0.61932206,"- take(array) - array can be now of mixed types - strings and predicate functions so this is possible now yield take(['ACTION_A', ac => ac.payload])",Change mainTask.isMainRunning to mainTask.isRunning.,0
442,delete global Store variable,0.53881174,Removed deprecated getState argument passed to Sagas. You can use the select Effect to get the store state, changed project structure to fix circular dependency moved functions dependent on 'sagaHelpers' imports to a separate file  added second export to 'effects' for new file/functions   renamed helpers file   updated path to match name change ,0
443,Move delay back to src/internal/utils,0.6196047,"- delay became an effect, you still can import delay util from redux-saga/utils though",,0
444,Merge pull request #226 from coryhouse/patch-10,0.45971376,- issue with joiner not ending in cancelled state when joining cancelled task ,add the missed  buffers.sliding(1),0
445,Fixed counter example,0.6715419,- Fixed cancellable-counter example,  core: renaming in fms   switch fms from tuple to object ,0
446,v1.0.0-beta.3,0.70709085,This is first (and very likely last 😉) release candidate version 🎉. We expect no more breaking changes before releasing stable v1 (truth to be told there were not many breaking changes during whole beta process - the API is mostly the same).,,1
447,github URL,0.54756564,The documentation is now using GitBook thanks to @cef62,  core: create test for retry helper   core: refactor fmsIterator   core: add retry helper   core typings: add typings for retry helper   core: retry helper. address comments ,0
448,0.2.2,0.56464565,@redux-saga/core@1.2.0,  update to latest lerna version;   run CI for 2 node LTS versions ,0
449,Merge pull request #97 from DjebbZ/patch-3,0.44012827,#2270 d2579a2 Thanks @Methuselah96! - Inlined Redux Action type to fix compatibility with strict package managers.,"  Adding summaries and examples of useful testing libraries.   Added info about effectMiddleware   Add period   Fix name   Fix grammar, phrasing. ",0
450,Merge pull request #1568 from redux-saga/remvoe-deprecated-join-cancel-form,0.538936,import { detach } from 'redux-saga',,0
451,Merge pull request #453 from neighborhood999/patch-1,0.44338912,A small patch with the following merges,,0
452,Merge pull request #704 from CarsonF/bugfix/types-monitor,0.4840808,This patch fixes synchronous errors handling (see #152 and #165),,0
453,Merge pull request #588 from dooart/master,0.47568637,- issue with joiner not ending in cancelled state when joining cancelled task ,,0
454,Updated docs links,0.7381699,- many docs improvements,Update ForkModel.md,1
455,Fix typo in RacingEffects.md,0.51204216,- Fix issues with Error handling,,0
456,Added a blocking / non-blocking cheatsheet to the API reference section of the docs.,0.5451006,- many docs improvements,  babel-plugin: update readme   update real-world example   address comments ,0
457,Fix minor grammar errors in TaskCancellation.md,0.5381961,- Fix issues with Error handling,,0
458,Add another article,0.5816346,  },,0
459,Unified error logs in proc.js,0.7029495,- unified internally error logging,  Fixed location of the delay function in the beginner tutorial   Delay function   Fixed format ,1
460,Add example test with createMockTask,0.6829046,  const mockTask = createMockTask(),Safely Handle Various Arguments in Calls to Promise.reject(),0
461,Merge pull request #1909 from gabormagyari/master,0.47637016,Task cancellation support. Thanks to @aikoven for this one. (issue #14).,"This handles situations where, for example, a promise's reject() callback is called with a string or undefined. Before, an undefined error would cause all sagas to stop working",0
462,channel support,0.86821055,Support for Channels and Event channels,Add redux-saga-requests to addons in docs,1
463,examples/cancellable-counter/src/sagas/index.js,0.5213482,```js,,0
