Index,Commit Message,Score,Correspond Changelog Sentence,Commit Description,Label
1282,fix several typos,0.56059116,- Fix issues with Error handling,Fixed undefined variable error in effectCancelled in sagaMonitor.,0
1283,Refactor effect inspection utils (#1555),0.6604894,"- removed asEffect, effect types are public, effect shapes are stable, so if for whatever reason you want to do some effect inspection you can just check them without us providing additional helpers for it",,0
1284,some pretty printing,0.5044854,  },,0
1285,Merge pull request #1803 from redux-saga/fix-put-test,0.5923372,"Let's face it. Errors coming from redux-saga were unreadable and made finding a root cause of the problem really difficult. We really want to improve this situation and with this release (thanks to @restrry's amazing contribution) we start to log ""saga stacks"" along with original errors. This works similar to what React already does with its ""component stacks"". Just look at this one:",Enhanced sagaMonitor to work in Node environment.,0
1286,Fix Markdown for Gitbook,0.59560394,The documentation is now using GitBook thanks to @cef62,Update Channels.md,0
1287,Fix swapped words (#1948),0.5081146,Changed:," In Node environment, filtered out the console CSS styles %c and object output %O that aren't supported by the Node console. Added poor man's console.group and console.groupEnd that are missing from the Node console without a polyfill. Added fallback for performance.now() that is missing from the Node environment. Do not export to window unless it's available. Added verbose output that can show low-level calls (disabled by default, some setter should be added to change the value in runtime). Added export of the snapshot-logging function for use from external code.",0
1288,drop unused SAGA_ITERATOR symbol,0.6062216,"runSaga(iterator, {",,0
1289,add import statements to some glossary examples,0.5401648,"import {  take, put, call, ... } from 'redux-saga/effects'",Added missing line for Api token storage in docs. Fixes #300.,0
1290,Fixed an issue with arguments that exceed the maximum value for the internally-used setTimeout (#2293),0.8884803,#2293 2d2214e Thanks @neurosnap! - Fixed an issue with arguments that exceed the maximum value for the internally-used setTimeout. Previously it could overflow based on the input that was too big and thus a timeout could resolve immediately.,docs: typo,1
1291,Merge pull request #1795 from aikoven/fix-take-typings,0.5425309,- issue with joiner not ending in cancelled state when joining cancelled task ,,0
1292,Use task.root to track whether a task is a root task or a detached task. (#1637),0.5277079,  let task,,0
1293,Fix typo middlware -> middleware. (#2066),0.6573684,"    applyMiddleware(/ other middleware, / sagaMiddleware)",,0
1294,dropped getState() in favor of select(),0.72086585,"  getState: ...,",log error for check,1
1295,429 V8 bug when return to yield*ed saga helper,0.8940791,- fix V8 issue when yield*ing saga helpers,,1
1296,Fixed a missing parenthesis in a doc (#2281),0.48442432,This patch removes all Symbol references from the source code. Some reported issues were related to buggy/incomplete/absent Symbol support which caused subtle and hard to track bugs on  the source code.,fix typo,0
1297,Merge pull request #1773 from bwyap/fix-testing-docs-example,0.5030186,- Fix issues with Error handling,,0
1298,Running build scripts in parallel,0.55298924,"It's now possible to have parallel takes (yield [take(...), take(...)]",,0
1299,Fix funding.url in redux-saga package.json (#2010),0.52253795,"- got us https://redux-saga.js.org/ domain, thanks to @baldwmic",,0
1300,restore middleware startup,0.5595536,"    applyMiddleware(/ other middleware, /createSagaMiddleware(...startupSagas ))",,0
1301,Add html-webpack-plugin module in package.json,0.70176864,"- Added ""jsnext:main"" entry to package.json for ES2015 module import (PR #204)",,1
1302,removed semi-colons from code blocks in Tutorial,0.4902503,This patch removes all Symbol references from the source code. Some reported issues were related to buggy/incomplete/absent Symbol support which caused subtle and hard to track bugs on  the source code.,Fix typo,0
1303,Merge pull request #454 from pke/patch-2,0.4252388,A small patch with the following merges,,0
1304,Code improvement in the beginner tutorial (#711),0.49988434,"- We have started to use babel@7-beta, hopefully it won't break anything. I've investigated differences between outputs and everything seems to be ok, but you never know ;) This should result in a little bit smaller and a little bit more performant code.",Rename .eslintrc (deprecated) to .eslintrc.json,0
1305,remove extraneous space,0.54979473,Removed:,Clean up docs style,0
1306,Merge pull request #115 from RainerAtSpirit/fixTypos,0.4953024,This patch fixes the createMockTask result to be conform to the API of Task object (see #182),,0
1307,add error docs and example,0.6174828,Error handling,,0
1308,added TODO remainders,0.5001236,A small patch with the following merges,,0
1309,Replace npmcdn.com with unpkg.com,0.3998742,- Browser build is now on cdnjs (thanks to @ian4hu & @pvnr0082t) ,,0
1310,Merge pull request #363 from jscinoz/master,0.4771894,- issue with joiner not ending in cancelled state when joining cancelled task ,,0
1311,fixes #875,0.6775092,A patch release fixing some issues,,0
1312,Bootstrap without running npm scripts,0.43032765,import { createMockTask } from 'redux-saga/lib/testUtils',,0
1313,0.15.4,0.5034555,For more background see the explanation on this issue. This release should fixe #50 and #55,,0
1314,Add HelperFunc types,0.5932784,The release adds 2 helper functions takeEvery and takeLatest to handle the common case concurrency scenarios,,0
1315,Merge pull request #1717 from TimvdLippe/browser-esm-bundle,0.4764833,- got redux-saga/effects and redux-saga/utils working properly for webpack2 and rollup users (or any other bundle which recognizes jsnext:main/module entry). Thanks to @Ephys. How was it achieved can be seen here. Neat trick which I think is not publicly known and it was an issue for quite some time and also allowed me to help fixing this in some other libraries.,,0
1316,switched to no-promise version of proc,0.4548636,"This restores the pre 0.10 behavior for handling puts whose result is a Promise (i.e. dispatch an action which will be handled by a middleware and returns a Promise). In pre 0.10 releases, the put doesn't wait for the returned promise to resolve; ",Only check eventChannel matcher if defined,0
1317,fixed main entry in package.json,0.7847004,"- Added ""jsnext:main"" entry to package.json for ES2015 module import (PR #204)",Fixed the docs for basics/DeclarativeEffects,1
1318,added io argument,0.48928106,- typings fordetachgot added thanks to @aikoven ,,0
1319,Remove some more GitBook leftovers,0.5240629,Removed:,Fix mistake in Error Handling part of docs issue: #278,0
1320,export effects,0.51622826,// export the middleware,,0
1321,Version Packages (#2325),0.6213044,Updated dependencies [2466c79]:,Fixed title of spawn with context,0
1322,Merge pull request #2159 from acdvs/docusaurus,0.45100528,- createSagaMiddleware supports a new (optional) option: onError API docs to detect uncaught exceptions from Sagas (thanks to @secobarbital),Match buffer names in documentation.,0
1323,Merge pull request #1920 from slorber/patch-1,0.45959905,Include fix #71 'yield [] should return immediately an empty array instead of blocking forever' (thanks to @slorber ) ,,0
1324,added server side rendering using END support,0.5408485,Middleware API,"The eventChannel function was enforcing the matcher function when passed 2 arguments, even though the function supports no matcher in any case.",0
1325,Merge pull request #352 from jonboiser/master,0.4711062,- issue with joiner not ending in cancelled state when joining cancelled task ,https://github.com/yelouafi/redux-saga/tree/master/docs/api#buffers,0
1326,Fix code example bug in Beginner Tutorial,0.52945876,- Fix issues with Error handling,,0
1327,Add link to egghead videos in external resources,0.3690278,- Browser build is now on cdnjs (thanks to @ian4hu & @pvnr0082t) ,,0
1328,support task manual + auto saga cancellation (thanks to @aikoven),0.7139833,Task cancellation support. Thanks to @aikoven for this one. (issue #14).,,1
1329,check undefined argument in io.take,0.6215786,take will now throw an error if provided with an argument and that argument is undefined. (see #35.  thanks @tgriesser) ,,0
1330,upgraded to 0.10,0.49103558,"This is rather a smaller release, but some things have changed or got improved.",,0
1331,rebuild examples with inline source maps,0.45356455,Also migrated examples to webpack. All build infrastructure use webpack,,0
1332,cancellation using Never abstraction,0.7309551,       // logic proper to cancellation,,1
1333,Fixed typo (#2136),0.63480127,- fix #287 weird error stack trace and error printing,,0
1334,Add immediately in scheduler.js (#1641),0.5036067,configureStore.js,,0
1335,Merge pull request #1627 from redux-saga/pkg/contributors,0.48574078,- got redux-saga/effects and redux-saga/utils working properly for webpack2 and rollup users (or any other bundle which recognizes jsnext:main/module entry). Thanks to @Ephys. How was it achieved can be seen here. Neat trick which I think is not publicly known and it was an issue for quite some time and also allowed me to help fixing this in some other libraries.,,0
1336,Merge pull request #386 from chentsulin/patch-3,0.49526012,A small patch with the following merges,,0
1337,TypeScript: add delay effect,0.5954952,- dev warning for using delay effect incorrectly,,0
1338,TypeScript: update typings for channels,0.596222,#2296 612cae8 Thanks @lourd! - Updates Channel type to eliminate void-emitting pitfall,,0
1339,Add link for new article,0.49500254,New:,,0
1340,add integration tests for babel plugin,0.5135084,import test from 'tape';,,0
1341,chore: npm doesnt support node 10,0.5873171,"- redux@4 got in supported range (this will let npm dedupe redux in node_modules, keep in mind though that we only depend on compose from that package)",,0
1342,Merge pull request #87 from romseguy/monitor-check-env,0.49025777,- got redux-saga/effects and redux-saga/utils working properly for webpack2 and rollup users (or any other bundle which recognizes jsnext:main/module entry). Thanks to @Ephys. How was it achieved can be seen here. Neat trick which I think is not publicly known and it was an issue for quite some time and also allowed me to help fixing this in some other libraries.,,0
1343,recursively call runEffect if middleware returns something different,0.6291734,"- fix #316 Compare END action by string type, not by reference, to allow middleware-transformed actions",,0
1344,Merge pull request #725 from redux-saga/matchers-mixed-array,0.50343853,"- signature of join & cancel, they both accept now a single task descriptor or an array of those (previously they have accepted variadic length of arguments)",,0
1345,Use trailing comma for all files,0.28936273,You can even enhance those stacks with file names and line numbers by using in development our new babel-plugin-redux-saga (also thanks to @restrry). Let us know if there are any issues with this or if we can make them even more useful!,,0
1346,Removed special sagaHelpers treatment when running effects,0.6304087,"It's no longer possible to start the Sagas in the applyMiddleware phase. Starting from this version Sagas must be started using the sagaMiddleware.run(saga, ...args) method. For a background see #235",,0
1347,Update README_ru.md,0.45608968,"Let's face it. Errors coming from redux-saga were unreadable and made finding a root cause of the problem really difficult. We really want to improve this situation and with this release (thanks to @restrry's amazing contribution) we start to log ""saga stacks"" along with original errors. This works similar to what React already does with its ""component stacks"". Just look at this one:",,0
1348,fixed lint issue,0.5227566,- Fix issues with Error handling,,0
1349,Fix saga monitor imports in real world example,0.6997434,"+ sagaMonitor: monitor,",Punctuation additions to readme,0
1350,Fixed comment in Glossary which indicated wrongfully that put is a blocking effect (fixes #626) (#653),0.50156444,"#2068 586179c Thanks @mikabytes! - Added warnings when using take(channelOrPattern) incorrectly with more than one parameter. It helps to surface problem with take(ACTION_A, ACTION_B) being used instead of take([ACTION_A, ACTION_B]).",,0
1351,Add typing for cancel(...tasks),0.8007809,- implemented cancel(...tasks) in similar manner ,,1
1352,Add missing yield,0.59850466,yield take(increment),,0
1353,Clean up docs style,0.70455813,- many docs improvements,,1
1354,Fix a few more typos in internal/proc.js,0.4471127,- Fix issues with Error handling,,0
1355,Ensure that tests do not run in parallel to workaround dtslint issues (#2282),0.58314395,- keeping single stdChannel in the internals allowed to fix 2 bugs with missed actions (see #707 and #1146),,0
1356,Merge branch 'babel-plugin-pure-calls',0.50964195,"- removed#PUREannotations from the source code, adding them automatically with [annotate-pure-calls babel's plugin](https://github.com/Andarist/babel-plugin-annotate-pure-calls)",,0
1357,Fixed unsubscribe and close ordering in eventChannel,0.7012371,"- fixed issue with eventChannels not closing automatically upon emitting END, thanks to @baldwmic",,1
1358,Use error.stack for logging,0.72821146,- unified internally error logging,,1
1359,Made Andarist's changes,0.6376327,Changed:,,0
1360,Added new effect - flush. It can be used to clear channel from buffered items and geting them back in a batch in the saga. (closes #481),0.56145406,"Starting with this release; the check is no longer necessary. If you want to react to cancellations, you can do it inside finally block. A new effect cancelled() is provided to check if the Saga has been cancelled",,0
1361,include dist in order to run vanilla examples,0.4925355,diff,,0
1362,remove unused iterator reference;,0.4955385,So SagaCancellationException class and isCancelError function were removed.,Changing case in import to match path of Counter,0
1363,Add LICENSE files (#2324),0.82834363,#2324 2466c79 Thanks @neurosnap! - Add LICENSE file,,1
1364,update advanced testing doc to use runSaga toPromise function (#1771),0.54008824,"runSaga(iterator, {",,0
1365,adding a title to the gitbook,0.617396,The documentation is now using GitBook thanks to @cef62,,0
1366,grammar,0.5974493,"},",,0
1367,Added contributor info to all package.json files,0.65402824,"#2308 8207e33 Thanks @Andarist, @neurosnap! - exports field has been added to the package.json manifest. It limits what files can be imported from a package but we've tried our best to allow importing all the files that were considered to be a part of the public API.",,0
1368,Merge pull request #42 from mz026/add-budo-dev-dependencies,0.5253441,"Updated dependencies [bed4458, 612cae8, 20f22a8, d2579a2]:",,0
1369,removed doubled the,0.6589271,Removed:,,0
1370,Merge pull request #96 from DjebbZ/patch-2,0.46580726,- got redux-saga/effects and redux-saga/utils working properly for webpack2 and rollup users (or any other bundle which recognizes jsnext:main/module entry). Thanks to @Ephys. How was it achieved can be seen here. Neat trick which I think is not publicly known and it was an issue for quite some time and also allowed me to help fixing this in some other libraries.,,0
1371,0.12.1,0.6687025,  },,0
1372,Update runSaga docs descriptions,0.63944185,- many docs improvements,,0
1373,added docs for select and getState effect,0.7006573,- yield getState() same as select but retrieves the entire state (Api docs),Docs typo,1
1374,export apply,0.666537,// export the middleware,,0
1375,Use a proxy cjs file to require dev & prod bundles conditionally as process.env lookups are costly in node,0.6850682,- CommonJS entries are proxied now. This means that process.env.NODE_ENV is read only once and based on that value the appropriate bundle (development or production) is loaded conditionally with require. process.env is slow in node.js so this should improve performance a little bit.,,0
1376,Merge pull request #685 from kuy/trans-ja-b5f341,0.4334864,Task cancellation support. Thanks to @aikoven for this one. (issue #14).,,0
1377,Document Iterable TypeScript dependency.,0.5264064,take effect supporting Symbol types again - thanks to @iMoses ,,0
1378,add missing package in real-world example,0.5285239,#2270 d2579a2 Thanks @Methuselah96! - Inlined Redux Action type to fix compatibility with strict package managers.,,0
1379,Add multicastChannel documentation (#2250),0.7019352,"- support for yield take(multicastChannel, pattern)",,1
1380,Update FutureActions.md (#1210),0.56816995,"Updated dependencies [bed4458, 612cae8, 20f22a8, d2579a2]:",,0
1381,Build umd with rollup,0.59420556,"- got us a rolluped UMD build, which is way smaller than the one which was produced by a webpack, thanks to the so called 'flat-bundling'",,0
1382,Merge pull request #541 from Emetrop/patch-1,0.44447914,- got redux-saga/effects and redux-saga/utils working properly for webpack2 and rollup users (or any other bundle which recognizes jsnext:main/module entry). Thanks to @Ephys. How was it achieved can be seen here. Neat trick which I think is not publicly known and it was an issue for quite some time and also allowed me to help fixing this in some other libraries.,,0
1383,Merge pull request #135 from jjbohn/jb-beginnger-tutorial-tweak,0.4817306,- issue with joiner not ending in cancelled state when joining cancelled task ,,0
1384,simplify struct,0.57294095,"    reducer,",,0
1385,first release,0.806356,Starting from this release,,1
1386,still trying to get bundlesize to run without errors,0.5088472,"- we are reusing @babel/runtime helpers, this has helped us to remove some bytes from our bundles",,0
1387,Remove reference to unused import (#659),0.6222506,import { detach } from 'redux-saga',bump deps,0
1388,Merge pull request #1639 from retyui/Issue#1638,0.45584655,Task cancellation support. Thanks to @aikoven for this one. (issue #14).,,0
1389,fix #287 weird error stack trace and error printing,0.9972238,- fix #287 weird error stack trace and error printing,,1
1390,1,0.7245927,  },,1
1391,Merge pull request #751 from zech/zech-pr-rollupjsdoc-1,0.4217406,- marked overloaded put.sync as deprecated,,0
1392,Fixed missing yields in Sequancing Sagas example (fixes #499),0.5908964,- fix V8 issue when yield*ing saga helpers,,0
1393,Merge pull request #95 from DjebbZ/patch-1,0.4305359,- issue with joiner not ending in cancelled state when joining cancelled task ,Remove empty line,0
1394,Merge pull request #348 from kolarpavel/doc-typo,0.41198468,A small patch with the following merges,,0
1395,Remove typings-tester,0.58842605,TS Typings,Update docs,0
1396,Add recipe for retrying XHRs,0.43880844,To create detached forks which follow the old model. You can use the new effect spawn.,Fix Api.clearItem/Api.storeItem usages,0
1397,forgot to add built output,0.47140387,#2297 fdca798 Thanks @lourd! - Adds missing isAborted method to mock task and deprecates its setRunning method,,0
1398,Merge pull request #41 from tomtangrx/master,0.51559937,- issue with joiner not ending in cancelled state when joining cancelled task ,,0
1399,Do not swallow errors when executing put effect (closes #632),0.67056286,"- errors thrown during put execution are no longer caught and swallowed, you need to catch them manually",,0
1400,Merge pull request #733 from thezanke/master,0.48567104,- issue with joiner not ending in cancelled state when joining cancelled task ,,0
1401,Merge pull request #257 from ajwhite/docs-typo,0.43695217,A small patch with the following merges,,0
1402,Merge pull request #1875 from ethan-marsh/root-saga-patterns-docs,0.53044,A small patch with the following merges,,0
1403,Merge pull request #18 from yched/patch-1,0.43660226,"yield detach(takeEvery(ACTION_A, mightThrowSaga))",,0
1404,correct option name sagaMonitor instead of monitor,0.8250656,"+ sagaMonitor: monitor,",Fixed broken link,1
1405,Fix typo,0.5174011,- Fix issues with Error handling,,0
1406,Update ForkModel.md,0.71763885,New fork model,,1
1407,Merge pull request #91 from prashaantt/real-world-script-fix,0.4880831,- Fix issues with Error handling,,0
1408,upgarded with new middleware API,0.92092574,Middleware API,fix small typo,1
1409,Updated helper name to hasOwn and fixed the typescript definition of stringableFunc,0.4770918,Task object gets a new property:isCancelled,,0
1410,Forgot to save before push,0.48378253,- marked overloaded put.sync as deprecated,,0
1411,"Removed deprecated APIs - bare saga helpers (not effects), takem, put.sync, parallel effect (arrays)",0.80116516,"- removed some deprecated APIs - takeEvery, takeLatest, throttle from the redux-saga entry point (they are and were importable from redux-saga/effects), takem, put.sync and executing array of effects, there is explicit API for this for already some time - all effect",,1
1412,Fix and improve debounce code example in API docs,0.5581739,(see API docs for detailed infos),,0
1413,Merge pull request #752 from blocka/expose_on_error,0.492551,- issue with joiner not ending in cancelled state when joining cancelled task ,,0
1414,Mark options.onerror as deprecated (#682),0.5749176,  // No longer valid with 0.9.1,,0
1415,checking inputs,0.54026574,"test('getData', assert => {",,0
1416,"add , separator to func calls",0.4775814,- detach helper returns a new effect instead of mutating the input one,,0
1417,adding missing imports to examples in recipes docs,0.5623184,"import { createStore, applyMiddleware } from 'redux'",,0
1418,Unified style on all of the badges,0.4439764,- got us a logo! Thanks to @thekarland,,0
1419,Add throttle type definition,0.48362297,"- added TS typings for helpers' effect creators from the redux-saga/effects, that means takeEvery, takeLatest, throttle (thanks to @mcrawshaw)",Grammar fixes,0
1420,Allow to provide custom emitter to saga middleware,0.7541205,"    applyMiddleware(/ other middleware, / sagaMiddleware)",Grammar fixes,1
1421,Scaling Logos to 260px,0.35237902,- got us a logo! Thanks to @thekarland,Grammar fix,0
1422,Merge pull request #169 from yjcxy12/patch-1,0.45245495,- issue with joiner not ending in cancelled state when joining cancelled task ,Grammar fixes,0
1423,Merge pull request #860 from onlyann/master,0.46555096,- issue with joiner not ending in cancelled state when joining cancelled task ,Grammar fixes,0
1424,Merge pull request #373 from nicholaswyoung/feat-use-reducer,0.49969783,Task cancellation support. Thanks to @aikoven for this one. (issue #14).,Grammar fixes,0
1425,Removed outdated part of troubleshooting section,0.63205945,This patch removes all Symbol references from the source code. Some reported issues were related to buggy/incomplete/absent Symbol support which caused subtle and hard to track bugs on  the source code.,,0
1426,fixed merge conflicts,0.5291889,A small patch with the following merges,,0
1427,auto end with undefined result,0.49311036,assert.end(),,0
1428,0.14.0,0.54874,Starting from this release,,0
1429,Update sagas.js,0.54998815,configureStore.js,,0
1430,buffer check,0.5659764,TL/DR: Use buffer.fixed(limit) when you need a bounded buffer (will throw an error when the untaked messages exceed the buffer limit). Use buffer.expanding(limit) when you need an auto expanding buffer.,,0
1431,fixed signature,0.52239084,- Fixed cancellable-counter example,,0
1432,Rewritten even more tests (1 files left) so the internal APIs gets hidden,0.54363143,"- removed some deprecated APIs - takeEvery, takeLatest, throttle from the redux-saga entry point (they are and were importable from redux-saga/effects), takem, put.sync and executing array of effects, there is explicit API for this for already some time - all effect",,0
1433,use npm run check instead of npm test on travis,0.4669428,"- new function createMockTask to mock results of fork effects. With this function, it is now possible to test generators using fork like this",,0
1434,Add chat article to external resources list,0.38735682,"- Updated docs, added a section on channels",Grammar fixes,0
1435,Merge pull request #784 from justsayno/patch-1,0.49593285,- issue with joiner not ending in cancelled state when joining cancelled task ,,0
1436,build badge on all readmes,0.3644657,A small patch with the following merges,,0
1437,Fix endless loop while createTaskIterator gets a function that returns a Promise resolved with undefined.,0.577966,- fix Rejected Promise does not throw inside Generators if rejected with an undefined error #283,,0
1438,Removed support for 2 (lol) old deprecated APIs of runSaga,0.6954701,runSaga: remove deprecated StoreIO,,0
1439,Update API docs with info on emitters,0.6519386,(see API docs for detailed infos),Grammar fixes,0
1440,"Remove building umd bundles during precommit, that was a silly idea 🙈",0.56741655,"- got us a rolluped UMD build, which is way smaller than the one which was produced by a webpack, thanks to the so called 'flat-bundling'",Grammar fixes,0
1441,Merge pull request #274 from secobarbital/patch-3,0.49762386,A small patch with the following merges,Grammar fix,0
1442,1588 Added debounce into effects.d.ts (#1589),0.5195726,"- we have stopped interpreting effects returned from fork, this shouldn't affect any real-life code, affected patterns look like this fork(() => effectCreator()) and fork(takeEvery, 'type', fn)",Grammar tweaks,0
1443,"Drop GitBook dependencies, create lockfile for the website",0.5580932,The documentation is now using GitBook thanks to @cef62,Grammar fixes,0
1444,Merge pull request #200 from ooflorent/fix-eslint,0.51811934,- Fix issues with Error handling,,0
