1435,Add German translations for new array validator.,0.5853863,Adds uppercase validation rule translation by @michaelnabil230 in link,,0
1436,Facade should support calls with no parameters.,0.35467508,Add language for prohibited_if and prohibited_unless validation rules (#5557),,0
1437,Merge pull request #4226 from diogoazevedos/develop,0.47543073,Gitignore docker-compose.override.yml (#5487,,0
1438,Rename static::get_encoding() method to static::encoding() to fit better with style.,0.38468975,Change variable name (03ac80b),,0
1439,"Added ""pretend"" option to mail config.",0.552897,Add failover in supported mail configurations comment section (#5692),Fix in comment in config/app.php,0
1440,allow Config::set to set an entire configuation array.,0.44114238,Add serialize option to array cache config (#5244),I know it is a small thing but it's driving me crazy!,0
1441,Add VSCode to gitignore file,0.75025237,Add .env.backup to gitignore (#5046),require_once /vendor/autoload.php,1
1442,register session in ioc.,0.52596605,Check if register route is enabled (#4775),,0
1443,Fix forever length.,0.4307813,Change password min length to 8 (#4794) ,Change indent for package.json from 2 to 4 spaces,0
1444,refactoring database and connector classes.,0.636745,"Use RefreshDatabase trait (a536402, #4373)","Minor style issue more than anything. If using php artisan preset it will use PHP's JSON_PRETTY_PRINT to rewrite the file (link). JSON_PRETTY_PRINT uses four spaces for indentation, causing the entire file contents to be altered upon a diff. Rather than adding logic to change the indentation after executing json_encode() in Illuminate\Foundation\Console\Presets\Preset, it seems easier to just fix the default indentation in package.json. NPM doesn't seem to change the spacing at all, so this seems like a happy medium.",0
1445,Cleaning up auth code.,0.59121835,Clean up auto register Vue components (#4854),update example unit test to use RefreshDatabase trait,0
1446,Date mutator for 'email_verified_at' attribute on User model stub,0.7779393,Attribute casting for email_verified_at on User model stub (#4930),,1
1447,Merge pull request #4141 from coolpraz/patch-1,0.5064908,Revert change to QUEUE_CONNECTION (34368a4),"Fixes ""Cannot resolve directory'"" in PhpStorm",0
1448,Remove duplicate insert of SSH alias,0.48479772,Add Arr and Str aliases by default (#4951),This fixes the annoying error shown on the import line Cannot resolve directory 'node_modules' less... (Strg+F1)  This inspection checks references to files and directories.,0
1449,Merge pull request #888 from TommyC81/patch-3,0.52546203,Revert change to QUEUE_CONNECTION (34368a4),[5.5] add whoops to dev dependencies,0
1450,Fix phpunit.,0.48912555,Changed,,0
1451,Merge pull request #4188 from themsaid/laravelMix,0.5229615,Revert change to QUEUE_CONNECTION (34368a4),,0
1452,added default values to the signature of Query::left_join to allow closure-based join conditions,0.41006994,Introduce sqlite foreign_key_constraints config option (#4838),Add auth directive,0
1453,Merge pull request #3891 from socieboy/develop,0.480264,Fix running mix tasks error (#4832),"Revert ""don't need it""",0
1454,Fixed wrong return type in phpdoc,0.7469051,Update redirectTo return type PHPDoc (#5175),,1
1455,Remove unnecessary parens from Auth::check.,0.50330067,Remove redundant nulls by @felixdorn in link,,0
1456,Merge pull request #3323 from EliuFlorez/patch-15,0.5467591,Revert change to QUEUE_CONNECTION (34368a4),don't need it,0
1457,remove some comment bloat from the request class.,0.5825541,Remove default commented namespace by @driesvints in link,,0
1458,Add sqlsrv as group connection,0.5841429,Add env variable for mysql ssl cert (9180f64),Change hardcoded urls to named routes,0
1459,DB::raw higher precedence than alias,0.42950416,Add RateLimiter facade alias (#5642)﻿,This makes the links consistent with the ones in link,0
1460,Merge pull request #1472 from franzliedke/patch-61,0.49736643,Revert change to QUEUE_CONNECTION (34368a4),Fixed trailing slash redirection for subdirectory installs.,0
1461,refactoring the response class.,0.5201308,"Use RefreshDatabase trait (a536402, #4373)",Previously redirection to remove trailing slashes would fail if Laravel was not installed in the root directory.,0
1462,Fixed parameters on Session::has.,0.47414008,"Add ""none"" to supported same site options in session config (#5174)",Remove migrations from autoload classmap,0
1463,cleaning up the auth class.,0.4319383,Clean up auto register Vue components (#4854),,0
1464,Up dependency on dev branch.,0.51747364,Bump several dependencies﻿,,0
1465,Ignore the Yarn error log,0.94335306,Ignore Yarn error log (#4322),,1
1466,Added support for  element,0.4992075,Add Js facade (399d435)﻿,,0
1467,more refactoring and dependency injection.,0.49839482,Bumped some dependencies﻿,,0
1468,Changed .gitignore in session to ignore all contents,0.4959001,Add .env.backup to gitignore (#5046),,0
1469,Added missing semi colon. Closes #1334.,0.4809838,Add ably entry (5182e9c),,0
1470,trimmed readme.,0.45522636,Minor skeleton slimming by @taylorotwell in link,Fixed CI,0
1471,Fix phpdoc to order by syntax convention (#5005),0.58452284,Fix alphabetical order (#5795),,0
1472,Update latest CDN,0.5011027,Update database config (#4783),,0
1473,Added ability to dynamically create links to named routes using the HTML class.,0.58911556,Rearrange route methods by @osbre in link,,0
1474,document new options,0.45859128,Add ably entry (5182e9c),,0
1475,tweaks.,0.7605113,Changed,,1
1476,more 2.0 changes,0.59637153,Changed,,0
1477,update tests,0.6404623,"Update validation language files (#5637, #5636)﻿",,0
1478,use str class,0.5649258,Use Str::random() instead of str_random() (#4926),,0
1479,Tweak some paths again.,0.42551216,DRY up path to /home (#5173),,0
1480,Adjust for Elixir move to npm,0.40483522,Upgrade axios to v1.x by @ankurk91 in link,,0
1481,Use dev stability for master,0.4860228,"Use minimum stability ""stable"" by @taylorotwell in link",,0
1482,Tweaks Laravel description (#6099),0.6872785,Laravel 7 constraint (054bb43),,0
1483,common js style,0.5379078,Add Js facade (399d435)﻿,,0
1484,Remove defalut auth:api middleware,0.6466268,Disable TrustHosts middleware (b7cde8b),,0
1485,[9.x] remove null since default parameter is null (#5779),0.59346676,Remove redundant nulls by @felixdorn in link,Ignore the Yarn error log,0
1486,Even more refactoring on the request class.,0.50942624,"Use RefreshDatabase trait (a536402, #4373)","Like the npm error log, this file can also be ignored. See also",0
1487,Removed unnecessary else,0.78338224,Removed,[5.4] Fix docblock.,1
1488,Merge pull request #3957 from WayneHarris/vue-resource,0.5452266,Revert change to QUEUE_CONNECTION (34368a4),,0
1489,code formatting,0.45392707,Add validation language line (926c48e,,0
1490,Fix bug in IoC singleton checking.,0.56735563,Update VerificationController (#4756),,0
1491,update channel,0.54843044,Change default days to 14 for daily channel (cd8dd76),"Derives session.cookie from SESSION_COOKIE, falling back to (snake_cased) APP_NAME . '_session', falling back to 'laravel_session' (current) in order to make it less discoverable, thereby (slightly) reducing threat vector.",0
1492,renamed blade::register to blade::extend,0.43225485,Removing double arrow alignments (#4830),Fix to TrustProxies,0
1493,Working on structure.,0.43285814,"Remove auth scaffolding (b5bb91f, 13e4389, 3ee0065)",,0
1494,Update CsrfMiddleware.php,0.68197674,Upgraded PHPUnit to v7 (f771896),Upgrade axios and cross-env packages,0
1495,Merge pull request #854 from jasonlewis/feature/pattern-filters,0.48412406,Removed migrations from autoload classmap (#4340),,0
1496,rename example event,0.53331524,Change variable name (03ac80b),Require Laravel Mix 1.0,0
1497,Merge pull request #4066 from damiencriado/patch-1,0.56037724,Revert change to QUEUE_CONNECTION (34368a4),,0
1498,Added comments to HTML class.,0.67850727,Add commented code (69d0c50),Add quotes,0
1499,Use expire for consistency.,0.42941058,"Use RefreshDatabase trait (a536402, #4373)","Sass compilers can sometimes be weird if import urls like this aren't quoted. They'll spit out junk like Error: Encountered invalid @import syntax. Anyways, pretty common practice to use quotes for all imports. I mean, seriously, how much more do you want me to write for a dang PR that adds a pair of quotes? I've got work to do, gah.",0
1500,fix session option extract bug.,0.6189887,Cleanup session config (#5261),Simplify mix require,0
1501,Refactoring Router.,0.69849443,Re-add property to route service provider (9cbc381),,0
1502,Merge pull request #4203 from KristofMorva/sort-gitignore,0.51596767,Gitignore docker-compose.override.yml (#5487,"Note that I left your dang const as it is, even though it's stupid. let for life. 💃💃💃💃",0
1503,Added remember_token to protected $hidden variable,0.41859692,Removed $namespace property (b33852e),,0
1504,More work on filters.,0.41235036,Use laravel/tinker v2 (#5161),,0
1505,Merge pull request #3871 from diogoazevedos/use-const,0.46287498,Defined mix as const in webpack.mix.js (#4741),Dynamic changing locale,0
1506,Map API routes before Web routes,0.5457844,Swap route order (292a5b2),,0
1507,initial commit of laravel!,0.40885162,Update to the latest version of laravel-vite-plugin by @jessarcher in link,Simplify test suite names,0
1508,Improve typing on user factory,0.80325377,Improve typing on user factory by @axlon in link,,1
1509,"Add ""url"" option to configuration.",0.7026379,Add asset url configuration option (63a4039),Update JSON error message structure,1
1510,Merge pull request #3260 from itised/master,0.4794609,Revert change to QUEUE_CONNECTION (34368a4),Use current PHP version instead of using PATH,0
1511,Merge pull request #13 from mikelbring/develop,0.5006606,Improve Pusher configuration for easy development by @oanhnn in link,,0
1512,small typo fix in readme,0.57900655,Small typo fix in filesystems.php by @tooshay in link,,0
1513,A few tweaks to mail config.,0.74421835,"Update mail config (76d8227, 61ec16f, e43d454, 130b8c8)",Update CHANGELOG.md,1
1514,consistency,0.48166126,Fix types consistency in Redis database config (#5191),,0
1515,Merge pull request #4580 from laurencei/revert-4573-defaults-55,0.59623086,Revert change to QUEUE_CONNECTION (34368a4),,0
1516,Resolved autoloader conflict,0.66914314,Autoload commands (5d54c21),Add missing IPv4/IPv6 validation messages,0
1517,Update RouteServiceProvider.php,0.683545,Update redirectTo return type PHPDoc (#5175),,0
1518,adding some comments to the form class.,0.67596465,Add comment (a6ca577),,0
1519,Fix s3 endpoint url reference (#5267),0.99851245,Fix S3 endpoint url reference (#5267),"I don't like the fact we have to add  ``` module ``` To have it working, when the docs suggest adding only the meta tag. This will get the token from the meta tag.",1
1520,"Use constraints for ""unique"" on Postgres schemas.",0.40210998,Add postmark token (4574265),,0
1521,Merge pull request #3674 from themsaid/language-for-distinct,0.5325531,Sorted entries in the en validation translations file by @FaridAghili in link,,0
1522,Update font delivery (#5952),0.7844243,Update font delivery by @abenerd in link,,1
1523,added better comments to url->to_route method.,0.53488994,Rearrange route methods by @osbre in link,,0
1524,Refactor the lang class.,0.5328275,Update lang attribute (#4781),Added port to sqlsrv settings,0
1525,Redis connection setup in .env,0.70921874,Add REDIS_CLIENT env variable (ea7fc0b),Most installations won't work without it.,1
1526,fix doc block,0.6425803,Modify the cache.php docblocks (#5468),Add sqlsrv as group connection,0
1527,Add typehint for Factory,0.62371767,Improve typing on user factory by @axlon in link,,0
1528,Merge pull request #3273 from theravel/master,0.5398158,Revert change to QUEUE_CONNECTION (34368a4),"Since the doc says that the Laravel supports SQL Server out of the box, makes sense add it, out of the box.",0
1529,Bulgarian translation for array validator messages.,0.52550334,Changed message for alpha_dash validation rule (#4661),Revert Queue Prefix,0
1530,fix conflicts.,0.45499283,Bumped several dependencies﻿,,0
1531,added languages method to the request class.,0.53304434,Add language entry for starts_with rule (#4866),,0
1532,Merge pull request #3416 from krienow/doctype,0.52747273,Remove redundant @return docblock in UserFactory by @datlechin in link,,0
1533,Fix typo (#6128),0.6414679,Fix typo by @izzudin96 in link,fix typo,0
1534,Added title tag,0.5015145,Add commented code (69d0c50),,0
1535,Merge pull request #4896 from goodjack/patch-1,0.47731838,Revert change to QUEUE_CONNECTION (34368a4),,0
1536,added Str alias.,0.75145197,Add Arr and Str aliases by default (#4951),Update readme.md,1
1537,add Simplified Chinese language package,0.45594734,Add language entry for starts_with rule (#4866),doctype uppercase to lowercase,0
1538,cleaning up some comments.,0.57188594,Add comment (a6ca577),"no harm, only benefits",0
1539,added support for custom validation lines.,0.7588136,Add validation language line (926c48e,,1
1540,adding better comments in auth class.,0.66111636,Add comment (a6ca577),Allow filesystem to be changed on config,0
1541,added loader class.,0.5133661,Improve Pusher configuration for easy development by @oanhnn in link,"Allow to change the filesystem storage on the fly. For example, you can swap the storage disk with a fake one with Storage::fake for tests.",0
1542,Merge pull request #3081 from alnutile/patch-5,0.5719737,Revert change to QUEUE_CONNECTION (34368a4),,0
1543,dont use ioc for session.,0.48152983,Use file session driver again (#5201),,0
1544,switched to simpler bcrypt implementation from phpass.,0.53452927,Set bcrypt rounds using the hashing config (#4643),this PR goes along with link,0
1545,Refactoring the Request class.,0.5669622,Revert change to QUEUE_CONNECTION (34368a4),Updated changelog,0
1546,Updated package.json,0.62351257,Sets package.json type to module by @timacdonald in link,,0
1547,Add throttle middleware.,0.6807002,"Add HandleCors middleware (#5189, 0bec06c)",Ignore the npm debug log,0
1548,Added back support for named views.,0.45641017,"Add new view.expires option (#5209, 91dd1f6)","When an NPM run fails, is created a npm-debug.log file. This file can be ignored and should not be published on a Git based repository.",0
1549,moved validation/errors into system/messages... not just useful for error messages.,0.58168644,Add missing full stop for some validation messages (#5205),More clear way to assign middleware in controller,0
1550,Add comment regarding foreign and associated keys in eloquent.,0.5377161,Implement new primary key syntax (#5147),Fix break from #4226,0
1551,Bumped laravel 6 min version for new LTS users,0.58330023,Bump Laravel to v8.75 (#5750),,0
1552,[9.x] Support pusher-js v8.0 (#6059),0.86096275,Support pusher-js v8.0 by @balu-lt in link,Assign guest middleware to LoginController using documented way link  to avoid confusing with $options array values meaning.,1
1553,added before and after date filters,0.4997617,Add date facade alias (#5556),,0
1554,Merge pull request #3791 from JosephSilber/authorize-namespace,0.51790357,Remove X-UA-Compatible meta tag (#4748),,0
1555,added config for password reminders.,0.70427847,"Add Password confirmation (#5129, d1f7a5a, 9bc23ee)",,1
1556,Tweak default SQLite database.,0.6853951,Ignore SQLite journals (#4971),Remove extra autoload file,0
1557,refactoring the auth class.,0.51359403,Add auth line (b54ef29)﻿,,0
1558,Merge pull request #1041 from Jakobud/feature/docs/templating,0.50964886,Remove redundant @return docblock in UserFactory by @datlechin in link,,0
1559,Gitignore docker-compose.override.yml (#5487),0.99632096,Gitignore docker-compose.override.yml (#5487,,1
1560,Merge pull request #4830 from cyberhicham/master,0.51671726,Revert change to QUEUE_CONNECTION (34368a4),,0
1561,Fix Response::of_something() calls,0.56282675,Fix unterminated statements (#4952),,0
1562,Added better language support for Pagination library.,0.4752328,Adds uppercase validation rule translation by @michaelnabil230 in link,,0
1563,cleaning up some code.,0.5576235,Clean up auto register Vue components (#4854),,0
1564,Merge pull request #1485 from laravie/feature/auth-events,0.55492985,Update to the latest version of laravel-vite-plugin by @jessarcher in link,,0
1565,Remove obsolete namespace import in config.php.,0.5802841,Renamed ModelFactory.php to UserFactory.php to encourage separate files (67a8a11),,0
1566,Merge pull request #52 from staydecent/master,0.5237072,Remove redundant @return docblock in UserFactory by @datlechin in link,Apply fixes from StyleCI,0
1567,Add web.config,0.70170826,Add new Stripe webhook config values (#4803),,1
1568,fixed belongs_to eager loading bug when parent does not exist.,0.516757,Add missing null cache driver in config/cache.php (#5472)﻿,,0
1569,update mail configuration file,0.77754915,"Update mail config (76d8227, 61ec16f, e43d454, 130b8c8)",,1
1570,added arr class and tweaked input class.,0.55963254,Add Arr and Str aliases by default (#4951),Add string to validation,0
1571,Add ulid and ascii validation message (#6046),0.90125275,Add ulid and ascii validation message by @nshiro in link,,1
1572,Fix auth bug and other resolver bugs.,0.57275474,Bumped several dependencies﻿,,0
1573,customizable redirect on auth failure,0.58024883,Revert change to QUEUE_CONNECTION (34368a4),Add to axios defaults instead of overwriting them,0
1574,Merge pull request #1142 from HendrikJan/master,0.49356225,Revert change to QUEUE_CONNECTION (34368a4),"This change ensures the default ""Accept"" header specified by axios is retained.",0
1575,tweaking routes.,0.6170722,Swap route order (292a5b2),Sorting gitignore file,0
1576,added uri class tests.,0.5055282,Rename test methods (#5574),Make app name configurable in environment file,0
1577,fix sorting of migrations.,0.5414956,Removed migrations from autoload classmap (#4340),,0
1578,Change namespace for RemindableTrait.,0.52680683,Remove namespace from Routes by @emargareten in link,,0
1579,Added new options to session config.,0.6491698,"Add ""none"" to supported same site options in session config (#5174)",DRY some npm scripts,0
1580,fire app shutdown event.,0.4869436,Allow configurable emergency logger (#5179),"dev and prod are just aliases, so this allows to just defer them to their counterparts. watch-poll just adds one extra argument so the special option -- allows to pass it to the watch script.",0
1581,Adjust Eloquent\Hydrator to pass array of columns into Query->get method.,0.409171,Add ThrottleRequests to the priority array (#5057),,0
1582,Merge pull request #487 from jasonlewis/patch-8,0.5363714,Revert change to QUEUE_CONNECTION (34368a4),,0
1583,added replace_mimes method.,0.5215746,Replace string helper (fae44ee),NPM scripts should support Windows,0
1584,NPM scripts should support Windows,0.42150846,Ignore the NPM debug log (#4232),,0
1585,Merge pull request #4833 from DojoGeekRA/feature/phpunit.xml,0.51577574,Align min PHP version with docs by @u01jmg3 in link,Provide consistency with NPM scripts,0
1586,Merge pull request #1876 from briankiewel/robots,0.4290083,Revert change to QUEUE_CONNECTION (34368a4),,0
1587,Update middleware.,0.718048,"Add HandleCors middleware (#5189, 0bec06c)",Add vagrant virtual machine directory to git ignore list.,1
1588,fix error in comment,0.6294035,Add commented code (69d0c50),,0
1589,Merge pull request #4986 from DivineOmega/patch-1,0.49984565,Revert change to QUEUE_CONNECTION (34368a4),"It trips me up each time that npm run dev exists but npm run prod does not. This serves to fix that case, as well as providing consistency in both directions dev/development and prod/production. Source",0
1590,Use $.noConflict in profiler to allow multiple jQuery versions.,0.5261394,"Add ""none"" to supported same site options in session config (#5174)",Added changelog,0
1591,Added str::limit and str::limit_words. Unfortunately php doesn't include mb_str_word_count.,0.5109143,Use Composer's @php directive (#4278),Composer -o,0
1592,Fixed session.http_only retrieval.,0.63533086,"Add ""none"" to supported same site options in session config (#5174)",Composer allows us to optimize the autoloader using the --optimize flag or shortly -o.,0
1593,Remove extra whitespace in config/cache.php,0.57051253,Modify the cache.php docblocks (#5468),Require laravel-mix v0.*,0
1594,fix bug in query class.,0.5677597,Fix unterminated statements (#4952),,0
1595,Typo?,0.41565225,﻿,,0
1596,Requires PHP 7.3 and bumps both PHPUnit and Collision,0.8045378,Ensures downloaded version of Collision supports PHP 8.1 (#5697),Possible URL fix?,1
1597,Merge pull request #867 from niallobrien/develop,0.47933477,Improve Pusher configuration for easy development by @oanhnn in link,,0
1598,Fix spacing on Auth doc code examples.,0.5473602,Add auth line (b54ef29)﻿,,0
1599,Merge pull request #1150 from franzliedke/patch-40,0.5125743,Revert change to QUEUE_CONNECTION (34368a4),,0
1600,Merge pull request #4447 from talvbansal/master,0.45385063,Revert change to QUEUE_CONNECTION (34368a4),,0
1601,Merge pull request #260 from sparksp/2.2b1/migrate-sort,0.4726055,Add stub handler (4931af1),,0
1602,Merge branch 'feature/installation' into develop,0.34619153,Simplified mix require (#4283),,0
1603,Revert npm script refactor,0.48442364,Revert change to QUEUE_CONNECTION (34368a4),The .js files should be vendored too,0
1604,Fixed empty result set bug in paginator class.,0.542098,Fix unterminated statements (#4952),"Some projects can present JS as the primary language, even clearly being a Laravel/PHP project. With this, that problem can be avoided.",0
1605,Imports without model events trait on seeds (#5745),0.5311548,Fully qualified user model in seeder (#5406),unindex token,0
1606,Check  against host name for CLI commands,0.4833274,Check if register route is enabled (#4775),Mailtrap now reference smtp. for their host value.,0
1607,Merge pull request #4725 from calebporzio/patch-1,0.511993,Add stub handler (4931af1),,0
1608,Merge development branch.,0.3393979,Simplified mix require (#4283),,0
1609,Add Japanese language resource files.,0.43880454,Sorted entries in the en validation translations file by @FaridAghili in link,Adds unix_socket to config/database.php for consistency,0
1610,Fixed bug in Config::set method.,0.5819781,Fix unterminated statements (#4952),"For the mysql driver only (as this only applies to mysql) add the ""socket"" configuration parameter and corresponding environment variable.",0
1611,Merge pull request #2951 from bworwa/patch-1,0.53483653,Revert change to QUEUE_CONNECTION (34368a4),common js style,0
1612,refactoring. adding back pagination.,0.5101121,"Use RefreshDatabase trait (a536402, #4373)",,0
1613,Merge pull request #3031 from GrahamCampbell/cs,0.5159582,Remove unneeded call by @taylorotwell in link,,0
1614,Merge pull request #3780 from laravel/analysis-8LZ3WJ,0.5570711,Revert change to QUEUE_CONNECTION (34368a4),Upgrade laravel-mix to 0.8.3,0
1615,Add default address in mail config.,0.6621647,Add option to set sendmail path (#5741),,0
1616,Merge pull request #3904 from scrubmx/patch-5,0.48931903,Add ThrottleRequests to the priority array (#5057),,0
1617,Fix CSRF token bug.,0.73505706,Log console error if CSRF token cannot be found (1155245),,1
1618,Bump ignition,0.64661705,Ignition v2 (#5211),Fix cross-env binary,0
1619,Upgrade laravel-mix to 0.8.3,0.76337814,Upgraded Laravel Mix to ^1.0 (#4294),,1
1620,Update mounted instead of ready,0.52486026,"Update mail config (76d8227, 61ec16f, e43d454, 130b8c8)",,0
1621,Merge pull request #246 from ericbarnes/develop,0.47906947,Improve Pusher configuration for easy development by @oanhnn in link,,0
1622,Remove class loader from aliases.,0.5710765,Remove namespace from Routes by @emargareten in link,,0
1623,Possible fix for issue #378.,0.60571015,Revert #4744 (#4791),[5.4] Use consistent config paths,0
1624,Add fallback sans-serif font in case the custom font fails to load,0.52582324,Update font delivery by @abenerd in link,,0
1625,wording change,0.6802708,Changed,[5.4] Fix cross-env bin path,0
1626,Change .env PUSHER_* params order,0.5220748,Changing .env to make Pusher work without editing the commented out part in the bootstrap.js by @cveldman in link,,0
1627,Improve comments in routes.php.,0.5694481,Fix empty paths for server.php  by @driesvints in link,,0
1628,Refactoring Paginator.,0.547455,"Use RefreshDatabase trait (a536402, #4373)",,0
1629,Added stub keyphrase.,0.5755062,Add stub handler (4931af1),[5.4] Update description of filled rule,0
1630,Remove redundant check from bootstrap/autoload.php,0.70732653,"Dropped bootstrap/autoload.php (#4226, #4227, 100f71e)",filled isn't really required. It just implies that it needs a value.,1
1631,Merge branch 'master' of github.com:laravel/laravel into develop,0.4389531,Gitignore docker-compose.override.yml (#5487,,0
1632,Fix break from #4226,0.5784778,Fix running mix tasks error (#4832),Refactor npm scripts,0
1633,Updated line to use spaces instead of tabs.,0.42726108,Remove deprecated language line (#5074),"Per #4147, this adds a new npm run watch-poll command, and dries up some of those long repetitive commands.",0
1634,set default auth_mode for smtp mail driver (#5293),0.9567579,Allow configuring the auth_mode for SMTP mail driver (#5293),Change hard-coded '/login' param to named route,1
1635,Merge pull request #4870 from driesvints/update-changelog,0.58037513,Revert change to QUEUE_CONNECTION (34368a4),,0
1636,Fix check.,0.55712837,Update VerificationController (#4756),Update package.json,0
1637,rename property for clarity,0.50272715,Change variable name (03ac80b),update laravel mix to new version,0
1638,added comments to pagination language.,0.62403214,Add comment (a6ca577),"Updated axios, jQuery, Laravel Mix, Lodash and Vue.js versions",0
