2932,Merge pull request #3187 from GrahamForks/autoload-dev,0.5258806,Bring back pusher cluster config option by @jesseleite in link,,0
2933,added Requst::json method.,0.5703888,Add auth.json to skeleton by @driesvints in link,,0
2934,Merge pull request #3536 from bbashy/patch-2,0.52126044,Add stub handler (4931af1),,0
2935,refactoring response and session classes.,0.48710334,"Use RefreshDatabase trait (a536402, #4373)",,0
2936,Bump Guzzle,0.61119735,Bump lodash from 4.17.15 to 4.17.19 (f465c51),,0
2937,typo,0.4421754,Fix typo by @izzudin96 in link,,0
2938,add basic trust host middleware,0.93409306,Add basic trust host middleware (5639581),,1
2939,Attribute casting for 'email_verified_at' on User model stub,0.97752815,Attribute casting for email_verified_at on User model stub (#4930),,1
2940,Add full code coverage for Laravel\Form,0.58436227,Update minimum Laravel version (02ca853),,0
2941,improve cache class documentation.,0.6147777,Modify the cache.php docblocks (#5468),,0
2942,fixed changelog,0.5107251,Changed,,0
2943,Update to the latest version of laravel-vite-plugin (#5943),0.8905063,Update to the latest version of laravel-vite-plugin by @jessarcher in link,,1
2944,Merge pull request #4311 from lucasmichot/feature/master/docblock,0.63790894,Remove redundant @return docblock in UserFactory by @datlechin in link,,0
2945,Fixing eloquent 2 query->first method.,0.462174,Fix unterminated statements (#4952),"When using the timezone validation, it does not have a default sentence, you are greeted with: ""validation.timezone"" instead.",0
2946,added delete option to cpdir method.,0.5359658,Removed,,0
2947,Consider protocoless URLs as valid. Closes. #1966.,0.5821142,Closed @auth correctly (#5471)﻿,,0
2948,added with helper.,0.50716054,Add ably entry (5182e9c),,0
2949,Added port to sqlsrv settings,0.61575687,Add env variable for mysql ssl cert (9180f64),,0
2950,Define mix as const,0.7788799,Defined mix as const in webpack.mix.js (#4741),,1
2951,Merge pull request #971 from franzliedke/patch-27,0.4993517,Revert change to QUEUE_CONNECTION (34368a4),Why aren't we ignoring sqlite databases at this point?,0
2952,fix glob problem in file cache driver.,0.59042966,Add missing null cache driver in config/cache.php (#5472)﻿,,0
2953,"Trivial improvement to Laravel, while it is not documented, it has been a standard in Laravel to use tab as indentation and new line for curly bracket",0.5674505,Update minimum Laravel version (02ca853),,0
2954,Merge pull request #2332 from laheab/master,0.5215235,Update laravel mix and sass loader (#5203),,0
2955,Add required_if validation language line.,0.8218566,Add language for prohibited_if and prohibited_unless validation rules (#5557),,1
2956,Merge pull request #3151 from gregoryduckworth/patch-1,0.5483394,Revert change to QUEUE_CONNECTION (34368a4),,0
2957,restructured session driver interfaces and added cookie session driver.,0.6168854,Use file session driver again (#5201),,0
2958,"Updated with ""ü"" and ""Ü"" characters. Letter occurs in Hungarian, German, Karelian, Turkish, Estonian, Azeri, Turkmen languages.",0.36278316,Add message for UUID validation rule (#4834),,0
2959,Refactoring View class.,0.5249743,"Use RefreshDatabase trait (a536402, #4373)",,0
2960,Change hard-coded '/login' string to named route,0.5914038,Fix route when uncomment $namespace (#5424),,0
2961,Added QUEUE_DRIVER to .env.example,0.7273766,Changed QUEUE_DRIVER env variable name to QUEUE_CONNECTION (c30adc8),,1
2962,Merge pull request #4861 from unstoppablecarl/middleware-priority-comment,0.58266515,Type hint the middleware Request (#5438)﻿,,0
2963,Use facades.,0.6639056,Use correct facade (#4780),Create .gitignore,0
2964,removed routes directory,0.67774916,Remove namespace from Routes by @emargareten in link,spacing cleanup,0
2965,[ALL] gitignore for NetBeans IDE,0.5873878,Gitignore docker-compose.override.yml (#5487,Why aren't we ignoring sqlite databases at this point?,0
2966,Update laravel/session/drivers/cookie.php,0.63972056,Update Kernel.php (#4861),,0
2967,Improve Blade unit-test code coverage,0.46712452,Rename test methods (#5574),,0
2968,Rename path to files.,0.5297152,Revert changes to env file (3b2ed46),Update validation language to include boolean,0
2969,Simplify test suite names,0.5955566,Rename test methods (#5574),Language validation addition for link,0
2970,Fix bug causing non-required fields to throw errors in Validator class.,0.57745296,Fix unterminated statements (#4952),,0
2971,"overall code refactoring, comment improvement.",0.6331109,Add commented code (69d0c50),,0
2972,Correct property name bug in validator.,0.5919914,Changed syntax for validation (#4820),,0
2973,Update syntax.,0.62097675,Changed,,0
2974,added certificate of origin to license file.,0.45474678,"Utilize Authentication Middleware Contract (#5181, #5182)",,0
2975,Stack doesn't need to be in this composer file.,0.4362169,Don't need to ignore vite config file by @GrahamCampbell in link,Added remember_token to protected $hidden variable,0
2976,removed unecessary methods from exception wrapper.,0.54617417,Correct exception handler doc (#5187),Fix grammar in config/mail.php,0
2977,Configure default database connections for Forge and Homestead.,0.52485895,"Prefix redis database connection by default (#4982, #4986, #4987)",Added redis to list of available queue drivers,0
2978,Add to the compiler.,0.54412746,Add ably entry (5182e9c),Add note about expire time,0
2979,Merge pull request #640 from crynobone/feature/remove-prettyprint,0.4740482,Remove X-UA-Compatible meta tag (#4748),,0
2980,fix bug in db profiling.,0.59395105,Update database config (#4783),Updated Badges,0
2981,add language line,0.74842525,Add language line by @taylorotwell in link,,1
2982,According to PHP Bug 78516 Argon2 requires at least 8KB (#5097),0.85229236,"Revert ""[6.x] According to PHP Bug 78516 Argon2 requires at least 8KB"" (#5102link)","Might be confusing for users, if the expire time is not stated.",1
2983,Merge pull request #3872 from donnes/patch-1,0.5447194,Revert change to QUEUE_CONNECTION (34368a4),,0
2984,Merge pull request #4803 from driesvints/cashier-add-verify-webhook-config-values,0.5892551,Add new Stripe webhook config values (#4803),,0
2985,move cookie payload check into cookie class.,0.5244984,Add sanctum cookie endpoint to default cors paths (aa6d3660),,0
2986,Fix bug with table prefix and columns.,0.5374335,Add to axios defaults instead of overwriting them (#4208),,0
2987,Moved pre-update-cmd to post-update-cmd,0.45267102,Update default CORS config (#5259),,0
2988,Merge pull request #3547 from laravel/analysis-8b2da8,0.5499627,Revert change to QUEUE_CONNECTION (34368a4),Add missing mailgun.domain option.,0
2989,always disable magic quotes at runtime.,0.4532528,Remove default commented namespace by @driesvints in link,[4.1] Improved Badges,0
2990,fix array tests.,0.55584073,Use PHPUnit TestCase and in-memory DB (#5169),,0
2991,Merge pull request #4518 from fideloper/trustedproxy,0.48063666,Remove redundant @return docblock in UserFactory by @datlechin in link,Signed-off-by: crynobone crynobone@gmail.com,0
2992,Refactor DB\Connector class.,0.58927244,"Use RefreshDatabase trait (a536402, #4373)",,0
2993,Merge pull request #1880 from authman/master,0.48277768,Revert change to QUEUE_CONNECTION (34368a4),,0
2994,Merge pull request #4494 from m1guelpf-forks/patch-3,0.53691316,Revert change to QUEUE_CONNECTION (34368a4),,0
2995,Shorten long exception message.,0.5391543,Correct exception handler doc (#5187),,0
2996,Temporarily remove tinker from master,0.6737896,Removed TinkerServiceProvider (6db0f35) ,,0
2997,added back to top widget,0.5272574,Bring back pusher cluster config option by @jesseleite in link,,0
2998,tweaked comment in auth class.,0.6246213,Add comment (a6ca577),,0
2999,added unsigned() description,0.55552846,Fix unterminated statements (#4952),,0
3000,Refactered user and fixed parse error.,0.4753375,Update UserFactory password (#4797),,0
3001,Merge pull request #978 from racklin/pgsql-schema,0.56894755,Revert change to QUEUE_CONNECTION (34368a4),,0
3002,Use no protocol to fetch Lato font,0.5328837,Update font delivery by @abenerd in link,[PROPOSAL] Ignore all .env.*.php files,0
3003,Update VerificationController.php,0.7589431,Update VerificationController (#4756),,1
3004,"Exit with non-zero if command fails, useful in scripting and CI",0.43095732,Add missing full stop for some validation messages (#5205),Minor CS Fixes,0
3005,Ignore changelog in export,0.5501456,Switch to ESM imports by @jessarcher in link,Add fallback_locale to config,0
3006,remove lodash (#6095),0.6588949,Remove lodash dependency when auto registering Vue components (#4853),,0
3007,Fix pagination translation,0.5140737,Add 'multiple_of' translation (#5449)﻿,Added log to the mail config,0
3008,change form and html class to use html5 style elements.,0.4514705,Add Js facade (399d435)﻿,,0
3009,Merge pull request #4594 from mputkowski/patch-sftp,0.48983994,Use smtp.mailtrap.io as default MAIL_HOST (#4182),,0
3010,Update .gitignore (#5593),0.9452739,Update .gitignore (bc435e7),This is implemented in link,1
3011,Merge pull request #1989 from juukie14/master,0.45508373,Bring back pusher cluster config option by @jesseleite in link,,0
3012,changing a comment.,0.6940406,Changed,,0
3013,Added output from String documentation examples.,0.47790277,Adds uppercase validation rule translation by @michaelnabil230 in link,,0
3014,Fix output buffer checking bug.,0.50777304,Add missing full stop for some validation messages (#5205),,0
3015,Added home link to welcome page,0.67215735,"Remove unnecessary link type on ""welcome"" view (#4935)",,0
3016,fix function namespacing.,0.53000444,Fix route when uncomment $namespace (#5424),Updated mail config comments from postmark to mailgun,0
3017,added view tests.,0.4795702,"Add new view.expires option (#5209, 91dd1f6)",,0
3018,Merge pull request #3203 from jumilla/develop,0.47026795,Simplified mix require (#4283),All environment files shall be ignored from Git,0
3019,refactoring the uri class... again,0.55220354,"Update database config relating to Url addition (#5018, b0e0bdc)",,0
3020,add forge to links,0.5597943,Allow Pest plugin in Composer by @driesvints in link,,0
3021,Merge pull request #3858 from laravel/analysis-XV0reP,0.5331143,Revert change to QUEUE_CONNECTION (34368a4),,0
3022,Display errors by default.,0.50883865,Add failover in supported mail configurations comment section (#5692),Iron.io config less error prone.,0
3023,Fix bug in Eloquent to_array method.,0.5487378,Fix unterminated statements (#4952),,0
3024,validation rules sorting consistency (#6031),0.7411604,Order validation rules alphabetically (#5728),Auth should respond with a 401 to AJAX requests,1
3025,Merge pull request #5806 from axlon/patch-1,0.5277885,Bring back pusher cluster config option by @jesseleite in link,In iron.io settings 'token' is the first field and 'Project ID' is the second. The proposed order makes it less error prone.,0
3026,Merge pull request #2935 from GrahamCampbell/badges,0.494097,Remove unneeded call by @taylorotwell in link,5x boost for EU customers,0
3027,more validator refactoring.,0.7003131,Changed syntax for validation (#4820),,1
3028,added ignore rules to views .gitignore.,0.5254975,Gitignore docker-compose.override.yml (#5487,,0
3029,tweaking facades.,0.5983894,Use correct facade (#4780),Add required_with_all validation message,0
3030,Refactor Lang class.,0.5621307,Update lang attribute (#4781),added alt to img tag in hello,0
3031,Tweak the language line logic.,0.60610247,Remove deprecated language line (#5074),,0
3032,Use double quotes; Remove un-used fonts,0.4934587,Remove deprecated language line (#5074),"added required alt tag to img, now successfully passes w3c validation",0
3033,Refactor loader for performance.,0.6054565,Use post-autoload-dump (2f4d726),,0
3034,add note to upgrade log.,0.56268215,"Updated logging configuration (acabdff, bd5783b, ff0bec8, f6e0fd7, 2eeca4e, ebb0a2a, b78f5bd)",This option is already supported in 'Illuminate/Queue/Connectors/IronConnector.php' Having this option hidden works well only for North America. However for EU having it set to EU servers give 5X boost in network performance with iron.io,0
3035,Fixes variable export for Windows.,0.4584051,Switch to ESM imports by @jessarcher in link,"Improvement of validation traduction for ""email"" rule",0
3036,renamed test.,0.79222405,Rename test methods (#5574),,1
3037,"Remove inline styling, add class to link",0.6039407,"Remove unnecessary link type on ""welcome"" view (#4935)",,0
3038,working on some configuration changes.,0.58191776,Changed,Added required_without_all,0
3039,readme cleanup and overall better'ness,0.461631,Clean up auto register Vue components (#4854),Updating .htaccess for consistency,0
3040,Merge pull request #1692 from adityamenon/master,0.5066138,Revert change to QUEUE_CONNECTION (34368a4),,0
3041,"Changed a line which causes ""illegal string offset"" error to be thrown in php5.4 on trying to access $value['tmp_name']",0.5051626,Use Composer's @php directive (#4278),,0
3042,Merge pull request #1 from ThunderBirdsX3/ThunderBirdsX3-patch-1,0.46751076,Add ThrottleRequests to the priority array (#5057),,0
3043,Merge pull request #4196 from DojoGeekRA/patch-1,0.5236305,Ignore Yarn error log (#4322),added license badge,0
3044,"Add message for ""Not Regex"" validation rule",0.6249149,Add prohibited validation rule (#5569),,0
3045,Refactor messages class.,0.53451884,"Use RefreshDatabase trait (a536402, #4373)",,0
3046,use class name to be consistent with web middleware,0.94033635,Use class name to be consistent with web middleware (140d4d9),,1
3047,One more change (comments may need to be altered),0.6772156,Changed,,0
3048,Increment version.,0.5270704,Changed,tabs to spaces,0
3049,refactoring various classes.,0.4954397,Changed,,0
3050,Merge pull request #4001 from RonMelkhior/master,0.53493965,Revert change to QUEUE_CONNECTION (34368a4),,0
3051,Backport the composer script fixes,0.4788323,Re-order composer.json (#5570)﻿,Add php artisan clear-compiled to post-install-cmd,0
3052,Update .gitignore (#6123),0.9261777,Update .gitignore (bc435e7),laravel/framework#3152 Signed-off-by: crynobone crynobone@gmail.com,1
3053,bump the Vite version (#5977),0.68643,Bump Vite plugin version by @timacdonald in link,,0
3054,Update HTML alias. Closes #1210.,0.58909136,Add RateLimiter facade alias (#5642)﻿,Fixing indentation to be consistent,0
3055,Merge pull request #878 from TommyC81/develop,0.505438,Improve Pusher configuration for easy development by @oanhnn in link,,0
3056,update name,0.5689023,Change variable name (03ac80b),,0
3057,Refactor the encryption class.,0.62893647,Rename encrypted to forceTLS for Pusher (#5159),,0
3058,Merge pull request #1526 from TheShiftExchange/blade_e,0.53604317,Revert change to QUEUE_CONNECTION (34368a4),Corrected the spelling of 'maintenance' in maintenance mode comment block,0
3059,Added first draft of remember me to auth.,0.4524911,Add auth line (b54ef29)﻿,,0
3060,Set timezone in core file.,0.5088644,Change default days to 14 for daily channel (cd8dd76),,0
3061,[5.2] Remove unused import,0.58353084,Removed,Enhancements to the 4.0>4.1 upgrade guide.,0
3062,Use semver caret operator,0.41154617,Add env variable for mysql ssl cert (9180f64),,0
3063,silently flush output buffer on error.,0.4862811,Add missing full stop for some validation messages (#5205),Re-order upgrade instructions,0
3064,Merge pull request #3817 from JosephSilber/unauthenticated-json,0.5436096,Add auth.json to skeleton by @driesvints in link,composer update throws an error while executing artisan if you have not yet done this step: Remove call to redirectIfTrailingSlash in bootstrap/start.php file.,0
3065,Remove properties.,0.7395152,Removed,Added new steps - upgrade.md,1
3066,Missing  close tag,0.50522196,Use short closure by @taylorotwell in link,,0
3067,add default address,0.59953517,Add username in config to use with phpredis + ACL by @neoteknic in link,,0
3068,"Tweaking has_many ""save"" method.",0.47172645,Refactored exception handler (too many commits),,0
3069,"Bring back cluster config option, as required by pusher-js v8.0. (#6174)",0.8801785,Bring back pusher cluster config option by @jesseleite in link,,1
3070,Add clarification to comment.,0.67105925,Add comment (a6ca577),Added step to add remote.php,0
3071,[8.x] Grammatical omission of 'of' on line 14 (#5603),0.4190234,Remove deprecated language line (#5074),,0
3072,fixed misleading comment.,0.4482255,Fix unterminated statements (#4952),Group similar upgrade task.,0
3073,Add Disk facade.,0.55763817,Use correct facade (#4780),,0
3074,Added post create-project command to generate key.,0.58368224,Implement new primary key syntax (#5147),,0
3075,Uses Laravel Ignition v2.x (#6079),0.7020539,Bump Laravel to v8.75 (#5750),Added instruction to update composer.json to 4.1,1
3076,Merge pull request #4000 from zaknes/master,0.48454878,Revert change to QUEUE_CONNECTION (34368a4),,0
3077,"Use tabs, always.",0.33218205,Use same default queue name for all drivers (#5549),,0
3078,Refactor database manager.,0.67134136,"Use RefreshDatabase trait (a536402, #4373)",Signed-off-by: crynobone crynobone@gmail.com,0
3079,Remove redundant Closure namespace import in VerifyCsrfToken,0.59538937,Remove redundant @return docblock in UserFactory by @datlechin in link,,0
3080,Merge pull request #3690 from kevinsimard/master,0.47558168,Revert change to QUEUE_CONNECTION (34368a4),Remove duplicate insert of SSH alias,0
3081,moved asset container to system directory.,0.5386137,Make Asset Directory Flattened (ff38d4e),,0
3082,cleaned up paths.,0.43944758,DRY up path to /home (#5173),Add Remote component to upgrade,0
3083,Merge pull request #3845 from mayoz/patch-3,0.50367266,Revert change to QUEUE_CONNECTION (34368a4),Missing reference to SSH in upgrade.md,0
3084,Adding having() support to the Fluent query builder.,0.49704376,Add language for prohibited_if and prohibited_unless validation rules (#5557),,0
3085,Some spacing.,0.38905156,Removing double arrow alignments (#4830),,0
3086,Merge pull request #438 from sparksp/patch-7,0.514215,Ignore Yarn error log (#4322),,0
3087,[9.x] Make authenticate session a route middleware (#5842),0.85210323,Make authenticate session a route middleware by @taylorotwell in link,,1
3088,Added basic GitHub contribution docs.,0.59063804,Update .gitignore (bc435e7),,0
3089,Merge pull request #4867 from ajthinking/patch-1,0.53835225,Revert change to QUEUE_CONNECTION (34368a4),,0
3090,added missing parens.,0.5065286,Removed,,0
3091,use route service provider,0.7070339,Re-add property to route service provider (9cbc381),Update upgrade.md,1
3092,Bumped versions,0.63155305,Bumped some dependencies﻿,Quick reminder to change the path in the BaseController to match the change to the alias.,0
3093,Fix comment on default session driver.,0.64540005,Use file session driver again (#5201),,0
3094,Merge pull request #3198 from ibrasho/switch-order-of-providers,0.5160359,Revert change to QUEUE_CONNECTION (34368a4),,0
3095,Changed localhost to 127.0.0.1,0.54434884,Shorten pusher host config by @buihanh2304 in link,,0
3096,Merge pull request #486 from daylerees/docs-template,0.51973426,Remove redundant @return docblock in UserFactory by @datlechin in link,,0
3097,Merge pull request #4234 from tillkruss/master,0.49577704,Ignore Yarn error log (#4322),,0
3098,refactor cache driver method.,0.6305713,Use separate cache database for Redis (#4665),,0
3099,added Response::json method.,0.57628655,Add auth.json to skeleton by @driesvints in link,,0
3100,Merge pull request #945 from cviebrock/html-link,0.55010253,"Remove unnecessary link type on ""welcome"" view (#4935)",Add note to upgrade.md about new Controller alias,0
3101,Fix bug in IoC.,0.55977625,Add missing maintenance to config by @ibrunotome in link,,0
3102,correct link,0.55063194,Use except by @taylorotwell in link,,0
3103,Fixed some fonts.,0.58721685,Update font delivery by @abenerd in link,,0
3104,merging hotfixes. re-added tests into repository.,0.5424515,Bump several dependencies﻿,,0
3105,Remove check for items in File cache driver.,0.7315439,Delete cached config file before running tests (#5091),Fixed very minor typo in auth.php,1
3106,fixed bug that prevented view exception from being shown.,0.54105175,"Add new view.expires option (#5209, 91dd1f6)",Remove space and add global class reference in docblock,0
3107,clean up comment,0.54679984,Add comment (a6ca577),Tiny inconsistency between 'between' and 'digits_between' validation rules messages,0
3108,remove hyphen on email,0.89390916,Remove hyphen on email (ffc74ba),,1
3109,Spellcheck,0.44844145,Changed syntax for validation (#4820),,0
3110,Remove duplicate bootstrap reference.,0.7613908,Remove unused Bootstrap class (#4917),,1
3111,Switch to .scss,0.61554134,Update font and colors in scss (6646ad7),,0
3112,Do not strtolower request URI.,0.5002631,Don't redirect for api calls (#4805),,0
3113,Add new password rule language line,0.72312653,Add translation for current_password rule (#5628)﻿,,1
3114,Documented availability of SES mail driver in mail config,0.55325437,Add failover driver to default mail config file (#5672)﻿,,0
3115,Merge pull request #3914 from dersvenhesse/patch-1,0.5424286,Revert change to QUEUE_CONNECTION (34368a4),,0
3116,"Revert ""Bump PHPUnit""",0.67561036,Bump minimum PHP version (#5452),,0
3117,Merging structure branch.,0.3673705,Simplified mix require (#4283),,0
3118,Merge branch '6.x' into 7.x,0.41580957,Simplify the maintenance file call (#5752),Feature/cleanup css,0
3119,Add ability to specify iteration count in Hash class.,0.6266748,Use Hash::make() in RegisterController (#4570),,0
3120,Autoload the console.,0.6532324,Autoload commands (5d54c21),The default message was not clear,0
3121,Bypass auto-loader when loading core routing classes.,0.56672114,Removed migrations from autoload classmap (#4340),,0
3122,Correct broken links in docs,0.6249155,Fix dead link in web.config (#5528)﻿,Updated line to use spaces instead of tabs.,0
3123,refactoring and tweaking.,0.6660968,Changed,,0
3124,Merge pull request #3398 from crynobone/feature/root-install,0.46748862,Fix running mix tasks error (#4832),Added configuration for RedisQueue,0
3125,Changing .env to make Pusher work without editing the commented out part in the bootstrap.js (#6021),0.9675649,Changing .env to make Pusher work without editing the commented out part in the bootstrap.js by @cveldman in link,,1
3126,fixing readme typos.,0.5743403,Fix typo by @izzudin96 in link,,0
3127,Return value of cookie.,0.44569606,Try to build session cookie name from app name (#4305),,0
3128,download zip archive of repos by default instead of submoduling.,0.40545285,Switch to using meta,,0
3129,Update upgrade.md,0.5735612,Upgrade to Mix v6 (#5505),,0
3130,use class,0.43818772,Add an example to the class aliases by @nshiro in link,,0
3131,"In the call() method, the exception wasn't being thrown if only 1 or more than 2 arguments were passed to the method. Fixed conditional statement to only accept exactly 2 arguments.",0.5505151,Refactored exception handler (too many commits),,0
3132,Merge pull request #199 from syntaqx/master,0.4555081,Revert change to QUEUE_CONNECTION (34368a4),,0
3133,Merge pull request #752 from AndrewBNZ/master,0.4709298,Revert change to QUEUE_CONNECTION (34368a4),gitignore windows thumbnails,0
3134,Make the Authenticate middleware throw an AuthenticationException,0.81313705,"Utilize Authentication Middleware Contract (#5181, #5182)",,1
3135,List supported drives in cache and broadcasting configs,0.5249899,Add serialize option to array cache config (#5244),,0
3136,fix typo,0.6286303,Fix typo by @izzudin96 in link,"Move pre-update-cmd to post-update-cmd, solves inconveniences.",0
3137,Merge pull request #1992 from neoascetic/patch-1,0.49749216,Bring back pusher cluster config option by @jesseleite in link,,0
3138,Merge pull request #845 from tobsn/patch-5,0.50820345,Revert change to QUEUE_CONNECTION (34368a4),,0
3139,Merge pull request #1568 from franzliedke/patch-62,0.50859314,Revert change to QUEUE_CONNECTION (34368a4),,0
3140,Support custom URLs for AWS storage,0.5643206,Add AWS S3 Bucket to .env.example (f84a69e),,0
3141,Revert #4744,0.97613907,Revert #4744 (#4791),,1
3142,Refactoring the Config class.,0.5268839,"Use RefreshDatabase trait (a536402, #4373)",,0
3143,Merge pull request #4689 from laravel/verify-skeleton,0.5000192,Update to the latest version of laravel-vite-plugin by @jessarcher in link,Added clarity,0
3144,Continuing to work on structure.,0.32598007,Set framework version ^7.24 (#5370),,0
3145,"convert indentation to tabs, like every other file in Laravel  :)",0.40211213,Replace Laravel CORS package by @driesvints in link,,0
3146,add u PCRE modifier to str::words.,0.49259162,Add Arr and Str aliases by default (#4951),,0
3147,working on the route class.,0.5715806,Swap route order (292a5b2),,0
3148,update handler,0.6924095,Update VerificationController (#4756),,0
3149,Refactoring Form class.,0.47378346,"Use RefreshDatabase trait (a536402, #4373)",,0
3150,Merge pull request #736 from joecwallace/cli-env-management,0.52108335,"Update cross-env and resolve-url-loader to the latest (#5210, #5216)",,0
3151,fix cons,0.4551257,Bumped some dependencies﻿,,0
3152,Added support for on_delete and on_cascade of foreign keys.,0.56813085,Introduce sqlite foreign_key_constraints config option (#4838),Add missing license information in composer.json,0
3153,Added Romega Software to Sponsorships (#5721),0.4440437,Vite 3 support by @timacdonald in link,The license information was missing from the composer.json file. This information is quite important as it is displayed on Packagist and used by automated tools (like link/ for instance) to check compatibility of your project dependencies.,0
