Commit Message,Score,Correspond Changelog Sentence,Commit Description,Label
Docs: Fix quotes in readme example (#573),0.4404683,Update README.md by @eirslett in link,Single quotes should be used Run prettier format,0
v0.4.2,0.43457335,Support vite 3.1 by @IanVS in link,,0
Fix MDX1 in Windows environments (#560),0.87393165,Fix mdx1 in Windows by @joshwooding in link,,1
v0.4.1,0.42835808,Support vite 3.1 by @IanVS in link,,0
Inject mdx compiler for mdx1 (#556),0.91407204,Inject mdx compiler for mdx1 by @IanVS in link,"fixes link I found that mdx was not working correctly here, and @valentinpalkovic realized my fallback in Storybook 7 wasn't either (link).  It was because we used to inject the mdx compiler into the source code that we get back from the @storybook/mdx1-csf compiler, but we lost that in link.  This re-introduces it, with a bit better of a guarantee that the correct version is going to be loaded, by starting from inside @storybook/mdx1-csf. I've also pinned mdx1-csf here, in case the import is moved from the loader to the compiler, as @shilman has suggested doing.  We'll need to adjust this if that happens.",1
Allow the use of @vitejs/plugin-react-swc (#552),0.83998114,Allow the use of @vitejs/plugin-react-swc by @IanVS in link,"Fixes link This will first look for @vitejs/plugin-react, then @vitejs/plugin-react-swc.  It seems like the SWC version might not work with MDX stories, though.  I updated the react-18 example to use it, and the intro story doesn't load.  I don't think that should necessarily block this PR though. Allow the use of @vitejs/plugin-react-swc Use react-plugin-swc in react-18 example Fix NODE_PATH in all examples Fix peer dependencies Fix update-examples script",1
v0.4.0,0.46096253,Support vite 3.1 by @IanVS in link,,0
Update @vitejs/plugin-react dependency for vite 4 (#548),0.8213656,"To fully support Vite 4, we've updated our mdx handling to no longer require the use of @vitejs/plugin-react.  This means that non-react projects will no longer be getting that plugin added to their projects, and react projects will need to make sure they include it as a dependency (changes to viteFinal are not required).","Fixes link This also updates the version of mdx1-csf to one that no longer requires the use of the react vite plugin to compile jsx, it handles compilation itself.  So, we no longer need to include @vitejs/plugin-react in all projects, and react projects will need to make sure it's installed.  That makes this a breaking change. And this also updates Vite to 4 in the examples, and fixes some missing dependencies. Co-authored-by: Josh Wooding 12938082+joshwooding@users.noreply.github.com",1
Add Node limit,0.25612825,Add support for preact by @maxbeatty in link,,0
v0.3.0,0.5409401,Support vite 3.1 by @IanVS in link,,0
Update Readme (#546),0.70375955,Update README by @IanVS in link,,1
Breaking: Update peer dependencies for Vite 4 (#545),0.9135185,Breaking: Update peer dependencies for Vite 4 by @IanVS in link,Breaking: Update peer dependencies for Vite 4 Update react-docgen-typescript plugin Update examples Add update-examples script to install in all examples Update readme,1
v0.2.7,0.46496898,Support vite 3.1 by @IanVS in link,,0
feat: allow definition of stories in vue files (#505),0.9367087,feat: allow definition of stories in vue files by @tobiasdiez in link,feat: allow definition of stories in vue files Update vite-config.ts Update inject-export-order-plugin.ts Update codegen-importfn-script.ts Update code-generator-plugin.ts Update packages/builder-vite/vite-config.ts Co-authored-by: Ian VanSchooten ian.vanschooten@gmail.com Update packages/builder-vite/code-generator-plugin.ts Co-authored-by: Ian VanSchooten ian.vanschooten@gmail.com Update packages/builder-vite/inject-export-order-plugin.ts Co-authored-by: Ian VanSchooten ian.vanschooten@gmail.com Update packages/builder-vite/source-loader-plugin.ts Co-authored-by: Ian VanSchooten ian.vanschooten@gmail.com Update packages/builder-vite/plugins/vue-docgen.ts Co-authored-by: Ian VanSchooten ian.vanschooten@gmail.com Co-authored-by: Ian VanSchooten ian.vanschooten@gmail.com,1
v0.2.6,0.47992063,Support vite 3.1 by @IanVS in link,,0
Pin version of react-docgen (#531),0.91988146,Pin version of react-docgen by @IanVS in link,Pin version of react-docgen Update example yarn.lock files,1
v0.2.5,0.48790807,Support vite 3.1 by @IanVS in link,,0
Fix bail not being defined (#510),0.82645077,Fix bail not being defined by @joshwooding in link,,1
v0.2.4,0.45442942,Support vite 3.1 by @IanVS in link,,0
Re-add typescript check when adding react-docgen-typescript plugin (#509),0.94107556,Re-add typescript check when adding react-docgen-typescript plugin by @joshwooding in link,,1
Fix vue 2.x selection logic (#508),0.84588134,Fix vue 2.x selection logic by @IanVS in link,"Fixes: link This corrects the vue 2.6 / 2.7 logic, and also finds a slightly-better way to handle module resolution from within builder-vite when running examples.  Instead of adding dev dependencies into the builder, this sets a node_path environment variable, so that the node_modules of the example is used as a global lookup from within the builder.",1
v0.2.3,0.49804813,Support vite 3.1 by @IanVS in link,,0
Don't publish yarn cache,0.35686827,Default Cache Directory Conflict Resolution by @GuyGooL5 in link,,0
fix: add missing peer deps (#500),0.79958,fix: add missing peer deps by @adalinesimonian in link,"fix: add missing peer deps fix: add vue-docgen-api peer dep, improve error chore: update yarn.lock Update lockfile of packages Co-authored-by: Ian VanSchooten ian.vanschooten@gmail.com",1
Support vue 2.6 and 2.7 (#503),0.93471324,Support vue 2.6 and 2.7 by @IanVS in link,"This cherry-picks some commits from @heykc's PR link, but puts them on top of link, so that we can have multiple versions of vue examples that don't conflict with each other in the monorepo, which was one of the challenges in the original PR. This also attempts to read the version of vue from the user's package.json, determine whether it's 2.6 or 2.7, and use the appropriate vite plugin, as suggested by @Djaler.",1
Move examples out of workspaces (#502),0.77745503,Move examples out of workspaces by @IanVS in link,"We sometimes have trouble with our examples because of hoisting issues. So, instead of using a monorepo, this PR would turn this repo into a multi-project repo, with no top-level package.json, and instead each example would be stand-alone, and so would packages/builder-vite. I'm not positive this is the way to go, but it did already suss out a few issues with missing dependencies in both the projects as well as the builder-vite itself. One thing that's a bit wonky is that since the builder-vite has a completely different node_modules, it can't use any of the packages that are installed in the example, like preact and the vite preact plugin in the preact example. I added them as dev deps to the builder, which works fine I think. It's a downside, but on the other hand it makes these deps a little bit explicit without bloating the dependencies for users.",1
Support vite 3.1 (#490),0.8614271,Support vite 3.1 by @IanVS in link,"I think we actually can support it just fine now, but our build fails due to a change in the Typescript definitions of rollup hooks.  Here's an example of a failing vite ecosystem-ci build: link So, this updates the examples to vite 3.1.0-beta.1, adds a devDependency on that version for the builder itself, and does a check before calling the react-refresh transform function to make typescript happy.",1
Make sure mocked actions can be identified in production build (#482),0.9142907,Make sure mocked actions can be identified in production build by @bodograumann in link,Enable esbuild keep names as workaround Add interactive test in vue example Fixes #206.,1
Remove pluginutils from dependencies (#470),0.8253306,Remove pluginutils from dependencies by @kazuma1989 in link,because createFilter util is exposed from Vite v3. link,1
v0.2.2,0.46796757,No changes from v0.2.0-beta.1.  Publishing error.,,0
Move appType config to correct spot (#464),0.3603406,Fix exported typescript types for viteFinal,,0
v0.2.1,0.47043318,No changes from v0.2.0-beta.1.  Publishing error.,,0
Remove mock-core-js plugin,0.89865464,Remove mock-core-js plugin by @IanVS in link,,1
Improve react docgen plugin usage,0.8559422,Improve react docgen plugin usage by @IanVS in link,,1
Add @rollup/pluginutils to dependencies (#459),0.865784,Add @rollup/pluginutils to dependencies by @IanVS in link,,1
Bump @joshwooding/vite-plugin-react-docgen-typescript to 0.0.5,0.75996196,Fix react-docgen-typescript in some monorepos by @joshwooding in link,,1
fix: pass options read from config file to svelteDocgen (#449),0.94237936,Fix: pass options read from config file to svelteDocgen by @benmccann in link,Looks like we only passed the options from the config file to csfPlugin and missed svelteDocgen,1
"Set vite appType to ""custom""",0.5734813,Avoid vite starting app instead of storybook: link,,0
Ignore applyDecorators in v6 story store (#443),0.8662139,Ignore applyDecorators in v6 story store by @kvcvc in link,"The applyDecorators is an export from frameworks (and can be overridden in preview.js) but is only used in storyStoreV7 mode. The file being updated here is used for the v6 store, which handles decorators a different way, but still ends up reading the export which falls through to the default warning. We can safely ignore it in the case statement.",1
Cleanup peerDependencies (#445),0.7924966,Cleanup peerDependencies by @benmccann in link,@storybook/source-loader doesn't need to be in peerDependencies because it's already in dependencies @storybook/core-common and @storybook/node-logger can be just regular dependencies instead of peerDependencies since we don't need the user to add them to their package.json ~~@storybook/mdx1-csf doesn't need to be downloaded by all users. Users will use either @storybook/mdx1-csf or @storybook/mdx2-csf so move it to devDependencies so that users won't end up including it automatically~~,1
cleanup dependencies on alphas/betas (#444),0.88553536,Cleanup dependencies on alphas/betas by @benmccann in link,cleanup dependencies on alphas/betas move dependency make vps a dev dep,1
v0.2.0,0.5014888,Support vite 3.1 by @IanVS in link,,0
Update readme with vite version support,0.6921876,This release is necessary to support vite 2.9.0.,,0
Improve sourcemaps (#437),0.7623008,Improve sourcemaps by @ianvs in link,"Turns out we weren't creating good sourcemaps, especially in dev.  It seems that whereas rollup only uses the mappings, I guess that vite/esbuild uses the sources field of the sourcemap as well, and without passing the source option to MagicString's generateMap, we were losing the connection.  So, this adds the id as the source, and also enables hires (high resolution) so that columns are correct and not just lines (useful for code coverage, for example). I also added MagicString to some of our other plugins which weren't using it. The most obvious changes are in the react and svelte projects.  Vue is a bit improved, but we're still losing the story file sourcemaps for some reason. To test, fire up an example project (in dev especially, but good to check prod builds too), look in the sources tab in devtools, and poke around, looking for sourcemapped versions of the files.  You should see them in this branch, but not nearly as many, if any, in main.",1
v0.2.0-beta.2,0.6696076,No changes from v0.2.0-beta.1.  Publishing error.,,0
v0.2.0-beta.1,0.6795203,No changes from v0.2.0-beta.1.  Publishing error.,,0
Load @sveltejs/vite-plugin-svelte conditionally (#434),0.90884626,Load @sveltejs/vite-plugin-svelte conditionally by @IanVS in link,"It was being imported at the top of the file, which means for all frameworks.  Instead, this requires it conditionally only for svelte projects.",1
v0.2.0-beta.0,0.6773331,No changes from v0.2.0-beta.1.  Publishing error.,,0
Support Vite 3 (#394),0.71504515,Support vite 3.1 by @IanVS in link,"This updates the vite builder to support vite 3.0, which is a breaking change due to our use of @vitejs/plugin-react, which also has a new major version to support vite 3. This also updates our examples to the latest vite and vite plugin beta versions.",1
Read svelte.config.js (#428),0.95465666,[breaking] Read svelte.config.js by @benmccann in link,"Partially reverts link The reason given there was that: which may not be what storybook users want / expect, since their production config may be different from the storybook config (same reason we don't automatically merge vite.config.js) However, I think that users would expect their svelte.config.js to be taken into account. E.g. right now the user's preprocessing configuration is ignored. The user can still pass custom svelteOptions in .storybook/main.cjs if they need to override their normal options for some reason (although I can't think of a reason off the top of my head why this would be necessary) You can see a number of people complaining preprocessing doesn't work here: link",1
v0.1.39,0.49426097,"Note: version 0.1.40 accidentally included breaking changes, which are not included in this version.",,0
Handle resolve.alias as an array (#430),0.84649783,Handle resolve.alias as an array by @IanVS in link,"Fixes #425. We weren't being smart enough about merging in the resolve.alias config, which can either be an object or an array.  So, I've used mergeConfig from vite to handle that instead, and added a demonstration in the vue example that fails without this change but works with it. @rlesniak, how's this look to you?",1
Add .storybook to server.fs.allow (#427),0.86735314,Add .storybook to server.fs.allow by @benmccann in link,"Avoids errors when a user has configured a server.fs.allow already, such as when using sveltekit.",1
Fix markdown import in mdx (#429),0.8960134,Fix markdown import in mdx by @joshwooding in link,,1
v0.1.38,0.5122704,"Note: version 0.1.40 accidentally included breaking changes, which are not included in this version.",,0
Support MDXv2 (#377),0.9085746,Support MDXv2 by @joshwooding in link,"Fixes link  Fixes link Fixes link To enable experimental MDX2 in a project, follow this guide: link Support MDXv2 Fix formatting Remove explicit mdx-js/preact from example Remove workarounds from readme Add @storybook/mdx2-csf to examples using it Co-authored-by: Ian VanSchooten ian.vanschooten@gmail.com",1
Allow setting global args in SB 6.5+ (#399),0.885652,Allow setting global args in SB 6.5+ by @IanVS in link,,1
Simplify CI job to publish overview,0.33066285,Test built storybooks in CI by @IanVS in link,,0
Add some description to overview introduction,0.42174202,"Add composed ""overview"" example that builds/includes all framework examples by @dohooo in link",,0
"Add composed ""overview"" example that builds/includes all framework examples (#404)",0.8561212,"Add composed ""overview"" example that builds/includes all framework examples by @dohooo in link","This adds an example project (overview) which composes the framework examples together into a single storybook, which not only provides a demonstration of how this composition can be accomplished in a nice clean way using link, but also will allow us to use chromatic snapshots against all example storybooks at once. It will currently publish this composed storybook to github pages, under the /builder-vite path. It's being set up to only deploy to gh-pages on pushes to main.  Next we can set up chromatic to publish them there.",1
Fix react mdx stories (#417),0.8153177,Fix react mdx stories by @IanVS in link,"This fixes an issue where as long as preact is installed in the monorepo, vite-plugin-mdx will default to using it, even in react projects, causing an error in mdx stories. This uses the framework option, and only uses the preact mdx if the framework is preact, otherwise falling back to react.  This was enabled by link. I also added an mdx story in the preact example, but the styling is wrong.  @maxbeatty do you know why that might be?  Does storybook's emotion need to be configured to work with preact, maybe? To test, verify that the introduction story is working in the react example as well as the preact example, and maybe vue too, for good measure.",1
add support for preact (#408),0.49795115,Add support for preact by @maxbeatty in link,"Fixes #385 by adding support for preact, along with an example project. run yarn example:preact to verify add support for preact add preact example build: include mdx for preact example style: allow long svg path test: unique ports for each example chore(deps): upgrade storybook to 6.5.9 refactor: simpler config test: test-storybook needs unique url",0
Use an alias for react-dom/client if not installed (#410),0.8754091,Use an alias for react-dom/client if not installed by @IanVS in link,"This implements a suggestion in link to alias react-dom/client to our placeholder file when the dependency is not found. In vite 3.0, our current approach will no longer work, and we'll need to use this method instead.",1
Avoid cd in scripts,0.8206727,Avoid cd in scripts by @IanVS in link,,1
Add webpack/cra migration section to readme (#405),0.90167236,Add webpack/cra migration section to readme by @IanVS in link,"This adds a bit of help for users who are coming from a webpack or create react app project. There are a few gotchas and sneaky things that are needed, which we should work to smooth out, but for now teaching users how to migrate seems like it might be useful.",1
v0.1.36,0.4969862,"Note: version 0.1.40 accidentally included breaking changes, which are not included in this version.",,0
"fix: prevent crashing on ""--smoke-test"" (#400)",0.9223021,"fix: prevent crashing on ""--smoke-test"" by @AriPerkkio in link",Fixes #397. Storybook expects stats to match Stats interface of webpack: link. This type-mismatch is caused by @storybook/core-common's Builder and will be fixed by link. Pass null as optional Stats instead of incorrect structure,1
Svelte: Generate docgen (#392),0.80031586,Svelte: Generate docgen by @j3rem1e in link,,1
Disable telemetry in examples (#393),0.8340075,Disable telemetry in examples by @IanVS in link,,1
Update Storybook to 6.5.0 in examples (#386),0.93033636,Update Storybook to 6.5.0 in examples by @joshwooding in link,,1
v0.1.35,0.48439518,"Note: version 0.1.40 accidentally included breaking changes, which are not included in this version.",,0
Do not require @storybook/addon-svelte-csf (#388),0.8940724,Do not require @storybook/addon-svelte-csf to be installed by @IanVS in link,"Starting in Storybook 6.5, @storybook/addon-svelte-csf is not installed by default in Svelte projects.  Instead, it's encouraged to use CSF for stories. But, the vite builder expects that it's always there, and would throw an error if it's not installed.  This allows it to be missing. It also fixes the logic for our other catch statements, which weren't working because the boolean logic was reversed.  🤦.",1
v0.1.34,0.4987077,"Note: version 0.1.40 accidentally included breaking changes, which are not included in this version.",,0
Handle new versions of vite-plugin-svelte (#382),0.8887276,Handle new versions of vite-plugin-svelte by @IanVS in link,"Fixes link There have been two changes in @sveltejs/vite-plugin-svelte that cause problems for us, which this PR addresses: link started to merge the svelte.config.js file by default, which may not be what storybook users want / expect, since their production config may be different from the storybook config (same reason we don't automatically merge vite.config.js).  With the changes here, the configFile option in svelteOptions can still be set to true or to a specific file, if desired. link began returning an array of plugins rather than just a single one.  This would normally be fine, except that we hack around with the plugin to create two separate ones, with different names, to avoid HMR in story files.  So, this PR checks to see if the result is an array or not, and reacts accordingly.  Note, I'm throwing away the inspector for story files.  This might be a problem, but until we hear about it, I think this'll be fine.  The inspector is still pretty experimental anyway, from what I can tell. To test, you can revert the changes I've made in vite-config.ts, and you'll see that the svelte example breaks (I updated the svelte plugin in it).  With the changes, it builds successfully. This also enables the use of the new experimental inspection plugin. To enable this feature, be sure you have @sveltejs/vite-plugin-svelte version 1.0.0-next.43 or higher, then add the following to your svelteOptions in .storybook/main.js: js module.exports = {   // ... rest of config   framework: '@storybook/svelte',   svelteOptions: {     preprocess: preprocess(),     experimental: { inspector: true }, // <-- this line   }, }; Then, when the storybook opens, focus a story iframe and press cmd+shift (mac) or ctrl+shift (windows) to activate.",1
Fix new stories not appearing in the importFn,0.89225304,Fix new stories not appearing in the importFn by @joshwooding in link,,1
Use globalThis instead of global dependency (#383),0.8550004,Use globalThis instead of global dependency by @IanVS in link,,1
Fix order of MDX stories in sidebar,0.90211433,Fix order of MDX stories in sidebar by @joshwooding in link,,1
Disable HMR for web-components projects (#372),0.90681297,Disable HMR for web-components projects by @IanVS in link,"Fixes #370. When using storyStoreV7, we configure HMR to swap out the importFn when stories change.  However, this breaks web-components projects (see link). So, instead, this change checks if the framework is web-components and if so, refreshes the page instead of performing an HMR.  It's still pretty quick, and not a full page reload. You can test this out by starting up our lit-ts example (which I've configured to use storyStoreV7 now), open the story, and save the component or story file.  It shouldn't blow up anymore. One bummer is that MDX files also no longer HMR, though technically they could.  But I can't find a way to detect which part of the importFn changed, in order to determine whether to HMR or not, and it's safer to just avoid it for all stories when using web-components.",1
Fix tests not being found when testing lit-ts example on windows CI,0.9755244,Fix tests not being found when testing lit-ts example on Windows CI by @joshwooding in link,,1
Bump @storybook/test-runner in react-18 example,0.94226277,Bump @storybook/test-runner in react-18 example by @joshwooding in link,,1
v0.1.33,0.49376297,"Note: version 0.1.40 accidentally included breaking changes, which are not included in this version.",,0
Fix svelte story files not reloading (#362),0.9040353,Fix svelte story files not reloading by @IanVS in link,"Fixes link Svelte story files have the same issue as react story files.  The webpack HMR seems to prevent vite's HMR from working correctly, so we need to exclude story files as HMR boundaries in vite.  The svelte plugin doesn't expose as nice of a way to do this, but thanks to a suggestion from @domyen in link, I was able to make it work. To test: Start up the svelte example, edit a .stories.svelte file, and confirm that the page reloads and shows your changes.",1
Prevent vite:define from replacing in story source (#364),0.83616793,Prevent vite:define from replacing in story source by @IanVS in link,"This fixes an issue where the vite:define plugin replaced environment variables inside the injected story source from @storybook/source-loader, which is supposed to be a string.  But when vite does the replacement, it adds its own quotes, which breaks the string. For a simplified example, storybook might generate something like this: js var STORY = ""console.log(import.meta.env.VITE_VAR);"" But then vite:define turns it into: js var STORY = ""console.log(""env variable value"");"" Here's a reproduction from the user who originally reported this issue: link To test, I modified our environment variable stories.  In the process, I used some zero-width spaces to make the headings look a bit better, as suggested in link. I also decided to use ts-node instead of adding a babel config for the react-ts project.  At least until we figure out exactly how that .babelrc works.   Add dynamic env var to story examples Fix react-ts example Prevent vite:define from replacing in story source Clean up some types",1
Warn in console when storyStoreV7 used with .svelte files (#363),0.95467454,Warn in console when storyStoreV7 used with .svelte files by @IanVS in link,"This makes it a bit more obvious that something is wrong when using storyStoreV7 with .svelte files (ref link), and gives an indication of how to fix the issue: This also fixes link by expanding the range for the @storybook/core-common peer dependency to avoid installing an older version when the user is using a 6.5 pre-release.",1
Run CI on pushes to main,0.2784229,Test built storybooks in CI by @IanVS in link,,0
Add babelrc to process main.ts file,0.37927893,Fix svelte-preprocess typescript support by @bfanger in link,link,0
v0.1.32,0.4495235,"Note: version 0.1.40 accidentally included breaking changes, which are not included in this version.",,0
Use correct Options type for viteFinal,0.6050963,Fix exported typescript types for viteFinal,,0
v0.1.31,0.47115618,"Note: version 0.1.40 accidentally included breaking changes, which are not included in this version.",,0
